,job_id,job_title,location,experience,education,job_type,job_description,job_link
2,4e508bc18be17969,Business Analyst,"Los Angeles, CA",MID_LEVEL,MASTERS_DEGREE,FULLTIME,"Business Systems Analyst - job post Geopaq Logic Los Angeles, CA 90001 $55 - $60 an hour -  Full-time Apply now Apply now save-icon Job details Salary $55 - $60 an hour Job Type Full-time Software Business Systems Analyst Duration: 12+ month + extension Location: San Bernardino, California – Onsite- Hybrid Visa: GC, USC, EAD, H1-B Seeking an experienced Software Business Systems Analyst (BSA) to work for us supporting our San Bernardino County government client. The BSA position is responsible for analyzing business processes, determining requirements and utilizing best practices to determine how to implement those requirements. The position will require a thorough understanding of the Software Development Life Cycle and Agile Software Development for the practical application of business analysis and application development methodologies. Expected to be a 12 month position, open to US citizens, green card and H1-B holders. For the first 2 months, it will be full-time on-site in San Bernardino with possibility of a hybrid schedule thereafter. General Responsibilities Strong ability to gather business requirements and develop functional/technical specifications. Strong ability to coordinate project efforts with degrees of complexity, deadlines, goals, etc. Strong ability to communicate with executive management, supervisors, and colleagues. Strong collaboration skills and the ability to work effectively in a team environment. Strong understanding of the full end-to-end business processes. Strong ability to problem-solve, design, and implement solutions. Solid project management and leadership skills. Ability to create detailed project documents including but not limited to a Charter, Business Requirements, Recommendation Reports, etc. Ability to interact with end users, developers and act in a lead capacity for other technical staff. Hands-on experience solving technical issues. Knowledge of business analysis tools and methodologies. Specific Skills and Qualifications Exceptional organizational, documentation, written and verbal communication skills. Experience with drafting use case scenarios, and test cases. Experience with charting and charting tools for the creation of swim lanes diagrams, process flow diagrams, data flow diagrams, etc. Experience with custom software development processes. Experience with procurement processes and related documents. User training and user acceptance testing experience. Proficient understanding of Agile tools, Azure Boards, and Microsoft TFS. Experience with Power BI and reporting dashboard tools. Experience and Education: Bachelor’s degree in information management, Computer Science, Business/Public Administration or any closely related field. At least 3 years’ experience performing business systems analysis, preferably with at least one year lead role experience in managing IT related projects. An equivalent combination of experience, education and training will be considered. Job Type: Full-time Salary: $55.00 - $60.00 per hour Benefits: 401(k) matching Employee discount Health insurance Health savings account Life insurance Relocation assistance Retirement plan Schedule: 8 hour shift Ability to commute/relocate: Los Angeles, CA 90001: Reliably commute or planning to relocate before starting work (Required) Work Location: One location Health insurance If you require alternative methods of application or screening, you must approach the employer directly to request this as Indeed is not responsible for the employer's application process.",https://www.indeed.com/jobs?q=Business+Analyst&l=Los+Angeles%2C+CA&sc=0kf%3Aattr%28EXSNN%7CFCGTU%7CHFDVW%7CQJZM9%7CUTPWG%252COR%29explvl%28MID_LEVEL%29jt%28fulltime%29%3B&start=20&pp=gQAeAAAAAAAAAAAAAAAB_mTAHQAlAQEBCATlG4E_tgDm5vlb82BNFcxhbPFeGJGHyGD1P2dXqMXrVAAA&vjk=4e508bc18be17969
3,50067fd09c031427,Business Analyst,"Los Angeles, CA",MID_LEVEL,MASTERS_DEGREE,FULLTIME,"Operations Systems Analyst - job post Feit Electric Los Angeles, CA $100,000 - $110,000 a year -  Full-time Apply now Apply now save-icon Job details Salary $100,000 - $110,000 a year Job Type Full-time Candidates for this position ideally will have a minimum of two years working as a WMS Analyst in an Information Technology or Operations role in a warehousing environment and: · Be able to troubleshoot errors in the system, come up with solutions and work around the floor · Experience in inventory control, cycle counting, bin verification and adjustment · Have experience with training and leading a team through system upgrades on the warehouse floor. Maintain all aspects of WMS configuration and functionality Ideal candidates will also: · Be able to stand or walk for long periods of time · Have good oral, written and verbal communication skills · Be organized, systematic and a fanatic driver on processes and procedures · Have solid work ethic Have SSRS Reporting experience Knowledge of transactional SQL · Be able to wear many hats and work on multiple projects at once · Bachelors in computer science or related field (Preferred) Have WMS experience – Manhattan ILS or SCALE (Preferred) Other duties may be assigned Job Type: Full-time Pay: $100,000.00 - $110,000.00 per year Benefits: 401(k) Dental insurance Employee assistance program Employee discount Flexible schedule Health insurance Life insurance Paid time off Vision insurance Schedule: 8 hour shift Monday to Friday Education: Bachelor's (Preferred) Experience: WMS Systems (Manhattan SCALE Preferred): 2 years (Preferred) Work Location: Multiple Locations Health insurance If you require alternative methods of application or screening, you must approach the employer directly to request this as Indeed is not responsible for the employer's application process.",https://www.indeed.com/jobs?q=Business+Analyst&l=Los+Angeles%2C+CA&sc=0kf%3Aattr%28EXSNN%7CFCGTU%7CHFDVW%7CQJZM9%7CUTPWG%252COR%29explvl%28MID_LEVEL%29jt%28fulltime%29%3B&start=20&pp=gQAeAAAAAAAAAAAAAAAB_mTAHQAlAQEBCATlG4E_tgDm5vlb82BNFcxhbPFeGJGHyGD1P2dXqMXrVAAA&vjk=50067fd09c031427&advn=1657051130582945
4,68c5c1532cb7ca8a,Business Analyst,"Los Angeles, CA",MID_LEVEL,MASTERS_DEGREE,FULLTIME,"Business Information Analyst II - job post Elevance Health 5,931 reviews Woodland Hills, CA • Remote Full-time You must create an Indeed account before continuing to the company website to apply Apply on company site save-icon Job details Job Type Full-time Job Family: Data Warehousing and Business Information Type: Full time Date Posted: Jan 09, 2023 Req #: JR43013 Description Title: Business Information Analyst II Location: Remote within CA Hours: Standard hours Build the possibilities. Make an extraordinary impact: Responsible for analyzing, reporting and developing recommendations on data related to multiple, varied business metrics. How you will make an impact: Creates and maintains databases to track business performance. Analyzes data and summarizes performance using summary statistical procedures. Develops and analyzes business performance reports (e.g. for claims data, provider data, utilization data) and provides notations of performance deviations and anomalies. Creates and publishes periodic reports, makes necessary recommendations, and develops ad hoc reports as needed. May require taking business issue and devising best way to develop appropriate diagnostic and/or tracking data that will translate business requirements into usable decision support tools. Minimum Requirements: Requires a BS/BA degree in related field and a minimum of 2 years related operational and/or data analysis experience, experience in database structures, and standard query and reporting tools; or any combination of education and experience which would provide an equivalent background. Preferred Skills, Capabilities and Experience: Strong experience with Long Term Care Services, CA Medicaid, and social determinants of health is preferred. Strong experience with SQL is highly preferred. Experience with Tableau and Power BI is highly preferred. Strong experience with MS Suite, particularly Excel, is highly preferred. Familiarity with the IT Development Life Cycle is preferred. If this job is assigned to any Government Business Division entity, the applicant and incumbent fall under a 'sensitive' work designation and may be subject to additional requirements beyond those associates outside Government Business Divisions. Requirements include but are not limited to more stringent and frequent background checks and/or government clearances, segregation of duties principles, role specific training, monitoring of daily job functions, and sensitive data handling instructions. Associates in these jobs must follow the specific policies, procedures, guidelines, etc. as stated by the Government Business Division in which they are employed. For candidates working in person or remotely in the below locations, the salary* range for this specific position is $58,960 to $106,128 Locations: California In addition to your salary, Elevance Health offers benefits such as, a comprehensive benefits package, incentive and recognition programs, equity stock purchase and 401k contribution (all benefits are subject to eligibility requirements). The salary offered for this specific position is based on a number of legitimate, non-discriminatory factors set by the company. The company is fully committed to ensuring equal pay opportunities for equal work regardless of gender, race, or any other category protected by federal, state, and local pay equity laws. The salary range is the range Elevance Health in good faith believes is the range of possible compensation for this role at the time of this posting. This range may be modified in the future and actual compensation may vary from posting based on geographic location, work experience, education and/or skill level. Even within the range, the actual compensation will vary depending on the above factors as well as market/business considerations. No amount is considered to be wages or compensation until such amount is earned, vested, and determinable under the terms and conditions of the applicable policies and plans. The amount and availability of any bonus, commission, benefits, or any other form of compensation and benefits that are allocable to a particular employee remains in the Company's sole discretion unless and until paid and may be modified at the Company’s sole discretion, consistent with the law. Please be advised that Elevance Health only accepts resumes from agencies that have a signed agreement with Elevance Health. Accordingly, Elevance Health is not obligated to pay referral fees to any agency that is not a party to an agreement with Elevance Health. Thus, any unsolicited resumes, including those submitted to hiring managers, are deemed to be the property of Elevance Health. Be part of an Extraordinary Team Elevance Health is a health company dedicated to improving lives and communities – and making healthcare simpler. A Fortune 20 company with a longstanding history in the healthcare industry, we are looking for leaders at all levels of the organization who are passionate about making an impact on our members and the communities we serve. You will thrive in a complex and collaborative environment where you take action and ownership to solve problems and lead change. Do you want to be part of a larger purpose and an evolving, high-performance culture that empowers you to make an impact? We offer a range of market-competitive total rewards that include merit increases, paid holidays, Paid Time Off, and incentive bonus programs (unless covered by a collective bargaining agreement), medical, dental, vision, short and long term disability benefits, 401(k) +match, stock purchase plan, life insurance, wellness programs and financial education resources, to name a few. The health of our associates and communities is a top priority for Elevance Health. We require all new candidates in certain patient/member-facing roles to become vaccinated against COVID-19. If you are not vaccinated, your offer will be rescinded unless you provide – and Elevance Health approves – a valid religious or medical explanation as to why you are not able to get vaccinated that Elevance Health is able to reasonably accommodate. Elevance Health will also follow all relevant federal, state and local laws. Elevance Health has been named as a Fortune Great Place To Work in 2022, has been ranked for five years running as one of the 2023 World’s Most Admired Companies by Fortune magazine, and is a growing Top 20 Fortune 500 Company. To learn more about our company and apply, please visit us at careers.ElevanceHealth.com. Elevance Health is an Equal Employment Opportunity employer and all qualified applicants will receive consideration for employment without regard to age, citizenship status, color, creed, disability, ethnicity, genetic information, gender (including gender identity and gender expression), marital status, national origin, race, religion, sex, sexual orientation, veteran status or any other status or condition protected by applicable federal, state, or local laws. Applicants who require accommodation to participate in the job application process may contact ability@icareerhelp.com for assistance.",https://www.indeed.com/jobs?q=Business+Analyst&l=Los+Angeles%2C+CA&sc=0kf%3Aattr%28EXSNN%7CFCGTU%7CHFDVW%7CQJZM9%7CUTPWG%252COR%29explvl%28MID_LEVEL%29jt%28fulltime%29%3B&start=20&pp=gQAeAAAAAAAAAAAAAAAB_mTAHQAlAQEBCATlG4E_tgDm5vlb82BNFcxhbPFeGJGHyGD1P2dXqMXrVAAA&vjk=68c5c1532cb7ca8a
5,3528c425826b63b0,Business Analyst,"Los Angeles, CA",MID_LEVEL,MASTERS_DEGREE,FULLTIME,"Customer Data Lab Business Analyst - job post American Honda Motor Co (part of Honda) 1,533 reviews Torrance, CA 90501 $54,400 - $81,500 a year -  Full-time You must create an Indeed account before continuing to the company website to apply Apply on company site save-icon Job details Salary $54,400 - $81,500 a year Job Type Full-time Customer Data Lab Business Analyst Location: Torrance, CA Workstyle: Remote What Makes a Honda, is Who makes a Honda Honda has a clear vision for the future, and it’s a joyful one. We are looking for individuals with the skills, courage, persistence, and dreams that will help us reach our future-focused goals. At our core is innovation. Honda is constantly innovating and developing solutions to drive our business with record success. We strive to be a company which serves as a source of “power” that supports people around the world who are trying to do things based on their own initiative and that helps people expand their own potential. To this end, Honda strives to realize “the joy and freedom of mobility” by developing new technologies and an innovative approach to achieve a “zero environmental footprint.” We are looking for qualified individuals with diverse backgrounds, experiences, continuous improvement values, and a strong work ethic to join our team. If your goals and values align with Honda’s, we want you to join our team to Bring the Future! About this Position: In this role, you will support enabling strategic outcomes agreed upon by Executive Leadership as requirements for HONDA business transformation, including: Create customer promoters through increased customer knowledge that enables personalization and 1:1 communications Reducing marketing and operational cost through increased efficiency Enabling better decision making for each customer at each stage of the customer journey Responsibilities include: Manage and maintain Data Privacy and Governance request (delete me, do not contact, etc.) and process Prepare for and facilitate CDL & BU Working Sessions: prioritize topics, drive discussion, surface timely topics and ensure delivery timelines are met Support CDL leadership team to develop and create internal communications to support CDL Product Release and build enterprise awareness. Support and facilitate PO process, track PO spend, conduct quarterly reconciliation Gather annual budget requests, prepare for readout to CDL leadership Prepare documents for budget and business planning Provision access to CDL internal and external team members – maintaining setup/ and deactivation process. Provision SharePoint and MS Team (s) access. Provide support with the Communication Reporting Dashboard Onboard new associates, contingent workers, and contractors. Ensure CDL artifacts are current (CDL playbook, onboarding material, etc.) Who we are seeking: Required Work Experience: 2-5+ years in a customer-centric position, project support/delivery, or enterprise strategy development Auto or electrification experience a plus Project management/agile a plus Required Education: Bachelor’s degree preferred Desired skills: Highly versatile able to work in extremely fast-paced, frequently ambiguous work environment; ability to self-manage Excellent communication skills and create supporting materials (including PowerPoint slides, illustrations, etc.) Excellent customer service and problem-solving skills. Curious, questioning skills to gain understanding and build support Adaptable with proven track record of growing responsibilities Able to coordinate multiple initiatives simultaneously Strong organizational skills Self-motivated with strong organizational and project coordination skills Ability to communicate effectively with internal and external customers as well as non-technical and technical personnel Strong verbal and written communication skills Skilled at questioning, using evidence to persuade Ability to manage complex initiatives with multiple elements and stakeholders Ability to present complex positions and strategies for business decisions, processes, and plans Ability to work effectively with AHM staff, IT staff, 3rd party vendor staff Ability to interact with other Honda company's personnel, builds strong relationships at all levels and across all business units and organizations, and understands business imperatives Additional Position Factors: Workstyle: Remote Travel: 10% At Honda, you will play a key role in our journey to become a company that society wants to exist now, and in the future. Your endless curiosity will drive innovation and your courageous spirit will challenge the status quo. We believe having a workforce made up of diverse thinkers and innovators makes us a better Honda. Respect for each other and respect for diversity each and every day drives our associates to contribute at the highest level and work effectively in a team environment. We make the dream of mobility a reality with our innovative and high-quality products. Together, we Bring the Future to our customers, associates, and communities. We are Honda! What differentiates Honda and make us an employer of choice? Total Rewards: Competitive Base Salary: $54,400 - $81,500 Pay will be based on several variables that include, but not limited to, geographic location, work experience, education, etc. Annual Bonus Overtime Industry leading Benefit Plans (Medical, Dental, Vision, Rx) Paid time off, including vacation, paid holidays, sick time, personal days 401K Plan with company match + additional contribution Career Growth: Advancement opportunities Career mobility Education reimbursement for continued learning Training and Development programs Additional Offerings: Wellbeing program Community service and engagement programs Product programs Free drinks onsite Honda is an equal opportunity employer and considers qualified applicants for employment without regard to race, color, creed, religion, national origin, sex, sexual orientation, gender identity and expression, age, disability, veteran status, or any other protected factor.",https://www.indeed.com/jobs?q=Business+Analyst&l=Los+Angeles%2C+CA&sc=0kf%3Aattr%28EXSNN%7CFCGTU%7CHFDVW%7CQJZM9%7CUTPWG%252COR%29explvl%28MID_LEVEL%29jt%28fulltime%29%3B&start=20&pp=gQAeAAAAAAAAAAAAAAAB_mTAHQAlAQEBCATlG4E_tgDm5vlb82BNFcxhbPFeGJGHyGD1P2dXqMXrVAAA&vjk=3528c425826b63b0
6,e13aeac8b4e8786a,Business Analyst,"Los Angeles, CA",MID_LEVEL,MASTERS_DEGREE,FULLTIME,"Business Intelligence Manager - job post USC Credit Union Los Angeles, CA 90007 $120,000 - $150,000 a year -  Full-time Apply now Apply now save-icon Job details Salary $120,000 - $150,000 a year Job Type Full-time USC Credit Union is looking for a skilled Business Intelligence (BI) Manager to enhance our data analytics and reporting, with the primary goal of giving our organization's leaders the key information they need to help them make informed, strategic business decisions. The BI Manager will source and analyze data, perform assessments and risk analysis to identify problems with current company processes, and support in decision making. The BI Manager will collaborate with management to increase efficiency and improve both member and employee experiences. Responsibilities include, but are not limited to: Builds underlying business intelligence infrastructure where necessary, including architecture of databases, visual style guides, and creation of new extract-transform-load processes. Produces data collection methods (e.g., surveys, tests, etc.), and develops tools and processes to support analyses. Generates summary and specified dashboard accounts which represent operational data in brief and intelligible format, suitable for the target audience, such as executive leadership, department managers and supervisors and other analysts. Provides business data trend information to support recommendations for action. Collaborates with management on matters of best practices, appropriate statistical measures and benchmarking. Provides management with suggestions, as appropriate. Carries out quality assessment of data, data reports and the accompanying decisions. Conducts analysis of findings and offers action-driven recommendations and insights to executive leaders and managers on the basis of results. Provides recommendations for decisions affecting business operations and strategic initiatives. Trains non-technical stakeholders on use of reporting tools and concepts. Devises policies and methods to be used for data governance standards, both for internal data and vendor relationships. May lead staff or student workers, as assigned. Minimum Field of Expertise: Bachelor's degree in business, statistics, or another related field. Three years of experience in analytics with some supervisory duties. Direct knowledge and experience in data modeling, data warehousing and reporting. Project management experience for complex projects. Demonstrated organizational, critical thinking, interpersonal, planning, problem solving, and business analytical skills. Able to work at a high functional and technical level. Knowledge of SQL & Power BI. Compensation: The annual base salary range for this position is $120,000 - $150,000. When extending an offer of employment, the University of Southern California considers factors such as (but not limited to) the scope and responsibilities of the position, the candidate's work experience, education/training, key skills, internal peer equity, federal, state, and local laws, contractual stipulations, grant funding, as well as external market and organizational considerations. Why USC Credit Union is a great place to work: Medical through USC Network, Blue Cross, and Kaiser: https://employees.usc.edu/medical/ Dental: https://employees.usc.edu/dental/ Vision: https://employees.usc.edu/vision/ Dependent Care and Health Care Flexible Spending Accounts (FSAs): https://employees.usc.edu/fsas/ Retirement with up to 10% employer contributions: https://employees.usc.edu/usc-retirement-savings-program/ Tuition reimbursement: https://employees.usc.edu/tuition-benefits/ Paid Time Off (PTO) including, up to 24 vacation days (based on tenure), 12 sick days, 9 paid holidays, 1 paid personal day, 4 paid winter recess days, paid bereavement, and paid jury duty: https://employees.usc.edu/time-off/ Life and voluntary insurance benefits: https://employees.usc.edu/insurance-benefits/ WorkWell Center that provides programs, resources, and services to benefits-eligible staff and their dependents, that help them thrive in all areas of work-life wellness: https://workwell.usc.edu/ Other generous perks and discounts: https://employees.usc.edu/perks/ Job Type: Full-time Pay: $120,000.00 - $150,000.00 per year Benefits: 401(k) 401(k) matching Dental insurance Flexible schedule Flexible spending account Health insurance Life insurance Paid time off Retirement plan Tuition reimbursement Vision insurance Schedule: 8 hour shift Ability to commute/relocate: Los Angeles, CA 90089: Reliably commute or planning to relocate before starting work (Required) Education: Bachelor's (Preferred) Work Location: In person Health insurance If you require alternative methods of application or screening, you must approach the employer directly to request this as Indeed is not responsible for the employer's application process.",https://www.indeed.com/jobs?q=Business+Analyst&l=Los+Angeles%2C+CA&sc=0kf%3Aattr%28EXSNN%7CFCGTU%7CHFDVW%7CQJZM9%7CUTPWG%252COR%29explvl%28MID_LEVEL%29jt%28fulltime%29%3B&start=20&pp=gQAeAAAAAAAAAAAAAAAB_mTAHQAlAQEBCATlG4E_tgDm5vlb82BNFcxhbPFeGJGHyGD1P2dXqMXrVAAA&vjk=e13aeac8b4e8786a
