,job_id,job_title,location,experience,education,job_type,job_description,job_link
0,6e49202f32b0f6ee,Business Analyst,"Los Angeles, CA",MID_LEVEL,MASTERS_DEGREE,FULLTIME,"Technology Business Analyst - Cannabis Industry - job post IGS Solutions LLC 18 reviews Los Angeles, CA 90058 • Hybrid remote $95,000 a year -  Full-time Apply now Apply now save-icon Job details Salary $95,000 a year Job Type Full-time Job Duties and Responsibilities: We are looking to hire a Business Analyst to join our Technology Enablement team. You will be a member of a team that is responsible for building, enhancing, and maintaining the platforms and applications of the STIIIZY technology stack. We’re looking for someone who is a problem-solver, an analyzer, has strong technical prowess, is very detail-oriented, and has a strong curiosity to learn how software works “under the hood”. What you will do in this role: Act as a liaison between business and technical development teams Elicit and document requirements from internal and external stakeholders Translate business processes and requests into written technical specifications Write user stories and product defect reports using standard processes and guidelines Create technical diagrams, process maps, workflows, and wireframes Ensure that technical teams have a very clear understanding of the functional and non-functional requirements Create and modify SQL queries to conduct data analysis and validate functionality Develop acceptance criteria and perform primary testing of changes Communicate with project managers as development progresses Maintain internal technical product documentation Desired Skills and Experience: Familiarity with an agile software delivery and product delivery lifecycles Understanding of connections between front-end user interface and backend technical processes Excellent written and verbal communication skills Writing clear and concise user stories and requirements for complex systems Able to communicate effectively with technical and non-technical audiences at all levels of an organization Writing queries in SQL or similar relational database query language Analytically minded and possess strong critical thinking and problem-solving skills Able to identify tasks and manage a multi-streamed workload independently Competency working with Teams, Excel and other Microsoft Office365 products Competency working with Confluence, JIRA, and Atlassian products At least 2 years prior experience in an analyst or similar role preferred Must Haves: Go-getter Lack of standardization, dig in and get going Willing to work with ambiguity Flexible Works with high-level executives Senior Level Take ownership Be very engaged and invested Technical background We provide equal employment opportunities to all employees and applicants for employment and prohibit discrimination and harassment of any type without regard to race, color, religion, age, sex, national origin, disability status, genetics, protected veteran status, sexual orientation, gender identity or expression, or any other characteristic protected by federal, state, or local laws. This policy applies to all terms and conditions of employment, including recruiting, hiring, placement, promotion, termination, layoff, recall, transfer, leaves of absence, compensation, and training. Job Type: Full-time Pay: $95,000.00 per year Benefits: 401(k) matching Dental insurance Health insurance Life insurance Vision insurance Experience level: 2 years 3 years Schedule: 8 hour shift Monday to Friday Application Question(s): How many years of experience do you have in a similar role? Are you comfortable with a Hybrid role that would require you to travel to Los Angeles 2-3 days a week? Education: Bachelor's (Preferred) Experience: Confluence, JIRA, and Atlassian products: 2 years (Preferred) Work Location: Hybrid remote in Los Angeles, CA 90058 Health insurance If you require alternative methods of application or screening, you must approach the employer directly to request this as Indeed is not responsible for the employer's application process.",https://www.indeed.com/jobs?q=Business+Analyst&l=Los+Angeles%2C+CA&sc=0kf%3Aattr%28EXSNN%7CFCGTU%7CHFDVW%7CQJZM9%7CUTPWG%252COR%29explvl%28MID_LEVEL%29jt%28fulltime%29%3B&vjk=6e49202f32b0f6ee&advn=183365483118057
1,d0e9bea6a39fdb95,Business Analyst,"Los Angeles, CA",MID_LEVEL,MASTERS_DEGREE,FULLTIME,"Business Analyst - Cannabis Industry - job post IGS Solutions LLC 18 reviews Los Angeles, CA 90058 $75,000 - $85,000 a year -  Full-time Apply now Apply now save-icon Job details Salary $75,000 - $85,000 a year Job Type Full-time COMPANY: We are setting the industry standard to influence and inspire through our innovative methods. We merge together cannabis culture with cutting-edge technology to deliver the best possible customer and employee experience(s). The company operates a fully integrated cannabis business with a footprint that covers the entire breadth of the state of California; the world's largest cannabis market. We control our supply chain from cultivation to retail, which enables us to deliver clean and tested cannabis products at unmatched prices. Our mission is to provide the one-stop-shop cannabis experience by offering exceptional customer experience service and diversified products. We strive to build long-term customer loyalty. POSITION: We are looking for a passionate and experienced Business Analyst. The successful candidate will transform data into information, information into insight, and insight into key business decisions. The Business Analyst is responsible for serving as the liaison between the business and IT in translating complex business needs into solutions backed by data and analysis or software. A detail-oriented individual, with strong technical and communication skills is desired for this position. Responsibilities: Consults with business stakeholders to understand business needs/challenges and deliver actionable solutions driven by analytical insights Build, develop, and maintain data models, reporting systems, data automation systems, dashboards and performance metrics that support key business decisions Responsible for assessing existing reporting and analytical processes to invent and simplify mechanisms of automation tools Identify, analyze, and interpret trends or patterns in complex data sets (structured and unstructured) Support various departments as well as cross-functional teams across the company in reaching their goals through analysis, insights, and automation Maintain, improve, clean, and manipulate data using extract, transform and load (ETL) processes. Requirements: Bachelor's or Master's degree in Business Administration, Computer Science, Information Systems, a related field or equivalent work experience 3+ years of business analysis experience Strong knowledge and experience of SQL programming preferably with databases such as PostgreSQL, MySQL, and MSSQL Strong knowledge and experience creating beautiful and meaningful visual dashboards with PowerBI, Tableau, Quicksight, etc.. Familiarity with at least one programming language: Python, Javascript, etc.. Experience with ERP systems is a plus Strong written and verbal communication skills to effectively relate data and findings to stakeholders Excellent critical thinking skills to help solve business problems and make confident decisions Physical Demands: The physical demands described here are representative of those that must be met by an associate to successfully perform the essential functions of this job. Reasonable accommodations may be made to enable individuals with disabilities to perform the essential functions. Prolonged periods of sitting at a desk and working on a computer. Must be able to lift 20 pounds Using hand dexterity Must be able to access and navigate each department at the organization’s facilities Due to Covid-19, we are doing everything we can to keep our team and customers safe. This means individual offices or widely spaced workstations. We also provide extra masks, shields, hand sanitizer, and gloves as needed. We are an essential business, and we require our team to work in the office. We provide equal employment opportunities to all employees and applicants for employment and prohibit discrimination and harassment of any type without regard to race, color, religion, age, sex, national origin, disability status, genetics, protected veteran status, sexual orientation, gender identity or expression, or any other characteristic protected by federal, state, or local laws. This policy applies to all terms and conditions of employment, including recruiting, hiring, placement, promotion, termination, layoff, recall, transfer, leaves of absence, compensation, and training. Job Type: Full-time Pay: $75,000.00 - $85,000.00 per year Benefits: 401(k) matching AD&D insurance Dental insurance Health insurance Paid sick time Paid time off Vision insurance Schedule: 8 hour shift Monday to Friday Ability to commute/relocate: Los Angeles, CA 90058: Reliably commute or planning to relocate before starting work (Required) Education: Bachelor's (Required) Experience: Business analysis: 3 years (Required) PostgreSQL: 1 year (Required) MySQL: 1 year (Required) Power BI: 1 year (Required) Python: 1 year (Required) Work Location: One location Health insurance If you require alternative methods of application or screening, you must approach the employer directly to request this as Indeed is not responsible for the employer's application process.",https://www.indeed.com/jobs?q=Business+Analyst&l=Los+Angeles%2C+CA&sc=0kf%3Aattr%28EXSNN%7CFCGTU%7CHFDVW%7CQJZM9%7CUTPWG%252COR%29explvl%28MID_LEVEL%29jt%28fulltime%29%3B&vjk=d0e9bea6a39fdb95&advn=183365483118057
2,304e105ccd834474,Business Analyst,"Los Angeles, CA",MID_LEVEL,MASTERS_DEGREE,FULLTIME,"Business Systems Analyst (Oracle) - job post Aramark Uniform Services Burbank, CA Full-time Responded to 51-74% of applications in the past 30 days, typically within 7 days. Apply now Apply now save-icon Job details Job Type Full-time ARAMARK Uniform Services IT is looking for a highly motivated and energetic individual to join the team. In this role the individual will be working closely with other departments to support business needs. The Business System Analyst is expected to interface with the business community and other IS team members to successfully undertake, and advise on the management of information systems and project requirements. The Business System Analyst has support responsibilities as defined by business needs and manager direction. The primary skill set used for this position is business analysis, Route Accounting, SQL, and Project Management. Helps determine operational objectives by closely studying business processes Evaluating business requirements and writing future state designs with workflow charts and diagrams Analyzes required business process improvements and assists with required change management practices to facilitate the necessary business process changes to meet the future state designs Assists with gap identification, gap prioritization and gap solution design efforts after business requirements gathering and initial systems configuration and systems walkthrough with key business members Writes all functional design documents that details any customization/extensions that delivers the functional solution to solve the business requirement Collaborates with technical resources to plan and develop system flows. Helps programmers during system development, e.g. provide use cases, flowcharts, design specifications Develops and implements comprehensive test plans to ensure that systems and programs are tested and debugged. Creates functional tests of systems configurations and extensions/customizations delivered from the IT development team Writes or helps write solution design and critical control measures (i.e. roles and responsibilities of an ERP/Route Accounting system) Collaborates with Change management to construct user documentation; providing help desk support; training users. Qualifications: Competencies: Thinks Strategically – Focuses on the future and creates direction Raises the Bar – Take smart risks and sets high expectations Knows the Business – Has strong business judgment, prioritizes, and is decisive Simplifies the Agenda – Takes an enterprise view and helps others connect the dots Influences with Impact – Influences through action, and communicates effectively Manages Courageously – Embraces change and manages conflict Leverages Diversity - Promotes inclusion and leverages differences Develops Others - Develops capabilities and inspires commitment Drives for Results – Focuses on the end result and does the right thing Takes Action – Plays offense and moves with speed Works with Others – Plays as a team and achieves excellence together Required Qualifications: Bachelor’s Degree in one of the following disciplines Business, Computer Science, or related field. Minimum 2 years of relevant technology experience required, including experience with large, complex technology programs. Minimum of 2 years as an IT Business Analyst supporting ERP or Route Accounting software. Experience in application and mobile application support including problem analysis and resolution. Able to follow a methodical implementation process. Strong requirements elicitation and modeling skills and experience with requirements management Experienced in multi-system application integration. Experienced in developing workflow and functional Use Cases. Experience with Iterative or Agile project methodologies and tools. Familiarity with customer invoicing processes. Understanding of software development lifecycle. Able to work as a liaison between the business community and technical team. Excellent interpersonal, written and verbal communication skills Self-starter who requires minimal supervision. Has the drive and initiative to handle multiple deadlines continuously implementing changes Capable of working in a fast paced, dynamic, team-oriented environment. Experience using SQL based relational databases Proficient in Microsoft Excel and Word. Safety Requirements: This location requires all individuals working on site to be fully vaccinated against COVID-19. Preferred Qualifications: Use of Mobile Device Management software. Strong understanding of Sarbanes-Oxley (SOX) requirements. Knowledge of RESTful and SOAP web services. Job Type: Full-time Benefits: 401(k) 401(k) matching Dental insurance Flexible spending account Health insurance Health savings account Life insurance Paid time off Tuition reimbursement Vision insurance Schedule: 8 hour shift Monday to Friday Experience: Oracle EBS: 4 years (Required) Work Location: Multiple Locations Health insurance If you require alternative methods of application or screening, you must approach the employer directly to request this as Indeed is not responsible for the employer's application process.",https://www.indeed.com/jobs?q=Business+Analyst&l=Los+Angeles%2C+CA&sc=0kf%3Aattr%28EXSNN%7CFCGTU%7CHFDVW%7CQJZM9%7CUTPWG%252COR%29explvl%28MID_LEVEL%29jt%28fulltime%29%3B&vjk=304e105ccd834474&advn=2788108658390528
3,fe3d37e347327251,Business Analyst,"Los Angeles, CA",MID_LEVEL,MASTERS_DEGREE,FULLTIME,"SAP Functional Business Analyst - job post Los Angeles Community College District 78 reviews Los Angeles, CA 90017 $102,539 - $127,028 a year -  Full-time You must create an Indeed account before continuing to the company website to apply Apply on company site save-icon Job details Salary $102,539 - $127,028 a year Job Type Full-time The Los Angeles Community College District (LACCD) invites applications for the position of SAP Functional Business Analyst. This position analyzes and defines complex SAP business systems functions, business processes, and user needs and performs complex functional configuration, testing, and maintenance tasks for assigned District’s SAP business systems modules according to operational and business needs. MONTHLY SALARY: $8,544 - $10,585 *Salary Information is based on a full-time, 12-month position MINIMUM REQUIREMENTS FOR ACCEPTANCE OF AN APPLICATION: Education and Experience: A bachelor’s degree from a recognized college or university, preferably with a major in finance, accounting, business administration, public administration, human resources management, computer information systems, management information systems, or a related field AND three years of recent full-time paid professional-level experience in the functional configuration, modification, or maintenance of an SAP business system. A current Certification of Capability in Business Analysis (CCBA) from International Institute of Business Analysis (IIBA) is desirable. Special A valid Class ""C"" California driver's license is required. Travel to locations throughout the District is required. For a complete job description including the Knowledge, Skills, and Abilities associated with the position please visit our website. VACANCIES A current vacancy exists at the Educational Services Center, 770 Wilshire Blvd., Los Angeles, CA 90017. The hiring list established by this examination will be used to fill future vacancies as they occur during the life of the list. BENEFITS Medical and dental insurance and vision care plans are provided for employees and their dependents. A $50,000 life insurance policy is provided free of charge for each employee. 12 full-pay days and 88 half-pay days of illness leave. At least 16 paid holidays per year. Vacation days accrue annually beginning at 10 days and increasing incrementally to 24 days depending on years of service with the District.  Vacation days for management and confidential positions begin at 15, 20, or 24 days. Other paid time off includes: bereavement leave, personal necessity leave, court subpoena, and jury duty. Employees become members of the Public Employees Retirement System.  The employee and District contribute to the retirement system.  Employees are also covered by Social Security. Employee Assistance Program EXAMINATION PROCESS The examination process may consist of one or more parts which may include a training and experience evaluation, written test, performance test, and/or oral interview. ACCOMMODATION Individuals protected by the Americans with Disabilities Act (ADA) may request, orally or in writing, an accommodation in the examination process. Documentation of the need for accommodation is required solely for the purpose of establishing that the applicant has an ADA disability and that the disability necessitates a reasonable accommodation. Typically, a recent letter from an appropriate health care or rehabilitation professional which establishes that the applicant has an ADA qualifying disability, identifies the functional limitations as they relate to the testing situation, and recommends/suggests the appropriate accommodation is sufficient.  In order for appropriate arrangements to be made at the testing site, a request for accommodation and required documentation must be received by the Examiner of Record at least 3 days prior to the administration of the test. HOW TO APPLY and DEADLINE Apply Online at https://www.jobapscloud.com/LACCD/sup/bulpreview.asp?R1=23&R2=5441&R3=001 Completed applications must be submitted through our online employment system by 4:00 P.M. on WEDNESDAY, APRIL 12, 2023 or until a sufficient number of applications have been received . Resumes will not be accepted in lieu of an application. For a listing of other job opportunities with the Los Angeles Community College District, refer to our Web Page. Job Type: Full-time Pay: $102,539.04 - $127,027.92 per year Benefits: Dental insurance Employee assistance program Flexible spending account Health insurance Health savings account Life insurance Paid time off Parental leave Retirement plan Tuition reimbursement Vision insurance Experience level: 3 years Schedule: 8 hour shift Monday to Friday Work Location: One location Health insurance",https://www.indeed.com/jobs?q=Business+Analyst&l=Los+Angeles%2C+CA&sc=0kf%3Aattr%28EXSNN%7CFCGTU%7CHFDVW%7CQJZM9%7CUTPWG%252COR%29explvl%28MID_LEVEL%29jt%28fulltime%29%3B&vjk=fe3d37e347327251&advn=490126767499207
