,job_id,job_title,location,experience,education,job_type,job_description,job_link
6,e9d44817445c0bcb,Business Analyst,"Los Angeles, CA",MID_LEVEL,MASTERS_DEGREE,FULLTIME,"Sr Business Analyst - (Pega A & G Applications) - job post Molina Healthcare 1,638 reviews Long Beach, CA 90802 $54,922 - $107,099 a year -  Full-time You must create an Indeed account before continuing to the company website to apply Apply on company site save-icon Job details Salary $54,922 - $107,099 a year Job Type Full-time JOB DESCRIPTION Molina Healthcare is hiring a Sr. Business Analyst who has verifiable experience as an Analyst in the Healthcare area. Process Improvement experience is a plus. This role is on a team that handles implementations and code changes for our Health Plans nation-wide. Ideal candidates will have the following experience: Managed Care/ MCO / Health Insurance Business Analyst experience Appeals and Grievances experience Jira, Agile, Waterfall Writing stories, working with developers to help create stories Gathering requirements Testing code Medical terminology- understanding of types of claims Must have a high level of attention to detail, able to work in a fast-paced environment with competing priorities, ability to work independently with little oversight (once fully trained). KNOWLEDGE/SKILLS/ABILITIES Elicit requirements using interviews, document analysis, and requirements workshops, business process descriptions, use cases, business analysis, task and workflow analysis. Interpret customer business needs and translate them into application and operational requirements Communicate and collaborate with external and internal customers to analyze and transform needs, goals and transforming in to functional requirements and delivering the appropriate artifacts as needed. Work with operational leaders within the business to provide recommendations on opportunities for process improvements, medical cost savings or revenue enhancements. Create Business Requirements Documents, Test Plans, Requirements Traceability Matrix, User Training materials and other related documentations. Actively participates in all stages of project development including research, design, programming, testing and implementation to ensures the released product meets the intended functional and operational requirements. JOB QUALIFICATIONS Required Education Bachelor's Degree or equivalent combination of education and experience Required Experience 5-7 years of business analysis experience, 6+ years managed care experience. Demonstrates proficiency in a variety of concepts, practices, and procedures applicable to job-related subject areas. Preferred Education Bachelor's Degree or equivalent combination of education and experience Preferred Experience 3-5 years of formal training in Project Management Experience working with complex, often highly technical teams Preferred License, Certification, Association Certified Business Analysis Professional (CBAP), Certification from International Institute of Business Analysis preferred To all current Molina employees: If you are interested in applying for this position, please apply through the intranet job listing. Molina Healthcare offers a competitive benefits and compensation package. Molina Healthcare is an Equal Opportunity Employer (EOE) M/F/D/V. Pay Range: $54,922 - $107,099 a year* Actual compensation may vary from posting based on geographic location, work experience, education and/or skill level.",https://www.indeed.com/jobs?q=Business+Analyst&l=Los+Angeles%2C+CA&sc=0kf%3Aattr%28EXSNN%7CFCGTU%7CHFDVW%7CQJZM9%7CUTPWG%252COR%29explvl%28MID_LEVEL%29jt%28fulltime%29%3B&start=60&pp=gQBaAAAAAAAAAAAAAAAB_mTAHQArAQEBCQEaeoQ4bL6nt4lbFllDHOQF7RW6hJ5-wai5b1GSmt5vDZFRFzfIewAA&vjk=e9d44817445c0bcb
7,7fbcc4e71497ea1f,Business Analyst,"Los Angeles, CA",MID_LEVEL,MASTERS_DEGREE,FULLTIME,"Senior Analyst, Fund Accounting & Operations - job post Oaktree Capital Management, L.P. 29 reviews Los Angeles, CA $95,000 - $110,000 a year -  Full-time You must create an Indeed account before continuing to the company website to apply Apply on company site save-icon Job details Salary $95,000 - $110,000 a year Job Type Full-time Responsibilities This position is within Oaktree’s Fund Accounting & Operations Shared Services team, which works across all of Oaktree’s fund accounting teams to analyze, centralize and streamline fund data. Shared Services works in partnership with several other sub-departments to deliver standardized fund data, so strong communication and collaboration skills are critical to success in this position. The senior analyst will help coordinate accounting-related responses to due diligence questions and client requests across several fund accounting strategies. This includes acting as a liaison between Fund Accounting and Marketing, Client Services and Diligence Services teams to serve clients and prospects. This role will also assist with several initiatives to improve the implementation and maintenance of standardized processes over financial and non-financial information across Oaktree’s Finance organization. Responsibilities include: Manage communication across multiple departments to respond to due diligence requests from prospective clients effectively and efficiently. Assist with investor performance requests from the Client Services team and Marketing representatives (i.e., investor-level management and incentive fee calculations, capital activities, preferred return calculations, waterfall schedules, additional payment calculations, special fee distributions and relationship summaries). Prepare and process ad-hoc client inquiries related to fund reporting and partner activity (i.e., reconciling fund financial statements, queries on quarterly partner statements or ILPA templates). Act as one of the primary contacts within the Fund Accounting & Operations organization for all client requests related to accounting data or reporting. Perform reviews in connection with the accounting process for consistency and accuracy, assist with projects related to process improvement and help implement best practices across the Fund Accounting teams. Participate in ad hoc projects and analysis as needed. Qualifications 3-5 years of relevant accounting experience, preferably in the asset management industry Knowledge of closed-end private investment funds and fund accounting strongly preferred Experience with client relations preferred Strong communication skills – proven ability to tailor communication to various audiences Strong judgment and analytical skills – proven ability to communicate proactively, analyze issues and reach well-considered conclusions under tight time constraints Ability to manage tasks with competing priorities and deadlines, independently determining order of priority Proficiency with MS Office Excel as well as other financial applications Personal Attributes Independence & Collaboration; proficient at working both independently and in a team-oriented, collaborative environment; self-motivated with excellent work ethic; able to drive work effectively with limited supervision (at times) with high attention-to-detail. Intellectual Curiosity; energized by learning new things and engaging across a wide range of issues; must have strong problem-solving skills and adaptability; adept at conducting research into project-related issues and products; displays a technical aptitude that lends itself to learning and mastering new technologies. Communication; strong interpersonal and verbal/written communication skills. Relationship Building; works effectively with diverse teams of people with multiple perspectives, talents and backgrounds. Ability to elicit cooperation from and gain the confidence of a wide variety of participants including upper management, other departments and third-party service providers. Education Bachelor’s degree in Accounting, Finance or related field. Base Salary Range $95,000 - $110,000 + discretionary bonus and comprehensive benefits package Equal Opportunity Employment Policy Oaktree is committed to diversity and to equal opportunity employment. Oaktree does not make employment decisions on the basis of race, creed, color, ethnicity, national origin, citizenship, religion, sex, sexual orientation, gender identity, gender expression, age, past or present physical or mental disability, HIV status, medical condition as defined by state law (genetic characteristics or cancer), pregnancy, childbirth and related medical conditions, veteran status, military service, marital status, familial status, genetic information, domestic violence victim status or any other classification protected by applicable federal, state and local laws and ordinances. This policy applies to hiring, placement, internal promotions, training, opportunities for advancement, recruitment advertising, transfers, demotions, layoffs, terminations, recruitment advertising, rates of pay and other forms of compensation and all other terms, conditions and privileges of employment. This policy applies to all Oaktree applicants, employees, clients, and contractors.",https://www.indeed.com/jobs?q=Business+Analyst&l=Los+Angeles%2C+CA&sc=0kf%3Aattr%28EXSNN%7CFCGTU%7CHFDVW%7CQJZM9%7CUTPWG%252COR%29explvl%28MID_LEVEL%29jt%28fulltime%29%3B&start=60&pp=gQBaAAAAAAAAAAAAAAAB_mTAHQArAQEBCQEaeoQ4bL6nt4lbFllDHOQF7RW6hJ5-wai5b1GSmt5vDZFRFzfIewAA&vjk=7fbcc4e71497ea1f
8,31c85ac6c84ff5f5,Business Analyst,"Los Angeles, CA",MID_LEVEL,MASTERS_DEGREE,FULLTIME,"Customer/1 Application Specialist - job post Accenture 23,370 reviews 1003 E. 4th Place, 8th Floor, Los Angeles, CA 90013 Full-time You must create an Indeed account before continuing to the company website to apply Apply on company site save-icon Job details Job Type Full-time Accenture Flex offers you the flexibility of local fixed-duration project-based work powered by Accenture, a leading global professional services company. Accenture is consistently recognized on FORTUNE's 100 Best Companies to Work For and Diversity Inc's Top 50 Companies For Diversity lists. As an Accenture Flex employee, you will apply your skills and experience to help drive business transformation for leading organizations and communities. In addition to delivering innovative solutions for Accenture's clients, you will work with a highly skilled, diverse network of people across Accenture businesses who are using the latest emerging technologies to address today's biggest business challenges. You will receive competitive rewards and access to benefits programs and world-class learning resources. Accenture Flex employees work in their local metro area onsite at the project, significantly reducing and/or eliminating the demands to travel. Job Description: Technical and Functional Subject-Matter Expert (SME) Support of Customer/1 application Perform Requirements Gathering Perform Functional Analysis Document Functional Requirements Complete User Approvals and Sign-Off of Requirements Develop User Acceptance Test Plans Develop Post-Production Verification Requirements Functional and technical support of UAT Testers and Developers Support and analyze production abends and end-user application issues Support the development, review training materials, and participate in the implementation of the training as appropriate Basic Qualifications: Minimum 2 years of experience with Customer/1 Minimum 3 years of experience as a Business Analyst Minimum 2 years of experience with SQL Minimum 1 years of experience with the Unix platform (as a developer) High School Diploma or GED Preferred Qualifications: Experience with Oracle Utilities Platform Experience with Agile Delivery Compensation at Accenture varies depending on a wide array of factors, which may include but are not limited to the specific office location, role, skill set, and level of experience. As required by local law, Accenture provides a reasonable range of compensation for roles that may be hired in Albany County, NY, California, Colorado, New York City or Washington as set forth below. Information on benefits is here. Role Location California – $54.80-$64.80/hour Colorado – $54.80-$64.80/hour New York - Albany – $54.80-$64.80/hour New York City – $54.80-$64.80/hour Washington – $54.80-$64.80/hour What We Believe We have an unwavering commitment to diversity with the aim that every one of our people has a full sense of belonging within our organization. As a business imperative, every person at Accenture has the responsibility to create and sustain an inclusive environment. Inclusion and diversity are fundamental to our culture and core values. Our rich diversity makes us more innovative and more creative, which helps us better serve our clients and our communities. Read more here Equal Employment Opportunity Statement Accenture is an Equal Opportunity Employer. We believe that no one should be discriminated against because of their differences, such as age, disability, ethnicity, gender, gender identity and expression, religion or sexual orientation. All employment decisions shall be made without regard to age, race, creed, color, religion, sex, national origin, ancestry, disability status, veteran status, sexual orientation, gender identity or expression, genetic information, marital status, citizenship status or any other basis as protected by federal, state, or local law. Accenture is committed to providing veteran employment opportunities to our service men and women. For details, view a copy of the Accenture Equal Opportunity and Affirmative Action Policy Statement . Requesting An Accommodation Accenture is committed to providing equal employment opportunities for persons with disabilities or religious observances, including reasonable accommodation when needed. If you are hired by Accenture and require accommodation to perform the essential functions of your role, you will be asked to participate in our reasonable accommodation process. Accommodations made to facilitate the recruiting process are not a guarantee of future or continued accommodations once hired. If you would like to be considered for employment opportunities with Accenture and have accommodation needs for a disability or religious observance, please call us toll free at 1 (877) 889-9009, send us an email or speak with your recruiter. Other Employment Statements Applicants for employment in the US must have work authorization that does not now or in the future require sponsorship of a visa for employment authorization in the United States. Candidates who are currently employed by a client of Accenture or an affiliated Accenture business may not be eligible for consideration. Job candidates will not be obligated to disclose sealed or expunged records of conviction or arrest as part of the hiring process. The Company will not discharge or in any other manner discriminate against employees or applicants because they have inquired about, discussed, or disclosed their own pay or the pay of another employee or applicant. Additionally, employees who have access to the compensation information of other employees or applicants as a part of their essential job functions cannot disclose the pay of other employees or applicants to individuals who do not otherwise have access to compensation information, unless the disclosure is (a) in response to a formal complaint or charge, (b) in furtherance of an investigation, proceeding, hearing, or action, including an investigation conducted by the employer, or (c) consistent with the Company's legal duty to furnish information.",https://www.indeed.com/jobs?q=Business+Analyst&l=Los+Angeles%2C+CA&sc=0kf%3Aattr%28EXSNN%7CFCGTU%7CHFDVW%7CQJZM9%7CUTPWG%252COR%29explvl%28MID_LEVEL%29jt%28fulltime%29%3B&start=60&pp=gQBaAAAAAAAAAAAAAAAB_mTAHQArAQEBCQEaeoQ4bL6nt4lbFllDHOQF7RW6hJ5-wai5b1GSmt5vDZFRFzfIewAA&vjk=31c85ac6c84ff5f5
9,3b6dace434d11c53,Business Analyst,"Los Angeles, CA",MID_LEVEL,MASTERS_DEGREE,FULLTIME,"Sales Analyst - job post Konica Minolta 964 reviews Los Angeles, CA 90001 Full-time You must create an Indeed account before continuing to the company website to apply Apply on company site save-icon Job details Job Type Full-time Join Konica Minolta and help drive innovation as we transform the Workplace of the Future.™ Position Objective A Sales or Customer Relationship Management (CRM) Business Analyst duties include organizing and analyzing marketing and customer data and helping sales and marketing teams deepen their market influence and build long-lasting customer relationships. Essential Job Functions Create reports regularly and analyze performance trends. Find areas of improvement and make recommendations. Develop and maintain a separate industry database to conform to and report on current GTM strategy Develop and deliver progress reports to region executives. Develop and maintain region defined account attributes inside and outside of SAP-CRM for sales targeting related to the current GTM strategy. Maintain separate database outside of SAP-CRM of activity attributes for detailed reporting. Monitor and Maintain information on accounts and prospects in SAP-CRM database. Update any missing or incorrect information in the system. Train managers and employees on the effective use of CRM system eMarketing campaign development, execution and tracking Strategy development of operational initiatives Manage territory alignment, assignment and integrity Competencies (Knowledge, Skills and Abilities) Excellent verbal and written communication skills Proficiency in MS Office (Word and PowerPoint); advanced Excel Great time management skills and detail oriented. Ability to work independently and in a team environment. Experience, Educational Reqts and Certifications 4-year College degree or commensurate business experience 3 - 5 years related work experience 3+ years of Database experience required Konica Minolta Offers: Outstanding benefits package (including medical, dental, vision, life insurance) 401(k) plan with matching company contribution Generous holiday and paid time off schedules Ongoing professional development training Visible, exciting work supporting sales of cutting edge technology and workflow solutions. Konica Minolta Business Solutions U.S.A., Inc., a global Fortune 1000 company and one of Forbes Best-In-State Employers 2021, is transforming the way we all do business. From smart office technology and information management to cloud, mobility and IT services, we have a rich history of creating the products and services necessary to drive innovation and make work possible from anywhere at any time. Our award-winning products and solutions help companies around the world move information faster, improve quality and productivity, enhance security and facilitate the sharing of information. We are proud that our portfolio leads the industry while exceeding environmental standards. At Konica Minolta, you'll work for an amazing technology company with growth opportunities, great benefits and talented, passionate co-workers. Konica Minolta is an equal opportunity and affirmative action employer. We consider all qualified applicants for employment without regard to race, color, religion, creed, national origin, sex, pregnancy, age, sexual orientation, transgender status, gender identity, disability, alienage or citizenship status, marital status or partnership status, genetic information, veteran status or any other characteristic protected under applicable law.",https://www.indeed.com/jobs?q=Business+Analyst&l=Los+Angeles%2C+CA&sc=0kf%3Aattr%28EXSNN%7CFCGTU%7CHFDVW%7CQJZM9%7CUTPWG%252COR%29explvl%28MID_LEVEL%29jt%28fulltime%29%3B&start=60&pp=gQBaAAAAAAAAAAAAAAAB_mTAHQArAQEBCQEaeoQ4bL6nt4lbFllDHOQF7RW6hJ5-wai5b1GSmt5vDZFRFzfIewAA&vjk=3b6dace434d11c53
10,aea90c57f7cf1a0e,Business Analyst,"Los Angeles, CA",MID_LEVEL,MASTERS_DEGREE,FULLTIME,"Sales Performance Management Consultant - job post Deloitte 11,492 reviews 555 West 5th Street Suite 2700, Los Angeles, CA 90013 Full-time You must create an Indeed account before continuing to the company website to apply Apply on company site save-icon Job details Job Type Full-time Sales Performance Management Consultant Are you passionate about helping clients solve complex challenges and supporting them through critical transformations? As a member of our Sales & Service Excellence practice, you will design and implement sales and service experiences, capabilities, and architecture required to bring customer strategies to life. Would you like to work for an organization committed to your professional development and personal success? Deloitte offers an award-winning culture that supports our employees development of their personal brand through learning opportunities, professional experiences, inclusion, collaboration and personal well-being. Work you'll do Our ambition is to be the best in the world at driving customer transformation through the development of clever commercial strategies, distinctive experiences, and the application of digital technologies. Responsibilities include, but are not limited to: Help companies maximize the return for their digital sales enablement and sales operations infrastructure investment Work with Sales Leadership on devising sales strategies aimed at improving sales productivity focused on sales process standardization, digital tool adoption, sales reporting (pipeline, performance) Provide best-in-class services for planning, designing, deploying, and supporting digital sales technology tools Offer end-to-end solutions including process analysis and design, requirements planning, business case development, analytics support and administration support Act in a mentoring capacity to support the career development of other colleagues Responsible for business development efforts, including Statements of Work (SOW), proposal development, client presentations, etc. Contribute to the internal development of our practice through participation in areas such as business development, training, methodology and toolkit development, and recruiting The Team Digital Customer Digital Customer offering focuses on designing and implementing sales and service experiences, capabilities, and architectures to bring customer strategies to life. The ambition is to be the best in the world at driving customer transformation through the development of clever commercial strategies, distinctive experiences, and the application of digital technologies. We help make the ""creative digital consultancy"" real and in doing so, make new markets. Professionals will serve our clients through the following types of work: Customer Operations | modernize, deploy, and operate office capabilities and business processes across sales operations, quote-to-cash, and revenue management team Sales Excellence & Service Excellence | Integrate the latest technologies with leading-edge strategies, insights, experiences, and talent to enable outstanding customer service Salesforce | Deloitte unleashes the powerful Salesforce platform for our clients to drive the best possible outcomes and redefine engagement. We innovate like never before by creatively using technology to help enhance digital customer and employee experiences for our clients Qualifications Required: Bachelor's Degrees (BS or BA) A broad-based and business-oriented understanding of sales issues 2 + years experience as a Business Analyst, Systems Consultant, or Compensation Analyst for a mid-to-large sized organization; or, direct consulting experience Experience with systems implementation Proficiency in MS Access and SQL Ability to travel at least 50% of the time on average based on the work you do and the clients and industry/ sectors you serve Experience with tier one compensation software product - Callidus, SAP Commissions, Varicent, Xactly Must be legally authorized to work in the United States without the need for employer sponsorship, now or at any time in the future For individuals assigned and/or hired to work in California, Colorado, Jersey City, Nevada, New York City, and Washington State, Deloitte is required by law to include a reasonable estimate of the compensation range for this role. This compensation range is specific to California, Colorado, Jersey City, Nevada, New York City, and Washington State and takes into account the wide range of factors that are considered in making compensation decisions including but not limited to skill sets; experience and training; licensure and certifications; and other business and organizational needs. At Deloitte, it is not typical for an individual to be hired at or near the top of the range for their role and compensation decisions are dependent on the facts and circumstances of each case. A reasonable estimate of the current range is $84,000 to $140,000. Preferred: Advanced degree in related specialization area Strong oral and written communication skills, including presentation skills (MS Visio, MS PowerPoint, MS Word, MS Excel) #LI-KD1",https://www.indeed.com/jobs?q=Business+Analyst&l=Los+Angeles%2C+CA&sc=0kf%3Aattr%28EXSNN%7CFCGTU%7CHFDVW%7CQJZM9%7CUTPWG%252COR%29explvl%28MID_LEVEL%29jt%28fulltime%29%3B&start=60&pp=gQBaAAAAAAAAAAAAAAAB_mTAHQArAQEBCQEaeoQ4bL6nt4lbFllDHOQF7RW6hJ5-wai5b1GSmt5vDZFRFzfIewAA&vjk=aea90c57f7cf1a0e
