,job_id,job_title,location,experience,education,job_type,job_description,job_link
0,ffcac5b914ffe4ae,Business Analyst,"Chicago, IL",MID_LEVEL,BACHELORS_DEGREE,TEMPORARY,"Data Analyst, Early College and Career Education - job post Chicago Public Schools 1,766 reviews 42 W Madison St, Chicago, IL 60602 $56,000 - $71,000 a year -  Part-time, Temporary You must create an Indeed account before continuing to the company website to apply Apply on company site save-icon Job details Salary $56,000 - $71,000 a year Job Type Part-time Temporary Data Analyst, Early College and Career Education Job Number: 220001AD Posting Date : Feb 15, 2023, 9:30:49 AM Primary Location : Central-42 West Madison Street (Early College and Career) CPS Non-Union Job Grade : S06 JOB DESCRIPTION - Chicago Public Schools (CPS) is the third-largest school district in the United States, serving over 330,000 students in 600+ schools and employing nearly 36,000 people, most of them teachers. CPS has set ambitious goals to ensure that every student, in every school and every neighborhood, has access to a world-class learning experience that prepares each for success in college, career, and civic life. In order to fulfill this mission, we make three commitments to our students, their families, and all Chicagoans: academic progress, financial stability, and integrity. Six core values are embedded within these commitments – student-centered, whole child, equity, academic excellence, community partnership, and continuous learning. Located in the Office of College and Career Success (OCCS), the Department of Early College and Career Education (ECCE) provides CPS students with opportunities to take career and college courses while in high school, saving them time and money while pursuing their post-secondary education. The Data Analyst will contribute to a diverse array of projects that support the goal of creating access to college and career instruction, advising, and ultimately enrollment in a postsecondary pathway for all CPS students. This position will design and implement data collection and reporting systems to continuously enhance the quality and breadth of data-informed decisions and communications. Additionally, the Data Analyst will conduct analyses in order to inform day-to-day practice, drive strategy and policy, and to monitor key program and student outcomes. The Data Analyst will also serve as the internal lead on accessing key CPS data systems and will be responsible for managing on-demand data requests to answer key questions about the initiatives and operations of ECCE. This position will report to the Manager of Business Operations in ECCE. The Data Analyst will be held accountable for the following responsibilities: Serve as the system administrator for the Work-Based Learning team’s Customer Relationship Management (CRM) System Develop processes to strategically and systematically collect, archive, and report work-based learning data in an accurate and timely manner, using automated processes where possible. Implement key processes of the annual summer internship program Analyze and visualize data on a project basis to enhance understanding of and usage by key stakeholders. Prepare and disseminate analysis reports, briefs, and presentations; communicate results meaningfully to various audiences both internal and external. Engage in capacity building with internal staff around using data to inform practice and strategy. Analyze CPS and 3rd party student-level data, handle data requests and special analyses, support grant proposals and funder reporting, and provide data and reports to external research partners. Assist in determining key future analyses and metrics based on findings from internal and external research, literature reviews, and collaboration with external partners. Lead or participate in workgroups with internal staff and external partners to support strategic planning, continuous improvement, and the development of new initiatives. Ensure data quality and integrity across Offices Adhere to a set of guiding principles for analytic practice as established by the Data Governance Council Work with approved enterprise analytic tool sets. (SAS, SQL) Compile, manipulate, and analyze data using appropriate statistical techniques Participate in District’s Data Analyst User Group Perform related duties as required In order to be successful and achieve the above responsibilities, the Data Analyst must possess the following qualifications: Education Required : A bachelor’s degree from an accredited college or university is required; Focus in education, measurement, psychology, social science, public policy, economics, or a related field requiring quantitative coursework, is preferred. Master’s degree preferred Experience Required : A minimum of two (2) years of professional experience in a relevant field and a role requiring data analysis skills is required One or more years of experience as a business analyst or systems analyst preferred Experience managing and/or engaging with CRM systems required Familiarity with Taleo, PeopleSoft, or similar systems preferred Experience writing code with data analytic tools (SAS, R, SPSS, STATA, etc) Experience drafting ad hoc surveys, programming content into online survey platforms (Alchemer, Survey Monkey, Qualtrics, etc.), and presenting findings to stakeholders Knowledge, Skills, and Abilities : Ability to use or learn SAS required Advanced experience with Excel and gSuite applications Exceptional organizational, communication (oral and written), and problem-solving skills Strong attention to detail and data quality assurance Ability to deliver high-quality results in a fast-paced environment, respond immediately to multiple constituencies and meet established deadlines Able to lead independently under general guidance and as part of a team Capable of coordinating efforts and collaborating with a variety of individuals having conflicting agendas Ability to establish priorities and manage multiple activities while meeting established deadlines Ability to work in a cross-functional team with technical and non-technical personnel from a variety of departments Flexibility to meet changing departmental needs and priorities Ability to work on multiple projects simultaneously Adheres to a high level of professionalism at all times across professional interactions (ie- meets deadlines, is responsive to communications and requests, etc.) Conditions of Employment As a condition of employment with the Chicago Public Schools (CPS), employees are required to: Establish/Maintain Chicago Residency - Employees are required to live within the geographic boundaries of the City of Chicago within six months of their CPS hire date and maintain residency throughout their employment with the district. This Chicago residency requirement does not apply to part-time/temporary positions. Be Fully Vaccinated or Submit to Weekly COVID-19 Testing - Employees are required to be fully vaccinated within 30 days of their hire date. Full vaccination is defined as at least two weeks after your second shot of a two-shot vaccination course, or at least two weeks after a one-shot vaccination course. Unvaccinated staff must submit to weekly testing. CPS Non-Union Job Grade: S06 Estimated Annual Salary Range: $56,000 - $71,000 Final salary offers are dependent upon candidate qualifications.",https://www.indeed.com/jobs?q=Business+Analyst&l=Chicago%2C+IL&sc=0kf%3Aattr%28FCGTU%7CHFDVW%7CQJZM9%7CUTPWG%252COR%29explvl%28MID_LEVEL%29jt%28temporary%29%3B&vjk=ffcac5b914ffe4ae
1,553b6e10e037ba4e,Business Analyst,"Chicago, IL",MID_LEVEL,BACHELORS_DEGREE,TEMPORARY,"Web and Database Analyst (Part-time/Temporary Position), ECCE - job post Chicago Public Schools 1,766 reviews 42 W Madison St, Chicago, IL 60602 $40 an hour -  Part-time, Temporary You must create an Indeed account before continuing to the company website to apply Apply on company site save-icon Job details Salary $40 an hour Job Type Part-time Temporary Web and Database Analyst (Part-time/Temporary Position), ECCE Job Number: 220003TT Posting Date : Sep 19, 2022, 5:05:30 PM Primary Location : Central-42 West Madison Street (CW - Early College and Career) JOB DESCRIPTION - Chicago Public Schools (CPS) is the third-largest school district in the United States, serving over 330,000 students in 600+ schools and employing nearly 36,000 people, most of them teachers. CPS has set ambitious goals to ensure that every student, in every school and every neighborhood, has access to a world-class learning experience that prepares each for success in college, career, and civic life. In order to fulfill this mission, we make three commitments to our students, their families, and all Chicagoans: academic progress, financial stability, and integrity. Six core values are embedded within these commitments – student-centered, whole child, equity, academic excellence, community partnership, and continuous learning. Career and Technical Education (CTE) programs at Chicago Public Schools (CPS) are part of the department of Early College and Career Education (ECCE) within the Office of Career and College Success (OCCS). CTE programs for CPS high schools serve 15K+ students across 70+ schools with the goal of enhancing student preparation for college and career success, as evidenced by increasing graduation rates, college enrollment rates, employment rates, and earning levels of CPS CTE students. Job Summary: The Web and Database Analyst (Part-Time/Temporary) role is a part-time/temporary position designed to assist with the maintenance and enhancement of the workbased learning cloud based software Salesforce. Salesforce is leveraged to capture student internship data, workbased learning opportunities and various touch points with internship partners. The analyst will also develop key reporting templates as well as provide analysis for critical academic readiness related projects as outlined in the Roadmap. The part-time analyst will report directly to the Roadmap Director. The Web and Database Analyst (Part-Time/Temporary) will be held accountable for the following responsibilities: Develop processes to strategically and systematically collect, archive, and report key postsecondary metrics in an accurate and timely manner, using automated processes where possible. Develop practical and clear reporting templates that reflect important trends for critical Roadmap outcomes/KPIs to various stakeholders. Serve as primary consultant for the Work-Based Learning team’s Customer Relationship Management (CRM) System needs. Analyze and visualize data on a project basis to enhance understanding of and usage by key stakeholders. Ensure data quality and integrity across Offices. Adhere to a set of guiding principles for analytic practice as established by the Data Governance Council Work with approved enterprise analytic tool sets. (SAS, SQL) In order to be successful and achieve the above responsibilities, the Web and Database Analyst (Part-Time/Temporary) must possess the following qualifications: Education Required: A bachelor’s degree from an accredited college or university is required; Focus in education, measurement, psychology, social science, public policy, economics, or a related field requiring quantitative coursework, is preferred. Experience Required: A minimum of two (2) years of professional experience in a relevant field and a role requiring data analysis skills is required One or more years of experience as a business analyst or systems analyst preferred Knowledge, Skills, and Abilities: Ability to use or learn SAS required Advanced experience with Excel and gSuite applications Exceptional organizational, communication (oral and written), and problem-solving skills Strong attention to detail and data quality assurance Ability to deliver high-quality results in a fast-paced environment, respond immediately to multiple constituencies and meet established deadlines Able to lead independently under general guidance and as part of a team Conditions of Employment As a condition of employment with the Chicago Public Schools (CPS), employees are required to: Establish/Maintain Chicago Residency - Employees are required to live within the geographic boundaries of the City of Chicago within six months of their CPS hire date and maintain residency throughout their employment with the district. The Chicago residency requirement does not apply to temporary/part-time positions, however, all CPS employees must be residents of Illinois. Be Fully Vaccinated Against COVID-19 - Unless approved for a medical or religious exemption, all employees are required to be up-to-date on COVID-19 vaccinations, including boosters, and to submit proof of vaccination to the district within 30 days of hire. “Up-to-date” on vaccination is defined as being at least two weeks past all primary vaccine doses and any applicable boosters. Unvaccinated staff with an approved exemption must submit to weekly testing. CPS Non-Union Job Grade: Miscellaneous Position Estimated Annual Salary Range: $40.00 P/HR FLSA Classification: Non-Exempt",https://www.indeed.com/jobs?q=Business+Analyst&l=Chicago%2C+IL&sc=0kf%3Aattr%28FCGTU%7CHFDVW%7CQJZM9%7CUTPWG%252COR%29explvl%28MID_LEVEL%29jt%28temporary%29%3B&vjk=553b6e10e037ba4e
2,10924fe91a216ddb,Business Analyst,"Chicago, IL",MID_LEVEL,BACHELORS_DEGREE,TEMPORARY,"Project Coordinator, Office of the Registrar - job post Dominican University 102 reviews 7900 W Division Street, River Forest, IL 60305 Full-time, Temporary You must create an Indeed account before continuing to the company website to apply Apply on company site save-icon Job details Job Type Full-time Temporary JOB TITLE: Project Coordinator FLSA STATUS: Salaried, temporary (1 year) DEPARTMENT: Office of the Registrar REPORTS TO: University Registrar; Title V Project Director JOB STATUS: Full-time, 1-year temporary, grant funded (37.5+ hours/week) This is a 1-year temporary, grant-funded position under #P031S220030, Avanzamos: Advancing Dominican University from Hispanic-Enrolling to Hispanic-Serving PRIMARY PURPOSE/ POSITION SUMMARY: Reporting to the University Registrar, the Project Coordinator is responsible for the planning, coordination and implementation of the Stellic suite of degree management tools. The Project Coordinator will be responsible for expanding the use of multiple Stellic modules across the Colleges and related student service units, initially through a pilot implementation, followed by campus wide deployment to all students, faculty, advisors and related staff. The Project Coordinator will be responsible for developing a cross-functional training program for faculty, students, and staff. Through a collaborative partnership with IT Services, academic and student service units, the position will coordinate the Stellic project through the project lifecycle. The position will develop an inclusive, consistent student and faculty experience, applying change management strategies and develop a layered approach to training tools. The Project Coordinator interacts with a broad range of campus stakeholders. This role will ensure compliance and quality control with published programs and policies, and accreditation standards and procedures. The Project Coordinator is responsible for collaborating with campus partners to provide a seamless transition from Jenzabar to the Stellic advising and degree management experience. The successful candidate must be an experienced project manager with a demonstrated background in systems implementation, curriculum, advising, training and supporting a diverse community in a higher education setting. The Project Coordinator must be adept at balancing changing priorities while meeting critical deadlines. EXPECTATIONS FOR ALL DOMINICAN EMPLOYEES: To support the University's mission of preparing students to pursue truth, to give compassionate service, and to participate in the creation of a more just and humane world. JOB COMPONENTS/PRINCIPAL DUTIES AND RESPONSIBILITIES: Project Coordination: Stellic Coordinate a working group of subject matter experts within the Registrar’s office, IT, Advising, and the Colleges, and targeted appropriate internal and/or external sources to ensure optimal project outcome(s). In collaboration with the working group develops and defines the scope of work, schedule and methodology for carrying out the project and revises the plan through the project lifecycle to meet changing needs and priorities. Creates and manages the project plan which highlights staffing, budget, quality, communications, risk, and procurement, as appropriate. Owns and executes project communications including kick-off, regular project status updates, meetings and changes to project scope, timelines, risks, etc. Provides regular and accurate reports as well as project status updates, progress, risks, and issues to stakeholders and project working group. Identifies and manages project dependencies, deliverables, and critical path. Identifies, tracks, and implements strategies to manage risks and issues, maintains accurate risk-tracking documents, and escalates issues when necessary to minimize impact. Monitors project and team performance against plans and takes effective corrective and preventive actions as required. Facilitates open and honest communication among participants, stakeholders, and working committee. Initiates and prepares transition plans to migrate project deliverables, incorporating user training and prototype standards testing according to operational/business requirements. Conducts post-implementation follow-up to ensure all tasks and close-out steps are completed successfully on the project. Forges the necessary relationships with stakeholders to accomplish work and be effective. Sets and continually manages project expectations with working group and stakeholders. Develop and direct quality assurance protocols and create test cases for system and user acceptance testing. Training and Development Collaborate with the Colleges and campus partners to establish a comprehensive training framework for new users and application administrators. Designs, develops and evaluates instructional training materials including workshop manuals, job aids, handouts, on-line tutorials, self-paced learning modules, and presentations. Develops all necessary documentation to support ongoing application administration Responsible for the initial training of students, faculty and staff. Characteristics of the Successful Candidate Required qualifications: Undergraduate degree in Computing Science, Business Management or Information Systems Management and 5 years related project management experience preferably in higher education; or any equivalent combination of experience and /or education from which comparable knowledge, skills and abilities have been achieved. Experience with student information system integrations, preferably with Jenzabar (J1) Advising and Registration modules. Experience implementing systems, strategies and processes for managing a project portfolio. Experience developing, facilitating, and delivering staff development and training activities. Ability to design and create training materials and presentations using PowerPoint and/or other authoring tools. Demonstrated knowledge of advising, curriculum management, and experience with instruction, including public-speaking. Experience providing collaborative service with faculty, students, and staff to implement systems with judgment and flexibility. Experience working within a complex, decentralized university environment. Ideal qualifications: Masters Degree. Demonstrated knowledge of project management principles, change management practices, and techniques needed for managing large projects. Certification as a Project Management Professional (PMP) or PMI Professional in Business Analysis (PMI-PBA). Knowledge of instructional design principles and learning theories. Must be very collaborative with regards to decision-making and relationship building—be a consensus builder, able to work with many stakeholders throughout the academic enterprise. Be a facilitator of change with the capacity to build alliances and bring others onboard with new initiatives. Possess strong interpersonal skills and be comfortable maintaining a highly visible and engaged role, actively working with a wide variety of constituents. Possess excellent communication and active listening skills—able to communicate effectively up, down, and across the institution with ease. Be adaptable to changing needs, circumstances, and opportunities while remaining committed to continuous assessment and process improvement. Possess a strong customer service orientation and exhibit respect to students, staff, academic leaders, and faculty in the execution of duties. Candidates may be requested to complete a background screening upon hire. EEO Statement Dominican University is proud to be an equal opportunity employer and is dedicated to the goal of building an equity-centered faculty and staff committed to teaching, working, and learning in a multicultural environment. Dominican University believes that justice, equity, and inclusion are critical to our growth and development and seek to recruit, develop, and retain from a diverse pool of applicants who bring varied experiences, perspectives, and backgrounds. If you need accommodations due to a disability, you may contact us at hr@dom.edu for assistance.",https://www.indeed.com/jobs?q=Business+Analyst&l=Chicago%2C+IL&sc=0kf%3Aattr%28FCGTU%7CHFDVW%7CQJZM9%7CUTPWG%252COR%29explvl%28MID_LEVEL%29jt%28temporary%29%3B&vjk=10924fe91a216ddb
