,job_id,job_title,location,experience,education,job_type,job_description,job_link
10,64983b28b764f7fb,Business Analyst,"Los Angeles, CA",MID_LEVEL,MASTERS_DEGREE,FULLTIME,"FICO Business System Analyst - job post King's Hawaiian 152 reviews 2808 Sepulveda Blvd, Torrance, CA 90505 $110,000 - $160,000 a year -  Full-time You must create an Indeed account before continuing to the company website to apply Apply on company site save-icon Job details Salary $110,000 - $160,000 a year Job Type Full-time Joining King’s Hawaiian makes you part of our `ohana (family). We are a family-owned business for over seventy years, respecting our roots while thinking about our future as we continue to grow and care for our customers and the communities we serve. Our `ohana members build an environment of inclusivity as they freely collaborate, pursue learning through curiosity, and explore innovation as critical thinkers. Beyond that, we are also passionate about supporting the long-term health and well-being of our employees and their families. If you’re excited to rise with our team, come and join our `ohana! This position will have overall responsibility for supporting business end users within the Finance and Costing area (SAP FICO). The Business Systems Applications Analyst will work closely with various partners including business users and consultants and is leads systems support and improvement initiatives throughout the systems development life cycle which will include facilitating the gathering of business requirements, supporting testing and implementation of various technology! Are you are Critical, analytical problem solver with a proven history of building, conveying and deploying IT strategies particularly to technology-challenged colleagues? Then this job is right for you! Creates timelines for initiatives in Supply Chain, SAP-FICO regarding system functionality according to prioritization of Business User Groups. Analyzes and resolves internal manufacturing and finance business/system requirements and 3rd party vendor capabilities. Including data flow modeling, workflow analysis and functional analysis to support and identify Finance business requirements. Builds project plans, risk logs, issues log and project status reports. Develops and revises process maps, user experiences, and acceptance tests as input to system implementations and upgrades. Provides Functional Organization Support and Coordination by collaborating with partners and business specialists to develop, implement and test system functionality and impacts on other modules and provides training as required. Interacts with upper management (e.g. directors and hiring managers) as Systems Administrator for all applications to identify appropriate security and access functional requirements and ensure they are met and maintained. Coordinates with management to facilitate the hardware/software procurement process for all FICO (SAP) applications. Leads and supports multi-functional project teams through the project lifecycle for improvement and reengineering initiatives. Including finding opportunities to use system capabilities to build more efficient processes. Leads project implementation and deployment efforts and the preparation of systems/operations documentation to ensure business objectives are met. Evaluates, selects and manages Application Solution Providers and outsourced implementation /support resources. Executes licensing agreements and support contract renewals Skills/Experience: Bachelor of Arts or Bachelor of Science degree in Technology and/or business-related field with a strong ability of 5 plus years with SAP systems roll-outs, business process re-engineering and providing ongoing SAP systems support required Experience in Consumer Products industry selling through major retailing chains (Food and Beverage industry preferred) Detailed knowledge and understanding of business principles and processes with process driven analytical and critical thinking skills Sophisticated experience using Microsoft office products Highly Desired Experience with Hyland Software – OnBase document management, SAP Business Planning and Consolidation, MS Visio, and MS Project and ITIL 2.0 or 3.0 with confirmed experience leading change Motivational and dynamic leader as well as self-motivated with superb communication skills and ability to work with all levels of personnel Ability to efficiently lead in privately owned / family environment ensuring alignment with Core Values and business strategy. King's Hawaiian is an equal opportunity employer. We celebrate diversity and are committed to creating an inclusive environment for our ohana. Compensation Range: $110,000-$160,000 King's Hawaiian is an equal opportunity employer. We celebrate diversity and are committed to creating an inclusive environment for our ohana.",https://www.indeed.com/jobs?q=Business+Analyst&l=Los+Angeles%2C+CA&sc=0kf%3Aattr%28EXSNN%7CFCGTU%7CHFDVW%7CQJZM9%7CUTPWG%252COR%29explvl%28MID_LEVEL%29jt%28fulltime%29%3B&start=40&pp=gQA8AAAAAAAAAAAAAAAB_mTAHQAoAQEBEQJFpnwLNKDUMXLg3AfH9_B0JPIpEG2o1U22NJhlqseZoxBZxQAA&vjk=64983b28b764f7fb
11,9d8c61aedf0b480a,Business Analyst,"Los Angeles, CA",MID_LEVEL,MASTERS_DEGREE,FULLTIME,"Sales & Operations Planning Analyst - job post FIJI Water Company 29 reviews Los Angeles, CA • Hybrid remote $75,000 - $80,000 a year -  Full-time Apply now Apply now save-icon Job details Salary $75,000 - $80,000 a year Job Type Full-time Company Description It’s more than just water. FIJI Water is known for its iconic square bottle and unique mineral profile. Since 1996, FIJI Water has embodied what it means to be Earth's Finest Water® and is sold in more than 90 countries. FIJI Water is committed to doing business responsibly and seeking opportunities to make a difference. This means investing in sustainability, the environment, and local communities to enable positive change. We are looking for a Sales & Operations Planning Analyst to join our FIJI Water Planning team! This role is responsible for development and continuous improvement of the S&OP process for FIJI Water globally, and helps keep in balance supply and demand across all markets. The S&OP Analyst will interact with several business units at different levels within the organization by providing key information to support senior management decisions. This is a great opportunity to work and learn a unique supply chain like FIJI Water’s. This role will be reporting to the Senior Manager, Supply Planning. This full-time position is based at our HQ in Los Angeles and will work a hybrid schedule of three days in the office and two days remote work per week. Job Description Responsible to consolidate the information for S&OP monthly cycle meetings Coordinate S&OP weekly meetings and distribute key takeaways to stakeholders Maintain S&OP KPI’s, including forecast variance and forecast bias Analyze data to share accurate and actionable insights to FIJI leadership including analyzing data to balance supply and demand Standardize the process for reporting information in the S&OP ensuring that the correct information is being distributed to key contacts Work closely with supply planning and sales to identify potential forecasting & inventory problems that could be resolved with early identification and proper handling, such as inventory deficiencies or aging issues Generate scenarios as they relate to S&OP decisions Communicate new product introductions and track transitions as needed based on production and transit times Participate in cross functional projects as needed Qualifications 2+ years of experience in Demand/Supply Planning or S&OP process Advanced knowledge of PC applications, principally Excel and other MS Office products High attention to detail is a must BS/BA preferably in Supply Chain Management, Mathematics, Finance, or Business Management Ability to complete tasks independently, timely, and efficiently Proven executive presentation skills with the ability to use data for storytelling APICS/ASCM or IBF certifications a plus COVID vaccination will be required for this position unless candidate has a legally valid exemption Pay Rate: $75,000 - $80,000, and may include a discretionary bonus. Final compensation will be dependent upon skills & experience. Additional Information Competitive benefits package including Medical (including 24/7 online access to a physician), Vision, Dental and 401k with match eligibility Opportunities for development and internal mobility Manager and leadership training, biweekly L&OD webinars, and eLearning offerings Companywide problem solving and continuous improvement training Wonderful Giving (wonderfulgiving.com) - allowing you to donate company money to a cause of your choice Company focus on wellness and health FIJI® Water, natural artesian water bottled at the source in Viti Levu (Fiji islands), is the No. 1 premium imported bottled water in the United States. Known for its iconic square bottle, soft mouthfeel and unique mineral profile, FIJI Water is the water of choice among discerning consumers and top chefs. Widely available at fine restaurants and hotels, all major retail channels and through a convenient home/business delivery service, FIJI Water has expanded globally to more than 90 countries. To discover Earth’s Finest Water®, please visit www.fijiwater.com, like us on Facebook, or follow us on Instagram or Twitter. The Wonderful Company is proud to be an Equal Opportunity employer. We do not discriminate based upon race, religion, color, national origin, sex, sexual orientation, gender, gender identity, gender expression, transgender status, sexual stereotypes, age, status as a protected veteran, status as an individual with a disability, or other applicable legally protected characteristics. #LI-RD1 #LI-Hybrid EEO is the law - click here for more information If you require alternative methods of application or screening, you must approach the employer directly to request this as Indeed is not responsible for the employer's application process.",https://www.indeed.com/jobs?q=Business+Analyst&l=Los+Angeles%2C+CA&sc=0kf%3Aattr%28EXSNN%7CFCGTU%7CHFDVW%7CQJZM9%7CUTPWG%252COR%29explvl%28MID_LEVEL%29jt%28fulltime%29%3B&start=40&pp=gQA8AAAAAAAAAAAAAAAB_mTAHQAoAQEBEQJFpnwLNKDUMXLg3AfH9_B0JPIpEG2o1U22NJhlqseZoxBZxQAA&vjk=9d8c61aedf0b480a
12,3b39f446d3d68d70,Business Analyst,"Los Angeles, CA",MID_LEVEL,MASTERS_DEGREE,FULLTIME,"Salesforce Analyst/Administrator - job post RAND Corporation 60 reviews Los Angeles, CA $95,100 - $144,800 a year -  Full-time You must create an Indeed account before continuing to the company website to apply Apply on company site save-icon Job details Salary $95,100 - $144,800 a year Job Type Full-time Job Type: Regular Salesforce Administrator Overview of RAND The RAND Corporation is a nonprofit institution that helps improve policy and decision making. RAND Corporation is making a positive difference in the world by focusing on the most important issues of today, including challenges in health, education, national security, international affairs, law, business, and the environment. For over 70 years, leaders in the public and private sectors have turned to RAND for objective analysis, interdisciplinary research, and quantitative problem solving. To date, 32 recipients of the Nobel Prize have been associated with RAND at some point in their careers. RAND is continually evolving and growing our world-class computing environment in support of the computing intensive work of our Researchers. RAND invests in Information Services ensuring that you have access to the latest information technology tools. RAND Information Services is made up of exceptional professionals. We are looking for the next outstanding addition to join our team. Please review the opportunity described here as well as all of our current openings by visiting the Employment section of our website ( www.rand.org ). Beyond providing an outstanding computing environment for you, RAND offers excellent benefits, and its corporate headquarters are two blocks from the Pacific Ocean in Santa Monica, California. Other offices are in Boston, Pittsburgh, and Washington. Join us at RAND and make a positive difference in the world. The Salesforce Administrator will work directly for the Salesforce Manager and will collaborate with Office of External Affairs, Development, and Research colleagues to ensure RAND is maximizing efficiency and capitalizing on the full set of features and benefits of Salesforce based on diverse user needs. The Administrator will analyze current practices, including reporting and other business practices, and create plans for improvement that will be reviewed by the Governance Board as appropriate. The analyses will include business cases, costing, and measurement plans. The Administrator is directly responsible for the troubleshooting, support, and administration of the Salesforce system. Administration duties include implementing and monitoring practices defined by the Salesforce Governance Board and Executive Committee, as well as ensuring Information Security and regulatory compliance. The Administrator is also responsible for basic system maintenance, such as custom fields, dashboards, reports, flows, page layouts, and to ensure proper usage and integration of Salesforce as a part of a larger enterprise suite of applications. Additionally, the Administrator is responsible for ongoing data maintenance, importing, and strategies. The Administrator provides user support, including access, troubleshooting, and training. Other duties of the Administrator include managing third-party applications, testing changes, maintaining system documentation, and researching then implementing best practices. Qualifications Hands-on and leadership experience with Salesforce, with 1 – 3 years of Salesforce Administrator experience. Preference to candidates with in-depth knowledge of the Nonprofit Success Pack and implementation of custom fields, custom coding, and integrations. Strong reporting background using standard reporting tools including standard Salesforce reporting functionality, Apsona Multi-Step Reports, Apsona standard ETL tool, Click & Pledge, Soapbox Events, and other third-party applications. Experience updating an existing Salesforce.com configuration to provide solutions for reporting, flow and enhanced functions. Strong problem solving skills with data and software applications. Strong analytic skills demonstrated in process mapping and re-engineering. High-level technical understanding of data systems and integrations. Proven experience leading collaborative efforts with complex business and system requirements across an enterprise comprised of diverse business units. Excellent written and oral communication skills with the ability to effectively communicate with information technology professionals as well as very well-educated researchers in various fields. Education and Certification Requirements Either Bachelor’s degree in Computer Science, Software Engineering, Business Analysis, or a related field or experience with Salesforce at a nonprofit is required. Salesforce.com Administrator certification is required. Experience Minimum 3 years of data management, business analysis, or information technology experience with 2 or more years working with Salesforce. Requires advanced to expert level of knowledge and understanding of Salesforce and third-party applications. Security Clearance This position requires the ability to obtain and maintain a DOD security clearance. Location Santa Monica, Pittsburgh, or 100% Remote Salary range: $95,100 - $144,800 RAND considers a variety of factors when formulating an offer, including but not limited to, the specific role and associated responsibilities; a candidate’s work experience, education/training, skills, expertise; and internal equity. The salary range includes base pay plus RAND’s sabbatic pay (which provides additional compensation above base pay when vacation is taken). In addition, RAND provides strong benefits including health insurance coverage, life and disability insurance, savings plan, paid time-off and more. Positions Open One Equal Opportunity Employer: race/color/religion/sex/sexual orientation/gender identity/national origin/disability/vet",https://www.indeed.com/jobs?q=Business+Analyst&l=Los+Angeles%2C+CA&sc=0kf%3Aattr%28EXSNN%7CFCGTU%7CHFDVW%7CQJZM9%7CUTPWG%252COR%29explvl%28MID_LEVEL%29jt%28fulltime%29%3B&start=40&pp=gQA8AAAAAAAAAAAAAAAB_mTAHQAoAQEBEQJFpnwLNKDUMXLg3AfH9_B0JPIpEG2o1U22NJhlqseZoxBZxQAA&vjk=3b39f446d3d68d70
13,b360a6db69837a5c,Business Analyst,"Los Angeles, CA",MID_LEVEL,MASTERS_DEGREE,FULLTIME,"Senior Sales Analyst - job post Vista Search Partners Vista Search Partners in Pasadena, CA 91106 $90,000 - $130,000 a year -  Full-time Responded to 51-74% of applications in the past 30 days, typically within 8 days. Apply now Apply now save-icon Job details Salary $90,000 - $130,000 a year Job Type Full-time JOB DESCRIPTION- Consumer Packaged Goods Experience REQUIERED SALES ANALYST Employment: Full-Time Regular Status FLSA Status: Non-Exempt Schedule: Hours my vary depending on production Summary: The Sales Analyst is primarily responsible for processing sales data to achieve overall sales goals, growth, and profitability. Reporting Relationship: The Sales Analyst will have direct-line accountability to the Department Head and Account Executives. Essential Duties and Responsibilities: The following are the essential duties and responsibilities of the Sales Analyst. · Utilize IRI Worldwide data for CPG and translate into valid sales trends. · Create useful reports for and communicate to sales staff. · Use proprietary software (Famous) · Track review and process sales data · Act as a liaison between analytical team and sales team · Communicate availability, pricing structure, sales & marketing strategies and opportunities. · Maintain a safe and professional work area. · Represent Company in an ethical and business-like professional manner in all interactions with customers, suppliers, co-workers and the business community at large. · Provide professional service in a fast-paced environment, with a focus on process improvement and contribution to improving teamwork and workflow. Qualifications: The qualifications listed below are representative of the knowledge, skills and abilities required, unless specified otherwise. Reasonable accommodations may be made to enable individuals with disabilities to preform essential functions of the job. · A minimum of 3 to 5 years of experience with Sales Analytics and Syndicated Data · Familiarity with Consumer-Packaged Goods · Ability to access and utilize data from IRI Worldwide · Bachelor’s degree · Strong organizational and planning skills. · Detail-oriented, specifically with respect to data and record keeping. · Highly motivated, pro-active self-starter with the ability to solve problems in a resolute manner. · Ability to manage accounts effectively to meet targets and deadlines. · Strong written and verbal communication skills. Bilingual a plus · Proficient in MS Office (Word, Excel, Power Point, etc) Job Type: Full-time Pay: $90,000.00 - $130,000.00 per year Benefits: 401(k) 401(k) matching Dental insurance Health insurance Paid time off Vision insurance Schedule: Monday to Friday Weekend availability Supplemental pay types: Bonus pay Ability to commute/relocate: Pasadena, CA 91106: Reliably commute or planning to relocate before starting work (Required) Experience: Consumer Packaged Goods: 2 years (Required) IRI Data Analysis: 2 years (Required) Work Location: In person Health insurance If you require alternative methods of application or screening, you must approach the employer directly to request this as Indeed is not responsible for the employer's application process.",https://www.indeed.com/jobs?q=Business+Analyst&l=Los+Angeles%2C+CA&sc=0kf%3Aattr%28EXSNN%7CFCGTU%7CHFDVW%7CQJZM9%7CUTPWG%252COR%29explvl%28MID_LEVEL%29jt%28fulltime%29%3B&start=40&pp=gQA8AAAAAAAAAAAAAAAB_mTAHQAoAQEBEQJFpnwLNKDUMXLg3AfH9_B0JPIpEG2o1U22NJhlqseZoxBZxQAA&vjk=b360a6db69837a5c&advn=7200104927301033
14,181fb989705a6c12,Business Analyst,"Los Angeles, CA",MID_LEVEL,MASTERS_DEGREE,FULLTIME,"Sr. Healthcare Business Analyst - job post AltaMed Health Services Corporation 370 reviews 1401 North Montebello Boulevard, Montebello, CA 90640 Full-time Apply now Apply now save-icon Job details Job Type Full-time Overview: The Senior Business Analyst leads and evaluates analysis to produce business solutions. The Senior Business Analyst evaluates, analyzes and recommends optimal business solutions and leads other Business Analysts. This position will develop and manage project-based deliverables that include: process mapping, gathering business requirements, gathering and reporting operational metrics, project financial and operational analysis/reporting. He/she will also support peers and management to interpret performance data and develop recommendations for to improve business operations. The individual will work as part of a team supporting enterprise business software applications and infrastructure projects. Responsibilities: Strategize with business units to identify optimal solutions, while leveraging existing enterprise platforms and relevant prior work for best value Conduct analysis of business processes: current state analysis, gap analysis, benchmarking, best practices identification Facilitate business unit understanding of technical capabilities of enterprise applications through discussions and by conducting or coordinating demonstrations Interface with internal customers to formulate and define scope and objectives based on both user needs and a thorough understanding of business systems and industry requirements; consider business application of technology to both current and future business environment Conduct research and synthesize information to substantiate recommendations Communicate with management, personnel and vendors to coordinate activities and programs; resolve issues and conflicts and exchange information; respond to various requests for information from internal/external sources Develop detailed application, product, and/or tool selection evaluation criteria based on identified product requirements Engage vendor partners to assist in complex solutions where appropriate Examine best practices and monitor industry trends in various fields to accomplish business objectives Recommend and provide guidance on departmental process improvements Create and disseminate periodic guidance on security and information to optimize application usage Perform other duties as assigned. Qualifications: Bachelor’s degree in business, health care, statistics, organizational management or related field required Minimum 5 years of experience in business analysis, project coordination activities and designing end-to-end business processes in an outpatient clinic setting and/or enterprise support department Understanding of process improvement methodology (e.g. Lean, Six Sigma, or TQM) preferred If you require alternative methods of application or screening, you must approach the employer directly to request this as Indeed is not responsible for the employer's application process.",https://www.indeed.com/jobs?q=Business+Analyst&l=Los+Angeles%2C+CA&sc=0kf%3Aattr%28EXSNN%7CFCGTU%7CHFDVW%7CQJZM9%7CUTPWG%252COR%29explvl%28MID_LEVEL%29jt%28fulltime%29%3B&start=40&pp=gQA8AAAAAAAAAAAAAAAB_mTAHQAoAQEBEQJFpnwLNKDUMXLg3AfH9_B0JPIpEG2o1U22NJhlqseZoxBZxQAA&vjk=181fb989705a6c12
