,job_id,job_title,location,experience,education,job_type,job_description,job_link
0,37a0b4cec3abb619,Cloud Engineer,"San Francisco, CA",ENTRY_LEVEL,BACHELORS_DEGREE,FULLTIME,"Software Engineer - Cloud Infrastructure - job post Verkada 4 reviews San Mateo, CA 94401 Full-time You must create an Indeed account before continuing to the company website to apply Apply on company site save-icon Job details Job Type Full-time Who We Are Verkada is the largest cloud-based B2B physical security platform company in the world. Only Verkada offers seven product lines — video security cameras, access control, environmental sensors, alarms, visitor management, mailroom management and intercoms — integrated with a single cloud-based software platform. Designed with simplicity and scalability in mind, Verkada gives organizations the real-time insight to know what could impact the safety and comfort of people throughout their physical environment, while empowering them to take immediate action to minimize security risks, workplace frustrations and costly inefficiencies. Founded in 2016 with more than $360M in funding raised to date, Verkada has expanded rapidly with 14 offices across three continents, 1,500+ full-time employees and 15,700+ customers across 70+ countries, including 43 companies in the Fortune 500. Responsibilities Design and develop abstraction over services in public cloud platforms (AWS, Azure, GCP). Design and develop solutions using containers and modern orchestration systems. Manage and expand our multi-region, interconnected Kubernetes cloud infrastructure through Infrastructure as Code (we use Terraform) Build and maintain highly scalable and user friendly observability systems Design cloud components to operate in a secure, cost-efficient and reliable manner Be a force multiplier by sharing infrastructure knowledge and advocating for best practices across the entire organization Work with architects, product managers, and software engineers across teams in a highly collaborative environment. Qualifications Bachelor of Science in Computer Science, Computer Engineering, or related fields. Strong understanding of Computer Science fundamentals. High proficiency in coding with Python, Golang or other similar languages Experience with version control systems such as Git. Experience with large-scale distributed systems. Experience working with large-scale orchestration systems on multi-node cluster architectures. Thrive in a fast-paced, dynamic environment and value end-to-end ownership of projects. Intellectually curious and open to challenges. Preferred Experience working with a major public cloud platform (AWS, Azure, GCP). Experience with Amazon EKS, Azure AKS and/or Google GKE. Experience using Infrastructure as Code tools such as Terraform, AWS CloudFormation, etc. Experience building and/or maintaining observability stacks such as Datadog, New Relic, AWS Cloudwatch, etc. Strong experience with modern container orchestration systems such as Kubernetes, Mesos, Swarm. Experience working with service meshes such as Istio, Consul or Linkerd. US Perks & Benefits Generous company paid medical, dental & vision insurance coverage Unlimited paid time off & 11 companywide paid holidays Wellness allowance Commuter benefits Healthy lunches and dinners provided daily Paid parental leave policy & fertility benefits Verkada is an equal opportunity employer. We strive to be a welcoming place for everyone, and we do our best to make sure all people feel supported and connected at work. A big part of that effort is support for members and allies of our internal communities like Women at Verkada, Pride at Verkada, Multicultural at Verkada, and Parents at Verkada.",https://www.indeed.com/jobs?q=Cloud+Engineer&l=San+Francisco%2C+CA&sc=0kf%3Aattr%28FCGTU%7CHFDVW%7CQJZM9%7CUTPWG%252COR%29explvl%28ENTRY_LEVEL%29jt%28fulltime%29%3B&vjk=37a0b4cec3abb619
1,907ed5cbb92c73e6,Cloud Engineer,"San Francisco, CA",ENTRY_LEVEL,BACHELORS_DEGREE,FULLTIME,"Software Engineer, Infrastructure - job post rockset San Mateo, CA $120,000 a year -  Full-time You must create an Indeed account before continuing to the company website to apply Apply on company site save-icon Job details Salary $120,000 a year Job Type Full-time ABOUT ROCKSET At Rockset, we’ve built the real-time analytics database for the world's data applications. Our team and technology come from a rich heritage, rooted in the experience of building massive scale data systems at the world’s leading companies, and we created Rockset to make those kinds of powerful data platforms available to real-time application developers everywhere. We are creating a world where developers can go from complex data sets to fast, interactive applications and analysis effortlessly. We’re a fast-growing company that values curiosity, diversity, and open-mindedness. You will solve interesting problems, surrounded by exceptional people, while making customers happy. We work hard, but also take our personal lives and experiences seriously. We are backed by Greylock Partners and Sequoia Capital, and headquartered in San Mateo, CA with offices in Boston, MA and London, UK and remote employees throughout the US. ABOUT THE OPPORTUNITY We are looking for people who are excited by distributed systems and database technologies. Expect to have a lot of influence over the system we are creating. You should be curious and ready to deep dive into designing scalable distributed systems. You will contribute to the design and development of key backend features and components and participate in building infrastructure components from the ground up. You'll contribute to an architecture that anticipates large deployments and can handle scale and design clean, usable APIs. Our ideal candidate will have passion for crafting exceptional engineering solutions, striving for improving performance and helping customers succeed. The US base salary range for this full-time position is $120,000/year to $160,000/year + equity + benefits. The actual pay may vary based on factors such as location, experience, and skills. Final salary will be commensurate with the candidate’s level and location. This range represents base salary only. You'd be a great fit, if you have: Bachelor’s and/or Master’s degree in Computer Science or related field Experience with designing distributed systems is a plus Experience with systems like Kubernetes, Kafka and Zookeeper is a plus Experience with Linux, containers and virtual machines is a plus Strong communication skills to be used across engineering, product and other functional teams Benefits: Competitive salary & equity at a fast-growing startup Fully funded comprehensive medical, dental, and vision coverage Fertility HRA available to employees and their families Lunch provided every day Flexible schedule Flexible paid time off (we encourage 3 weeks a year) Paid parental leave Work from Tahoe week, where for 1 work week the entire company temporarily relocates to Tahoe Fun office environment with TGIF happy hours, board game nights, picnics and BBQs Whatever equipment you need to get the job done OUR COMMITMENT TO DIVERSITY We are an equal opportunity employer and value diversity at our company. We do not discriminate on the basis of race, religion, color, national origin, gender, sexual orientation, age, marital status, veteran status, or disability status.",https://www.indeed.com/jobs?q=Cloud+Engineer&l=San+Francisco%2C+CA&sc=0kf%3Aattr%28FCGTU%7CHFDVW%7CQJZM9%7CUTPWG%252COR%29explvl%28ENTRY_LEVEL%29jt%28fulltime%29%3B&vjk=907ed5cbb92c73e6
2,9db6bb88186c4fa8,Cloud Engineer,"San Francisco, CA",ENTRY_LEVEL,BACHELORS_DEGREE,FULLTIME,"Infrastructure Engineer II - job post Sutter Health 1,834 reviews San Francisco, CA • Remote $47.89 - $71.83 an hour -  Full-time You must create an Indeed account before continuing to the company website to apply Apply on company site save-icon Job details Salary $47.89 - $71.83 an hour Job Type Full-time Organization: SHSO-Sutter Health System Office-Bay Position Overview: Participates in the development of enterprise technology, solutions, systems, storage, network and telecommunications engineering designs that are used as a basis for consolidating and standardizing infrastructure throughout Sutter Health and its affiliates. Participates in interpreting architecture requirements, design, product evaluations, selection, configuration, installation, testing and integration of new technology in order to better support the needs of Sutter Health and its affiliates. Heavily involved in human-interface computing devices and their integration with clinical and technical workflows and infrastructure. Job Description : EDUCATION Equivalent experience will be accepted in lieu of the required degree or diploma. Associate's: Information Systems Technical field or equivalent education/experience PREFERRED EXPERIENCE AS TYPICALLY ACQUIRED IN: 1 year poject management experience. 1 year proven experience in the engineering, implementation, operation, maintenance, and support of a wide range of server platforms, networking and/or storage devices. 1 year working with change management practices. SKILLS AND KNOWLEDGE Ability to analyze information, problems, situations, practices, or procedures in order to identify relevant concerns and factors. Establish and maintain cooperative working relationships with clients, information services (IS) team members, management, and executive personnel/staff. Verbal and writing skills to effectively communicate with diverse groups such as: executives, managers, and subject matter experts. Use basic English words and phrases to effectively and clearly organize and communicate thoughts and ideas. Organize workflow to accomplish established objectives. Prioritize assignments to complete work in a timely manner. Work independently and follow through on assignments with minimal direction. Work as part of a team or collaborate with colleagues from different departments to achieve a common goal or to gain better understanding of client needs. Perform effectively in environments with frequent and fluctuating workload changes, competing demands, and frequent interruptions and/or distractions. DEPARTMENT SPECIFIC SKILLS AND KNOWLEDGE Department: Network specialty, Network infrastructure which may include: converged internet protocol (IP) networks, wireless local area network (WLAN), wide area network (WAN)/metropolitan area network (MAN), local area network (LAN), virtual private network (VPN)/Firewall. Transmission control protocol (TCP)/IP and open systems interconnection (OSI) model. Routing protocol – enhanced interior gateway routing protocol (EiGRP), open shortest path first (OSPF), border gateway protocol (BGP). frame relay/asynchronous transfer mode (FR/ATM), point-to-point protocol (PPP), high-level data link control (HDLC), multi-link point-to-point protocol (MLPPP) and virtual local area network (VLAN). digital signal and transmission line (DS3/T3), DS1/T1, fast Ethernet (FAST E), gigabit Ethernet (Gig E), 10 gigabit Ethernet (10 Gig E). Pay Range: $47.89-$71.83 The salary range for this role may vary above or below the posted range as determined by location. This range has not been adjusted for any specific geographic differential applicable by area where the position may be filled. Compensation takes into account several factors including but not limited to a candidate’s experience, education, skills, licensure and certifications, department equity, training and organizational needs. Base pay is just one piece of the total rewards program offered by Sutter Health. Eligible roles also qualify for a comprehensive benefits package. Job Shift : Days Schedule : Full Time Shift Hours: 8 Days of the Week: Friday, Monday, Thursday, Tuesday, Wednesday Weekend Requirements: None Benefits: Yes Unions: No This position is work from home eligible. Position Status: Non-Exempt Weekly Hours: 40 Employee Status: Regular Number of Openings: 1 Sutter Health is an equal opportunity employer EOE/M/F/Disability/Veterans.",https://www.indeed.com/jobs?q=Cloud+Engineer&l=San+Francisco%2C+CA&sc=0kf%3Aattr%28FCGTU%7CHFDVW%7CQJZM9%7CUTPWG%252COR%29explvl%28ENTRY_LEVEL%29jt%28fulltime%29%3B&vjk=9db6bb88186c4fa8
3,bf97e10c704a91c9,Cloud Engineer,"San Francisco, CA",ENTRY_LEVEL,BACHELORS_DEGREE,FULLTIME,"Site Reliability Engineer - Infrastructure - job post Verkada 4 reviews San Mateo, CA 94401 Full-time You must create an Indeed account before continuing to the company website to apply Apply on company site save-icon Job details Job Type Full-time Who We Are Verkada is the largest cloud-based B2B physical security platform company in the world. Only Verkada offers seven product lines — video security cameras, access control, environmental sensors, alarms, visitor management, mailroom management and intercoms — integrated with a single cloud-based software platform. Designed with simplicity and scalability in mind, Verkada gives organizations the real-time insight to know what could impact the safety and comfort of people throughout their physical environment, while empowering them to take immediate action to minimize security risks, workplace frustrations and costly inefficiencies. Founded in 2016 with more than $360M in funding raised to date, Verkada has expanded rapidly with 14 offices across three continents, 1,500+ full-time employees and 15,700+ customers across 70+ countries, including 43 companies in the Fortune 500. We are actively looking for a talented Site Reliability Engineer to join the Infrastructure team. As a member of the infrastructure team, your role will be to manage this infrastructure and continue to make it easier for our team to monitor and scale it, be it by adopting 3rd party tools or design your own. Example projects include optimizing our cluster cost efficiency, enforcing security requirements, improving monitoring and alerting, and adopting a service mesh. Responsibilities Keep our infrastructure up! Improve infrastructure automation Define infrastructure roadmap Provide technical support for engineers on other teams Requirements Must have a BS, MS, or PhD in Computer Science, or similar technical field of study Minimum of 1-2+ years of experience in a similar position Experience in at least one scripting language (preferably Python) Experience with one of the major cloud platforms (preferably AWS) Experience with Kubernetes Experience with Terraform Enthusiasm for learning about new technologies and tooling Nice to have Experience with ArgoCD Experience writing Kubernetes controllers Experience with service mesh Perks & Benefits Generous company paid medical, dental & vision insurance coverage Unlimited paid time off & 11 companywide paid holidays Wellness allowance Commuter benefits Healthy lunches and dinners provided daily Generous paid parental leave policy & fertility benefits Verkada is an equal opportunity employer. We strive to be a welcoming place for everyone, and we do our best to make sure all people feel supported and connected at work. A big part of that effort is support for members and allies of our internal communities like Women at Verkada, Pride at Verkada, Multicultural at Verkada, and Parents at Verkada.",https://www.indeed.com/jobs?q=Cloud+Engineer&l=San+Francisco%2C+CA&sc=0kf%3Aattr%28FCGTU%7CHFDVW%7CQJZM9%7CUTPWG%252COR%29explvl%28ENTRY_LEVEL%29jt%28fulltime%29%3B&vjk=bf97e10c704a91c9
4,f90cb3e726b4410f,Cloud Engineer,"San Francisco, CA",ENTRY_LEVEL,BACHELORS_DEGREE,FULLTIME,"DevOps Engineering – Engineer II - job post FICO 187 reviews San Rafael, CA $84,000 - $132,000 a year -  Full-time You must create an Indeed account before continuing to the company website to apply Apply on company site save-icon Job details Salary $84,000 - $132,000 a year Job Type Full-time FICO (NYSE: FICO) is a leading global analytics software company, helping businesses in 90+ countries make better decisions. Join our world-class team today and fulfill your career potential! The Opportunity “A DevOps role at FICO is an opportunity to work with cutting edge cloud technologies with a team focused on delivery of secure cloud solutions and products to enterprise customers.” - VP, DevOps Engineering What You’ll Contribute Collaborate in a devops environment where you will work closely with developers in automating new applications, features, and services. Support enterprise standards around technology, security compliance and systems interoperability for FICO products/solutions. Assist in developing scripts to automate development operations functions or processes –Cloud Infrastructure Automation & Orchestration. Research and implement automation tools to replace existing manual processes and maintenance tasks. Collaborate with other engineers on design, analysis, architecture/modeling, implementation, unit testing, code reviews and process enhancements. Optimize performance and scalability as necessary to meet business goals. Deliver customer solutions using open source and commercial technologies. Deliver full automation pipeline using CI/CD/DevOps concepts, tools and technologies (Jenkins, Maven/Gradle, Git/Stash, Nexus, Puppet/Chef). What We’re Seeking Bachelor's degree or equivalent in Electronic Engineering, Computer Science or related field. Experience in a computer engineering position or related occupation. Experience operating highly-available, redundant, public cloud architectures solutions utilizing IaaS and PaaS. Drive engineering automation from CI/CD, infrastructure provisioning, monitoring & alerting to developer support. Our Offer to You A culture and work environment strongly reflecting our core values: Act Like an Owner, Delight Our Customers and Earn the Respect of Others. The opportunity to make a difference by leveraging your unique strengths. Highly competitive compensation and rewards. Flexible work options, opportunities to give back to your community, social events with colleagues and a comprehensive benefits program inclusive of progressive parental leave. The targeted base pay range for this role is: $84,000 to $132,000 with this range reflecting differences in candidate knowledge, skills and experience. #LI-DA1 Why Make a Move to FICO? At FICO, you can develop your career with a leading organization in one of the fastest-growing fields in technology today – Big Data analytics. You’ll play a part in our commitment to help businesses use data to improve every choice they make, using advances in artificial intelligence, machine learning, predictive and prescriptive modeling, and much more. FICO makes a real difference in the way businesses operate worldwide: Credit Scoring — 150+ billion FICO Scores have been sold to date, making it the most used credit score in the world. Fraud Detection and Security — 2.6+ billion payment cards globally are protected by FICO fraud systems. Lending — 3/4 of US mortgages are approved using the FICO Score. Anti-Money Laundering — our solutions check more than half a billion transactions a day to prevent criminal schemes such as terrorist financing Global trends toward digital transformation have created tremendous demand for FICO’s solutions, placing us among the world’s top 100 software companies by revenue. We support many of the world’s largest banks, insurers, retailers, telecommunications providers and other firms reach a new level of success. Our success is dependent on really talented people – just like you – who thrive on the collaboration and innovation that’s nurtured by a diverse and inclusive environment. We’ll provide the support you need, while ensuring you have the freedom to develop your skills and grow your career. Join FICO and help change the way business thinks! Learn more about how you can fulfill your potential at www.fico.com/Careers FICO promotes a culture of inclusion and seeks to attract a diverse set of candidates for each job opportunity. We are an equal employment opportunity employer and we’re proud to offer employment and advancement opportunities to all candidates without regard to race, color, ancestry, religion, sex, national origin, pregnancy, sexual orientation, age, citizenship, marital status, disability, gender identity or Veteran status. Research has shown that women and candidates from underrepresented communities may not apply for an opportunity if they don’t meet all stated qualifications. While our qualifications are clearly related to role success, each candidate’s profile is unique and strengths in certain skill and/or experience areas can be equally effective. If you believe you have many, but not necessarily all, of the stated qualifications we encourage you to apply.",https://www.indeed.com/jobs?q=Cloud+Engineer&l=San+Francisco%2C+CA&sc=0kf%3Aattr%28FCGTU%7CHFDVW%7CQJZM9%7CUTPWG%252COR%29explvl%28ENTRY_LEVEL%29jt%28fulltime%29%3B&vjk=f90cb3e726b4410f
5,900f6ce2ec8f6ad8,Cloud Engineer,"San Francisco, CA",ENTRY_LEVEL,BACHELORS_DEGREE,FULLTIME,"Senior/Staff Software Engineer, Mission Planning - job post Zoox (part of Amazon.com) 9 reviews Foster City, CA $210,000 - $319,000 a year -  Full-time You must create an Indeed account before continuing to the company website to apply Apply on company site save-icon Job details Salary $210,000 - $319,000 a year Job Type Full-time The Mission Planner team at Zoox is responsible for generating the high level route our autonomous vehicles will take to transport passengers to their destination. By working closely with our cloud services team to facilitate pickup and drop off requests along with live traffic data among other inputs, and integrating closely with the decision making and trajectory planning and controls teams to allow dynamic planning this team will enable the core ability for our vehicles to choose the best routes through cities and adapt in real time. We are looking for an engineer who is excited to solve the complexities of mission planning in dynamic cities, by contributing novel solutions to the architecture and design and driven to take ownership of major software components. If you like to work close to the robot platform and enjoy experiencing your developed software in the robot, we would like to hear from you. Responsibilities You will develop mission planner algorithms, including graph search and integration with behavioral planning You will Integrate and test your developed applications in the robot, learn and make improvements. You will work collaboratively with passionate team members to support the integration of software components from all teams throughout Zoox. You will set the short and long term technical direction for the team and collaborate on the broader company-wide directions You will coordinate cross-functional initiatives with other teams across Mission Planning, Behavioral Planning and Cloud Services. Qualifications BS/MS in Computer Science or a related field Programming skills in C++ Understanding and experience with a variety of graph search techniques (A*, D*, Dijkstra …) Demonstrated ability to write code for a shipped product (commercial robotics, drones, consumer devices, automotive) Ability to work on multiple layers of the autonomous driving compute stack Bonus Qualifications PhD in computer science or related field Experience with autonomous robots Compensation There are three major components to compensation for this position: salary, Amazon Restricted Stock Units (RSUs), and Zoox Stock Appreciation Rights. The salary will range from $210,000 to $319,000. A sign-on bonus may be part of a compensation package. Compensation will vary based on geographic location, job-related knowledge, skills, and experience. Zoox also offers a comprehensive package of benefits including paid time off (e.g. sick leave, vacation, bereavement), unpaid time off, Zoox Stock Appreciation Rights, Amazon RSUs, health insurance, long-term care insurance, long-term and short-term disability insurance, and life insurance. Vaccine Mandate Employees working in this position will be required to have received a single dose of the J&J/Janssen COVID-19 vaccine OR have completed the two-dose Pfizer or Moderna vaccine series. In addition, employees will be required to receive a COVID-19 booster vaccine within two months of becoming eligible for the booster vaccine. Employees will be required to show proof of vaccination status upon receipt of a conditional offer of employment. That offer of employment will be conditioned upon, among other things, an Applicant’s ability to show proof of vaccination status. Please note the Company provides reasonable accommodations in accordance with applicable state, federal, and local laws. About Zoox Zoox is developing the first ground-up, fully autonomous vehicle fleet and the supporting ecosystem required to bring this technology to market. Sitting at the intersection of robotics, machine learning, and design, Zoox aims to provide the next generation of mobility-as-a-service in urban environments. We’re looking for top talent that shares our passion and wants to be part of a fast-moving and highly execution-oriented team. Follow us on LinkedIn A Final Note: You do not need to match every listed expectation to apply for this position. Here at Zoox, we know that diverse perspectives foster the innovation we need to be successful, and we are committed to building a team that encompasses a variety of backgrounds, experiences, and skills.",https://www.indeed.com/jobs?q=Cloud+Engineer&l=San+Francisco%2C+CA&sc=0kf%3Aattr%28FCGTU%7CHFDVW%7CQJZM9%7CUTPWG%252COR%29explvl%28ENTRY_LEVEL%29jt%28fulltime%29%3B&vjk=900f6ce2ec8f6ad8
