,job_id,job_title,location,experience,education,job_type,job_description,job_link
6,81c72d8af80ba14b,Cloud Engineer,"San Francisco, CA",ENTRY_LEVEL,BACHELORS_DEGREE,FULLTIME,"Senior Civil/Electrical/Mechanical Engineer (Facilities Maintenance & Operations) - job post EBMUD 11 reviews Oakland, CA 94607 • Hybrid remote $165,960 - $192,108 a year -  Full-time You must create an Indeed account before continuing to the company website to apply Apply on company site save-icon Job details Salary $165,960 - $192,108 a year Job Type Full-time The Position East Bay Municipal Utility District’s (EBMUD’s) Facilities Maintenance and Construction Division, part of the Operations and Maintenance Department (OMD), is seeking a highly qualified individual with exceptional technical, interpersonal and communication skills. The individual selected will supervise personnel in the Plant Engineering Services Section and will report to the Manager of Facilities Maintenance and Construction. The ideal candidate is well prepared to: Provide leadership and motivation to a multi-disciplinary staff Plan, schedule, assign, supervise and evaluate the work of staff engineers, planners, administrative support staff, and consultants Provide technical support for other divisions within OMD Manage asset lists and maintenance and job plan development for capital improvements. Coordinate section activities with other EBMUD sections, consultants, contractors, representatives of other agencies, and work collaboratively to provide timely and efficient service Supervise special planning, engineering studies, and investigations Respond to changing demands with flexibility and innovation Manage and prioritize multiple competing interests with diplomacy and tact Establish and implement performance and quality control standards Communicate effectively both orally and in writing A flexible/hybrid work from home schedule may be available for some positions in this job classification. The salary range is $13,830 per month increasing to $14,521, $15,247, and $16,009 after 6, 18, and 30 months, respectively. EBMUD is an Equal Opportunity Employer. All qualified candidates will receive consideration for employment without regard to race, color, religion, creed, sex, gender, gender identity (including transgender status), gender expression, marital or registered domestic partnership status, age for individuals age forty or older, national origin, ancestry, disability (mental or physical), medical condition (cancer and genetic characteristics), genetic information, sexual orientation, military and veterans status, family or medical leave status, pregnancy (including childbirth, lactation or related medical condition), pregnancy disability leave status, domestic violence victim status, political affiliation, and other categories protected by federal, state and/or local laws. Requirements 1. A bachelor’s degree in a civil, electrical, environmental, or mechanical engineering curriculum which is accredited by ABET or a California EIT certificate. 2. A minimum of six years of professional engineering experience* including two years of experience comparable to, or higher than, EBMUD’s Associate Engineer class. 3. Registration as a Civil, Electrical, or Mechanical Professional Engineer in the state of California. 4. Must possess a valid California driver’s license and have a satisfactory driving record; must be willing to work beyond normal work hours when needed; and must possess the physical characteristics to perform the critical and important duties of the position. An advanced degree in an accredited engineering curriculum may be substituted for one year of the required experience. Please note: EBMUD requires all employees to provide written proof of vaccination. Those employees with sincerely held religious beliefs or valid medical reasons, as determined by EBMUD, will be exempt from vaccination requirements. Contact EBMUD Human Resources for additional questions. Equivalent combinations of education and experience may be considered. To be considered under the “equivalent combination of education and experience” provision, it is your responsibility to include in your application materials written evidence of employment performed at the level of the typical duties of this position and/or coursework in subject areas directly related to this position. For more information, see our FAQ page at http://www.ebmud.com/jobs/job-resources/job-faqs-frequently-asked-questions/. The Selection Process 1. Submit a completed EBMUD application and the required supplemental question responses online at www.ebmud.com by 4:30 p.m., Friday, April 7, 2023. Only application materials submitted online during the filing period will be accepted. 2. Candidates must achieve a passing score on each test part in order to advance to the next step in the selection process. 3. All qualified applications and supplemental responses will be competitively evaluated, with those candidates receiving a passing score to be invited to a panel interview scheduled for April or May 2023. 4. Successful candidates will be placed on the hiring list, based on rank, for further consideration to fill the current regular vacancy, as well as others occurring over the next 12 to 24 months. 5. The probation period for this position is 12 months. For those holding civil service status the probation period is 6 months. 6. All employment offers are conditional, pending the results of a Live Scan background screening. All selected finalists must participate in the Live Scan background screening process to remain in consideration for EBMUD employment. Supplemental Information As the first step in the selection process, responses to the supplemental questions must be submitted online with the regular EBMUD application. Please provide thorough, accurate descriptions of assignments you have personally performed. Should you respond with comments such as “see application” or “see resume” instead of addressing the questions directly, your application may not be considered. Our excellent benefits package includes: Eligibility for annual merit-based bonus pay program; 12 days paid vacation; 16 holidays; 7 days paid administrative leave; 13 days paid sick leave; Family health insurance (choice of Kaiser fully paid or Sutter Health Plus or Anthem Blue Cross 85% paid); Fully paid family dental and vision care plans; life insurance; long-term disability insurance; EBMUD Retirement Plan (reciprocal with CalPERS); $1,000/yr. contributed to flexible spending account or cash; $145/mo. public transit subsidy; 401(k), 401(a) and 457(b) tax-deferred retirement plans; Roth 401(k); $3,500/yr. tuition reimbursement; And opportunities for professional growth including training and career development.",https://www.indeed.com/jobs?q=Cloud+Engineer&l=San+Francisco%2C+CA&sc=0kf%3Aattr%28FCGTU%7CHFDVW%7CQJZM9%7CUTPWG%252COR%29explvl%28ENTRY_LEVEL%29jt%28fulltime%29%3B&vjk=81c72d8af80ba14b
7,f6b01c75f133f008,Cloud Engineer,"San Francisco, CA",ENTRY_LEVEL,BACHELORS_DEGREE,FULLTIME,"Software Engineer - HD Mapping Infrastructure - job post Zoox (part of Amazon.com) 9 reviews Foster City, CA $160,000 - $225,000 a year -  Full-time You must create an Indeed account before continuing to the company website to apply Apply on company site save-icon Job details Salary $160,000 - $225,000 a year Job Type Full-time Our Calibration, Localization, and Mapping (CLAMS) team is responsible for building the algorithms and tools necessary for keeping Zoox vehicles well calibrated, always knowing where they’re located within the world, and aware of their environment. Without precise calibration, localization, and mapping our vehicles would be at a disadvantage when it comes to perceiving and reasoning about the surrounding world, and is therefore foundational in enabling results from many other teams across Zoox. This work is critical for scaling autonomous driving in a safe and reliable way. We are looking for engineers who are ambitious and excited about helping Zoox deliver on its goals to deliver autonomous mobility. Responsibilities One of the most critical ways a self driving car localizes is using a high definition 3D map. As a Mapping Backend Software Engineer, you will design and develop essential production-ready components of our 3D mapping pipeline. You’ll further automate the scalable backend that produces our large-scale 3D maps, as well as mature our map validation system, test, metrics, and release frameworks. You’ll also enhance our map content interface consumed by downstream customers, such as our own Localization team and the Road Network team. The architecture you build will enable us to easily produce new high-fidelity map content at enormous scales in parallel, while delivering rapid updates to small areas where the map is out of date. Qualifications Bachelors in Computer Science or related field 7+ years C++ 11 or newer experience Passion for code correctness, testability, modularity, and elegant architectures Drive to build a highly scalable mapping system Experience working with cloud and web technologies (AWS, S3, EC2, SQL, HTML, JS, CSS) Experience handling large data sets efficiently Bonus Qualifications Experience working with geographic data Familiarity with SLAM Strong mathematical skills Experience designing metrics and knowledge of statistics Compensation There are three major components to compensation for this position: salary, Amazon Restricted Stock Units (RSUs), and Zoox Stock Appreciation Rights. The salary will range from $160,000 - $225,000. A sign-on bonus may be part of a compensation package. Compensation will vary based on geographic location, job-related knowledge, skills, and experience. Zoox also offers a comprehensive package of benefits including paid time off (e.g. sick leave, vacation, bereavement), unpaid time off, Zoox Stock Appreciation Rights, Amazon RSUs, health insurance, long-term care insurance, long-term and short-term disability insurance, and life insurance. Vaccine Mandate Employees working in this position will be required to have received a single dose of the J&J/Janssen COVID-19 vaccine OR have completed the two-dose Pfizer or Moderna vaccine series. In addition, employees will be required to receive a COVID-19 booster vaccine within two months of becoming eligible for the booster vaccine. Employees will be required to show proof of vaccination status upon receipt of a conditional offer of employment. That offer of employment will be conditioned upon, among other things, an Applicant’s ability to show proof of vaccination status. Please note the Company provides reasonable accommodations in accordance with applicable state, federal, and local laws. About Zoox Zoox is developing the first ground-up, fully autonomous vehicle fleet and the supporting ecosystem required to bring this technology to market. Sitting at the intersection of robotics, machine learning, and design, Zoox aims to provide the next generation of mobility-as-a-service in urban environments. We’re looking for top talent that shares our passion and wants to be part of a fast-moving and highly execution-oriented team. Follow us on LinkedIn A Final Note: You do not need to match every listed expectation to apply for this position. Here at Zoox, we know that diverse perspectives foster the innovation we need to be successful, and we are committed to building a team that encompasses a variety of backgrounds, experiences, and skills.",https://www.indeed.com/jobs?q=Cloud+Engineer&l=San+Francisco%2C+CA&sc=0kf%3Aattr%28FCGTU%7CHFDVW%7CQJZM9%7CUTPWG%252COR%29explvl%28ENTRY_LEVEL%29jt%28fulltime%29%3B&vjk=f6b01c75f133f008
8,618f0d37184849f4,Cloud Engineer,"San Francisco, CA",ENTRY_LEVEL,BACHELORS_DEGREE,FULLTIME,"Senior Civil Engineer - job post City of San Rafael 15 reviews San Rafael, CA 94901 $10,439 - $12,689 a month -  Full-time You must create an Indeed account before continuing to the company website to apply Apply on company site save-icon Job details Salary $10,439 - $12,689 a month Job Type Full-time Under general direction of the Public Works Director, the position is responsible for the City’s most complex civil engineering projects in support of the Capital Improvement Program for the City of San Rafael. The Senior Civil Engineer will apply the broad parameters of departmental policy guidelines in order to execute the planning, design, construction, and project management of complex capital improvements; supervises the work of professional and sub-professional engineering personnel; performs professional field and office civil engineering work in connection with a variety of public work projects; and provides technical assistance to the Assistant Public Works Director. ESSENTIAL DUTIES AND RESPONSIBILITIES include the following: This list is meant to be representative, not exhaustive. Some incumbents may not perform all the duties listed and other related duties may be assigned. Plans, supervises and performs professional engineering work in the design and construction of all aspects of public capital projects, including but not limited to Streets, City Owned Property and Facilities, Drainage and Traffic projects and related facilities. Supervises the preparation of plans, project specifications, field inspections, and other engineering work performed by staff members and consultants. Manages complex construction projects and consultants; and meets with public and private engineers, architects, contractors and owners to explain and discuss projects. Responds to inquiries or complaints from staff, the public, and provides technical information to internal and outside Agency staff, City Council and the public. Prepares comprehensive technical and staff reports in verbal and written form to the City Council and Department Directors. Coordinates engineering activities and capital projects with other divisions, departments and agencies. Prepares, reviews, and approves engineering drawings, plans and specifications and other legal documents for the City Engineer. Ensures compliance with the Public Contracts Code, Federal and State laws, local ordinances and regulations. Delivers federally funded transportation projects in conformance with the Caltrans Local Assistance Procedures Manual (LAPM). Reviews and approves progress payments to consultants, contractors and vendors. May serve as a witness in court; may represent the department at public hearings and before the City Council and various commissions. Performs related duties as required. KNOWLEDGE OF: Principles, practices and techniques of municipal civil engineering in order to manage projects from inception to completion. Principle, practices, methodology of employee supervision, including work planning reviewing and evaluating. General design and construction methods related to pump stations, streets, storm drains, buildings, parks and other public works projects. Understanding of Laws and codes related to civil engineering, accessibility codes, and projects related to civil engineering and traffic engineering. Principles of organization, administration, budget and supervision. Personal computers and related engineering software including but not limited to AutoCAD design and drafting. ABILITY TO: Plan, organize, supervise, review and evaluate the work of staff and effectively recommend selection of staff, disciplinary actions and other personnel matters; and train staff in work procedures. Analyze budgetary and staffing needs and make sound independent recommendations. Effectively implement new policies and procedures. Apply principles of logic and scientific reasoning to develop and evaluate alternative courses of action and determine appropriate solutions. Read, understand, and interpret complex technical and legal documents, maps technical drawings and other engineering material related to hydraulics, soil mechanics, surveying, traffic systems, and other municipal engineering related subjects. Effectively communicate to convey technical information and give instructions. Listen attentively, conduct and record clearly and concisely with technical accuracy. Adjusts to workload changes and work under stress to meet deadlines. Maintains effective working relationships with all levels of representatives from governmental and private agencies, construction and consultant contractors, coworkers and the general public. Prepare plans, drawings, specifications, diagrams and make sketches. Use a PC and related engineering software. Evaluate and resolve engineering problems. EDUCATION AND/OR EXPERIENCE: Any combination of education and experience that demonstrates possession of the requisite knowledge, skill and abilities. A typical way to obtain these would be: Bachelor’s degree in Civil Engineering. Five (5) years of increasingly responsible post degree engineering experience managing complex construction and maintenance projects and consultants. A master’s degree may substitute for 1 year of post degree engineering experience. LICENSES: Registration as a Civil Engineer in the State of California. Valid drivers’ license. PHYSICAL DEMANDS: The physical demands described here are representative of those that must be met by an employee to successfully perform the essential function of this job. Reasonable accommodations may be made to enable individuals with disabilities to perform the essential functions. While performing the duties of this job, the employee is regularly required to sit and talk or hear. The employee frequently is required to use hands to finger, handle, or feel and reach with hands and arms. The employee is occasionally required to stand and walk. The employee must regularly lift and/or move up to 10 pounds and occasionally lift and/or move up to 25 pounds. Specific vision abilities required by this job include close vision, distance vision, color vision, peripheral vision, depth perception, and ability to adjust focus. WORK ENVIRONMENT: The work environment characteristics described here are representative of those an employee encounters while performing the essential functions of this job. Reasonable accommodations may be made to enable individuals with disabilities to perform the essential functions. While performing the duties of this job, the employee occasionally works in evenings or on weekends and indoor conditions and regularly works near video/computer displays. The employee is regularly required to sit; use hands to finger, handle, or feel; and talk or hear. The employee frequently is required to stand, walk, reach with hands and arms, and taste or smell. The employee is occasionally required to climb or balance and stoop, kneel, crouch, or crawl, lift and/or move up to 50 pounds. Specific vision abilities required by this job include close vision, distance vision, color vision, peripheral vision, depth perception, and ability to adjust focus. The employee is occasionally exposed to outside weather conditions and uses personal vehicle. The noise level in the work environment is usually moderate. APPLICATION AND SELECTION PROCESS: City of San Rafael application is required . Resumes do not substitute for the City application. Candidates should detail related education and experience on the application. The examination process may include the following application appraisal and oral board interview examination. The passing point for the oral board examination final score will be 70%. Note: Prior to appointment, candidate must pass a pre-employment physical, background check, driving record, drug screen, and fingerprinting. To file an application, go to: www.calopps.org. Select “Member Agencies”. Select “San Rafael”. Follow this link to submit your application: https://www.calopps.org/san-rafael/job-20321673 For more information about the City of San Rafael, please visit www.cityofsanrafael.org. Reasonable Accommodation : The City of San Rafael will make reasonable accommodations in the exam process to accommodate disabled applicants. If you have a disability for which you require an accommodation, please contact us at (415) 485-3474 before the test date. Reasonable accommodations may be made to enable individuals with disabilities to perform the essential functions of this position. Such accommodations must be requested by the applicant. Benefits The City of San Rafael offers an attractive compensation and benefits program. The salary range for this position is $10,439 - $12,689 annually DOQ/DOE and a competitive benefits program including: Retirement: The City is a part of the Marin County Employee Retirement Association (MCERA) plan, which offers reciprocity between agencies in CalPERS (this is part of the 37 Act County System): Classic Employees (Tier 2 – hired on or after 7/1/2011) - 2% @ at 55 formula, average of three highest years of compensation. PEPRA employees - hired after 1/1/13 or with 6-month break in service are eligible for a 2% at 62 formula, average of three highest years of compensation. Health Insurance: Full flex cafeteria plan which can be applied to a health plan or converted to cash (Employee Only - $882.77; Employee+1 - $1,773.73; Employee+Family - $1,925.07; Waive Coverage $300.00) Life and Long Term Disability Insurance: $5,000 basic and long-term disability is two-thirds of the salary up to $1,000 per month Dental Insurance: Fully paid premiums for employee and eligible dependents Vision Insurance: Fully paid premium for employee – employee responsible for dependent cost if enrolled. 457 Deferred Comp: Participation is voluntary. City contributes 1% on employee’s behalf. 125 Plan: Participation is voluntary. Annual Leave: Vacation 10 days (1-3 years of service/6.25 hours earned per month); 12 days per year; 12 holidays and 1 floating holiday. Gym Reimbursement: Employees eligible to receive up to $16.50 per month reimbursement for paid gym memberships. Bilingual Pay: Eligible to receive $150 per month for certified fluency. Social Security: The City of San Rafael does NOT contribute to social security. Work Week: 37.5 hours per week/7.5 hours per day. Recruitment Contact Contact phone: (415)485-3474 Contact email: rhonda.castellucci@cityofsanrafael.org",https://www.indeed.com/jobs?q=Cloud+Engineer&l=San+Francisco%2C+CA&sc=0kf%3Aattr%28FCGTU%7CHFDVW%7CQJZM9%7CUTPWG%252COR%29explvl%28ENTRY_LEVEL%29jt%28fulltime%29%3B&vjk=618f0d37184849f4
