,job_id,job_title,location,experience,education,job_type,job_description,job_link
0,8b3e2ed4331c90b9,Data Analyst,"Dallas, TX",MID_LEVEL,BACHELORS_DEGREE,CONTRACT,"Data Analyst - job post Pinnacle Group Irving, TX Up to $60 an hour -  Contract Responded to 51-74% of applications in the past 30 days, typically within 10 days. Apply now Apply now save-icon Job details Salary Up to $60 an hour Job Type Contract Job Description: Information Security Application Vulnerability Governance Data Analyst will be responsible for analyzing program data from multiple systems and providing insights to the governance team on effectiveness of security controls. To be successful in this role candidate need to be a strong analytical thinker, enjoy solving complex problems, build effective visualizations using dashboards, and be a team player and an effective communicator. The position is an individual contributor and reports to Application Vulnerability Assessment (AVA) Program Manager. The overall objective of this role is to ensure the development of an effective data analytics solution to monitors trends for program metrics and effectiveness of security controls Responsibilities: Design and implement a solution for performance measurements on effectiveness of controls and overall vulnerability assessment program Analyze trends on assets security health posture and report using visualization tools for program review with management and stakeholders Analyze and report aggregated data from multiple data sources Develop data visualization mock-ups for monitoring program data trends and communicate using analytical tools Develop reports for tracking program effectiveness and update power point deck for weekly , monthly and quarterly updates Develop, optimize and provide continuous support for reports and ad-hoc queries from end user. Create dashboards with parameters and interactive drill down functionality. Provide timely, accurate, and actionable reporting on application vulnerability activity, trends, service levels, and areas of concern to senior management. Streamline and automate report creation and distribution for weekly and monthly reporting Work with the Metrics reporting team to enhance and refine the metrics and key performance indicators reported to senior management and external regulatory agencies. Develop User acceptance test plans for testing changes to system enhancements that impact governance and compliance. Document business requirements related to system enhancements and submitted for reviews and approvals. Perform data analysis from multiple systems and assess completeness of data for reporting. Ensure data integrity and compliance by performing data audits and data validation. Performs root cause analysis on metric trends and provide insight to governance team for appropriate refinements to rules. Qualifications: At least 5 plus years of strong data analysis and report development experience Excellent Excel data analysis and Access database skills experience with data analysis leveraging databases like Oracle, SQL Server, Microsoft Access Strong Business Intelligence Developer Skills Excellent SQL Skills Experience with issue resolution - ability to research, identify and communicate solutions. Excellent documentation skills - Collect, summarize and synthesize information in an auditable format. Excellent organization and multi-tasking skills. Proven influencing and relationship management skills. Strong understanding of application development life cycle, CI/CD and DevOps concepts. Education: Bachelor’s degree/University degree or equivalent experience Pluses: At least 5 plus years’ experience with Business Intelligence Reporting tools like Cognos, Tableau. Job Type: Contract Salary: Up to $60.00 per hour Schedule: 8 hour shift Ability to commute/relocate: Irving, TX: Reliably commute or planning to relocate before starting work (Required) Experience: Data modeling: 4 years (Preferred) Work Location: One location Speak with the employer +91 +14698428519 If you require alternative methods of application or screening, you must approach the employer directly to request this as Indeed is not responsible for the employer's application process.",https://www.indeed.com/jobs?q=Data+Analyst&l=Dallas%2C+TX&sc=0kf%3Aattr%28FCGTU%7CHFDVW%7CQJZM9%7CUTPWG%252COR%29explvl%28MID_LEVEL%29jt%28contract%29%3B&vjk=8b3e2ed4331c90b9
1,63946dfaa24259df,Data Analyst,"Dallas, TX",MID_LEVEL,BACHELORS_DEGREE,CONTRACT,"Business Analyst - job post Excellerent Solutions Inc Irving, TX $63,222 - $121,293 a year -  Contract Responded to 51-74% of applications in the past 30 days, typically within 19 days. Apply now Apply now save-icon Job details Salary $63,222 - $121,293 a year Job Type Contract Location: Irving, TX Direct Client: 100% Onsite Job(5 days a week), Candidates who are ready to work Onsite will only be considered. Long Term Project Responsibilities Work with departmental managers to understand the current processes and systems. Conduct time-in-motion studies and facilitate focus group sessions to identify areas within the process or system that require improvement. Recommend process changes/system modifications to streamline and automate a business process. Work with the development team to design, test, implement, and maintain updates within company databases and applications necessary to streamline/automate a business process. Define high-level goals and road map associated with their project. Identify and analyze the risks associated with achieving the milestones for a project. Develop risk mitigation strategies. Work with Deployment Manager to organize and execute pre-deployment user acceptance testing that is specific to the project. Assist the corporate training group in the creation of training documentation and programs that are focused on building consistency and proficiency within a process. Facilitate/present the initial training sessions for a particular process. Ensure the management and training for a particular process is effectively transitioned back to the business after the completion of a project. Communicate status of the project to senior management. Serve as the single point of contact for project-related issues that need to be escalated to senior management for resolution. Data validation and report development REQUIREMENTS Bachelor's degree or equivalent. Proficiency in defining business problems and proposing solutions. Mortgage Industry knowledge with experience in originations process Past experience in any Loan Origination System (LOS) will be plus. Experience working in Agile methodology Expert skills in Microsoft Excel, including the ability to utilize the following functions: V-Lookup, H-Lookup, Concatenating formulas, Conditional formatting, and Pivot Tables Bachelor's degree in Business, Economics or related field a plus Excellent interpersonal, verbal and written communication skills. Must be proactive and solutions-oriented business professional with the ability to interface with all levels of management across business units and functions. Job Type: Contract Pay: $63,222.00 - $121,293.00 per year Schedule: 8 hour shift Experience: Mortgage: 5 years (Preferred) Work Location: In person If you require alternative methods of application or screening, you must approach the employer directly to request this as Indeed is not responsible for the employer's application process.",https://www.indeed.com/jobs?q=Data+Analyst&l=Dallas%2C+TX&sc=0kf%3Aattr%28FCGTU%7CHFDVW%7CQJZM9%7CUTPWG%252COR%29explvl%28MID_LEVEL%29jt%28contract%29%3B&vjk=63946dfaa24259df
0,5920f57e71c5974a,Data Analyst,"Dallas, TX",MID_LEVEL,BACHELORS_DEGREE,CONTRACT,"Digital Business Analyst - job post Harvey Nash USA 43 reviews Plano, TX 75023 $45 - $50 an hour -  Contract Responded to 75% or more applications in the past 30 days, typically within 7 days. Apply now Apply now save-icon Job details Salary $45 - $50 an hour Job Type Contract Position: Business Analyst 3(Manager, SEA National Retail, Strategy & Analytics) Location: Plano, TX Duration: 6 months contract Job Description: · For decades, Client has been leading the charge on innovation. We see beauty in achieving excellence and our passion for change fuels our discoveries, inventions, and breakthrough technology. We believe that technology can, and should, make the world a better place, so we create new possibilities for people everywhere, push the limits of what’s possible, and constantly innovate. · At Client Electronics America, we take pride in the creativity and diversity of our talented people – they are at the forefront of everything we do. Their skillset and mindset drive our continued success. Only the resilient and resourceful thrive in the daily dose of unexpected at Client. We unapologetically push to achieve unforeseen potential in everything we do, both within the workplace and at home. We fearlessly face challenges head-on, conquer the unconquerable, and are comfortable living in the uncomfortable zone. Position Summary: · The Contractor, SEA Strategy & Analytics will support a variety of strategic efforts for the National Retail division, mainly focusing on spearheading delivery of the National Retail division’s executive presentations/communications and analyzing business performance relevant to market. · This position will be crucial to Client’s ability to set & drive its short, medium, and long-term course in the highly dynamic electronics industry. Role and Responsibilities: Lead development of executive business presentations to both local and global leadership Regular development of executive presentations (local, global leadership & partner) on business performance and strategic initiatives Competitive analysis & ROI management of key growth initiatives Regular presentations and reviews with partners to develop joint strategies and tactics for growth Provide business updates, KPI dashboards and preparing strategic business presentations to both local and global leadership Oversee QBR timings, cadence, story line development, meeting management etc Market intelligence & Business Performance Quarterly / Yearly performance KPI tracking & Reporting Expertise in key industry databases and leveraging (Ex. NPD, Numerator, IDC, Traqline, Strategic Analytics) Monitor, evaluate and report on the competitive environment and market share dynamics Serve as advisory resource for specific initiatives aimed at setting strategic direction & planning, including scenario analysis, business impact & ad-hoc support / recommendations in response to external / internal strategic developments Skills and Qualifications: Bachelor’s degree required; advanced degree highly desired from a Top graduate school. Strong academic record preferred. 5-7 years of professional experience, with successful track record for growth and leadership. Experience in management consulting or strategy development in a corporate setting is required. Analytical track record across various practice areas and industries highly preferred. Experience in direct or indirect leadership of teams Fluent in reading writing and verbal communications in English Thorough Expertise in key industry databases and leveraging (Ex. NPD, Competitirack, IDC, Market Track, Strategic Analytics, Social Analytics) Necessary Skills & Attributes: Develop and maintain excellent working relationships with all assigned levels within and outside the company. Ability to Plan, organize, and prioritize multiple assignments and projects Strong project management skills with ability to efficiently scope and execute concrete strategic initiatives and lead multifunctional teams with diverse interests toward share objectives. Work independently and in a team environment in order to achieve customer business objectives, personal and team goals and complete assignments within established time frames and specifications. The ability to develop tasks and work assignments, based on sometime vaguely defined objectives. Advanced ability to quickly capture, understand synthesize, summarize and draw insights from constantly changing information and to effectively communicate those summaries and insights to management Analytical track record across various practice areas and industries highly preferred Review detailed product development, marketing documents and media materials as needed. Excellent communication and interpersonal skills: info sharing, networking, influencing, leadership conflict resolution Strong sense of urgency and speed to action. Mastery of MS office suites, particularly PowerPoint, Excel (VBA a plus) and Word. Working knowledge of Tableau preferred Top must-have skills/requirements – Advanced ability to quickly capture, understand synthesize, summarize and draw insights from constantly changing information and to effectively communicate those summaries and insights to management in a timely and organized manner Mastery of MS office suites, particularly PowerPoint, Excel (VBA a plus) and Word Strong sense of urgency and speed to action. Work independently and in a team environment in order to achieve customer business objectives, personal and team goals and complete assignments within established time frames and specifications. Physical/Mental Demands and Working Conditions: The position requires the ability to perform the essential duties and responsibilities in the following environment: Work is generally performed in an office environment. Operate a computer keyboard and view a video display terminal 50% of work time, including prolonged periods of time. The movement and transportation of equipment, most of the time under 25 pounds. Performs work under time schedules and stresses which are normally periodic or cyclical, including time sensitive job stress, fatigue, unpaid over-time, intellectual challenge, constant technical data feedback, language barriers, and business management stress. Machines, tools, equipment, and work aids representative and commonly associated with PCs, printers, and office work areas. Frequently works additional hours beyond normal schedule. Under very little direct supervision with a high level of responsibility to apply general policies and guidelines where decisions are seldom monitored and consequences of decisions adversely affect operating results and management decisions. Complete access to confidential company data where disclosure may jeopardize the company’s competitive position. Job Type: Contract Salary: $45.00 - $50.00 per hour Experience level: 5 years Schedule: Monday to Friday Ability to commute/relocate: Plano, TX 75023: Reliably commute or planning to relocate before starting work (Required) Experience: Business analysis: 5 years (Required) Work Location: One location If you require alternative methods of application or screening, you must approach the employer directly to request this as Indeed is not responsible for the employer's application process.",https://www.indeed.com/jobs?q=Data+Analyst&l=Dallas%2C+TX&sc=0kf%3Aattr%28FCGTU%7CHFDVW%7CQJZM9%7CUTPWG%252COR%29explvl%28MID_LEVEL%29jt%28contract%29%3B&start=10&pp=gQAPAAAAAAAAAAAAAAAB_kE4zwAJAQAIuygRXlBSAAA&vjk=5920f57e71c5974a
1,ca1f004da82bfe07,Data Analyst,"Dallas, TX",MID_LEVEL,BACHELORS_DEGREE,CONTRACT,"Business Analyst - RETAIL - job post Intone Networks 15 reviews Dallas, TX Contract You must create an Indeed account before continuing to the company website to apply Apply on company site save-icon Job details Job Type Contract • Experience Required: 4-6 Years • Experience in Enterprise Digital Asset Management System in Retail Space (SiteCore, would be preferable) • First-hand experience in requirement gathering from business and product teams • Have proven track record for 4-6 years as a business system analyst • Should have experience working with teams located in offshore and working across vendors • Should have good analytical skills, can review the documents shared by the client team, and create BA deliverables • Should have first-hand experience in writing and managing user story document, non-functional requirements, traceability matrix etc • Should be comfortable with the technical requirement discussion and have experience in mapping the requirements to API with JSON as a request/response • Should be able to participate in UAT, BUAT and Post-production bug verification along with dev and QA team • Excellent time and stakeholders' management, decision-making, leadership and planning skills with the ability to learn quickly and multi-task in a fast-paced environment. • Expectation management Stakeholder management Excellent written and verbal communication skills • Capability to understand the new or existing system and business process • Standardise the requirements gathered across the teams and conceptualize application workflow • Identifying options for potential solutions and assessing them for both technical and business suitability • Working closely with stakeholders and technical team to ensure timely closure of requirements • Generate frequent status reports to Stakeholders & teams. Responsibility 1. Work with business and product teams to understand the Vision, Product Strategy, and Product Roadmap. 2. Work with the business team to understand the current marketing digital asset workflow and map it to the new process 3. Capture all functional and technical requirements as user stories 4. Work with the implementation team to Groom, Prioritize and execute the product backlog 5. Identify any dependencies and resolve team impediments. Should reach out the the leadership on any risks that are identified ahead of time. 6. Should steer and help the implementation team for successful execution of the product roadmap",https://www.indeed.com/jobs?q=Data+Analyst&l=Dallas%2C+TX&sc=0kf%3Aattr%28FCGTU%7CHFDVW%7CQJZM9%7CUTPWG%252COR%29explvl%28MID_LEVEL%29jt%28contract%29%3B&start=10&pp=gQAPAAAAAAAAAAAAAAAB_kE4zwAJAQAIuygRXlBSAAA&vjk=ca1f004da82bfe07
2,c642ca99fe8c2eb1,Data Analyst,"Dallas, TX",MID_LEVEL,BACHELORS_DEGREE,CONTRACT,"Business Intelligence Analyst (W2) - job post Mican Technologies Irving, TX $40 - $45 an hour -  Contract Responded to 75% or more applications in the past 30 days, typically within 5 days. Apply now Apply now save-icon Job details Salary $40 - $45 an hour Job Type Contract Required Experience: Designs, develops, and implements reports, extracts, dashboards Assist with business area analysis, requirements definition, source identification, data quality definition, transformation, and summarization processes Stay abreast of developments in 3rd party reporting tools as needed to augment the reporting needs Ensure the testing of reports during upgrades are tested thoroughly to ensure data integrity and report accuracy Education Included From Job Education Essential Level Bachelors Degree Yes 3 Needs Healthcare experience and experience with Power BI, SQL and SAS. Job Type: Contract Salary: $40.00 - $45.00 per hour Experience: SQL: 5 years (Required) Power BI: 3 years (Required) SAS: 3 years (Required) Work Location: On the road Speak with the employer +91 7328323606 If you require alternative methods of application or screening, you must approach the employer directly to request this as Indeed is not responsible for the employer's application process.",https://www.indeed.com/jobs?q=Data+Analyst&l=Dallas%2C+TX&sc=0kf%3Aattr%28FCGTU%7CHFDVW%7CQJZM9%7CUTPWG%252COR%29explvl%28MID_LEVEL%29jt%28contract%29%3B&start=10&pp=gQAPAAAAAAAAAAAAAAAB_kE4zwAJAQAIuygRXlBSAAA&vjk=c642ca99fe8c2eb1
