,job_id,job_title,location,experience,education,job_type,job_description,job_link
0,7e4bb4278d9c80cc,Data Scientist,"San Francisco, CA",SENIOR_LEVEL,DOCTORAL_DEGREE,FULLTIME,"Sr. Data Scientist - job post Adobe 749 reviews San Francisco, CA 94103 $122,400 - $223,000 a year -  Full-time You must create an Indeed account before continuing to the company website to apply Apply on company site save-icon Job details Salary $122,400 - $223,000 a year Job Type Full-time Our Company Changing the world through digital experiences is what Adobe’s all about. We give everyone—from emerging artists to global brands—everything they need to design and deliver exceptional digital experiences! We’re passionate about empowering people to create beautiful and powerful images, videos, and apps, and transform how companies interact with customers across every screen. We’re on a mission to hire the very best and are committed to creating exceptional employee experiences where everyone is respected and has access to equal opportunity. We realize that new ideas can come from everywhere in the organization, and we know the next big idea could be yours! The Opportunity As a data scientist within the Creative Cloud Experience and Engagement organization, you will be a core part of the data science and analytics team, driving analytics-based insights that enable engaging experiences for our Creative Cloud customers, and bring users to experience core product value quickly across the Creative Cloud business. We’re looking for a candidate who is passionate about deriving impactful customer insights from large datasets, through descriptive, diagnostic, predictive and prescriptive analytics techniques. The ideal candidate will have a combination of strong analytical and technical skills, along with the ability to work with multi-functional teams, and the curiosity and ability to influence data-driven decision making by key partners. What you'll Do Drive analytics for user revenue/engagement growth programs and A/b tests through analyzing results and communicating insights. Partner with product managers to understand product/customer behavior and features, and use insights generated to make recommendations to improve customer experience and engagement. Be a specialist of stitching and calibrating sparse and noisy data across various data sources. Support regular ad-hoc data and analysis needs to better understand customer behavior. Build reporting frameworks / resources that enable partners to self-serve information. Partner with teams including product analytics, Go-To-Market and Campaign. What you need to succeed Master's / PhD degree in Computer Science, Analytics/Data Science, Statistics, or related quantitative field, or a Bachelor's degree in a similar field with relevant practical experience Strong skills in a data science/analytics role with a proven track record of success Experience in hypothesis testing and A/b test analytics Expertise in working with large data sets using Hive/SQL Hands-on experience working with Hadoop. Bonus points for prior experience working on any Cloud Platform eg Databricks. Expertise in developing sophisticated reports/dashboards using Tableau Good attention to detail and ability to stitch and QA multiple data sources. Strong analytical and quantitative problem-solving ability Excellent oral and written communication skills Ability to synthesize large scale data sets to generate a clear story and impactful insights A curious mind, passion, and motivation to learn new skills, tools, and analytics techniques critical to tackle business challenges. Our compensation reflects the cost of labor across several U.S. geographic markets, and we pay differently based on those defined markets. The U.S. pay range for this position is $122,400 -- $223,000 annually. Pay within this range varies by work location and may also depend on job-related knowledge, skills, and experience. Your recruiter can share more about the specific salary range for the job location during the hiring process. At Adobe, for sales roles starting salaries are expressed as total target compensation (TTC = base + commission), and short-term incentives are in the form of sales commission plans. Non-sales roles starting salaries are expressed as base salary and short-term incentives are in the form of the Annual Incentive Plan (AIP). In addition, certain roles may be eligible for long-term incentives in the form of a new hire equity award.",https://www.indeed.com/jobs?q=Data+Scientist&l=San+Francisco%2C+CA&sc=0kf%3Aattr%286QC5F%252COR%29explvl%28SENIOR_LEVEL%29jt%28fulltime%29%3B&vjk=7e4bb4278d9c80cc
1,2955f8f17323b018,Data Scientist,"San Francisco, CA",SENIOR_LEVEL,DOCTORAL_DEGREE,FULLTIME,"Senior/Principal Data Scientist - Finance - job post Genentech (part of Roche) 1,023 reviews San Francisco, CA Full-time You must create an Indeed account before continuing to the company website to apply Apply on company site save-icon Job details Job Type Full-time The Position At Genentech we work to deliver better outcomes to more patients, faster. As a Senior/Principal Data Scientist in Finance, you will collaborate to create actionable insights, analyses, visualizations and models - and help apply them in teams and systems to drive decisions and build value across the business. Finance plays a central role in our mission to provide better outcomes to patients faster. We partner locally and globally across the business, including with Commercial Sales and Marketing, Research, Clinical, Medical, Manufacturing and other core business units. Our goals is to leverage data to augment decision making, reduce cost, increase revenue, and ultimately bring better outcomes to patients. Your main focus will be partnering with business stakeholders, and aligning in our technical groups, to develop and apply analyses and predictive models that provide actionable insights to run the business. At the principal level, you will not only be an expert in data science and analytics, but will play a larger role with focused areas of the business like Commercial Finance, R&D, and Personal Health. Your will be able to influence the direction of data-driven decision making at a high level. You will also help lead the integration of data systems, dashboards, and suites of predictive models tailored to produce data-driven insights for specific functions in the company. Your business acumen and teamwork skills will allow you to work closely, and deliver tangible value, with business partners. Having a high level of technical proficiency is also needed to deliver well validated models, insightful analyses, and work within our team of data scientists, engineers and analysts. The successful candidate will be effective integrating data science and analytics into business practice, and embedding predictive models and visualizations into data-centric products and processes that run at scale. This is an excellent opportunity to take on cutting edge projects with significant scope, and work in a strong team with an excited set of business partners. You will be a respected member of a vibrant data science and analytics community of thousands. This is an opportunity to make lasting contributions that improve patient health, at a company that provides great benefits and an excellent work environment. Minimum Requirements: PhD with 2+ years of industry experience as a data scientist, or a Master’s degree with thesis work and 4+ years of experience, in Computer Science, Computational Biology/Chemistry, Engineering, or similar areas. Industry experience in team settings with strong demonstrated contributions as shown by attributable revenue generation, cost savings, quality product releases, patents, publications and conference presentations. Desired Experience: The successful candidate will have a mixture of technical and organizational experience. Technical expertise desired includes: Consultative work with stakeholders across the business, and contributing as a valued member of the team to influence decisions using insights from data, analytics and data science. Operating in data environments with multiple complex data sources: finding, accessing, cleansing, merging, validating and annotating data. Performing data exploration to identify actionable insights - including finding trends, key features, feature engineering, discovering and showing relationships and developing visualizations. Developing, validating predictive models will include familiarity with test and training sets, supervised and unsupervised methods, and understanding strengths and weaknesses of algorithms (such as clustering techniques, Random Forests, Gradient Boosting etc.). Characterizing the accuracy of models across use cases, creating benchmarks, developing unit tests, bringing models to production deployment, monitoring usage and accuracy of models in production, refreshing models, and phasing the updated model into production in frameworks such as A/B testing is desired. Automating data processes and data quality metrics to detect and account for irregularities in data quality. Communicating key findings within data science, in cross-disciplinary project teams, and to partnered groups across the business with different needs and perspectives (such as Commercial, Research and Manufacturing). On the hands-on technical side, we work primarily in an AWS-based environment, and are looking for substantial experience with platforms like AWS, languages like Python and R, libraries like Pandas and SKLearn, familiarity with software development and version control systems, tools like Anaconda and Jupyter Notebooks, systems like SageMaker, and visualization in R Shiny or Tableau. Softer skills desired include understanding the perspectives of team members from other disciplines or backgrounds, analyzing business and project needs and opportunities, building consensus, communicating your findings to create actionable insight, and running data-centric meetings for purposes ranging from discovery to confirming decisions. The expected salary range for this position based on the primary location of California is $172,224 to $233,662. Actual pay will be determined based on experience, qualifications, geographic location, and other job-related factors permitted by law. A discretionary annual bonus may be available based on individual and Company performance. This position also qualifies for the benefits detailed at the link provided below. Benefits #ITcareers #LI-PK1 Genentech is an equal opportunity employer, and we embrace the increasingly diverse world around us. Genentech prohibits unlawful discrimination based on race, color, religion, gender, sexual orientation, gender identity or expression, national origin or ancestry, age, disability, marital status and veteran status. Genentech requires all new hires to be fully vaccinated against COVID-19 as of their start date. This requirement is a condition of employment at Genentech, and it applies regardless of whether the position is located at a Genentech campus or is fully remote. If you are unable to receive the vaccine due to a disability or serious medical condition, or because it is prohibited as a result of your sincerely held religious beliefs, you will have an opportunity to request a reasonable accommodation.",https://www.indeed.com/jobs?q=Data+Scientist&l=San+Francisco%2C+CA&sc=0kf%3Aattr%286QC5F%252COR%29explvl%28SENIOR_LEVEL%29jt%28fulltime%29%3B&vjk=2955f8f17323b018
2,fa0cd054de557b52,Data Scientist,"San Francisco, CA",SENIOR_LEVEL,DOCTORAL_DEGREE,FULLTIME,"Senior Data Scientist - job post Pendulum™ 20 reviews San Francisco, CA • Hybrid remote Full-time Apply now Apply now save-icon Job details Job Type Full-time Pendulum® is on a mission to help people improve physical and mental health by creating a new category of products that target the microbiome. We are researching, developing and commercializing a novel class of rationally-designed Live Synbiotics™ (probiotics + prebiotics) that have demonstrated clinical efficacy to treat conditions like metabolic syndrome, inflammation and neurodegeneration. Pendulum has created proprietary pipelines to build a unique discovery platform that identifies key, novel bacterial strains and the prebiotics that feed them. We are a highly collaborative team of scientists, engineers, physicians, marketers and salespeople interested in improving human health by using the latest research from diverse fields, such as microbiology, molecular biology, high-throughput genomics, distributed computing, pharmaceutical development and nutrition. We believe strongly in an individual’s transparency and strong communication to enable the most effective and efficient path to team success. If you’re interested in building a new category of products that will help improve the lives of people globally and you love working in a cross-functional, collaborative, inspiring environment, please continue reading! We are seeking an individual with a proven track record working with commercial teams to develop, communicate and maintain metrics, dashboards and predictive models to achieve key business objectives. The ideal candidate will enjoy explaining complex data and analytics concepts and tradeoffs to technical and non-technical audiences. As a technical leader, ideal candidates will define and communicate standards across the organization, work with engineering teams to align activities with business goals and mentor data scientists and analysts across the organization. Responsibilities Partner with commercial teams to develop and define metrics and visualizations that guide data-driven decisions Partner with engineering and technical teams to prioritize data engineering efforts and standards Work with data engineering team to define, implement and organize user-facing analytics tools, e.g., dashboards, metrics and predictive models Guide A/B testing experimental design, analysis and interpretation Design, implement and apply appropriate analytics techniques using R or Python Define analytics best practices, visualization guides, standards and mentor analysts and data scientists across the organization Provide leadership to identify and define KPIs and metrics that need to be used for tracking execution strategy Work with business teams to show why certain metrics should or should not be used based on data driven insights Summarize and highlight key data-driven insights to executive team to inform key decisions and drive improved outcomes Review work and provide valuable feedback on analyses produced by analysts, data scientists and engineers Requirements Master’s or PhD in Statistics, Computer Science or another quantitative field 8+ years of industry experience in Data Science and Analytics 6+ years experience in Python, R and SQL Experience leading complex cross functional projects and teams Experience promoting best practices and excellence across an analytics team Experience developing a vision, roadmap, datasets, and tooling in a nascent area Experience working with modern cloud based data stack Knowledge of statistics fundamentals, EDA, hypothesis testing, experimental design and analysis Knowledge of predictive modeling, forecasting and sequential testing Experience working on customer analytics to drive user growth, retention/churn, attribution, and LTV models Excellent oral and written communication skills Intensely curious problem solver who stays current on the latest techniques and introduces new methods when appropriate Salary & Benefits 155,000 to 170,000 (DOE) Medical, Dental, and Vision Commuter Benefits Life & STD Insurance Company match on 401 (k) Flexible Time Off (FTO) Equity Pendulum Therapeutics, Inc. is committed to creating a diverse environment and is proud to be an equal opportunity employer. All qualified applicants will receive consideration for employment without regard to race, color, religion, gender, gender identity or expression, sexual orientation, national origin, genetics, disability, age, or veteran status. We welcome all to apply. If you require alternative methods of application or screening, you must approach the employer directly to request this as Indeed is not responsible for the employer's application process.",https://www.indeed.com/jobs?q=Data+Scientist&l=San+Francisco%2C+CA&sc=0kf%3Aattr%286QC5F%252COR%29explvl%28SENIOR_LEVEL%29jt%28fulltime%29%3B&vjk=fa0cd054de557b52
3,3999d86f0422eed7,Data Scientist,"San Francisco, CA",SENIOR_LEVEL,DOCTORAL_DEGREE,FULLTIME,"Principal Data Scientist - job post PG&E Corporation 967 reviews Oakland, CA 94612 • Hybrid remote Full-time You must create an Indeed account before continuing to the company website to apply Apply on company site save-icon Job details Job Type Full-time Requisition ID # 144688 Job Category: Accounting / Finance Job Level: Manager/Principal Business Unit: Information Technology Work Type: Hybrid Job Location: Oakland Department Overview The Data Science & Decision Science Department is both a “Delivery” team that is a sophisticated practitioner of data science and a “Center of Excellence” team that supports other practitioners in an enterprise-wide Hub & Spoke analytics adoption model. As a Delivery team, this Department uses industry leading data science and change management practices to drive PG&E’s transition to the sustainable grid of the future. The Department works cross-functionally across the company to enable data driven decisions applying analytics, as well as improvements to relevant business processes. Deployed to some of PG&E’s highest priority arenas, the Department does not specialize in a traditional utility domain, such as asset management or program administration, but instead specializes in extracting useful insights from disparate data sets and facilitating actions informed by these insights. As a Center of Excellence team, this Department listens to the needs of practitioners across the company, along with emerging industry practices, and builds standards, processes, tools, knowledge and best practices that meet the current and future needs of the enterprise. This team works on a wide variety of difficult problems, offering great variety in the work, and constant opportunity to explore and learn. Current and past engagements include: Creating wildfire risk models that are used by regulators and the utility to prioritize asset management Developing computer vision models that improve, accelerate, and automate asset inspections processes Predicting electric distribution equipment failure before it occurs, allowing for proactive maintenance Forming the analytical framework behind PG&E’s Transmission Public Safety Power Shutoff Optimizing non-wires alternative resource portfolios, like the Oakland Clean Energy Initiative, including location and resource adequacy considerations Analyzing customer demographic, program participation, and SmartMeter interval data to build program targeted propensity models, e.g. for customer owned distributed energy resource technologies Identifying and investigating anomalous customer natural gas usage, in order to resolve dangerous customer side leaks Position Summary PG&E is looking for two Principal Data Scientists with large experience in delivery of data science products as well as standards & processes development, but with specific focus on Center of Excellence programs. In this role the successful candidates will be uniquely positioned at the forefront of utility industry analytics, having the opportunity to advance PG&E’s triple bottom line of People, Planet, and Prosperity. Working as part of cross functional teams, including data engineers, data scientists, technologists, subject matter experts, and change management professionals – these individuals will co-lead the development of standards and best practices for strategic decision making and operational processes. They will also explore delivery opportunities and lead delivery work, as needed. This Delivery piece could be both hands-on and collaborating with other data science teams (depending on scope and complexity). The responsibilities of these positions include: Develop Standards and Processes as part of the Center of Excellence (COE) for data science based on research about PG&E analytic portfolio products, acting as a servant leader of delivery teams across the enterprise so said Standards and Processes facilitate strong and reliable product delivery for those teams. Advise others in data science matters as well as deliver hands-on data science work as part of the “Delivery” piece of the job. Support the identification and implementation of process improvement at the department level. Support building data science capability both within the Department and across the enterprise. Present findings and makes recommendations to officers and cross-functional management. Build and maintain strong relationships with business units and external agencies. PG&E is providing the salary range that the company in good faith believes it might pay for this position at the time of the job posting. This compensation range is specific to the locality of the job. The actual salary paid to an individual will be based on multiple factors, including, but not limited to, specific skills, education, licenses or certifications, experience, market value, geographic location, and internal equity. We would not anticipate that the individual hired into this role would land at or near the top half of the range described below, but the decision will be dependent on the facts and circumstances of each case.​ A reasonable salary range is: ​ Bay Area Minimum: $151,000.00 Bay Area Mid-point: $204,000.00 Bay Area Maximum: $257,000.00 &/OR​ California Minimum: $143,000.00 California Mid-point: $194,000.00 California Maximum: $244,000.00 This position is hybrid, working from your remote office and your assigned work location based on business need. The assigned work location will be within the PG&E Service Territory. Reporting Relationship This position reports to the Director, Enterprise Decision Science/Data Science & Analytics Products. Job Responsibilities: Works closely with domain experts to develop relevant domain knowledge in the electric and gas utility, as well as knowledge of related datasets. Documents data sources, methodology, and model evaluation metrics. Collaborates with analytics platform owners to prioritize and drive development of scalable data science capabilities. Mentors junior data scientists and drives standardization in process and toolsets across the data science community at PG&E. Works with enterprise leaders as an advocate for digital transformation of the business through the adoption of data science, analytics, and data-driven business processes. Applies machine learning and other analytical modeling methods to develop robust and reliable analytical models, including visualizations, within PG&E’s software development environment. Manages development of complex quantitative models and tools. Recognizes and prioritizes the most important work related to data science models to achieve highest operational impact for analytics in the business. Utilizes deep understanding of business drivers and financial levers to provide strategic decision support. Presents findings and makes recommendations to executive leadership and cross-functional management. Education Minimum Bachelor’s Degree in Computer Science, Econometrics, Economics, Engineering, Mathematics, Applied Sciences, Statistics or job-related discipline or equivalent experience. Experience Minimum Job-related experience (e.g., data analytics and modeling), 10 years, OR Master’s Degree and job-related experience, 8 years, OR Doctorate and job-related experience, 5 years. Knowledge, Skills, Abilities and (Technical) Competencies Proficiency with the elements of the data management lifecycle (data acquisition, security, storage, architecture, integration, governance, compliance, reference data management, data quality and metadata) and best practices Competency with relevant project management tools, theories and techniques as needed to support the timely and successful execution of project requirements Knowledge of industry trends and current issues in job-related area of responsibility as demonstrated through peer reviewed journal publications, conference presentations, open source contributions or similar activities Proficiency with commonly used data science and/or operations research programming languages, packages, and tools Expertise in data science/machine learning models and algorithms Proficient at systems thinking and structuring complex problems Proficiency in synthesizing complex information into clear insights and translating those insights into decisions and actions Ability to clearly communicate complex technical details and insights to colleagues, stakeholders, and leadership Knowledge of the mathematical and statistical fields that underpin data science Ability to develop, coach, teach and mentor others to meet both their career goals and the organization goals #featuredjob",https://www.indeed.com/jobs?q=Data+Scientist&l=San+Francisco%2C+CA&sc=0kf%3Aattr%286QC5F%252COR%29explvl%28SENIOR_LEVEL%29jt%28fulltime%29%3B&vjk=3999d86f0422eed7
