,job_id,job_title,location,experience,education,job_type,job_description,job_link
0,6e87408700aa8c68,Data Architect,"Chicago, IL",ENTRY_LEVEL,BACHELORS_DEGREE,FULLTIME,"Cloud Data Architect - job post Clarkston Consulting 16 reviews Chicago, IL • Remote Full-time Apply now Apply now save-icon Job details Job Type Full-time Do you want the opportunity to leverage your skills to make a direct impact on the world’s leading life sciences, consumer products, and retail companies? Join Clarkston Consulting as a Cloud Data Architect to help deliver creative business solutions to our market-leading clients as a part of our team of experienced professionals. We are looking for motivated, self-driven leaders who are energized by team results and interested in joining a firm that values its culture and people as its biggest strengths. Together, we can help find the answers to our clients most challenging business problems. What You’ll Do Clarkston gives you the opportunity to deliver great solutions, become recognized as an industry expert, and help build a great practice. As a Cloud Data Architect at Clarkston, you will: Design and develop platforms for scalable solutions Design, prototype, and develop Big Data Platforms utilizing Azure or AWS Work with all levels of staff, management, stakeholders, and vendors Showcase advanced analytical and conceptual skills to create original concepts/theories for various projects Provide forward thinking technical expertise in current and emerging technologies, trends, and practices Anticipate internal and/or external business challenges including regulatory; recommend process, product or service enhancements Design/drive architectural strategies with business and strategic goals Translate business goals and objectives into IT capabilities and develop technical solutions How You’ll Grow At Clarkston, we feel that we provide the greatest value to our clients through a combination of our industry expertise, business process knowledge, and consulting excellence. Beyond your day-to-day responsibilities, throughout your career at Clarkston you will: Have the support and mentorship of your Clarkston colleagues and leaders Own your career – you'll be able to take charge of your career journey with diverse opportunities to lead and expand your skillset both at the client site and within the firm Have the opportunity to make a real and positive impact not only the clients you work with, but on the firm as well Travel Requirement Travel is an integral part of this role and is estimated to average 20-30%. This may vary based upon client and project needs. While travel is a requirement of the role, due to COVID-19 restrictions, all non-essential travel has been limited and any on-site requests are subject to review. When not traveling, consultants work from their home office. Relocation is not required. Requirements What We’re Looking For: The Cloud Data Architect will help support our client(s) by serving in a lead capacity on client initiatives, mentoring more junior data architects and data engineers in Clarkston’s analytics team, assisting in defining client solutions, and support managing the delivery of those solutions. An ideal candidate as a Cloud Data Architect would have the following qualifications and experience: Experience with data management solutions using data lake platform tools and technologies Experience with data architecture, specifically in support of data warehousing, business intelligence, master data management, and reference data management Familiarity with delivering Data as a Service (DaaS) concepts from enterprise repositories using REST APIs Familiarity with Azure or AWS-based data and data management tools, such as Azure SQL Azure Data Catalog, Azure Service Fabric, and microservices Familiarity with data integration points for TOGAF (or other recognized architecture framework) Working knowledge of development or operations framework methodologies, including Information Technology Infrastructure Library (ITIL), Systems Development Life Cycle (SDLC), etc. Familiarity with developing data catalogues, and integrating with existing enterprise architecture Familiarity with cloud data platforms and process automation Experience in using various data modeling techniques and their appropriate usage in data integration Experience in working with all levels of staff, management, stakeholders, and vendors Significant experience in performing analysis of business processes and functions Significant experience in work as an engineer or technical subject matter expert in two or more of the following areas: infrastructure; data; application; and/or security related technology Effective skill creating system diagrams for review by both technical and non-technical audiences Advanced analytical and conceptual skills to create original concepts/theories for various projects Develop and apply architectural governance based on business and information technology strategies Effective skill applying innovative approaches to solve technical design issue Anticipate internal and/or external business challenges including regulatory; recommend process, product or service enhancements Provide forward thinking technical expertise in current and emerging technologies, trends and practices Minimum degree required: bachelor's or 4-year degree from an accredited college or university Benefits Our benefits include: Comprehensive Health and Wellness Benefits (Medical, Dental, Vision, and more) 401k with company contributions Paid vacation, personal days, holidays, and sick leave Paid Parental Leave and Family Building Benefits (Adoption, Surrogacy, and Infertility Support) Life and Disability Insurance Training and Professional Development investments, Tuition Assistance, and more Visit Careers at Clarkston to learn more about our culture, benefits, and opportunities. We hope you’ll join us! COVID-19 Vaccination Statement While Clarkston Consulting has not mandated vaccination at this time, COVID-19 vaccinations are required in order to access Clarkston Consulting facilities and those of many of our clients. With this in mind, all prospective hires will be required to provide their vaccination status. If you require alternative methods of application or screening, you must approach the employer directly to request this as Indeed is not responsible for the employer's application process.",https://www.indeed.com/jobs?q=Data+Architect&l=Chicago%2C+IL&sc=0kf%3Aattr%28FCGTU%7CHFDVW%7CQJZM9%7CUTPWG%252COR%29explvl%28ENTRY_LEVEL%29jt%28fulltime%29%3B&vjk=6e87408700aa8c68
1,c4e8b761eb4e8117,Data Architect,"Chicago, IL",ENTRY_LEVEL,BACHELORS_DEGREE,FULLTIME,"Systems Architect-Enterprise Sales-Chicago - job post Cisco Systems 6,232 reviews 4025 W Madison St, Chicago, IL 60624 Full-time You must create an Indeed account before continuing to the company website to apply Apply on company site save-icon Job details Job Type Full-time Why You'll Love Cisco We change the World, you will become passionate about your employer and the brand you represent. Everything is converging on the Internet, making networked connections more meaningful than ever before in our lives. Our employees' groundbreaking ideas impact everything. Here, that means we take creative ideas from the drawing board to dynamic solutions that have real world impact. You'll collaborate with Cisco leaders, partner with mentors, and develop incredible relationships with colleagues who share your interest in connecting the unconnected. You'll be part a team that cares about its customers, enjoys having fun, and you'll take part in changing the lives of those in our local communities. Come prepared to be encouraged and inspired. What You'll Do As we continue to uphold our standard of excellence in Global Enterprise Sales, we are embracing unprecedented innovation as tremendous opportunity for growth. We succeed because we listen to our customers and anticipate their needs as the market shifts and technology transitions accelerate. Our customer are versatile, agile and adopt technology fast to compete aggressively and grow their business. We are confident our model in Global Enterprise provides you with unlimited opportunities to succeed at Cisco. Our culture is one of support and empowerment. Cisco is looking for a Systems Architect (SA) with a strong Enterprise Networking, Data Center, Collaboration, Security, Automation, and Cloud background. The SA role is a customer focused technical sales professional who ensures that technical information and guidance is provided to the customer, delivering meaningful outcomes based on Cisco’s product and services portfolio. The SA will partner with our Account Executives in a pre-sales technical function, showcasing Cisco solutions, providing customer presentations, performing technical demonstrations, creating BoM’s, and running proof of concept activities. The SA will partner, consult, influence and design solutions to allow the customer to meet their desired outcomes. In addition to technology aptitude and the ability to learn quickly and stay current; the ideal candidate's interpersonal, presentation and troubleshooting skills should evoke passion and confidence. In addition to the above, the SA will perform the following functions: Technology solution consultant to the customer and the Cisco account team Leverage an array of Cisco technology, services and support specialists Collaborate closely with Account Sales Executives on account planning activities Educate the customer on Cisco differentiation, creating demand Set brand preference to Cisco Align Cisco’s product and services capabilities to customers business drivers Apply Business Architecture fundamentals to the technical selling process Who You'll Work With The candidate will consult with partner and internal resources for selected accounts in the assigned territory. Keep up-to-date on relevant competitive solutions, products and services. Assist with the development of formal sales plans and proposals for assigned opportunities. Actively participate as a specialist on assigned Virtual Team and provides consultative support in their area of specialization to other Systems Engineers. Who You Are 8+ years of computing industry related experience. Cisco product experience or relevant experience in key competitor offerings in technology area of emphasis required. Pre-Sales experience required. Typically requires BS/BA (EE/CS) or equivalent. Minimum CCNP, CCDP, VCP or similar vendor certification required. Knowledge of Cisco's Solutions, networking fundamentals required. Customer intimacy skills Business Architecture awareness Why Cisco #WeAreCisco, where each person is unique, but we bring our talents to work as a team and make a difference powering an inclusive future for all. We embrace digital, and help our customers implement change in their digital businesses. Some may think we’re “old” (36 years strong) and only about hardware, but we’re also a software company. And a security company. We even invented an intuitive network that adapts, predicts, learns and protects. No other company can do what we do – you can’t put us in a box! But “Digital Transformation” is an empty buzz phrase without a culture that allows for innovation, creativity, and yes, even failure (if you learn from it.) Day to day, we focus on the give and take. We give our best, give our egos a break, and give of ourselves (because giving back is built into our DNA.) We take accountability, bold steps, and take difference to heart. Because without diversity of thought and a dedication to equality for all, there is no moving forward. So, you have colorful hair? Don’t care. Tattoos? Show off your ink. Like polka dots? That’s cool. Pop culture geek? Many of us are. Passion for technology and world changing? Be you, with us! Message to applicants applying to work in the U.S.: When available, the salary range posted for this position reflects the projected hiring range for new hire, full-time salaries in U.S. locations, not including equity or benefits. For non-sales roles the hiring ranges reflect base salary only; employees are also eligible to receive annual bonuses. Hiring ranges for sales positions include base and incentive compensation target. Individual pay is determined by the candidate's hiring location and additional factors, including but not limited to skillset, experience, and relevant education, certifications, or training. Applicants may not be eligible for the full salary range based on their U.S. hiring location. The recruiter can share more details about compensation for the role in your location during the hiring process. U.S. employees have access to quality medical, dental and vision insurance, a 401(k) plan with a Cisco matching contribution, short and long-term disability coverage, basic life insurance and numerous wellbeing offerings. Employees receive up to twelve paid holidays per calendar year, which includes one floating holiday, plus a day off for their birthday. Employees accrue up to 20 days of Paid Time Off (PTO) each year and have access to paid time away to deal with critical or emergency issues without tapping into their PTO. We offer additional paid time to volunteer and give back to the community. Employees are also able to purchase company stock through our Employee Stock Purchase Program. Employees on sales plans earn performance-based incentive pay on top of their base salary, which is split between quota and non-quota components. For quota-based incentive pay, Cisco pays at the standard rate of 1% of incentive target for each 1% revenue attainment against the quota up to 100%. Once performance exceeds 100% quota attainment, incentive rates may increase up to five times the standard rate with no cap on incentive compensation. For non-quota-based sales performance elements such as strategic sales objectives, Cisco may pay up to 125% of target. Cisco sales plans do not have a minimum threshold of performance for sales incentive compensation to be paid.",https://www.indeed.com/jobs?q=Data+Architect&l=Chicago%2C+IL&sc=0kf%3Aattr%28FCGTU%7CHFDVW%7CQJZM9%7CUTPWG%252COR%29explvl%28ENTRY_LEVEL%29jt%28fulltime%29%3B&vjk=c4e8b761eb4e8117
2,32e2d62bd9af2ded,Data Architect,"Chicago, IL",ENTRY_LEVEL,BACHELORS_DEGREE,FULLTIME,"Computer Services Support Specialist - job post Sargent & Lundy 168 reviews 55 East Monroe Street, Chicago, IL 60603 Full-time You must create an Indeed account before continuing to the company website to apply Apply on company site save-icon Job details Job Type Full-time Overview: Sargent & Lundy is one of the most experienced full-service architect-engineering firms in the world. Founded in 1891, the firm is a global leader in power and energy with expertise in grid modernization, renewable energy, energy storage, nuclear power, and fossil fuels. Sargent & Lundy delivers comprehensive project services—from consulting, design and implementation to construction management, commissioning and operations/maintenance—with an emphasis on quality and safety. The firm serves public and private sector clients in the power and energy, gas distribution, industrial, and government sectors. Our Core Values Every decision we make is guided by our core values. By upholding these six principles, we support our clients, employees, and community. They are the compass we follow as we continue to grow our business and lead the industry. Quality – We provide high-quality deliverables and services through an uncompromising focus on peer review, safety, and continuous improvement. Accountability – Our actions demonstrate the highest levels of professionalism, integrity, and respect. Our People – We value diverse perspectives, encourage professional growth, and are committed to providing a work community where people thrive. Our work is challenging but rewarding. Our Clients – We deliver value and exceed our clients’ expectations through outstanding customer service, personal accessibility, and clear communication. Innovation – Since 1891, we have invested in the people, training, tools, and technology needed to quickly adapt in a constantly changing world. Meaningful Impact – We make a positive impact in the communities where we work and live. Responsibilities: Sargent and Lundy is currently looking for a full time Computer Services Support Specialist. This position is based in our Downtown Chicago Office, and limited travel will be required. The Computer Support Specialist will provide hardware and software support for employees’ Laptops/PC’s and provide support for software installation and other types of office technology. Responsibilities Setup and installation of PC's and monitors for end users, Perform swaps of PC's for users (including imaging, setup, data transfer, delivery and installation). Trouble shoot computer and other office technology related hardware and software problems while offering technical support and guidance to users, in person or remotely. Collaborate with other office technology and computing systems support groups to restore service and/or identify problems. Utilize and maintain ticketing and task management tools. Setup and support a wide variety of Video Conference and Internet Collaboration meetings with direct interface with the presenters in small and large conference rooms. Provide support of mobile, wireless and VPN technologies. Document, track, and monitor each problem to ensure a timely resolution Qualifications: We do not sponsor employees for work authorization in the U.S. for this position. This position requires: Minimum 1-2 years related experience Experience in a corporate environment is a plus High School Diploma or equivalent is required Strong working knowledge of desktop and laptop computer hardware components, Windows 10/11, and Microsoft Office Ability to perform basic troubleshooting of general applications Basic knowledge of Video Conferencing and Collaboration Systems A+ certification is a plus. Excellent verbal communication and customer service skills Ability to maintain regular attendance and timeliness Ability to follow established guidelines, be organized and see tasks through to completion Must be self-motivated, capable of multitasking, have excellent time management skills and be able to work well in a team environment Must be able to lift and carry up to forty (40) pounds (e.g. computer, monitor, misc equipment etc.) Occasional travel will be required to other S&L office locations Sargent & Lundy is an Equal Opportunity/Affirmative Action employer. All qualified applicants will receive consideration for employment without regard to race, color, religion, sex, sexual orientation, gender identity, national origin, disability status, protected veteran status, or any protected status as defined by law. Reasonable accommodation may be made to enable individuals with disabilities to perform the essential functions of the position",https://www.indeed.com/jobs?q=Data+Architect&l=Chicago%2C+IL&sc=0kf%3Aattr%28FCGTU%7CHFDVW%7CQJZM9%7CUTPWG%252COR%29explvl%28ENTRY_LEVEL%29jt%28fulltime%29%3B&vjk=32e2d62bd9af2ded
3,cd79ae3c12e84c37,Data Architect,"Chicago, IL",ENTRY_LEVEL,BACHELORS_DEGREE,FULLTIME,"Configuration Engineer - job post Pricefx Chicago, IL 60606 • Remote Full-time Apply now Apply now save-icon Job details Job Type Full-time We are a young and unconventional software company created in 2011 by experienced pricing software and pricing consulting professionals. As the first pureplay, native Cloud and SaaS provider in our industry, Pricefx became and intends to stay the leading SaaS Pricing (Price Optimization & Management) and CPQ (Configure-Price-Quote) vendor . We are an agile company that brings good ideas to life quickly and is committed to market-driven innovation . We are highly flexible, our customers are from diverse industries and sizes with brands like Michelin, Bosch, and Danone. We are a solid and sustainable company that is and will be strongly growing globally for the years ahead. It’s a great time to join us and grow with us. Your mission? Are you a software developer but you find it boring and repetitive? Do you miss communication with people? Then join Pricefx and use your skills to help our customers reach their goals! With us, you will be in direct contact with the customers, capturing their requirements, discussing their needs, proposing the solutions, and making it all real by configuring our software. You will be in charge of… Assist in designing, implementation, and configuration of Pricefx solution according to customer needs using Groovy language Assist in communicating, gathering, and formalizing customer requirements Cooperating with Pricefx support team and customers on resolving technical issues Supporting Solution Architects to develop and maintain user stories Configuring solution according to Solution Architecture and user stories Cooperating with the project team to resolve issues Contributing to Product enhancements What should you have to succeed? To achieve all this, you need to be patient yet proactive, gracious yet confident, independent yet cooperative. But mainly, you need to be eager for challenges as both your soft skills and technical knowledge will be truly tested in Pricefx! You need to have excellent communication and consulting skills , as well as: Critical knowledge and experience object-oriented programming principles Programming experience is a must. We use Groovy , but you will learn how to use it fast, if you already have a solid knowledge of JAVA or similar programming language (.NET, possibly JavaScript or Python). Experience with relational databases is a must Important knowledge and experience web technologies (HTML, JSON, REST API, etc.) if you already have knowledge of Groovy , it is a big plus pricing domain projects is a big plus enterprise software implementation projects is an advantage This would make it easier… IT and pricing knowledge CPQ experience SaaS experience Location Chicago, IL or Remote Opportunity Other job specifics… Full-time employment Ability to travel up to 10%, with occasional international travel What will you love about us? You will be part of a global team and a company culture that is characterized by the free and respected exchange of professional and cultural perspectives. As a rapidly growing organization, you will have opportunities to explore creative ways of delivering continuous value to our clients and charting a career path that reflects the unique skill set and experience you bring to Pricefx. We will give you the option of your own devices by providing a monthly $240-IT allowance (laptop, mobile, and internet). We have built a benefits program to match the strength of our team. Our office is centrally located in the West Loop of Chicago and plenty of flexibility on public transportation options. We match your 401K contribution dollar for dollar up to 4% and vest it starting the first month. We give you 4 weeks of sick time and 14 public holidays each year plus your birthday. We have an amazing healthcare coverage sponsored by the ADP platform. We offer 12 weeks paid maternity leave. By applying, I confirm that I acknowledge and understand how Pricefx processes my personal data as per information in GDPR for Candidates . #BI-Remote If you require alternative methods of application or screening, you must approach the employer directly to request this as Indeed is not responsible for the employer's application process.",https://www.indeed.com/jobs?q=Data+Architect&l=Chicago%2C+IL&sc=0kf%3Aattr%28FCGTU%7CHFDVW%7CQJZM9%7CUTPWG%252COR%29explvl%28ENTRY_LEVEL%29jt%28fulltime%29%3B&vjk=cd79ae3c12e84c37
