,job_id,job_title,location,experience,education,job_type,job_description,job_link
0,55b6f0cfab336bda,Data Scientist,"San Francisco, CA",SENIOR_LEVEL,DOCTORAL_DEGREE,FULLTIME,"Sr Staff Engineer, AI/ML - job post Uber 2,773 reviews San Francisco, CA 94103 $243,000 a year -  Full-time You must create an Indeed account before continuing to the company website to apply Apply on company site save-icon Job details Salary $243,000 a year Job Type Full-time About the Role We are looking for a Sr Staff Engineer who has past experience of developing AI/ML technology to drive automation and efficiency for business. The role expects the person to architect and scale AI/ML application at scale leveraging human in the loop keeping machine first. The challenges in the role would include disambiguating different real world applications of ML operations at scale across use-cases like Labelling large data sets for industries like Autonomous Vehicles, translating content of different priorities across tiers of languages using a combination of machine translations and linguistic experts in the loop, among many others. In this role you will: Build technology systems to solve the real world operations problems leveraging machines and HITL Partner with operations, customer engineers and researchers to drive data processing that feeds into machine learning Identify opportunities to reduce the cost of human operations by leveraging automations Minimum qualifications: PhD or equivalent in Computer Science, Engineering, Mathematics or related field AND 6-years full-time Software Engineering work experience OR 8-years full-time Software Engineering work experience, WHICH INCLUDES 6-years total technical software engineering experience in one or more of the following areas: Programming language (e.g. C, C++, Java, Python, or Go) Note the 6-years total of specialized software engineering experience may have been gained through education and full-time work experience, additional training, coursework, research, or similar (OR some combination of these). The years of specialized experience are not necessarily in addition to the years of Education & full-time work experience indicated. Technical skills: Required: Experience of solving problems leveraging AI/ML to drive automation and efficiency Experience developing engineering systems to leverage humans in the loop (HITL) to train machines at scale Iterated and improved the accuracy and performance of a machine first HITL engineering process Partnered across functions such as global business & operations, and different lines of businesses to build automation Preferred: Experience in solving problems in Autonomous Vehicles Industry Experience of solving problems in AR/VR (Artificial and Virtual Reality) industry. Building systems that helps ML Operations scale Uber is proud to be an Equal Opportunity/Affirmative Action employer. All qualified applicants will receive consideration for employment without regard to sex, gender identity, sexual orientation, race, color, religion, national origin, disability, protected Veteran status, age, or any other characteristic protected by law. We also consider qualified applicants regardless of criminal histories, consistent with legal requirements. If you have a disability or special need that requires accommodation, please let us know by completing this form. Offices continue to be central to collaboration and Uber’s cultural identity. Unless formally approved to work fully remotely, Uber expects employees to spend at least half of their work time in their assigned office. For certain roles, such as those based at green-light hubs, employees are expected to be in-office for 100% of their time. Please speak with your recruiter to better understand in-office expectations for this role. For San Francisco, CA-based roles: The base salary range for this role is $243,000 per year - $270,000 per year. For Sunnyvale, CA-based roles: The base salary range for this role is $243,000 per year - $270,000 per year. For all US locations, you will be eligible to participate in Uber's bonus program, and may be offered an equity award & other types of comp. You will also be eligible for various benefits. More details can be found at the following link https://www.uber.com/careers/benefits.",https://www.indeed.com/jobs?q=Data+Scientist&l=San+Francisco%2C+CA&sc=0kf%3Aattr%286QC5F%252COR%29explvl%28SENIOR_LEVEL%29jt%28fulltime%29%3B&start=10&pp=gQAPAAAAAAAAAAAAAAAB_lEzKAAMAQAC_8vWGFauEuvsAAA&vjk=55b6f0cfab336bda
1,fa7a2a95e7d5ea3d,Data Scientist,"San Francisco, CA",SENIOR_LEVEL,DOCTORAL_DEGREE,FULLTIME,"Senior Data Engineer - SFL Scientific - job post Deloitte 11,490 reviews San Francisco, CA Full-time You must create an Indeed account before continuing to the company website to apply Apply on company site save-icon Job details Job Type Full-time Senior Data Engineer SFL Scientific, a Deloitte Business practice brings together several key capabilities to architect integrated programs that transform our clients' businesses, including Strategic Growth Transformation, Transformation Strategy & Design, Technology Strategy & Business Transformation, and AI & Data Strategy. Professionals will serve as trusted advisors to our clients, working with them to make clear data-driven choices about where to play and how to win - ultimately driving growth and enterprise value. We are hiring a Senior Data Engineer to support the design and develop solutions for various organizations looking to implement tools, software, and processes that support machine learning and AI initiatives across healthcare, life sciences, manufacturing, energy, and other sectors. Work you'll do As a Senior Data Engineer you work cross-functionally with data scientists, machine learning engineers, project managers, and industry experts to develop robust AI infrastructure and deployment services for our novel machine learning applications. Key to this role is the ability to demonstrate expertise in cloud deployment, DevOps, MLOps, data engineering, and streamlining IT infrastructure processes for organizations across a wide variety of industries. In our consultative approach, we are platform agnostic and are committed to providing the best technical solutions for each client and solution. Our engineering team leverages emerging technologies across cloud, HPC, DevOps, and MLOps to create solutions and products that address complex issues and business problems faced by global organizations to include cancer detection, drug discovery, optimizing population health and clinical trials, autonomous systems and edge AI, and renewable energy. Join us to expand your technical career through the lens of consulting and work on many novel projects and use cases to expand your data science & AI skills. Work with clients to design, develop, and deploy new architectures for machine learning & automation applications such as ELT functions, HPC/compute infrastructure, AWS/Azure solutions, database solutions, and optimization of DevOps procedures Leverage skills in modern data architecture, cloud engineering, data transformation, and management of structured and unstructured data sources Support and enhance data architecture, and data pipelines, and define database schemas (Graph DB, SQL, NoSQL) to support algorithm scalability and deployment based on agile business priorities and technology initiatives Participate in architectural discussions to ensure solutions are designed for successful deployment, security, and high availability in the cloud or on-prem Adopt and maintain best engineering practices in automation, HPC, CI/CD, and AIOps The Team SFL Scientific, a Deloitte Business, is a data science professional services practice focused on strategy, technology, and solving business challenges with Artificial Intelligence (AI). The team has a proven track record serving large, market-leading organizations in the private and public sectors, successfully delivering high-quality, novel and complex projects, and offering deep domain and scientific capabilities. Made up of experienced AI strategists, data scientists, and AI engineers, they serve as trusted advisors to executives, helping them understand and evaluate new and essential areas for AI investment and identify unique opportunities to transform their businesses. Basic Qualifications: Bachelor's degree in a STEM field or equivalent experience (Computer Science, Engineering, Physics etc.); Master's degree preferred 4+ years' experience in data engineering, cloud engineering, MLOps, while building highly scalable and secure solutions Proficient in Python, SQL, Shell scripting Experience with distributed computing frameworks (e.g., Spark, Dask), cloud platforms (e.g. AWS, Azure), containerization, and supporting analytics libraries Expertise with code management and DevOps tools (e.g., Docker, Kubernetes, Jenkins, etc.) Experience with workflow and data management solutions such as Airflow, Kafka, Glue, etc. Experience designing data architectures and understanding of different types of databases or platforms (relational, NoSQL, graph, etc.) Strong analytical and problem-solving skills with the ability to develop novel and efficient solutions Limited immigration sponsorship may be available Ability to travel 10%, on average, based on the work you do and the clients and industries/sectors you serve Live within commuting distance to one of Deloitte's consulting offices Preferred Qualifications: Master's or Ph.D. degree in Computer Science, Information Technology, or related STEM field AWS/Azure Certifications (AWS/Azure Certified: SysOps Administrator, DevOps Engineer, Solutions Architect). Expertise in designing and scaling IT architectures, data lakes, & database schemas (Graph, SQL, NoSQL), etc. Demonstrated experience launching AI/ML solutions into production environments, such as into cloud or HPC/GPU environments The wage range for this role takes into account the wide range of factors that are considered in making compensation decisions including but not limited to skill sets; experience and training; licensure and certifications; and other business and organizational needs. The disclosed range estimate has not been adjusted for the applicable geographic differential associated with the location at which the position may be filled. At Deloitte, it is not typical for an individual to be hired at or near the top of the range for their role and compensation decisions are dependent on the facts and circumstances of each case. A reasonable estimate of the current range is $138,000 to $230,000. You may also be eligible to participate in a discretionary annual incentive program, subject to the rules governing the program, whereby an award, if any, depends on various factors, including, without limitation, individual and organizational performance. #MonitorDeloitte #DeloitteJobs #StrategyConsulting #DeloitteStrategy #Strategy22 #SFL22",https://www.indeed.com/jobs?q=Data+Scientist&l=San+Francisco%2C+CA&sc=0kf%3Aattr%286QC5F%252COR%29explvl%28SENIOR_LEVEL%29jt%28fulltime%29%3B&start=10&pp=gQAPAAAAAAAAAAAAAAAB_lEzKAAMAQAC_8vWGFauEuvsAAA&vjk=fa7a2a95e7d5ea3d
2,bd77e407b55f87a3,Data Scientist,"San Francisco, CA",SENIOR_LEVEL,DOCTORAL_DEGREE,FULLTIME,"Senior/Staff Machine Learning Engineer - Prediction - job post Zoox (part of Amazon.com) 9 reviews Foster City, CA $221,000 - $319,000 a year -  Full-time You must create an Indeed account before continuing to the company website to apply Apply on company site save-icon Job details Salary $221,000 - $319,000 a year Job Type Full-time The Prediction team is responsible for forecasting the future states of all the dynamic agents around our vehicle. To account for the inherent uncertainty of predicting the future, our job is to compute a probabilistic representation over the intentions and movements of other agents. Our probabilistic predictions are then tightly integrated into our Planning system to deliver a safe and comfortable ride. Responsibilities Develop new algorithms to model and recognize the future behavior of all other agents in the world Leverage our large-scale machine learning infrastructure to discover new solutions and push the boundaries of the field Engineer software that runs on-vehicle to efficiently execute our algorithms in real time Develop metrics and tools to analyze errors and understand improvements of our systems Collaborate with engineers on Perception and Planning to solve the overall Autonomous Driving problem in complex urban environments Qualifications BS, MS, or PhD degree in computer science or related field Experience with training and deploying Deep Learning models Experience with production Machine Learning pipelines: dataset creation, training frameworks, metrics pipelines Fluency in C++ Extensive experience with programming and algorithm design Strong mathematics skills 8+ years of experience in a related field Bonus Qualifications Conference or Journal publications in Machine Learning or Robotics related venues Prior experience with Prediction and/or autonomous vehicles in general Fluency in Python Compensation There are three major components to compensation for this position: salary, Amazon Restricted Stock Units (RSUs), and Zoox Stock Appreciation Rights. The salary will range from $221,000 to $319,000. A sign-on bonus may be part of a compensation package. Compensation will vary based on geographic location, job-related knowledge, skills, and experience. Zoox also offers a comprehensive package of benefits including paid time off (e.g. sick leave, vacation, bereavement), unpaid time off, Zoox Stock Appreciation Rights, Amazon RSUs, health insurance, long-term care insurance, long-term and short-term disability insurance, and life insurance. Vaccine Mandate Employees working in this position will be required to have received a single dose of the J&J/Janssen COVID-19 vaccine OR have completed the two-dose Pfizer or Moderna vaccine series. In addition, employees will be required to receive a COVID-19 booster vaccine within two months of becoming eligible for the booster vaccine. Employees will be required to show proof of vaccination status upon receipt of a conditional offer of employment. That offer of employment will be conditioned upon, among other things, an Applicant’s ability to show proof of vaccination status. Please note the Company provides reasonable accommodations in accordance with applicable state, federal, and local laws. About Zoox Zoox is developing the first ground-up, fully autonomous vehicle fleet and the supporting ecosystem required to bring this technology to market. Sitting at the intersection of robotics, machine learning, and design, Zoox aims to provide the next generation of mobility-as-a-service in urban environments. We’re looking for top talent that shares our passion and wants to be part of a fast-moving and highly execution-oriented team. Follow us on LinkedIn A Final Note: You do not need to match every listed expectation to apply for this position. Here at Zoox, we know that diverse perspectives foster the innovation we need to be successful, and we are committed to building a team that encompasses a variety of backgrounds, experiences, and skills.",https://www.indeed.com/jobs?q=Data+Scientist&l=San+Francisco%2C+CA&sc=0kf%3Aattr%286QC5F%252COR%29explvl%28SENIOR_LEVEL%29jt%28fulltime%29%3B&start=10&pp=gQAPAAAAAAAAAAAAAAAB_lEzKAAMAQAC_8vWGFauEuvsAAA&vjk=bd77e407b55f87a3
3,f0093b4829343be7,Data Scientist,"San Francisco, CA",SENIOR_LEVEL,DOCTORAL_DEGREE,FULLTIME,"Associate Director, Statistical Programming - job post Gilead Sciences 519 reviews Foster City, CA 94404 Full-time You must create an Indeed account before continuing to the company website to apply Apply on company site save-icon Job details Job Type Full-time For Current Gilead Employees and Contractors: Please log onto your Internal Career Site to apply for this job. At Gilead we believe every employee deserves a great leader. As a people leader now or in the future, we expect that you will model and create an environment of inclusion, be intentionally focused on the hiring, development, growth and retention of talent, and empower teams to align and achieve goals. Job Description Associate Director, Statistical Programming Job Responsibilities and Skills: Works collaboratively with Clinical Development staff to meet project deliverables and timelines for statistical data analysis and reporting. Generates or oversees the production of programming deliverables (e.g., tables, listings) for study reports and integrated summaries. Anticipates resource needs and works with management and HR to ensure adequate long-term resource allocation within a therapeutic project. Manage a team of diversified statistical programmers. Ensures programming and corresponding documentation is completed in a manner that is consistent with departmental procedures. Directs the design and/or coding of analysis files. Provides primary and secondary programming support as needed and harmonizes strategic initiatives (e.g., process improvement) across a therapeutic area or equivalent. Excellent verbal and written communication skills and interpersonal skills are required. Has a thorough understanding of clinical trials design and reporting process, as well as regulatory reporting requirements including electronic data submissions with FDA, PMDA, and other global agencies. Has hands-on and leading experience with regulatory submissions and post-filing activities such as FDA, EMA, PMDA filing, RtQs, and inspections. Experience with and demonstrated ability to interact with others departments to define and produce user-defined statistical reports (e.g., ad hoc requests). Has the proven ability to anticipate and resolve study related issues and conflicts within a therapeutic project. Experience with and proven ability in oversight or managing outsourced study. Proven ability to create buy-in and support and has demonstrated ability to negotiate timelines. Has the ability to directly supervise personnel. Manages critical deadlines, demonstrates ability to resolves issues, and ensures studies will be completed within designated timeframe. Responsible for all statistical programming activities within a therapeutic project or equivalent. Proven ability and Viewed as a key resource by more senior individuals on technical initiatives and may represent the Company on contracts. Identifies and leads strategic initiatives for the programming group. Serves as project leader on studies of greater complexity. May attend CST (Clinical Sub- Team) meetings as a representative of Programming group Typical Education and Experience: 10 years of experience and a BS degree in Biostatistics/Computer Science or equivalent. 8 years of experience and a MS degree in Biostatistics/Computer Science or equivalent. 2 years of experience and a PhD degree in Biostatistics/Computer Sciences or equivalent. For jobs in the United States: As an equal opportunity employer, Gilead Sciences Inc. is committed to a diverse workforce. Employment decisions regarding recruitment and selection will be made without discrimination based on race, color, religion, national origin, gender, age, sexual orientation, physical or mental disability, genetic information or characteristic, gender identity and expression, veteran status, or other non-job related characteristics or other prohibited grounds specified in applicable federal, state and local laws. In order to ensure reasonable accommodation for individuals protected by Section 503 of the Rehabilitation Act of 1973, the Vietnam Era Veterans' Readjustment Act of 1974, and Title I of the Americans with Disabilities Act of 1990, applicants who require accommodation in the job application process may contact careers@gilead.com for assistance. Following extensive monitoring, research, consideration of business implications and advice from internal and external experts, Gilead has made the decision to require all U.S., Canada, Australia, Singapore, and Hong Kong employees and contractors to receive the COVID-19 vaccines as a condition of employment. “Full vaccination” is defined as two weeks after both doses of a two-dose vaccine or two weeks since a single-dose vaccine has been administered. Anyone unable to be vaccinated, either because of a sincerely held religious belief or a medical condition or disability that prevents them from being vaccinated, can request a reasonable accommodation. For more information about equal employment opportunity protections, please view the 'Know Your Rights' poster. NOTICE: EMPLOYEE POLYGRAPH PROTECTION ACT YOUR RIGHTS UNDER THE FAMILY AND MEDICAL LEAVE ACT PAY TRANSPARENCY NONDISCRIMINATION PROVISION Our environment respects individual differences and recognizes each employee as an integral member of our company. Our workforce reflects these values and celebrates the individuals who make up our growing team. Gilead provides a work environment free of harassment and prohibited conduct. We promote and support individual differences and diversity of thoughts and opinion. For Current Gilead Employees and Contractors: Please log onto your Internal Career Site to apply for this job.",https://www.indeed.com/jobs?q=Data+Scientist&l=San+Francisco%2C+CA&sc=0kf%3Aattr%286QC5F%252COR%29explvl%28SENIOR_LEVEL%29jt%28fulltime%29%3B&start=10&pp=gQAPAAAAAAAAAAAAAAAB_lEzKAAMAQAC_8vWGFauEuvsAAA&vjk=f0093b4829343be7
