,job_id,job_title,location,experience,education,job_type,job_description,job_link
0,bf09c73096983b98,Data Architect,"Austin, TX",MID_LEVEL,DOCTORAL_DEGREE,FULLTIME,"Solutions Architect - job post NVIDIA 257 reviews Austin, TX $141,000 - $228,000 a year -  Full-time You must create an Indeed account before continuing to the company website to apply Apply on company site save-icon Job details Salary $141,000 - $228,000 a year Job Type Full-time We are looking for a Machine Learning Engineer/Solution Architect with experience in deploying Machine Learning (ML), Deep Learning (DL) models on prem and in the cloud. As part of the Solution Architecture organization, we work with the most sophisticated computing hardware and software, driving the latest breakthroughs in deep learning and machine learning with NVIDIA’s enterprise customers. This role offers an excellent opportunity to build your career in the rapidly growing field of deep learning while enabling the world's most successful technology companies. Primary responsibilities will be to lead software/application customer technical engagements around NVIDIA products and technologies. Join us in this exciting endeavor! What You’ll Be Doing: A considerable part of the day-to-day job is staying up on pioneering Deep Learning and Machine Learning ecosystem. You'll be called on to help architect and scale high-performance, distributed AI deployments on prem or in the cloud that are built with the latest NVIDIA GPU supercomputers. Document what you know and teach others. This can vary from building targeted training for partners and other Solutions Architects to writing whitepapers, blogs, and wiki articles, to working through challenging problems with a partner on a whiteboard. Answer questions and provide mentorship. Work with Partner Business Managers to assist partners and customers on their critical projects. You will help them build their GPU and DPU enabled Accelerated Compute datacenters or cloud services to get the most out of their investment. Lead and develop proof-of-concepts (PoCs) for solutions applied to enterprise and industrial applications such as LLM, NLP/NLU, recommender systems, image recognition and video analytics using ML/DL frameworks. Support the business development team through the sales process for GPU/DPU/Network hardware/software products. Responsible for technical relationships and enabling customers in building innovative NVIDIA technology solutions. Partner with NVIDIA Engineering, Product, Sales teams to secure design wins at customers. Enable development and growth of NVIDIA product features through customer feedback and PoC evaluations. What We Need To See: BS, MS, or PhD in Computer Science, Electrical/Computer Engineering, Physics, Mathematics, or other Engineering fields or equivalent experience. 4+ years of work-related experience in Deep Learning and Machine Learning, including deep learning frameworks TensorFlow or PyTorch, GPU and CUDA experience extremely helpful. Experience working with DevOps on prem or in cloud environments, including but not limited to Docker/Containers, Kubernetes, cloud APIs, IaaS and Data Center deployments, additional experience with DPUs will be extremely helpful. Deep understanding of dense data-center design including compute, storage, networking, cloud APIs and IaaS. Ability to multitask effectively in a dynamic environment. Strong analytical and problem-solving skills. Clear written and oral communication skills with the ability to effectively collaborate and coordinate across cross-functional teams in engineering, sales, marketing, product, and program management. Comfortable working in a customer-facing environment. Self-starter with a passion for growth, enthusiasm for continuous learning and sharing findings across teams. Ways To Stand Out From The Crowd: External customer-facing skill-set and background. Skilled in deploying ML/DL models at scale on cloud computing clusters in production. Development experience with NVIDIA software libraries and GPUs or DPUs. Knowledge of MLOps, DevOps and Cloud oriented workflows using Docker/containers, Kubernetes, cloud APIs, data center deployments etc. Knowledge of MLPerf, LLM, AWS, Azure or GCP. Able to think creatively to debug and solve complex problems. NVIDIA is widely considered to be one of the technology world’s most desirable employers! We have some of the most forward-thinking and hardworking people in the world working for us. If you're creative and autonomous, we want to hear from you! The base salary range is $141,000 - $228,000. Your base salary will be determined based on your location, experience, and the pay of employees in similar positions. You will also be eligible for equity and benefits . NVIDIA is committed to fostering a diverse work environment and proud to be an equal opportunity employer. As we highly value diversity in our current and future employees, we do not discriminate (including in our hiring and promotion practices) on the basis of race, religion, color, national origin, gender, gender expression, sexual orientation, age, marital status, veteran status, disability status or any other characteristic protected by law.",https://www.indeed.com/jobs?q=Data+Architect&l=Austin%2C+TX&sc=0kf%3Aattr%286QC5F%252COR%29explvl%28MID_LEVEL%29jt%28fulltime%29%3B&vjk=bf09c73096983b98
1,edcb8b64614e611d,Data Architect,"Austin, TX",MID_LEVEL,DOCTORAL_DEGREE,FULLTIME,"Solutions Architect - job post Oski Technology 3 reviews Austin, TX $141,000 - $228,000 a year -  Full-time You must create an Indeed account before continuing to the company website to apply Apply on company site save-icon Job details Salary $141,000 - $228,000 a year Job Type Full-time We are looking for a Machine Learning Engineer/Solution Architect with experience in deploying Machine Learning (ML), Deep Learning (DL) models on prem and in the cloud. As part of the Solution Architecture organization, we work with the most sophisticated computing hardware and software, driving the latest breakthroughs in deep learning and machine learning with NVIDIA’s enterprise customers. This role offers an excellent opportunity to build your career in the rapidly growing field of deep learning while enabling the world's most successful technology companies. Primary responsibilities will be to lead software/application customer technical engagements around NVIDIA products and technologies. Join us in this exciting endeavor! What You’ll Be Doing: A considerable part of the day-to-day job is staying up on pioneering Deep Learning and Machine Learning ecosystem. You'll be called on to help architect and scale high-performance, distributed AI deployments on prem or in the cloud that are built with the latest NVIDIA GPU supercomputers. Document what you know and teach others. This can vary from building targeted training for partners and other Solutions Architects to writing whitepapers, blogs, and wiki articles, to working through challenging problems with a partner on a whiteboard. Answer questions and provide mentorship. Work with Partner Business Managers to assist partners and customers on their critical projects. You will help them build their GPU and DPU enabled Accelerated Compute datacenters or cloud services to get the most out of their investment. Lead and develop proof-of-concepts (PoCs) for solutions applied to enterprise and industrial applications such as LLM, NLP/NLU, recommender systems, image recognition and video analytics using ML/DL frameworks. Support the business development team through the sales process for GPU/DPU/Network hardware/software products. Responsible for technical relationships and enabling customers in building innovative NVIDIA technology solutions. Partner with NVIDIA Engineering, Product, Sales teams to secure design wins at customers. Enable development and growth of NVIDIA product features through customer feedback and PoC evaluations. What We Need To See: BS, MS, or PhD in Computer Science, Electrical/Computer Engineering, Physics, Mathematics, or other Engineering fields or equivalent experience. 4+ years of work-related experience in Deep Learning and Machine Learning, including deep learning frameworks TensorFlow or PyTorch, GPU and CUDA experience extremely helpful. Experience working with DevOps on prem or in cloud environments, including but not limited to Docker/Containers, Kubernetes, cloud APIs, IaaS and Data Center deployments, additional experience with DPUs will be extremely helpful. Deep understanding of dense data-center design including compute, storage, networking, cloud APIs and IaaS. Ability to multitask effectively in a dynamic environment. Strong analytical and problem-solving skills. Clear written and oral communication skills with the ability to effectively collaborate and coordinate across cross-functional teams in engineering, sales, marketing, product, and program management. Comfortable working in a customer-facing environment. Self-starter with a passion for growth, enthusiasm for continuous learning and sharing findings across teams. Ways To Stand Out From The Crowd: External customer-facing skill-set and background. Skilled in deploying ML/DL models at scale on cloud computing clusters in production. Development experience with NVIDIA software libraries and GPUs or DPUs. Knowledge of MLOps, DevOps and Cloud oriented workflows using Docker/containers, Kubernetes, cloud APIs, data center deployments etc. Knowledge of MLPerf, LLM, AWS, Azure or GCP. Able to think creatively to debug and solve complex problems. NVIDIA is widely considered to be one of the technology world’s most desirable employers! We have some of the most forward-thinking and hardworking people in the world working for us. If you're creative and autonomous, we want to hear from you! The base salary range is $141,000 - $228,000. Your base salary will be determined based on your location, experience, and the pay of employees in similar positions. You will also be eligible for equity and benefits . NVIDIA is committed to fostering a diverse work environment and proud to be an equal opportunity employer. As we highly value diversity in our current and future employees, we do not discriminate (including in our hiring and promotion practices) on the basis of race, religion, color, national origin, gender, gender expression, sexual orientation, age, marital status, veteran status, disability status or any other characteristic protected by law.",https://www.indeed.com/jobs?q=Data+Architect&l=Austin%2C+TX&sc=0kf%3Aattr%286QC5F%252COR%29explvl%28MID_LEVEL%29jt%28fulltime%29%3B&vjk=edcb8b64614e611d
2,eb966df06313eb06,Data Architect,"Austin, TX",MID_LEVEL,DOCTORAL_DEGREE,FULLTIME,"Associate Fellow – API Architect - job post Verizon 31,231 reviews Austin, TX 78704 Full-time You must create an Indeed account before continuing to the company website to apply Apply on company site save-icon Job details Job Type Full-time When you join Verizon Verizon is one of the world's leading providers of technology and communications services, transforming the way we connect across the globe. We're a diverse network of people driven by our shared ambition to shape a better future. Here, we have the ability to learn and grow at the speed of technology, and the space to create within every role. Together, we are moving the world forward - and you can too. Dream it. Build it. Do it here. What you’ll be doing... The Verizon Technology and Product Development (TPD) team is currently working to transform to an Application Programming Interface (API)-first model. As such, the team is looking for an Associate Fellow who is a subject matter expert in API to drive products in various stages of the journey, including monolithic, API-last and API-first approaches. This Associate Fellow provides the API core team with guidance to enable this transformation and is responsible for setting the overall standards for Verizon’s TPD API program. Additionally, this role acts as the go-to person and subject matter expert for Technology product managers, architects, developers and other development teams for technical API related questions. Responsibilities include, but are not limited to the following: Creating a design methodology to help business and technology classify capabilities across the organization—security, video, cloud, etc. for Domain Classification. Creating the Design/Architectural standards that define guidelines, service design principles, and patterns to build robust, reliable, and secure services that expose stable, well-documented and easy to use service contracts (aka APIs) to its customers. Creating a governance chapter across the company to include e/vangelize standards and ensuring adherence across the development and product teams by running monthly charters. Identifying common specifications for vendors to use for API building while ensuring standardization across TPD vendors and expand to Global Network & Technology vendors. Acting as subject matter expert for different design guides including Transport protocols (HTTP etc.); API protocol (REST, GraphQL, Events, etc.); service runtime libraries; reliability, observability, security, data privacy. Identifying tools to automate governance and help with publishing conformance to API-first (documentation to quality of APIs). Representing Verizon at various standard bodies such as TMForum and GSMA to provide Verizon’s view and help create technical alliances. Providing end-to-end architecture for publishing APIs including tools. Working with Technology product managers to contribute towards standards, guidelines, style guides etc. These standards define every aspect of API design, styling, API protocol semantics, API versioning, various communication patterns and API security. Where you’ll be working: This hybrid role will have a defined work location that includes work from home and assigned office days as set by the manager. *This role can sit out of any valid U.S. based Verizon work location.* What we’re looking for... You’ll need to have: Bachelor’s degree or four or more years of work experience. Six or more years of relevant work experience. Willingness to travel 25% or less of the time. Even better if you have one or more of the following: Influenced enterprise-wide chapters for API or enterprise architecture conformity across organization Master’s degree or Doctorate in engineering, computer science and/or telecommunications. Experience managing large cross-functional or enterprise-wide projects. Previous enterprise and backend architecture experience. Strong experience working on mobile technologies/applications. Strong experience in developing and architecting enterprise applications. Strong experience in launching and building API and API programs. *If Verizon and this role sound like a fit for you, we encourage you to apply even if you don’t meet every “even better” qualification listed above. * Equal Employment Opportunity We're proud to be an equal opportunity employer - and celebrate our employees' differences, including race, color, religion, sex, sexual orientation, gender identity, national origin, age, disability, and Veteran status. At Verizon, we know that diversity makes us stronger. We are committed to a collaborative, inclusive environment that encourages authenticity and fosters a sense of belonging. We strive for everyone to feel valued, connected, and empowered to reach their potential and contribute their best. Check out our diversity and inclusion page to learn more.",https://www.indeed.com/jobs?q=Data+Architect&l=Austin%2C+TX&sc=0kf%3Aattr%286QC5F%252COR%29explvl%28MID_LEVEL%29jt%28fulltime%29%3B&vjk=eb966df06313eb06
3,bfdd5667c8241f66,Data Architect,"Austin, TX",MID_LEVEL,DOCTORAL_DEGREE,FULLTIME,"Staff Systems Engineer - Hadoop Administration - job post Visa 1,066 reviews Austin, TX • Hybrid remote Full-time You must create an Indeed account before continuing to the company website to apply Apply on company site save-icon Job details Encouraged to Apply Fair chance Job Type Full-time Company Description Visa is a world leader in digital payments, facilitating more than 215 billion payments transactions between consumers, merchants, financial institutions and government entities across more than 200 countries and territories each year. Our mission is to connect the world through the most innovative, convenient, reliable and secure payments network, enabling individuals, businesses and economies to thrive. When you join Visa, you join a culture of purpose and belonging – where your growth is priority, your identity is embraced, and the work you do matters. We believe that economies that include everyone everywhere, uplift everyone everywhere. Your work will have a direct impact on billions of people around the world – helping unlock financial access to enable the future of money movement. Join Visa: A Network Working for Everyone. Job Description Product Reliability Engineering(PRE) is part of the Visa's technology organization. The division is responsible for maintaining and supporting Visa's data assets and provides support for value added products and services to drive innovation for our partners and clients, within Visa and globally. Product Reliability Engineering Big Data Platform Team is part of PRE supports open source Big Data and Kafka clusters in Visa. As a Staff Big Data Engineer you will be responsible for monitoring, troubleshooting, automating and continuously developing software tools to improve the availability and resiliency of open source Big Data Platforms at Visa. In this hands-on role, you will Administer and ensure performance, reliability and increase the operational efficiency of open source big data platforms. Essential Functions: Responsible for Performing Big Data Administration and Engineering activities on multiple opensource Hadoop, Kafka, HBase and Spark clusters. Strong Troubleshooting and debugging skills. Cross-team teamwork, build and maintain relationships with the customer teams, the user community, architects, and engineering teams, jointly work on key deliverables ensuring production scalability and stability. Effective Root cause analysis of major production incidents and developing learning documentation. Identify and implement HA solution for services with SPOF. Plan and perform capacity expansion and upgrades in timely manner avoiding any scaling issues and bugs. Automation of repetitive tasks to reduce manual effort and avoid Human errors. Tune alerting and setup observability to proactively identify the issues and performance problems. Work closely with L-3 teams in reviewing new use cases, cluster hardening techniques for building a robust and reliable platforms. Leverage DevOps tools, disciplines( Incident, problem and change management) and standards in day to operations. Ensure the Hadoop platform can effectively meet performance and SLA requirements. Perform security remediation, automation and selfheal as per the requirement. This is a hybrid position. Hybrid employees can alternate time between both remote and office. Employees in hybrid roles are expected to work from the office 2-3 set days a week (determined by leadership/site), with a general guidepost of being in the office 50% or more of the time based on business needs. Qualifications Basic Qualifications: 5+ years of relevant work experience and a Bachelors degree or at least 2 years of work experience with an Advanced degree (e.g. Master, MBA, JD, MD) or 0 years of work experience with a PhD, OR 8+ years of relevant work experience Preferred Qualifications: 6 or more years of work experience with a Bachelors Degree or 4 or more years of relevant experience with an Advanced Degree (e.g. Masters, MBA, JD, MD) or up to 3 years of relevant experience with a PhD Hands on experience working as a Hadoop system engineer in managing Hadoop platforms. Experience in building, managing and tuning performance of Hadoop platforms. Extensive knowledge on Hadoop eco-system such as Zookeeper, HDFS, Yarn, HIVE and SPARK. Excellent Shell, Python programming skills for automation requirement for repetitive dev-ops tasks Understanding of security tools like Kerberos and Ranger. Experience on Hortonworks distribution or Open Source preferred. Hands-on experience in debugging Hadoop issues both on platform and applications. Knowledge on Kafka, HBASE and Kubernetes is a plus. understanding of Linux, networking, CPU, memory and storage. Knowledge on Java and Python is good to have. Excellent interpersonal, verbal, and written communication skills. This position is not ideal for a Hadoop developer. Additional Information Work Hours: Varies upon the needs of the department. Travel Requirements: This position requires travel 5-10% of the time. Mental/Physical Requirements: This position will be performed in an office setting. The position will require the incumbent to sit and stand at a desk, communicate in person and by telephone, frequently operate standard office equipment, such as telephones and computers. Visa is an EEO Employer. Qualified applicants will receive consideration for employment without regard to race, color, religion, sex, national origin, sexual orientation, gender identity, disability or protected veteran status. Visa will also consider for employment qualified applicants with criminal histories in a manner consistent with EEOC guidelines and applicable local law. Visa will consider for employment qualified applicants with criminal histories in a manner consistent with applicable local law, including the requirements of Article 49 of the San Francisco Police Code. U.S. APPLICANTS ONLY: The estimated salary range for a new hire into this position is 117,700.00 to 153,000.00 USD, which may include potential sales incentive payments (if applicable). Salary may vary depending on job-related factors which may include knowledge, skills, experience, and location. In addition, this position may be eligible for bonus and equity.Visa has a comprehensive benefits package for which this position may be eligible that includes Medical, Dental, Vision, 401 (k), FSA/HSA, Life Insurance, Paid Time Off, and Wellness Program.",https://www.indeed.com/jobs?q=Data+Architect&l=Austin%2C+TX&sc=0kf%3Aattr%286QC5F%252COR%29explvl%28MID_LEVEL%29jt%28fulltime%29%3B&vjk=bfdd5667c8241f66
