,job_id,job_title,location,experience,education,job_type,job_description,job_link
9,5c053ae3217c00eb,QA Engineer,"San Francisco, CA",MID_LEVEL,MASTERS_DEGREE,FULLTIME,"Senior Software Test Engineer - job post Abbott Laboratories 5,855 reviews Alameda, CA $82,100 - $164,100 a year -  Full-time You must create an Indeed account before continuing to the company website to apply Apply on company site save-icon Job details Salary $82,100 - $164,100 a year Job Type Full-time Abbott is a global healthcare leader that helps people live more fully at all stages of life. Our portfolio of life-changing technologies spans the spectrum of healthcare, with leading businesses and products in diagnostics, medical devices, nutritionals and branded generic medicines. Our 115,000 colleagues serve people in more than 160 countries. About Abbott Abbott is a global healthcare leader, creating breakthrough science to improve people’s health. We’re always looking towards the future, anticipating changes in medical science and technology. Working at Abbott At Abbott, you can do work that matters, grow, and learn, care for yourself and family, be your true self and live a full life. You’ll also have access to: Career development with an international company where you can grow the career you dream of. Free medical coverage for employees* via the Health Investment Plan (HIP) PPO An excellent retirement savings plan with high employer contribution Tuition reimbursement, the Freedom 2 Save student debt program and FreeU education benefit - an affordable and convenient path to getting a bachelor’s degree. A company recognized as a great place to work in dozens of countries around the world and named one of the most admired companies in the world by Fortune. A company that is recognized as one of the best big companies to work for as well as a best place to work for diversity, working mothers, female executives, and scientists. The Opportunity This position works out of our Alameda, CA location in the Abbott Diabetes Care Division, where we are focused on helping people with diabetes manage their health with life-changing products that provide accurate data to drive better-informed decisions. We’re revolutionizing the way people monitor their glucose levels with our new sensing technology. The Software Test Engineer represents test engineering throughout the Software Development Lifecycle. This person contributes to both the product development but also to the SDLC Agile process. This position includes mentoring junior members of the team and ensuring the correct procedures and processes are being followed for both software quality and compliance. What you’ll work on Mobile App and Smart Watch App Compatibility Testing Review System Specifications/Requirements documents, user stories and create verification test cases (based on those requirements) and execute test cases. Investigate and report unexpected events, issues or software bugs. Verify bug fixes Perform regression testing, exploratory testing, system level end to end testing, to ensure application software releases are of high quality Create verification and validation test plans, test reports, trace matrices and review with relevant stakeholders (dev and quality) Review deliverables/activities as identified in the test plans for accuracy, consistency, completeness and compliance. Ensure adequate test coverage for every release Mentor and provide day to day guidance to the junior members of the software test team. Review work to ensure compliance and quality Provide feedback and suggest improvements to the Agile SDLC process Required Qualifications Bachelors Degree (± 16 years) Minimum 5 years 2+ years of Software Quality Assurance in a regulated industry is required Moderate knowledge of Agile methodologies Moderate level of understanding of test-driven methodologies Demonstrated success in technical proficiency, creativity, and independent thought Excellent verbal and written communication skills Strong analytical & problem-solving skills Ability to multi-task and prioritize responsibilities Preferred Qualifications Bachelor’s degree in Computer Science or related engineering field Must have Mobile App Compatibility testing and OS testing e.g. OS upgrade, introducing New OS for existing and new app versions Prior experience in Life Science domain in software testing will be an advantage Exposure to Bluetooth Low Energy (BLE) and Near Field Connectivity (NFC) testing with Mobile devices. Experience working in Software Quality Assurance on Apple OS and Android platforms, Smart Watch platforms Ability to identify and investigate difficult problems and independently work towards results Creative thinker and strong problem solver with meticulous attention to detail Ability to work in a fast-paced and dynamic environment Understanding of and experience with the SDLC and QA’s role in it Experience with macOS or Linux command line Medical device manufacturing regulations and industry standards per FDA 21 CFR Part 820 and ISO 13485 (Design Controls) a plus What We Offer At Abbott, you can have a good job that can grow into a great career. We offer: Training and career development , with onboarding programs for new employees and tuition assistance Financial security through competitive compensation, incentives and retirement plans Health care and well-being programs including medical, dental, vision, wellness and occupational health programs Paid time off 401(k) retirement savings with a generous company match The stability of a company with a record of strong financial performance and history of being actively involved in local communities Learn more about our benefits that add real value to your life to help you live fully: www.abbottbenefits.com Follow your career aspirations to Abbott for diverse opportunities with a company that provides the growth and strength to build your future. Abbott is an Equal Opportunity Employer, committed to employee diversity. Connect with us at www.abbott.com, on Facebook at www.facebook.com/Abbott and on Twitter @AbbottNews and @AbbottGlobal. The salary for this role is between $82,100 – $164,100",https://www.indeed.com/jobs?q=QA+Engineer&l=San+Francisco%2C+CA&sc=0kf%3Aattr%28EXSNN%7CFCGTU%7CHFDVW%7CQJZM9%7CUTPWG%252COR%29explvl%28MID_LEVEL%29jt%28fulltime%29%3B&vjk=5c053ae3217c00eb
10,2c66249836196293,QA Engineer,"San Francisco, CA",MID_LEVEL,MASTERS_DEGREE,FULLTIME,"QA Engineer - job post UnifyID Redwood City, CA Full-time You must create an Indeed account before continuing to the company website to apply Apply on company site save-icon Job details Job Type Full-time About Prove (acquired UnifyID) Prove is the modern platform for continuous identity authentication and is used by over 1,000 enterprises and 500 financial institutions, including 9 of the top 10 U.S. banks. Prove’s cloud solutions, and mobile intelligence-driven APIs can be easily orchestrated to increase Approve Rates to over 90%, enabling companies to authenticate customer identities accurately, effortlessly, and privately while mitigating fraud. Prove’s solutions are available in 195 countries. For the latest updates from Prove, follow us on LinkedIn. About the Role We are seeking a self-directed and passionate quality engineer who is ready to get fully immersed into the details of crafting the future of identity management and security. Requirements: Friendly and approachable, but not afraid to call out B.S. when necessary. Great communication skills Understands how to build feedback mechanisms for timely and effective developer feedback on software quality, but not just process for the sake of process. Knows when to hold up a release when necessary and can drive a compromise solution. Brings a strong sense of ownership and responsibility. Curious enough to dig into initial bugs, help with RCA’s by looking at a bit of source code, maybe to verify reproducibility and even suggest possible fixes. Not afraid to look at logs, both client and server. Comfortable navigating the question “What is the right thing to do or build?” when constrained by both business requirements and time. Self-starter, driven, and passionate about quality but, knows how to balance it out to avoid burning out. 15+ years industry experience of software development 3+ years in Engineering or QA At least one role in which you made meaningful and business critical contributions to at least one product with at least 1M+ users Skills: Docker GitLab, and continuous integration Sentry (android and iOS) Bash Android Robolectric (and limitations) iOS simulator (and limitations) Go Python Mongo PostgresSQL AWS, and their managed service offerings deployment strategies BlackDuck Valgrind 3rd party security audit Join us! As we continue to scale our company, we are looking for people who know how to make an impact. We’re talking self-starting professionals who thrive in a fast-paced environment, process information quickly, and make intelligent decisions. The work is challenging and requires not only smarts but natural curiosity and tenacity. Teamwork is also important to us – we work together and play together. Prove has big plans; we’re excited and optimistic about the future. If this sounds like a career for you – come check us out. This team is located in the heart of Silicon Valley in downtown Redwood City and has unparalleled access to deep entrepreneurial expertise, high-caliber academic research institutions, and top-tier VC resources. Finally, it is important that you be authentic and be yourself. Prove is an equal opportunity employer committed to providing equal employment opportunity for all people regardless of race, color, religion, gender or sexual orientation, age, marital status, national origin, citizenship status, disability, veteran status, or other personal characteristics.",https://www.indeed.com/jobs?q=QA+Engineer&l=San+Francisco%2C+CA&sc=0kf%3Aattr%28EXSNN%7CFCGTU%7CHFDVW%7CQJZM9%7CUTPWG%252COR%29explvl%28MID_LEVEL%29jt%28fulltime%29%3B&vjk=2c66249836196293
11,7f4a53b6ce20c80b,QA Engineer,"San Francisco, CA",MID_LEVEL,MASTERS_DEGREE,FULLTIME,"Software Development Engineer in Test - job post Zoox (part of Amazon.com) 9 reviews Foster City, CA $130,000 - $206,000 a year -  Full-time You must create an Indeed account before continuing to the company website to apply Apply on company site save-icon Job details Salary $130,000 - $206,000 a year Job Type Full-time Autonomous vehicles have some of the largest, most complex software ever shipped in a safety-critical environment. Solving that problem is one of the most exciting technical challenges of our lifetime. The Software Quality Assurance team at Zoox has a critical set of responsibilities, from AI validation to internal tools test automation. As a Sr. Software Development Engineer in Test on our team, you will take a leadership role in driving forward technical advancements in test frameworks and tools. You will implement and develop test automation frameworks, implement new solutions to technical test problems, and build novel tools for our teams to utilize. You will be a force multiplier by mentoring other test engineers and growing their test design and coding capabilities. Qualifications Bachelor's or Master's degree in computer science, engineering, mathematics, or related field 3+ years of experience as a Software Development in Test or similar role Experience building automated web tests using Selenium, Cypress, or similar frameworks and tools Experience creating API tests Strong proficiency with C++ or Python Fluency in Javascript / TypeScript Experience with version control systems like Git Experience with Linux or Unix based systems Bonus Qualifications Experience with Vue.js and Node.js applications Experience testing 3D applications Compensation There are three major components to compensation for this position: salary, Amazon Restricted Stock Units (RSUs), and Zoox Stock Appreciation Rights. The salary range for this position is $130,000 to $206,000. A sign-on bonus may be offered as part of the compensation package. Compensation will vary based on geographic location and level. Leveling, as well as positioning within a level, is determined by a range of factors, including, but not limited to, a candidate's relevant years of experience, domain knowledge, and interview performance. The salary range listed in this posting is representative of the range of levels Zoox is considering for this position. Zoox also offers a comprehensive package of benefits including paid time off (e.g. sick leave, vacation, bereavement), unpaid time off, Zoox Stock Appreciation Rights, Amazon RSUs, health insurance, long-term care insurance, long-term and short-term disability insurance, and life insurance. Vaccine Mandate Employees working in this position will be required to have received a single dose of the J&J/Janssen COVID-19 vaccine OR have completed the two-dose Pfizer or Moderna vaccine series. In addition, employees will be required to receive a COVID-19 booster vaccine within two months of becoming eligible for the booster vaccine. Employees will be required to show proof of vaccination status upon receipt of a conditional offer of employment. That offer of employment will be conditioned upon, among other things, an Applicant’s ability to show proof of vaccination status. Please note the Company provides reasonable accommodations in accordance with applicable state, federal, and local laws. About Zoox Zoox is developing the first ground-up, fully autonomous vehicle fleet and the supporting ecosystem required to bring this technology to market. Sitting at the intersection of robotics, machine learning, and design, Zoox aims to provide the next generation of mobility-as-a-service in urban environments. We’re looking for top talent that shares our passion and wants to be part of a fast-moving and highly execution-oriented team. Follow us on LinkedIn A Final Note: You do not need to match every listed expectation to apply for this position. Here at Zoox, we know that diverse perspectives foster the innovation we need to be successful, and we are committed to building a team that encompasses a variety of backgrounds, experiences, and skills.",https://www.indeed.com/jobs?q=QA+Engineer&l=San+Francisco%2C+CA&sc=0kf%3Aattr%28EXSNN%7CFCGTU%7CHFDVW%7CQJZM9%7CUTPWG%252COR%29explvl%28MID_LEVEL%29jt%28fulltime%29%3B&vjk=7f4a53b6ce20c80b
12,faf73f2ecb9a5cce,QA Engineer,"San Francisco, CA",MID_LEVEL,MASTERS_DEGREE,FULLTIME,"Quality Control Release Engineer - job post Canvas Medical 2 reviews San Francisco, CA • Remote Full-time You must create an Indeed account before continuing to the company website to apply Apply on company site save-icon Job details Job Type Full-time Canvas Medical is the electronic medical records (EMR) and payments development platform for healthcare. We build modern, elegant front- and back-end tooling to enable new ways for developers and clinicians to collaborate to solve healthcare’s toughest challenges. Canvas is institutionally backed by some of the greatest technology investors in the world (funded notable health tech companies such as GoodRx, Oscar Health, and Hims & Hers Health). We are seeking a full time Quality Control Release Engineer to join the team to manage, schedule and coordinate releases in support of overall business objectives, on-time and consistently. This role requires both a technical and project management skillset. This person will help improve the existing release process by implementing tools, services, testing and processes to deliver production ready code to customers frequently. This role is extremely collaborative, working with feature and platform stakeholders throughout the business to clearly understand what is being released and coordinate customer communication platform changes. What you'll be doing: Prepare, coordinate, document, offer trainings, and oversee the release process Host a release cutting meeting to go over and understand every change included in each release, build customer facing release logs, ensure pull requests have been tested, match the expected file changes, and enforce PR standards adhere to Canvas best practices Determine a git branching/tagging strategy Own release deployment timelines that dictate when environment deploys happen, adhering to client contractual requirements. This task includes shared services, client sandbox environments, non-production and production environments Manage the JIRA Release Board Communicate release details and schedules to the business as required Involvement in regression testing and coordination of any issue found to prevent release delays. Longer term, as this role automates and improves more of the release process, ownership of the regression testing suite will become more of a focus. This includes running tests and writing new tests associated with the new releases Be available to assist with issues that arise from a release (such as an incident, release failure to an environment, etc.) and coordinate any necessary hotfix deployments Build and enhance features and tools to help automate and simplify the release process Make difficult decisions about releases (ex. delaying a release) if there are concerns about code quality Be responsible for turning features on and soft launch of new features, understanding which clients receive which features, documenting their purpose(s) Maintain end user base permissions across customer instances What we’re looking for: Bachelor’s degree in related field or qualifying years of experience 2-6 years of previous release engineering experience following an agile software development practice The ability to stay organized, prioritize, and stay on top of weekly tasks. Project management experience is preferred Proven track record of managing cloud application(s) with high availability and high scalability Strong understanding of the software development life cycle, git, branching strategy, and especially the software release management process GitHub experience is strongly preferred Experience using JIRA Demonstrated ability to communicate and coordinate with cross-functional teams toward task completion Demonstrated effective leadership and analytical skills while being detail oriented Experience using configuration management and automation tools such as CloudFormation or Terraform Experience in programming or DevOps is a strong plus Location - This is a remote position that can be performed in the Pacific time zone. Compensation : The annual base salary for this position is in the range of $120,000 - $135,000 for employees based in San Francisco. This position also is eligible for benefits and our Employee Stock Ownership Plan. Exact compensation may vary based on skills, experience and geographic location. We are a fully remote, distributed team. We encourage people to do their work when and where they perform at their best. Because of this structure, strong written communication skills, time management skills, and personal accountability are very important to us. Employee benefits offered: Competitive Salary and Equity Package Health Insurance Home Office Stipend 401k Paid Maternity/Paternity Leave Flexible/unlimited PTO Paid Sabbatical after 4 years of employment Canvas Medical provides equal employment opportunities to all employees and applicants for employment without regard to race, religion, color, national origin, gender, sexual orientation, age, marital status, veteran status, or disability status.",https://www.indeed.com/jobs?q=QA+Engineer&l=San+Francisco%2C+CA&sc=0kf%3Aattr%28EXSNN%7CFCGTU%7CHFDVW%7CQJZM9%7CUTPWG%252COR%29explvl%28MID_LEVEL%29jt%28fulltime%29%3B&vjk=faf73f2ecb9a5cce
13,4496d983a0450df4,QA Engineer,"San Francisco, CA",MID_LEVEL,MASTERS_DEGREE,FULLTIME,"Air Quality Engineer / Scientist (Environmental Compliance Specialist) - job post Yorke Engineering, LLC Yorke Engineering, LLC in San Francisco, CA 94103 $50,000 - $150,000 a year -  Full-time Apply now Apply now save-icon Job details Salary $50,000 - $150,000 a year Job Type Full-time Air Quality Engineer / Scientist (Environmental Permitting and Compliance Specialist) Join Yorke Engineering, LLC, an Environmental Consulting leader in California that implements Environmental Engineering and Compliance solutions for our clients throughout California. Our mission is to solve environmental compliance problems for industrial and governmental/infrastructure facilities. We are a growing and dynamic organization of highly respected professionals. Yorke Engineering, LLC has assisted over 1,400 client organizations with their Air Quality and Environmental Compliance, Engineering, and Permitting needs. Our philosophy is to efficiently help government and industrial customers with the complex array of environmental laws and regulations. From simple permits to complex agency negotiations, from small companies to the largest of California’s organizations, Yorke successfully solves our clients’ Air Quality and Environmental challenges. Our team has over 1,000 years of combined environmental experience and consists of engineers and scientists that specialize in Air Quality, Waste, Water, CEQA, Safety, and Industrial Hygiene. We are looking for a sharp Air Quality Engineer / Scientist (Environmental Permitting and Compliance Specialist) to join our team in any of our Northern CA offices (Berkeley or San Francisco) during our normal business hours. We offer competitive salaries, a full benefits package including Paid Time Off, Holidays, Full Medical/Dental/Vision, along with a 401k program with a generous company match. Position Summary: The Air Quality Engineer / Scientist (Environmental Permitting and Compliance Specialist) performs professional engineering work, executing the compliance and permitting functions in relation to Air Quality Regulations and Compliance. This candidate will be reviewing processes and equipment, analyzing permit-related technical and regulatory issues, and communicating those analyses within Yorke, the client organization, with government agencies and with the public at large. The work is challenging, broad in scope, and variable from project to project. The position involves effective communication, decision-making, and time management. The candidate performs other duties as required or assigned. The candidate qualifications we are seeking include: 3-10 years of work experience in the Air Quality and/or Environmental industry in an engineering role (preferably in a consulting environment); Experience as an active team member in the environmental services industry as a consultant focusing on: Process and equipment review; Air quality permitting under BAAQMD, and other Air Districts, including Title V permitting; RECLAIM implementation and reporting; Annual Emissions Reporting; Air Dispersion Modeling; Air Quality Assessments including Data Analysis and Emission Inventories; General Air Quality Compliance for facilities in CA, including problem solving. Ability to be an active team member on project teams towards project completion within project scope, budget and schedule and ensure quality work product and deliverables; Ability to work with clients, staff, and regulators through effective communication and expertise by fostering a collaborative environment without losing focus of quality; Proven track record or desire to engage in successful regulatory work in dealing with the BAAQMD, EPA, CARB and/or other similar regulatory agencies; Experience or desire to work on-site at client facilities; Prepare reports and submissions in timely manner; Experience with handling highly technical data and technical data interpretation; Highly motivated to continue working in Air Quality environmental field and expand their knowledge and experience; CA Regulatory/Compliance experience is required. Job Requirements: B.S or M.S. degree in Chemical Engineering, Environmental Engineering, or Mechanical Engineering, or other relevant technical degrees from an accredited college (minimum GPA of 3.0); Ability to work collaboratively in a team fashion, handle several projects at once, prioritize work, and work efficiently; Desire to learn or developing technical expertise in environmental rules and regulations; Excellent oral and written communications skills; Experience in conflict resolution and crisis management; Track record of successful analysis, interpretation, and application of rules and regulations towards practical solutions; Ability to think critically and develop solutions; Software Knowledge: Strong Microsoft Excel, Word, Outlook, and Powerpoint skills (required); Microsoft 365 Applications, including Sharepoint (a plus) EIT, CPP or P.E. (a plus). Job Type: Full-time Pay: $50,000.00 - $150,000.00 per year Benefits: 401(k) 401(k) matching Dental insurance Flexible spending account Health insurance Life insurance Paid time off Vision insurance Schedule: Monday to Friday Ability to commute/relocate: San Francisco, CA 94107: Reliably commute or planning to relocate before starting work (Required) Education: Bachelor's (Required) Experience: California Environmental/Regulatory: 3 years (Preferred) Environmental Consulting: 3 years (Preferred) Work Location: In person Health insurance If you require alternative methods of application or screening, you must approach the employer directly to request this as Indeed is not responsible for the employer's application process.",https://www.indeed.com/jobs?q=QA+Engineer&l=San+Francisco%2C+CA&sc=0kf%3Aattr%28EXSNN%7CFCGTU%7CHFDVW%7CQJZM9%7CUTPWG%252COR%29explvl%28MID_LEVEL%29jt%28fulltime%29%3B&vjk=4496d983a0450df4
