,job_id,job_title,location,experience,education,job_type,job_description,job_link
0,3b9b300db41653e0,QA Engineer,"Los Angeles, CA",SENIOR_LEVEL,BACHELORS_DEGREE,FULLTIME,"Senior Water Quality Engineer - job post AECOM 5,082 reviews Los Angeles, CA $80,000 - $149,000 a year -  Full-time You must create an Indeed account before continuing to the company website to apply Apply on company site save-icon Job details Salary $80,000 - $149,000 a year Job Type Full-time Company Description At AECOM, we’re delivering a better world. We believe infrastructure creates opportunity for everyone. Whether it’s improving your commute, keeping the lights on, providing access to clean water or transforming skylines, our work helps people and communities thrive. Our clients trust us to bring together the best people, ideas, technical expertise and digital solutions to our work in transportation, buildings, water, the environment and new energy. We’re one global team – 47,000 strong – driven by a common purpose to deliver a better world. Job Description AECOM is seeking a well-rounded Senior Water Quality Engineer with a focus on water quality, stormwater compliance, industrial wastewater and water regulatory guidance in Southern California. The selected candidate will join AECOM’s Environmental Health and Safety (EHS) + Air practice within the Environment Business Line. The primary emphasis of the group is to support clients with their environmental regulatory compliance needs for a variety of federal, municipal, and private-sector clients. The Senior Water Quality Engineer will be responsible for developing and maintaining client relationships for the EHS practice, managing complex projects and programs, mentoring and developing junior staff. A successful candidate will have demonstrated experience managing clients in California and/or along the West Coast, as well as the ability to utilize their environmental technical compliance experience to help our clients navigate their environmental compliance challenges. Additionally, qualified candidates will have excellent analytical, writing, presentation, and managerial skills, with a professional background in environmental consulting. The Senior Water Quality Engineer will also work under the direction of the EHS Practice Lead in client project delivery, writing proposals, winning work and marketing AECOM’s services through webinars and promotional material. Significant experience in the following areas is required: Supporting business development efforts, including preparation of technical and cost proposals, to grow our environmental compliance work with new clients and existing. Developing and maintaining positive relationships with clients to enhance client retention and growth. Managing projects which include but not limited to the preparation Storm Water Pollution Prevention Plans (SWPPPs), industrial wastewater discharge permits, managing a stormwater sampling team, Spill Prevention, Control, and Countermeasures (SPCC) Plans and other water quality or compliance projects. Researching, reviewing, and analyzing policies and regulations. Supporting regulatory compliance tasks relating to stormwater management. Mentoring junior staff and leading project teams to efficiently execute environmental compliance projects. About AECOM’s Environment Business Line Join AECOM to be part of an expert global team who is connected through a well-developed, worldwide, internal technical practice network through which you can learn from and brainstorm with the best in the world. AECOM is an industry-leading, world class environmental firm, and we want you to succeed within it. We respect and encourage your own pathway to excellence via our Freedom to Grow initiative. AECOM is known for our award-winning technical excellence, leading-edge science and innovative project delivery. We provide sustainable solutions for some of the world’s most challenging issues. Our global clients and their projects are diverse and interesting. They span market sectors and geographies and require innovative technical solutions to solve wide-ranging environmental problems within diverse community profiles. AECOM’s Sustainable Legacies program describes our approach to the environment, social equity and governance (ESG.) We embed sustainability throughout our business and help clients embed sustainable practices into their work. We help clients reduce their impact on the environment, achieve compliance and reduce risks. Qualifications Minimum Qualifications: Bachelor’s Degree in Environmental Management, Science, Engineering, or relevant environmental discipline. 6 years of technical experience directly related to environmental multi-media environmental regulatory compliance (e.g., CWA, RCRA, CAA, HSC etc.) and its application (i.e., developing SPCC/SWPPP plans, preparing NPDES stormwater and wastewater permits, conducting multi-media compliance audits and providing corrective actions, developing environmental compliance SOPs and programs, etc.). Qualified Stormwater Pollution Prevention Plan Developer and Practitioner (QSD / QSP) and/or Qualified Industrial Stormwater Practitioner (QISP) Valid US Driver's License and pre-employment driving record verification is required. Preferred Qualifications Professional certification (e.g., CHMM, PE, CEP) and/or PMP certification. Experience in developing and implementing construction and industrial stormwater pollution prevention plans (SWPPPs) in California At least 8 years of project/program management experience directly related to environmental compliance projects from proposal development through completion for an environmental consulting firm (i.e., developing proposals/cost estimates, managing clients, projects, and project teams; coordinating resources and managing subcontractors; etc.). Ability to independently manage various environmental compliance projects and programs ranging in size and scale. Environmental consulting experience with both public and private-sector clients in California. Experience working with communicating and working with various regulatory agencies. Highly effective verbal and written communication skills; proficient in technical writing; highly effective organization and multi-tasking skills. Ability to prioritize multiple demands, think strategically and successfully lead multiple projects simultaneously. Strong attention to detail with excellent analytical, judgment and problem-solving capabilities. Experience mentoring junior staff and leading project teams for environmental compliance work. Ability to support business development efforts, including preparation of technical and cost proposals, to grow our environmental compliance work with existing and new clients. Working understanding of federal contracting and sub-contracting practices and requirements. Experience with health & safety regulatory compliance. Managing environmental due diligence portfolios (Phase I and II Additional Information Due to the nature of the work, U.S. Citizenship is required. Some travel is required in and around the state of California and the west region (up to 25%/month). Offered rate of compensation (California locations only) will be based on individual education, qualifications, experience, and work location. The salary range for this position is $80,000-149,000.00. With infrastructure investment accelerating worldwide, our services are in great demand, and there’s never been a better time to be at AECOM! Join us, and you’ll get all the benefits of being a part of a global, publicly traded firm – access to industry-leading technology and thinking and transformational work with big impact and work flexibility. AECOM provides a wide array of compensation and benefits programs to meet the diverse needs of our employees and their families. We also provide a robust global well-being program. We’re the world’s trusted global infrastructure firm, and we’re in this together – your growth and success are ours too. As an Equal Opportunity Employer, we believe in each person’s potential, and we’ll help you reach yours. Join us and let’s get started.",https://www.indeed.com/jobs?q=QA+Engineer&l=Los+Angeles%2C+CA&sc=0kf%3Aattr%28FCGTU%7CHFDVW%7CQJZM9%7CUTPWG%252COR%29explvl%28SENIOR_LEVEL%29jt%28fulltime%29%3B&start=10&pp=gQAPAAAAAAAAAAAAAAAB_k4WvAAQAQEBBwC4v-9mIyU4znNE8QAA&vjk=3b9b300db41653e0
1,8f7c7945574d5995,QA Engineer,"Los Angeles, CA",SENIOR_LEVEL,BACHELORS_DEGREE,FULLTIME,"Sr. Quality Engineer - job post Trojan Battery 143 reviews Santa Fe Springs, CA $90,000 - $110,000 a year -  Full-time You must create an Indeed account before continuing to the company website to apply Apply on company site save-icon Job details Salary $90,000 - $110,000 a year Job Type Full-time It's fun to work in a company where people truly BELIEVE in what they're doing! We're committed to bringing passion and customer focus to the business. Job Description SUMMARY: As a member of the Trojan Quality Team, this is intended to be a senior level position with responsibilities of: leading, coordinating, developing and implementing effective process, product, and component control plans. Utilize advance 6 Sigma tools such as: Root Cause and Corrective Action (RCCA), Design of Experiments (DOE), Failure Mode & Effects Analysis (FMEA), and other statistical techniques to analyze, understand, and reduce process variation. Also responsible for manufacturing process improvements through process optimization, process audits, data collection and effective corrective actions. ESSENTIAL DUTIES AND RESPONSIBILITIES: Other duties may be assigned including the following. Responsible for the development of product and process quality plans, including control plans, procedures, inspection plans, and other quality documentation Facilitate total quality management tools and approaches to other company departments for analytical and reporting processes within respective department Facilitate/lead workers engaged in quality auditing activities to ensure continuous control over materials/products/processes, as well as conformance to business processes affecting quality Lead and/or support process improvement activities/teams Mentorship of quality team members Write, implement, and follow quality system procedures and work instructions. Lead/Support engineering efforts of analytical laboratory equipment, and assist in validations of manufacturing equipment, and processes Drive process improvement and problem solving thru 6 Sigma principals Root Cause and Corrective Action principals (RCCA) Developing Sampling Plans for production, qualification, and validation of products/processes. Develop project proposals for process improvements based on financial and business needs. Lead projects in manufacturing operations for process improvement, cost reduction, problem solving and other activities. SUPERVISORY RESPONSIBILITIES: None QUALIFICATIONS: To perform this job successfully, an individual must be able to perform each essential duty satisfactorily. The requirements listed below are representative of the knowledge, skill, and/or ability required. Ability to interpret drawings and first article inspection results Highly motivated self-starter Must be outgoing in personality with strong relationship skills for customers, colleagues, and senior management Must be able to work with minimum supervision High standard of business and personal ethics Experience with BaaN and ERP systems is preferred Must be very comfortable with Microsoft Office Applications; MS Outlook, MS Word, MS Excel, MS PowerPoint, Access or equivalent, and Minitab Excellent written and verbal communication skills are essential Expert in advanced statistical techniques: DoE, SPC required EDUCATION and/or EXPERIENCE: Bachelor’s Degree in technical discipline and/or a science discipline, preferred 6 Sigma skills (Blackbelt certified or willing to be certified) Lean Principals Experience with Cost of Quality (COQ) system implementation a plus Management Quality Systems (MQS) (e.g., ISO 9000, QS 9000, etc.) A minimum of 7 years related experience in high volume product manufacturing required Sampling Schemes Battery Technology a plus LANGUAGE SKILLS: Proficient in English Bilingual in Spanish is preferred PREFERRED CERTIFICATES, LICENSES, REGISTRATIONS: Certified Quality Engineer (AMERICAN SOCIETY OF QUALITY) 6 Sigma Black Belt PHYSICAL DEMANDS: The physical demands described here are representative of those that must be met by an employee to successfully perform the essential functions of this job Must be able to lift 25lbs. Must be able to sit for extended periods of time Must have finger dexterity for typing/using a keyboard Must be able to drive to different company locations WORK ENVIRONMENT: The work environment characteristics are normal office conditions. Reasonable accommodations may be made to enable individuals with disabilities to perform the essential functions. Must be able to work in a lead cid battery plant Must be able to work outside of normal business hours as needed Must be able to travel as needed Consistent and regular attendance required Salary Range: $90,000 - $110,000/year Our salary ranges are determined by role, education and experience level, and location if you like wild growth and working with happy, enthusiastic over-achievers, you'll enjoy your career with us!",https://www.indeed.com/jobs?q=QA+Engineer&l=Los+Angeles%2C+CA&sc=0kf%3Aattr%28FCGTU%7CHFDVW%7CQJZM9%7CUTPWG%252COR%29explvl%28SENIOR_LEVEL%29jt%28fulltime%29%3B&start=10&pp=gQAPAAAAAAAAAAAAAAAB_k4WvAAQAQEBBwC4v-9mIyU4znNE8QAA&vjk=8f7c7945574d5995
2,c8725e9e7e07479b,QA Engineer,"Los Angeles, CA",SENIOR_LEVEL,BACHELORS_DEGREE,FULLTIME,"Senior Supplier Quality Engineer - job post Eaton 5,066 reviews Los Angeles, CA 90039 $88,838 - $130,295 a year -  Full-time You must create an Indeed account before continuing to the company website to apply Apply on company site save-icon Job details Salary $88,838 - $130,295 a year Encouraged to Apply Fair chance Job Type Full-time Eaton’s Fuel Motion Control Division is currently seeking a Sr Supplier Quality Engineer to join our team. This position is based at our Los Angeles, CA facility. Position Overview: The Sr Supplier Quality Engineer will be responsible for driving supplier improvements in the areas of Quality, Delivery and Lean Manufacturing initiatives. The improvements must be consistent with Eaton Aerospace requirements. Making what matters work at Eaton takes the passion of every employee around the world. We create an environment where creativity, invention and discovery become reality, each and every day. It’s where bold, bright professionals like you can reach your full potential—and where you can help us reach ours. In this role, you will: Oversee and participate in the development and initiation of inspection, testing and evaluation techniques for incoming goods. Evaluate inspection techniques and recommends changes. Work with Production, Quality Assurance, Materials and other departments to define quality standards and procedures. Review and analyze inspection test results and oversees the disposition of unaccepted items with affected suppliers and companies. Analyze supplier performance both in-house and on supplier premises as required. Apply standard statistical techniques to analyze and evaluate studies. Team with suppliers to define and document Process Flow Diagrams, Process FMEAs, AIAG Process Control Plans and Inspection plans. Negotiate with suppliers to find equitable solutions to problems identified. Visit supplier locations to evaluate quality standards and processes. Answer technical questions regarding commodity quality, long-term feasibility or quality certifications. Participate in the development, implementation, and evaluation of quality system surveys. Implement and oversee the administration of special programs to recognize and to ensure the use of suppliers who maintain established standards of quality, reliability, and price. Communicate with appropriate personnel regarding significant changes. Control nonconforming material in accordance with Eaton procedures. Flows down of external/internal quality requirements to suppliers. Support continuous improvement initiatives. Support internal audit requirements in accordance with Eaton procedures. Achieve objectives as detailed by Quality Management. When we embrace the different ideas, perspectives and backgrounds that make each of us unique, we — as individuals and as a company — are stronger. Qualifications Required (Basic) Qualifications : Bachelor’s degree from accredited institution Minimum three (3) years Supplier and/or Quality Engineering experience working with quality systems. No relocation benefit is being offered for this position. Only candidates that currently reside within 50 miles of the Los Angeles, CA facility will be considered. Active-Duty Military Service member candidates are exempt from the geographical area limitation. Must be authorized to work in the United States without company sponsorship now or in the future. This position requires use of information or access to hardware which is subject to the International Traffic in Arms Regulations (ITAR). All applicants must be U.S. persons within the meaning of ITAR. ITAR defines a U.S. person as a U.S. Citizen, U.S. Permanent Resident (i.e. ‘Green Card Holder’), Political Asylee, or Refugee Preferred Qualifications: Experience with Aerospace and/or Automotive suppliers. Experience with complex machining suppliers. Experience with Special processes suppliers (Heat Treating, Plating, Painting, etc.) Familiar with major Aerospace primes Quality System, as well as working knowledge of AS9100 or ISO9001:2016 and regulatory bodies (i.e., FAA, EASA, CAAC, etc.) AS9011 or ISO9001 Lead Auditor experience. Working knowledge of Six Sigma/ Lean tools. Experience with Electrical suppliers. The expected annual salary range for this role is $88,838 – $130,295. Please note the salary information shown above is a general guideline only. Salaries are based upon candidate skills, experiences, and qualifications as well as market and business considerations. At Eaton, we know that good benefit plans are important to employees and their families. Eaton provides various Health and Welfare benefits as well as Retirement benefits, and several programs that provide for paid and unpaid time away for work. Click here for more detail: Eaton Benefits at a Glance. Please note that specific programs and options available to an employee may depend on eligibility factors such as geographic location, date of hire, and applicability of collective bargaining agreements. California Only: Eaton will consider for employment, qualified applicants with criminal histories in a manner consistent with the requirements of the FCIHO. Eaton considers qualified applicants regardless of criminal histories, consistent with local laws. To request a disability-related reasonable accommodation to assist you in your job search, application or interview process, please call us at 412-893-3600 to discuss your specific need. Only accommodation requests will be accepted by this phone number. All other inquiries related to your job search will not be supported by this phone number. Eaton is an intelligent power management company dedicated to improving the quality of life and protecting the environment for people everywhere. We are guided by our commitment to do business right, to operate sustainably and to help our customers manage power today and well into the future. By capitalizing on the global growth trends of electrification and digitalization, we’re accelerating the planet’s transition to renewable energy, helping to solve the world’s most urgent power management challenges, and doing what’s best for our stakeholders and all of society. Founded in 1911, Eaton has been listed on the NYSE for nearly a century. We reported revenues of $19.6 billion in 2021 and serve customers in more than 170 countries. Our culture is built on a strong commitment to practicing our core values and supporting our employees with the tools they need to succeed. We have demonstrated our passion for sustainability with the announcement of cutting carbon emissions from the company’s operations by at least 50 percent by 2030. Eaton is committed to having a workforce that is diverse and non-discriminatory at all levels, reflecting the diversity of our customers and the varied environments in which we conduct business around the world. Our success depends on our ability to attract and retain the very best people unlimited by race, color, social or economic status, religion, national origin, marital status, age, disability, veteran status, sexual orientation, gender identity or any protected status. Eaton follows relevant non-discrimination laws and regulations in the countries where we operate. It is the policy of the Company to make all decisions regarding employment, including hiring, compensation, training, promotions, transfers, or lay-offs, based on the principle of equal employment opportunity as defined above. Job: Quality Region: North America – US/Puerto Rico Organization: AER FMC Fuel Motion Control Systems Job Level: Individual Contributor Schedule: Full-time Is remote work (i.e. working from home or another Eaton facility) allowed for this position?: No Does this position offer relocation?: No Travel: Yes, 50 % of the Time",https://www.indeed.com/jobs?q=QA+Engineer&l=Los+Angeles%2C+CA&sc=0kf%3Aattr%28FCGTU%7CHFDVW%7CQJZM9%7CUTPWG%252COR%29explvl%28SENIOR_LEVEL%29jt%28fulltime%29%3B&start=10&pp=gQAPAAAAAAAAAAAAAAAB_k4WvAAQAQEBBwC4v-9mIyU4znNE8QAA&vjk=c8725e9e7e07479b
