,job_id,job_title,location,experience,education,job_type,job_description,job_link
13,608fe95d8847d6b4,QA Engineer,"Los Angeles, CA",SENIOR_LEVEL,BACHELORS_DEGREE,FULLTIME,"Senior Quality Engineer, NDT Level III (RT/UT) - job post Aerojet Rocketdyne 385 reviews Canoga Park, CA 91304 • Hybrid remote $100,000 - $147,333 a year -  Full-time You must create an Indeed account before continuing to the company website to apply Apply on company site save-icon Job details Salary $100,000 - $147,333 a year Job Type Full-time Overview: Aerojet Rocketdyne is a world-recognized aerospace and defense leader that provides propulsion systems and energetics to space and defense customers. Our Canoga Park, California facility near Los Angeles is the company’s Space headquarters and specializes in the design, fabrication, assembly and testing of hardware for liquid rocket engines that support exploration missions as well as the defense of our nation and allies. Currently, employees are building the RS-25 engine for NASA’s Space Launch System that will take the first female and person of color to the moon and eventually Mars. Additional programs include propulsion systems for Lockheed Martin’s Terminal High Altitude Area Defense (THAAD) program, unique power systems that will power Sierra Nevada’s Dream Chaser Spacecraft and the Mars Perseverance Rover. Visit www.rocket.com for more information on you can Power the Future with Aerojet Rocketdyne. We are seeking Non-Destructive Test Level III Quality Engineers (Ultrasonic & Radiography preferred) to join our team in Canoga Park, California (Los Angeles area). Generous relocation benefits and/or hiring incentive may be available. Job responsibilities include providing effective and efficient NDT Quality support to Aerojet Rocketdyne and occasionally serve as an NDT quality interface with suppliers' quality management. Responsibilities include, but are not limited to: Provide training and testing to LI and LII. Develop, review and approve NDT techniques with LII personnel. Write, review and approve specifications pertinent to NDT. Support review boards for inspectability of product. Prepare NDT for customer and internal audits. Develop and Lead Corrective action reviews on audit/NCR findings. Maintain own LIII certifications. Participate in the direction of the NDT department. Audit and surveillance of quality systems and processes. Any other duties deemed appropriate by management. Successful candidates will have a track-record of proactivity and a demonstrated history of successfully working under minimal supervision. What we can offer you: Trusted - Aerojet Rocketdyne is proud to be recognized as America’s #1 Most Trusted Aerospace & Defense Company Inspiring Company Culture - Our people support each other and work together to leave an indelible impact on our nation’s aerospace and defense legacy. Read more about our culture: Careers | Aerojet Rocketdyne. Work/Life Balance - Begin accruing 3 weeks of vacation to start plus additional sick allowance. 9/80 schedule providing for longer weekends. Annual 1+ week year-end paid company shut down. Comprehensive Health Benefits - Medical, Dental, Vision, Health Savings Accounts, and Wellness programs. Prepare for the Future - 401(k) with company match. Professional Development - Tuition assistance program, Employee recognition program, and Leadership development program. Employee Resource Groups – Local and Enterprise employee-led volunteer groups to create community, awareness, impact, and to support a culture where everyone belongs. This posting may represent one or more specific immediate or near-term openings. Those who express an interest may be considered for current and future positions. Essential Job Functions (Including % of Time for Each): 5% - Review supplier-submitted NDT technique sheets for compliance to AR-Los Angeles specifications and drawing requirements. Coordinate with suppliers on the development and approval of these technique sheets. Prepare necessary reports. 5% - Manage site NDT supply base by monitoring suppliers to ensure flow down of AR requirements to sub-tier suppliers, audit existing NDT suppliers and assess potential new NDT suppliers for their ability to meet site requirements. 90% - Review process specifications, in-house technique sheets, etc. as noted above under job responsibilities. Requirements: Requires a Bachelor's degree in an engineering or science discipline and at least five (5) years of related experience in Quality/Manufacturing/NDT processes in Ultrasonic & Radiography (or an equivalent combination of education and experience). 10+ years of related experience preferred. Additional Requirements and Preferred Qualifications: Must have experience in at least two of the following NDT methods: Radiography (RT), Ultrasonic Testing (UT), Fluid Penetrant Inspection (FPI), Eddy Current (ET), or Magnetic Particle (MT). Certifications: The ideal candidate would have multiple Level 3 certifications; RT, UT and FPI preferred. At least one Level 2 certification is required. Candidate must meet requirements of NAS-410. Knowledge of industry NDT standards (ex. ASTM 1742, ASTM 1417, ASTM 1444, AMS-STD-2154, etc...) is requisite. Hands-on working experience in a manufacturing environment and a corresponding understanding of manufacturing processes is essential. Experience with auditing practices and Process Certification is desired. A demonstrated proficiency with a variety of NDT inspection techniques and equipment along with a working knowledge of blueprint reading and interpretation is required. Must have demonstrated excellent interpersonal, written and verbal communication skills, as well as the ability to work well in a team environment. Must possess strong computer skills and be well-organized. Position requires responding to customer needs and may include weekend work. Auditing experience/certification desired. May be required to obtain and maintain a U.S. Security Clearance at the appropriate level. Requires U.S. Citizenship. Must also be able to satisfy federal government requirements for access to government information, and having dual citizenship may preclude you from being able to meet this requirement. Work Environment/Physical Requirements: Employees must possess the mobility to work in a standard office setting and to use standard office equipment, including a computer; stamina to sit or stand and maintain attention to detail despite interruptions; may occasionally lift/carry/push/pull up to 25 pounds; may require occasional walking, climbing, stooping, crouching, and/or bending; and vision to read printed materials and a computer screen, and hearing and speech to communicate in person and over the telephone. The work environment may also require a combination of indoor and outdoor activity (hot, cold, wet, humid conditions) with a varied amount of walking, standing, sitting, climbing (i.e. ladders, stair, scaffolding, ramps), balance (maintaining body equilibrium to prevent falling when walking, standing, or crouching on narrow, slippery, or erratically moving surfaces), bending, reaching, handling/fingering (seizing, holding, grasping, turning, picking, pinching), stooping, kneeling, crouching. While performing the duties of this job, employees may work around variable noise levels or with fumes or airborne particles, hazardous chemicals, etc. requiring the use of personal protective equipment such as face protection (safety glasses, goggles, face shield), foot protection (i.e. steel toed shoes, rubber boots, etc.), gloves, hard hat, shop coat or hearing protection. Work requires the ability to change into or out of personal protective equipment when entering or exiting manufacturing, laboratory, or other areas. This position may be expected to work varying shifts and hours to ensure successful operation of activities in the organization. Depending on the location of the position, visual certification requirement may apply. The position requires the ability to travel by air or auto. Pay range for this position:: 100,000 - 147,333 per year Note about pay range:: Pay range for this job level is a general guideline only for California and/or Washington State and not a guarantee of compensation or salary. Additional factors considered in extending an offer include (but are not limited to) responsibilities of the job, education, experience, knowledge, skills, and abilities, as well as internal equity, alignment with market data, applicable bargaining agreement (if any), or other law.",https://www.indeed.com/jobs?q=QA+Engineer&l=Los+Angeles%2C+CA&sc=0kf%3Aattr%28FCGTU%7CHFDVW%7CQJZM9%7CUTPWG%252COR%29explvl%28SENIOR_LEVEL%29jt%28fulltime%29%3B&start=10&pp=gQAPAAAAAAAAAAAAAAAB_k4WvAAQAQEBBwC4v-9mIyU4znNE8QAA&vjk=608fe95d8847d6b4
14,5a8daef7280a0067,QA Engineer,"Los Angeles, CA",SENIOR_LEVEL,BACHELORS_DEGREE,FULLTIME,"Air Quality Engineer - job post NV5 55 reviews Long Beach, CA 90807 $80,000 - $110,000 a year -  Full-time Apply now Apply now save-icon Job details Salary $80,000 - $110,000 a year Job Type Full-time Overview: NV5 is growing the Environmental Health Safety and Air team with the addition of an EH&S Associate Consultant in our Long Beach, CA office. Relative to the candidate’s degree and/or number of years of experience, the ideal candidate will work on various Air and Environmental Health & Safety compliance projects autonomously and under supervision of a Senior Consultant. The candidate must have a thorough working knowledge of Air Quality compliance. NV5 is growing a different kind of consulting firm – a firm of dynamic, motivated, and entrepreneurial technical experts. NV5 is known for anticipating and resolving sustainability, compliance, remediation and restoration needs for the most significant industrial businesses and agency sector organizations. We are a collaborative team of technical and scientific leaders and innovators who keep ahead of trends and requirements. Our experts are trusted advisors to clients across many industries and sectors. We help our clients obtain and maintain compliance with federal, state and local environmental regulations; and we specialize in the complex California regulatory agencies’ requirements. Our work makes businesses and communities cleaner, stronger, and safer. What does all that mean for you? It means you’ll be part of a strong team that wants you to succeed and will give you the tools to do so. It means you’ll be working with smart and dedicated people who work hard but like to have fun. It means there’s plenty of opportunity to increase your skills and share your ideas. And, probably most importantly, we do important work in a business that continues to expand and grow – which means you can develop strong technical expertise, expand your existing skills, learn from top experts in the business, and grow your career with us! If that matches where you want to be in your career and how you like to work, let us hear from you! Responsibilities: Key Responsibilities will include: Air quality permitting under SCAQMD, SJVAPCD, BAAQMD and other Air Districts, including Title V Permitting Air quality regulatory compliance support Annual Emissions Reporting Title V and RECLAIM compliance and reporting Air dispersion modeling Health Risk Assessment and reporting Greenhouse Gas (GHG) analysis Noise studies and modeling Toxic Release Inventory (TRI) reporting California EH&S regulatory compliance audits Hazardous Materials Business Plan (HMBP) & California Environmental Reporting System Spill Prevention, Control, and Countermeasure (SPCC) Plans Hazardous waste minimization Provide training for the management of hazardous waste and materials On-site work at client facilities Frequent contact with clients, regulatory agencies, and outside contractors Qualifications: Candidates should have: BS degree in environmental science, engineering, or industrial hygiene (or equivalent), MS preferred 3 – 8 years of related experience Experience with Air Dispersion Modeling (i.e. AERMOD) and/or health risk assessment tools for permitting, and other software is preferred. Consulting experience preferred Ability to multi-task and manage a variety of project activities Excellent verbal and written communication skills Effective technical writing skills along with MS Office proficiency OSHA 40-hour HAZWOPER Certification preferred The pay range for this California position is $80,000.00- $110,000.00 per year; however, base pay offered may be higher or lower depending on job-related knowledge, skills, and experience of the candidate. Restricted stock units may be provided as part of the compensation package, in addition to a full range of medical, financial, and/or other benefits, dependent on the position offered. This information is provided per California Senate Bill 1162. Base pay information is based on market location. Applicants should apply via the NV5 careers site. NV5 offers a competitive compensation and benefits package including medical, dental, life insurance, PTO, 401(k) and professional development/advancement opportunities. NV5 provides equal employment opportunities (EEO) to all applicants for employment without regard to race, color, religion, gender, sexual orientation, gender identity or expression, national origin, age, disability, genetic information, marital status, amnesty, or status as a covered veteran in accordance with applicable federal, state and local laws. NV5 complies with applicable state and local laws governing non-discrimination in employment in every location in which the company has facilities. This policy applies to all terms and conditions of employment, including, but not limited to, hiring, placement, promotion, termination, layoff, recall, transfer, leaves of absence, compensation, and training. If you require alternative methods of application or screening, you must approach the employer directly to request this as Indeed is not responsible for the employer's application process.",https://www.indeed.com/jobs?q=QA+Engineer&l=Los+Angeles%2C+CA&sc=0kf%3Aattr%28FCGTU%7CHFDVW%7CQJZM9%7CUTPWG%252COR%29explvl%28SENIOR_LEVEL%29jt%28fulltime%29%3B&start=10&pp=gQAPAAAAAAAAAAAAAAAB_k4WvAAQAQEBBwC4v-9mIyU4znNE8QAA&vjk=5a8daef7280a0067
15,cecbecfd528d2c24,QA Engineer,"Los Angeles, CA",SENIOR_LEVEL,BACHELORS_DEGREE,FULLTIME,"Quality Engineer 4 - job post Safran 3,601 reviews Cypress, CA 90630 Full-time You must create an Indeed account before continuing to the company website to apply Apply on company site save-icon Job details Job Type Full-time Job description Are you passionate about technology or aviation? Come invent the solutions of tomorrow in the aerospace and defense industry, with an international group where innovation, teamwork and continuing, daily education are fundamental values. Join us! Are you passionate about technology or aviation? Come invent the solutions of tomorrow in the aerospace and defense industry, with an international group where innovation, teamwork and continuing, daily education are fundamental values. Join us! This position will utilize lean kaizen events to improve a product line or lines by training employees and using quality assurance process sampling systems, procedures and statistical techniques. The Quality Engineer will design, or specify inspection and testing mechanisms and equipment, analyze production and service limitations and standards, recommend the revision of specifications, and formulate quality assurance policies and procedures. Conduct training on manufacturing quality assurance, lean manufacturing and SPC concepts and tools. The Quality Engineer is the control point for the analysis, reporting and training of a product line or lines. This job reports to the Quality Assurance Manager. Summary of Duties: Reviews and signs engineering change notices (ECNs) and engineering drawings. Works with the quality control and production personnel to drive the continuous improvement process. Tracks and ensures measuring and testing equipment used within the division is within calibration. Monitors and assists first article inspection (FAI) information system. Writes reports and standard work, performs employee training, and conducts statistical analysis. Ensures production tooling is inspected and conforms to specs prior to use. Approves work orders prior to release to ensure engineering operations are properly documented. Applies purchase order quality clauses to applicable products within an MRP system Assists corrective action board (CAB) by being a member, provides problem solving / resolution. Performs internal process audits to company specifications. Complementary description Safran Cabin headquarters are in Huntington Beach, California, with a global presence of over 10,000 employees at 39 sites. Site locations are in the United States, Mexico, Brazil, Canada, Germany, France, Czech Republic, the Netherlands, Tunisia and Thailand. SAFRAN Cabin serves over 400 airlines and leasing companies globally and delivers to all airframe OEM manufacturers with a heritage spanning over 80 years in the industry. Safran's Corporate Social Responsibility (CSR) goes beyond our facility walls. We value and support the communities where we live and work. One of Safran's values and CSR pillar is Corporate Citizenship that helps drive economic, social and cultural progress by sharing our gifts with those around us. Your Career: Safran is committed to providing internal mobility to our employees. We operate globally so the sky is the limit of where your Safran journey can take you. Your Development: Safran employees have free access to Safran University courses and external tuition reimbursement for approved programs or certifications. Your Benefits: Our suite of comprehensive benefits include health care (medical, dental and vision), life insurance, 401(k) savings plans with company match, paid time off, and more! ting diversity throughout our companies. Job requirements Education: BS degree preferred or equivalent work experience in related fields. Experience: 8-10 years' experience within the quality environment. Computer Skills: Proficient with Microsoft Office® programs, Office, and with MRP systems. Advanced Excel skills. Other Skills: Certified blueprint reader. Strong trouble shooting skills and communication skills. Advanced Spreadsheet building and Microsoft Office Skills. Ability to read engineering drawings, specifications and other related literature is necessary. Proficient with general quality systems and with the following internal processes: CDQ, SQUIP, DSQR. Additional Preferred Skills: (not required) Management experience Quality certification At Safran, diversity & inclusion is a source of richness that adds quality of life, performance, and innovation. We welcome diverse contributions and provide equal employment opportunity to all individuals regardless of race, color, religion, sex/gender, sexual orientation, gender identity/gender expression, marital status, pregnancy, age, national origin, ancestry, disability/medical condition, military or veteran status, citizenship status, genetic characteristics or information, or any other characteristic protected by applicable federal, state, and local laws. Safran is an international high-technology group, operating in the aviation (propulsion, equipment and interiors), defense and space markets. Its core purpose is to contribute to a safer, more sustainable world, where air transport is more environmentally friendly, comfortable and accessible. Safran has a global presence, with 76,800 employees and sales of 15,3 billion euros in 2021 and holds, alone or in partnership, world or regional leadership positions in its core markets. Safran undertakes research and development programs to maintain the environmental priorities of its R&T and innovation roadmap. Safran was ranked as the world's third best employer in its sector by Forbes magazine in 2021. Safran Cabin is a world leader in fully integrated cabin interiors, catering systems and cargo equipment. Bachelor's Degree More than 8 years",https://www.indeed.com/jobs?q=QA+Engineer&l=Los+Angeles%2C+CA&sc=0kf%3Aattr%28FCGTU%7CHFDVW%7CQJZM9%7CUTPWG%252COR%29explvl%28SENIOR_LEVEL%29jt%28fulltime%29%3B&start=20&pp=gQAeAAAAAAAAAAAAAAAB_k4WvAAKAQAMGvgrOZUIWgAA&vjk=cecbecfd528d2c24
16,71cb689546e00077,QA Engineer,"Los Angeles, CA",SENIOR_LEVEL,BACHELORS_DEGREE,FULLTIME,"Sr. Supplier Quality Engineer - job post Safran 3,601 reviews Carson, CA $70,560 - $110,880 a year -  Full-time You must create an Indeed account before continuing to the company website to apply Apply on company site save-icon Job details Salary $70,560 - $110,880 a year Job Type Full-time Job description Supplier quality engineer works very closely with suppliers, engineering, operations, SCM to assess quality and ensure all products are free from defects and in compliance with engineering and manufacturing specifications and government standards. They work to resolve any quality issues and provide guidance on process enhancements and improvements. Partner with supplier to ensure product conformance. Reviewing our manufacturing specifications to identify materials needed for production. Researching, sourcing, and assessing the best vendors to supply the necessary materials. Visiting vendor facilities and observing the manufacturing environment to review and assess their procedures. Performing regular quality control audits to ensure vendors continue to work in compliance with company and federal standards. Reviewing incoming supplies and products from vendors to check for defects and ensure quality. Conducting tests and assessments on products to identify quality issues. Maintaining detailed reports on supplier quality, including defect rates and areas that result in flaws. Partner with suppliers to reduce defects and conduct on going monitoring Providing technical advice and guidance to suppliers to reduce defect rates. Serving as a liaison between our company's senior management and the vendors to identify quality issues and come up with solutions. Complementary description Safran Cabin headquarters are in Huntington Beach, California, with a global presence of over 10,000 employees at 39 sites. Site locations are in the United States, Mexico, Brazil, Canada, Germany, France, Czech Republic, the Netherlands, Tunisia and Thailand. Safran Cabin serves over 400 airlines and leasing companies globally and delivers to all airframe OEM manufacturers with a heritage spanning over 80 years in the industry. Safran's Corporate Social Responsibility (CSR) goes beyond our facility walls. We value and support the communities where we live and work. One of Safran's values and CSR pillar is Corporate Citizenship that helps drive economic, social and cultural progress by sharing our gifts with those around us. Your Career: Safran is committed to providing internal mobility to our employees. We operate globally so the sky is the limit of where your Safran journey can take you. Your Development: Safran employees have free access to Safran University courses and external tuition reimbursement for approved programs or certifications. Your Benefits: Our suite of comprehensive benefits include health care (medical, dental and vision), life insurance, 401(k) savings plans with company match, paid time off, Safran Perks with BenefitHub – Employee Discounts & Rewards Marketplace for consumer products/services and more! Annual Salary: USD 70,560-110,880 Job requirements Partner with SCM for researching, sourcing, and assessing the best vendors to supply the necessary materials. Visiting Supplier facilities and observing the manufacturing environment to review and assess their procedures. Performing regular quality control audits to ensure vendors continue to work in compliance with company and federal standards. Reviewing incoming supplies and products from vendors to check for defects and ensure quality of the product and FAIRs as required. Conducting tests and assessments on products to identify quality issues. Maintaining detailed reports on supplier quality, including defect rates and areas that result in flaws and improvements needed Partner with suppliers to reduce defect rates. Serving as a liaison between our company's senior management and the supplier to identify quality issues and come up with solutions. Act as the focal point for supplier quality for customer and regulatory audits. Specificity of the job 25-45% travel as required. Safran is an international high-technology group, operating in the aviation (propulsion, equipment and interiors), defense and space markets. Its core purpose is to contribute to a safer, more sustainable world, where air transport is more environmentally friendly, comfortable and accessible. Safran has a global presence, with 76,800 employees and sales of 15,3 billion euros in 2021 and holds, alone or in partnership, world or regional leadership positions in its core markets. Safran undertakes research and development programs to maintain the environmental priorities of its R&T and innovation roadmap. Safran was ranked as the world's third best employer in its sector by Forbes magazine in 2021. Safran Cabin is a world leader in fully integrated cabin interiors, catering systems and cargo equipment. Bachelor's Degree More than 3 years",https://www.indeed.com/jobs?q=QA+Engineer&l=Los+Angeles%2C+CA&sc=0kf%3Aattr%28FCGTU%7CHFDVW%7CQJZM9%7CUTPWG%252COR%29explvl%28SENIOR_LEVEL%29jt%28fulltime%29%3B&start=20&pp=gQAeAAAAAAAAAAAAAAAB_k4WvAAKAQAMGvgrOZUIWgAA&vjk=71cb689546e00077
