,job_id,job_title,location,experience,education,job_type,job_description,job_link
5,bf4b6fd43c346f37,QA Engineer,"San Francisco, CA",MID_LEVEL,MASTERS_DEGREE,FULLTIME,"#015 - Software Quality and Automation Engineer - job post Eko Health Berkeley, CA 94710 $170,000 - $176,800 a year -  Full-time You must create an Indeed account before continuing to the company website to apply Apply on company site save-icon Job details Salary $170,000 - $176,800 a year Job Type Full-time At Eko, we’re dedicated to providing healthcare professionals with industry leading digital tools to hear and understand their patients’ hearts and lungs. With our platform, clinicians can detect cardiopulmonary disease with higher accuracy, diagnose with more confidence, manage treatment effectively, and ultimately give their patients the best care possible. With over $125M in funding from partners like 3M and the Mayo Clinic, Eko has become one of the fastest growing digital health companies, doubling our customer base in the last year to over 135,000 clinicians across 4,000 U.S. hospitals. We’ve built a tremendously talented, diverse, and mission driven team and are proud to be certified as a Great Place to Work®. Together we are committed to investing in each other and our mission to ensure all patients have access to high quality care. Job Description: Develop and execute software tests for Eko to identify and resolve software problems. Duties include: collaborate with product/design/engineering to realize product requirements; identify issues, verify test cases, and executing them and their results; design, develop, and implement automation projects for applications; design test plans for automated software test procedures; identify and manage risks, issues, and potential defects through project life cycle; and participate in product technical and architectural design discussions. Job Requirements: Bachelor’s Degree (or foreign equivalent) in Computer Science and Engineering, Software Engineering, Computer Applications, or a related field and 5 years of progressively responsible IT experience, which includes 2 years of experience in the following skill set: Managing or leading a team; Creating and executing test documents such as test plan, test cases, and test report; Cucumber, TestNG, Postman and MySQL/PostgreSQL; Scripting in Shell or Python; Debugging on Android, iOS, and Linux; and Developing and testing software of medical devices. To Apply: Visit https://www.ekohealth.com/page/careers for a complete job description, requirement and to apply. Refer to Req#015 Benefits and Perks We Offer: Eko was recognized by “Great Place to Work” in 2020 and 2021 Paid-time off Medical/Dental/Vision, Disability + Life Insurance Volunteer time off One Medical membership Parental Leave 401k Matching Work from home equipment stipend Flexible schedules Wellness programs (Wellness Wednesdays, Time off) Wellness perks (Headspace, Ginger, Aaptiv, Physera) Learning and Development stipend $170,000 - $176,800 a year Eko is proud to be an equal opportunity employer and welcome people of different backgrounds, experiences, abilities and perspectives. We celebrate diversity and are committed to building a diverse and inclusive team. Eko is elevating the way clinicians detect and monitor cardiac and respiratory disease by bringing together advanced sensors, patient and provider software, and AI-powered analysis. Its FDA cleared platform is used by tens of thousands of clinicians treating millions of patients around the world, in-person, and through telehealth. The company is headquartered in Oakland, California and privately-held, with investments from ARTIS Ventures, NTT Venture Capital, DigiTx Ventures, Mayo Clinic, Sutter Health and others. Eko is proud to be an equal opportunity employer and welcome people of different backgrounds, experiences, abilities and perspectives. We celebrate diversity and are committed to building a diverse and inclusive team.",https://www.indeed.com/jobs?q=QA+Engineer&l=San+Francisco%2C+CA&sc=0kf%3Aattr%28EXSNN%7CFCGTU%7CHFDVW%7CQJZM9%7CUTPWG%252COR%29explvl%28MID_LEVEL%29jt%28fulltime%29%3B&vjk=bf4b6fd43c346f37
6,f5084a4fc56cb970,QA Engineer,"San Francisco, CA",MID_LEVEL,MASTERS_DEGREE,FULLTIME,"QA Engineer - job post Abbott Laboratories 5,855 reviews Alameda, CA $82,100 - $164,100 a year -  Full-time You must create an Indeed account before continuing to the company website to apply Apply on company site save-icon Job details Salary $82,100 - $164,100 a year Job Type Full-time Abbott is a global healthcare leader that helps people live more fully at all stages of life. Our portfolio of life-changing technologies spans the spectrum of healthcare, with leading businesses and products in diagnostics, medical devices, nutritionals and branded generic medicines. Our 115,000 colleagues serve people in more than 160 countries. QA Engineer About Lingo Meet Lingo, a new biosensing technology that provides users a window into their body. Lingo tracks key biomarkers – such as glucose, ketones, and lactate – to help people make better decisions about their health and nutrition. Biowearable technology will digitize, decentralize and democratize healthcare, enabling consumers to take control of their own health. The opportunity Personalized healthcare is the future. Working on Lingo, you will help build a next-generation technology that enables individuals to make decisions about how to improve energy, lose weight or enhance athletic performance. The Lingo team embodies a start-up culture and mindset with the backing of Abbott, a company with a rich history of healthcare innovation. Join us and grow your career as you help Abbott shape the future of healthcare. This position works out of our <> location in Lingo. As a QA engineer, you will be our quality champion, empowering teams to create high-performing and secure systems. To create a highly resilient system, you will embrace an entrepreneurial mindset and trial unhappy paths and edge cases in performance and security testing. You will enhance and implement automated testing frameworks and support feature-based testing by drawing on a combination of automated and manual testing to efficiently cover the system’s functionality without compromising quality. What you’ll do Ensure every feature developed by the team is tested Blend automated and manual testing to efficiently cover the system’s functionality without compromising quality Strive to automate and maintain comprehensive test suites with a continuous improvement mindset Work with the technology team to run tests after deployment in production environments to ensure quality Create, manage, and utilize defect workflows with automated testing Know the product vision and work closely with designers and the product owner to translate their visions into tests Partner with development teams to identify key areas of risk in new solutions Design and publish meaningful metrics to support the creation and execution of automated testing frameworks Qualifications 4+ years of relevant experience as a QA engineer or tester Significant experience as an exploratory or hands-on tester in multiple platforms and testing techniques Experience with manual acceptance testing at the story level and exploratory and creative testing within fast-paced sprint cycles An ability to find hidden requirements, edge cases, and a “desire to break” attitude Experience implementing automated end-to-end tests Experience with frameworks and tools such as BDD and Selenium and the ability to code in JavaScript Strong organizational skills, tracking multiple test executions simultaneously, and an ability to synthesize results University degree in Computer Science, Engineering, or similar technical disciplines Apply Now Participants who complete a short wellness assessment qualify for FREE coverage in our HIP PPO medical plan. Free coverage applies in the next calendar year. Learn more about our health and wellness benefits, which provide the security to help you and your family live full lives: www.abbottbenefits.com Follow your career aspirations to Abbott for diverse opportunities with a company that can help you build your future and live your best life. Abbott is an Equal Opportunity Employer, committed to employee diversity. Connect with us at www.abbott.com, on Facebook at www.facebook.com/Abbott and on Twitter @AbbottNews and @AbbottGlobal. Divisional Information Diabetes We’re focused on helping people with diabetes manage their health with life-changing products that provide accurate data to drive better-informed decisions. We’re revolutionizing the way people monitor their glucose levels with our new sensing technology. The salary for this role is between $82,100 – $164,100",https://www.indeed.com/jobs?q=QA+Engineer&l=San+Francisco%2C+CA&sc=0kf%3Aattr%28EXSNN%7CFCGTU%7CHFDVW%7CQJZM9%7CUTPWG%252COR%29explvl%28MID_LEVEL%29jt%28fulltime%29%3B&vjk=f5084a4fc56cb970
7,211c57f17e880c0e,QA Engineer,"San Francisco, CA",MID_LEVEL,MASTERS_DEGREE,FULLTIME,"Quality Assurance Engineer - job post AppFolio 57 reviews San Francisco, CA 94103 $80,000 - $115,000 a year -  Full-time You must create an Indeed account before continuing to the company website to apply Apply on company site save-icon Job details Salary $80,000 - $115,000 a year Job Type Full-time Hi, We’re AppFolio. We’re innovators, changemakers, and collaborators. We’re more than just a software company — we’re a cloud-based powerhouse that creates products to make our customers’ lives easier. We’re revolutionizing the way people do business, and we want your ideas, your enthusiasm, and your passion to help us keep on innovating. We love where we work, and you can, too. **NOTE: Our major development hubs are based in Santa Barbara, CA and San Diego, CA. However, we're open to exploring remote-first working arrangements in other locations around the United States if relocation is not desired.** To find out more about what AppFolio has to offer, check out appfolioinc.com/careers . Who we are: AppFolio (NASDAQ: APPF) was founded by the team that built GoToMeeting, a market-leading enterprise software solution. We have extensive experience in software development and continue to lead the way in providing our customers with user-friendly, intuitive, and innovative solutions. To learn more about AppFolio and our values check out our profile on The Muse ! What’s in it for you: Competitive Pay Full Benefits 401k 20 PTO Days Amazing company culture Room to grow and tons of mentoring Onsite Fitness Classes A fully stocked break room with all kinds of snacks and goodies Being a part of a growing, public SaaS company What we are looking for: We are hiring a Quality Assurance Engineer to contribute to our rapid product development pace. Our Engineers work collaboratively to set the technical direction for our SaaS products, developing easy-to-use solutions for our customers. This is an ideal opportunity for someone who has a passion and commitment to quality software, loves learning new and emerging technologies, and is driven to help build a successful SaaS product used by thousands of happy businesses. We practice and value modern agile methods and a whole team approach to quality. Responsibilities : Conduct exploratory software testing to identify areas of improvement for our web-based applications Test new product features as part of our user story-driven, Agile/Scrum software development process Collaborate closely with software developers to resolve issues discovered during testing Coordinate across teams to ensure preparedness for each software release Assist in backlog grooming for upcoming development sprints Encourage and advocate team ownership of software quality Skills & Knowledge: Bachelors in Computer Science, Engineering, or equivalent combination of technical coursework and practical experience. 2 - 5+ years of experience in Accounting, Finance, Technology, or related fields. All work experience levels in QA Engineering welcome to apply. Analytical, organizational, and time-management skills with high attention to detail A commitment to quality, and an enthusiasm for testing Strong interpersonal and communication skills to collaborate with development teams and product owners Nice to have: Experience with Agile/Scrum software development process in a SaaS environment Experience with Ruby on Rails If you are interested in creating exceptional SaaS products and being part of a successful public company, apply today! Requires a Bachelor’s/Master’s degree in Computer Science, Information Systems, Engineering or related field plus any amount of knowledge in the following: developing business or other application software for web-based users; Ruby or Ruby on Rails or related programming language; JavaScript or CoffeeScript; HTML; CSS; SQL; and SVN or GIT source control. Employer will accept knowledge gained through any employment, education, training, or coursework. Compensation & Benefits The base salary that we reasonably expect to pay for this role is: $80,000-$115,000 The actual base salary for this role will be determined by a variety of factors, including but not limited to: the candidate’s skills, education, experience, etc. Please note that base pay is one important aspect of a compelling Total Rewards package. The base pay range indicated here does not include any additional benefits or bonuses/commissions that you may be eligible for based on your role and/or employment type. Regular full-time employees are eligible for benefits including but not limited to: Paid Time Off (PTO) Medical, dental, and vision benefits Long-term and short-term disability insurance 401(k) Wellness benefits Interns / full-time temporary / eligible variable hour employees are eligible for benefits including but not limited to: Medical 401(k) Wellness benefits Our Story AppFolio (NASDAQ: APPF) was founded in 2006 with the mission to revolutionize vertical industry businesses by providing great software and service. Our easy-to-use, cloud-based software helps our customers more effectively market, manage, and grow their businesses. Our software solutions exist in the real estate vertical, including AppFolio Property Manager and AppFolio Investment Management. To find out more about what AppFolio has to offer, check out appfolioinc.com/careers . #L1-ER1",https://www.indeed.com/jobs?q=QA+Engineer&l=San+Francisco%2C+CA&sc=0kf%3Aattr%28EXSNN%7CFCGTU%7CHFDVW%7CQJZM9%7CUTPWG%252COR%29explvl%28MID_LEVEL%29jt%28fulltime%29%3B&vjk=211c57f17e880c0e
8,e83aa4983d217295,QA Engineer,"San Francisco, CA",MID_LEVEL,MASTERS_DEGREE,FULLTIME,"Software QA Automation Engineer - job post Authentic8 Redwood City, CA $100,000 - $130,000 a year -  Full-time You must create an Indeed account before continuing to the company website to apply Apply on company site save-icon Job details Salary $100,000 - $130,000 a year Job Type Full-time We are a fast-growing remote-friendly cybersecurity company with multiple offices in the US including San Francisco and Washington, D.C. The world’s most at-risk organizations rely on Authentic8 to completely eliminate the risk of using the web.We believe people should be able to go online without fear of exploit, surveillance or repercussion. And our mission is to make this a reality. Through integrity in our work, respect of others and commitment to this mission, we are building a business that enables access to the web with the peace of mind that everyone deserves. We are a rapidly growing company with more than 500 customers across the public and private sector. Established in 2010, Authentic8 continues to see new demand and use case opportunities for the cloud-based Silo Web Isolation Platform. Authentic8 is looking for a high-energy Software QA Automation Engineer to add to our QA automation efforts. The Authentic8 solution has a diverse technology architecture, so the right candidate will be skilled in White Box testing, the frameworks, tools, and processes for automating the testing of web and desktop applications, RESTful services, servers, and databases. The Authentic8 solution is delivered to users of all major platforms, your experience with Windows, macOS, and Linux will ensure a high quality experience by our users. The position demands maturity, flexibility and someone ready to contribute at a high level-and the rewards come with it. Responsibilities Create and automate tests for various Authentic8 products File bug reports and work with engineers and product management to drive issues to conclusion Build new automated test frameworks and enhance existing ones Build and enhance test tools for QA team Work with site reliability engineers to support timely deployment of releases Work with development engineers to support unit testing (frameworks and test scripts) Skills & Requirements Significant White Box testing experience Hands-on experience and success delivering test automation Ability to write tests in Python and other languages (Java, Javascript, etc.) using common testing frameworks Ability to create detailed test plans, test cases Familiarity with working in Linux based systems - ssh, command line usage, shell scripting, etc Experience testing Web Applications with automated tools (Selenium, Puppeteer, etc) Experience testing servers and/or proxies Understanding of databases and ability to form SQL queries for data validation Ability to communicate clearly including status, bug reports, and test plans Experience with one or more source code control systems (GIT, Subversion) Highly Desirable Skills Experience working with Sikuli, or other desktop automation tools Experience with integrating REST / GraphQL APIs Experience with executing and building performance/load tests Experience with Visual Regression Testing Familiarity with Postman or similar API testing applications Cloud services experience (Azure, AWS, GCE, EC2, S3, Rackspace, etc) Familiarity with Windows and macOS Security experience (SSH keyfiles/agents, SSL Certificates, etc) Documentation skills, using Confluence or other wiki systems Data networking configuration and debugging skills (TCP/IP, network tracing, etc) Education/Experience BS, BA (or equivalent) a plus 3+ years of related experience in Software QA Strong problem-solving, communication and analytical skills Salary Range $100,000 - $130,000 + bonus and equity Authentic8 Core Values & Principles: Integrity: We apply our best efforts. We are honest with and accountable to others. Mission-Focused: We clearly define and communicate our goals and do not stray in the pursuit of our objective. Respect: We value and respect the ideas and experience our diverse backgrounds bring us. Positive consideration of differing viewpoints makes us stronger. We are collaborative: We recognize the best work is the product of teams. We must each be reliable and expect to rely on others. We are transparent: By operating with common information and understanding we ensure that we are aligned. We find innovative solutions: We seek innovative solutions not as a buzzword but as a means to solve difficult problems with zeal, efficiency and quality. We take ownership: We are responsible for our actions, our reputation and our business. Authentic8 offers competitive benefits, including medical, dental and vision, flexible PTO, a 401k program and stock options. Authentic8 offers competitive benefits, including medical, dental and vision, flexible PTO, a 401k program and stock options. It is the policy of Authentic8 to provide equal employment opportunity (EEO) to all persons regardless of age, color, national origin, citizenship status, physical or mental disability, race, religion, creed, gender, sex, sexual orientation, gender identity and/or expression, genetic information, marital status, status with regard to public assistance, veteran status, or any other characteristic protected by federal, state or local law.",https://www.indeed.com/jobs?q=QA+Engineer&l=San+Francisco%2C+CA&sc=0kf%3Aattr%28EXSNN%7CFCGTU%7CHFDVW%7CQJZM9%7CUTPWG%252COR%29explvl%28MID_LEVEL%29jt%28fulltime%29%3B&vjk=e83aa4983d217295
