,job_id,job_title,location,experience,education,job_type,job_description,job_link
0,94301e2c0cfda1c6,QA Engineer,"San Francisco, CA",MID_LEVEL,MASTERS_DEGREE,FULLTIME,"QA Engineer - Hybrid - job post Worker's Compensation Insurance Rating Bureau Oakland, CA 94612 • Hybrid remote $97,996 - $145,002 a year -  Full-time Apply now Apply now save-icon Job details Salary $97,996 - $145,002 a year Job Type Full-time The Workers' Compensation Insurance Rating Bureau of California (WCIRB) is California's trusted, objective provider of actuarially-based information and research, advisory pure premium rates, and educational services integral to a healthy workers' compensation system. The WCIRB is a California unincorporated, private, nonprofit association comprised of all companies licensed to transact workers' compensation insurance in California, and has over 400 member companies. No state money is used to fund its operations. The operations of the WCIRB are funded primarily by membership fees and assessments. To accurately measure the cost of providing workers' compensation benefits, the WCIRB performs a number of functions, including collection of premium and loss data on every workers' compensation insurance policy, examination of policy documents, inspections of insured businesses, and test audits of insurer payroll audits and claims classification. The WCIRB employs approximately 175 people. The home office is located in Oakland, California. “Join our progressive software team and become a leader in our program to migrate from a monolithic, legacy application to a performant, Azure-hosted set of .Net microservices” The Role WCIRB is looking for a QA Engineer for functional and automation testing who is passionate about quality and automation. You will be creating, maintaining, and improving automation frameworks/infrastructure. You will be involved in every step of software development process like designing, development and testing. You will be responsible for monitoring, analyzing, and reporting test results. The ideal candidate will be highly technical, detail-oriented, creative, motivated, and can work without too much supervision. What You’ll Do Review requirements, specifications, and technical design documentation to define the test strategy and estimate QA effort. Build, maintain, and improve the existing automation framework and processes. Create and improve testing-related documentation, including test plans, test cases/scripts, defect reports, and knowledge base articles. Achieve extensive code coverage through unit testing. Can build, deploy, run & manage the Testing related application individually. Influence the development team, program management, architect & design teams on technical implementation, Testability and user scenarios. Responsible for monitoring, analyzing, and reporting test results and Incident Management. Work closely with the QA group to automate features for better regression coverage, automate production issues, execute scripts, and triage automation runs. Effectively collaborate with Business users, Development Teams, Functional QAs, and others to understand requirements and scope of work. Develop deep expertise in the WCIRB systems. Requirements 8-10 years of experience in the software industry, with a passion for quality processes. Proficient in QA process & methodologies, tools, and different testing approaches (black box and automated testing) with short release cycles. 8-10 years of experience in the architectural design, development, and maintenance of test automation frameworks is required. Must have hands-on experience in C#.net and Visual Studio. Experience with one or more Unit Test Frameworks like Nunit, Xunit or MSTests. Experience with one or more automation tools like Playwright, Selenium or Cypress. Experience in testing and automating APIs and Knowledge of tools like SoapUI, Postman, Fiddler etc. Experience in the software development lifecycle, test methodologies, and tools. Strong problem-solving, critical thinking, verbal, and written communication skills. Bachelor’s in Computer Science/ Engineering or a similar field. Nice to Have Experience in CI/CD pipelines and Azure DevOps. Experience with Microservice architecture. Shell scripting. Knowledge and experience in SQL Database testing. Perks & Benefits Our employees enjoy a state of the art, energy-efficient, open work environment that nurtures collaboration and creativity. At the WCIRB, we go the extra mile to keep our employees happy and healthy. Our perks include: Hybrid work environment (40% onsite, 60% remote) Allocations for continuous learning & development Allowance for wellness & fitness programs Medical, dental and vision benefits 401K and pension plan Annual incentive plan Social activities Employee discounts on activities and events Community volunteer involvement Please note that the WCIRB has enacted a mandatory COVID-19 vaccine requirement for all employees. Proof of full vaccination or an approved exemption or deferral is required of all employees, including new hires. QA Engineer $97,996 - 145,002 Senior QA Engineer $108,893 - 163,272 If you require alternative methods of application or screening, you must approach the employer directly to request this as Indeed is not responsible for the employer's application process.",https://www.indeed.com/jobs?q=QA+Engineer&l=San+Francisco%2C+CA&sc=0kf%3Aattr%28EXSNN%7CFCGTU%7CHFDVW%7CQJZM9%7CUTPWG%252COR%29explvl%28MID_LEVEL%29jt%28fulltime%29%3B&vjk=94301e2c0cfda1c6
1,9f6fe31feac65fa7,QA Engineer,"San Francisco, CA",MID_LEVEL,MASTERS_DEGREE,FULLTIME,"QA Engineer - Hybrid - job post WCIRB Oakland, CA 94612 • Hybrid remote $95,420 - $158,980 a year -  Full-time Apply now Apply now save-icon Job details Salary $95,420 - $158,980 a year Job Type Full-time The Workers' Compensation Insurance Rating Bureau of California (WCIRB) is California's trusted, objective provider of actuarially-based information and research, advisory pure premium rates, and educational services integral to a healthy workers' compensation system. The WCIRB is a California unincorporated, private, nonprofit association comprised of all companies licensed to transact workers' compensation insurance in California, and has over 400 member companies. No state money is used to fund its operations. The operations of the WCIRB are funded primarily by membership fees and assessments. To accurately measure the cost of providing workers' compensation benefits, the WCIRB performs a number of functions, including collection of premium and loss data on every workers' compensation insurance policy, examination of policy documents, inspections of insured businesses, and test audits of insurer payroll audits and claims classification. The WCIRB employs approximately 175 people. The home office is located in Oakland, California. “Join our progressive software team and become a leader in our program to migrate from a monolithic, legacy application to a performant, Azure-hosted set of .Net microservices” The Role WCIRB is looking for a QA Engineer for functional and automation testing who is passionate about quality and automation. You will be creating, maintaining, and improving automation frameworks/infrastructure. You will be involved in every step of software development process like designing, development and testing. You will be responsible for monitoring, analyzing, and reporting test results. The ideal candidate will be highly technical, detail-oriented, creative, motivated, and can work without too much supervision. What You’ll Do Review requirements, specifications, and technical design documentation to define the test strategy and estimate QA effort. Build, maintain, and improve the existing automation framework and processes. Create and improve testing-related documentation, including test plans, test cases/scripts, defect reports, and knowledge base articles. Achieve extensive code coverage through unit testing. Can build, deploy, run & manage the Testing related application individually. Influence the development team, program management, architect & design teams on technical implementation, Testability and user scenarios. Responsible for monitoring, analyzing, and reporting test results and Incident Management. Work closely with the QA group to automate features for better regression coverage, automate production issues, execute scripts, and triage automation runs. Effectively collaborate with Business users, Development Teams, Functional QAs, and others to understand requirements and scope of work. Develop deep expertise in the WCIRB systems. Requirements 8-10 years of experience in the software industry, with a passion for quality processes. Proficient in QA process & methodologies, tools, and different testing approaches (black box and automated testing) with short release cycles. 8-10 years of experience in the architectural design, development, and maintenance of test automation frameworks is required. Must have hands-on experience in C#.net and Visual Studio. Experience with one or more Unit Test Frameworks like Nunit, Xunit or MSTests. Experience with one or more automation tools like Playwright, Selenium or Cypress. Experience in testing and automating APIs and Knowledge of tools like SoapUI, Postman, Fiddler etc. Experience in the software development lifecycle, test methodologies, and tools. Strong problem-solving, critical thinking, verbal, and written communication skills. Bachelor’s in Computer Science/ Engineering or a similar field. Nice to Have Experience in CI/CD pipelines and Azure DevOps. Experience with Microservice architecture. Shell scripting. Knowledge and experience in SQL Database testing. Perks & Benefits Our employees enjoy a state of the art, energy-efficient, open work environment that nurtures collaboration and creativity. At the WCIRB, we go the extra mile to keep our employees happy and healthy. Our perks include: Hybrid work environment (40% onsite, 60% remote) Allocations for continuous learning & development Allowance for wellness & fitness programs Medical, dental and vision benefits 401K and pension plan Annual incentive plan Social activities Employee discounts on activities and events Community volunteer involvement Please note that the WCIRB has enacted a mandatory COVID-19 vaccine requirement for all employees. Proof of full vaccination or an approved exemption or deferral is required of all employees, including new hires. Salary range: QA Engineer $97,996 - 145,002 Senior QA Engineer $108,893 - 163,272 VgwYzo0kkW If you require alternative methods of application or screening, you must approach the employer directly to request this as Indeed is not responsible for the employer's application process.",https://www.indeed.com/jobs?q=QA+Engineer&l=San+Francisco%2C+CA&sc=0kf%3Aattr%28EXSNN%7CFCGTU%7CHFDVW%7CQJZM9%7CUTPWG%252COR%29explvl%28MID_LEVEL%29jt%28fulltime%29%3B&vjk=9f6fe31feac65fa7
2,81b373ffd6e7c680,QA Engineer,"San Francisco, CA",MID_LEVEL,MASTERS_DEGREE,FULLTIME,"QA Engineer (Remote) - job post Primary.Health San Francisco, CA • Remote Full-time You must create an Indeed account before continuing to the company website to apply Apply on company site save-icon Job details Encouraged to Apply Fair chance Job Type Full-time Primary.Health is the engine behind your COVID-19 testing and vaccination programs. Our web-based platform provides government agencies, schools, healthcare facilities, and community based organizations the ability to quickly register participants, schedule appointments, arrange for easy onsite check-in and check-out, and exchange data between labs and state databases, easing the reporting process. JOB TITLE: QA Engineer JOB TYPE: Full-time LOCATION: Remote JOB SCOPE: As a Quality Engineer at Primary you will be responsible for quality assurance related activities and following the complete end-to-end testing lifecycle including testing the products existing and new features, automating test cases, reporting bugs, etc. You will be working closely with our Developers and Product Managers. We are a fast moving organization, typically do multiple deployments per day, and are looking for great people to build software to help power this. MAJOR JOB DUTIES: Work collaboratively with cross-functional teams to plan and execute on engineering projects. Develop automated tests against a comprehensive healthcare platform. Work closely with the engineering team to figure out how best to deploy software safely MINIMUM EDUCATION: Bachelor’s degree in Computer Science or Engineering. QUALIFICATIONS: Minimum of 3+ years of industry experience in QA or a testing environment Ability to develop test strategy, design test plans and test cases Experience writing automated tests with selenium, capybara, against complex web services. You’re fluent in at least one major programming language and would be able to switch between multiple languages. In our stack, we mainly use Ruby on Rails and React. You have strong SQL query knowledge You can break down complex problems rigorously and understand the tradeoffs necessary to deliver great, impactful products. You’re curious, you’re data-driven, you love to ask questions, and you think critically about problems. You love delivering value to your users and your teammates through your work. Nice-to-Have Qualification: You’ve demonstrated your ability to thrive in a fast-paced startup environment. Primary embraces diversity. We are proud to be an equal opportunity workplace and do not discriminate on the basis of sex, race, color, age, sexual orientation, gender identity, religion, national origin, citizenship, marital status, veteran status, or disability status. Pursuant to the San Francisco Fair Chance Ordinance, we will consider for employment qualified applicants with arrest and conviction records.",https://www.indeed.com/jobs?q=QA+Engineer&l=San+Francisco%2C+CA&sc=0kf%3Aattr%28EXSNN%7CFCGTU%7CHFDVW%7CQJZM9%7CUTPWG%252COR%29explvl%28MID_LEVEL%29jt%28fulltime%29%3B&vjk=81b373ffd6e7c680
3,d0baa0aa2d349d11,QA Engineer,"San Francisco, CA",MID_LEVEL,MASTERS_DEGREE,FULLTIME,"QA Engineer - job post Matrix Precise, Inc. Oakland, CA 94612 Full-time Apply now Apply now save-icon Job details Job Type Full-time About Matrix Precise: Matrix Precise Inc. is a Technology Development, Consulting and R&D Company. We provide solutions in the areas of facial recognition, smart retail, handwriting recognition and smart robots. Our client services also entail a range of development and support solutions from web and mobile application development, infrastructure and production support and testing services. We offer very competitive compensation and benefits packages including health insurance and 401K. Position Overview: We are looking for a Quality Assurance Engineer to ensure that the solution delivered has the highest level of quality possible. You will be primarily responsible for the creation and execution of test cases, manual and automated testing as needed. Someone who will be responsible for discovery, management, and closure of issues discovered during the testing process. We are looking for an individual to assist in the identification of process improvements and quality standards. This individual must possess excellent analytic and problem-solving skills and have the tenacity to discover the hard-to-find defects and manage them until closure. You will be required to collaborate and communicate effectively in a team environment, as well as work and think independently. Responsibilities Management and execution of test scenarios and test cases and, where possible, develop and execute automated test scripts to verify software functionality and adherence to business requirements. Ability to create test plans and test cases by analyzing requirements, setting up test environments, understanding and executing test scripts with little supervision Read/write/execute SQL queries to validate inserts, updates & extracts from a SQL Server/Oracle database. Leverage various toolsets to test Web Services or Rest Services (API testing ex: SoapUI or Postman). Perform various types of testing, including Performance, Load, Regression, Integration and Functional. Identify test data, execute the test cases and report defects. Good experience with various defect tracking tools (JIRA, Bugzilla etc) Take a proactive role in researching and implementing more effective test practices Familiar with different tools supporting test automation (Selenium, Cucumber, MySQL, Eclipse IDE, Core Java) Estimate, track and analyze defect metrics associated with testing activities and help identify problem areas in the application. Provide timely updates and elevate critical risks to project and management teams. Good verbal and written communication skills for collaborative team environment and technical documentation Strong analytical and troubleshooting/debugging skills to resolve technical and business issues Interface with supervisor, business analysts, and developers in order to verify complex solutions. Manage priorities in a highly dynamic environment by working closely with your supervisor and the team’s Project Manager. Working experience in HealthCare industry is highly desirable. Qualifications A minimum of 7-8 years’ QA experience, including 5 or more years of manual testing Experience with RDBMS (Oracle, SQL Server, MySQL) and database query writing/execution. Experience testing standalone, web, backend systems and/or mobile applications. Expertise in testing methodologies, test plans and test case development. Strong experience testing software at API level using SOAP UI, PostMan, REST Client etc Well versed with defect reporting process. Experience writing and maintaining test cases and related documentation. Experience in automation tools like Selenium web driver or similar tools. Bachelor’s degree in Computer Science, MIS or similar required (minimum). Expectations Adaptable and able to pick up new technologies and techniques quickly. Self-motivated, detail oriented and organized Must be a team player, a leader and proven ability to influence and collaborate. Excellent communication (oral and written), interpersonal, and organizational skills. Applicants must be passionate about delivering a high-quality solution to our customer base. ZOzeTOp8gV If you require alternative methods of application or screening, you must approach the employer directly to request this as Indeed is not responsible for the employer's application process.",https://www.indeed.com/jobs?q=QA+Engineer&l=San+Francisco%2C+CA&sc=0kf%3Aattr%28EXSNN%7CFCGTU%7CHFDVW%7CQJZM9%7CUTPWG%252COR%29explvl%28MID_LEVEL%29jt%28fulltime%29%3B&vjk=d0baa0aa2d349d11
4,7b99d19a639332b1,QA Engineer,"San Francisco, CA",MID_LEVEL,MASTERS_DEGREE,FULLTIME,"QA Field Engineer - job post Plato Systems San Mateo, CA Full-time Apply now Apply now save-icon Job details Job Type Full-time We are a stealth startup building perception systems for autonomy. We are based in the Bay Area, funded by NEA (https://www.nea.com/), and our core team includes faculty entrepreneurs (Stanford and UC Santa Barbara) and industry veterans (Uber, Apple, Amazon Lab126, Rohde & Schwarz), who have successfully shepherded signal processing and machine learning innovations to large-scale software for location improvement and safety at Uber, led the development of state-of-the-art computer vision technologies that shipped over millions of Amazon devices, and delivered zero-to-one product experiences at Uber and Box (you can see here (https://docs.google.com/document/d/e/2PACX-1vTjp41EW3GXuZ3IR8GYDHRAjhbgXFTySKiCvwi0yAGqkmYxTlDdx5zCuC3vvuHE44Qg1E42HO7MIti2/pub) for more information about us). Our core product grew out of 5+ years of university R&D by our co-founders. Our mission and team expertise spans beyond software to advanced sensor systems, algorithms, embedded systems, signal processing, and machine learning. Our team is building and deploying edge software and cloud services for real-time customer facing products as well as internal big data tools. We look for people with a depth of expertise and experience in one of these areas, and with the intellectual curiosity for interacting with, learning from, and teaching world-class experts in areas outside their expertise. We currently have an exciting opportunity for a QA engineer. The candidate will join a multi-disciplinary team of scientists and engineers and support multiple teams across the company. Responsibilities: You will be conducting field tests for a product that produces real-time machine learning inference based on input from multiple sensors. These tests include both controlled captures that will be used for internal algorithm development and verification, as well as customer trials. You will also play an integral part across every part of the data pipeline from data collection, to manual and automatic annotation methods, to evaluation, verification, debugging, and root-causing of potential issues. It is expected that you can track and clearly communicate work you are doing related to product readiness, identify any gaps, and consistently assess new and innovative ways to improve the quality and performance of our products. Some examples of your day to day tasks and requirements: Engineering Support Collaborate with the engineering team to perform gap analysis and root cause of failures on existing and new products. Assist in software and hardware quality testing Identify, analyze, and communicate design or performance faults in a systematic and timely fashion. Analyze system performance and compile reports to engineering team Operations Support Devise and improve processes, including software and procedures, around deployment of product for field tests Own and run the data pipeline across collection to annotation and post-processing pipelines On-site debug of software and hardware issues Support and run field tests, customer installations and demos Develop and perform signal and performance quality checks to ensure successful deployment Own and run the data annotation and post-processing pipelines Basic Qualifications: General BS in engineering with 1+ years of experience Prior experience and good understanding of working with Linux-based OS Prior experience in debugging software/hardware issues Coding competency in python Proven track record of being self-motivated to operate independently, take initiative, and continuously learn Excellent writing and communication skills Willingness to travel (up to 25%), mainly in North America post-Covid Preferred Skills: General Prior experience as a field, QA, technical project management (TPM), or test engineer on systems involving sensors and algorithms Prior experience in interacting with customers (internal and external) and addressing their concerns and requirements in a timely manner Familiarity with operation of python numerical and data science libraries (e.g. numpy, scipy, opencv, pandas) No past experience in computer vision or machine learning is required; we are mainly looking for a talented, self-motivated, self-starter individual who can be hands-on and grow in this field. Nevertheless, some familiarity with these concepts would be a plus If you require alternative methods of application or screening, you must approach the employer directly to request this as Indeed is not responsible for the employer's application process.",https://www.indeed.com/jobs?q=QA+Engineer&l=San+Francisco%2C+CA&sc=0kf%3Aattr%28EXSNN%7CFCGTU%7CHFDVW%7CQJZM9%7CUTPWG%252COR%29explvl%28MID_LEVEL%29jt%28fulltime%29%3B&vjk=7b99d19a639332b1
