,job_id,job_title,location,experience,education,job_type,job_description,job_link
2,2c66d051a736a18d,QA Engineer,"San Francisco, CA",MID_LEVEL,MASTERS_DEGREE,FULLTIME,"Staff NPD Quality Engineer - job post Noah Medical San Carlos, CA • Hybrid remote $117,800 - $176,800 a year -  Full-time Apply now Apply now save-icon Job details Salary $117,800 - $176,800 a year Job Type Full-time The Company Noah Medical is building the future of medical robotics. Our next generation robotic platform targets early diagnosis and treatment of patients across multiple disease states. Based in Silicon Valley and backed by well-known institutional investors, our incredibly talented team of 150+ engineers, innovators and industry leaders brings years of experience from the top healthcare companies in the world, including: Intuitive, Auris, Stryker, Johnson & Johnson, Boston Scientific, Verb Surgical, Mako, Think Surgical, Medrobotics & Hansen. This position provides hands-on guidance and leadership from a Quality and Regulatory perspective to the team throughout all stages of product development. We are looking for someone that is highly motivated in their career growth; you must be a self-starter, team builder, and excellent communicator. Responsibilities: Provide hands-on guidance and leadership throughout the New Product Development cycle in all Quality Engineering disciplines. Participate in product development teams and represent Quality and Regulatory function. Provide input to the product development planning process according to QMS implementation/requirements/trace matrix. Contribute to regulatory submissions. Define, implement, and provide training on all aspects of Noah Medical’s Quality Management System to meet US FDA and International requirements. Provide hands-on leadership and guidance to Design Control requirements, DHF, Risk Management, Design Verification/Validation, inspection and test methods/specifications, and Process Validation activities. Initial supplier selection and qualification activities. Other QMS and Design Control activities not specified here and as assigned Requirements: BS in Engineering or Technology, Mechanical, Industrial, Electrical, Life Sciences, etc. Minimum 6 years of Engineering work experience in the medical device field and a minimum of 2 year of experience in a development QE function or equivalent with focus on capital equipment. Experience in meeting Design Control and DHF requirements with NPD teams. Well versed in the complete Quality Management System to meet US FDA, ISO13485, ISO14971, IEC60601, and IEC62304 requirements. Experience with Risk Management, FMEA, Hazard Analysis, GD&T requirements. Consistent with applicable laws, an employee's pay within this range is based on a number of factors which include but are not limited to relevant education, skills, job-related knowledge, qualifications, work experience, credentials, and/or geographic location. Noah Medical reserves the right to modify this range as needed. Please note that the aforementioned range is only one component of the position's total compensation package. In addition, this position may be eligible for bonuses, stock and employee benefits including but not limited to PTO, paid holidays, health insurance, dental & vision insurance, life & disability insurance and a 401k plan. Additional details on the compensation package and employee benefits offerings will be provided to candidates during the interview process. Noah Medical is proud to be an Equal Opportunity Employer. We celebrate diversity and are committed to ensuring an inclusive environment for our employees. Applicants are considered for all positions without regard to race, color, religion, sex or gender, gender identity or expression, sexual orientation, national origin, ancestry, age, genetic information, physical or mental disability, marital or protected military or veteran status, or any other consideration made unlawful by federal, state or local laws. To all recruitment agencies: Noah Medical does not accept unsolicited 3rd party agency resumes. Please do not forward resumes to any Noah Medical employees. Noah Medical is not responsible for any fees related to unsolicited resumes and we will not pay fees to any third-party agency or company that does not have a signed agreement with Noah Medical. If you require alternative methods of application or screening, you must approach the employer directly to request this as Indeed is not responsible for the employer's application process.",https://www.indeed.com/jobs?q=QA+Engineer&l=San+Francisco%2C+CA&sc=0kf%3Aattr%28EXSNN%7CFCGTU%7CHFDVW%7CQJZM9%7CUTPWG%252COR%29explvl%28MID_LEVEL%29jt%28fulltime%29%3B&start=20&pp=gQAeAAAAAAAAAAAAAAAB_lY64wALAQAPlE9-SaF6_A4AAA&vjk=2c66d051a736a18d
3,c87845ff51d342fa,QA Engineer,"San Francisco, CA",MID_LEVEL,MASTERS_DEGREE,FULLTIME,"Supplier Quality Engineer - job post Cuberg San Leandro, CA $127,000 - $157,000 a year -  Full-time Apply now Apply now save-icon Job details Salary $127,000 - $157,000 a year Job Type Full-time The Supplier Quality Engineer will ensure the quality of Cuberg raw materials and continued quality performance of suppliers, drive improvement plans, and manage supplier quality issues. Ideal candidates are detail-oriented, proactive problem-solvers with a strong technical and business background. The SQE must be comfortable in a fast-paced, highly collaborative, and dynamic startup environment, with the ability to work well with internal and external stakeholders, as well as independently. Join us in building the future of energy. About Cuberg is commercializing next-generation battery technology to power the future of electric mobility. The company was acquired in 2021 by Northvolt, a global supplier of sustainable, high-quality battery cells and systems. As Northvolt's Advanced Technology Center operating in Silicon Valley, Cuberg is developing and commercializing lithium metal batteries, building an innovation ecosystem around lithium-ion technology, and leveraging Northvolt's state-of-the-art manufacturing capabilities to rapidly scale up production of advanced batteries. Responsibilities Develop and implement standard procedures related to supplier quality management Set up quality monitoring procedures and supplier KPI dashboards, evaluate supplier performance and make improvement proposals relating to raw materials and components Maintain a supplier database and scorecards, including performance evaluations Coordinate quality reviews, improvement and follow-up of raw material and component quality and conformity Develop procedures for and execute supplier quality audits Act as the link between relevant Cuberg organizations (manufacturing, production, quality) and suppliers in case of non-conformities, quality and delivery issues. Manage the non-conformance process, develop and validate corrective actions with suppliers; investigate supplier quality and delivery issues to identify opportunities for improvement. Communicate with suppliers regularly to address any concerns and foster an environment that facilitates continual improvement in working relationships Contribute to implementation of electronic quality data sharing with suppliers together with the Data Team Own the Cuberg Supplier Quality Manual (SQM) and supplier quality toolbox. Manage and communicate the SQM to suppliers and internally. In collaboration with Manufacturing, develop the Quality Control, inspection and testing plan of raw materials and components, review results and initiate/support improvement projects Develop and manage Supplier Quality Agreements together with Purchasing. Develop procedures for qualifying new raw materials and components together with R&D and Purchasing The San Fransisco / Bay Area base salary range for this full-time position is $127,000 - $157,000 + bonus + equity + benefits. Requirements BSc or MSc degree in Manufacturing/Engineering/Physics/Chemistry or equivalent in relevant experience. 5+ years of relevant work experience within high volume production Experience of supplier quality management in relevant industry, e.g. Li-ion raw materials, Automotive, Semiconductor, Pharmaceutical, Food industries Experience in developing processes, standards, documentation to support efficient Supplier Quality Management, and specific knowledge of quality management systems, e.g. IATF16949, ISO 9001, TQM Experience from auditing suppliers, non-conformity management and 8D Project management skills and a successful track record of leading quality improvements in manufacturing and with suppliers Good knowledge of Lean and six sigma, SPC, FMEA, process capability, Quality troubleshooting tools and problem-solving methodology Ability to travel domestically and internationally Benefits We offer competitive compensation and benefits packages to help you and your family build a healthy and secure future. Generous stock options Group health benefits that provide strong support for employee well-being and preventative care, including comprehensive medical, dental, vision, and flexible savings account plans A retirement program that helps build future financial security through both traditional and Roth 401(k) options with employer matching Generous paid time off plans to renew and refresh through vacation, personal leave, holidays, and parental leave If you require alternative methods of application or screening, you must approach the employer directly to request this as Indeed is not responsible for the employer's application process.",https://www.indeed.com/jobs?q=QA+Engineer&l=San+Francisco%2C+CA&sc=0kf%3Aattr%28EXSNN%7CFCGTU%7CHFDVW%7CQJZM9%7CUTPWG%252COR%29explvl%28MID_LEVEL%29jt%28fulltime%29%3B&start=20&pp=gQAeAAAAAAAAAAAAAAAB_lY64wALAQAPlE9-SaF6_A4AAA&vjk=c87845ff51d342fa
4,6ec13cf87515b601,QA Engineer,"San Francisco, CA",MID_LEVEL,MASTERS_DEGREE,FULLTIME,"Strategic Sourcing Manager (Engineering & Professional Services) - job post Zoox (part of Amazon.com) 9 reviews Foster City, CA $111,000 - $176,000 a year -  Full-time You must create an Indeed account before continuing to the company website to apply Apply on company site save-icon Job details Salary $111,000 - $176,000 a year Job Type Full-time This role will be responsible for Zoox’s strategic sourcing and engineering professional services partnerships within the Indirect Procurement space. This includes working cross-functionally to understand needs for third-party engagement across the business, finding and evaluating potential partners and suppliers, drafting and issuing RFQs, leading or assisting in the negotiation of all key terms and conditions as well as pricing, managing commercial and supply chain issues, identifying and executing on cost reduction opportunities, and overall management of third party relationships across various categories of spend. RESPONSIBILITIES Support various departments in the procurement of engineering and professional services (software/firmware or vehicle development) Support and inform internal stakeholders with respect to supplier selection and management Identify sourcing alternatives to drive efficiencies via benchmarking, competitive quotes, and engineering changes Negotiate the cost and other terms and conditions of such purchases by collaborating with the stakeholders and legal team Ensure smooth procure to pay process by working with the stakeholders and finance team QUALIFICATIONS 6+ years of experience in procurement, program management, finance, consulting, or business development in a technology-related industry Bachelor’s degree required Strategic sourcing, financial and business opportunity analysis, comfort with legal frameworks and contract negotiation skills Excellent communication skills with the ability to influence cross-functional stakeholders Superior analytical skills Strong technical writing skills Demonstrated ability to work in a team environment to achieve business objectives Open-minded self-starter with the ability to adapt, improvise, and problem-solve Ability to work independently on multiple tasks and projects with various stakeholders Organizational skills to manage and track transactional details BONUS QUALIFICATIONS MBA or equivalent professional degree Experience procuring Professional Services related to software or vehicle development teams is highly desirable Experience in management of engineering teams and developing project requirements SAP ERP implementation (Ariba preferred) experience is highly desirable Software services and/or Firmware procurement experience Experience working in a fast-paced and evolving environment Experience in contract drafting, redlining, and working cross-functionally with legal Process improvement skills Experience with business intelligence platforms and Procure to Pay (“P2P”) analytics Support ERP implementation, policies, and procedures for a growing organization There are three major components to compensation for this position: salary, Amazon Restricted Stock Units (RSUs), and Zoox Stock Appreciation Rights. The salary range for this position is $111,000 to $176,000. A sign-on bonus may be offered as part of the compensation package. Compensation will vary based on geographic location and level. Leveling, as well as positioning within a level, is determined by a range of factors, including, but not limited to, a candidate's relevant years of experience, domain knowledge, and interview performance. The salary range listed in this posting is representative of the range of levels Zoox is considering for this position. Zoox also offers a comprehensive package of benefits including paid time off (e.g. sick leave, vacation, bereavement), unpaid time off, Zoox Stock Appreciation Rights, Amazon RSUs, health insurance, long-term care insurance, long-term and short-term disability insurance, and life insurance. Vaccine Mandate Employees working in this position will be required to have received a single dose of the J&J/Janssen COVID-19 vaccine OR have completed the two-dose Pfizer or Moderna vaccine series. In addition, employees will be required to receive a COVID-19 booster vaccine within two months of becoming eligible for the booster vaccine. Employees will be required to show proof of vaccination status upon receipt of a conditional offer of employment. That offer of employment will be conditioned upon, among other things, an Applicant’s ability to show proof of vaccination status. Please note the Company provides reasonable accommodations in accordance with applicable state, federal, and local laws. About Zoox Zoox is developing the first ground-up, fully autonomous vehicle fleet and the supporting ecosystem required to bring this technology to market. Sitting at the intersection of robotics, machine learning, and design, Zoox aims to provide the next generation of mobility-as-a-service in urban environments. We’re looking for top talent that shares our passion and wants to be part of a fast-moving and highly execution-oriented team. Follow us on LinkedIn A Final Note: You do not need to match every listed expectation to apply for this position. Here at Zoox, we know that diverse perspectives foster the innovation we need to be successful, and we are committed to building a team that encompasses a variety of backgrounds, experiences, and skills.",https://www.indeed.com/jobs?q=QA+Engineer&l=San+Francisco%2C+CA&sc=0kf%3Aattr%28EXSNN%7CFCGTU%7CHFDVW%7CQJZM9%7CUTPWG%252COR%29explvl%28MID_LEVEL%29jt%28fulltime%29%3B&start=20&pp=gQAeAAAAAAAAAAAAAAAB_lY64wALAQAPlE9-SaF6_A4AAA&vjk=6ec13cf87515b601
5,fb32875a8da927af,QA Engineer,"San Francisco, CA",MID_LEVEL,MASTERS_DEGREE,FULLTIME,"Automation System Engineer -- 2nd Shift - job post CelLink Corp San Carlos, CA 94070 $60 - $70 an hour -  Full-time Apply now Apply now save-icon Job details Salary $60 - $70 an hour Job Type Full-time **Type: **Salaried, full-time position Schedule: Swing shifts and on-call nights as needed Location: San Carlos, CA About Us: CelLink Corporation makes the world’s largest and most electrically- and thermally-conductive flexible circuits. We are a fast-growing team of skilled engineers and manufacturing experts who are fundamentally redefining the way printed circuits are made. CelLink performs research, development and manufacturing in San Carlos, CA. Automation & Controls Engineer Our company is looking for an enthusiastic, hands-on engineer to join our team and drive the development of CelLink’s revolutionary flex circuit manufacturing technology. The perfect applicant for this position will have a strong software programming base in C# or Python, preferably in an industrial environment. They should also possess experience engineering controls and programming complex equipment used in high volume manufacturing. Candidates should have direct experience in the design and continuous improvement of automation and controls including PLC and PC architectures and a thorough working knowledge of a wide range of electromechanical control components. Responsibilities: Lead the engineering of automation and controls on all equipment. Integrate a wide range of controls components such as: PLCs, motion controllers, machine vision systems, heater controllers, web edge guiding and steering mechanisms, pneumatic actuators, encoders, force sensors, thermocouples, analog devices, and various location, distance, and material presence sensors. Lead electrical control box engineering, standards compliance, assembly, modification, and documentation. Develop, deploy, and maintain revision control of electrical and software changes on large tool sets where the hardware and software must be copied exactly. Develop software to collect data for batch computation and data analytics. Develop and execute test plans to verify machine functionality and reliability. Provide timely and accurate project status, documentation, and training. Troubleshoot down equipment, including finding the root cause of failures and engineering solutions to correct them. Work closely with equipment vendors throughout phases of project development on controls and software requirements and related issues. Support factory expansion efforts, including vendor acceptance testing, equipment commissioning, and process qualification. Qualifications: Bachelor's or Master’s degree in Electrical Engineering, Software Engineering, or similar field. 5+ years of directly related experience. Skills & Requirements: Advanced control system engineering and programming of complex process tools and automation primarily using Beckhoff, Mitsubishi, and Omron PLC’s, Windows and Linux PC’s, C#, Python and SQL. Expert level troubleshooting of all facets of automated systems. Knowledge of manufacturing executions systems including direct experience integrating equipment data streams into factory information databases. Advanced knowledge of process control and implementation of real time data acquisition. Must be a self-starter with the ability to multi-task in a fast-paced environment. Ability to communicate effectively, both orally and in writing. Ability to influence others and collaboratively gain consensus using supportive data. Ability and willingness to work hands-on. Ability to travel 10%. CelLink is a venture-backed startup located in the San Francisco Bay area. The job title and compensation for this position will be commensurate with ability and experience. At CelLink, we believe that variety and inclusion among our teammates are essential to our success. We honor diversity and are committed to creating an inclusive environment for all employees while building teams that represent a variety of backgrounds, perspectives, and skills. We are an equal opportunity employer. All employment is decided on the basis of qualifications, merit, and business needs. You should be competent in: PLC Troubleshooting Skills Electrical Schematics Troubleshooting Industrial Automation Equipment PLC Programming Experience Machines & technologies you'll use: Servo Motors Programmable Logic Controller (PLC) (Allen Bradley, Mitsubishi, Siemens, Beckoff) Salary info: $60 - $70 / hr If you require alternative methods of application or screening, you must approach the employer directly to request this as Indeed is not responsible for the employer's application process.",https://www.indeed.com/jobs?q=QA+Engineer&l=San+Francisco%2C+CA&sc=0kf%3Aattr%28EXSNN%7CFCGTU%7CHFDVW%7CQJZM9%7CUTPWG%252COR%29explvl%28MID_LEVEL%29jt%28fulltime%29%3B&start=20&pp=gQAeAAAAAAAAAAAAAAAB_lY64wALAQAPlE9-SaF6_A4AAA&vjk=fb32875a8da927af
