,job_id,job_title,location,experience,education,job_type,job_description,job_link
3,d7cca4ce7568c206,QA Engineer,"Los Angeles, CA",SENIOR_LEVEL,BACHELORS_DEGREE,FULLTIME,"JTEO System Test Engineer - job post ENSCO, Inc. 50 reviews El Segundo, CA $102,990 - $140,000 a year -  Full-time You must create an Indeed account before continuing to the company website to apply Apply on company site save-icon Job details Salary $102,990 - $140,000 a year Job Type Full-time Job Description ENSCO is seeking an innovative, creative, and highly motivated individual to support the U.S. Space Force, Space Systems Command’s MILSATCOM Program through the MILSATCOM Systems Engineering, Integration and Test (MSEIT) contract. This position, located at in Colorado Spring, CO, will support a diverse set of strategic and tactical MILSATCOM systems and infrastructure in a multidisciplinary and collaborative environment. Duties will include: Collecting, reviewing, analyzing, and reporting on DoD Satellite Terminal T&E data; with a focus on Advance Extremely High Frequency (AEHF) terminals Reviewing test plans and procedures and identifying gaps Developing test plans, detailed test procedures, and test reports Analyzing test data to verify requirements Preparing/presenting briefings at senior management meetings Supporting Integrated Test Teams (ITT) and Test Plan Working Groups Developing terminal requirements traceability reports Qualifications Required (Skills) BS degree in engineering, physics, biology, chemistry, mathematics, computer science, network and telecommunications; information systems, information technology, or computer information systems 7+ years of related experience to include: 5+ years of work experience in Systems Engineering or Test Engineering 5+ years of experience in development and documentation of Systems/Test engineering documents, including requirements, test reports, requirements verification, and requirements traceability 5+ years SATCOM experience (operations, maintenance, development or terminal) Understanding of the discipline and practice of Systems Engineering throughout the system lifecycle phases of concept, development, production, use, support, and retirement Strong writing and oral presentation skills Ability to write final-version, CDRL deliverable technical documents and reports Proficient with Microsoft Office products (Word, Excel, and PowerPoint) Strong interpersonal, organizational, and team-building skills US Citizenship and an active Secret clearance is required to be considered for this position AN ACTIVE SECRET CLEARANCE IS REQUIRED TO BE CONSIDERED FOR THIS POSITON, FOR WHICH YOU MUST BE A US CITIZEN. Qualifications Desired MS degree in engineering, physics, biology, chemistry, mathematics, computer science, network and telecommunications; information systems, information technology, or computer information systems Professional certifications, such as INCOSE CSEP or ESEP 10 years experience with government test and evaluation, Space Systems Command; MILSATCOM, and Joint Interoperability Test Command Large “system of systems” problem solving experience DOORS experience Active Top Secret clearance LI-TL1 Req ID 3111BR Internal Position Title Staff Systems Engineer Employment Status Regular Full-time U.S. Citizenship Yes Background Check Type 7 year Drug Screen Type None Export Control and Licensing None Contract Award Contingency No Recruiter Tasha Lott Salary Range 102,989.95 - 140,000.00 Benefit Highlights Annual education tuition reimbursement 401(k) Plan with up to 6% dollar-for-dollar company match Medical, dental and vision insurance Spending Accounts – FSA, Dependent Care FSA, and HSA Leave available for holidays, bereavement, jury duty, military service, family medical leave, and as required by State law Paid Time Off 100% Company paid Employee Assistance Program and life, disability, accidental death and dismemberment, business travel accident, and professional liability insurance (employee only) Other voluntary programs, including supplemental life, auto and home insurance, and legal program Computer purchase discount Recognition and reward programs Patent awards Technical paper awards for presentations and publications Recruitment awards Length of service awards Community service recognition Division Description ENSCO has been delivering engineering, science, and advanced technology solutions to complex priority programs since 1969.ENSCO operates in the aerospace, avionics, national security, rail, and cyber sectors. ENSCO is a small business with 721 employees strong where our Mission Systems Group (MSG) makes up two-thirds of the company. MSG headquarters are located in Cocoa Beach, FL., with facilities and capabilities in Colorado Springs, CO., El Segundo, CA., Orcutt, CA., Endicott, NY, Melbourne, FL., and Springfield, VA. MSG delivers engineering and technologies for aerospace, cybersecurity, avionics, national security programs, and meteorological systems for government and commercial customers. ENSCO is a family-owned award-winning culture where our model is “we take care of our employees who take care of our customers.” This is a simple but effective strategy that has brought us impressive results over the last 53 years. ENSCO has received many awards such as the 2021 Top Workplace and 2021 Workplaces Technology Awards, which attest to the high standard our employees rate ENSCO during surveys. ENSCO also has a diverse portfolio of benefits such as a flexible work schedule, training, and professional development resources, remote work options, strong work/life balance, and tuition assistance. At ENSCO, you can build your career no matter the stage of your career- college student, new graduate, experienced professional, or transitioning military. Adding to our awards, ENSCO has been recognized for its outstanding culture with several awards including the U.S. Department of Labor Hire Vets 2021 Gold Award, Diversity Jobs Top Employer in 2022, and Top Workplaces 2022. ENSCO engineers bring innovative solutions to complex problems, keeping our nation and its citizens safe. ENSCO has earned the trust of the United States Armed Forces by focusing on areas of national priority, and we salute their sacrifices. We take pride in retaining those highly trained veterans of our highly skilled diversified team. The ENSCO Corporate Office is located in Springfield, VA. Strength in Diversity ENSCO, Inc. and its wholly owned U.S. subsidiaries are equal opportunity/affirmative action employers, committed to diversity in the workplace. All qualified applicants will receive consideration for employment without regard to race, color, religion, sex, gender identity, sexual orientation, national origin, disability, or protected veteran status, or any other protected characteristic under state or local law.",https://www.indeed.com/jobs?q=QA+Engineer&l=Los+Angeles%2C+CA&sc=0kf%3Aattr%28FCGTU%7CHFDVW%7CQJZM9%7CUTPWG%252COR%29explvl%28SENIOR_LEVEL%29jt%28fulltime%29%3B&start=10&pp=gQAPAAAAAAAAAAAAAAAB_k4WvAAQAQEBBwC4v-9mIyU4znNE8QAA&vjk=d7cca4ce7568c206
4,9b6c179a713e66a7,QA Engineer,"Los Angeles, CA",SENIOR_LEVEL,BACHELORS_DEGREE,FULLTIME,"Sr. Quality Engineer III - job post Mercury Systems 47 reviews Torrance, CA 90501 $95,000 - $164,000 a year -  Full-time You must create an Indeed account before continuing to the company website to apply Apply on company site save-icon Job details Salary $95,000 - $164,000 a year Job Type Full-time The Sr. Quality Engineer will act as the Quality Program Lead for multiple design, development, and production programs. The Quality Program Lead is responsible for assuring the program(s) meet plans, processes, specifications, and contractual requirements. Responsibility for the Sr. Quality Engineer are: Assists the Quality Engineering Manager and other team members oversee the Quality Management System. Assists with developing and improving standards and procedures. Creates Quality, test and inspection plans and reports Ensures on-going ISO/AS9100/AS9100/ISO 17025 compliance with the Quality Management System. Verifies the accuracy or performance of the product and creates a Failure Analysis Report. Analyzes failures, determine root cause and initiate corrective action on product and internal process failures. Troubleshoots inaccuracies or problems and share results and recommendations with team members. Ensures requirements are being met per functional specifications. Performs QA tasks to assure developed products meet requirements. Performs supplier qualification, visits, and audits. Utilizes Customer (Internal or External) feedback as an input to drive continual improvement. Verifies and validates information flowing to suppliers and validates that the suppliers are responding with requirements. Implements, administers, and maintains Quality Management System through design, development and production phases on Engineering/Production programs. Interfaces with Program Management, Engineering and Operations in program lifecycle. Defines, analyzes, manages, and improves program metrics. Reviews and performs first article inspection. Reviews program documentations (drawings, assemblies, procedures, reports, etc.) Perform other duties as necessary. To succeed in this role, you should have the following skills and experience 4 Year Degree, preferably in an Engineering discipline Practical knowledge and experience with AS9100 Quality Management Standard Certified AS9100 auditor a plus 7-10 years experience performing Quality Assurance duties in a mission critical environment Secret Clearance preferred Full-Time Equivalent Annual Salary Range: Full-Time Equivalent Annual Salary Range: $95,000 - $164,000 for a Non-Technical Principal / Manager at Torrance CA USA. The disclosed salary range is a general guideline for Mercury team members employed at the job level at the location listed above and does not include overtime for eligible hourly employees. The disclosed salary range is a general guideline for Mercury team members employed at the job level at the location listed above and does not include overtime for eligible hourly employees. Mercury considers a variety of factors to determine individual base salary offers to candidates, including: the role and related responsibilities prior work experience education, training, skills and certifications internal equity with others employed by Mercury in similar roles geographic location and alignment with market data. In addition to base salary, Mercury provides a variety of benefits for team members including: bonus opportunities (or special incentives for sales positions) health, life and disability insurance company-paid holidays and time off 401(k) retirement plan discounted employee stock purchase plan tuition reimbursement and access to professional development and personal wellness platforms including LinkedIn Learning, Headspace, Aaptiv and Virgin Pulse. Why should you join Mercury Systems? Mercury Systems is the leader in making trusted, secure mission-critical technologies profoundly more accessible to the aerospace and defense industries. Optimized for customer and mission success, our innovative solutions power more than 300 critical aerospace and defense programs. Headquartered in Andover, Mass., and with manufacturing and design facilities around the world, Mercury specializes in engineering, adapting and manufacturing new solutions purpose-built to meet the industry's current and emerging high-tech needs. Our employees are committed to Innovation that Matters®. Our Culture We are committed to making Mercury a great place to work, no matter where our employees are located. We offer a casual and enjoyable atmosphere that allows employees to learn and grow. We help and care for one another and work as one to achieve results for us and for our customers. We value communication and transparency, and strive to foster two-way dialogue at all levels of the organization. We are committed to lifelong learning, offering comprehensive skills training and tuition reimbursement. Whether you're just starting out on your career journey or you are an experienced professional, it's important to us that you feel recognized and rewarded for your contributions. To find out more about Why Mercury?, or visit the Mercury Community or find answers to general questions at Mercury FAQs Mercury Systems is an equal opportunity employer. All qualified applicants will receive consideration for employment without regard to race, color, religion, age, sex (including pregnancy), sexual orientation, gender identity, national origin, genetic information, creed, citizenship, disability, protected veteran or marital status. As an equal opportunity employer, Mercury Systems is committed to a diverse workforce. In order to ensure reasonable accommodation for individuals protected by Section 503 of the Rehabilitation Act of 1973, the Vietnam Veterans' Readjustment Act of 1974, and Title I of the Americans with Disabilities Act of 1990. If you would like to contact us regarding the accessibility of our website or need assistance completing the application process, please contact the number below. (978) 256-1300 Click here read about our recent press release and how Mercury Systems was named to Fortune Magazine's list of 100 Fastest-Growing Companies. Click Here to learn about OFCCP Equal Opportunity Employer Minorities/Women/Protected Veterans/Disabled",https://www.indeed.com/jobs?q=QA+Engineer&l=Los+Angeles%2C+CA&sc=0kf%3Aattr%28FCGTU%7CHFDVW%7CQJZM9%7CUTPWG%252COR%29explvl%28SENIOR_LEVEL%29jt%28fulltime%29%3B&start=10&pp=gQAPAAAAAAAAAAAAAAAB_k4WvAAQAQEBBwC4v-9mIyU4znNE8QAA&vjk=9b6c179a713e66a7
5,698a395a416c2a8c,QA Engineer,"Los Angeles, CA",SENIOR_LEVEL,BACHELORS_DEGREE,FULLTIME,"Sr Quality Engineer I - job post Kite Pharma 59 reviews Santa Monica, CA Full-time You must create an Indeed account before continuing to the company website to apply Apply on company site save-icon Job details Job Type Full-time Job Description Everyone at Kite is grounded by one common goal – curing cancer. Every single day, we seek to establish a direct line between that purpose and our day-to-day work. Would you like to join us in this mission? We are seeking a highly motivated individual to join us as a Sr Quality Engineer I in Santa Monica, CA. This role with be supporting our efforts in this exciting new area of cancer immunotherapy. Responsibilities: Provide equipment, system, software, and facility qualification guidance and strategy during project planning and development phases. Leading enterprise, cross-functional and local computer systems validation activities, in providing approach, methodology and deliverables. Partnering with project teams to provide solutions for validation of systems following a risk-based approach. Assist in developing validation documents with functional teams, ensuring the documentation meets compliance requirements and quality standards. Track and report status and progress of qualification activities or projects to direct manager Participate in – and manage risk assessments Manage the risk management process and ensure maintenance and approval of related documents Provide Quality oversight in change control activities to ensure technical and document impact assessments are performed in a compliant manner and the regulated systems are maintained in a validated state. Oversee and manage validation instrument inventory including calibrations and maintenance. Perform investigations and implement corrective actions related to CAPAs and deviations. Representing Quality Engineering in an emerging industry 15% - 25% Domestic/International travel Perform other duties as required Basic Qualifications: Master’s Degree and 4+ years of experience in pharmaceutical or FDA regulated environment OR Bachelor’s Degree and 6+ years of experience in pharmaceutical or FDA regulated environment OR High School Degree and 10+ years of experience in pharmaceutical or FDA regulated environment Preferred Qualifications: BS degree in Engineering, Computer Science, Mathematics or relevant scientific field 7+ years' experience in FDA regulated environment with strong understanding of cGxP standards and Risk based qualification and validation. Knowledge of FDA guidance's and industry standards (i.e., Quality Systems, ICH, EudraLex). Adequate clinical knowledge and cross-functional understanding of clinical trial methodology Working knowledge of cGMP manufacturing and regulatory regulations and requirements for biotechnology, pharmaceuticals and medical devices. Proven track record to create, review, and execute qualification protocols and associated validation lifecycle documentation, including identification and resolution of non-conformances/deviations. Documentation, including identification and resolution of non-conformances/deviations. Demonstrate the ability to translate system requirement specifications into executable validation protocols. Ability to think critically and utilize troubleshooting and problem-solving skills. Ability to function efficiently and independently in a fast paced, changing environment. Self-motivated and willing to accept temporary responsibilities outside of initial job description. Well-developed computer skills and fluent with Microsoft office applications. Excellent interpersonal, verbal and written communication skills are essential in this collaborative work environment. Comfortable in a fast-paced company and ambiguous environment Strong verbal and written communication skills #LI-ML1 #QCQA123",https://www.indeed.com/jobs?q=QA+Engineer&l=Los+Angeles%2C+CA&sc=0kf%3Aattr%28FCGTU%7CHFDVW%7CQJZM9%7CUTPWG%252COR%29explvl%28SENIOR_LEVEL%29jt%28fulltime%29%3B&start=10&pp=gQAPAAAAAAAAAAAAAAAB_k4WvAAQAQEBBwC4v-9mIyU4znNE8QAA&vjk=698a395a416c2a8c
6,db8e4cab39d7230e,QA Engineer,"Los Angeles, CA",SENIOR_LEVEL,BACHELORS_DEGREE,FULLTIME,"Test Engineer - job post Systems Planning and Analysis, Inc. 45 reviews El Segundo, CA • Hybrid remote Full-time You must create an Indeed account before continuing to the company website to apply Apply on company site save-icon Job details Job Type Full-time Overview: Systems Planning and Analysis, Inc. (SPA) delivers high-impact, technical solutions to complex national security issues. With over 50 years of business expertise and consistent growth, we are known for continuously innovating for our government customers, in both the US and abroad. Our exceptionally talented team is highly collaborative in spirit and practice, producing Results that Matter . Come work with the best! SPA has a near-term need for a Test Engineer. Responsibilities: As a Test Engineer at SPA, you will be assigned to support the US Space Force’s Space Systems Command, Operational Command and Control Acquisition Delta, known as Kobayashi Maru (KM). Kobayashi Maru is responsible for continuously delivering impactful software for space operations. The program office’s mission includes the development and deployment of software for space defense, space domain awareness, and enabling data services. Your top priority as Test Engineer will be upholding and implementing Test and Evaluation (T&E) activities in accordance with Department of Defense (DoD) Instruction 5000.89 and Air Force (AF) Instruction 63-101/20/101. Your next challenge will be devising and executing a DoD, AF, and Space Force compliant Test Strategy for a software intensive program developing and delivering capabilities in a rapid Agile DevSecOps framework. The key duties associated with this position include but are not limited to the following: Use T&E best practices to objectively assess the progress of system design, compliance with contract/mission requirements, confirm combat capability, and determine continual system improvements once fielded; Assist in identifying, managing, and mitigating/resolving risks throughout the software development and delivery life cycle; Assess the strengths and weaknesses of the software enterprise and its individual components and provide recommendations to improve weaknesses or remove deficiencies; Assist in determining whether the system is operationally effective, suitable, survivable, and safe for its intended use; Assist in validation and verification that delivered software capability meets Key Performance Parameters, Key System Attributes, Capability Need Statements, and technical performance measures; Advise on the required infrastructure, resources, and systems necessary to execute a robust T&E strategy for a software-intensive program; Support and facilitate integrated developmental and operational test activities, including liaison and enablement of the various test agencies and stakeholders; Function as the primary catalyst ensuring all required T&E documentation (e.g., test plans, test results, test schedules, etc.) is complete, thorough, and submitted on time to meet program office deadlines; Effectively facilitate all T&E working groups, events, milestone reviews, demonstrations, and engagements to ensure integrated test requirements are met without obstruction to rapid software delivery. This is a hybrid position. You may primarily work remotely, but you will be expected to work on-site with the Government customer at an off-Base location in El Segundo, CA at least 2 days per week due to the fast pace, quick-turn nature of the job and the persistent need to access secure networks. You should be within comfortable driving distance to the El Segundo, CA area. Qualifications: Required Qualifications: U.S. Citizenship and possession of a current Secret clearance Minimum 8 years of Systems Engineering experience with the DoD Bachelor’s Degree in Computer Science or STEM from an accredited institution Your resume must demonstrate experience: Successfully executing T&E programs for software intensive weapon systems Familiarity with DoDI 5000.89 Successfully entering and exiting Developmental Test and Operational Test to earn Operational Acceptance Participating in an Integrated Test Team or similar test working groups Performing systems engineering for an Agile software development program Authoring relevant T&E documents (e.g., test plans, test procedures, test strategies, etc.) Foundational understanding of cloud technologies, automated software tests, unit test, regression test, and end-to-end testing Desired Qualifications: CompTIA Security+ certification or equivalent One or more of the following certifications is highly desired INCOSE CSEP or equivalent certification Scrum Certified or equivalent Agile certification At SPA, we strive to deliver a robust total compensation package that will attract and retain top talent. Elements of the compensation package include competitive base pay and variable compensation opportunities. SPA provides eligible employees with an opportunity to enroll in a variety of benefit programs, generally including health insurance, flexible spending accounts, health savings accounts, retirement savings plans, life and disability insurance programs, and a number of programs that provide for both paid and unpaid time away from work. The specific programs and options available to any given employee may vary depending on eligibility factors such as geographic location, date of hire, etc. Please note that the salary information shown below is a general guideline only. Salaries are commensurate with experience and qualifications, as well as market and business considerations. California Pay Transparency Range: 150k - 185k",https://www.indeed.com/jobs?q=QA+Engineer&l=Los+Angeles%2C+CA&sc=0kf%3Aattr%28FCGTU%7CHFDVW%7CQJZM9%7CUTPWG%252COR%29explvl%28SENIOR_LEVEL%29jt%28fulltime%29%3B&start=10&pp=gQAPAAAAAAAAAAAAAAAB_k4WvAAQAQEBBwC4v-9mIyU4znNE8QAA&vjk=db8e4cab39d7230e
