,job_id,job_title,location,experience,education,job_type,job_description,job_link
0,f19208266bc5a4b4,Software Engineer,"Austin, TX",MID_LEVEL,MASTERS_DEGREE,FULLTIME,"Software Engineer II, Backend API-Customer Experience-Austin, Dallas, San Antonio-Hybrid - job post H-E-B 9,837 reviews 2416 E 6th St, Austin, TX 78702 Full-time You must create an Indeed account before continuing to the company website to apply Apply on company site save-icon Job details Job Type Full-time Overview: H-E-B is one of the largest, independently owned food retailers in the nation operating over 420+ stores throughout Texas and Mexico, with annual sales generating over $34 billion. Described by industry experts as a daring innovator and smart competitor, H-E-B has led the way with creative new concepts, outstanding service and a commitment to diversity in our workforce, workplace and marketplace. H-E-B offers a wealth of career opportunities to our 145,000+ Partners (employees), competitive compensation and benefits program and comprehensive training that lead to successful careers. Responsibilities: H-E-B Digital builds the tech that feeds Texas. Come join us at H-E-B Digital and be a partner in building the next generation of digital innovations that enhance how Texans find inspiration from food, make food decisions, and ultimately get food into their homes. We’re using the best available technologies to deliver modern, engaging, reliable, and scalable experiences to meet the evolving needs of our growing audience. Our digital solutions are growing in popularity and adoption—like Curbside and Home Delivery—so you’ll get the opportunity to define the user experience for millions of customers and hundreds of thousands of Partners. If you’re someone who enjoys collaborating with engineers with diverse backgrounds and skills to solve new challenges, working in a dynamic environment, learning new skills, and applying it all to solve large and impactful business problems, we want you as part of our team. This is an exciting time to join H-E-B Digital, and we’re hiring across the stack: front-end web and mobile, full-stack, and backend engineering. For more information, visit digital.heb.com At H-E-B, we hire first for problem-solving and growth mindset. We do not expect you to have experience with all of these technologies; a few specific experiences and a desire to learn in this direction are most important. If you are in doubt, please apply anyway! What we are looking for Enthusiastic individuals looking for fun, camaraderie, challenges, and opportunities to mentor others while growing their career 2+ years of application development experience We work most often with Java and Node.js with Typescript. We’re still interested if you have equivalent experience in other general purpose programming languages. We work most often with relational databases like MySQL and event-streaming with Kafka. We’re still interested if you’ve used other persistence and adjacent technology like Redis, Postgres, DynamoDB, and ElasticSearch. Ownership mentality and can produce quality results with guidance Enjoy learning new technologies as they emerge Strong knowledge of computer science fundamentals: data structures and algorithms Experience with common software engineering tools such as Git, JIRA, Confluence, etc. Bachelor’s degree in computer science or comparable field, or equivalent self-study What you’ll do (Design & Development) Operate independently with assistance from more experienced developers as needed Participate in the full SDLC; including development, estimation, planning, and design applications Deliver moderately complex code solutions Contribute to overall system design, architecture, security, scalability, reliability, and performance of applications Build on experience working with Docker, Linux, AWS, Terraform, and APIs using REST and GraphQL. Support the build and deployment pipeline; may assist in diagnosing / solving production support issues Support technical design and delivery of complex features across multiple systems as H-E-B improves the user experience Help create documentation and training related to technology stacks and standards within assigned team Use / contribute to the refinement of Digital Engineering- related tools, standards, and training Engage / collaborate with external technical teams to ensure timely, high-quality solutions Engage with shared services teams and vendors when necessary Provide end-to-end support to applications Our Benefits Immediate eligibility for quarterly bonuses based on company performance A robust Benefits plan with coverage starting Day One 10% off H-E-B brand products in-store and online starting Day One Parental Leave for new parents, adoptions included Adoption Assistance Family Planning Assistance through Progyny’s fertility specialists Access to LGBTQ-focused healthcare concierge Access to H-E-B’s full service, affordable primary care practice H-E-B Wellness Primary Care Access to other savings (gyms, phone, hotels, and more) through an online discount program Flexible work opportunities including WFH and hybrid options About H-E-B H-E-B is one of the largest, independently owned food retailers in the nation operating over 400 stores throughout Texas and Mexico, with annual sales generating over $34 billion. Described by industry experts as a daring innovator and smart competitor, H-E-B has led the way with creative new concepts, outstanding service and a commitment to diversity in our workforce, workplace and marketplace. H-E-B offers a wealth of career opportunities to our 145,000+ Partners (employees), competitive compensation and benefits program and comprehensive training that lead to successful careers. DEVS3232",https://www.indeed.com/jobs?q=Software+Engineer&l=Austin%2C+TX&sc=0kf%3Aattr%28EXSNN%7CFCGTU%7CHFDVW%7CQJZM9%7CUTPWG%252COR%29explvl%28MID_LEVEL%29jt%28fulltime%29%3B&vjk=f19208266bc5a4b4
1,aacc9b1b4f51c76b,Software Engineer,"Austin, TX",MID_LEVEL,MASTERS_DEGREE,FULLTIME,"Junior Software Engineer - job post Fathom5 Austin, TX 78754 • Hybrid remote Full-time Apply now Apply now save-icon Job details Job Type Full-time Fathom5 is an industrial technology company building security-first Brilliant Machines to accelerate Industry 4.0. Our work requires us to think critically , act boldly , and move quickly . We are looking for an enthusiastic Junior Software Engineer to join our software design team. You will report directly to the Fathom5 Chief Engineer and assist with all functions of software coding and design. Your primary focus will be to learn the codebase, learn Fathom5’s DevOps practices, develop code as part of small teams, and work with customers and users on feedback. We are looking for a curious, creative individual with a technical foundation who is naturally fascinated by the challenges and detail work in enabling industrial automation and has the technical capacity to systematically express their problem-solving ideas in contributing to our mission to Secure the Digital Future. The Fathom5 Junior Software Engineer will: Assist the Chief Engineer with all aspects of software design and coding. Attend and contribute to company development meetings, daily stand-up, and demo days. Learn the codebase and improve their coding skills. Write and maintain code. Work on bug fixes. Respond to requests from the development team. Write reports. Conduct development and integration tests. and will also have a working knowledge of: Command line tools Pulling and making commits Docker containers Microservice design patterns – making APIs, clusters, and containers The Fathom5 Junior Software Engineer position requires: Proficiency in multiple programming languages – Demonstrated experience and proficiency in at least two programming languages (GOLANG, Rust, C, and C++ preferred). Clear and effective communication – Written and oral communication skills sufficient to explain technical material to other team members. Quick learning – The ability and desire to learn new technologies swiftly. Team-first mentality – The ability and desire to work in a team environment. Startup Stamina – Fathom5 is changing the world at the intersection of industrial systems and advanced software. Sometimes changing the world requires long hours, standing for full days at events, and medical clearance for carrying computer equipment as well as occasional travel in support of our customers. This is an entry level position and will have these credentials: B.S./B.A. from an accredited four-year university in Computer Science, Computer Engineering, or Electric Engineering with a CS focus Coding academy certifications also welcomed and accepted 0-2 years experience in a professional business environment At Fathom5, we believe that a diverse, equitable and inclusive workplace makes us a more relevant and resilient company. We welcome people from all backgrounds, ethnicities, cultures, and experiences. Fathom5 provides equal employment opportunities to all employees and applicants for employment and prohibits discrimination and harassment of any type without regard to race, color, religion, age, sex, national origin, disability status, genetics, protected veteran status, sexual orientation, gender identity or expression, or any other characteristic protected by federal, state, or local laws. We know that the impostor syndrome and confidence gap are real. Please do not hesitate to apply! Due to the sensitive nature of some of our projects, only US Citizens can be considered for employment at this time. No recruiters, please! If you require alternative methods of application or screening, you must approach the employer directly to request this as Indeed is not responsible for the employer's application process.",https://www.indeed.com/jobs?q=Software+Engineer&l=Austin%2C+TX&sc=0kf%3Aattr%28EXSNN%7CFCGTU%7CHFDVW%7CQJZM9%7CUTPWG%252COR%29explvl%28MID_LEVEL%29jt%28fulltime%29%3B&vjk=aacc9b1b4f51c76b
2,0c293ffda0107452,Software Engineer,"Austin, TX",MID_LEVEL,MASTERS_DEGREE,FULLTIME,"Staff Backend API Software Engineer-Customer Experience-Austin, Dallas, San Antonio, TX-HYBRID - job post H-E-B 9,837 reviews 2416 E 6th St, Austin, TX 78702 Full-time You must create an Indeed account before continuing to the company website to apply Apply on company site save-icon Job details Job Type Full-time Overview: H-E-B is one of the largest, independently owned food retailers in the nation operating over 420+ stores throughout Texas and Mexico, with annual sales generating over $34 billion. Described by industry experts as a daring innovator and smart competitor, H-E-B has led the way with creative new concepts, outstanding service and a commitment to diversity in our workforce, workplace and marketplace. H-E-B offers a wealth of career opportunities to our 145,000+ Partners (employees), competitive compensation and benefits program and comprehensive training that lead to successful careers. Responsibilities: H-E-B Digital builds the tech that feeds Texas. Come join us at H-E-B Digital and be a partner in building the next generation of digital innovations that enhance how Texans find inspiration from food, make food decisions, and ultimately get food into their homes. We’re using the best available technologies to deliver modern, engaging, reliable, and scalable experiences to meet the evolving needs of our growing audience. Our digital solutions are growing in popularity and adoption—like Curbside and Home Delivery—so you’ll get the opportunity to define the user experience for millions of customers and hundreds of thousands of Partners. If you’re someone who enjoys collaborating with engineers with diverse backgrounds and skills to solve new challenges, working in a dynamic environment, learning new skills, and applying it all to solve large and impactful business problems, we want you as part of our team. This is an exciting time to join H-E-B Digital, and we’re hiring across the stack: front-end web and mobile, full-stack, and backend engineering. For more information, visit digital.heb.com At H-E-B, we hire first for problem-solving and growth mindset. We do not expect you to have experience with all of these technologies; a few specific experiences and a desire to learn in this direction are most important. If you are in doubt, please apply anyway! What we are looking for 8+ years of application development experience We work with Docker, Linux, AWS and Terraform . We’re still interested if you are proficient with another cloud provider such as Google Cloud Platform or Microsoft Azure and other Infrastructure-as-code tools. We work most often with Java and Node.js with Typescript . We’re still interested if you are proficient in other general purpose programming languages. We work most often with relational databases like MySQL and event-streaming with Kafka . We’re still interested if you are proficient in other persistence and adjacent technology like Redis, Postgres, DynamoDB, and ElasticSearch. We’re using GraphQL and REST for our APIs, depending on the needs of the API. Ownership mentality and a consistent track record of successful, high-quality results Enjoy learning new technologies as they emerge An advanced understanding of development methodologies and processes Comprehensive knowledge of CS fundamentals: data structures, algorithms, and design patterns Advanced knowledge of system architecture and design patterns Experience with common software engineering tools such as Git, JIRA, Confluence, etc. High level of comfort in Agile development methodologies Experience implementing development, system, and process improvements for your team or organization Bachelor’s degree in computer science or comparable field, or equivalent self-study What you’ll do (Design & Development) Lead initiatives, technical design, and delivery of complex features across multiple systems to improve user experiences Coach and mentor junior engineers in engineering techniques, processes, and new technologies; enable others to succeed Contribute to overall system design, architecture, security, scalability, reliability, and performance of applications Support the build and deployment pipeline and when necessary, both diagnose and solve production support issues Identify, scope, and architect solutions for new features while applying sound technical judgment that considers technology alternatives, impact on affected / adjacent systems, and tradeoffs Work with Product, Design, and QA to deliver world-class digital experiences Get the opportunity to stay ahead of new technologies with an eye to evaluating and potentially incorporating them into your team’s architecture Apply understanding to help improve the cloud infrastructure that powers our high-performance, consumer-scale site and mobile apps Recommend changes to processes and tools at the team and organization level based on industry standards, patterns, and practices Diagnose / fix highly complex technical issues independently Identify and communicate cross-team dependencies Communicate individual and project-level development statuses, issues, risks, and concerns to technical leadership and management; research / advise technical leadership in vendor negotiations Create documentation and training related to technology stacks and standards within assigned team Provide end-to-end support to applications Our Benefits Immediate eligibility for quarterly bonuses based on company performance A robust Benefits plan with coverage starting Day One 10% off H-E-B brand products in-store and online starting Day One Parental Leave for new parents, adoptions included Adoption Assistance Family Planning Assistance through Progyny’s fertility specialists Access to LGBTQ-focused healthcare concierge Access to H-E-B’s full service, affordable primary care practice H-E-B Wellness Primary Care Access to other savings (gyms, phone, hotels, and more) through an online discount program Flexible work opportunities including WFH and hybrid options About H-E-B H-E-B is one of the largest, independently owned food retailers in the nation operating over 400 stores throughout Texas and Mexico, with annual sales generating over $34 billion. Described by industry experts as a daring innovator and smart competitor, H-E-B has led the way with creative new concepts, outstanding service and a commitment to diversity in our workforce, workplace and marketplace. H-E-B offers a wealth of career opportunities to our 145,000+ Partners (employees), competitive compensation and benefits program and comprehensive training that lead to successful careers. DEVS3232",https://www.indeed.com/jobs?q=Software+Engineer&l=Austin%2C+TX&sc=0kf%3Aattr%28EXSNN%7CFCGTU%7CHFDVW%7CQJZM9%7CUTPWG%252COR%29explvl%28MID_LEVEL%29jt%28fulltime%29%3B&vjk=0c293ffda0107452
3,3475787c3f658b29,Software Engineer,"Austin, TX",MID_LEVEL,MASTERS_DEGREE,FULLTIME,"Software Engineer II - job post Accruent 44 reviews Austin, TX • Remote $98,000 - $182,000 a year -  Full-time Apply now Apply now save-icon Job details Salary $98,000 - $182,000 a year Job Type Full-time Personal development and becoming the best you is all about growth and exploring new skills and opportunities – both in and out of the office. At Accruent, we call this Grow Without Limits, and we're proud to offer each of our employees the resources, coaching and support necessary to achieve Growth Without Limits in their personal and professional lives. Explore where the path takes you. Why you want to work for our Engineering team: The Engineering team is vital to the success of our current and emerging software developments! As part of this team, you will be able to deliver enhancements and customizations on new and existing products to make an impact for the business and our customers. As we continue to expand our product suite, we look for innovative team members to persevere in the constantly evolving environment of technology. Our goal is to optimize our products to make sure our customers are mission ready! The Software Engineer II is responsible for coding, testing, and implementing products for Accruent's real estate performance management software suite. Responsibilities include mentoring Software Associates, creating and reviewing technical requirements, and developing code in a variety of programming languages for a web-based enterprise application. Proven technical leadership and project ownership is required to be considered for this position. In this role, you would be working on the Central Auth application in .NET with a React UI. The ideal candidate will be highly motivated and have a passion for technology and creative problem solving. If you are dedicated, enjoy working in a team environment, have an ambitious spirit and enjoy creating innovative solutions to complex problems, Accruent may be a fit for you. This position reports directly to the Sr Engineering Manager and will be a remote, work from home opportunity. How you'll make a difference: Create code that meets design specifications, follows standards, and is easy to maintain. When required, makes suggestions for new designs. Perform and design testing protocols to ensure that the product is fully tested. Ensure that all enhancements, bug fixes, and new products are documented. Work with various teams in the organization to ensure appropriate project requirements are met. Be an authority in at least one of the key technical and functional areas of a product. Mentor junior level Software Associates on engineering and company standard processes, as well as provide mentorship on technology and product practices. Ability to teach other non-technical customers/other team members information about the code. Participate in a Development team that is responsible for developing quality software. Ability to carry out all policies and procedures as established by the team, department or company at large. What you bring to the table: Bachelor's Degree in Computer Science or related field, or equivalent experience. 4+ years of professional software development experience Experience in at least two of the following: React, Microsoft .NET, SQL Server Preferred skills/experience: .NET Framework 3.5+ and MS Visual Studio 2015 or newer. .NET Core Experience Microsoft SQL server databases Agile development methodologies Expertise in building scalable enterprise web-based applications Identity server experience preferred Please Note: This job does not require travel domestically or internationally, This is a full-time, exempt opportunity. Relocation will not be considered for this position. At this time, visa sponsorship is not available. The salary range for this position is $98,000-$182,000. This position is also eligible for a bonus as part of the compensation package. Base pay offered may vary depending on various factors, including, but not limited to: job-related knowledge; skills; experience; and other eligibility factors such as geographic location. The Total Rewards package includes competitive base pay and an opportunity to enroll in a variety of benefit programs, generally including health insurance, flexible spending accounts, health savings accounts, retirement savings plans, life and disability insurance programs, and several programs that provide for both paid and unpaid time away from work. ABOUT ACCRUENT At Accruent (a subsidiary or affiliate of Fortive Corporation), we strive to be on the cutting edge of the software world, providing purpose-built intelligent solutions that raise customer expectations, shift paradigms and transform the way businesses operate and achieve success. We aim to provide the same transformational growth for our 1,000+ employees which includes a vibrant office culture in major cities like Austin and Amsterdam – and 10,000 customers in more than 150 countries – we know you'll gain new experiences along the way. In our continued effort to help our teams Grow Without Limits, we provide all employees with the resources, coaching and support they need to reach new heights and experience true professional and personal development – and we do this because we believe it will help us grow as a global company in return. Every person can bring something incredible to the table, and we can always achieve more together. So, if you are courageous, adaptable, collaborative and interested in becoming the best you, we encourage you to join us for the ride – even if you don't believe you have the exact experience to fill a particular role. Explore the path. Join Accruent. ABOUT FORTIVE Fortive's essential technology makes the world stronger, safer, and smarter. We accelerate transformation across a broad range of applications including environmental, health and safety compliance, industrial condition monitoring, next-generation product design, and healthcare safety solutions. We are a global industrial technology innovator with a startup spirit. Our forward-looking companies lead the way in software-powered workflow solutions, data-driven intelligence, AI-powered automation, and other disruptive technologies. We're a force for progress, working alongside our customers and partners to solve challenges on a global scale, from workplace safety in the most demanding conditions to groundbreaking sustainability solutions. We are a diverse team 17,000 strong, united by a dynamic, inclusive culture and energized by limitless learning and growth. We use the proven Fortive Business System (FBS) to accelerate our positive impact. At Fortive, we believe in you. We believe in your potential—your ability to learn, grow, and make a difference. At Fortive, we believe in us. We believe in the power of people working together to solve problems no one could solve alone. At Fortive, we believe in growth. We're honest about what's working and what isn't, and we never stop improving and innovating. Fortive: For you, for us, for growth. Fortive Corporation and all Fortive Companies are proud to be equal opportunity employers. We value and encourage diversity and solicit applications from all qualified applicants without regard to race, color, national origin, religion, sex, age, marital status, disability, veteran status, sexual orientation, gender identity or expression, or other characteristics protected by law. Fortive and all Fortive Companies are also committed to providing reasonable accommodations for applicants with disabilities. Individuals who need a reasonable accommodation because of a disability for any part of the employment process should ask to speak with a Human Resources representative to request an accommodation. #LI-Remote If you require alternative methods of application or screening, you must approach the employer directly to request this as Indeed is not responsible for the employer's application process.",https://www.indeed.com/jobs?q=Software+Engineer&l=Austin%2C+TX&sc=0kf%3Aattr%28EXSNN%7CFCGTU%7CHFDVW%7CQJZM9%7CUTPWG%252COR%29explvl%28MID_LEVEL%29jt%28fulltime%29%3B&vjk=3475787c3f658b29
