,job_id,job_title,location,experience,education,job_type,job_description,job_link
2,14c1c0855e9a75f7,Software Engineer,"Austin, TX",MID_LEVEL,MASTERS_DEGREE,FULLTIME,"Full Stack Java Developer - job post Intiva Health 6 reviews Austin, TX 78744 Full-time Apply now Apply now save-icon Job details Job Type Full-time Duties: Responsible for health of Hashgraph solution which includes AWS nodes and an API that interacts with Salesforce. Provide full life cycle development with JAVA technology. Create both front-end components (including interfaces, proof of concepts, API, SDK and maintenance of existing technologies, etc.) using Javascript, PHP, HTML, and CSS as well as back-end components (including application code, databases, infrastructure and support for existing technologies, etc.) such as PHP, Java, Java IDE, Python, .NET, for company’s software products. Work with product development team to develop and maintain the Intiva Health platform using existing tools and technologies, focusing on the Hashgraph technology, and integrating this technology with the Intiva Health platform. Work with inhouse Salesforce Development team to ensure Hashgraph technology is seamlessly integrated to existing platform. Lead the continued development and performance of distributed ledger technology, designing and building core components to keep transactions decentralized from across different locations thus providing security and accurately stored information using cryptography. Coordinate with users to review software application requirements and provide or propose technical solutions. Research and design solutions for challenges in the Hashgraph platform. Provide input into technology roadmaps, aligning short-term and long-term goals with specific technology solutions for Intiva Health product. Create and maintain technical documentation. Contribute to internal knowledge of best practices in emerging technology. Minimum requirements: Bachelor’s degree in Computer Science or related. 2 years of experience as Full Stack Java Developer, Software Developer, Systems Engineer, or related. t2hNuxZeTl If you require alternative methods of application or screening, you must approach the employer directly to request this as Indeed is not responsible for the employer's application process.",https://www.indeed.com/jobs?q=Software+Engineer&l=Austin%2C+TX&sc=0kf%3Aattr%28EXSNN%7CFCGTU%7CHFDVW%7CQJZM9%7CUTPWG%252COR%29explvl%28MID_LEVEL%29jt%28fulltime%29%3B&radius=50&start=80&pp=gQB4AAAAAAAAAAAAAAAB_kJtzABQAQIBESQRCOvUpByAaKcfB5kl54t8dgJC8z4sQX_Yh3VYZ7K0ggb5jFPgXza5X9-KfNzz72o_-FCtsFpoYoGsID5BaHWoKImIGg4XeEsqSYQAAA&vjk=14c1c0855e9a75f7
3,c643060cb798fe96,Software Engineer,"Austin, TX",MID_LEVEL,MASTERS_DEGREE,FULLTIME,"Senior Machine Learning Engineer - job post Recruiting From Scratch Austin, TX 73301 • Remote $150,000 - $200,000 a year -  Full-time Apply now Apply now save-icon Job details Salary $150,000 - $200,000 a year Job Type Full-time About Our Client We are the global leader in e-commerce technology, helping companies seize the full potential of every transaction moment to grow revenue and acquire new customers at scale. Live Nation, Groupon, Staples, Lands’ End, Fanatics, UrbanStems, GoDaddy, Vistaprint and HelloFresh are among the more than 2,500 leading global businesses and advertisers that are using our solutions to drive more value through every transaction by offering highly relevant messages to their customers at the moment they are most likely to convert. With our December 2021 Series E raise of USD$325M, we're is expanding rapidly and globally – operating in 19 countries across North America, Europe and the Asia-Pacific region with the largest office in NYC and a major R&D hub in Sydney. With annual revenues of more than US$200M and vibrant company culture, we have been listed in ‘Great Places to Work’ in the US and Australia. Our award-winning culture is guided by our five core values: Smart with Humility, Own the Outcomes, Force for Good, Conquer New Frontiers, and Enjoy the Ride. These values help us attract, engage, and develop the right talent around the globe and ensure we have the right conditions to do our best work. Keen to join a fast-growing company and a vibrant culture? Our engineering team builds best-in-class e-commerce technology that provides personalized and relevant experiences for customers globally and empowers marketers with sophisticated, AI-driven tooling to better understand consumers. Our bespoke platform handles millions of transactions per day and considers billions of data points which give engineers the opportunity to build technology at scale, collaborate across teams and gain exposure to a wide range of technology. We are expanding rapidly in our major R&D centers in NYC and Sydney. We are passionate about using intelligent systems to improve the transaction moment for retailers everywhere. Come join us and build the future! The Role As a Senior Machine Learning Engineer, you are someone who has significant expertise in both machine learning and software engineering. You will be working with our engineering and product teams to design, build and productionize proprietary machine learning models to solve different business challenges including smart bidding, lookalike modelling, forecasting, and etc. Responsibilities Collaborate closely with product managers and other engineers to understand business priorities, frame machine learning problems, architect machine learning solutions. Build and productionize machine learning models including data preparation/processing pipelines, machine learning orchestrations, improvements of services performance and reliability and etc. Contribute and maintain the high quality of code base with tests that provide a high level of functional coverage as well as non-functional aspects with load testing, unit testing, integration testing, etc. Keep track of emerging tech and trends, research the state-of-art deep learning models, prototype new modelling ideas, and conduct offline and online experiments. Share your knowledge by giving brown bags, tech talks, and evangelizing appropriate tech and engineering best practices. Mentor other team members, facilitate within/across team workshops and lead the agile development. Requirements Bachelor’s degree in Computer Science, a similar technical field of study or equivalent practical experience. 3+ years of industry experience in building production-grade machine learning systems with all aspects of model training, tuning, deploying, serving and monitoring. 5+ years of industry experience in software engineering roles and development experience in Python, SQL, Go, and/or other programming languages. Strong understanding in software engineering, system design, data engineering and/or cloud architecture. Knowledge in at least one of following areas - Bayesian methods, Econometrics, Reinforcement learning, Gradient boosting machine, Natural language processing, Computer vision, etc. Be motivated, self-driven in a fast (we truly mean fast) paced environment with a proven track record demonstrating impact across several teams and/or organizations. Ability to communicate and collaborate effectively with business stakeholders and manage tasks in a timely manner. Our client encourages autonomy; teams have complete ownership of their systems including building, running and monitoring. As such, you may be required to be on-call and respond to systems alerts should they arise. Ideas, opinions, and the ability to share them through respectful proposals, presentations, and team-wide discussions, An eagerness to work and learn in the open and share your learnings with your teammates. Experience in DevOps, MLOps and SRE is a massive plus. Experience of Kubernetes, Kubeflow, TFX and Feature Store in a production environment is a massive plus. Benefits Force for Good. We actively invest in the growth of our people and the strengthening of our communities. Our NYC office is 100% vaccinated to keep our employees and community safe and healthy. We require all stars as well as anyone else who will be onsite at our NYC office – clients, contractors, vendors, and suppliers – to show proof of vaccination and their booster shot. Work with the greatest talent in town. Our recruiting process is tough. We hold a high bar because we have a high-performing, high-velocity culture - we only want the brightest and the best. Join a community. We believe the best things happen when we come together to solve complex problems and make meaningful connections with each other through interest groups, sports clubs, and social events. Accelerate your career. Develop through our global training events, ‘Level Up’ investment, online training courses, and our fantastic people leaders. Take your career to race car speed - Grow your career in our rapidly growing company. Take a break. When you work hard, we know you also need to rest. We offer generous time off and parental leave policies, as well as mental health and wellness days for all employees. We also offer a paid Sabbatical for employees who have been with us for 3 years or more. Stay happy and healthy. Enjoy catered lunch 3 times a week and healthy snacks in the office. Plus join the gym on us! In the US, access generous retirement plans like a 4% dollar-for-dollar 401K matching plan and get fully funded premium health insurance for your whole family. And our NYC office is dog-friendly! Become a shareholder. All employees have stock options. If we succeed, everyone enjoys the upside. See the world! Along with our global all-staff events in amazing locations (Phuket, Thailand in January 2020, Hawaii in May 2022), we also offer generous relocation packages for those interested in moving to another office. We have cool offices in great cities - New York, Sydney, London, Singapore, Tokyo. Get the best of both worlds with a hybrid workplace. We currently work 3 days a week in office, allowing you to enjoy the best of both worlds (please note: this is subject to change based on the needs of the business and some support roles still require a full time presence). One week per quarter, you also have the flexibility to work from anywhere. We believe in equality. We are an Equal Opportunity Employer and recognizes that a diverse workforce is crucial to our success as a business. We would love you to apply for one of our open roles - irrespective of socio-economic status or background, age, gender identity, race, religion, sexual orientation, color, pregnancy, carer/family responsibilities, national and social origin, political opinion, marital, veteran, or disability status. Salary range: $200,000 - $300,000 / year Location: Hybrid 3 days, of your choice, a week in office at the intersection of SoHo and TriBeCa within walking distance of the bike path and outdoor fields on the Hudson River. You’ll be tempted to skip the catered lunches to try out all of the delicious local eateries in the area. Who is Recruiting from Scratch: Recruiting from Scratch is a premier talent firm that focuses on placing the best product managers, software, and hardware talent at innovative companies. Our team is 100% remote and we work with teams across the United States to help them hire. We work with companies funded by the best investors including Sequoia Capital, Lightspeed Ventures, Tiger Global Management, A16Z, Accel, DFJ, and more. If you require alternative methods of application or screening, you must approach the employer directly to request this as Indeed is not responsible for the employer's application process.",https://www.indeed.com/jobs?q=Software+Engineer&l=Austin%2C+TX&sc=0kf%3Aattr%28EXSNN%7CFCGTU%7CHFDVW%7CQJZM9%7CUTPWG%252COR%29explvl%28MID_LEVEL%29jt%28fulltime%29%3B&radius=50&start=80&pp=gQB4AAAAAAAAAAAAAAAB_kJtzABQAQIBESQRCOvUpByAaKcfB5kl54t8dgJC8z4sQX_Yh3VYZ7K0ggb5jFPgXza5X9-KfNzz72o_-FCtsFpoYoGsID5BaHWoKImIGg4XeEsqSYQAAA&vjk=c643060cb798fe96
4,e7d27944175d2e15,Software Engineer,"Austin, TX",MID_LEVEL,MASTERS_DEGREE,FULLTIME,"Scrum Master - job post Aptive 19 reviews Austin, TX 78754 Full-time You must create an Indeed account before continuing to the company website to apply Apply on company site save-icon Job details Job Type Full-time Job Summary: Aptive is seeking a Scrum Master to support digital transformation within the Department of Veterans Affairs (VA) Financial Services Center. Within the FSC, the Financial Technology Service (FTS) is responsible for all Information Technology including requirements analysis and sizing, backlog management, scrum team governance, incremental/sprint planning, business value, dependency management, risk and impact analysis, scheduling, budget vs actual labor reporting, configuration management, testing, infrastructure operations, application modernization, cyber security, process improvement, and Agile Release Train orchestration. FTS’s IT products address a broad array of VA’s enterprise requirements including timekeeping and payroll; accounting; financial reporting and auditing; healthcare claims processing; accounts payable and payment processing; employee travel and charge card; employee relocation; financial data analytics; and financial integration. This role can be performed in Austin, TX or fully remote. Primary Responsibilities: Lead and facilitate scrum meetings and eliminate blockers (PI Planning, Retrospectives, Daily Stand-ups, Demos, etc.). Lead and build relationships to encourage collaboration, transparency, and innovation. across a highly cross-functional Agile software development team supporting CI/CD. Promote Agile quality practices, coordinate across organizations, and serve as a resource to answer questions. Advise government personnel on improvements to the standardization of processes. Work directly with senior-level client leadership teams in client-delivery engagement Servant leader who helps the teams achieve their goal through constant coaching, mentoring, and smooth facilitation of processes Ensure that the team is focused and knows the tasks they have to accomplish in the time given Interact with different teams such as Product Management and Portfolio management teams, or other release trains to ensure alignment Facilitation of Team and Program Level events for effective program execution Minimum Qualifications: Bachelor's degree in Engineering, Computer Science, Systems, Business, or related scientific /technical discipline is required. SAFe Certified Scrum Master 5+ years of experience Experience in leading an Agile development team with automating application deployments, scaling, and management. Proven experience with large-scale software development, data management, and software integration projects. Experience facilitating briefings to senior leadership and the strong ability to capture actions resulting from meetings and requests. Experience with Scaled Agile Framework (SAFe®) and Kanban agile methods is highly desired. Ability to obtain a Government clearance. Desired Qualifications: Experience with the Department of Veteran Affairs, tools, processes, and frameworks is a plus. Experience with Project and Configuration Management tools (e.g., Jira, Rally Software, Github, etc.) is desirable. Experienced in technical disciplines and technical background. PMP preferred. About Aptive: Aptive is a modern federal consulting firm focused on human experience, digital services, and business transformation. We harness creativity, technology, and culture to connect people and systems to impact the world. We’re advisors, strategists, and engineers focused on people, above all else. We believe in generating success collaboratively, leaving client organizations stronger after every engagement and building trust for the next big challenge. Our work inspires people, fuels change and makes an impact. Join our team to be part of positive change in your community and our nation. EEO Statement: Aptive is an equal opportunity employer. We consider all qualified applicants for employment without regard to race, color, national origin, religion, creed, sex, sexual orientation, gender identity, marital status, parental status, veteran status, age, disability, or any other protected class. Veterans, members of the Reserve and National Guard, and transitioning active-duty service members are highly encouraged to apply. COVID 19 Vaccine Statement: This position supports a federal government contract and is subject to government vaccination mandates or other customer vaccination requirements. All new hires are required to report their vaccination status and proof of vaccination, or an adjudicated accommodation may be required for employment.",https://www.indeed.com/jobs?q=Software+Engineer&l=Austin%2C+TX&sc=0kf%3Aattr%28EXSNN%7CFCGTU%7CHFDVW%7CQJZM9%7CUTPWG%252COR%29explvl%28MID_LEVEL%29jt%28fulltime%29%3B&radius=50&start=80&pp=gQB4AAAAAAAAAAAAAAAB_kJtzABQAQIBESQRCOvUpByAaKcfB5kl54t8dgJC8z4sQX_Yh3VYZ7K0ggb5jFPgXza5X9-KfNzz72o_-FCtsFpoYoGsID5BaHWoKImIGg4XeEsqSYQAAA&vjk=e7d27944175d2e15
5,c7858d81eb46ead7,Software Engineer,"Austin, TX",MID_LEVEL,MASTERS_DEGREE,FULLTIME,"Software Engineering Architect R25468 - job post Applied Research Laboratories Austin, TX 78758 $120,000 - $150,000 a year -  Full-time Apply now Apply now save-icon Job details Salary $120,000 - $150,000 a year Job Type Full-time Please note: You must be a US Citizen and submit an application through the ARL website in ordered to be considered for this position. https://utaustin.wd1.myworkdayjobs.com/UTstaff/job/PICKLE-RESEARCH-CAMPUS/Software-Engineering-Architect_R_00025468. Earliest Start Date: Immediately Position Duration: Expected to Continue Salary Range:$120,000 - $150,000+/negotiable depending on qualifications Job Description: Play a significant role in advancing and improving internally developed systems vital to Applied Research Laboratories’ business operations. Design, develop and maintain enterprise applications across all ARL business areas. Research and develop new technologies to enhance our software development process. Mentor/train developers and set standards for development. Assist with unit’s strategic and resource planning. Job Details: Application Development: Design, develop and maintain key applications in accounting, purchasing, human resources, etc., used by our internal clients. Testing and Release Management: Perform and review testing on work developed by other team members. Administer the test environment. Project Management: Plan, develop and lead technical projects of priority for the team. Interface with internal clients to gather specifications, troubleshoot complex issues and ensure client satisfaction. Server Administration: Configure and maintain web servers used in our technology stack. Determine web application and database architecture. Mentoring and Strategic Planning: Provide feedback and guidance to development staff to improve programming code and troubleshoot issues. Participate in strategic planning for team improvements, both technological and procedural. Research, develop and present new technologies or industry trends that advance the team and our code base. Other related functions as assigned. Required Qualifications: Bachelor's degree. At least five years of demonstrated experience designing, developing, and implementing enterprise web applications with reporting functionality. At least two years of experience working with a relational database such as Oracle or MySQL. Experience working with clients and stakeholders to convert their business needs into technical requirements and solutions. Experience managing technical projects from inception through implementation and ongoing maintenance. Equivalent combination of relevant education and experience may be substituted as appropriate. Applicant must have a dynamic skill set, willing to work with new technologies, be highly organized and capable of planning and coordinating multiple tasks and managing their time. The position will require attention to detail, effective problem-solving skills and excellent judgment. Ability to work independently with sensitive and confidential information, maintain a professional demeanor, work as a team member without daily supervision and effectively communicate with diverse groups of clients. Able to work under pressure and accept supervision. Regular and punctual attendance. US Citizen . Applicant selected will be subject to a government security investigation and must meet eligibility requirements for access to classified information at the level appropriate to the project requirements of the position. Preferred Qualifications: Bachelor’s degree in computer science or related field. Additional experience in required areas. Experience with Oracle SQL. Recent experience using Oracle PL/SQL. Recent experience using Oracle APEX. Demonstrated ability to mentor other developers. Experience with Python 3, PHP, Bash shell scripting. Strong familiarity with Linux/UNIX software development environment. Experience with Git and GitLab. Familiarity with modern development tools, methodologies and automated testing, dependency management tools, testing frameworks, CI/CD, package/image deployment. Experience developing reports using TIBCO WebFOCUS Reporting Software. Experience developing with Flask Framework. General Notes: An agency designated by the federal government handles the investigation as to the requirement for eligibility for access to classified information. Factors considered during this investigation include but are not limited to allegiance to the United States, foreign influence, foreign preference, criminal conduct, security violations, drug involvement, the likelihood of continuation of such conduct, etc. Visit our website (www.arlut.utexas.edu) for additional information about Applied Research Laboratories. UT Austin offers a competitive benefits package that includes: · 100% employer-paid basic medical coverage · Retirement contributions · Paid vacation and sick time · Paid holidays Please visit our Human Resources (HR) website to learn more about the total benefits offered. Salary Range: $120,000 - $150,000+/negotiable depending on qualifications Working Conditions: Standard office conditions Repetitive use of a keyboard at a workstation Use of manual dexterity Some weekend, evening and holiday work Possible interstate/intrastate travel Required Materials: Resume/CV 3 work references with their contact information; at least one reference should be from a supervisor Letter of interest Employment Eligibility: Regular staff who have been employed in their current position for the last six continuous months are eligible for openings being recruited for through University-Wide or Open Recruiting, to include both promotional opportunities and lateral transfers. Staff who are promotion/transfer eligible may apply for positions without supervisor approval. Retirement Plan Eligibility: The retirement plan for this position is Teacher Retirement System of Texas (TRS), subject to the position being at least 20 hours per week and at least 135 days in length. Background Checks: A criminal history background check will be required for finalist(s) under consideration for this position. Equal Opportunity Employer: The University of Texas at Austin, as an equal opportunity/affirmative action employer, complies with all applicable federal and state laws regarding nondiscrimination and affirmative action. The University is committed to a policy of equal opportunity for all persons and does not discriminate on the basis of race, color, national origin, age, marital status, sex, sexual orientation, gender identity, gender expression, disability, religion, or veteran status in employment, educational programs and activities, and admissions.' ' Work Remotely No Job Type: Full-time Pay: $120,000.00 - $150,000.00 per year Benefits: Employee assistance program Employee discount Flexible spending account Health insurance Life insurance Paid time off Retirement plan Tuition reimbursement Schedule: 8 hour shift Monday to Friday Education: Bachelor's (Preferred) Experience: Oracle PL/SQL: 2 years (Preferred) TIBCO WebFOCUS Reporting: 1 year (Preferred) SQL: 2 years (Preferred) Flask Framework: 1 year (Preferred) Software development: 4 years (Preferred) Work Location: In person Health insurance If you require alternative methods of application or screening, you must approach the employer directly to request this as Indeed is not responsible for the employer's application process.",https://www.indeed.com/jobs?q=Software+Engineer&l=Austin%2C+TX&sc=0kf%3Aattr%28EXSNN%7CFCGTU%7CHFDVW%7CQJZM9%7CUTPWG%252COR%29explvl%28MID_LEVEL%29jt%28fulltime%29%3B&radius=50&start=80&pp=gQB4AAAAAAAAAAAAAAAB_kJtzABQAQIBESQRCOvUpByAaKcfB5kl54t8dgJC8z4sQX_Yh3VYZ7K0ggb5jFPgXza5X9-KfNzz72o_-FCtsFpoYoGsID5BaHWoKImIGg4XeEsqSYQAAA&vjk=c7858d81eb46ead7
