,job_id,job_title,location,experience,education,job_type,job_description,job_link
2,a656896809d2019f,Software Engineer,"San Diego, CA",MID_LEVEL,MASTERS_DEGREE,FULLTIME,"Software Engineer (with active Secret Clearance) - job post Deloitte 11,490 reviews San Diego, CA 92101 Full-time You must create an Indeed account before continuing to the company website to apply Apply on company site save-icon Job details Job Type Full-time Are you looking to make an immediate impact where you can help our clients solve their business challenges? Deloitte's Core Business Operations (CBO) portfolio operates at the center of our client's business. By joining our team, you could help C-suite and program leaders transform their organization and accelerate mission execution through emerging and disruptive technologies, innovative business models, retooled program operations and industry-driven solutions. This individual will join an active MIDS JTRS support team working with Government and industry in the development, implementation and test of MIDS JTRS Block Upgrades, Block Cycles, and Engineering Releases. This includes introduction of new functionality as well as correction of problem reports. MIDS JTRS is a multi-channel software defined radio that runs Link 16 and other tactical data link waveforms and communication protocols. MIDS JTRS is fielded in multiple and varying air, surface ship, and C2 platforms. Work you'll do Provide engineering support necessary to monitor, review and critique the Software specifications, designs, and implementations being developed for MIDS JTRS block upgrades, block cycles and/or engineering releases. Evaluate interfaces and operational and performance requirements of overall systems. Analyze, define, and document requirements for data, workflow, logical processes, interfaces with other systems, internal and external checks and controls, and outputs. Apply software engineering principles and expertise to review software specifications and interface documents that establish the Functional Baseline (FBL), Allocated Baseline (ABL) and Product Baseline (PBL). This includes review of ECPs/NORs, SDD/IDD and API documents. Provide software engineering expertise to review Software Test Plans (STPs) and Software Test Descriptions (STDs), ensuring that requirements are correctly and sufficiently tested Evaluate software qualification test results from both real-time laboratory environment and remote evaluation of recorded test data. Review and evaluate all documentation and products related to software releases, including Software Product Specification (SPS), Software Verification Description (SVD) and SW executables. The team Deloitte's Government and Public Services (GPS) practice - our people, ideas, technology and outcomes-is designed for impact. Serving federal, state, & local government clients as well as public higher education institutions, our team of over 15,000+ professionals brings fresh perspective to help clients anticipate disruption, reimagine the possible, and fulfill their mission promise. The Systems Engineering offering is comprised of experienced professionals who help guide clients through their most complex technology challenges. This can include the delivery of large scale software applications & integrated systems, the development of service-oriented architecture (SOA) and other integrations solutions, and the delivery of technology enablement to support CIO services transformation. Our Systems Engineering offering focuses on key client issues that impact the core business, provide operational value, drive down the cost of quality, and enhance technology innovation. Qualifications Required: An active s ecret clearance is required to be considered. Bachelor of Science degree from an accredited university in applied science, computing, engineering, mathematics, physics, management information systems, or another related engineering or computer science discipline. At least five (5) years of systems engineering experience supporting a NAVWAR program office. Strong knowledge of DoN software systems and applications. Must be legally authorized to work in the United States without the need for employer sponsorship, now or at any time in the future. Desired: Master of Science degree from an accredited university in applied science, computing, engineering, mathematics, physics, management information systems, or another related engineering or computer science discipline. At least ten (10) years of systems engineering experience supporting a NAVWAR program office. Advanced knowledge of DoN software systems and applications. For individuals assigned and/or hired to work in California, Colorado, Jersey City, Nevada, New York City, and Washington State, Deloitte is required by law to include a reasonable estimate of the compensation range for this role. This compensation range is specific to California and takes into account the wide range of factors that are considered in making compensation decisions including but not limited to skill sets; experience and training; licensure and certifications; and other business and organizational needs. At Deloitte, it is not typical for an individual to be hired at or near the top of the range for their role and compensation decisions are dependent on the facts and circumstances of each case. A reasonable estimate of the current range is $93,000 to $171,000. You may also be eligible to participate in a discretionary annual incentive program, subject to the rules governing the program, whereby an award, if any, depends on various factors, including, without limitation, individual and organizational performance.",https://www.indeed.com/jobs?q=Software+Engineer&l=San+Diego%2C+CA&sc=0kf%3Aattr%28EXSNN%7CFCGTU%7CHFDVW%7CQJZM9%7CUTPWG%252COR%29explvl%28MID_LEVEL%29jt%28fulltime%29%3B&start=50&pp=gQBLAAAAAAAAAAAAAAAB_lTimwA9AQIBEi4IU74vp_2OMc3ykEPEovWxOdqLFuNebJ_-QrSQwTd0iF_LJ9J29D9foTOrjxgq2hln0t-XG8xk4AAA&vjk=a656896809d2019f
3,1b71eef40969059d,Software Engineer,"San Diego, CA",MID_LEVEL,MASTERS_DEGREE,FULLTIME,"Software Engineer - Java / Front End - job post Illumina 268 reviews San Diego, CA Full-time You must create an Indeed account before continuing to the company website to apply Apply on company site save-icon Job details Job Type Full-time What if the work you did every day could impact the lives of people you know? Or all of humanity? At Illumina, we are expanding access to genomic technology to realize health equity for billions of people around the world. Our efforts enable life-changing discoveries that are transforming human health through the early detection and diagnosis of diseases and new treatment options for patients. Working at Illumina means being part of something bigger than yourself. Every person, in every role, has the opportunity to make a difference. Surrounded by extraordinary people, inspiring leaders, and world changing projects, you will do more and become more than you ever thought possible. Responsibilities : Design, implement and optimize the performance of large-scale distributed systems with security and compliance in mind. Build SaaS based commercial products to process and analyze terabytes of data Develop batch processing pipelines that enable the scaling of ETL processes for Illumina Next Generation Sequencing data Investigate, prototype, and deliver new and innovative system solutions Key Qualifications: Minimum of 4+ years of experience designing, implementing, and supporting highly scalable applications Excellent Java based application development and debugging skills. Experience with Java 8+, Spring Boot, Rest APIs and Microservices. Proficient in building highly scalable real time services based on REST as well as in Event-driven architecture and messaging frameworks (Pub/Sub, Kafka, and/or RabbitMQ) Experience in large scale data platform and data processing system such as Hadoop and Spark Experience with distributed storage and database systems (such as RDBMS, NoSQL databases, ElasticSearch) Experience with numerous aspects of DevOps, including source control, CI/CD, Kubernetes and containerized deployment. Excellent written and verbal communication and presentation skills, for both technical and non-technical audience. Demonstrated leadership and self-direction as well as a willingness to teach others and learn new technologies. Education Qualifications: Bachelor’s or master’s degree in Computer Science or equivalent The estimated base salary range for the Software Engineer - Java / Front End role based in the United States of America is: $79,300 - $118,900. Should the level or location of the role change during the hiring process, the applicable salary range may be updated accordingly. Compensation decisions are dependent on several factors including, but not limited to, an individual’s qualifications, location where the role is to be performed, internal equity, and alignment with market data. Additionally, all employees are eligible for one of our variable cash programs (bonus or commission) and eligible roles may receive equity as part of the compensation package. We offer a wide range of benefits as innovative as our work, including access to genomics sequencing, family planning, health/dental/vision, retirement benefits, and paid time off. At Illumina, we strive to foster a diverse and inclusive workplace by cultivating an environment in which everyone contributes to our mission. Built on a strong foundation, Illumina has always been rooted in openness, collaboration, and seeking alternative views and perspectives to propel innovation in genomics. We are proud to confirm a zero-net gap in pay, regardless of gender, ethnicity, or race. We also have several Employee Resource Groups (ERG) that deliver career development experiences, increase cultural awareness, and demonstrate our collective commitment to diversity and inclusion in the communities we live and work. We are proud to be an equal opportunity employer committed to providing employment opportunity regardless of sex, race, creed, color, gender, religion, marital status, domestic partner status, age, national origin or ancestry, physical or mental disability, medical condition, sexual orientation, pregnancy, military or veteran status, citizenship status, and genetic information. If you require accommodation to complete the application or interview process, please contact accommodations@illumina.com. To learn more, visit: https://www.dol.gov/ofccp/regs/compliance/posters/pdf/eeopost.pdf",https://www.indeed.com/jobs?q=Software+Engineer&l=San+Diego%2C+CA&sc=0kf%3Aattr%28EXSNN%7CFCGTU%7CHFDVW%7CQJZM9%7CUTPWG%252COR%29explvl%28MID_LEVEL%29jt%28fulltime%29%3B&start=50&pp=gQBLAAAAAAAAAAAAAAAB_lTimwA9AQIBEi4IU74vp_2OMc3ykEPEovWxOdqLFuNebJ_-QrSQwTd0iF_LJ9J29D9foTOrjxgq2hln0t-XG8xk4AAA&vjk=1b71eef40969059d
4,32777f926da0539f,Software Engineer,"San Diego, CA",MID_LEVEL,MASTERS_DEGREE,FULLTIME,"Engineer for Software Tactical Data Link Test and Evaluation - Secret clearance, San Diego, CA - job post General Dynamics Information Technology (part of General Dynamics) 5,584 reviews San Diego, CA $92,000 - $138,000 a year -  Full-time You must create an Indeed account before continuing to the company website to apply Apply on company site save-icon Job details Salary $92,000 - $138,000 a year Job Type Full-time Clearance Level Secret Category Software Engineering Location San Diego, California Onsite Workplace Requisition Type: Regular Your Impact Own your opportunity to work with the largest government agency in the nation. Make an impact by advancing the Department of Defense’s mission to keep our country safe and secure. Job Description GDIT is looking for a Software Test En gineer joining our team to support software T&E and analysis work for the Naval Information Warfare Center (NIWC) in San Diego, CA. This is an onsite position In this role, a typical day will include: Software Test and Evaluation (T&E) of Link-16 Advance Tactical Data Link (ATDL) which includes T&E planning and support of activities related to Qualification Tests of the Multifunctional Information Distribution System Joint Tactical Radio System (MIDS JTRS) terminal and Link-16 waveforms Identify and develop applicable tests, conduct tests, analyze test data, and document test results for inclusion in the formal block upgrade qualification Test Data Reports Preparing the test portions of the Qualification Test mission-based test plan and procedures Preparing automated software scripts and initialization loads for tests Identifying potential issues related to the concurrent operation through post-test analysis Supporting efforts relating to test execution and post-test analysis for waveform implementation Providing support for the retest MIDS terminals to verify that software updates to those terminals corrected problems identified in qualification tests Participating in the biweekly problem review boards (PRB) Dry run block upgrade software scripts and loads on-site REQUIRED QUALIFICATIONS: Active Secret clearance Engineering degree (will accept experience in lieu of) Digital Communications or wireless engineering technology background 4+ years of systems/software T&E experience, preferably with tactical communication systems Ability to work on-site NIWC Pacific in Point Loma San Diego. PREFERRED QUALIFICATIONS: BSEE or BSCS and a minimum of 4 years technical experience with DOD tactical systems Current technical experience (within the last 3 years) in Tactical Communications Systems to include TDL, ATDL, SDR, and/or related C4I systems at the systems level. Desired TDL, ATDL, and SDR Test and Evaluation (T&E) experience to include analyzing test requirements, T&E planning, developing traditional and Mission-Based test procedures, providing for traceability of requirements, test execution, post-test analysis and generating test reports. T&E experience should include testing for functionality and interoperability using relevant TDL/ATDL test tools. Prefer an electrical engineer or computer scientist with an emphasis in digital communications or a prior Electronics Tech (ET) or Aviation Electronics Tech (AT) with demonstrated technical experience in Link16 or similar data link. WHAT GDIT CAN OFFER YOU: Competitive and broad benefits package. Full-time, 40-hour work week, 9/80 schedule. Project offers autonomy, challenging work, and team environment.",https://www.indeed.com/jobs?q=Software+Engineer&l=San+Diego%2C+CA&sc=0kf%3Aattr%28EXSNN%7CFCGTU%7CHFDVW%7CQJZM9%7CUTPWG%252COR%29explvl%28MID_LEVEL%29jt%28fulltime%29%3B&start=50&pp=gQBLAAAAAAAAAAAAAAAB_lTimwA9AQIBEi4IU74vp_2OMc3ykEPEovWxOdqLFuNebJ_-QrSQwTd0iF_LJ9J29D9foTOrjxgq2hln0t-XG8xk4AAA&vjk=32777f926da0539f
5,aad5d8732d8c5855,Software Engineer,"San Diego, CA",MID_LEVEL,MASTERS_DEGREE,FULLTIME,"Embedded Engineer - job post UST 988 reviews San Diego, CA Full-time You must create an Indeed account before continuing to the company website to apply Apply on company site save-icon Job details Job Type Full-time Tester II – Software Testing Who we are: Born digital, UST transforms lives through the power of technology. We walk alongside our clients and partners, embedding innovation and agility into everything they do. We help them create transformative experiences and human-centered solutions for a better world. UST is a mission-driven group of over 29,000+ practical problem solvers and creative thinkers in over 30+ countries. Our entrepreneurial teams are empowered to innovate, act nimbly, and create a lasting and sustainable impact for our clients, their customers, and the communities in which we live. With us, you’ll create a boundless impact that transforms your career—and the lives of people across the world. Visit us at UST.com . You Are: We are looking for someone who has strong background on Firmware/Embedded/RTOS concepts, with an understanding of HW concepts and ability to drive DDR System Level failures. The Opportunity : Interact closely with cross-functional software teams to verify and debug software stability issues and features Engage with HW and VI team to identify potential HW bugs Participate in silicon-on dock bring-up activities in the lab Debug issues reported in DDR Define and develop test cases to catch DDR specific issues Perform day to day tasks related to DDR validation What you need : Skills and Experience: 0-2 years experience with Embedded Systems 0-2 years experience with C Programming Languages 0-2 years experience with Python 0-2 years experience with System Testing Minimum qualifications: Bachelor’s Degree in Computer Science or Computer Engineering Compensation can differ depending on factors including but not limited to the specific office location, role, skill set, education, and level of experience. As required by local law, UST provides a reasonable range of compensation for roles that may be hired in California, Colorado, New York City or Washington as set forth below. Role Location: Range of Starting Pay for Role California: $46,000 - $70,000 What we believe : We’re proud to embrace the same values that have shaped UST since the beginning. Since day one, we’ve been building enduring relationships and a culture of integrity. And today, it's those same values that are inspiring us to encourage innovation from everyone, to champion diversity and inclusion, and to place people at the center of everything we do. Humility: We will listen, learn, be empathetic and help selflessly in our interactions with everyone. Humanity: Through business, we will better the lives of those less fortunate than ourselves. Integrity: We honor our commitments and act with responsibility in all our relationships. Equal Employment Opportunity Statement UST is an Equal Opportunity Employer. All qualified applicants will receive consideration for employment without regard to race, color, religion, sex, sexual orientation, gender identity, national origin, disability, or status as a protected veteran. UST reserves the right to periodically redefine your roles and responsibilities based on the requirements of the organization and/or your performance.",https://www.indeed.com/jobs?q=Software+Engineer&l=San+Diego%2C+CA&sc=0kf%3Aattr%28EXSNN%7CFCGTU%7CHFDVW%7CQJZM9%7CUTPWG%252COR%29explvl%28MID_LEVEL%29jt%28fulltime%29%3B&start=50&pp=gQBLAAAAAAAAAAAAAAAB_lTimwA9AQIBEi4IU74vp_2OMc3ykEPEovWxOdqLFuNebJ_-QrSQwTd0iF_LJ9J29D9foTOrjxgq2hln0t-XG8xk4AAA&vjk=aad5d8732d8c5855
6,19a692c9d1ba0961,Software Engineer,"San Diego, CA",MID_LEVEL,MASTERS_DEGREE,FULLTIME,"Software Engineering Manager - Avionics - job post General Atomics and Affiliated Companies 720 reviews Poway, CA $125,810 - $229,670 a year -  Full-time You must create an Indeed account before continuing to the company website to apply Apply on company site save-icon Job details Salary $125,810 - $229,670 a year Job Type Full-time General Atomics Aeronautical Systems, Inc. (GA-ASI), an affiliate of General Atomics, is a world leader in proven, reliable remotely piloted aircraft and tactical reconnaissance radars, as well as advanced high-resolution surveillance systems. DUTIES AND RESPONSIBILITIES: This position typically reports to a technical manager and is responsible for the planning, managing and technical performance of one or more engineering unit(s). Manages all phases of assigned engineering project(s) from inception through completion. Participates with technical staff, program managers and/or Division/Group executive management to develop and implement current, annual and long-term technical, schedule, quality, business and financial objectives for the unit(s). May also contribute to the development of annual and long- term objectives for the Division/Group. Objectives are typically accomplished through subordinate engineering managers and/or team leaders. May be responsible for decisions that impact outcomes where erroneous decisions could cause serious schedule delays and expenditure of additional time, resources and funds. Manage all activities for engineering project(s) including planning and managing technical performance to ensure quality, business, and financial objectives are attained. Manage and implement current, annual and long-term technical, schedule, quality, business, and financial objectives for the engineering unit(s) and may also participate in the development of Group/Company objectives. Participate in and coordinate the establishment of design concepts, criteria, and engineering efforts for product research, development, testing, and integration. Interact with internal and external representatives at various levels concerning resolution of technical and scheduling issues. Act as primary contact for engineering activities. May participate in the preparation of proposals, business plans, proposal work statements and specifications, operating budgets and financial terms/conditions of contract(s). Ensure technical leadership and excellence is maintained by participating in the planning, attraction, selection, retention, and development of the required management, professional, and technical talent. Lead progress review sessions to discuss cost, schedule, and technical performance. Identify engineering issues and provide leadership in developing solutions such as re-allocation of resources or modifying contract specifications. May participate in the development of new business opportunities and expansion of existing business opportunities. Manage the development of and ensure the security of the unit’s proprietary technology, and maintain the strict confidentiality of sensitive information. Responsible for ensuring all laws, regulations and other applicable obligations are observed wherever and whenever business is conducted on behalf of the Company. Responsible for ensuring work is accomplished in a safe manner in accordance with established operating procedures and practices We recognize and appreciate the value and contributions of individuals with diverse backgrounds and experiences and welcome all qualified individuals to apply. 40727 Job Qualifications: Typically requires a Bachelors, Masters or PhD in engineering or a related technical field as well as eleven or more years of progressively complex software engineering experience with at least five of those years having management responsibilities. Equivalent experience may be substituted in lieu of education. Must demonstrate an in-depth understanding of Software Engineering principles, concepts, theory, regulations and practices; and comprehensive leadership skills including organizing, planning, scheduling and coordinating workloads to meet established deadline or milestones; and the ability to understand new concepts quickly and apply them accurately throughout an evolving environment. Must posses the ability to resolve complex management and technical problems Ability to obtain and maintain a DoD security clearance is required Must posses strong verbal and written communication skills to accurately document, report and present findings Must posses strong interpersonal skills to effectively interface with all levels of employees, management and outside representatives Must posses the ability to maintain the confidentiality of sensitive information Must posses good computer skills Customer focused, must be able to work on a self-initiated basis and in a team environment, and able to work extended hours and travel as required. Ability to work independently and lead in a team environment is essential Ability to work extended hours and travel as required Salary: $125,810 - $229,670 Travel Percentage Required 0 - 25 Relocation Assistance Provided Not Provided US Citizenship Required? Yes Clearance Required? Desired Clearance Level Secret Workstyle Hybrid",https://www.indeed.com/jobs?q=Software+Engineer&l=San+Diego%2C+CA&sc=0kf%3Aattr%28EXSNN%7CFCGTU%7CHFDVW%7CQJZM9%7CUTPWG%252COR%29explvl%28MID_LEVEL%29jt%28fulltime%29%3B&start=50&pp=gQBLAAAAAAAAAAAAAAAB_lTimwA9AQIBEi4IU74vp_2OMc3ykEPEovWxOdqLFuNebJ_-QrSQwTd0iF_LJ9J29D9foTOrjxgq2hln0t-XG8xk4AAA&vjk=19a692c9d1ba0961
