,job_id,job_title,location,experience,education,job_type,job_description,job_link
0,4bf05453c26202f0,Software Engineer,"San Diego, CA",MID_LEVEL,MASTERS_DEGREE,FULLTIME,"Software Developer - job post Forecast 3D 10 reviews Carlsbad, CA 92008 $120,000 - $170,000 a year -  Full-time Apply now Apply now save-icon Job details Salary $120,000 - $170,000 a year Job Type Full-time FORECAST 3D, a leading provider of full spectrum of 3D Printing, Rapid Machining, and quick-turn tooling solutions for producing the highest quality prototypes and batch production runs, is currently seeking a driven, self-motivated, energetic and detail oriented Software Developer in our Carlsbad, CA office. Our business is rapidly growing and we are looking for additional support in our IT department. SUMMARY: The Software Developer is a highly motivated and self-directed technologist who not only is a proficient software developer in a broad range of languages, tools, and technologies, but also expertly applies them to achieve company objectives. PRIMARY RESPONSIBILITIES The ideal candidate has a passion for creating world class business applications and the ability and willingness to code to the full stack and data model beneath. Develops and delivers software that adheres to key architectural drivers for our critical business applications. These applications are used by our Additive division through all aspects of our product development, from sales to final production. Works with team to improve front end development standards including architecture of web components, approach to styling, and user interface standards. Creates, documents, and maintains coding standards for our business applications. Codes all aspects of software including interfacing with our custom APIs, Microsoft Graph APIs, and front-end components. When necessary, meets directly with key stakeholders to provide guidance related to usability and best approaches based on effort and risk. Applies DevOps mindset to all work and looks for ways to efficiently build, deploy, and test software for frequent releases and iterations. Demonstrated proficiency in and knowledge of C/C++, data structures, algorithms, performance, and multi-threaded programming techniques Detailed knowledge of software design practices including modular architecture, event-driven architecture, software design patterns and object-oriented design Ability to quickly understand and work with internal and externally developed code Matrix reporting to Global IT REQUIRED EDUCATION Minimum Bachelor's Degree in a field related to the position or a combination of related education and work experience in the areas of application/web/systems/database development to equal four years. REQUIRED EXPERIENCE Minimum of 5 years of experience creating web-based user interfaces using HTML5, CSS3, and associated technologies. Minimum of 5 years of experience working with JavaScript, JavaScript, C#, C++ Minimum of 3 years of experience working with Microsoft Graph APIs including implementing RESTful APIs. Has proven understanding of coding for security and performance through all tiers of an application. Other nice to have skills include: Experience developing business applications, analytics, and system security. PHP experience is a Plus! Before applying, please note: This is not a remote position; candidates must be able to reliably commute to the Carlsbad location. Forecast 3D is a supplier which abides by the International Traffic in Arms Regulations (ITAR). In order to be considered for this position, applicants must be either a U.S. citizen, lawful permanent resident of the U.S., protected individual as defined by 8 U.S.C. 1324b(a)(3), or eligible to obtain the required authorizations from the U.S. Department of State Job Type: Full-time Pay: $120,000.00 - $170,000.00 per year Benefits: 401(k) 401(k) matching Dental insurance Health insurance Life insurance Paid time off Vision insurance Schedule: 8 hour shift Monday to Friday Ability to commute/relocate: Carlsbad, CA 92008: Reliably commute or planning to relocate before starting work (Required) Work Location: One location Health insurance If you require alternative methods of application or screening, you must approach the employer directly to request this as Indeed is not responsible for the employer's application process.",https://www.indeed.com/jobs?q=Software+Engineer&l=San+Diego%2C+CA&sc=0kf%3Aattr%28EXSNN%7CFCGTU%7CHFDVW%7CQJZM9%7CUTPWG%252COR%29explvl%28MID_LEVEL%29jt%28fulltime%29%3B&vjk=4bf05453c26202f0&advn=4322168851172276
1,eee9dffea61bc6c7,Software Engineer,"San Diego, CA",MID_LEVEL,MASTERS_DEGREE,FULLTIME,"Software Engineer - job post SeeScan Inc. 10 reviews San Diego, CA 92123 • Hybrid remote $100,000 - $150,000 a year -  Full-time You must create an Indeed account before continuing to the company website to apply Apply on company site save-icon Job details Salary $100,000 - $150,000 a year Job Type Full-time About this position SeeScan is seeking an experienced Software Engineer to join our team. Our Software Engineers boast a diverse range of skills, creating innovative technology across industries including subsea cameras and lighting, pipe inspection, and utility locating. Tell us where your interests lie, and we’ll tell you how you can help lead the creation of our best-in-class products. Our ideal candidate is naturally curious, motivated to learn new skills, and driven to perform to high standards of excellence. At SeeScan, you will collaborate with industry pioneers, enjoy ownership over your creative and intellectual output, and experience the satisfaction of participating in the product’s growth from initial conception to finished platform. This position offers a flexible schedule with the possibility of some remote work. Our company culture Working at SeeScan is unlike working for other companies of our size. As industry leaders with 40 years in business, we have the stability of a larger company while maintaining the feel of a small and welcoming community. Our casual, people-first culture goes hand-in-hand with our focus on the talent and potential of our employees, and our investment in employee success is reflected in the longevity of most of our team – more than half of us have been here for over five years, and nearly a third have been here for over ten. We’ll give you the tools you need to succeed, and we want to see you grow with us. What we’re looking for Across our organization, we’re looking for people who embody our values of continuous learning, passion, and fairness. Whether you’re designing the latest tech, building our products on the production floor, or keeping our business running and profitable, we want people who approach problems with a can-do attitude and who are eager to be part of a team. Our goal is to create the best products in our industries – as a privately-owned company, we place excellence first, and we seek employees who will help us continue our trend of sustainable growth and innovation. In this position, you will Be a cross-functional team member supporting multiple projects Participate in the full software development lifecycle Be involved in front-end, back-end, and full stack development Contribute to the design and architecture of efficient, reusable, and scalable products and applications Identify, analyze and isolate problems on both a system-wide and subsystem scale Contribute to projects including mobile app development, web applications, and embedded systems About you Dedicated and driven lifelong learner Effective and efficient at troubleshooting Able to adapt quickly to changing priorities and moving targets, while always working with a sense of urgency Abstract “outside the box” thinker Collaborative team player with strong communication skills Desired skills Our Software Engineering team is a large, diverse group whose projects range across web development, mobile apps, embedded systems, and more. We are looking for people with talents in any of the following languages and processes, as well as those who want to further their skillset: BareMetal C/C++ Linux Yocto GStreamer Swift iOS Android JavaScript React FreeRTOS Kotlin Vue HTML To help us understand where you can best contribute to our projects, let us know where your experience lies currently and what you're hoping to learn next! Your background 5+ years hands-on experience in software development BS in computer science, computer engineering, or similar with relevant experience Compensation The salary range for this position is $100,000 to $150,000 annually. This range represents a good faith estimate based on the qualifications we expect to find in a successful candidate. Actual compensation offered may be less or greater than this estimate based on a variety of factors, including, but not limited to, our assessment of your ability to bring value to our organization. We offer A position within an established company that has nearly 40 years of experience Medical, dental, and vision coverage Traditional and Roth 401(k) investment options, with partial company matching contribution Flexible Paid Time Off plan with no cap or “use it or lose it” requirement If this position is of interest, please submit your application, including your resume and a thoughtful cover letter explaining why you are the ideal candidate for this position, to https://careers.seescan.com/position/967. We are looking for a long-term, in-house teammate to join us, not a contractor or consultant. About SeeScan Modern life depends on the infrastructure that brings water, wastewater, electricity, gas, and communications services to our homes and businesses. SeeScan’s mission is to deliver best-of-class products that protect these vital services. Our DeepSea brand of harsh-environment oceanographic equipment is synonymous in this industry with robust and high value-add products, dating back nearly 40 years to our founder’s garage. We build cameras, lights, batteries, relief valves, and other products from the ground up, from initial product conception to prototyping, testing, and final assembly. At SeeScan, you’ll be part of a group of people who bring passion and energy into everything they do. We value the individual contributions all of our employees make and invest in the tools and training they need to find success and professional growth. We do our best to empower the right people to take on new opportunities, and our culture promotes transparency, integrity, and continuous learning. Notes No recruiters, contractors, or consultants, please No relocation assistance or visa sponsorships available for this position SeeScan is an Equal Opportunity Employer COVID-19 Vaccination Requirement SeeScan is committed to maintaining a safe work environment for all of its employees. Therefore, we will only be extending offers to candidates who are fully vaccinated against COVID-19 with an mRNA-type vaccine (Pfizer or Moderna) or vaccinated and boosted with a Johnson & Johnson vaccine. You are considered fully vaccinated, or boosted, two full weeks after receiving your final dose. We will make a good faith effort to make reasonable accommodations for those with valid medical or religious exemptions from receiving the vaccine. Job Type: Full-time Pay: $100,000.00 - $150,000.00 per year Benefits: 401(k) Dental insurance Flexible schedule Health insurance Paid time off Vision insurance Schedule: 8 hour shift Monday to Friday Work Location: Hybrid remote in San Diego, CA 92123 Health insurance",https://www.indeed.com/jobs?q=Software+Engineer&l=San+Diego%2C+CA&sc=0kf%3Aattr%28EXSNN%7CFCGTU%7CHFDVW%7CQJZM9%7CUTPWG%252COR%29explvl%28MID_LEVEL%29jt%28fulltime%29%3B&vjk=eee9dffea61bc6c7&advn=6178604170838957
2,5fa287c59f5f5477,Software Engineer,"San Diego, CA",MID_LEVEL,MASTERS_DEGREE,FULLTIME,"Software Engineer - job post Vertikal RMS San Diego, CA • Remote $80,000 - $127,020 a year -  Full-time Responded to 51-74% of applications in the past 30 days, typically within 18 days. Apply now Apply now save-icon Job details Salary $80,000 - $127,020 a year Job Type Full-time Job Description: Software Engineer Lead Location: we are flexible on working from home however you must be located in the Southern Calif area to attend periodic team meetings Job Description Vertikal is seeking a highly motivated, experienced Software Engineer. We are looking for a strong leader, communicator with a balance of technical knowledge and project leadership. As an ideal candidate, you’ve created and led teams developing scalable cloud services in a fast-paced, flexible agile environment. You know how to nurture talent, develop and promote best practices, foster open communication, and provide guidance and mentoring to effective and high-performing teams to deliver high-quality solutions to customers. This is an exciting opportunity to lead an engineering team building the future of Vertikal’s product strategy. Our Tech Stack - Current Application: Java, React framework, Node JS-back-end development, Form.io, MSSQL database. Legacy application: C#, ASP, HTML, MSSQL database. AWS cloud technologies, Yurbi BI Analytics. ESSENTIAL FUNCTIONS Technology Leadership - Provide full stack software development technical expertise for your team’s successes. Provide Subject matter expertise in code reviews, integration, testing and deployment events. Lead the technology direction, with the ability to be hands on as needed. Team Leadership - Lead and grow remote teams of engineers. Mentor and provide feedback to team members. Ensure alignment across all technical teams like devops, software developers, data engineers and QA Testers. Engineering Operations - Proactively identify gaps and improvements in existing applications and team operations. Collaborate with Product Owners and business stakeholders to develop requirements and a product vision. This position may also perform other administrative duties as needed. REQUIRED QUALIFICATIONS Bachelor’s or Master’s degree in Computer Science or other relevant technical engineering degree, equivalent relevant work experience will also be considered 5+ years of software development experience in MVC architectures with hands-on software engineering experience Must be proficient with our tech stack technologies: Java, React framework, Node JS-back-end development, Form.io, MSSQL database,C#, ASP, HTML, AWS cloud technologies Expertise in software design and architecture, including CI/CD, modern web UI development, caching systems and relational database systems, API development, and code quality best practices Proficient experience with Security best practices Experience with monolithic and micro services architectures Experience in providing feedback to your team about their design choices Ability to supervise, train and mentor team members Able to lead and support a remote team Excellent interpersonal, written and oral communication skills Self-starter who can come up to speed quickly and identify the problems that need to be solved Experience and well-versed in leading in an Agile development environment Must possess the ability to work with a sense of urgency and be available to communicate with teams across multiple time zones Candidates must be legally authorized to work in the United States of America Job Type: Full-time Pay: $80,000.00 - $127,020.00 per year Benefits: 401(k) Dental insurance Health insurance Paid time off Vision insurance Schedule: 8 hour shift Application Question(s): The position requires periodic (weekly, monthly) in-person meetings in the San Diego or Inland Empire area. Are you located within driving distance? Experience: React: 2 years (Required) Node.js: 2 years (Required) SQL: 2 years (Required) OOP: 2 years (Required) Work Location: Remote Health insurance If you require alternative methods of application or screening, you must approach the employer directly to request this as Indeed is not responsible for the employer's application process.",https://www.indeed.com/jobs?q=Software+Engineer&l=San+Diego%2C+CA&sc=0kf%3Aattr%28EXSNN%7CFCGTU%7CHFDVW%7CQJZM9%7CUTPWG%252COR%29explvl%28MID_LEVEL%29jt%28fulltime%29%3B&vjk=5fa287c59f5f5477
3,fc3700d7637c9b5d,Software Engineer,"San Diego, CA",MID_LEVEL,MASTERS_DEGREE,FULLTIME,"Junior Backend Developer - job post Bandsintown 4 reviews San Diego, CA 92101 $80,000 - $120,000 a year -  Full-time Apply now Apply now save-icon Job details Salary $80,000 - $120,000 a year Job Type Full-time Tonefuse, Bandsintown’s performance marketing solutions connecting hundreds of millions of customers to music, is looking for a developer to join our growing team in North America. If you are looking to strengthen your skills in Big Data and Advertising Technologies, then this opening may be a perfect fit for you! You will contribute to building and improving Tonefuse music Smartlinks infrastructure. Currently, Tonefuse is serving over 200 million unique visitors each month on the web’s most popular music related publisher sites. We are a fast growing, mobile centric contextual ad platform with marketing services focused on delivering subscribers to Music and Video Streaming Platforms. Responsibilities Be a technical leader within the team you work with. Coordinate technical projects across Tonefuse products. Facilitate collaboration with other engineers to solve interesting and challenging problems. Collaborate with key internal stakeholders to determine how to scalably design backend systems and APIs to meet their needs. Architect, develop, and operate services deployed to millions of users. Work with data engineers to build and maintain batch and real-time data pipelines with data processing frameworks like EMR, Spark, Kinesis Streams, and the AWS Cloud Platform. Collaborate with other engineers, product owners, and designers to identify and solve challenging problems, creating awesome music sessions for users worldwide. This position is only available to employees located in San Diego or able to work in person in our San Diego office at least twice per week. Required Experience BS/MS in Computer Science or equivalent. May consider self-taught individuals with previous development experience. Fluency in the major programming languages such as Javascript/Python/PHP. Experience with SQL and NoSQL. You have experience working directly with stakeholders to understand, document and develop APIs and systems to meet their requirements, driving increased adoption and reducing reliance on custom one-off implementations. You have experience writing distributed, high-volume services and know how to deploy and keep them running in production. You have an interest in big data processing technologies. You love working in an environment where you constantly experiment and iterate quickly. You believe data is the most powerful tool for informed decision-making. You have a deep understanding of system design, data structures, and algorithms. You care about quality and you know what it means to ship high quality code. Nice to Haves Exposure to big data tools: Hadoop, Spark, AWS Technologies. Working knowledge or previous experience in regards to API creation, design and data manipulation. Benefits Compensation commensurate with experience Paid time off, including standard company holidays Medical, Dental & Vision coverage, Life & Disability insurance 401k Saving Plan with generous company matching Casual office atmosphere and friendly coworkers Work with a recognizable product/brand that music fans and artists love If you require alternative methods of application or screening, you must approach the employer directly to request this as Indeed is not responsible for the employer's application process.",https://www.indeed.com/jobs?q=Software+Engineer&l=San+Diego%2C+CA&sc=0kf%3Aattr%28EXSNN%7CFCGTU%7CHFDVW%7CQJZM9%7CUTPWG%252COR%29explvl%28MID_LEVEL%29jt%28fulltime%29%3B&vjk=fc3700d7637c9b5d
