,job_id,job_title,location,experience,education,job_type,job_description,job_link
10,338cd25aea1459a7,Software Engineer,"San Diego, CA",MID_LEVEL,MASTERS_DEGREE,FULLTIME,"Software Engineer - job post DKW Communications Camp Pendleton, CA Full-time Responded to 75% or more applications in the past 30 days, typically within 5 days. Apply now Apply now save-icon Job details Job Type Full-time Come Join Our Team! DKW Communications, Inc. (DKW) is a government contractor providing professional and technical services to various government agencies i.e. defense, law enforcement and security. We are currently looking for a_ Software Engineer _to join our winning team. The individual hired for this position will provide support for our government customer located in Camp Pendleton, CA. This is an onsite position. Primary Duties and Responsibilities Performs the work necessary to design, develop, document, test, integrate, and modify operating systems and application software for aviation training systems Develops, creates, troubleshoots, and modifies specialized utility programs and applications in support of real-time systems Performs hardware and software development planning in the incorporation of hardware and software modifications into aviation training systems Develops software solutions by studying information needs; conferring with users; studying systems flow, data usage, and work processes; investigating problem areas; following the software development lifecycle Determines operational feasibility by evaluating analysis, problem definition, requirements, solution development, and proposed solutions Documents and demonstrates solutions by developing documentation, flowcharts, layouts, diagrams, charts, code comments and clear code Requirements US citizenship is required. Must have or be able to obtain a Secret security clearance. Bachelor’s degree in electronics or computer engineering, computer science, or equivalent. 3-5 years of practical experience in software development associated with modeling and simulation within the training systems domains is required Demonstrated experience with Microsoft Windows and various Unix flavors, such as Linux Familiar with software development and diagnostic tools CompTIA Security+ preferred; if not held, certification must be obtained within six months of date of hire (fully reimbursed by company) Desired Programming Languages: Assembly; C, C++; Microsoft .Net (C#, VB); Java Desired Operating Systems : Windows 7/10, Windows Server 2008R2, Windows Server 2012R2, Red Hat Enterprise Linux 5,6,7 **All qualified applicants will receive consideration for employment without regard to race, color, religion, sex, sexual orientation, gender identity, national origin, disability or veteran status.** Job Type: Full-time Benefits: 401(k) 401(k) matching Dental insurance Flexible spending account Health insurance Health savings account Life insurance Paid time off Referral program Relocation assistance Tuition reimbursement Vision insurance Schedule: Monday to Friday Supplemental pay types: Signing bonus Ability to commute/relocate: Camp Pendleton, CA: Reliably commute or planning to relocate before starting work (Required) Education: Bachelor's (Required) Security clearance: Secret (Preferred) Work Location: In person Health insurance If you require alternative methods of application or screening, you must approach the employer directly to request this as Indeed is not responsible for the employer's application process.",https://www.indeed.com/jobs?q=Software+Engineer&l=San+Diego%2C+CA&sc=0kf%3Aattr%28EXSNN%7CFCGTU%7CHFDVW%7CQJZM9%7CUTPWG%252COR%29explvl%28MID_LEVEL%29jt%28fulltime%29%3B&radius=50&start=20&pp=gQAeAAAAAAAAAAAAAAAB_lTimwApAQEBCnUd1KQ0KeC3ceNYfP7DkB9O-QZ2mCfhkVCAVLRiLcMNHUGHZ6oAAA&vjk=338cd25aea1459a7
11,826115ccce0fd445,Software Engineer,"San Diego, CA",MID_LEVEL,MASTERS_DEGREE,FULLTIME,"Software Engineer, Universal Media - job post Apple 11,770 reviews San Diego, CA Full-time You must create an Indeed account before continuing to the company website to apply Apply on company site save-icon Job details Job Type Full-time Summary Posted: Mar 16, 2023 Weekly Hours: 40 Role Number: 200469120 First, iTunes revolutionized how we listen to music and then our App Store ignited a cultural, social and economic phenomenon that changed how people work, play, meet, travel and so much more. Today Apple continues to push the boundaries of innovation and the team behind the App Store, Apple Music, iTunes, and many other high profile products on iPhone, Mac and AppleTV+ are called Apple Media Products. With your passion and dedication to running successful projects there's no telling what you could accomplish. Be ready to make something great when you come here. Dynamic, inspiring people and innovative, industry-defining technologies are the norm at Apple. The people who work here have reinvented and defined entire industries with our products and services. The same passion for innovation also applies to our business practices - strengthening our commitment to leave the world better than we found it. You should join the Apple Universal Media team if you want to help deliver the next amazing Apple product. We are growing and as an integral member of the Processing team, you will own key modules of the product and be responsible for delivering industry grade solutions. Key Qualifications 5+ years of server side Java application development 4+ years experience working with data science projects or collaborating with Data Science Hands-on experience with NLP, mining of structured, semi-structured and unstructured data Experience working with large data sets and pipelines, ideally using tools and libraries such as Spark Experience with Solr/Elastic Search, NoSQL/Cassandra and related technologies Ability to understand, design and explain complex systems Broad knowledge of computer science and systems; ability to quickly learn new domains and technologies Excellent problem-solving and analytic skills Passion for building great products Strong communication skills Passionate about quality EXTRA CREDIT Data modeling Hands on experience with large scale distributed systems Experience implementing and deploying micro services using docker/Kubernetes Description The Universal Media Engineering team is responsible for the data platform powering the Universal Search for TV App, Siri, and Spotlight across all Apple devices. We are building the next generation knowledge graph based on advanced algorithms, machine learning and natural language processing. You’ll be working in a fast-paced environment, constantly challenged to push the envelop. You’ll design and implement data services that directly impact millions of users. Candidate should be a self starting, upbeat individual with excellent communication skills to effectively collaborate with all levels of the organization. Education & Experience BS in Computer Science, Mathematics, or EE, or meaningful industry experience is required. MS in Computer or Data Science or related technical field is desired. Additional Requirements Pay & Benefits At Apple, base pay is one part of our total compensation package and is determined within a range. This provides the opportunity to progress as you grow and develop within a role. The base pay range for this role is between $115,000 and $217,500, and your base pay will depend on your skills, qualifications, experience, and location. Apple employees also have the opportunity to become an Apple shareholder through participation in Apple’s discretionary employee stock programs. Apple employees are eligible for discretionary restricted stock unit awards, and can purchase Apple stock at a discount if voluntarily participating in Apple’s Employee Stock Purchase Plan. You’ll also receive benefits including: Comprehensive medical and dental coverage, retirement benefits, a range of discounted products and free services, and for formal education related to advancing your career at Apple, reimbursement for certain educational expenses — including tuition. Additionally, this role might be eligible for discretionary bonuses or commission payments as well as relocation. Learn more about Apple Benefits. Note: Apple benefit, compensation and employee stock programs are subject to eligibility requirements and other terms of the applicable plan or program.",https://www.indeed.com/jobs?q=Software+Engineer&l=San+Diego%2C+CA&sc=0kf%3Aattr%28EXSNN%7CFCGTU%7CHFDVW%7CQJZM9%7CUTPWG%252COR%29explvl%28MID_LEVEL%29jt%28fulltime%29%3B&radius=50&start=20&pp=gQAeAAAAAAAAAAAAAAAB_lTimwApAQEBCnUd1KQ0KeC3ceNYfP7DkB9O-QZ2mCfhkVCAVLRiLcMNHUGHZ6oAAA&vjk=826115ccce0fd445
12,f25a9d000bcb0806,Software Engineer,"San Diego, CA",MID_LEVEL,MASTERS_DEGREE,FULLTIME,"Biotech Instrumentation Software / Applications Engineer (Engineering & Applied Physics) - job post Vertex Pharmaceuticals 273 reviews San Diego, CA 92121 $73,600 - $110,400 a year -  Full-time You must create an Indeed account before continuing to the company website to apply Apply on company site save-icon Job details Salary $73,600 - $110,400 a year Job Type Full-time Job Description Instrumentation Software/Applications Engineer The Engineering and Applied Physics team at Vertex, San Diego, is looking to add a top-notch Instrumentation Software/Applications Engineer to our small, elite team of engineers and physicists. From advanced robotics and automation to microfluidics and cutting-edge microscopy, this unique in-house team develops a wide array of performance focused technological solutions for the toughest challenges in drug discovery. Where commercial options don’t exist, the team collaborates directly with Vertex scientists to create innovative solutions that enable ground-breaking science and discovery of life-saving medicines. The Software/Applications Engineer plays a key role not only developing control software to run our instruments, but also ensures effective integration with our science to maximize the impact we have on drug discovery. Key Responsibilities: Develop custom control software for data acquisition, motion control, signal processing, vision and data analysis, automated workflow, and user interface/experience Collaborate with lab scientists and the engineering team to define new instrument specifications and process requirements Develop, deploy, and support custom instrumentation; from initial proof of concept to small scale production; in Vertex labs from San Diego to Boston and the UK Train Vertex scientists in the operation and care of that instrumentation Minimum Requirements: A passion for science and engineering, and a desire to tangibly apply that passion in the pursuit of transforming the lives of patients with serious diseases Bachelor of Science degree in Bioengineering, Mechanical, Electrical, Chemical, or other relevant Engineering discipline 2+ years' experience developing/working with instrumentation, automation, and robotics, preferably in a laboratory-based life science environment Experience in control software development, including system design, UI/UX, configuration, setup, complex troubleshooting, and service LabVIEW proficiency or a demonstrated ability and desire to learn Python, MATLAB and/or SQL programming is a bonus Aptitude for hands-on work with complex electro-mechanical systems Exceptional multitasking and communication skills, with a keen attention to detail Able to transition seamlessly and productively between independent work and collaboration in diverse, cross-discipline, cross-functional teams A compulsive problem solver; able to deliver innovative, effective solutions to challenging problems, in a high-paced, highly productive, and collaborative work environment Salary range: $73,600 - $110,400 annually Disclosure Statement: The range provided is based on what we believe is a reasonable estimate for the base salary pay range for this job at the time of posting. This role is eligible for an annual bonus and annual equity awards. Some roles may also be eligible for overtime pay, in accordance with federal and state requirements. Actual base salary pay will be based on a number of factors, including skills, competencies, experience, and other job-related factors permitted by law. At Vertex, our Total Rewards offerings also include inclusive market-leading benefits to meet our employees wherever they are in their career, financial, family and wellbeing journey while providing flexibility and resources to support their growth and aspirations. From medical, dental and vision benefits to generous paid time off (including a week-long company shutdown in the Summer and the Winter), educational assistance programs including student loan repayment, a generous commuting subsidy, matching charitable donations, 401(k) and so much more. Company Information Vertex is a global biotechnology company that invests in scientific innovation. Vertex is committed to equal employment opportunity and non-discrimination for all employees and qualified applicants without regard to a person's race, color, sex, gender identity or expression, age, religion, national origin, ancestry, ethnicity, disability, veteran status, genetic information, sexual orientation, marital status, or any characteristic protected under applicable law. Vertex is an E-Verify Employer in the United States. Vertex will make reasonable accommodations for qualified individuals with known disabilities, in accordance with applicable law. Please note that Vertex requires COVID-19 vaccination for all employees working in the U.S. as a condition of employment at Vertex, subject to medical, religious or other accommodations or exemptions required by law. We believe this requirement is vital to keeping everyone at Vertex and in our communities safe. This requirement applies to both existing and new employees who may at any time work on-site at a Vertex facility or visit another location on behalf of Vertex (e.g., conferences, customer visits, etc.), including all remote employees. Any applicant requiring an accommodation in connection with the hiring process and/or to perform the essential functions of the position for which the applicant has applied should make a request to the recruiter or hiring manager, or contact Talent Acquisition at ApplicationAssistance@vrtx.com.",https://www.indeed.com/jobs?q=Software+Engineer&l=San+Diego%2C+CA&sc=0kf%3Aattr%28EXSNN%7CFCGTU%7CHFDVW%7CQJZM9%7CUTPWG%252COR%29explvl%28MID_LEVEL%29jt%28fulltime%29%3B&radius=50&start=20&pp=gQAeAAAAAAAAAAAAAAAB_lTimwApAQEBCnUd1KQ0KeC3ceNYfP7DkB9O-QZ2mCfhkVCAVLRiLcMNHUGHZ6oAAA&vjk=f25a9d000bcb0806
13,529bc96ed1c98d6c,Software Engineer,"San Diego, CA",MID_LEVEL,MASTERS_DEGREE,FULLTIME,"Senior Node JS Developer (140k + Benefits) - job post Jarvis Recruitment Group California $100,000 - $140,000 a year -  Full-time Apply now Apply now save-icon Job details Salary $100,000 - $140,000 a year Job Type Full-time Jarvis Cole is working with an award-winning fashion retailer looking to bring on a Node.JS Engineer to help build out their customer checkout portal. You would help solve problems and APIs, work with the Backend Node.JS and Machine Learning team, and create secure and scalable APIs for the crud interface. Qualifications 5+ years of years backend development experience 3+ years of back-end frameworks (C#/Node.JS/Python) 2+ years in Docker / AWS Perks 401(k) matching 100% healthcare coverage (Dental, Health, Vision) Extensive on-the-job training Disability Insurance Generous PTO / Sick Time Fully Remote Pay $100k - $140k DOE Must Be Authorized To Work In US Job Type: Full-time Pay: $100,000.00 - $140,000.00 per year Benefits: 401(k) 401(k) matching Dental insurance Employee discount Flexible schedule Health insurance Life insurance Paid time off Vision insurance Schedule: 10 hour shift 8 hour shift Day shift Monday to Friday Night shift Overtime Supplemental pay types: Signing bonus Education: Bachelor's (Preferred) Experience: Node.js: 3 years (Required) Typescript: 3 years (Required) Work Location: Multiple Locations Health insurance If you require alternative methods of application or screening, you must approach the employer directly to request this as Indeed is not responsible for the employer's application process.",https://www.indeed.com/jobs?q=Software+Engineer&l=San+Diego%2C+CA&sc=0kf%3Aattr%28EXSNN%7CFCGTU%7CHFDVW%7CQJZM9%7CUTPWG%252COR%29explvl%28MID_LEVEL%29jt%28fulltime%29%3B&radius=50&start=20&pp=gQAeAAAAAAAAAAAAAAAB_lTimwApAQEBCnUd1KQ0KeC3ceNYfP7DkB9O-QZ2mCfhkVCAVLRiLcMNHUGHZ6oAAA&vjk=529bc96ed1c98d6c&advn=1622972731283716
14,659f4f30e29cc95f,Software Engineer,"San Diego, CA",MID_LEVEL,MASTERS_DEGREE,FULLTIME,"Health Software Development Engineer in Test - job post Apple 11,770 reviews San Diego, CA Full-time You must create an Indeed account before continuing to the company website to apply Apply on company site save-icon Job details Job Type Full-time Summary Posted: Mar 8, 2023 Weekly Hours: 40 Role Number: 200467135 The Health Software Quality team is looking for a driven and dedicated Software Engineer in Test. We are responsible for testing and ensuring the quality of iOS and WatchOS health related features, such as ECG, AFib History, and the Health app. As a member of our dynamic group, you will have the outstanding opportunity to be part of developing frameworks, tools and tests for all of Apple’s supported platforms. You’ll be working directly with some of the most hardworking software engineers responsible for the building some of Apple's most impactful products. Key Qualifications 4+ years of experience with test automaton development including creation and management of test frameworks from scratch. Experience writing code in Swift or Objective-C to test an API, SDK, or Framework. Experience developing various forms of software tests in any of the following: unit, functional, performance, or stress Passion for quality and desire to push forward Apple product quality through deeply technical UI and low-level automation. Creative thinker and strong problem solver with meticulous attention to detail to investigate and debug difficult issues. Excellent written and verbal communication skills are needed to facilitate close interaction with development teams, management, and other organizations within Apple Description You will work in a multi-functional team which is responsible for testing multiple health related projects on both iOS and WatchOS. We work closely with other Software Engineers, Project Managers, and various QA teams at Apple. Your role will help the Health Software Quality team scale in test development by creating testable code bases, supporting frameworks, developing tests and test applications, triaging results and debugging problems to insure the next generation of Apple’s Health features are delivered with the highest quality possible. Education & Experience BS or MS in CS/CE or equivalent experience Additional Requirements Pay & Benefits At Apple, base pay is one part of our total compensation package and is determined within a range. This provides the opportunity to progress as you grow and develop within a role. The base pay range for this role is between $115,000 and $217,500, and your base pay will depend on your skills, qualifications, experience, and location. Apple employees also have the opportunity to become an Apple shareholder through participation in Apple’s discretionary employee stock programs. Apple employees are eligible for discretionary restricted stock unit awards, and can purchase Apple stock at a discount if voluntarily participating in Apple’s Employee Stock Purchase Plan. You’ll also receive benefits including: Comprehensive medical and dental coverage, retirement benefits, a range of discounted products and free services, and for formal education related to advancing your career at Apple, reimbursement for certain educational expenses — including tuition. Additionally, this role might be eligible for discretionary bonuses or commission payments as well as relocation. Learn more about Apple Benefits. Note: Apple benefit, compensation and employee stock programs are subject to eligibility requirements and other terms of the applicable plan or program.",https://www.indeed.com/jobs?q=Software+Engineer&l=San+Diego%2C+CA&sc=0kf%3Aattr%28EXSNN%7CFCGTU%7CHFDVW%7CQJZM9%7CUTPWG%252COR%29explvl%28MID_LEVEL%29jt%28fulltime%29%3B&radius=50&start=20&pp=gQAeAAAAAAAAAAAAAAAB_lTimwApAQEBCnUd1KQ0KeC3ceNYfP7DkB9O-QZ2mCfhkVCAVLRiLcMNHUGHZ6oAAA&vjk=659f4f30e29cc95f
15,4bf05453c26202f0,Software Engineer,"San Diego, CA",MID_LEVEL,MASTERS_DEGREE,FULLTIME,"Software Developer - job post Forecast 3D 10 reviews Carlsbad, CA 92008 $120,000 - $170,000 a year -  Full-time Apply now Apply now save-icon Job details Salary $120,000 - $170,000 a year Job Type Full-time FORECAST 3D, a leading provider of full spectrum of 3D Printing, Rapid Machining, and quick-turn tooling solutions for producing the highest quality prototypes and batch production runs, is currently seeking a driven, self-motivated, energetic and detail oriented Software Developer in our Carlsbad, CA office. Our business is rapidly growing and we are looking for additional support in our IT department. SUMMARY: The Software Developer is a highly motivated and self-directed technologist who not only is a proficient software developer in a broad range of languages, tools, and technologies, but also expertly applies them to achieve company objectives. PRIMARY RESPONSIBILITIES The ideal candidate has a passion for creating world class business applications and the ability and willingness to code to the full stack and data model beneath. Develops and delivers software that adheres to key architectural drivers for our critical business applications. These applications are used by our Additive division through all aspects of our product development, from sales to final production. Works with team to improve front end development standards including architecture of web components, approach to styling, and user interface standards. Creates, documents, and maintains coding standards for our business applications. Codes all aspects of software including interfacing with our custom APIs, Microsoft Graph APIs, and front-end components. When necessary, meets directly with key stakeholders to provide guidance related to usability and best approaches based on effort and risk. Applies DevOps mindset to all work and looks for ways to efficiently build, deploy, and test software for frequent releases and iterations. Demonstrated proficiency in and knowledge of C/C++, data structures, algorithms, performance, and multi-threaded programming techniques Detailed knowledge of software design practices including modular architecture, event-driven architecture, software design patterns and object-oriented design Ability to quickly understand and work with internal and externally developed code Matrix reporting to Global IT REQUIRED EDUCATION Minimum Bachelor's Degree in a field related to the position or a combination of related education and work experience in the areas of application/web/systems/database development to equal four years. REQUIRED EXPERIENCE Minimum of 5 years of experience creating web-based user interfaces using HTML5, CSS3, and associated technologies. Minimum of 5 years of experience working with JavaScript, JavaScript, C#, C++ Minimum of 3 years of experience working with Microsoft Graph APIs including implementing RESTful APIs. Has proven understanding of coding for security and performance through all tiers of an application. Other nice to have skills include: Experience developing business applications, analytics, and system security. PHP experience is a Plus! Before applying, please note: This is not a remote position; candidates must be able to reliably commute to the Carlsbad location. Forecast 3D is a supplier which abides by the International Traffic in Arms Regulations (ITAR). In order to be considered for this position, applicants must be either a U.S. citizen, lawful permanent resident of the U.S., protected individual as defined by 8 U.S.C. 1324b(a)(3), or eligible to obtain the required authorizations from the U.S. Department of State Job Type: Full-time Pay: $120,000.00 - $170,000.00 per year Benefits: 401(k) 401(k) matching Dental insurance Health insurance Life insurance Paid time off Vision insurance Schedule: 8 hour shift Monday to Friday Ability to commute/relocate: Carlsbad, CA 92008: Reliably commute or planning to relocate before starting work (Required) Work Location: One location Health insurance If you require alternative methods of application or screening, you must approach the employer directly to request this as Indeed is not responsible for the employer's application process.",https://www.indeed.com/jobs?q=Software+Engineer&l=San+Diego%2C+CA&sc=0kf%3Aattr%28EXSNN%7CFCGTU%7CHFDVW%7CQJZM9%7CUTPWG%252COR%29explvl%28MID_LEVEL%29jt%28fulltime%29%3B&radius=50&start=30&pp=gQAtAAAAAAAAAAAAAAAB_lTimwAzAQEBEAEm4aYt54mx0yaZiLLiwNi11MXovJKQDKBXMf4pYMeRUll0EKHUL1cg_9ORmEvsAAA&vjk=4bf05453c26202f0&advn=4322168851172276
