,job_id,job_title,location,experience,education,job_type,job_description,job_link
9,9e2a88028c585cad,Software Engineer,"San Diego, CA",MID_LEVEL,MASTERS_DEGREE,FULLTIME,"Web Developer - job post Plum Paper, division of Avery Products 2330 Cousteau Ct, Vista, CA 92081 $70,000 - $85,000 a year -  Full-time Responded to 51-74% of applications in the past 30 days, typically within 3 days. Apply now Apply now save-icon Job details Salary $70,000 - $85,000 a year Job Type Full-time Plum Paper, division of Avery Products Corporation is an e-commerce stationery company specializing in personalized planners and notebooks. Our ecommerce platform offers our customers the ability to design and create stationery products specific to their life. We manufacture these personalized products in-house and ship to our customers daily from our Vista, California warehouse. Plum Paper is looking for Web Developer to work directly with our web and creative team to provide a streamline user experience for our customers. You will be responsible for the front end management of our e-commerce website, providing collaboration with back end development to provide positive user experiences and deliver measurable business growth. What we offer: Competitive salary with quarterly bonus potential Dynamic, energetic work environment with an exceptional talented workforce. Great comprehensive benefits including Medical, Dental, Vision, Short-Term and Long-Term Disability, Company provided & paid life insurance Excellent 401K Retirement Plan with generous company match. Work life balance, 12 company paid holidays, paid vacation and paid sick time PRIMARY RESPONSIBILITIES Manage digital store, overseeing all site merchandising including navigation, pricing, categories, visual merchandising, video content, product setup and activation, search optimization, and purchase journey Develop, test, and deploy eCommerce platform features, optimizations, merchandising improvements, bug fixes, custom functionality and integrations to maximize conversions Work directly with the Web Development team and Creative team in the delivery of e-commerce web application features and projects to drive sales and customer acquisition Take ownership and responsibility of projects and features and work closely with design team Research & suggest emerging technologies and website features with the goal of applying these technologies to current and future projects Learn our website along with its framework, data model, and user interfaces Take responsibility for developing new components and site enhancements for better customer experience and customer conversion Produce reasonable estimates for tasks and meeting project schedules Advise on evidence-based and experimental changes to our platform Monitor the effectiveness of strategies by inspecting standardized metrics Capture daily DTC site analytics, overseeing key performance indicators (e.g., traffic conversions, AOV, CAC, LTV, etc.), interpreting data into trends and marketing strategy, and optimizing site Responsible for testing all the enhancements and doing an acceptance testing before releasing the features Manage Amazon store, Etsy store, and Google Shopping Optimize product listings on Amazon through product testing Oversee the SEO Program in conjunction with the marketing team PREFERRED QUALIFICATIONS Associates degree in Computer Science, MIS, related field; or 5 years of equivalent work experience Experience with Ruby on Rails Deep understanding of E-Commerce, user experience, site architecture, content, meta tags, conversion, AOV, and traffic analysis Ability to write high-performance, scalable, reusable code Experience building and maintaining e-Commerce websites Attention to detail and strong analytical skills Effective and comfortable under minimum supervision Experience in web and mobile development best practices Strong knowledge of SEO/SEM Experience with tag management tools such as Google Tag Manager, Google Analytics Ability to perform at high levels in a fast-paced ever-changing work environment Creative and analytical mind with exceptional problem-solving skills Experience with Amazon storefront management and other e-commerce platforms Experience working with sophisticated eCommerce web applications and mobile front-ends All offers of employment are based on the successful completion of a pre-employment background check. Avery Products Corporation is an at-will employer. Employment is at will and, as such, are free to resign at any time without any reason. The company retains the right to terminate an employee’s employment at any time with or without reason or notice. Thank you for your time and consideration of this opportunity. Please include resume when responding. Job Type: Full-time Salary: $70,000.00 - $85,000.00 per year Benefits: 401(k) 401(k) matching Dental insurance Employee assistance program Flexible spending account Health insurance Health savings account Life insurance Paid time off Tuition reimbursement Vision insurance Compensation package: Bonus pay Experience level: 5 years Schedule: Monday to Friday Application Question(s): Will you now, or in the future, require sponsorship for employment visa status (e.g. H-1B visa status)? Education: Associate (Required) Experience: Web development: 5 years (Required) Work Location: One location Health insurance If you require alternative methods of application or screening, you must approach the employer directly to request this as Indeed is not responsible for the employer's application process.",https://www.indeed.com/jobs?q=Software+Engineer&l=San+Diego%2C+CA&sc=0kf%3Aattr%28EXSNN%7CFCGTU%7CHFDVW%7CQJZM9%7CUTPWG%252COR%29explvl%28MID_LEVEL%29jt%28fulltime%29%3B&radius=50&start=70&pp=gQBpAAAAAAAAAAAAAAAB_lTimwBCAQIBElAGAQ6VNHGdOQn1JrQFGRBeuN4uWXa6XadpmIYT4P4cEdcfrty6p4swoivXPm7qvCyzAFjcOUt5odOOvjfSAAA&vjk=9e2a88028c585cad
10,63e59ba0e1e57556,Software Engineer,"San Diego, CA",MID_LEVEL,MASTERS_DEGREE,FULLTIME,"Web Software Developer- Intermediate - job post Spathe Systems 8 reviews 2000 Trident Way Bldg 624, San Diego, CA 92155 $80,000 - $100,000 a year -  Full-time You must create an Indeed account before continuing to the company website to apply Apply on company site save-icon Job details Salary $80,000 - $100,000 a year Job Type Full-time Overview: Spathe Systems is a rapidly growing SOF led, 8(a) defense contractor headquartered in Tampa, FL with offices in Fayetteville, NC and strategic partner locations in Virginia Beach and Coronado. As a small business with a tight knit family feel, Spathe empowers its employees to solve problems and make decisions. SPATHE is looking for a qualified person to support a multi-year contract with US Navy SOF in support of their Enterprise Knowledge Management team that under general supervision, develops, codes, tests, and debugs new software and enhancements to existing web software. Responsibilities: Competent to work on fairly complex programs with guidance. Works with technical staff to understand problems with web software and resolve them. Experience with object models such as JSON, CSOM, and REST. Experience with programming languages HTML, CSS, JavaScript (i.e., REACT, Vue, jQuery). Experience working in and with SharePoint 2013, 2016 and SPO. Experience writing code for new user interfaces, testing of code, debugging code and implementation of new enhancements to existing software based on requirements. Works with Microsoft 0365 to include Power BI to develop and implement interactive dashboards, graphs charts, and other user interfaces. Provides developer documentation, end-user documentation to include how-to guides, training guides, and frequently asked questions (FAQs). Qualifications: 5 or more years of relevant experience or a BA/BS degree in Applied Science in Internet & Web Development, Digital Media and Web Technologies, Computer Science, or Computer Programming. IAT Level II (Sec+). * SECRET CLEARANCE * Additional Notes Salary: 80k-100k Physical Requirements Must be able to perform essential duties satisfactorily with reasonable accommodations. Work is generally done sitting, talking, hearing, and typing. Visual acuity to use a keyboard, prepare and analyze data and figures; transcribing, viewing a computer terminal; extensive reading. Work Environment NAB Coronado, CA. Work is regularly performed in a combination of office and conference settings and routinely uses standard office equipment. Position ID - M3139WDI",https://www.indeed.com/jobs?q=Software+Engineer&l=San+Diego%2C+CA&sc=0kf%3Aattr%28EXSNN%7CFCGTU%7CHFDVW%7CQJZM9%7CUTPWG%252COR%29explvl%28MID_LEVEL%29jt%28fulltime%29%3B&radius=50&start=70&pp=gQBpAAAAAAAAAAAAAAAB_lTimwBCAQIBElAGAQ6VNHGdOQn1JrQFGRBeuN4uWXa6XadpmIYT4P4cEdcfrty6p4swoivXPm7qvCyzAFjcOUt5odOOvjfSAAA&vjk=63e59ba0e1e57556
11,2f888d456151fcfe,Software Engineer,"San Diego, CA",MID_LEVEL,MASTERS_DEGREE,FULLTIME,"Embedded Firmware Engineer - job post Fluidra North America 8 reviews San Diego, CA $75,000 - $105,000 a year -  Full-time You must create an Indeed account before continuing to the company website to apply Apply on company site save-icon Job details Salary $75,000 - $105,000 a year Job Type Full-time Fluidra is seeking an Embedded Firmware Engineer to join the team at our North American Headquarters in Carlsbad, CA. WHAT YOU WILL CONTRIBUTE The Embedded Firmware Engineer will be responsible to write firmware for new product development. The Embedded Controls Engineer I also tests firmware, software and apps written by colleagues, and provides Sustaining Engineering support to existing products. Additionally, you will: Designs, writes, and modifies firmware for embedded control applications using C computer language. Tests firmware, software and apps written by colleagues. Prepares all required product documentation. Provides support in addressing production and warranty issues concerning current products. Takes an active role in the redesign of existing products to meet revised requirements. Combines broad knowledge of design skills, engineering principles, manufacturing techniques, and analytical skills to address field problems and proposes corrective actions. Writes reports, conducts evaluations, and analyzes data. Responsible for following quality system procedures. Assists in procedure development when required. Ensures product quality and take appropriate action when non-conformances are identified. Keeps accurate records as required. Provides support to Production. WHAT WE SEEK 2 + years of experience in the design and maintenance of embedded control firmware, and testing of firmware, software and apps. Experience with the following components and systems: Micro-controllers (preferably PIC, ARM, AVR and 8051) and their associated development tools (IDE, compiler, assembler, etc.). C computer language programming. Familiarity with Assembly language. Testing firmware, software and apps serial communications (RS-485, I2C, SPI, etc.) sensors and transducers (temperature, pressure, etc.) keypads (membrane, discrete, matrices, etc.) analog-to-digital conversion displays (LED, LCD, VFD, 7-segment, alphanumeric, graphical) peripheral drivers (indicators, relays, triacs, etc.) power supplies and batteries Experience in the design and manufacture of electronic assemblies and their application to consumer products. Familiarity with requirements of safety agencies (UL, CSA, CE, etc.). Ability to use sophisticated electronic test equipment. Ability to use office and technical software applications. Ability to communicate effectively with technicians, colleagues, management, and vendors. Ability to work effectively independently or in a team environment. Strong mechanical aptitude. Experience and involvement in all facets and phases of product development from inception to production, and obsolescence is preferable. Familiarity with swimming pool automation systems is a big plus. EDUCATION B.S. in Computer, Electrical or Electronic Engineering or related experience WHAT WE OFFER An exciting opportunity to dive in and begin your career with a company that offers a competitive total rewards package that includes: Alternate work week schedule (EVERY OTHER FRIDAY OFF!) Flexible vacation 11 paid Holidays Full range of health benefits including medical, dental & vision, short & long-term disability 401(K) matching (100% of first 3% contributed, 50% of the next 2%) Health and wellness programs / gym reimbursement Educational assistance up to $7,000 per year On-site self-service café / free gourmet coffee stations Company sponsored FUN events! On-site gym, ping-pong, foosball, outdoor bocce ball court, BBQ & firepit Generous product discounts WHY WORK FOR FLUIDRA? We’re an industry‐leading, global company with a legacy of innovation. Offering an extensive array of quality‐designed pool and spa equipment, our portfolio includes some of the most trusted brands in the business: Polaris®, Jandy®, CMP, S.R. Smith, and Zodiac®. We also sell products under the Cover‐Pools®, iAquaLink®, Grand Effects® , Dell® and Nature2® names. Recognized as the foremost provider of reliable and visionary pool equipment, our reach extends worldwide across both the residential and commercial pool and wellness markets. We now have over 7,000 employees, a presence in over 45 countries and the combined resources to accelerate innovation in critical areas like energy-efficiency, robotics and the Internet of Things. Our focus is on creating the perfect pool and wellness experience responsibly. We take our mission to heart, and our employees embody these guiding principles in everything we do: passion for success, honesty & trust, customer collaboration, teamwork and inclusion , learn and adapt, excellence and i nnovation. Don't meet every single requirement listed? At Fluidra, we thrive on building an inclusive workspace, so if you are excited about this role and your past experience doesn't align perfectly, we encourage you to apply anyways! You may be just the right candidate for this role or another role in the organization. Fluidra is proud to be an equal opportunity employer. Fluidra recruits, employs, trains, compensates and promotes regardless of race, religion, color, national origin, sex, disability, age, veteran status, or any legally protected characteristic. Expected salary range is $75,000 - $105,000. Fluidra offers a comprehensive total rewards / benefits program that includes base salary, annual bonus based on performance of individual and company objectives, competitive 401K matching, paid vacation and sick time, full range of health benefits, educational assistance, etc. The actual salary offer will carefully consider a wide range of factors, including skills, qualifications, experience and location. Your recruiter will provide additional details on our compensation and total rewards program. #onsite #LI-MG1",https://www.indeed.com/jobs?q=Software+Engineer&l=San+Diego%2C+CA&sc=0kf%3Aattr%28EXSNN%7CFCGTU%7CHFDVW%7CQJZM9%7CUTPWG%252COR%29explvl%28MID_LEVEL%29jt%28fulltime%29%3B&radius=50&start=70&pp=gQBpAAAAAAAAAAAAAAAB_lTimwBCAQIBElAGAQ6VNHGdOQn1JrQFGRBeuN4uWXa6XadpmIYT4P4cEdcfrty6p4swoivXPm7qvCyzAFjcOUt5odOOvjfSAAA&vjk=2f888d456151fcfe
12,afe335240d7c3b65,Software Engineer,"San Diego, CA",MID_LEVEL,MASTERS_DEGREE,FULLTIME,"DevOps Engineer - Remote - job post Point Loma Nazarene University 96 reviews San Diego, CA 92106 • Remote $36.00 - $38.50 an hour -  Full-time You must create an Indeed account before continuing to the company website to apply Apply on company site save-icon Job details Salary $36.00 - $38.50 an hour Job Type Full-time PLNU is a Christian liberal arts university in the evangelical, Wesleyan tradition, offering quality undergraduate, graduate and professional programs. We provide higher education in a vibrant Christian environment where minds are engaged and challenged, character is modeled and formed, and service is an expression of faith. PLNU is an institution that is committed to reflecting the rich diversity of God’s kingdom. We therefore encourage applications from culturally diverse candidates. Benefits: We are pleased to offer attractive benefits and resources. This includes benefits such as health, dental, tuition benefits for employees and dependents, competitive retirement matching, vacation and sick time, and 15 paid holidays per year. In addition, we have many opportunities to engage with our community including staff chapel and a robust wellness program. Job Summary: The IT Operations team at PLNU is responsible for managing, maintaining, and advancing the University’s Enterprise IT infrastructure. As part of this team, through both individual efforts and in partnership with internal and external collaborators, the DevOps Engineer provides on-going support and innovation, with an emphasis on Cloud technologies and integrations, to ensure that all members of the University community are provided with stable and effective working and learning environments. This position may be eligible for a remote work arrangement. We are currently accepting applications from residents of the following states: AL, AZ, CA, CO, FL, GA, HI, ID, IN, KS, KY, MI, NC, OH, OK, OR, SC, TN, TX, UT, VA and WI Salary: Pay Range: $36.00 - $38.50 per hour Job Status: Full time *** Job Description: Responsibilities Maintain current cloud services and assist with new cloud projects with an eye toward secure and automatable processes Collaborate with other IT teams on integration and automation projects, new and ongoing Provide Tier 3 Help Desk support, and take part in rotating on-call shifts Create documentation for new projects, including but not limited to architecture diagrams, system configuration descriptions, process workflows and troubleshooting steps Research potential solutions for enhancements to existing processes and provide insight when discussing new projects. Take advantage of training opportunities and other means to stay current with industry changes related to areas of team responsibility Required Education, Certification, or Experience Bachelor's degree in a related field , an equivalent combination of recognized, current DevOps/Developer certifications and/or 3+ years’ proven experience in a similar role. Required Knowledge and Technical Skills (minimum requirements) Software development in modern languages and utilizing web services/APIs Use of common tools related to Extract/Transform/Load (ETL), JSON/XML, Git or other revision control platforms Quickly acquire skills and knowledge of unfamiliar or emerging software systems Physical Requirements The work is primarily sedentary and may require sitting for extended periods of time Ability to lift computers and other IT equipment, up to 30 pounds Sufficient hand, arm, and finger dexterity to operate a computer keyboard Visual acuity to read documents, email, other correspondence, and reports on paper and computer monitors Speaking and hearing ability sufficient to communicate in person or over the telephone Special Conditions Job offer is contingent on clear background check *** At PLNU, we believe in pursuing calling together. Deep and meaningful relationships between students, faculty, and staff is vital in nurturing our shared community and expressing God’s love. We are looking for enthusiastic candidates to join us in empowering our students to reach their greatest personal, spiritual and professional potential. Point Loma Nazarene University does not discriminate on the basis of race, color, national origin, sex, age, disability or status as a veteran in any of its policies, practices or procedures.",https://www.indeed.com/jobs?q=Software+Engineer&l=San+Diego%2C+CA&sc=0kf%3Aattr%28EXSNN%7CFCGTU%7CHFDVW%7CQJZM9%7CUTPWG%252COR%29explvl%28MID_LEVEL%29jt%28fulltime%29%3B&radius=50&start=70&pp=gQBpAAAAAAAAAAAAAAAB_lTimwBCAQIBElAGAQ6VNHGdOQn1JrQFGRBeuN4uWXa6XadpmIYT4P4cEdcfrty6p4swoivXPm7qvCyzAFjcOUt5odOOvjfSAAA&vjk=afe335240d7c3b65
13,ead6c400c0571961,Software Engineer,"San Diego, CA",MID_LEVEL,MASTERS_DEGREE,FULLTIME,"Embedded Software Engineer - Platforms - job post Zoox (part of Amazon.com) 9 reviews San Diego, CA $147,000 - $209,000 a year -  Full-time You must create an Indeed account before continuing to the company website to apply Apply on company site save-icon Job details Salary $147,000 - $209,000 a year Job Type Full-time Zoox is looking for an embedded software engineer to join our Firmware Platforms team. In this role, you will be responsible for developing, extending, and maintaining support for multiple embedded platforms for the Zoox vehicle. You will work closely with electrical engineers, embedded software engineers, and validation engineers to enable support for new advanced platforms and accelerate application development across multiple projects. We are looking for people who are passionate about diving deep into the hardware and creating robust and reusable software. Responsibilities Architect, develop, debug, optimize, review, and test software for multiple real-time embedded platforms Develop and maintain board support packages for multiple platforms, including compiler, bootloader, drivers, and real-time operating system Build low-level frameworks, interfaces, and infrastructure to make our embedded application development faster, simpler, more portable, and more testable Bringup of new embedded platforms by working with electrical engineers, suppliers, and vendors to identify and solve hardware and low-level software issues. Contribute to all phases of the software development cycle including prototyping, requirements capture, design, implementation, and validation Qualifications Bachelor’s or Master’s degree in computer science, electrical engineering, or equivalent experience 3+ years of experience developing real-time embedded software for distributed electro-mechanical systems Strong embedded C++/C programming experience Strong experience with micro-controllers and/or microprocessors (ARM, PowerPC) Experience with real-time operating systems on embedded systems (POSIX, QNX, FreeRTOS, etc.) Familiarity with modern software development methodologies and tools (Agile, Git, unit testing, CI, etc.) Bonus Qualifications Experience with automotive communication protocols and stacks (CAN, LIN, ethernet, UDS, etc.) Familiarity with high assurance development practices and tools (Polarion, ISO-26262, MISRA C/C++, etc.) Ability to read and provide feedback on PCB schematics Compensation There are three major components to compensation for this position: salary, Amazon Restricted Stock Units (RSUs), and Zoox Stock Appreciation Rights. The salary range for this position is $147,000 to $209,000. A sign-on bonus may be offered as part of the compensation package. Compensation will vary based on geographic location and level. Leveling, as well as positioning within a level, is determined by a range of factors, including, but not limited to, a candidate's relevant years of experience, domain knowledge, and interview performance. The salary range listed in this posting is representative of the range of levels Zoox is considering for this position. Zoox also offers a comprehensive package of benefits including paid time off (e.g. sick leave, vacation, bereavement), unpaid time off, Zoox Stock Appreciation Rights, Amazon RSUs, health insurance, long-term care insurance, long-term and short-term disability insurance, and life insurance. Vaccine Mandate Employees working in this position will be required to have received a single dose of the J&J/Janssen COVID-19 vaccine OR have completed the two-dose Pfizer or Moderna vaccine series. In addition, employees will be required to receive a COVID-19 booster vaccine within two months of becoming eligible for the booster vaccine. Employees will be required to show proof of vaccination status upon receipt of a conditional offer of employment. That offer of employment will be conditioned upon, among other things, an Applicant’s ability to show proof of vaccination status. Please note the Company provides reasonable accommodations in accordance with applicable state, federal, and local laws. About Zoox Zoox is developing the first ground-up, fully autonomous vehicle fleet and the supporting ecosystem required to bring this technology to market. Sitting at the intersection of robotics, machine learning, and design, Zoox aims to provide the next generation of mobility-as-a-service in urban environments. We’re looking for top talent that shares our passion and wants to be part of a fast-moving and highly execution-oriented team. Follow us on LinkedIn A Final Note: You do not need to match every listed expectation to apply for this position. Here at Zoox, we know that diverse perspectives foster the innovation we need to be successful, and we are committed to building a team that encompasses a variety of backgrounds, experiences, and skills.",https://www.indeed.com/jobs?q=Software+Engineer&l=San+Diego%2C+CA&sc=0kf%3Aattr%28EXSNN%7CFCGTU%7CHFDVW%7CQJZM9%7CUTPWG%252COR%29explvl%28MID_LEVEL%29jt%28fulltime%29%3B&radius=50&start=70&pp=gQBpAAAAAAAAAAAAAAAB_lTimwBCAQIBElAGAQ6VNHGdOQn1JrQFGRBeuN4uWXa6XadpmIYT4P4cEdcfrty6p4swoivXPm7qvCyzAFjcOUt5odOOvjfSAAA&vjk=ead6c400c0571961
