,job_id,job_title,location,experience,education,job_type,job_description,job_link
12,106a80c9c90cbbde,Machine Learning Engineer,"San Francisco, CA",ENTRY_LEVEL,BACHELORS_DEGREE,fulltime,"Senior Manager, Data Science - job post RingCentral 156 reviews Belmont, CA 94002 $172,000 - $193,000 a year -  Full-time RingCentral 156 reviews Read what people are saying about working here. You must create an Indeed account before continuing to the company website to apply Apply on company site save-icon Job details Salary $172,000 - $193,000 a year Job Type Full-time Say hello to possibilities. It’s not everyday that you consider starting a new career. We’re RingCentral, and we’re happy that someone as talented as you is considering this role. First, a little about us, we’re a global leader in cloud-based communications and collaboration software. We are fundamentally changing the nature of human interaction—giving people the freedom to connect powerfully and personally from anywhere, at any time, on any device. We’re a $2 billion company that’s growing at 20+% annually and we’re expanding our Engineering Team to make sure we stay ahead of the competition. We’re currently looking for: The Sr. Manager of Data Science will be responsible for leading the Data Science function focused on Customer retention, expansion, and acquisition. S/he will be responsible for setting and driving the strategic vision, growing the team, and developing a world-class data science and machine learning organization. Data is at the heart of our business and strategy. This role will partner with other executive leaders to leverage data science, analytics and machine learning as a strategic differentiator for the business - working across the organization to support a variety of business and technical problems. This position can be based at our Belmont CA or our Denver CO offices. Responsibilities: Set the data science vision for RingCentral’s Data & Analytics organization and build the roadmap to drive business results. Be a thought leader for the design and development of our data, and machine learning platforms, driving capability around tooling that enables enterprise-wide analysis. Hands-on development while guiding the rest of data scientists. As necessary, recruit, hire, and train a world class team of data scientists, researchers, machine learning engineers, and business analysts to solve business critical problems across the company. Partner with other executive leaders and work cross-functionally with Sales, Marketing, Product and Customer teams to strategically leverage data science capabilities and apply your team’s skills/knowledge to our most pressing strategic problems. Evangelize the data science and research function within RingCentral and foster a strong data science community. Qualifications: 2+ years building and leading a data science function, with experience leading through growth. 10+ years of previous experience in a hands-on data science role, preferably customer and marketing focused. Strong business acumen. Brings commercial and business orientation, with a track record of leveraging data science to identify trends, formulate business insights, and develop actionable solutions to solve critical business, customer, and organizational problems. Ability to break down high-level business problems into concrete solutions. Excellent communicator that can bridge between a wide range of stakeholders (technical and non-technical); proven ability to develop strong partnerships with internal and cross-functional peers, with a specific history partnering successfully with product and engineering teams. Academic/Research foundations - MS or PhD preferred. Foundation in Mathematics, Economics/Econometrics, Statistics, Computer Science, Operations Research, or related field. What we offer: Comprehensive medical, dental, vision, disability, life insurance Health Savings Account (HSA), Flexible Spending Account (FSAs) and Commuter Benefits 401K match and ESPP Flexible PTO Wellness programs including 1:1 wellness coaching through TaskHuman and meditation guidance through Headspace Paid parental leave and new parent gift boxes Pet insurance Employee Assistance Program (EAP) with counseling sessions available 24/7 Rocket Lawyer services that provide legal advice, document creation and estate planning Employee bonus referral program About RingCentral: RingCentral, Inc. (NYSE: RNG) is a leading provider of business cloud communications and contact center solutions based on its powerful Message Video Phone™ (MVP™) global platform. More flexible and cost effective than legacy on-premises PBX and video conferencing systems that it replaces, RingCentral® empowers modern mobile and distributed workforces to communicate, collaborate, and connect via any mode, any device, and any location. RingCentral is headquartered in Belmont, California, and has offices around the world. RingCentral is an equal opportunity employer that truly values diversity. We do not discriminate on the basis of race, religion, color, national origin, gender, sexual orientation, age, marital status, veteran status, or disability status. If you are hired in Belmont, the compensation range for this position is between $172,000 and $193,000 for full-time employees, in addition to eligibility for variable pay, equity, and benefits. Benefits may include, but are not limited to, health and wellness, 401k, ESPP, vacation, parental leave, and more! The salary may vary depending on your location, skills, and experience. #LI-BH1 #LI-Onsite",https://www.indeed.com/jobs?q=Data+Scientist&l=San+Francisco%5D+%23%2C+CA&sc=0kf%3Aattr%286QC5F%252COR%29explvl%28SENIOR_LEVEL%29jt%28fulltime%29%3B&vjk=106a80c9c90cbbde
13,e744297aba75a6ae,Machine Learning Engineer,"San Francisco, CA",ENTRY_LEVEL,BACHELORS_DEGREE,fulltime,"Associate Principal Scientist, Digital Pathology/Machine Learning - job post Merck Sharp & Dohme 4,362 reviews San Francisco, CA • Remote $131,900 - $224,300 a year -  Full-time Merck Sharp & Dohme 4,362 reviews Read what people are saying about working here. You must create an Indeed account before continuing to the company website to apply Apply on company site save-icon Job details Salary $131,900 - $224,300 a year Job Type Full-time Job Description Our Company’s Anatomic Pathology group in South San Francisco is seeking an experienced researcher with expertise in machine learning and digital pathology to support applied research and biomarker development in oncology and other therapeutic areas. This position will require application of computer vision, machine learning, and software programming to develop custom computational methods for automating tissue based analyses and interrogating basic biological features and mechanisms of action leverageable for clinical and discovery efforts. The successful candidate will deploy convolutional neural networks in machine learning projects focused on complex feature and pattern recognition, spatial analysis, and other evaluations applied to digitized pathology images. The position requires a high level of comfort with coding (e.g. Python, MATLAB), as well as facility with deep-learning frameworks (e.g. PyTorch) with conversion of custom-coded solutions for use by non-coders. This position is interdisciplinary, sitting at the intersection of pathology, applied computer science, and therapeutic area biology, particularly oncology. An exceptional degree of collaboration is required. Our Research Scientists are our Inventors. We identify and target steps in disease mechanisms or pathways that could be inhibited or enhanced. Our goal is to isolate a compound that is effective against a disease target. Using innovative thinking, state-of-the-art facilities and robust scientific methodology we collaborate to discover the next medical breakthrough. The successful candidate will: Develop and automate machine learning based tissue segmentation algorithms to replace manual annotations in image analysis workflows Devise and implement efficient and robust parallel-computing workflows in High Performance Computing systems for large-scale image analysis projects Develop novel spatial evaluation algorithms for interrogation of proximity relationships between tissue constituents Write custom code for algorithm development and model training, converting custom solutions to enable use by non-coders as appropriate Work with images from across different pathology assay types and different disease indications Interact smoothly with pathologists, pathology bench scientists, statisticians, biologists, clinicians, and informatics/IT staff, both internally and externally Serve as a subject matter expert regarding computational aspects of digital pathology projects Present data in team meetings and participate in generation of technical reports in support of regulatory documents as needed Possess a high level of self-motivation, comfort with complex multitasking, ability to work independently with minimal assistance Have excellent communication and interpersonal skills, high levels of creativity and flexibility and highly collaborative approach This position is remote or hybrid based on the candidate's location and preference. Qualifications: Education: Bachelor's (with 10 years), Master's (with 6 years) or Ph.D. (with 2 years) in biology, pathology, immunology, computer science or related field and relevant experience Required Skills and Experience: In-depth knowledge of image processing, computer vision, and statistical machine learning Highly proficient in programming , e.g., Python and MATLAB Familiarity and comfort with digital image analysis, preferably pathology images Preferred Skills, and Experience: High level of comfort with histology/microanatomy Background in oncology and/or immunology Previous work in the pharmaceutical industry Practical knowledge with Perkin Elmer Vectra Polaris platform and HALO image analysis system We are a research-driven biopharmaceutical company. Our mission is built on the simple premise that if we “follow the science” that great medicines can make a significant impact to our world. We believe that a research-driven enterprise dedicated to world-class science can succeed by inventing medicine and vaccine innovations that make a difference for patients across the globe. Who we are … We are known as Merck & Co., Inc., Rahway, New Jersey, USA in the United States and Canada and MSD everywhere else. For more than a century, we have been inventing for life, bringing forward medicines and vaccines for many of the world's most challenging diseases. Today, our company continues to be at the forefront of research to deliver innovative health solutions and advance the prevention and treatment of diseases that threaten people and animals around the world. What we look for … Imagine getting up in the morning for a job as important as helping to save and improve lives around the world. Here, you have that opportunity. You can put your empathy, creativity, digital mastery, or scientific genius to work in collaboration with a diverse group of colleagues who pursue and bring hope to countless people who are battling some of the most challenging diseases of our time. Our team is constantly evolving, so if you are among the intellectually curious, join us—and start making your impact today. NOTICE FOR INTERNAL APPLICANTS In accordance with Managers' Policy - Job Posting and Employee Placement, all employees subject to this policy are required to have a minimum of twelve (12) months of service in current position prior to applying for open positions. If you have been offered a separation benefits package, but have not yet reached your separation date and are offered a position within the salary and geographical parameters as set forth in the Summary Plan Description (SPD) of your separation package, then you are no longer eligible for your separation benefits package. To discuss in more detail, please contact your HRBP or Talent Acquisition Advisor. #EligibleforERP #DATA2020 Employees working in roles that the Company determines require routine collaboration with external stakeholders, such as customer-facing commercial, or research-based roles, will be expected to comply not only with Company policy but also with policies established by such external stakeholders (for example, a requirement to be vaccinated against COVID-19 in order to access a facility or meet with stakeholders). Please understand that, as permitted by applicable law, if you have not been vaccinated against COVID-19 and an essential function of your job is to call on external stakeholders who require vaccination to enter their premises or engage in face-to-face meetings, then your employment may pose an undue burden to business operations, in which case you may not be offered employment, or your employment could be terminated. Please also note that, where permitted by applicable law, the Company reserves the right to require COVID-19 vaccinations for positions, such as in Global Employee Health, where the Company determines in its discretion that the nature of the role presents an increased risk of disease transmission. Current Employees Current Contingent Workers US and Puerto Rico Residents Only: Our company is committed to inclusion, ensuring that candidates can engage in a hiring process that exhibits their true capabilities. For more information about personal rights under Equal Employment Opportunity, visit: EEOC Know Your Rights EEOC GINA Supplement Pay Transparency Nondiscrimination We are proud to be a company that embraces the value of bringing diverse, talented, and committed people together. The fastest way to breakthrough innovation is when diverse ideas come together in an inclusive environment. We encourage our colleagues to respectfully challenge one another’s thinking and approach problems collectively. We are an equal opportunity employer, committed to fostering an inclusive and diverse workplace. Under New York City, Washington State and California State law, the Company is required to provide a reasonable estimate of the salary range for this job. Final determinations with respect to salary will take into account a number of factors, which may include, but not be limited to the primary work location and the chosen candidate’s relevant skills, experience, and education. Expected salary range: $131,900.00 - $224,300.00 Available benefits include bonus eligibility, health care and other insurance benefits (for employee and family), retirement benefits, paid holidays, vacation, and sick days. For Washington State Jobs, a summary of benefits is listed here. Learn more about your rights, including under California, Colorado and other US State Acts Search Firm Representatives Please Read Carefully Merck & Co., Inc., Rahway, NJ, USA, also known as Merck Sharp & Dohme LLC, Rahway, NJ, USA, does not accept unsolicited assistance from search firms for employment opportunities. All CVs / resumes submitted by search firms to any employee at our company without a valid written search agreement in place for this position will be deemed the sole property of our company. No fee will be paid in the event a candidate is hired by our company as a result of an agency referral where no pre-existing agreement is in place. Where agency agreements are in place, introductions are position specific. Please, no phone calls or emails. Employee Status: Regular Relocation: Domestic/International VISA Sponsorship: Yes Travel Requirements: Flexible Work Arrangements: Shift: Valid Driving License: Hazardous Material(s): Requisition ID: R204734",https://www.indeed.com/jobs?q=Data+Scientist&l=San+Francisco%5D+%23%2C+CA&sc=0kf%3Aattr%286QC5F%252COR%29explvl%28SENIOR_LEVEL%29jt%28fulltime%29%3B&vjk=e744297aba75a6ae
14,a516c37c3e0aa19e,Machine Learning Engineer,"San Francisco, CA",ENTRY_LEVEL,BACHELORS_DEGREE,fulltime,"Director of Data Science - job post Qcells 107 reviews San Francisco, CA • Hybrid remote Full-time Qcells 107 reviews Read what people are saying about working here. Apply now Apply now save-icon Job details Job Type Full-time This is a San Francisco based position that is currently remote and will have a hybrid schedule once we return to office. We are open to candidates willing to relocate to the San Francisco Bay Area. ABOUT GELI Geli (Growing Energy Labs, Inc.) provides software and business solutions to design, connect, and operate energy storage systems ranging in size from residential to utility-scale, as well as grid-tied, microgrid, and off-grid systems. Geli’s suite of products creates an ecosystem where project developers, OEMs, financiers, and project operators can deploy advanced energy projects using a seamless hardware-agnostic software platform. Geli is a subsidiary of Hanwha Q CELLS, one of the world’s largest photovoltaic manufacturers most recognized for its high-performance, high-quality solar cells and modules. OUR VISION Geli is committed to helping make the planet a cleaner, better place to live, both with our software products and through our everyday actions. Imagine a world where there is less reliance on non-renewable power, where you source your electricity from your neighbors rather than from power stations hundreds of miles away and software makes the best possible use of the solar, wind, and battery storage available. This is our vision. We are looking for enthusiastic colleagues that are not only fluent in technology, but also share our vision of a world running on 100% renewable energy. ABOUT THIS JOB As Director/Senior Director of Data Science, you will be responsible for managing our Data Science team, which currently includes Optimization, Forecasting, Machine Learning, Machine Learning Ops, and Data Engineering. This is a high-visibility, high-impact position in a fast-growing team with an opportunity to contribute to overall business strategy and product vision. PRIMARY RESPONSIBILITIES You will help the team build state of the art, production quality software that solves key business problems, while working with other Software (Cloud, IoT), DevOps, Hardware, Product management and System test teams. You will grow and lead a globally distributed team of 30+ people (US, AUS, Seoul, UK, India) You will serve, inspire, and empower the team while eliminating roadblocks to help them contribute and realize their full potential. You will be responsible for the vision, roadmap, and execution of the Data Science team charter. Determine and prioritize the team’s work based on business needs. Support career paths, mentorship, and growth for team members. Provide technical requirements for key data infrastructure decisions. Collaborate with other leaders and executives to build data-informed business strategy and product roadmaps. Excel at the intersection of leadership, business outcomes, data science and software engineering. Required Qualifications PhD or M.S. in science or engineering, math, statistics or equivalent combined education and work experience is preferred. 10+ years of technical experience in a data science role or equivalent 5+ years management experience building and leading data science teams. Note: Strong technical & people leadership skills are a must. 5+ years’ experience working with production software Proficient at executing cross-functional projects and coordinating with leadership across multiple teams Ability to translate complex business problems into achievable and actionable analytic projects A willingness to collaborate and communicate with the broader team to drive cross-team and cross-organization initiatives forward A high sense of urgency and commitment Experience in Energy domain – Solar, Wind, Energy Storage, Smart Grid, Energy Markets Preferred Qualifications Deep understanding and experience with time series forecasting, ML techniques (e.g. ARIMA, tree-based models, neural network), and tools (e.g. TensorFlow, PyTorch, Scikit-Learn, Keras). Experience with load, solar, price forecasting and energy market. Experience with optimization techniques (deterministic, stochastic) and optimization packages (Pyomo, Cvxpy, Gurobi, Express, Cplex) Experience with applying statistical modeling, ML, optimization techniques to the data in power and energy domain Experience in ML Ops: container orchestration, code isolation, data versioning, and graph-based computation. Experience with various cloud technologies (AWS, Kubernetes, Docker, Microservices) Good understanding of software development and deployment processes (CI/CD, Agile, Source Control Management) Experience building complex, automated data processes in Python, SQL, AWS, Airflow, Snowflake, RPA, and other technologies BENEFITS OF WORKING AT GELI Competitive salary commensurate with experience Competitive benefits offerings Convenient accessible location in downtown San Francisco Flexible work-from-home-office opportunities, as determined by position and job duties WORK ENVIRONMENT Make a difference: join a group of people who are passionate about renewable energy Have an impact: the company is still small enough that everyone’s contribution has a significant impact to the success of the company Many opportunities to lead teams, projects, and contribute to development Casual professional working environment: there’s no need to dress up, just present your best self Work collaboratively in a diverse environment- we commit to reaching better decisions by respecting opinions and working through disagreements DIVERSITY We value the insights that a diverse team can bring. We encourage applications from members of groups that have been traditionally underrepresented in tech. Growing Energy Labs, Inc. provides equal employment opportunities (EEO) to all employees and applicants for employment without regard to race, color, religion, sex, national origin, age, disability, or genetics. If you require alternative methods of application or screening, you must approach the employer directly to request this as Indeed is not responsible for the employer's application process.",https://www.indeed.com/jobs?q=Data+Scientist&l=San+Francisco%5D+%23%2C+CA&sc=0kf%3Aattr%286QC5F%252COR%29explvl%28SENIOR_LEVEL%29jt%28fulltime%29%3B&vjk=a516c37c3e0aa19e
