,job_id,job_title,location,experience,education,job_type,job_description,job_link
71,be22c688fe3fadfe,Machine Learning Engineer,"San Francisco, CA",ENTRY_LEVEL,BACHELORS_DEGREE,fulltime,"Manager Product Management (Machine Learning Feature Lifecycle) - job post Capital One 10,036 reviews New York, NY 10011 Full-time, Part-time Capital One 10,036 reviews Read what people are saying about working here. You must create an Indeed account before continuing to the company website to apply Apply on company site save-icon Job details Encouraged to Apply Fair chance Job Type Full-time Part-time 114 5th Ave (22114), United States of America, New York, New York Manager Product Management (Machine Learning Feature Lifecycle) Capital One is a high-tech company, a scientific laboratory, and a nationally recognized brand all in one reaching tens of millions of consumers. We are a passionate and entrepreneurial team that embraces bold ideas, fosters collaboration and delivers great experiences for our customers. Machine learning is at the heart of our approach. Our teams provide millions of customers with individualized, real-time experiences, protection, and decisions driven by machine learning and advanced analytic capabilities. In order to further scale our efforts in this space, we are building a world class machine learning platform. This platform will enable our data scientists and machine learning engineers to take models from conception to production faster and safer than ever before. This work is core to Capital One’s mission, changing banking for good. As a Product Manager on the Machine Learning Experience (MLX) Product team, you will be part of the ML Feature Platform Development Team designing and delivering a best in class MLOps “platform” product for Capital One Data Scientists. This team is focused on building a unified experience for authoring, registering, and discovering data sets used to train business-critical ML models faster for customers and businesses. We are passionate about building platform software that powers data science at Capital One and are looking for someone excited to build something from the ground up.. This role represents the needs of the customer to inform the platform roadmap ensuring the capabilities being delivered are aligned with the intended business outcomes. You will be responsible for feature definition and partnering with tech teams to deliver platform components. The ideal candidate for this role is passionate about technology and deeply empathizes with internal and external customer needs. They are comfortable in conversation with engineering teams as well as stakeholders ranging from data scientists to senior leaders. Specific responsibilities include, but are not limited to: Develop and communicate the product vision and strategy for key components of the platform. Deeply understand the needs of data scientists and engineers across Capital One. Prioritize the Product Backlog to maximize business and customer outcomes. Incorporate design thinking and analytics to inform product design. Enable collaboration and ensure communication between teams. Maintain a healthy backlog of work and play a critical role in many agile ceremonies. Support the team with escalation and resolution of impediments. Serve as the connection between customers, Capital One’s mission, and your team. We want you if you are: Passionate about building impactful products. You enjoy putting yourself in the shoes of customers. Even better if you have experience doing this with internal customers. You have expertise in, or are excited about, machine learning. You are a learner who is able to quickly get up to speed in a highly technical environment. You are experienced working in an Agile environment You are a do-er who can also zoom out and think strategically. You have excellent oral and written communication skills. You are highly collaborative and have the ability to influence and lead. Basic Qualifications: Bachelor’s Degree or military experience At least 3 year of product management experience or at least 3 year of experience in product design, agile delivery, business analysis, data science, or software engineering Preferred Qualifications: Bachelor’s Degree in Computer Science or Engineering MBA or Master’s degree 2+ years of experience in Agile product management At this time, Capital One will not sponsor a new applicant for employment authorization for this position. The minimum and maximum full-time annual salaries for this role are listed below, by location. Please note that this salary information is solely for candidates hired to perform work within one of these locations, and refers to the amount Capital One is willing to pay at the time of this posting. Salaries for part-time roles will be prorated based upon the agreed upon number of hours to be regularly worked. San Francisco, California: $169,700 - $193,700 for Manager, Product Management New York City: $160,200 - $182,800 for Manager, Product Management Candidates hired to work in other locations will be subject to the pay range associated with that location, and the actual annualized salary amount offered to any candidate at the time of hire will be reflected solely in the candidate’s offer letter. This role is also eligible to earn performance based incentive compensation, which may include cash bonus(es) and/or long term incentives (LTI). Incentives could be discretionary or non discretionary depending on the plan. Capital One offers a comprehensive, competitive, and inclusive set of health, financial and other benefits that support your total well-being. Learn more at the Capital One Careers website. Eligibility varies based on full or part-time status, exempt or non-exempt status, and management level. No agencies please. Capital One is an Equal Opportunity Employer committed to diversity and inclusion in the workplace. All qualified applicants will receive consideration for employment without regard to sex, race, color, age, national origin, religion, physical and mental disability, genetic information, marital status, sexual orientation, gender identity/assignment, citizenship, pregnancy or maternity, protected veteran status, or any other status prohibited by applicable national, federal, state or local law. Capital One promotes a drug-free workplace. Capital One will consider for employment qualified applicants with a criminal history in a manner consistent with the requirements of applicable laws regarding criminal background inquiries, including, to the extent applicable, Article 23-A of the New York Correction Law; San Francisco, California Police Code Article 49, Sections 4901-4920; New York City’s Fair Chance Act; Philadelphia’s Fair Criminal Records Screening Act; and other applicable federal, state, and local laws and regulations regarding criminal background inquiries. If you have visited our website in search of information on employment opportunities or to apply for a position, and you require an accommodation, please contact Capital One Recruiting at 1-800-304-9102 or via email at RecruitingAccommodation@capitalone.com. All information you provide will be kept confidential and will be used only to the extent required to provide needed reasonable accommodations. For technical support or questions about Capital One's recruiting process, please send an email to Careers@capitalone.com Capital One does not provide, endorse nor guarantee and is not liable for third-party products, services, educational tools or other information available through this site. Capital One Financial is made up of several different entities. Please note that any position posted in Canada is for Capital One Canada, any position posted in the United Kingdom is for Capital One Europe and any position posted in the Philippines is for Capital One Philippines Service Corp. (COPSSC).",https://www.indeed.com/jobs?q=Machine+Learning+Engineer&l=New+York%2C+NY&sc=0kf%3Aattr%28FCGTU%7CHFDVW%7CQJZM9%7CUTPWG%252COR%29explvl%28MID_LEVEL%29jt%28fulltime%29%3B&radius=50&start=40&pp=gQA8AAAAAAAAAAAAAAAB_gKCswAlAQEBCAaTfAH0ks0eMx6OWAFs8qFn5mAXWdKJ6aR3qATHIrN3AAAA&vjk=be22c688fe3fadfe
72,154982bd94331a66,Machine Learning Engineer,"San Francisco, CA",ENTRY_LEVEL,BACHELORS_DEGREE,fulltime,"Senior Frontend Developer (Angular/AWS) - job post Doran Jones 5 reviews New York, NY • Hybrid remote $70,000 - $225,004 a year -  Full-time Doran Jones 5 reviews Read what people are saying about working here. You must create an Indeed account before continuing to the company website to apply Apply on company site save-icon Job details Salary $70,000 - $225,004 a year Job Type Full-time Doran Jones Inc. is hiring a Frontend Software Engineer with Angular expertise to lead the development of a strategic data management project at a multi-national financial services firm. The application will be built on AWS and Snowflake and support transactional data analysis across a broad range of cash and derivative securities. Hybrid (NY/NJ office 3 days a week) Responsibilities Implement a highly performant user interface built from provided UX artifacts and written specifications within the following environment: AngularJS, JEST test framework, Bamboo/Bitbucket CI/CD, Docker, and Kubernetes, Integration test framework Manage deployment process across multiple environments, including production (controlled by change management process). Deliver UI that will interface with a REST API Provide rigorous testing standards to ensure the application's current and future stability is not compromised. Remain current with developments and trends in areas of expertise, including new technologies that may provide opportunities for the future. Develop and foster collaborative relationships to facilitate the accomplishment of work goals with QA and other colleagues in the organization. Required Experience 5+ Years of development as a front-end developer using Angular 8+, Typescript, Reactive Programming, Responsive Design, JavaScript, CSS3, SASS, and HTML5. In-depth knowledge of Agile Software Development practices and how to leverage these to streamline project execution. Experience working with AWS cloud environment. Possess the ability to decompose business problems into smaller parts to develop a solution, considering the impact on other subsystems. Experience in troubleshooting, tuning, and optimizing rendering time, memory & network utilization. Experience working with Angular CLI. Experience working in a platform managed by a DevOps team (OpenShift, a plus). Strong communication skills. Bachelor's degree in Computer Science, MIS, or a related field. Preferred Experience Working knowledge of Python development using standard data libraries (pandas, etc.). Consulting experience within financial services. $70,000 - $225,004 a year Actual compensation may vary based on factors such as work experience, education/training and skill level, market conditions, and the candidate's geographic location. We offer a competitive compensation package, including a base salary, comprehensive health care coverage, disability benefits, 401(k)+ match, life insurance, paid personal days, paid holidays, and paid time off, among others. For those in eligible roles, a discretionary bonus may be awarded based on company performance and in recognition of individual achievements and contributions. Additional details about total compensation and benefits details during the hiring process. Doran Jones Inc. (DJI) is the leading financial services Data Engineering and Application Development firm, specializing in Capital Markets, Risk, and Regulatory Compliance. We are US-based, helping our clients fill gaps in capacity and expertise, reduce risk, and accelerate change. Our leaders average over 25 years of experience in Financial Services and Technology. DJI is repeatedly engaged by the largest and most complex clients for our Agile transformation expertise and practical understanding of the critical relationship between data, architecture, and application development. DJI has a mission to place more people from non-traditional backgrounds into sustainable technology careers. Through partnerships with non-profit technology programs in underserved communities and Veteran organizations, candidates transition from tech training programs into real IT careers at DJI. Our unique recruitment policy allows us to create exceptional teams, bringing a broad spectrum of experience to our company and creating anything but a traditional consulting firm. DJI is a wholly-owned subsidiary of McLaren Strategic Ventures, a private equity firm, that invests in start-ups and scale-ups. They provide a full range of highly trusted domain consulting, advisory services, and innovative technologies globally. Doran Jones is able to offer a broad range of technology, deeper AI and machine learning tools, data intelligence, alternative resourcing capabilities, and capital access to invest and digitize at scale. Our clients benefit from this unique portfolio allowing them to accelerate the pace of their own digital transformations through innovative products and services designed around industry-wide issues. Visit Doran Jones to learn more!",https://www.indeed.com/jobs?q=Machine+Learning+Engineer&l=New+York%2C+NY&sc=0kf%3Aattr%28FCGTU%7CHFDVW%7CQJZM9%7CUTPWG%252COR%29explvl%28MID_LEVEL%29jt%28fulltime%29%3B&radius=50&start=40&pp=gQA8AAAAAAAAAAAAAAAB_gKCswAlAQEBCAaTfAH0ks0eMx6OWAFs8qFn5mAXWdKJ6aR3qATHIrN3AAAA&vjk=154982bd94331a66
73,e51d973220d764f3,Machine Learning Engineer,"San Francisco, CA",ENTRY_LEVEL,BACHELORS_DEGREE,fulltime,"Senior DevOps Engineer (Python Development) - job post Capital One 10,036 reviews New York, NY 10012 Full-time, Part-time Capital One 10,036 reviews Read what people are saying about working here. You must create an Indeed account before continuing to the company website to apply Apply on company site save-icon Job details Encouraged to Apply Fair chance Job Type Full-time Part-time 11 West 19th Street (22008), United States of America, New York, New York Senior DevOps Engineer (Python Development) At Capital One, security is our top priority and we are looking for a unique combination of an AWS Cloud Infrastructure Architect and a Software Developer preferably with Python expertise. We are AWS Infrastructure Developers to support Capital One Card Tech Data Scientists, to boost Capital One’s goal to reimagine banking. As a Capital One Software Engineer, you’ll have the opportunity to be on the forefront of driving a major Machine Learning technology transformation. What You’ll Do: Collaborate with and across Agile teams to design, develop, test, implement, and support technical solutions in full-stack development tools and technologies. Maintain high security ML build and train platform and support data scientists to create their state of the art ML/AI models. Share your passion for staying on top of tech trends, experimenting with and learning new technologies, participating in internal & external technology communities. Collaborate with digital product managers, and deliver robust cloud-based solutions that drive powerful experiences to help millions of Americans achieve financial empowerment. Utilize programming languages like Python or Scala. Container Orchestration services including Docker and Kubernetes, CD tools like Jenkins, AWS CodePipeline, CodeBuild etc. CM tools including Ansible and Terraform, and a variety of AWS tools and services Basic Qualifications: Bachelor’s degree At least 4 years of experience in DevOps Engineering (Internship experience does not apply) At least 2 years of experience with Cloud Native technologies (Amazon Web Services, Microsoft Azure, Google Cloud Platform) At least 2 years of Unix or Linux system administration experience Preferred Qualifications: 4+ years of professional software engineering/devops/MLE experience 3+ years of experience with AWS or 2+ year experience with current Associate+ Level Certificate 3+ years of experience coding with Python 2+ years of experience with Container Services 3+ years of experience with UNIX/Linux including basic commands and shell Proven experience of working with CI/CD systems. 1+ years of experience with network architecture and support 1+ years of experience working with Agile Methodologies 1+ years of experience with containers and microservices Familiarity with container orchestration (ECS, K8, EKS etc.) At this time, Capital One will not sponsor a new applicant for employment authorization for this position. The minimum and maximum full-time annual salaries for this role are listed below, by location. Please note that this salary information is solely for candidates hired to perform work within one of these locations, and refers to the amount Capital One is willing to pay at the time of this posting. Salaries for part-time roles will be prorated based upon the agreed upon number of hours to be regularly worked. Location is New York City: $161,900 - $184,800 for Senior Software Engineer Candidates hired to work in other locations will be subject to the pay range associated with that location, and the actual annualized salary amount offered to any candidate at the time of hire will be reflected solely in the candidate’s offer letter. This role is also eligible to earn performance based incentive compensation, which may include cash bonus(es) and/or long term incentives (LTI). Incentives could be discretionary or non discretionary depending on the plan. Capital One offers a comprehensive, competitive, and inclusive set of health, financial and other benefits that support your total well-being. Learn more at the Capital One Careers website. Eligibility varies based on full or part-time status, exempt or non-exempt status, and management level. No agencies please. Capital One is an Equal Opportunity Employer committed to diversity and inclusion in the workplace. All qualified applicants will receive consideration for employment without regard to sex, race, color, age, national origin, religion, physical and mental disability, genetic information, marital status, sexual orientation, gender identity/assignment, citizenship, pregnancy or maternity, protected veteran status, or any other status prohibited by applicable national, federal, state or local law. Capital One promotes a drug-free workplace. Capital One will consider for employment qualified applicants with a criminal history in a manner consistent with the requirements of applicable laws regarding criminal background inquiries, including, to the extent applicable, Article 23-A of the New York Correction Law; San Francisco, California Police Code Article 49, Sections 4901-4920; New York City’s Fair Chance Act; Philadelphia’s Fair Criminal Records Screening Act; and other applicable federal, state, and local laws and regulations regarding criminal background inquiries. If you have visited our website in search of information on employment opportunities or to apply for a position, and you require an accommodation, please contact Capital One Recruiting at 1-800-304-9102 or via email at RecruitingAccommodation@capitalone.com. All information you provide will be kept confidential and will be used only to the extent required to provide needed reasonable accommodations. For technical support or questions about Capital One's recruiting process, please send an email to Careers@capitalone.com Capital One does not provide, endorse nor guarantee and is not liable for third-party products, services, educational tools or other information available through this site. Capital One Financial is made up of several different entities. Please note that any position posted in Canada is for Capital One Canada, any position posted in the United Kingdom is for Capital One Europe and any position posted in the Philippines is for Capital One Philippines Service Corp. (COPSSC).",https://www.indeed.com/jobs?q=Machine+Learning+Engineer&l=New+York%2C+NY&sc=0kf%3Aattr%28FCGTU%7CHFDVW%7CQJZM9%7CUTPWG%252COR%29explvl%28MID_LEVEL%29jt%28fulltime%29%3B&radius=50&start=40&pp=gQA8AAAAAAAAAAAAAAAB_gKCswAlAQEBCAaTfAH0ks0eMx6OWAFs8qFn5mAXWdKJ6aR3qATHIrN3AAAA&vjk=e51d973220d764f3&advn=4418968771450209
