,job_id,job_title,location,experience,education,job_type,job_description,job_link
12,cad2933840fed46b,Machine Learning Engineer,"San Francisco, CA",ENTRY_LEVEL,BACHELORS_DEGREE,fulltime,"Technical Team Member – Distributed Data Science & Machine Learning - job post Agnik Berkeley, CA Full-time Apply now Apply now save-icon Job details Job Type Full-time Position: Technical Team Member – Distributed Data Science & Machine Learning Locations: (1) Columbia, MD, USA, (2) Berkeley, CA, USA. (3) Kolkata, India, (4) Remote (partial/full). Status: Open Overview Agnik, is a global connected car technology company (www.agnik.com) operating in 38 countries headquartered in USA with major consumer brands like Vyncs (https://www.vyncs.com) and several B2B products. Agnik is looking for several full-time members of its Technical Team for Distributed Data Science and Machine Learning. If you want to join a top notch technical team that develops novel algorithms/systems and very well familiar with statistics, machine learning, image analysis, and distributed systems then send a copy of your complete resume to jobs@agnik.com with a subject line “Technical Team Member - Distributed Data Science & Machine Learning”. Responsibilities As an employee of Agnik’s Distributed Data Science & Machine Learning Technical team Member, the primary focus of this position would be to design, develop, and implement novel data analysis and machine learning algorithms for connected car and mobility applications. Successful candidates must be knowledgeable and passionate about latest developments in field of machine learning and data science, should be a hands on developer. The position does not require extensive travel. Duties Include Develop real-time and off-line data analysis and machine learning algorithms/systems for embedded systems, mobile platforms, and cloud-based distributed environments. Dealing with big data management problems in real-time applications. Writing and reviewing code using Java/C#/C language for embedded and in-cloud environments for predictive modeling, control, and scene analysis. Developing geo-spatial data management and analysis software. Required Qualifications B.Tech/BS/M.Tech/MS/PhD. from a reputed University in Computer Science, Electrical/Electronic engineering (or other engineering/Science) with relevant experience. 1 – 5 years of experience in building data analysis, signal processing, and machine learning applications using Java/C/Python language, web-services in dot net environment, relational/non-relational databases, and developing distributed systems. Ability to communicate in fluent English. Effective communications skills and strong interpersonal skills, both orally and in written form. Distributed data management environments such as Hadoop and Spark. Ability to juggle multiple projects simultaneously. Attention to details, ability to prioritize and meet aggressive deadlines. Salary Commensurate with qualifications. Benefits, possible overseas trip. Locations (1) Columbia, MD, USA, (2) Berkeley, CA, USA. (3) Kolkata, India, (4) Remote (partial/full). If you require alternative methods of application or screening, you must approach the employer directly to request this as Indeed is not responsible for the employer's application process.",https://www.indeed.com/jobs?q=Data+Scientist&l=San+Francisco%5D+%23%2C+CA&sc=0kf%3Aattr%286QC5F%252COR%29explvl%28MID_LEVEL%29jt%28fulltime%29%3B&vjk=cad2933840fed46b
13,fb94d10aa18154e5,Machine Learning Engineer,"San Francisco, CA",ENTRY_LEVEL,BACHELORS_DEGREE,fulltime,"Machine Learning Engineer - Computer Vision and Geospatial Analytics - job post Buzz Solutions San Francisco Bay Area, CA Full-time You must create an Indeed account before continuing to the company website to apply Apply on company site save-icon Job details Job Type Full-time Job Location San Francisco Bay Area, CA, USA Type of Job Full Time Job Level Mid-Senior About the job JOB RESPONSIBILITIES Researching, developing and deploying advanced algorithms for image and video processing as well as computer vision. Working with Geospatial visual data such as Satellite imagery and LiDAR to build data ingestion and processing pipelines Developing Machine Vision AI models for Semantic Segmentation, Anomaly Detection and Entity Classification for Satellite imagery and LiDAR data Build Machine Vision and Computer Vision models for fault and anomaly detection for RGB and Infrared imagery Experience training models on VMs, Google Kubernetes and Compute Engines Build Predictive models and Causal Inference models for generating predictive insights Deploy dynamic models on cloud infrastructure and as service APIs Integrating ML models with our Software Platform Implementing ML/AI solutions for web and mobile platforms through the collaboration with Software engineers. To apply, send your resume (cover letter optional) to hiring@buzzsolutions.co Requirements A strong background in machine learning engineering . 3-5 years industry experience is ideal. MS/PhD in Machine Learning, Computer Science, Mathematics or related field with specialization in Machine Learning and/or Computer Graphics. Experience in image/video processing, computer vision, machine learning Strong experience working with RGB and Infrared imagery, Satellite imagery and LiDAR datasets Strong Experience working with CNNs, PyTorch, Fast RCNNs, Mask RCNNs, YOLO, ImageNets, Predictive models, Keras, Tensorflow Experience with Git, Docker, Compute Engine, VMs, Kubernetes Engine Experience deploying ML models in production Strong data science and machine learning skills Experience with Cloud Infrastructure such as Google Cloud Platform, AWS Experience with deploying Machine Learning models in production on Google Cloud Platform, AWS Proficient in Python, PyTorch, PySpark, OpenCV, MLFlow, KubeFlow, Docker Strong analytical and problem-solving skills About us Buzz Solutions safeguards the world's energy infrastructure by providing AI-based actionable insights and predictive analytics for power line and energy infrastructure inspections. We are disrupting the power utility industry by providing automation for inspection and maintenance operations for infrastructure, using our AI-powered software platform, and are a venture backed and funded startup looking for great talent to share our vision of energy industry transformation. Our solutions and technology allows the utilities to reduce current inspection operation costs by at least 50%, prevent power outages, prevent wildfires and manage their assets in an effective way. You will be working with a talented, passionate and hardworking team of engineers and product managers to build end-to-end Machine Learning products and pipelines that will be deployed for our customers in order to prevent issues such as power outages, forced shutdowns, impact of climate change on the aging grid infrastructure and preventing wildfires. Address San Francisco Bay Area, CA, USA",https://www.indeed.com/jobs?q=Data+Scientist&l=San+Francisco%5D+%23%2C+CA&sc=0kf%3Aattr%286QC5F%252COR%29explvl%28MID_LEVEL%29jt%28fulltime%29%3B&vjk=fb94d10aa18154e5
14,6da615ea01987b60,Machine Learning Engineer,"San Francisco, CA",ENTRY_LEVEL,BACHELORS_DEGREE,fulltime,"Audio AI Engineer - job post Zoom Video Communications, Inc. 14 reviews San Francisco Bay Area, CA • Remote From $98,500 a year -  Full-time Zoom Video Communications, Inc. 14 reviews Read what people are saying about working here. You must create an Indeed account before continuing to the company website to apply Apply on company site save-icon Job details Salary From $98,500 a year Encouraged to Apply Fair chance Job Type Full-time About This Role Responsibilities: Design and implement machine learning models on front end audio tasks to improve audio quality in Zoom’s online meeting (e.g. Noise Suppression, Voice Activity Detection, Speaker Recognition. Handle large amounts of audio data. Adapt machine learning and neural network algorithms and architectures to best fit the real-time requirement. Partner closely with other audio engineers to test and deploy machine learning models. Collaborate with cross-functional teams to integrate audio AI technology into new and existing products and services. Qualifications Master’s or PHD’s degree in Computer Science, Electrical Engineering, or related field Proficient in C++/C and Python. Experience with real-time speech related model optimization and Strong knowledge of real-time audio communication modules, such as NS, AGC, AEC, etc. Familiar with libraries for deep learning, such as TensorFlow, PyTorch, Keras, etc. Experience on audio signal processing, such as STFT, Log-Mel frequency, etc. Detail oriented, organized, ethical, responsible, and self-motivated. Team player, ability to work effectively in a matrix organization. Salary Range or On Target Earnings: Minimum: $98,500.00 Maximum: $197,000.00 In addition to the base salary and/or OTE listed Zoom has a Total Direct Compensation philosophy that takes into consideration; base salary, bonus and equity value. Information about Zoom’s benefits is on our careers page here . Note: Starting pay will be based on a number of factors and commensurate with qualifications & experience. We also have a location based compensation structure; there may be a different range for candidates in this and other locations. Work Styles at Zoom In most cases, you will have the opportunity to choose your preferred working location from the following options when you join Zoom: in-person, hybrid or remote. Visit this page for more information about Zoom's Workstyles . About Us Zoomies help people stay connected so they can get more done together. We set out to build the best video product for the enterprise, and today help people communicate better with products like Zoom Contact Center, Zoom Phone, Zoom Events, Zoom Apps, Zoom Rooms, and Zoom Webinars. We’re problem-solvers, working at a fast pace to design solutions with our customers and users in mind. Here, you’ll work across teams to deliver impactful projects that are changing the way people communicate and enjoy opportunities to advance your career in a diverse, inclusive environment. Explore Zoom: Hear from our leadership team Browse Awards and Employee Reviews on Comparably Visit our Blog Zoom with us! Find us on social at the links below and on Instagram We believe that the unique contributions of all Zoomies is the driver of our success. To make sure that our products and culture continue to incorporate everyone's perspectives and experience we never discriminate on the basis of race, religion, national origin, gender identity or expression, sexual orientation, age, or marital, veteran, or disability status. Zoom is proud to be an equal opportunity workplace and is an affirmative action employer. All your information will be kept confidential according to EEO guidelines. We welcome people of different backgrounds, experiences, abilities and perspectives including qualified applicants with arrest and conviction records and any qualified applicants requiring reasonable accommodations in accordance with the law. If you need any assistance or accommodations due to a medical condition, or if you need assistance accessing our website or completing the application process, please let us know by emailing us at careers@zoom.us . #LI-Remote",https://www.indeed.com/jobs?q=Data+Scientist&l=San+Francisco%5D+%23%2C+CA&sc=0kf%3Aattr%286QC5F%252COR%29explvl%28MID_LEVEL%29jt%28fulltime%29%3B&vjk=6da615ea01987b60
15,41d25964955611e7,Machine Learning Engineer,"San Francisco, CA",ENTRY_LEVEL,BACHELORS_DEGREE,fulltime,"Senior Machine Learning Engineer, Computer Vision - job post Lumafield San Francisco, CA Full-time Apply now Apply now save-icon Job details Encouraged to Apply Fair chance Job Type Full-time About Lumafield: Founded in 2019, Lumafield has developed the world's first accessible X-Ray CT scanner for engineers. Our easy-to-use scanner and cloud-based software give engineers the ability to see their work clearly, inside and out, at an extremely affordable price. Engineers make million-dollar decisions every day, and they need tools that give them the greatest possible insight into their products. By offering unprecedented visibility into products, as well as AI-driven tools that highlight problems and generate quantitative data, Lumafield promises to revolutionize the way complex products are created, manufactured, and used across industries. We are an impact driven company obsessed with providing the best value to our customers keeping their needs at the center of our evolution. Our team today includes world-class researchers and industrial designers, PhDs, creators, founders of successful startups, and zero egos. We are backed by top venture capital funds like Kleiner Perkins, Lux Capital, DCVC, Spark Capital, and others. The company is headquartered in Cambridge, MA and has an office in San Francisco, CA. About the Role: Lumafield is building the world’s largest dataset of industrial CT data and leveraging it to change the way the world makes things. Lumafield’s customers span in size from Fortune 500s to innovative startups and make everything from batteries to chapstick to medical devices to performance running shoes. Lumafield’s customers are applying CT in production applications that demand greater and greater levels of automation. As a computer vision machine learning engineer at Lumafield, you will develop machine learning models and machine learning-based features to automate a wide variety of manufacturing and inspection tasks. In addition to building models that ship to customers, you will also build models that support other aspects of Lumafield’s platform. This position is based in our San Francisco, CA office. What You'll Do: You will partner with the data engineering team to build and train models to rapidly develop models to perform classification regression, segmentation, and anomaly detection tasks using CT data As Lumafield’s first dedicated ML engineer, you will also make decisions about technology stack and how we approach vision problems The role is highly collaborative, results-oriented, and will involve seeing ML applications from concept through shipping and monitoring About You: Have developed, shipped, and monitored ML vision models in production using established languages (eg, Python) and frameworks (PyTorch, Keras, TensorFlow) Collaborate proactively with research and production engineering peers to deliver outcomes quickly Are familiar with the state of computer vision ML and are comfortable recommending tried and true models and approaches to well-defined vision tasks Know when to lean on conventional computer vision and when to leverage deep learning Have a deep understanding of machine learning fundamentals that you leverage effectively to rapidly develop new applications Have a masters or PhD in an applicable field and 5 years of professional production experience Bonus Points For: Familiarity with mechanical engineering or product design workflows Familiarity with 3D data representations (voxels, point clouds, meshes) A portfolio of previous work or Kaggle solutions that you can share Lumafield offers both competitive cash and equity compensation, as well as a health & wellness stipend, 401k, parental leave, flexible PTO, commuter benefits, company wide events and more! Lumafield is committed to building a team that represents a variety of backgrounds, perspectives, and skills, because the more inclusive we are, the better our work will be. Do you feel like your skills don’t meet every single requirement listed? We encourage you to apply anyway – If you’re excited about our technology, the opportunity, and are eager to learn more we’d love to hear from you! In keeping with our beliefs and goals, no employee or applicant will face discrimination or harassment based on: race, color, ancestry, national origin, religion, age, gender, marital domestic partner status, sexual orientation, gender identity, disability, genetic information or veteran status. Reach out if you want to be a part of what we are building. San Francisco Applicants: Review the San Francisco Fair Chance Ordinance guidelines applicable in your area. If you require alternative methods of application or screening, you must approach the employer directly to request this as Indeed is not responsible for the employer's application process.",https://www.indeed.com/jobs?q=Data+Scientist&l=San+Francisco%5D+%23%2C+CA&sc=0kf%3Aattr%286QC5F%252COR%29explvl%28MID_LEVEL%29jt%28fulltime%29%3B&start=10&pp=gQAPAAAAAAAAAAAAAAAB_ec4oAAKAQALoX3aoOYoKAAA&vjk=41d25964955611e7
16,7b33f99f8a824d68,Machine Learning Engineer,"San Francisco, CA",ENTRY_LEVEL,BACHELORS_DEGREE,fulltime,"Senior Software Engineer - Machine Learning - job post Saildrone 9 reviews Alameda, CA 94501 • Remote $150,000 - $220,000 a year -  Full-time Saildrone 9 reviews Read what people are saying about working here. You must create an Indeed account before continuing to the company website to apply Apply on company site save-icon Job details Salary $150,000 - $220,000 a year Job Type Full-time About Us At Saildrone, we sustainably explore, map, and monitor the oceans to understand, protect, and preserve our world. Saildrone provides real-time access to critical data from any ocean on earth, 24/7/365, and uses proprietary software applications to transform that data into actionable insights and intelligence. Saildrone’s fleet of uncrewed surface vehicles (USVs), powered by renewable wind and solar power, have a minimal carbon footprint and operate without the need for a crewed support vehicle. We work with governments, civil agencies, foundations, universities, and private companies around the globe to drive better information about our oceans and seas—from sailing into the eye of a category 4 hurricane to obtain new data about how storms intensify collecting new CO2 data in hard-to-reach areas, and counting fish biomass to inform sustainable fishery management, to mapping the ocean floor and reducing illegal fishing and drug trafficking. As a result of our work, we have been included on Fast Company’s annual list of the “World’s Most Innovative Companies for 2022”, earned the 2022 Ocean Awards’ Innovation Award, won “Best Tech For Good” in the 2022 Timmy Awards, and were recognized by Andreessen-Horowitz’s American Dynamism 50 list of the “Top 50 companies kickstarting American renewal. Saildrone’s hurricane mission was included as one of the New York Times’ “21 Things That Happened for the First Time in 2021,” and Popular Science's “100 Greatest Innovations of 2021.” We are based in Alameda, CA, with offices in Washington DC, St. Petersburg, FL, and Fall River, MA, and operate our missions worldwide. We are backed by top-tier investors in the frontier-tech and sustainability sectors, including Social Capital, Capricorn, Lux Capital, BOND Capital, and Emerson Collective. This is an exciting opportunity with a fast-growing team at the cutting-edge intersection of big data services and autonomous hardware. You will be an integral part of a high-performing multi-disciplinary delivering high impact for humanity and future generations. The Role As a software engineer on the Machine Learning team, you will help to develop and harden our MLOps stack, enabling easily definable datasets, robust and reproducible model training, efficient inference and evaluation, and smooth model deployment to Saildrones. Responsibilities Write efficient, well-tested, reliable and maintainable code following CI/CD best-practices. Optimize machine learning pipelines and models across multiple performance dimensions- runtime, compute resources, stakeholder-derived performance metrics, etc. Work with machine learning and software engineers to implement and deploy performant models that leverage Saildrone’s unique sensor suite (e.g., cameras, radar systems, bathymetric sensors, hydrophones). Collaborate cross-functionally with oceanographic domain experts and the machine learning, perception, and data pipeline teams to ensure sensor data quality and runtime performance of the models at sea and at port. Required skills and experience Strong Python and C++ skills to enable new types of models in the training pipelines and deployed on the drones Experience developing ML Ops pipelines that touch the full ML lifecycle, including maintaining ML models under continuous development Experience with one or more ML frameworks (e.g., PyTorch, TensorFlow, Caffe) Experience with one or more cloud computing platforms Experience with runtime libraries for ML models, such as TensorRT BS in a related field 5+ years professional experience Desired skills and experience MS, PhD in a related field Experience with sensor fusion Experience fielding ML models on robots, cars, cell phones or other edge devices Experience with oceanographic, maritime, and/or acoustic data Knowledge of bazel build systems and python bindings Location : This position is remote friendly but based out of Alameda, CA. Our waterfront office offers beautiful views of San Francisco Bay in always sunny Alameda. Even our walls have good karma, our offices mix software development with a hardware production line in the former airplane hangar used to film 'The Matrix'. Benefits : Medical, dental and vision plans for you and your dependents. Short and relaxing ferry ride from the Ferry Building for SF residents Enhanced Parental Leave Programs Competitive benefits including excellent medical, life insurance, 401k plan Catch up on the latest news about us : Interagency Public-Private Partnership Sends Uncrewed Saildrone to Explore Remote Alaskan Waters - NOAA OER (August 11, 2022) An Unprecedented View Inside a Hurricane – EOS (May 6, 2022) Meet the sailing robots trying to solve climate change – The Hill (Mar. 18, 2022) They Sailed Into a Hurricane, Now these Unmanned Saildrones are Seeking Data on Our Carbon Uptake – CNN (Dec. 9, 2021) Saildrone Catches a $100M C Breeze to Build More Robo-boats – TechCrunch (Oct. 18, 2021) With A Sight, Sound And Radar Picture, Saildrone Could Build An AI Database Of Everything In The Ocean – Forbes (Aug. 16, 2021) Changing Arctic Environment Could Also Change Technologies Needed to Protect It, Experts Say – SeaPower Magazine (Aug. 2, 2021) Autonomous Research Vehicle Completes Ocean Crossing from San Francisco to Hawaii – Hydro International (July 13, 2021) Saildrone Featured Videos Playlist We are an equal opportunity employer and value diversity at our company. We do not discriminate on the basis of race, religion, color, national origin, gender, sexual orientation, age, marital status, veteran status, or disability status. Individual compensation packages are based on geographic location, scope of the role, relevant experience, and the ability to deal with complexity and problem solve within our organization, among other factors Individuals who require employer sponsorship to remain employed in the United States now or in the future will not be considered for hire for certain positions. In accordance with Saildrone’s mandatory employee COVID-19 vaccination policy, please be advised that all employees are required to be vaccinated and boosted to safeguard the health of our employees and their families, our customers and visitors and the community at large. Any unsolicited resumes/candidate profiles submitted through our website or to personal email accounts of employees of Saildrone are considered property of Saildrone and are not subject to payment of agency fees. #LI-AG1 #LI-JK1 #LI-LP1 This is a remote position.",https://www.indeed.com/jobs?q=Data+Scientist&l=San+Francisco%5D+%23%2C+CA&sc=0kf%3Aattr%286QC5F%252COR%29explvl%28MID_LEVEL%29jt%28fulltime%29%3B&start=10&pp=gQAPAAAAAAAAAAAAAAAB_ec4oAAKAQALoX3aoOYoKAAA&vjk=7b33f99f8a824d68
