,job_id,job_title,location,experience,education,job_type,job_description,job_link
0,08cc73c20e61b3d7,Machine Learning Engineer,"San Francisco, CA",ENTRY_LEVEL,BACHELORS_DEGREE,fulltime,"Data Scientist - job post Focal Systems 11 reviews Burlingame, CA • Remote Full-time Focal Systems 11 reviews Read what people are saying about working here. Apply now Apply now save-icon Job details Job Type Full-time Data Scientist Burlingame, CA or Remote Who we are Focal Systems is the industry leader in retail AI solutions. We are a Silicon Valley based startup that has more than doubled in size every year since inception. Our mission is to automate and optimize brick and mortar retail using deep learning computer vision. We have been deployed at scale with the top retailers in the world. We are looking for smart, creative and passionate people who love to learn, enjoy thinking critically, and want to help build a great and enduring company! What we are looking for We generate billions of data points every minute that we utilize to help our clients optimize their store operations. As the Data Scientist, you will be responsible for managing our end to end data pipeline from image to insight. Reporting to the CEO and Head of Product, you will work very closely with our Product, Infrastructure and Deep Learning teams. What you will do Identify data, metrics and analyses needs; Initiate, develop and maintain data pipelines and data models that powers dashboards and data products with outstanding craftsmanship Synthesize data findings into compelling stories and communicate them throughout Focal Systems Act as a strategic partner to Head of Product and Focal executives; initiate and execute on data-driven analyses to help prioritize opportunities and provide actionable recommendations Prototype new analytics & machine learning models that improve both our insights and the product directly Work to drive new data initiatives, automation of reports, and establish best practices Work to scale our insights through better systems and automation Maximize efficiency and productivity through extensive process analysis and interdepartmental collaboration Design and implement processes and operational procedure around our data pipeline Analyze and report on performance metrics such as throughput, accuracy and cost for our data operations Work closely with product & engineering on building out the tools and platforms utilized in our data processing What you need to be successful At least a BS degree (MS / PhD degree preferred) in Engineering, Math, or Computer Science with 5+ years relevant experience Deep understanding of statistics Proven ability to manage complex data analysis Stable job history with a ""go-the-distance"" attitude Excellent communication, presentation and demonstration skills Experience with data analytics/business intelligence tools Deep experience with SQL; knowledge of Python strongly preferred Uphold our values & mission Startup mentality, team player and willing to work 40+ hours a week Why Focal Systems Strong Values and Mission: We are a tightly-knit team with an ambitious mission and a strong set of core values, which define our approach to business and have successfully guided us since in¬ception. Exceptional Team: We are a team of hard-working, fun-loving professionals from some of the most eminent universities, research labs, and tech companies of our time. We pride ourselves on recruiting exceptional individuals to help us redefine the state-of-the-art. Outstanding Partners: We work with 10+ of the largest retailers in the world and have a world-class roster of investors, advisors and partners to support & advise us in our endeavors. What we offer We care deeply about the health, happiness, and wellbeing of all of our employees. We offer: Competitive Salary & Attractive Stock Health Insurance Catered lunches Paid Time Off Quarterly Team Retreats Education grants If you require alternative methods of application or screening, you must approach the employer directly to request this as Indeed is not responsible for the employer's application process.",https://www.indeed.com/jobs?q=Data+Scientist&l=San+Francisco%5D+%23%2C+CA&sc=0kf%3Aattr%286QC5F%252COR%29explvl%28MID_LEVEL%29jt%28fulltime%29%3B&vjk=08cc73c20e61b3d7
1,cea669957604337f,Machine Learning Engineer,"San Francisco, CA",ENTRY_LEVEL,BACHELORS_DEGREE,fulltime,"Data Scientist - job post FocusKPI Inc. San Bruno, CA • Remote $50 - $70 an hour -  Full-time Apply now Apply now save-icon Job details Salary $50 - $70 an hour Job Type Full-time FocusKPI is seeking a Data Scientist to enable deep media insights through advanced analytics for our client, one of the largest retailers/e-commerce companies in the U.S.. Work Location: Remote in the U.S. Duration: 6 months contract with potential for extension and conversion, depending on budget and performance Pay range: $50/hour to $70/hour Responsibilities: Perform hands-on coding to retrieve and analyze large datasets using Python and SQL Integrate disparate data sources and leverage state-of-the-art analytics best practices to deliver integrated actionable insights to partners and stakeholders Manage and streamline data extraction process with great attention to details Assess the potential usefulness, validity, and rigor of new data sources Work with cross-functional team to ensure that the quality of the data are of the highest standard Help with media mix models to connect the impact of marketing tactics and business short-term and long-term outcomes Qualifications: Ph.D. degree in statistics/mathematics, engineering, computer science, economics, or a related field 3+ years of industry experience in data, analytics, and data science role Experience with advertising, measurement, and/or digital marketing analytics Experience with advertising technology platforms, Ad servers, DSPs, DMPs, etc. Proficient coding skills ( SQL/Python/R ) Deep knowledge of relational database capabilities and experience with big data technologies (Hive/Hadoop) Proficient BI/BA data visualization tools ( Tableau , PowerBI, ThoughtSpot, Looker, etc.) Experience working with Marketing Mix Modeling (MMM) and/or Multi-Touch Attribution Models (MTA) is a must Experience with Modeling and Machine learning Experience with cloud technologies such as GCP, AWS, Azure Experience in integrating, structuring, and analyzing large amounts of data from diverse sources Strong project management skills and attend-to-detail documentation skills. Strong written and verbal communication with the ability to communicate complex technical topics clearly to a range of audiences and to ‘tell a story that provides insight into the business Passion for working in a fast-paced agile environment. A collaborative mindset and sense of curiosity Experience with predictive modeling algorithms and optimization techniques Experience applying statistics to business problems Thank you! FocusKPI Hiring Team Founded in 2010, FocusKPI, Inc. (FocusKPI) is a data science and technology firm specializing in predictive analytics practice and methodologies. FocusKPI is a US company headquartered in Silicon Valley, California with an East Coast office in Boston, Massachusetts. NOTICE: Please be aware of fraudulent emails regarding job postings, job offers and fake checks. FocusKPI's recruiting team will strictly reach out via @focuskpi.com email domain. If you have received fraudulent emails now or in the past, please report it to https://reportfraud.ftc.gov/ . The domain @focuskpijobs.com is fraudulent and not related to FocusKPI. Please do not not reply or communicate to anyone with @focuskpijobs.com. p9ol9nsreY If you require alternative methods of application or screening, you must approach the employer directly to request this as Indeed is not responsible for the employer's application process.",https://www.indeed.com/jobs?q=Data+Scientist&l=San+Francisco%5D+%23%2C+CA&sc=0kf%3Aattr%286QC5F%252COR%29explvl%28MID_LEVEL%29jt%28fulltime%29%3B&vjk=cea669957604337f
2,fbe74a10098a829f,Machine Learning Engineer,"San Francisco, CA",ENTRY_LEVEL,BACHELORS_DEGREE,fulltime,"Senior Data Scientist- Flexible Location - job post PG&E Corporation 967 reviews Oakland, CA 94612 • Hybrid remote Full-time PG&E Corporation 967 reviews Read what people are saying about working here. You must create an Indeed account before continuing to the company website to apply Apply on company site save-icon Job details Job Type Full-time Requisition ID # 142842 Job Category: Accounting / Finance Job Level: Individual Contributor Business Unit: Gas Engineering Work Type: Hybrid Job Location: Oakland; Alameda; Alta; Angels C& Antioch; Auberry; Auburn; Avenal; Avila Beach; Bakersfield; Balch C& Bear Valley; Belden; Bellota; Belmont; Benicia; Berkeley; Brentwood; Brisbane; Buellton; Burney; Buttonwillow; Calistoga; Campbell; Canyon Dam; Canyondam; Capitola; Caruthers; Chico; Clearlake; Clovis; Coalinga; Colusa; Concord; Concord; Corcoran; Cottonwood; Cupertino; Daly City; Danville; Davis; Dinuba; Downieville; Dublin; Emeryville; Eureka; Fairfield; Folsom; Fort Bragg; Fortuna; Fremont; French C& Fresno; Fresno; Fulton; Garberville; Geyserville; Gilroy; Grass Valley; Guerneville; Half Moon Bay; Hayward; Hinkley; Hollister; Holt; Huron; Jackson; Kerman; King City; Lakeport; Lemoore; Lincoln; Linden; Livermore; Lodi; Loomis; Los Banos; Lower Lake; Madera; Magalia; Manteca; Manton; Mariposa; Martell; Marysville; Maxwell; Menlo Park; Merced; Meridian; Millbrae; Milpitas; Modesto; Monterey; Montgomery Creek; Morgan Hill; Morro Bay; Moss Landing; Mountain View; Napa; Needles; Newark; Newman; Novato; Oakdale; Oakhurst; Oakley; Olema; Orinda; Orland; Oroville; Palo Alto; Palo Cedro; Paradise; Parkwood; Paso Robles; Petaluma; Pioneer; Pismo Beach; Pittsburg; Placerville; Pleasant Hill; Point Arena; Potter Valley; Quincy; Rancho Cordova; Red Bluff; Redding; Richmond; Ridgecrest; Rio Vista; Rocklin; Roseville; Round Mountain; Sacramento; Salinas; San Bruno; San Carlos; San Francisco; San Francisco; San Jose; San Luis Obispo; San Mateo; San Rafael; San Ramon; San Ramon; Sanger; Santa Cruz; Santa Maria; Santa Nella; Santa Rosa; Selma; Shaver Lake; Sonoma; Sonora; South San Francisco; Springville; Stockton; Storrie; Taft; Tracy; Turlock; Twain; Ukiah; Vacaville; Vallejo; Walnut Creek; Wasco; Washington; Watsonville; West Sacramento; Wheatland; Whitmore; Willits; Willow Creek; Willows; Windsor; Winters; Woodland; Yuba City Department Overview Gas Operations is focused on ensuring the safe and reliable flow of natural gas to our customers. As a whole, Gas Operations is responsible for all aspects of PG&E's gas distribution and transmission operations, including planning, engineering, maintenance and construction, restoration and emergency response.This position is located within the Transmission Integrity Management department within PG&E's Asset Management and Systems Operation (AM&SO) Organization. Gas Operations AM&SO is responsible for maintaining over 6,000 miles of gas transmission pipelines throughout California. This Department is responsible for the overall administration and implementation of the Transmission Integrity Management Program (TIMP) and the evaluation of overall risk to the gas transmission system. This includes overseeing the completion of integrity management assessments, identifying High Consequence Areas (HCA), maintaining PG&E's assessment plan as required by 49 CFR Subpart O, and managing PG&E's overall gas risk management program. Position Summary Designs, develops, and executes scripts, programs, models, algorithms, and processes, using structured and unstructured data from disparate sources and sizes, generating actionable insights for strategy and policy development, process improvement, and product enhancement. Works on technical development phases: data engineering, analytics/modeling, and visualization/user interface. Interacts with technical and non-technical clients to resolve analysis and technical issues. Works with teams, clients, and senior leadership throughout the development cycle practicing continuous improvement. Data scientist will review current threat algorithm to determine correlations between data. Tasks may include validation of current risk model, comparison of events to current risk score, implement several different machined learned models to determine performance/optimization. Individual must be comfortable working with a wide range of stakeholders and be able to work independently to discover hidden solutions within the data. Must be able to utilize large data sets for a variety of data mining/data analysis methods. This position is hybrid, working from your remote office and your assigned work location based on business need. The assigned work location will be within the PG&E Service Territory. Incumbent should expect to travel to San Ramon, CA for projects, meetings, trainings, etc. Location is flexible within the PG&E Service Territory, please note hiring leader will make final decision of what are appropriate headquarters for the role based on business need. Position could require a minimal amount of travel. PG&E is providing the salary range that the company in good faith believes it might pay for this position at the time of the job posting. This compensation range is specific to the locality of the job. The actual salary paid to an individual will be based on multiple factors, including, but not limited to, specific skills, education, licenses or certifications, experience, market value, geographic location, and internal equity. Although we estimate the successful candidate hired into this role will be placed towards the middle or entry point of the range, the decision will be made on a case-by-case basis related to these factors.​ A reasonable salary range is: ​ Bay Area Minimum: $118,000 Bay Area Maximum: $188,000 &/OR​ California Minimum: $112,000 California Maximum: $179,000 This job is also eligible to participate in PG&E’s discretionary incentive compensation programs. Qualifications- Minimum Qualifications: Bachelor’s Degree in Computer Science, Econometrics, Economics, Engineering, Mathematics, Applied Sciences, Statistics or job-related discipline or equivalent experience Job-related experience (e.g. data analytics and modeling), 5 years, OR Master’s Degree and job-related experience, 3 years, OR Doctorate Desired Qualifications: Relevant industry (electric or gas utility, renewable energy, analytics consulting, etc.) experience, 1 year Knowledge, Skills, Abilities and (Technical) Competencies Experience with the elements of the data management lifecycle (data acquisition, security, storage, architecture, integration, governance, compliance, reference data management, data quality and metadata) and best practices Knowledge of relevant project management tools, theories and techniques as needed to support the timely and successful execution of project requirements Knowledge of commonly used data science and/or operations research programming languages, packages, and tools Understanding of data science/machine learning models and algorithms Ability to synthesize complex information into clear insights and translate those insights into decisions and actions Ability to clearly communicate complex technical details and insights to colleagues and stakeholders Knowledge of the mathematical and statistical fields that underpin data science Ability to collaborate and/or work on a team Knowledge of systems thinking and structuring complex problems Responsibilities Shares and collaborates with other PG&E data science professionals. Works closely with domain experts to develop relevant domain knowledge in the electric and gas utility, as well as knowledge of related datasets. Gathers, cleans, transforms, and/or reduces data from dissimilar sources from across PG&E. Works with business partners to advance business processes, based on analytical findings. Applies machine learning and other analytical modeling methods to develop robust and reliable analytical models, including visualizations, within PG&E’s software development environment. Documents data sources, methodology, and model evaluation metrics. Serves as the technical lead for the development of simple models. Develops and presents summary presentations to management. Position will work with engineers on calibration of risk model through field findings. Utilization of field findings can be used to develop machine learned models to better fit data.",https://www.indeed.com/jobs?q=Data+Scientist&l=San+Francisco%5D+%23%2C+CA&sc=0kf%3Aattr%286QC5F%252COR%29explvl%28MID_LEVEL%29jt%28fulltime%29%3B&vjk=fbe74a10098a829f
3,2130f3fbae765bec,Machine Learning Engineer,"San Francisco, CA",ENTRY_LEVEL,BACHELORS_DEGREE,fulltime,"Manager, Data Scientist - job post Rakuten San Francisco, CA $160,000 - $190,000 a year -  Full-time You must create an Indeed account before continuing to the company website to apply Apply on company site save-icon Job details Salary $160,000 - $190,000 a year Job Type Full-time Job Description: Do you love solving complex business problems using statistical modeling and machine learning? Do you want to contribute to the transformation of a business at scale, introducing automation and optimization across products and business systems? Would you enjoy managing/guiding a team of data scientists while keeping your hands dirty with your own machine learning projects? Rakuten Rewards is looking for a Data Science Manager / Senior Data Scientist. The Data Science team supports a wide spectrum of business domains including user experience personalization, forecasting and optimization of advertising campaigns, anomaly detection/alerting, etc. The scope of our work is broad and still expanding. As a leader within the Rakuten Rewards Data Science team, you will have the opportunity to create broad impact across our products and operations. KEY RESPONSIBILITIES This role includes significant leadership responsibilities Organizational leadership: responsible for employee evaluation and growth Product/project leadership: supporting business problem definition, ML problem formulation, etc. Technical leadership: leading definition of ML projects, insightfully supporting technical reviews, etc. It also includes responsibilities for individual contribution. Over half of your time will be devoted to R&D. You will contribute concrete ML data products to the business. ML project management ML problem formulation, model selection, feature engineering Deep learning model architecture and implementation Offline experimentation, evaluation, simulation Model deployment and testing REQUIREMENTS (Knowledge, Skills, Abilities) Strong problem solving and communication skills Strong mathematical and statistical skills Demonstrated management ability Experience with big data and machine learning frameworks. Python, sklearn, pytorch preferred. Practical experience with multiple ML problem types (e.g. supervised/unsupervised, regression/classification) Expertise with classical machine learning and deep learning Experience and demonstrated expertise through all phases of ML product development Experience in ad-tech and/or consumer services a plus QUALIFICATION REQUIREMENTS Master's or PhD degree in AI/ML, computational mathematics, computer science, statistics, physics or related field. 5+ years industry experience applying data science, machine learning methods, statistical computing and modelling to real-world problems 2+ years’ experience managing a team At the time of posting, Rakuten expects the base salary for this role will be between $160,000.00 - $ 190,000 .00. Individual compensation will vary based on job-related factors, including the skills, qualifications, and experience of the successful candidate as well as business need and geographic location. The successful applicant for this role will be eligible for discretionary bonus, health, vision, dental insurance, 401k matching, PTO, Volunteer Time Off (VTO), and other employee benefits as the company implements.",https://www.indeed.com/jobs?q=Data+Scientist&l=San+Francisco%5D+%23%2C+CA&sc=0kf%3Aattr%286QC5F%252COR%29explvl%28MID_LEVEL%29jt%28fulltime%29%3B&vjk=2130f3fbae765bec
4,200eee6d56488486,Machine Learning Engineer,"San Francisco, CA",ENTRY_LEVEL,BACHELORS_DEGREE,fulltime,"Applied Scientist - Personal and Platform Safety - job post Uber 2,766 reviews San Francisco, CA 94103 $149,000 a year -  Full-time Uber 2,766 reviews Read what people are saying about working here. You must create an Indeed account before continuing to the company website to apply Apply on company site save-icon Job details Salary $149,000 a year Job Type Full-time About the role In this role, you will partner closely with product management, operations, engineering, and actuarial teams, to build data science and machine learning solutions to support safety and insurance initiatives! You will use data platforms such as Hive and Spark and will work on structured and unstructured data to build machine learning models that will play an influential role in helping drive critical product and policy decisions. What you'll do Develop and lead statistical and machine learning efforts in relation to your projects. Our projects use machine learning, experimentation, signal processing, time series analysis, geospatial analysis, and more! We'll give you as many challenges as you can seek and help you grow to tackle more. Use large scale data processing such as Spark, Hive, and Uber's proprietary machine learning platform, and more. Collaborate with engineering to write and implement algorithms in production. Design and analyze experimental and observational studies; communicate findings; facilitate launch decisions. Work with a cross-functional team that includes product management, engineering, operations and others to complete projects. Basic Qualifications Ph.D., M.S. or Bachelors degree in Statistics, Economics, Machine Learning, Operations Research, or other quantitative fields. (If M.S. degree, a minimum of 1+ years of industry experience required and if Bachelor's degree, a minimum of 2+ years of industry experience as a Data Scientist or equivalent). Knowledge of underlying mathematical foundations of statistics, machine learning, optimization, economics, and analytics. Knowledge of experimental design and analysis. Experience with exploratory data analysis, statistical analysis and testing, and model development. Ability to use Python to work efficiently at scale with large data sets. Proficiency in languages and tools like SQL, R, and Spark. Preferred Qualifications Experience in algorithm development and prototyping. Experience with productionizing algorithms for real-time systems. Well-honed communication and presentation skills: able to transform a complex quantitative analysis into a succinct executive-level report. Uber is proud to be an Equal Opportunity/Affirmative Action employer. All qualified applicants will receive consideration for employment without regard to sex, gender identity, sexual orientation, race, color, religion, national origin, disability, protected Veteran status, age, or any other characteristic protected by law. We also consider qualified applicants regardless of criminal histories, consistent with legal requirements. If you have a disability or special need that requires accommodation, please let us know by completing this form. Offices continue to be central to collaboration and Uber’s cultural identity. Unless formally approved to work fully remotely, Uber expects employees to spend at least half of their work time in their assigned office. For certain roles, such as those based at green-light hubs, employees are expected to be in-office for 100% of their time. Please speak with your recruiter to better understand in-office expectations for this role. For San Francisco, CA-based roles: The base salary range for this role is $149,000 per year - $165,500 per year. You will be eligible to participate in Uber's bonus program, and may be offered an equity award & other types of comp. You will also be eligible for various benefits. More details can be found at the following link https://www.uber.com/careers/benefits.",https://www.indeed.com/jobs?q=Data+Scientist&l=San+Francisco%5D+%23%2C+CA&sc=0kf%3Aattr%286QC5F%252COR%29explvl%28MID_LEVEL%29jt%28fulltime%29%3B&vjk=200eee6d56488486
