,job_id,job_title,location,experience,education,job_type,job_description,job_link
20,a516c37c3e0aa19e,Machine Learning Engineer,"San Francisco, CA",ENTRY_LEVEL,BACHELORS_DEGREE,fulltime,"Director of Data Science - job post Qcells 107 reviews San Francisco, CA • Hybrid remote Full-time Qcells 107 reviews Read what people are saying about working here. Apply now Apply now save-icon Job details Job Type Full-time This is a San Francisco based position that is currently remote and will have a hybrid schedule once we return to office. We are open to candidates willing to relocate to the San Francisco Bay Area. ABOUT GELI Geli (Growing Energy Labs, Inc.) provides software and business solutions to design, connect, and operate energy storage systems ranging in size from residential to utility-scale, as well as grid-tied, microgrid, and off-grid systems. Geli’s suite of products creates an ecosystem where project developers, OEMs, financiers, and project operators can deploy advanced energy projects using a seamless hardware-agnostic software platform. Geli is a subsidiary of Hanwha Q CELLS, one of the world’s largest photovoltaic manufacturers most recognized for its high-performance, high-quality solar cells and modules. OUR VISION Geli is committed to helping make the planet a cleaner, better place to live, both with our software products and through our everyday actions. Imagine a world where there is less reliance on non-renewable power, where you source your electricity from your neighbors rather than from power stations hundreds of miles away and software makes the best possible use of the solar, wind, and battery storage available. This is our vision. We are looking for enthusiastic colleagues that are not only fluent in technology, but also share our vision of a world running on 100% renewable energy. ABOUT THIS JOB As Director/Senior Director of Data Science, you will be responsible for managing our Data Science team, which currently includes Optimization, Forecasting, Machine Learning, Machine Learning Ops, and Data Engineering. This is a high-visibility, high-impact position in a fast-growing team with an opportunity to contribute to overall business strategy and product vision. PRIMARY RESPONSIBILITIES You will help the team build state of the art, production quality software that solves key business problems, while working with other Software (Cloud, IoT), DevOps, Hardware, Product management and System test teams. You will grow and lead a globally distributed team of 30+ people (US, AUS, Seoul, UK, India) You will serve, inspire, and empower the team while eliminating roadblocks to help them contribute and realize their full potential. You will be responsible for the vision, roadmap, and execution of the Data Science team charter. Determine and prioritize the team’s work based on business needs. Support career paths, mentorship, and growth for team members. Provide technical requirements for key data infrastructure decisions. Collaborate with other leaders and executives to build data-informed business strategy and product roadmaps. Excel at the intersection of leadership, business outcomes, data science and software engineering. Required Qualifications PhD or M.S. in science or engineering, math, statistics or equivalent combined education and work experience is preferred. 10+ years of technical experience in a data science role or equivalent 5+ years management experience building and leading data science teams. Note: Strong technical & people leadership skills are a must. 5+ years’ experience working with production software Proficient at executing cross-functional projects and coordinating with leadership across multiple teams Ability to translate complex business problems into achievable and actionable analytic projects A willingness to collaborate and communicate with the broader team to drive cross-team and cross-organization initiatives forward A high sense of urgency and commitment Experience in Energy domain – Solar, Wind, Energy Storage, Smart Grid, Energy Markets Preferred Qualifications Deep understanding and experience with time series forecasting, ML techniques (e.g. ARIMA, tree-based models, neural network), and tools (e.g. TensorFlow, PyTorch, Scikit-Learn, Keras). Experience with load, solar, price forecasting and energy market. Experience with optimization techniques (deterministic, stochastic) and optimization packages (Pyomo, Cvxpy, Gurobi, Express, Cplex) Experience with applying statistical modeling, ML, optimization techniques to the data in power and energy domain Experience in ML Ops: container orchestration, code isolation, data versioning, and graph-based computation. Experience with various cloud technologies (AWS, Kubernetes, Docker, Microservices) Good understanding of software development and deployment processes (CI/CD, Agile, Source Control Management) Experience building complex, automated data processes in Python, SQL, AWS, Airflow, Snowflake, RPA, and other technologies BENEFITS OF WORKING AT GELI Competitive salary commensurate with experience Competitive benefits offerings Convenient accessible location in downtown San Francisco Flexible work-from-home-office opportunities, as determined by position and job duties WORK ENVIRONMENT Make a difference: join a group of people who are passionate about renewable energy Have an impact: the company is still small enough that everyone’s contribution has a significant impact to the success of the company Many opportunities to lead teams, projects, and contribute to development Casual professional working environment: there’s no need to dress up, just present your best self Work collaboratively in a diverse environment- we commit to reaching better decisions by respecting opinions and working through disagreements DIVERSITY We value the insights that a diverse team can bring. We encourage applications from members of groups that have been traditionally underrepresented in tech. Growing Energy Labs, Inc. provides equal employment opportunities (EEO) to all employees and applicants for employment without regard to race, color, religion, sex, national origin, age, disability, or genetics. If you require alternative methods of application or screening, you must approach the employer directly to request this as Indeed is not responsible for the employer's application process.",https://www.indeed.com/jobs?q=Data+Scientist&l=San+Francisco%5D+%23%2C+CA&sc=0kf%3Aattr%28EXSNN%7CFCGTU%7CHFDVW%7CQJZM9%7CUTPWG%252COR%29explvl%28SENIOR_LEVEL%29jt%28fulltime%29%3B&start=10&pp=gQAPAAAAAAAAAAAAAAAB_gIBfgAUAQEBBw9fTuqBM3BdnXv9JhK0OSMAAA&vjk=a516c37c3e0aa19e
21,9c93fe7798f65477,Machine Learning Engineer,"San Francisco, CA",ENTRY_LEVEL,BACHELORS_DEGREE,fulltime,"Data Science Senior Manager, Measurements - job post Genentech (part of Roche) 1,023 reviews San Francisco, CA Full-time Genentech 1,023 reviews Read what people are saying about working here. You must create an Indeed account before continuing to the company website to apply Apply on company site save-icon Job details Job Type Full-time The Position WHO WE ARE Our Strategic Analytics & Intelligence (SAI) team isn’t just deciphering data. We’re here to help solve the world’s most complex healthcare challenges and improve the lives of patients. With a mix of competitive intelligence, market research, data science, advanced analytics, access, and forecasting, SAI unlocks key insights for our internal partners that ultimately benefit healthcare providers and patients. Even if you’ve never worked in biotech, you’ll establish yourself as an expert alongside other specialists. Plus, you can gain new experiences across marketing disciplines, therapeutic areas, and commercial operations. The entire time, you’ll be surrounded by a diverse and inclusive team that aims to reflect the world we serve. CDS, which is the CMG Data Science team within SAI, exists to help the CMG (Commercial, Medical and Government Affairs) organization achieve its vision by unlocking value from data quickly and effectively. As a center of excellence, the CDS team has three primary remits: owning advanced Data Science Strategy and Innovation for SAI and CMG; application of Data Science to CMG enterprise priorities; and driving the Data Science capability on behalf of the SAI department. The team leverages advanced data science capabilities, working across CMG to develop strategic and holistic solutions by identifying and leading innovative analytics projects & pilots, to enable Genentech to deliver for our customers. The CDS team is committed to delivering production level work and builds ML systems with an enterprise mindset. CDS is involved in Genentech’s digital transformation to build an Integrated Customer Experience (ICX) which utilizes a large range of data sources (both structured and unstructured) as well as AI/ML algorithms to find patterns and deliver an automated experience to the end user. An excellent Data Science Senior Manager in the CDS team is independent, a great communicator, innovative, collaborative and visionary. The goal of the Measurement capability within CDS is to quantify the impact of CMG’s ICX and other business initiatives by applying machine learning models in areas such as marketing attribution modeling, forecasting value estimation, and omnichannel optimization - and making insights available to decision-makers at the speed of business. WHO YOU ARE We are looking for a seasoned leader and data scientist with an extensive track record in designing, developing, and evaluating ML models which focus on optimization of marketing strategies and tactics, customer journey and perceptions within campaigns, and revenue impact. As a Data Science Senior Manager - Measurement, you: Are energized to work collaboratively with partners and stakeholders across the business to apply, innovate, and deploy machine learning algorithms and data science methods for new measurement Will inform and empower Commercial and Medical stakeholders in marketing, finance, strategy teams, and the field to make data-driven decisions for patient benefit Drive to optimize investments and activities so that Genentech can create ever-improving, integrated customer experiences across brands and channels Deliver these benefits using robust and consistent methods that you have embedded in analytics products that can evolve and improve over time MAJOR RESPONSIBILITIES Develop state of the art causal learning, deep learning, and predictive techniques to help the organization understand the performance of omnichannel campaigns and optimize spend. Run regular A/B experiments and perform statistical analyses to measure the effects of these experiments. Work with other data scientists, engineers, and product partners to develop new machine learning approaches, and measurement strategies. Manage and guide data science and data engineering elements of AI/ML projects related to revenue prediction and optimization across commercial and marketing channels (TV, mail, email, web, social, mobile, digital, etc.). Collaborate within cross-functional teams to develop efficient measurement use cases (such as revenue simulation (what-if scenarios)) and define goals and deliverables. Leverage forecasting and simulation-based modeling approaches to provide optimization recommendations of marketing and business plans. Conduct advanced analysis on various marketing efforts to gauge performance, impact, and effectiveness against the desired results. Drive the development, deployment, and industrialization of enterprise-level Measurement algorithms to make business impact from structured and unstructured data for our brands and the different therapeutic areas. Act as subject matter expert for applicable data science and other advanced analytical methodologies, programs, and projects in relation to business impact measurement: revenue optimization, marketing mix, forecasting, campaign and tactic testing, etc. Take an enterprise mindset, linking individual responsibilities with broader organization; focus on outcomes that provide most business value. Define and produce deliverables that identify opportunities to tracking and measurement plans that inform and inspire internal stakeholders and decision makers. Minimum Requirements: Minimum a Bachelor’s degree in relevant disciplines such as: Computer Science; Applied Mathematics, Statistics, Economics / Econometrics, Engineering or related field, preferably with a focus on Data Science and Machine Learning applications. 7+ years of relevant industry work experience (transferable skill set across multiple industries is a huge plus ) Preferred Qualifications: Significant experience in the application of machine learning to enterprise data extracted from sources such as social media, email, and finance, combined with a demonstrated ability to drive tangible results Significant experience in most of the following quantitative fields: Machine Learning, Deep Learning, Reinforcement Learning, Mathematical Optimization, etc. Demonstrated proficiency in leveraging open source libraries for Deep Learning models (open source frameworks like Tensorflow, Keras, and/or PyTorch) Experience working with large, complex data using Hadoop or Spark or other big data platforms Proficiency with industry-standard programming languages such as R or Python Experience with other data science and cloud-computing tools and platforms (AWS, GCP, etc.) Strong knowledge of secondary data sources including syndicated sales, promotional & marketing data, social media, engagement, etc. Experience with data visualization tools such as Tableau, and/or Qlik, and/or Data Studio, etc. Proven track record of leadership, time-management, project management, and teamwork; Strong attention to detail Experience translating research or analysis to communicate (in presentations and in writing) concise and compelling business stories that influence decisions and strategy Ability to produce scalable and robust production-quality code incorporating testing, evaluation, and monitoring. Experience in designing and productionalizing large-scale distributed systems built around machine learning models and big data. Experience with growth (acquisition, engagement, retention) and modeling on marketing data (i.e. attribution, propensity to convert, customer journey mapping, lifetime value, incrementally) is a plus. The expected salary range for this position based on the primary location of South San Francisco, CA is $165k-$307K. Actual pay will be determined based on experience, qualifications, geographic location, and other job-related factors permitted by law. A discretionary annual bonus may be available based on individual and Company performance. Genentech is an equal opportunity employer, and we embrace the increasingly diverse world around us. Genentech prohibits unlawful discrimination based on race, color, religion, gender, sexual orientation, gender identity or expression, national origin or ancestry, age, disability, marital status and veteran status. Genentech requires all new hires to be fully vaccinated against COVID-19 as of their start date. This requirement is a condition of employment at Genentech, and it applies regardless of whether the position is located at a Genentech campus or is fully remote. If you are unable to receive the vaccine due to a disability or serious medical condition, or because it is prohibited as a result of your sincerely held religious beliefs, you will have an opportunity to request a reasonable accommodation.",https://www.indeed.com/jobs?q=Data+Scientist&l=San+Francisco%5D+%23%2C+CA&sc=0kf%3Aattr%28EXSNN%7CFCGTU%7CHFDVW%7CQJZM9%7CUTPWG%252COR%29explvl%28SENIOR_LEVEL%29jt%28fulltime%29%3B&start=10&pp=gQAPAAAAAAAAAAAAAAAB_gIBfgAUAQEBBw9fTuqBM3BdnXv9JhK0OSMAAA&vjk=9c93fe7798f65477
22,7eae89c11960ae2d,Machine Learning Engineer,"San Francisco, CA",ENTRY_LEVEL,BACHELORS_DEGREE,fulltime,"Senior/Staff Data Scientist - Collision Avoidance System - job post Zoox (part of Amazon.com) 9 reviews Foster City, CA $210,000 - $300,000 a year -  Full-time Zoox 9 reviews Read what people are saying about working here. You must create an Indeed account before continuing to the company website to apply Apply on company site save-icon Job details Salary $210,000 - $300,000 a year Job Type Full-time The Collision Avoidance System (CAS) is responsible for detecting and reacting to imminent collision situations in support of our vehicle’s overall safety goals. CAS Perception is responsible for processing raw sensor data from our vehicle’s world-class sensor suite using a combination of geometric, interpretable algorithms and deep learning to detect near-collisions with obstacles along our intended driving path, in the most challenging dense urban environments and under tight compute resource constraints. Overall CAS is parallel and complementary to our Main AI autonomy stack, and has a close relationship with our vehicle hardware and safety teams in order to architect redundancy into our overall driving system. Responsibilities Defining key performance metrics for our safety critical perception and prediction system, in order to guide product development to a commercial launch Apply distributed compute algorithms to efficiently analyze petabytes of urban driving data Work closely with ML engineers to develop metrics and tools for analyzing errors and understanding improvements in our systems Contribute to all phases of the software development cycle including prototyping, requirements capture, design, implementation, and validation. Qualifications BS, MS, or PhD degree in computer science or related field Proficient with C++ and/or PythonProficient with Scala / R / SQL Familiarity with modern software development methodologies and tools (Agile, Git, unit testing, CI, etc.) Experience designing metrics and building mechanisms to fuel business insights 8+ years of experience in a related field Bonus Qualifications Experience with production Machine Learning pipelines: dataset creation, training frameworks, metrics pipelines Experience with existing ADAS technologies, including adaptive cruise control, automatic emergency braking, lane-following, automated lane changing Experience with manual or automatic labeling pipelines Background in computer vision, perception, or signal processing Compensation There are three major components to compensation for this position: salary, Amazon Restricted Stock Units (RSUs), and Zoox Stock Appreciation Rights. The salary will range from $210,000 to $300,000. A sign-on bonus may be part of a compensation package. Compensation will vary based on geographic location, job-related knowledge, skills, and experience. Zoox also offers a comprehensive package of benefits including paid time off (e.g. sick leave, vacation, bereavement), unpaid time off, Zoox Stock Appreciation Rights, Amazon RSUs, health insurance, long-term care insurance, long-term and short-term disability insurance, and life insurance. Vaccine Mandate Employees working in this position will be required to have received a single dose of the J&J/Janssen COVID-19 vaccine OR have completed the two-dose Pfizer or Moderna vaccine series. In addition, employees will be required to receive a COVID-19 booster vaccine within two months of becoming eligible for the booster vaccine. Employees will be required to show proof of vaccination status upon receipt of a conditional offer of employment. That offer of employment will be conditioned upon, among other things, an Applicant’s ability to show proof of vaccination status. Please note the Company provides reasonable accommodations in accordance with applicable state, federal, and local laws. About Zoox Zoox is developing the first ground-up, fully autonomous vehicle fleet and the supporting ecosystem required to bring this technology to market. Sitting at the intersection of robotics, machine learning, and design, Zoox aims to provide the next generation of mobility-as-a-service in urban environments. We’re looking for top talent that shares our passion and wants to be part of a fast-moving and highly execution-oriented team. Follow us on LinkedIn A Final Note: You do not need to match every listed expectation to apply for this position. Here at Zoox, we know that diverse perspectives foster the innovation we need to be successful, and we are committed to building a team that encompasses a variety of backgrounds, experiences, and skills.",https://www.indeed.com/jobs?q=Data+Scientist&l=San+Francisco%5D+%23%2C+CA&sc=0kf%3Aattr%28EXSNN%7CFCGTU%7CHFDVW%7CQJZM9%7CUTPWG%252COR%29explvl%28SENIOR_LEVEL%29jt%28fulltime%29%3B&start=10&pp=gQAPAAAAAAAAAAAAAAAB_gIBfgAUAQEBBw9fTuqBM3BdnXv9JhK0OSMAAA&vjk=7eae89c11960ae2d
23,df55096620ca8ee9,Machine Learning Engineer,"San Francisco, CA",ENTRY_LEVEL,BACHELORS_DEGREE,fulltime,"Senior Product Manager - Data & AI - job post Deepcell Menlo Park, CA 94025 $160,000 - $190,000 a year -  Full-time Apply now Apply now save-icon Job details Salary $160,000 - $190,000 a year Job Type Full-time About Deepcell Interested in helping to develop cutting edge technologies to empower cell biology and save lives? If so, we'd love to talk to you! Deepcell is an early-stage Stanford spin-off company that has developed an AI-powered platform that analyzes, classifies and isolates label-free, viable cells based on their visual features for use in basic and translational research across the life sciences industry. Come join Deepcell and make a difference! We're a rapidly growing team of stellar innovators in biomedical engineering, artificial intelligence, and molecular biology. Our technology has won multiple prestigious awards and is backed by top-tier venture capitalists in Silicon Valley including Andreessen Horowitz, KDT, Casdin, and others. As we expand our product portfolio and near commercialization, we are excited to bring on a Senior Product Manager - Data & AI to grow our Product team! Purpose of Role We are looking for an experienced and creative Product Manager with a passion for Data & AI to join our Product team. As the Senior Product Manager for Data & AI, you will guide the development of our models and machine learning infrastructure, in order to satisfy critical user needs both internally and externally, and ensure the performance and scalability of our products and services. The role requires someone who can deep dive into both researching user needs and behaviors, and contributing to the design and architecture of our platform and related services. Responsibilities Deeply understanding and anticipating user needs related to the use and management of data and AI models on the Deepcell platform Help guide key product decisions enabling an efficient and scalable business model for the company Providing clarity over use cases and priorities to technical teams in order to efficiently guide iterative development Collaborating cross-functionally to translate roadmap items into concrete development initiatives Continuously gathering feedback from internal users, customers and subject matter experts to produce clear requirements Tracking product adoption and performance using analytics Minimum Qualifications B.S. or M.S. preferably in Engineering, Computer Science, Bioinformatics, Computational Biology, Mathematics, or equivalent technical degree 5+ years of experience in Product Management Proven track record of execution and launch of successful AI & ML-based products Passionate about cloud-based products, data-driven business models and data companies Self-motivated to prioritize and manage workload and meet critical project deadlines with limited supervision Ability to translate between engineers, data scientists, biologists, and commercial team members to balance user needs, team effort and business objectives Excellent communication and collaboration skills, detail oriented and receptive to feedback Preferred Qualifications Familiarity with the life sciences or biotechnology industry Robust knowledge of AI & ML methodologies and trends Technical experience to weigh tradeoffs and to have in depth discussions with data scientists and engineers on the nuances of complex AI systems Experience in startups, small companies, or other fast paced, continuously changing environments is a strong plus. Familiarity with agile projects methodologies Familiarity with GCP and/or AWS cloud environments and services Compensation and Benefits Annual salary range is $160,000 - $190,000 DOE Pre-IPO Equity Paid Medical, Dental, and Vision On-site Lunch and Snacks Gym Reimbursement Paid Time Off Parental Leave Deepcell believes that everyone has the ability to make an impact, and we are proud to be an equal opportunity employer committed to providing employment opportunity regardless of sex, race, creed, color, gender, religion, marital status, domestic partner status, age, national origin or ancestry, physical or mental disability, medical condition, sexual orientation, pregnancy, military or veteran status, citizenship status, and genetic information. If you require alternative methods of application or screening, you must approach the employer directly to request this as Indeed is not responsible for the employer's application process.",https://www.indeed.com/jobs?q=Data+Scientist&l=San+Francisco%5D+%23%2C+CA&sc=0kf%3Aattr%28EXSNN%7CFCGTU%7CHFDVW%7CQJZM9%7CUTPWG%252COR%29explvl%28SENIOR_LEVEL%29jt%28fulltime%29%3B&start=10&pp=gQAPAAAAAAAAAAAAAAAB_gIBfgAUAQEBBw9fTuqBM3BdnXv9JhK0OSMAAA&vjk=df55096620ca8ee9
