,job_id,job_title,location,experience,education,job_type,job_description,job_link
22,861e3dbdffa9bab8,Machine Learning Engineer,"San Francisco, CA",ENTRY_LEVEL,BACHELORS_DEGREE,fulltime,"Computer Vision/ML Software Engineer - GPU - 150921 - job post Santa Clara, CA Full-time You must create an Indeed account before continuing to the company website to apply Apply on company site save-icon Job details Job Type Full-time Company: AMD Location: Santa Clara, California, US Site: https://jobs.amd.com/job/Santa-Clara… Job Type: Onsite, Full-time What you do at AMD changes everything At AMD, we push the boundaries of what is possible. We believe in changing the world for the better by driving innovation in high-performance computing, graphics, and visualization technologies – building blocks for gaming, immersive platforms, and the data center. Developing great technology takes more than talent: it takes amazing people who understand collaboration, respect, and who will go the “extra mile” to achieve unthinkable results. It takes people who have the passion and desire to disrupt the status quo, push boundaries, deliver innovation, and change the world. If you have this type of passion, we invite you to take a look at the opportunities available to come join our team. Computer Vision/ML Software Engineer - GPU The Role: We are looking for our next team member to join our computer vision team in the Machine Learning Software Engineering group to enable and performance CPU and GPU code relating to computer vision. You will work independently and with other AMD engineers to tackle technical CPU and GPU performance issues and build test cases for verifying correctness and measure performance. The Person: Does this sound like you? We’d love to talk! Very Strong solution-oriented mindset Expertise in Computer vision, machine learning and performance testing on CPU & GPU Ability to independently prioritize opportunities to deliver results on time Excellent verbal and written communication skills Proficient in English Key Responsibilities: Software design and development in C/C++ and Python Seek maximum performance on AMD GPU through a combination of performance optimization, workload characterization, compilers, math libraries and lower-level AMD-internal toolsets Feeding back performance bottlenecks to the relevant engineering groups to improve performance Collaborate on future architectures and performance testing Attend internal working groups in resolving engineering issues; contribute to the debug and testing of unreleased GPUs and their readiness for ML workloads Document and publish performance results and procedures you have generated and automate repeatable procedures Apply CV/ML for training/inference and deployment into production applications Preferred Experience: Experience with computer vision and performance optimization Coding expertise in SIMD for CPU and GPU (C/C++, Python, OpenCL, HIP or Cuda) Performance profiling, monitoring tools, and software performance optimization Linux administration; understanding setup for ML middleware Familiar with computer vision algorithms and neural nets, such as Resnet, VGG, Yolo Experience with MLPerf or other ML benchmarks Experience working on very large NN models for computer vision Any experience understanding/inspecting/writing x86 assembly MPI and/or OMP coding experience Understanding of memory and cache hierarchy and methods to query performance/latency at each level Hands-on debugging skills with system-level debugger, as well as GPU debugging Academic Credentials: Bachelor’s degree in a technical field (Computer Science, Electrical Engineering, Physics, Mathematics), Preferred MS or PhD with machine learning coursework Posted: May 3rd, 2022",https://www.indeed.com/jobs?q=Machine+Learning+Engineer&l=San+Francisco%5D+%23%2C+CA&sc=0kf%3Aattr%28FCGTU%7CHFDVW%7CQJZM9%7CUTPWG%252COR%29explvl%28ENTRY_LEVEL%29jt%28fulltime%29%3B&start=10&pp=gQAPAAAAAAAAAAAAAAAB_f7eaAANAQAAkibmHNDgUJtLYgAA&vjk=861e3dbdffa9bab8
23,900f6ce2ec8f6ad8,Machine Learning Engineer,"San Francisco, CA",ENTRY_LEVEL,BACHELORS_DEGREE,fulltime,"Senior/Staff Software Engineer, Mission Planning - job post Zoox (part of Amazon.com) 9 reviews Foster City, CA $210,000 - $319,000 a year -  Full-time Zoox 9 reviews Read what people are saying about working here. You must create an Indeed account before continuing to the company website to apply Apply on company site save-icon Job details Salary $210,000 - $319,000 a year Job Type Full-time The Mission Planner team at Zoox is responsible for generating the high level route our autonomous vehicles will take to transport passengers to their destination. By working closely with our cloud services team to facilitate pickup and drop off requests along with live traffic data among other inputs, and integrating closely with the decision making and trajectory planning and controls teams to allow dynamic planning this team will enable the core ability for our vehicles to choose the best routes through cities and adapt in real time. We are looking for an engineer who is excited to solve the complexities of mission planning in dynamic cities, by contributing novel solutions to the architecture and design and driven to take ownership of major software components. If you like to work close to the robot platform and enjoy experiencing your developed software in the robot, we would like to hear from you. Responsibilities You will develop mission planner algorithms, including graph search and integration with behavioral planning You will Integrate and test your developed applications in the robot, learn and make improvements. You will work collaboratively with passionate team members to support the integration of software components from all teams throughout Zoox. You will set the short and long term technical direction for the team and collaborate on the broader company-wide directions You will coordinate cross-functional initiatives with other teams across Mission Planning, Behavioral Planning and Cloud Services. Qualifications BS/MS in Computer Science or a related field Programming skills in C++ Understanding and experience with a variety of graph search techniques (A*, D*, Dijkstra …) Demonstrated ability to write code for a shipped product (commercial robotics, drones, consumer devices, automotive) Ability to work on multiple layers of the autonomous driving compute stack Bonus Qualifications PhD in computer science or related field Experience with autonomous robots Compensation There are three major components to compensation for this position: salary, Amazon Restricted Stock Units (RSUs), and Zoox Stock Appreciation Rights. The salary will range from $210,000 to $319,000. A sign-on bonus may be part of a compensation package. Compensation will vary based on geographic location, job-related knowledge, skills, and experience. Zoox also offers a comprehensive package of benefits including paid time off (e.g. sick leave, vacation, bereavement), unpaid time off, Zoox Stock Appreciation Rights, Amazon RSUs, health insurance, long-term care insurance, long-term and short-term disability insurance, and life insurance. Vaccine Mandate Employees working in this position will be required to have received a single dose of the J&J/Janssen COVID-19 vaccine OR have completed the two-dose Pfizer or Moderna vaccine series. In addition, employees will be required to receive a COVID-19 booster vaccine within two months of becoming eligible for the booster vaccine. Employees will be required to show proof of vaccination status upon receipt of a conditional offer of employment. That offer of employment will be conditioned upon, among other things, an Applicant’s ability to show proof of vaccination status. Please note the Company provides reasonable accommodations in accordance with applicable state, federal, and local laws. About Zoox Zoox is developing the first ground-up, fully autonomous vehicle fleet and the supporting ecosystem required to bring this technology to market. Sitting at the intersection of robotics, machine learning, and design, Zoox aims to provide the next generation of mobility-as-a-service in urban environments. We’re looking for top talent that shares our passion and wants to be part of a fast-moving and highly execution-oriented team. Follow us on LinkedIn A Final Note: You do not need to match every listed expectation to apply for this position. Here at Zoox, we know that diverse perspectives foster the innovation we need to be successful, and we are committed to building a team that encompasses a variety of backgrounds, experiences, and skills.",https://www.indeed.com/jobs?q=Machine+Learning+Engineer&l=San+Francisco%5D+%23%2C+CA&sc=0kf%3Aattr%28FCGTU%7CHFDVW%7CQJZM9%7CUTPWG%252COR%29explvl%28ENTRY_LEVEL%29jt%28fulltime%29%3B&start=10&pp=gQAPAAAAAAAAAAAAAAAB_f7eaAANAQAAkibmHNDgUJtLYgAA&vjk=900f6ce2ec8f6ad8
24,ec6e1e25f3ca037e,Machine Learning Engineer,"San Francisco, CA",ENTRY_LEVEL,BACHELORS_DEGREE,fulltime,"Firmware Engineer - job post Science Alameda, CA $100,000 - $180,000 a year -  Full-time Apply now Apply now save-icon Job details Salary $100,000 - $180,000 a year Encouraged to Apply Fair chance Job Type Full-time Science is an early stage company developing technologies for a range of serious unmet medical needs. We are unafraid to take difficult technical risks, secure in the knowledge that with a clear understanding of what we are doing and with support from powerful modern tools, more progress is possible than might be immediately obvious. Regardless of role or team, the two most important factors we look for in a candidate are evidence of exceptional ability and the addition of positive energy to the group. As a small, very early stage team in a largely unstructured environment, the ability to independently orient yourself to the problems that need to be solved and then follow through is essential. We are looking for world class firmware engineers with excellent track records of delivering robust embedded firmware. You would be responsible for helping to lay the firmware bedrock for control and communication with Science neural interface platforms (such as the Science Eye). As is the case for most technical roles at Science, the work is interdisciplinary, and you would be expected to learn a host of new concepts while working with biologists, machine learning, optics and microfabrication engineers. Role & Responsibilities: Develop, test, maintain and support firmware through its entire lifecycle Build out firmware for neural interface implant and supporting wearable platforms Prototype (rapidly), test and analyze new systems and ideas to assess feasibility Key qualifications: Experience in firmware development delivering reliable, readable, and maintainable firmware for embedded systems Passion for developing neural interfaces Experience with microsystem sensors and actuators Experience with machine learning BS in EE, CE, CS, etc. Preferred qualifications: Experience with IEC 62304 compliant firmware for biomedical devices Rapid prototyping experience (microcontrollers, analog and digital interfaces, etc) RISC-V CPU architecture and firmware development experience Experience in a lab environment using oscilloscopes, spectrum analyzers, etc Experience with ASIC firmware development FPGA experience (HDL as well as firmware for soft/hardcores) MS or PhD in relevant field Experience with continuous integration testing Firmware hobby project experience Salary/Pay Range: For individuals hired to work in California, Science is required by law to include a reasonable estimate of the compensation range for this role. We determine your level based on your interview performance and make an offer based on geo-located salary bands. The base salary range for this full-time position is $100,000-$180,000 annually + equity + benefits. Within the range, individual pay is determined by work location and additional factors, including job-related skills, experience, and relevant education or training. Please keep in mind that the equity portion of the offer is not included in these numbers. Benefits: At Science, our benefits are in place to support the whole you: Competitive salary and equity Medical, dental, vision and life insurance Flexible vacation and company-paid holidays Healthy meals and snacks provided for non-remote employees Paid parental, jury duty, bereavement, family care and medical leave Dependent Care Flexible Spending Account, subsidized by Science Flexible Spending Account 401(k) Science Corporation is an equal opportunity employer. We strive to create a supportive and inclusive workplace where contributions are valued and celebrated, and our employees thrive by being themselves and are inspired to do their best work. We seek applicants of all backgrounds and identities, across race, color, ethnicity, national origin or ancestry, citizenship, religion, sex, sexual orientation, gender identity or expression, veteran status, marital status, pregnancy or parental status, or disability. Applicants will not be discriminated against based on these or other protected categories or social identities. Science will also consider for employment qualified applicants with criminal histories in a manner consistent with applicable federal, state and local law. If you require alternative methods of application or screening, you must approach the employer directly to request this as Indeed is not responsible for the employer's application process.",https://www.indeed.com/jobs?q=Machine+Learning+Engineer&l=San+Francisco%5D+%23%2C+CA&sc=0kf%3Aattr%28FCGTU%7CHFDVW%7CQJZM9%7CUTPWG%252COR%29explvl%28ENTRY_LEVEL%29jt%28fulltime%29%3B&start=10&pp=gQAPAAAAAAAAAAAAAAAB_f7eaAANAQAAkibmHNDgUJtLYgAA&vjk=ec6e1e25f3ca037e
25,361a13ecab09fc15,Machine Learning Engineer,"San Francisco, CA",ENTRY_LEVEL,BACHELORS_DEGREE,fulltime,"Software Engineer, Secure Embedded Operating Systems - job post Zoox (part of Amazon.com) 9 reviews Foster City, CA $160,000 - $225,000 a year -  Full-time Zoox 9 reviews Read what people are saying about working here. You must create an Indeed account before continuing to the company website to apply Apply on company site save-icon Job details Salary $160,000 - $225,000 a year Job Type Full-time Zoox's Robot Software Infrastructure team is looking for a motivated software engineer to help mature the operating system on our vehicle’s primary compute platform. In addition to operating systems, the Robot Software Infrastructure team is responsible for vehicle software updates, and works on security-focused software in close collaboration with the product security team. In this role, you’ll work on software that connects networks, drivers, artificial intelligence software, build systems, and web services. If you are excited to explore a broad problem space and are mindful of how components fit within a larger system, you may be a great fit! Ideally you will be able to work remotely, on-site, and occasionally in a vehicle. Qualifications Deep expertise with the Linux kernel, filesystems, and devices Networking experience including VLANs, 802.1x, TCP tuning, NIC features and configuration Hands-on experience with secure boot, encrypted boot volumes, and TPM 2.0 Strong written and verbal communication skills Proficiency in a language without automatic memory management (e.g., C or C++), and in a scripting language (e.g., Python or Ruby) Bachelor’s degree or equivalent practical experience Bonus Qualifications Familiarity with security software: PKI, cryptographic building blocks, etc. Experience with Linux in an embedded environment Master’s degree or above with a focus on networking, operating systems, or computer security Master’s degree or equivalent practical experience Compensation There are three major components to compensation for this position: salary, Amazon Restricted Stock Units (RSUs), and Zoox Stock Appreciation Rights. The salary range for this position is $160,000 to $225,000. A sign-on bonus may be offered as part of the compensation package. Compensation will vary based on geographic location and level. Leveling, as well as positioning within a level, is determined by a range of factors, including, but not limited to, a candidate's relevant years of experience, domain knowledge, and interview performance. The salary range listed in this posting is representative of the range of levels Zoox is considering for this position. Zoox also offers a comprehensive package of benefits including paid time off (e.g. sick leave, vacation, bereavement), unpaid time off, Zoox Stock Appreciation Rights, Amazon RSUs, health insurance, long-term care insurance, long-term and short-term disability insurance, and life insurance. Vaccine Mandate Employees working in this position will be required to have received a single dose of the J&J/Janssen COVID-19 vaccine OR have completed the two-dose Pfizer or Moderna vaccine series. In addition, employees will be required to receive a COVID-19 booster vaccine within two months of becoming eligible for the booster vaccine. Employees will be required to show proof of vaccination status upon receipt of a conditional offer of employment. That offer of employment will be conditioned upon, among other things, an Applicant’s ability to show proof of vaccination status. Please note the Company provides reasonable accommodations in accordance with applicable state, federal, and local laws. About Zoox Zoox is developing the first ground-up, fully autonomous vehicle fleet and the supporting ecosystem required to bring this technology to market. Sitting at the intersection of robotics, machine learning, and design, Zoox aims to provide the next generation of mobility-as-a-service in urban environments. We’re looking for top talent that shares our passion and wants to be part of a fast-moving and highly execution-oriented team. Follow us on LinkedIn A Final Note: You do not need to match every listed expectation to apply for this position. Here at Zoox, we know that diverse perspectives foster the innovation we need to be successful, and we are committed to building a team that encompasses a variety of backgrounds, experiences, and skills.",https://www.indeed.com/jobs?q=Machine+Learning+Engineer&l=San+Francisco%5D+%23%2C+CA&sc=0kf%3Aattr%28FCGTU%7CHFDVW%7CQJZM9%7CUTPWG%252COR%29explvl%28ENTRY_LEVEL%29jt%28fulltime%29%3B&start=10&pp=gQAPAAAAAAAAAAAAAAAB_f7eaAANAQAAkibmHNDgUJtLYgAA&vjk=361a13ecab09fc15
26,f90cb3e726b4410f,Machine Learning Engineer,"San Francisco, CA",ENTRY_LEVEL,BACHELORS_DEGREE,fulltime,"DevOps Engineering – Engineer II - job post FICO 187 reviews San Rafael, CA $84,000 - $132,000 a year -  Full-time FICO 187 reviews Read what people are saying about working here. You must create an Indeed account before continuing to the company website to apply Apply on company site save-icon Job details Salary $84,000 - $132,000 a year Job Type Full-time FICO (NYSE: FICO) is a leading global analytics software company, helping businesses in 90+ countries make better decisions. Join our world-class team today and fulfill your career potential! The Opportunity “A DevOps role at FICO is an opportunity to work with cutting edge cloud technologies with a team focused on delivery of secure cloud solutions and products to enterprise customers.” - VP, DevOps Engineering What You’ll Contribute Collaborate in a devops environment where you will work closely with developers in automating new applications, features, and services. Support enterprise standards around technology, security compliance and systems interoperability for FICO products/solutions. Assist in developing scripts to automate development operations functions or processes –Cloud Infrastructure Automation & Orchestration. Research and implement automation tools to replace existing manual processes and maintenance tasks. Collaborate with other engineers on design, analysis, architecture/modeling, implementation, unit testing, code reviews and process enhancements. Optimize performance and scalability as necessary to meet business goals. Deliver customer solutions using open source and commercial technologies. Deliver full automation pipeline using CI/CD/DevOps concepts, tools and technologies (Jenkins, Maven/Gradle, Git/Stash, Nexus, Puppet/Chef). What We’re Seeking Bachelor's degree or equivalent in Electronic Engineering, Computer Science or related field. Experience in a computer engineering position or related occupation. Experience operating highly-available, redundant, public cloud architectures solutions utilizing IaaS and PaaS. Drive engineering automation from CI/CD, infrastructure provisioning, monitoring & alerting to developer support. Our Offer to You A culture and work environment strongly reflecting our core values: Act Like an Owner, Delight Our Customers and Earn the Respect of Others. The opportunity to make a difference by leveraging your unique strengths. Highly competitive compensation and rewards. Flexible work options, opportunities to give back to your community, social events with colleagues and a comprehensive benefits program inclusive of progressive parental leave. The targeted base pay range for this role is: $84,000 to $132,000 with this range reflecting differences in candidate knowledge, skills and experience. #LI-DA1 Why Make a Move to FICO? At FICO, you can develop your career with a leading organization in one of the fastest-growing fields in technology today – Big Data analytics. You’ll play a part in our commitment to help businesses use data to improve every choice they make, using advances in artificial intelligence, machine learning, predictive and prescriptive modeling, and much more. FICO makes a real difference in the way businesses operate worldwide: Credit Scoring — 150+ billion FICO Scores have been sold to date, making it the most used credit score in the world. Fraud Detection and Security — 2.6+ billion payment cards globally are protected by FICO fraud systems. Lending — 3/4 of US mortgages are approved using the FICO Score. Anti-Money Laundering — our solutions check more than half a billion transactions a day to prevent criminal schemes such as terrorist financing Global trends toward digital transformation have created tremendous demand for FICO’s solutions, placing us among the world’s top 100 software companies by revenue. We support many of the world’s largest banks, insurers, retailers, telecommunications providers and other firms reach a new level of success. Our success is dependent on really talented people – just like you – who thrive on the collaboration and innovation that’s nurtured by a diverse and inclusive environment. We’ll provide the support you need, while ensuring you have the freedom to develop your skills and grow your career. Join FICO and help change the way business thinks! Learn more about how you can fulfill your potential at www.fico.com/Careers FICO promotes a culture of inclusion and seeks to attract a diverse set of candidates for each job opportunity. We are an equal employment opportunity employer and we’re proud to offer employment and advancement opportunities to all candidates without regard to race, color, ancestry, religion, sex, national origin, pregnancy, sexual orientation, age, citizenship, marital status, disability, gender identity or Veteran status. Research has shown that women and candidates from underrepresented communities may not apply for an opportunity if they don’t meet all stated qualifications. While our qualifications are clearly related to role success, each candidate’s profile is unique and strengths in certain skill and/or experience areas can be equally effective. If you believe you have many, but not necessarily all, of the stated qualifications we encourage you to apply.",https://www.indeed.com/jobs?q=Machine+Learning+Engineer&l=San+Francisco%5D+%23%2C+CA&sc=0kf%3Aattr%28FCGTU%7CHFDVW%7CQJZM9%7CUTPWG%252COR%29explvl%28ENTRY_LEVEL%29jt%28fulltime%29%3B&start=10&pp=gQAPAAAAAAAAAAAAAAAB_f7eaAANAQAAkibmHNDgUJtLYgAA&vjk=f90cb3e726b4410f
