,job_id,job_title,location,experience,education,job_type,job_description,job_link
4,65619e6373a1ec7d,Data Engineer,"Dallas, TX",SENIOR_LEVEL,BACHELORS_DEGREE,fulltime,"Data Engineer - job post PepsiCo 18,123 reviews Plano, TX Full-time You must create an Indeed account before continuing to the company website to apply Apply on company site save-icon Job details Job Type Full-time Overview PepsiCo operates in an environment undergoing immense and rapid change. Big-data and digital technologies are driving business transformation that is unlocking new capabilities and business innovations in areas like eCommerce, mobile experiences and IoT. The key to winning in these areas is being able to leverage enterprise data foundations built on PepsiCo’s global business scale to enable business insights, advanced analytics and new product development. PepsiCo’s Data Management and Operations team is tasked with the responsibility of developing quality data collection processes, maintaining the integrity of our data foundations and enabling business leaders and data scientists across the company to have rapid access to the data they need for decision-making and innovation. What PepsiCo Data Management and Operations does: Maintain a predictable, transparent, global operating rhythm that ensures always-on access to high-quality data for stakeholders across the company Responsible for day-to-day data collection, transportation, maintenance/curation and access to the PepsiCo corporate data asset Work cross-functionally across the enterprise to centralize data and standardize it for use by business, data science or other stakeholders Increase awareness about available data and democratize access to it across the company Job Description As a member of the data engineering team, you will be the key technical expert developing and overseeing PepsiCo's data product build & operations and drive a strong vision for how data engineering can proactively create a positive impact on the business. You'll be an empowered member of a team of data engineers who build data pipelines into various source systems, rest data on the PepsiCo Data Lake, and enable exploration and access for analytics, visualization, machine learning, and product development efforts across the company. As a member of the data engineering team, you will help lead the development of very large and complex data applications into public cloud environments directly impacting the design, architecture, and implementation of PepsiCo's flagship data products around topics like revenue management, supply chain, manufacturing, and logistics . You will work closely with process owners, product owners and business users. You'll be working in a hybrid environment with in-house, on-premise data sources as well as cloud and remote systems. Responsibilities Active contributor to code development in projects and services. Manage and scale data pipelines from internal and external data sources to support new product launches and drive data quality across data products. Build and own the automation and monitoring frameworks that captures metrics and operational KPIs for data pipeline quality and performance. Responsible for implementing best practices around systems integration, security, performance and data management. Empower the business by creating value through the increased adoption of data, data science and business intelligence landscape. Collaborate with internal clients (data science and product teams) to drive solutioning and POC discussions. Evolve the architectural capabilities and maturity of the data platform by engaging with enterprise architects and strategic internal and external partners. Develop and optimize procedures to “productionalize” data science models. Define and manage SLA’s for data products and processes running in production. Support large-scale experimentation done by data scientists. Prototype new approaches and build solutions at scale. Research in state-of-the-art methodologies. Create documentation for learnings and knowledge transfer. Create and audit reusable packages or libraries. COVID-19 vaccination is a condition of employment for this role. Please note that all such company vaccine requirements provide the opportunity to request an approved accommodation or exemption under applicable law. Qualifications BA/BS in Computer Science, Math, Physics, or other technical fields. Skills, Abilities, Knowledge Excellent communication skills, both verbal and written, along with the ability to influence and demonstrate confidence in communications with senior level management. Proven track record of leading, mentoring data teams. Strong change manager. Comfortable with change, especially that which arises through company growth. Ability to understand and translate business requirements into data and technical requirements. High degree of organization and ability to manage multiple, competing projects and priorities simultaneously. Positive and flexible attitude to enable adjusting to different needs in an ever-changing environment. Strong leadership, organizational and interpersonal skills; comfortable managing trade-offs. Foster a team culture of accountability, communication, and self-management. Proactively drives impact and engagement while bringing others along. Consistently attain/exceed individual and team goals Ability to lead others without direct authority in a matrixed environment. Competencies Highly influential and having the ability to educate challenging stakeholders on the role of data and its purpose in the business. Understands both the engineering and business side of the Data Products released. Places the user in the center of decision making. Teams up and collaborates for speed, agility, and innovation. Experience with and embraces agile methodologies. Strong negotiation and decision-making skill. Experience managing and working with globally distributed teams. EEO Statement All qualified applicants will receive consideration for employment without regard to race, color, religion, sex, sexual orientation, gender identity, national origin, protected veteran status, or disability status. PepsiCo is an Equal Opportunity Employer: Female / Minority / Disability / Protected Veteran / Sexual Orientation / Gender Identity If you'd like more information about your EEO rights as an applicant under the law, please download the available EEO is the Law & EEO is the Law Supplement documents. View PepsiCo EEO Policy. Please view our Pay Transparency Statement",https://www.indeed.com/jobs?q=Data+Engineer&l=Dallas%2C+TX&sc=0kf%3Aattr%28FCGTU%7CHFDVW%7CQJZM9%7CUTPWG%252COR%29explvl%28SENIOR_LEVEL%29jt%28fulltime%29%3B&vjk=65619e6373a1ec7d
5,7f939bc135ad5e20,Data Engineer,"Dallas, TX",SENIOR_LEVEL,BACHELORS_DEGREE,fulltime,"Sr. Data Engineer, Integration (SQL/SSIS/ETL) - job post Builders FirstSource 1,362 reviews Dallas, TX • Remote $134,850 - $182,445 a year -  Full-time Apply now Apply now save-icon Job details Salary $134,850 - $182,445 a year Job Type Full-time Publicly traded on the NYSE (BLDR), Builders FirstSource is the nation’s premier supplier of building materials and services for professional home builders and remodelers. With 30,000 team members supporting approximately 565 locations in 42 states and a market presence in 85 of the top 100 Metropolitan Statistical Areas, the company has significant geographic diversity and a balanced end market exposure. As a company we are focused on getting things done right and on building a successful future, for customers, vendors and team members. Due to the complexity of the building industry, Builders FirstSource manages a variety of operations with a large selection of career opportunities throughout the country. With long-tenured team members, it is evident that we believe in promoting from within, offer a competitive benefits package and provide job satisfaction across the board. Now is the time to be part of building something truly special. If you’d like to become part of an exciting, fast-paced organization, BFS is the company for you! From preliminary business requirements and solution architectures, conducts feasibility analysis and uses comprehensive technical knowledge, creativity and judgment in exploring possible high-level solution designs. Produces software designs to meet complex requirements within time and cost constraints. Ensures technical documentation reflects changes to application functionality or implementation choices. Plans, conducts, and supervises assignments. Reviews progress and results, and communicates with management. Leverages team skills for successful project completion. ESSENTIAL DUTIES AND RESPONSIBILITIES From functional requirements and collaboration with the business and analysts, performs domain analysis to ensure the solution provides consistency with domain vocabulary, boundaries, entities, and processes. Achieves long-term reuse by modeling the right concepts at a suitable level of detail. Leads system design, applying established and emerging software engineering best practices and design patterns. Balances between robustness and speed/cost considerations, optimizing based on what’s appropriate for the solution domain. Writes application code at a high level of productivity, defines logical and physical data structures, builds reports, and provides automation scripts. Plans overall documentation needs and provides technical documentation relating to system design, application deployment planning, and production support requirements. Ensures that changes in business entities and processes in go-forward analysis and system documentation. Plays a significant role in ensuring that documentation is completed and reviewed by peers and stakeholders Drives quality best practices including design reviews, unit testing, code reviews, and continuous integration to ensure a defect-free delivery. Maintains consistency and encourages improvement Supports the activities of downstream teams by reviewing test plans, supporting test execution, fixing defects, and by coordinating response to production issues. Proactively seeks to minimize impacts to stakeholders through planning and employing a systematic approach to managing issue queues Other duties as assigned. SUPERVISORY RESPONSIBILITIES This job has no supervisory responsibilities. MINIMUM REQUIREMENTS To perform this job successfully, an individual must be able to perform each essential duty satisfactorily. The requirements listed below are representative of the knowledge, skill, and/or ability required. Bachelor’s degree in Computer Science or related field and ten (10) years software design and development experience; or equivalent combination of education and experience. COMPETENCIES Ability to communicate, present, facilitate and collaborate with others. Experience in technical documentation and development of test cases for quality review. Must have advanced proficiency in the following: Applied domain and solution analysis Solution design and use of design best practices and patterns Programming code and scripting Expertise with diverse software architectures and system platforms WORK ENVIRONMENT / PHYSICAL ACTIVITY The physical demands described here are representative of those that must be met by an employee to successfully perform the essential functions of this job. Reasonable accommodations may be made to enable individuals with disabilities to perform the essential functions. Work is in an office setting and generally sedentary with physical effort associated with using a computer, but may involve walking or standing for brief periods of time. May be required to occasionally lift, carry, push, pull, or otherwise move objects up to 25 pounds. In addition to the base wage listed, this position is also eligible to earn an annual bonus subject to changes in plan design and documents and in accordance with applicable law. Eligibility and the amount of the bonus varies based on overall company success, thresholds met and other terms and conditions of the Company’s active bonus policy for the respective year. Full-Time Team Members are eligible for company benefits, including • Three Medical plan options • Dental & Vision • Critical Care • Accident & Hospital insurance Flexible Spending Accounts for Health & Dependent Care • Health Savings Account • 401(k) with company match • Vacation & Sick Time • Paid company holidays Company Paid Life & AD&D • Supplemental Life • Short & Long Term Disability • Bereavement • Paid Parental Leave • Team Member Assistance Program All benefits are subject to change pursuant to state and federal guidelines. Builders FirstSource is an Equal Opportunity/Affirmative Action Employer. All qualified applicants will receive consideration for employment without regard to race, color, religion, sex, national origin, protected veteran status or status as an individual with a disability. In compliance with the ADA Amendments Act (ADAAA), if you have a disability and would like to request an accommodation in order to apply for a position with Builders FirstSource, please call (214) 765-3990 or email: ADA.Accommodation@bldr.com. Please do not send resumes to this email address - it is intended only to be used to request an accommodation in submitting an application for a job opening. https://www.dol.gov/ofccp/regs/compliance/posters/ofccpost.htm EEO THE LAW - English/Spanish EEO IS THE LAW - SUPPLEMENT - English/Spanish Pay Transparency Provision - English/Spanish If you require alternative methods of application or screening, you must approach the employer directly to request this as Indeed is not responsible for the employer's application process.",https://www.indeed.com/jobs?q=Data+Engineer&l=Dallas%2C+TX&sc=0kf%3Aattr%28FCGTU%7CHFDVW%7CQJZM9%7CUTPWG%252COR%29explvl%28SENIOR_LEVEL%29jt%28fulltime%29%3B&vjk=7f939bc135ad5e20
6,372aa4b6db63f8f7,Data Engineer,"Dallas, TX",SENIOR_LEVEL,BACHELORS_DEGREE,fulltime,"Big Data Full Stack Engineer - job post Toyota 110 reviews Plano, TX 75024 • Hybrid remote Full-time You must create an Indeed account before continuing to the company website to apply Apply on company site save-icon Job details Job Type Full-time Overview Who we are Toyota Research & Development is racing toward a new future of mobility with a diverse team to help us enhance and design products to help people move. Headquartered in Michigan, the research hub of America, we offer competitive salaries, amazing benefits, leadership which prioritizes growth and development, and the chance to play a substantial role in our constant pursuit of innovation and advanced technology. Join an inclusive team environment that puts “respect for people” first, with long-term career opportunities within R&D or across Toyota’s enterprise. This position is based in Plano TX Toyota encourages all employees to live within a reasonable commuting distance of their assigned work location. Hybrid work from outside of the assigned work location may be permitted in a pre-approved list of states (AZ, CA, CO, GA, IL, IN, KY, MA, MI, MO, NJ, NY, OH, OR, TN, TX, VA, WV) with certain stipulations. Speak with your recruiter and hiring manager to learn more about our hybrid work program. To save time applying, Toyota does not offer sponsorship of job applicants for employment-based visas or any other work authorization for this position at this time. Who we’re looking for: Toyota’s Data and Analytics Department is looking for a passionate and highly motivated Big Data Full Stack Engineer. The primary responsibility of this role is to develop best-in-class data engineering solutions with cutting-edge technologies guided by principles of agility, DevSecOps, and continuous innovation. This is an individual contributor role that requires working with data science teams across the company and developing data engineering solutions to ensure the successful implementation of AI/ML initiatives with high standards of performance, and scalability while optimizing the cost and using emerging technologies in the Data universe. Reporting to the Manager, Data Science Platform, the person in this role will support the Data and Analytics department's objective to accelerate insights and drive business value by unleashing the power of data. What you will be doing: Design and develop highly scalable and state-of-the-art big data solutions in AWS and GCP to enable advanced analytics capabilities in the company. Design and build scalable data pipelines with optimal data ingestion, extraction, transformation, and loading (ELT, ETL) of data from a wide variety of data sources using Big Data and Integration technologies. Develop data models and features required for data scientists to build data science models. Perform design, feature, and code reviews to drive excellence in engineering and ensure high quality & maintainability. Support the build of analytics tools that utilize the data pipeline to provide actionable insights for business stakeholders, including data preparation for predictive and prescriptive modeling. Be current on the latest industry developments and trends to help lead the development of system/process improvements. Collaborate with Product owners, Data Scientists, Platform Teams, Business SMEs as well as different sub-groups within the Data organization to effectively lead data and analytics solutions. What you bring: Bachelor’s degree in Information Systems, Computer Science, or related discipline or equivalent work experience. 5 years of demonstrated experience in developing big data solutions that support business analytics and data science teams. 8 or more years of proficient experience developing data platforms, data warehouses, ETL/ELT pipelines, and programming in SQL, Python, Java, Scala-Spark, Bash, and other scripting languages. Strong knowledge and hands-on experience in Big Data technologies in Cloud such as AWS EMR, Apache Spark, Databricks, AWS Redshift, Snowflake, S3, GCP Big Query, Google Cloud Storage, and Google Data Proc. Competent with various batch & real-time streaming ingestion patterns with Sqoop, Kafka, Kinesis, and GCP Pub/Sub. Proven leadership in cloud administration with an emphasis on infrastructure automation (Terraform, Cloud Formation) and provisioning Lambda, SNS, EC2, Airflow, Elastic Cache, Redis, RESTful APIs in AWS Knowledge of DevOps methodology and automation experience with Jenkins, Ansible, Chef, XL Release, and XL Deploy Ability to research the latest trends and propose advanced tooling/solutions for data virtualization & digital twin concepts. Strong written and verbal communication skills with the ability to create and present concepts, roadmaps, and recommendations to executive management. Bonus if you have: Master’s degree in Computer Science or related discipline. AWS/GCP cloud certifications. AWS/GCP Data Engineering certifications. Experience with Automobile and/or Manufacturing organizations. What we’ll bring: During your interview process, our team can fill you in on all the details of our industry-leading benefits and career development opportunities. A few highlights include: A work environment built on teamwork, flexibility, and respect. Professional growth and development programs to help advance your career, as well as tuition reimbursement. Vehicle purchase & lease programs. Comprehensive health care and wellness plans for your entire family. Flextime and virtual work options (if applicable). Toyota 401(k) Savings Plan featuring a company match, as well as an annual retirement contribution from Toyota regardless of whether you contribute. Paid holidays and paid time off. Referral services related to prenatal services, adoption, childcare, schools, and more. Flexible spending accounts. Relocation assistance (if applicable). Belonging at Toyota Our success begins and ends with our people. We embrace diverse perspectives and value unique human experiences. Respect for all is our North Star. Toyota is proud to have 10+ different Business Partnering Groups across 100 different North American chapter locations that support team members’ efforts to dream, do and grow without questioning that they belong. As a company that has been one of DiversityInc’s Top 50 Companies for Diversity and a member of The Billion Dollar Roundtable supporting minority and woman-owned suppliers for over 10 years, we are proud to be an equal opportunity employer that celebrates the diversity of the communities where we live and do business. Applicants for our positions are considered without regard to race, ethnicity, national origin, sex, sexual orientation, gender identity or expression, age, disability, religion, military or veteran status, or any other characteristics protected by law. Have a question or need assistance with your application? Check out the How to Apply section of our careers page on Toyota.com or send an email to talent.acquisition@toyota.com.",https://www.indeed.com/jobs?q=Data+Engineer&l=Dallas%2C+TX&sc=0kf%3Aattr%28FCGTU%7CHFDVW%7CQJZM9%7CUTPWG%252COR%29explvl%28SENIOR_LEVEL%29jt%28fulltime%29%3B&vjk=372aa4b6db63f8f7
