,job_id,job_title,location,experience,education,job_type,job_description,job_link
0,7e4bb4278d9c80cc,Machine Learning Engineer,"San Francisco, CA",ENTRY_LEVEL,BACHELORS_DEGREE,fulltime,"Sr. Data Scientist - job post Adobe 749 reviews San Francisco, CA 94103 $122,400 - $223,000 a year -  Full-time Adobe 749 reviews Read what people are saying about working here. You must create an Indeed account before continuing to the company website to apply Apply on company site save-icon Job details Salary $122,400 - $223,000 a year Job Type Full-time Our Company Changing the world through digital experiences is what Adobe’s all about. We give everyone—from emerging artists to global brands—everything they need to design and deliver exceptional digital experiences! We’re passionate about empowering people to create beautiful and powerful images, videos, and apps, and transform how companies interact with customers across every screen. We’re on a mission to hire the very best and are committed to creating exceptional employee experiences where everyone is respected and has access to equal opportunity. We realize that new ideas can come from everywhere in the organization, and we know the next big idea could be yours! The Opportunity As a data scientist within the Creative Cloud Experience and Engagement organization, you will be a core part of the data science and analytics team, driving analytics-based insights that enable engaging experiences for our Creative Cloud customers, and bring users to experience core product value quickly across the Creative Cloud business. We’re looking for a candidate who is passionate about deriving impactful customer insights from large datasets, through descriptive, diagnostic, predictive and prescriptive analytics techniques. The ideal candidate will have a combination of strong analytical and technical skills, along with the ability to work with multi-functional teams, and the curiosity and ability to influence data-driven decision making by key partners. What you'll Do Drive analytics for user revenue/engagement growth programs and A/b tests through analyzing results and communicating insights. Partner with product managers to understand product/customer behavior and features, and use insights generated to make recommendations to improve customer experience and engagement. Be a specialist of stitching and calibrating sparse and noisy data across various data sources. Support regular ad-hoc data and analysis needs to better understand customer behavior. Build reporting frameworks / resources that enable partners to self-serve information. Partner with teams including product analytics, Go-To-Market and Campaign. What you need to succeed Master's / PhD degree in Computer Science, Analytics/Data Science, Statistics, or related quantitative field, or a Bachelor's degree in a similar field with relevant practical experience Strong skills in a data science/analytics role with a proven track record of success Experience in hypothesis testing and A/b test analytics Expertise in working with large data sets using Hive/SQL Hands-on experience working with Hadoop. Bonus points for prior experience working on any Cloud Platform eg Databricks. Expertise in developing sophisticated reports/dashboards using Tableau Good attention to detail and ability to stitch and QA multiple data sources. Strong analytical and quantitative problem-solving ability Excellent oral and written communication skills Ability to synthesize large scale data sets to generate a clear story and impactful insights A curious mind, passion, and motivation to learn new skills, tools, and analytics techniques critical to tackle business challenges. Our compensation reflects the cost of labor across several U.S. geographic markets, and we pay differently based on those defined markets. The U.S. pay range for this position is $122,400 -- $223,000 annually. Pay within this range varies by work location and may also depend on job-related knowledge, skills, and experience. Your recruiter can share more about the specific salary range for the job location during the hiring process. At Adobe, for sales roles starting salaries are expressed as total target compensation (TTC = base + commission), and short-term incentives are in the form of sales commission plans. Non-sales roles starting salaries are expressed as base salary and short-term incentives are in the form of the Annual Incentive Plan (AIP). In addition, certain roles may be eligible for long-term incentives in the form of a new hire equity award.",https://www.indeed.com/jobs?q=Data+Scientist&l=San+Francisco%5D+%23%2C+CA&sc=0kf%3Aattr%28EXSNN%7CFCGTU%7CHFDVW%7CQJZM9%7CUTPWG%252COR%29explvl%28SENIOR_LEVEL%29jt%28fulltime%29%3B&vjk=7e4bb4278d9c80cc
1,4bc8f3cabe6fedb1,Machine Learning Engineer,"San Francisco, CA",ENTRY_LEVEL,BACHELORS_DEGREE,fulltime,"Senior Product Data Scientist, Search - job post Cash App 3 reviews San Francisco, CA Full-time Cash App 3 reviews Read what people are saying about working here. You must create an Indeed account before continuing to the company website to apply Apply on company site save-icon Job details Encouraged to Apply Fair chance Job Type Full-time Company Description It all started with an idea at Block in 2013. Initially built to take the pain out of peer-to-peer payments, Cash App has gone from a simple product with a single purpose to a dynamic app, bringing a better way to send, spend, invest, borrow and save to our millions of monthly active users. With a mission to redefine the world's relationship with money by making it more relatable, available and accessible, at Cash App you'll have the opportunity to make a real-world impact with your career. Today, Cash App has thousands of employees around the world with a culture geared toward creativity, collaboration and impact. We’ve been a distributed team since day one, and continue to value working across time zones and continents both remotely and in our Cash App offices. Our offices are great, but many of our roles can be done remotely from the countries where Block operates. We tailor our experience to champion our employees’ creativity and productivity wherever they are. Job Description We are looking for Senior Product Data Scientists to join Block and help build Cash App, the fastest growing financial app in the world. We are reinventing the way people think about banking and financial services through our P2P, Banking, Cash Card, Boost, BTC, and stock investing products. We derive valuable insights from our extremely unique datasets and turn those into actions that improve the experience for our customers every day. This role is part of our Cash App’s Product Data science org and will be deeply embedded within our Search & Discovery team. You will use data science to better understand our customers and offer them delightful experiences to find and discover people and things quickly and with trust - we aim to grow and strengthen the connections between people and businesses across the globe. Through your work, you will empower Cash App to personalize customers’ search and discovery experiences with DS/ML, to better understand customers’ journeys, and help identify and execute on new opportunities for product improvement. You will test and employ a variety of analytical and modeling techniques on our comprehensive data and scale your solution to production by partnering closely with machine learning, product, design, and engineering teams. Qualifications You will: Partner directly with a Cash App product team, working closely with product managers, engineers, designers, and machine learning engineers Analyze large datasets using SQL and python to surface meaningful & actionable insights/opportunities to the product team and other key stakeholders Approach problems from first principles, using a variety of statistical and mathematical modeling techniques to research and understand customer behavior Design and analyze A/B experiments to evaluate the impact of changes we make to the product Work with engineers to log new, useful data sources as we build new product features Build, forecast, and report on metrics that drive strategy and facilitate decision making for key business initiatives Write code to effectively process, cleanse, and combine data sources in unique and useful ways, often resulting in curated ETL datasets that are easily used by the broader team Build and share data visualizations and self-serve dashboards for your product team Effectively communicate your work with team leads and cross-functional stakeholders on a regular basis Additional Information You have: A bachelor degree in statistics, data science, or similar STEM field with 4+ years of experience in a relevant role OR A graduate degree in statistics, data science, or similar STEM field with 2+ years of experience in a relevant role Advanced proficiency with SQL and data visualization tools (e.g. Tableau, Looker, etc) Experience with scripting and data analysis programming languages, preferably Python Experience with cohort and funnel analyses, a deep understanding statistical concepts such as selection bias, probability distributions, and conditional probabilities Experience with state of the art machine learning techniques such as regression, classification, recommendation system, and causal inference Experience with ElasticSearch Experience in a high-growth tech environment An appreciation for the connection between your work and the experience it delivers to customers Intellectual curiosity and a passion for what Cash App is building Technologies we use and teach: SQL (MySQL, Snowflake, BigQuery, etc.) Python (Pandas, Numpy) Tableau, Airflow, Looker To find a location’s zone designation, please refer to this resource. If a location of interest is not listed, please speak with a recruiter for additional information. Benefits include the following: Healthcare coverage Retirement Plans including company match Employee Stock Purchase Program Wellness programs, including access to mental health, 1:1 financial planners, and a monthly wellness allowance Paid parental and caregiving leave Paid time off Learning and Development resources Paid Life insurance, AD&D. and disability benefits Perks such as WFH reimbursements and free access to caregiving, legal, and discounted resources This role is also eligible to participate in Block's equity plan subject to the terms of the applicable plans and policies, and may be eligible for a sign-on bonus. Sales roles may be eligible to participate in a commission plan subject to the terms of the applicable plans and policies. Pay and benefits are subject to change at any time, consistent with the terms of any applicable compensation or benefit plans. We’re working to build a more inclusive economy where our customers have equal access to opportunity, and we strive to live by these same values in building our workplace. Block is a proud equal opportunity employer. We work hard to evaluate all employees and job applicants consistently, without regard to race, color, religion, gender, national origin, age, disability, pregnancy, gender expression or identity, sexual orientation, citizenship, or any other legally protected class. We believe in being fair, and are committed to an inclusive interview experience, including providing reasonable accommodations to disabled applicants throughout the recruitment process. We encourage applicants to share any needed accommodations with their recruiter, who will treat these requests as confidentially as possible. Learn more about our efforts to promote inclusion and diversity at block.xyz/inclusion Additionally, we consider qualified applicants with criminal histories for employment on our team, assessing candidates in a manner consistent with the requirements of the San Francisco Fair Chance Ordinance. Block, Inc. (NYSE: SQ) is a global technology company with a focus on financial services. Made up of Square, Cash App, Spiral, TIDAL, and TBD, we build tools to help more people access the economy. Square helps sellers run and grow their businesses with its integrated ecosystem of commerce solutions, business software, and banking services. With Cash App, anyone can easily send, spend, or invest their money in stocks or Bitcoin. Spiral (formerly Square Crypto) builds and funds free, open-source Bitcoin projects. Artists use TIDAL to help them succeed as entrepreneurs and connect more deeply with fans. TBD is building an open developer platform to make it easier to access Bitcoin and other blockchain technologies without having to go through an institution.",https://www.indeed.com/jobs?q=Data+Scientist&l=San+Francisco%5D+%23%2C+CA&sc=0kf%3Aattr%28EXSNN%7CFCGTU%7CHFDVW%7CQJZM9%7CUTPWG%252COR%29explvl%28SENIOR_LEVEL%29jt%28fulltime%29%3B&vjk=4bc8f3cabe6fedb1
2,59c72c4eb333b65a,Machine Learning Engineer,"San Francisco, CA",ENTRY_LEVEL,BACHELORS_DEGREE,fulltime,"Senior Research Data Scientist - job post Coalition San Francisco, CA 94105 • Remote Full-time Apply now Apply now save-icon Job details Job Type Full-time About Us Founded in 2017, Coalition combines cybersecurity and insurance to help organizations prevent digital risk before it strikes. Coalition's Active Insurance policies combine traditional coverage with a digital risk assessment and monitoring technology to help small and medium-sized businesses protect themselves in today's hyper-connected world. The team at Coalition is made up of cybersecurity and technology experts, as well insurance industry veterans. Our secret sauce is bringing this expertise together to create a world-class organization with a massive technological advantage. Coalition is also backed by leading global insurers like Allianz, Arch Insurance, Lloyd's of London, Swiss Re and Zurich North America. Today, Coalition is one of the world's largest commercial insurtech serving over 160,000 customers. In June 2022, Coalition closed an additional $250 million in Series F Funding to accelerate its rapid growth at a time when many other companies struggled to find funding. This latest funding validated that Coalition is building a long-term business that can deliver profitable growth with a clear strategic advantage. Coalition has experienced tremendous growth by helping organizations of all sizes solve real-world problems and by remaining true to our founding values of character, humility, responsibility, purpose, authenticity and inclusion. We are proud to have been named among Inc.'s Best Workplaces of 2021 and one of Fast Company's most innovative companies for 2022. About the Role As a Senior Research Data Scientist at Coalition, you will be responsible for measuring, understanding, and helping optimize Coalition's usage of data for cyber insurance. You will use analytics, experimentation, and modern statistical techniques to help us understand and improve our cyber risk selection/reduction, pricing, and automation to grow our revenue in a safe and efficient manner. Responsibilities Lead cross-functional projects using quantitative analysis and advanced data modeling to discover insights that will guide strategic operational decisions and uncover optimization opportunities Analyze large scale data for creation of risk signals to be used for insurance pricing and risk selection Lead the design and delivery of data models, reporting systems, data automation systems, dashboards and performance metrics that support key product decisions Analyze disparate data sources and synthesize into a narrative of what is happening in the data Train and mentor junior employees Contribute and grow the culture of data excellence on our team by bringing mature empathy, best practices, and processes to our organization Skills and Qualifications Bachelor's degree in Statistics, Economics, Mathematics or related technical field 5+ years of experience in related analytical, data science or consulting background Understanding of and experience with experimental design and statistical methods Experience working with data in Python, R and similar tools Strong communication skills and ability to convey complex topics to non-technical audiences Passion, drive, and a deep sense of responsibility. We build the systems that keep us and our customers safe! Bonus Skills Experience with cybersecurity data Exposure to causal inference, and other advanced statistical methods to measure impact of initiatives Perks 100% medical, dental and vision coverage Flexible PTO policy Annual home office stipend and WeWork access Mental & physical health wellness programs (One Medical, Headspace, Gympass, and more)! Competitive compensation and opportunity for advancement Coalition's individual pay is determined on several factors, including but not limited to, location, level, skills and experience. The US base salary range for this full-time position is $125,000 - $205,000, and your recruiter can share more on target salary for your location during the interview process. #LI-Remote Why Coalition? We're a highly fulfilling, mission-driven team who is committed to building a more diverse and inclusive culture. We want to work with people of all different backgrounds and paths in life, and we trust our team members to take responsibility, share ownership and put in the work, no matter how small the task. We are always looking for collaborative, inquisitive and dedicated individuals to join #OurCoalition and help us on our mission to solve digital risk. Recent press releases: To learn more, check out our featured press releases: Coalition Closes $250 Million in Series F Funding, Valuing the Cyber Insurance Provider at $5 Billion Coalition Named to Fast Company's Annual List of of the World's Most Innovative Companies for 2022 Coalition Launches Active Insurance, Reaches $650M Run Rate GWP Coalition launches tech-powered executive risks products with personalized risk assessment for all US small-businesses Coalition's very foundation is built on respecting and encouraging diversity and inclusion across the organization. Coalition is proud to be an Equal Opportunity and Affirmative Action employer. We do not discriminate based upon race, religion, color, national origin, sex (including pregnancy, childbirth, or related medical conditions), sexual orientation, gender, gender identity, gender expression, transgender status, sexual stereotypes, age, status as a protected veteran, status as an individual with a disability, or other applicable legally protected characteristics. For CA residents, please view important privacy information here. For EU residents, you can view GDPR information here. For any questions regarding CCPA or GDPR, please contact us at privacy@coalitioninc.com. If you require alternative methods of application or screening, you must approach the employer directly to request this as Indeed is not responsible for the employer's application process.",https://www.indeed.com/jobs?q=Data+Scientist&l=San+Francisco%5D+%23%2C+CA&sc=0kf%3Aattr%28EXSNN%7CFCGTU%7CHFDVW%7CQJZM9%7CUTPWG%252COR%29explvl%28SENIOR_LEVEL%29jt%28fulltime%29%3B&vjk=59c72c4eb333b65a
