,job_id,job_title,location,experience,education,job_type,job_description,job_link
6,115afa711de1110e,Machine Learning Engineer,"San Francisco, CA",ENTRY_LEVEL,BACHELORS_DEGREE,fulltime,"Director, Scientific Data Division - job post Lawrence Berkeley National Laboratory 190 reviews San Francisco Bay Area, CA $325,000 - $365,000 a year -  Full-time Lawrence Berkeley National Laboratory 190 reviews Read what people are saying about working here. You must create an Indeed account before continuing to the company website to apply Apply on company site save-icon Job details Salary $325,000 - $365,000 a year Job Type Full-time Lawrence Berkeley National Laboratory is seeking an experienced scientific leader with an outstanding record of research accomplishments in data science, computer science, computational science, applied math, or related fields to serve as the Director of the Scientific Data (SciData) Division. About the Position: This is an unparalleled opportunity to lead a research division that is internationally recognized for excellence in computer science, data science, and computational research, and to foster an environment that supports high-quality scientific research in foundational and groundbreaking fields and further advances in data-intensive computational science. The SciData Division Director oversees a staff of 100 employees and affiliates and an annual budget of $30 million. Responsibilities include: Providing vision and leadership for the Division; Overseeing research, operations, finance, human resources, and environmental health and safety; Establishing a culture of excellence and inclusion by recruiting a diverse team of outstanding scientists and staff, enthusiastically supporting and promoting their career development; and Advancing Berkeley Lab’s stewardship values of team science, innovation, trust, respect, and service, including building and maintaining a culture that is committed to the ideals of Inclusion, Diversity, Equity, and Accountability. Reporting to the Associate Laboratory Director for Computing Sciences, the SciData Director serves as a member of the executive team of the Computing Sciences Area, comprising the National Energy Research Scientific Computing Center (NERSC), Scientific Networking, and Applied Mathematics and Computational Research Divisions in addition to the SciData Division. The Director builds collaborative partnerships and programs within the Computing Sciences Area, with other Divisions at Berkeley Lab, and with external research institutions to contribute to large-scale, multidisciplinary initiatives, such as quantum information science and Artificial Intelligence. About the Scientific Data Division: The SciData Division transforms data-driven discovery and understanding through the development and application of novel data science methods, technologies, and infrastructures in partnership with science domain experts. Its work in machine learning involves researching, developing and sharing the algorithms, software, tools, and libraries that are fundamental to scientific machine learning. The Division builds tools and models that transform data generated by simulations, experiments, and observations to a form that researchers can manipulate to gain scientific insight. It advances and leverages data management, analytics, and security techniques to solve important problems in scientific cyber infrastructure and energy delivery systems. The Division also leads software engineering, software release management, and software development efforts that promote the visibility, usability, reliability, and sustainability of software products in domains from chemical engineering to high-energy physics. Just as research and development programs benefit science, domain scientists influence and contribute to the direction and content of SciData’s research. SciData works in partnership with a variety of experts in domains ranging from biology and materials science to fundamental physics and climate science to develop tools, techniques, and technologies to meet the data-analysis challenges posed by present and future experimental, observational, and simulation data. SciData researchers regularly win Best Paper awards, are called upon to give keynote addresses at international conferences, and develop leading-edge software that researchers worldwide use to produce impactful results. The SciData Division has a diverse funding portfolio, including from the U.S. Department of Energy (DOE) Office of Science. Learn more about the SciData Division here. Key Responsibilities: Research Direction: Provide scientific and operational leadership for SciData research programs, overseeing a $30-million portfolio and approximately 100 staff, including scientists, postdoctoral fellows, professional staff, and students, as well as several affiliates. Develop new initiatives advancing a long-term research vision and strategic plan aligned with national goals, and working collaboratively with Berkeley Lab senior leadership. Play a key role in the formulation and direction of Laboratory programs, strategy, and research policies that enhance Berkeley Lab’s preeminence as a National Laboratory. Partnership, Communications, and Culture: Work closely with Division Directors and Associate Lab Directors across the Laboratory to support existing high visibility collaborations and identify new opportunities to collaborate. Develop cooperative programs with colleagues at University of California and other research institutions. Establish and communicate the SciData Division’s mission , goals, programs, and accomplishments to Division staff and funding sponsors, Berkeley Lab staff and leadership, and to the broader research community. Liaise with DOE and other funding agencies, in partnership with other DOE Laboratories, to champion data science research, influence future research directions, and communicate new ideas; implement DOE policies as they impact the SciData Division. Foster a culture of diversity, inclusion, equity, and accountability by: following best practices in recruitment and promotion; engaging staff at all levels through communication, involvement, and recognition; and encouraging diverse committees and panels. Research Operations: Ensure operational effectiveness and compliance , in partnership with the Operations Deputy, across the operations areas, including budgets, funding, workforce planning, human resources management, environmental health and safety, property, space, and facilities management. Guide strategies for hiring, retaining, and developing a diverse and productive staff. Help assure the efficient, effective, and safe operation of the Laboratory as a member of Berkeley Lab’s scientific and operational management team . Qualifications: Education: Ph.D. or equivalent education/experience in computer science, data science, applied math, or a related field, and at least 10 years of professional experience. Research Expertise: An expert and leader in an area of computer science, data science, computational science, applied math, or other fields related to the SciData Division’s research programs. Strong record of research accomplishments, as evidenced by scholarly publications, patents, development and release of software products, and/or funded research grants. Research Program Development & Management: Experience and demonstrated competence in the management of scientific projects and collaborative science. Strategic leadership ability applicable to running a diverse, team-oriented organization with a multidisciplinary group of scientists and engineers. Ability to interact effectively with funding agencies and initiate substantial new research efforts and collaborations. Communications and Culture: Effective interpersonal and communication skills, and the ability to interact at the highest level of management, both internally and externally, in a constructive and collaborative manner and in a way that appropriately represents the Laboratory. Commitment to diversity, inclusion, equity, and accountability, including a commitment to mentoring and career development of personnel. Research Operations: Experience in effective oversight of operational functions, creativity in decision making and problem solving, and experience in human resource management. Application Guidelines: For full consideration, please submit your CV and cover letter by February 15, 2023 . In the cover letter, highlight your interest and vision for the position as well as relevant professional experience and accomplishments, including personal contributions to diversity, equity, and inclusion. Notes: This is a full-time career appointment, exempt (monthly paid) from overtime pay. This position is expected to pay $325,000 to $365,000 annually; salary for this position will be commensurate with the final candidate’s qualifications and experience, including skills, knowledge, relevant education, certifications, as well as aligned with the internal leadership peer group. Please note the above pay scale fits within the full salary range of $220,380 to $457,392 for the Scientific Division Director job classification. It is not typical for an individual to be offered a salary at or near the top of the full range for a position. This position may be subject to a background check. Any convictions will be evaluated to determine if they directly relate to the responsibilities and requirements of the position. Having a conviction history will not automatically disqualify an applicant from being considered for employment. The Scientific Data Division Director position is a career position that is appointed by and serves at the discretion of the Laboratory Director, and this appointment is at will and may be terminated at any time with or without cause. This position is subject to the financial disclosure requirements of the California Political Reform Act of 1974. The successful candidate for this position will be required to file financial interest statements upon assuming this position, annually while holding this position, and when leaving this position. Work will be primarily performed at: Lawrence Berkeley National Lab, 1 Cyclotron Road, Berkeley, CA. About Berkeley Lab Berkeley Lab is a U.S. Department of Energy (DOE) national laboratory managed by the University of California and designated a Federally Funded Research and Development Center. The Laboratory conducts world-class research that supports clean energy, a healthy planet, and solution-inspired discovery science. Berkeley Lab is defined by our deeply felt sense of stewardship, which we describe as a commitment to taking care of the Laboratory's research, people, and resources that are entrusted to us. Our values of team science, innovation, service, trust, and respect knit us together as a community. We practice these values and prioritize our principles of inclusion, diversity, equity, and accountability (IDEA) to build highly effective teams that produce world-class science and technology and where all individuals, regardless of their backgrounds, disciplines, and experiences, can thrive. More about Berkeley Lab. Based on University of California Policy - SARS-CoV-2 (COVID-19) Vaccination Program and U.S Federal Government requirements, Berkeley Lab requires that all members of our community obtain the COVID-19 vaccine as soon as they are eligible. As a condition of employment at Berkeley Lab, all Covered Individuals must Participate in the COVID-19 Vaccination Program by providing proof that vaccination requirements have been met or submitting a request for Exception or Deferral. Visit covid.lbl.gov for more information. Berkeley Lab is committed to Inclusion, Diversity, Equity and Accountability (IDEA) and strives to continue building community with these shared values and commitments. Berkeley Lab is an Equal Opportunity and Affirmative Action Employer. We heartily welcome applications from women, minorities, veterans, and all who would contribute to the Lab's mission of leading scientific discovery, inclusion, and professionalism. In support of our diverse global community, all qualified applicants will be considered for employment without regard to race, color, religion, sex, sexual orientation, gender identity, national origin, disability, age, or protected veteran status. Equal Opportunity and IDEA Information Links: Know your rights, click here for the supplement: Equal Employment Opportunity is the Law and the Pay Transparency Nondiscrimination Provision under 41 CFR 60-1.4.",https://www.indeed.com/jobs?q=Data+Scientist&l=San+Francisco%5D+%23%2C+CA&sc=0kf%3Aattr%286QC5F%252COR%29explvl%28SENIOR_LEVEL%29jt%28fulltime%29%3B&vjk=115afa711de1110e
7,5141d5aae99a423f,Machine Learning Engineer,"San Francisco, CA",ENTRY_LEVEL,BACHELORS_DEGREE,fulltime,"Senior Data Scientist - Optimization - job post AutoGrid Systems 13 reviews Redwood City, CA 94065 Full-time AutoGrid Systems 13 reviews Read what people are saying about working here. Apply now Apply now save-icon Job details Job Type Full-time About AutoGrid The world’s leading energy companies turn to AutoGrid to integrate all distributed energy resources, turn on new revenue streams and drive deeper engagement with their customers. Our suite of Energy Internet applications allows utilities, electricity retailers, renewable energy project developers and energy service providers to deliver clean, affordable and reliable energy in a distributed energy world. How do we do this? By pioneering the science of flexibility management. This innovative approach enables energy providers to mine the Energy Internet’s rich data lode to extract flexible capacity from distributed energy resources. In turn, flexible capacity can be used to balance energy supply and demand in real time, increase the productivity and value of energy assets, and deliver new energy services to customers Established at Stanford University in 2011, we have assembled a team of world-class software architects, electrical and computer engineers, data scientists and energy experts who apply cutting-edge analytics and in-depth energy data science to solve the world’s most critical energy problems. About the Role As Senior Data Scientist, you would be working with a team of other data scientists on the core optimization capabilities of the company in an agile environment. Experience in energy / utility or related markets is desirable but not necessary. Experience in building mission critical, highly scalable optimization applications is a must. Candidate should have a deep understanding of various optimization algorithms as well as practical experience of working with open-source and commercial solvers. Responsibilities Develop and maintain the optimization models and software implementation that drives AutoGrid’s predictive controls platform for managing distributed energy resources Benchmark and debug critical issues with the algorithms and software as they arise Contribute to improving scalability and reliability of the system Work with product owners to develop new features and capabilities About You B.S., MS., or Ph.D. in computer science, operations research, industrial engineering, or related field Experienced with solving large optimization problems using linear / non-linear / integer / dynamic / stochastic programming, as well as heuristic approaches Deep understanding of algorithms, data structures, performance optimization techniques, relational databases, and software development in a team environment Excellent programming skills in Python, Java or C++ Experience with optimization modeling languages (e.g. Pyomo, GAMS) and solvers (e.g. CBC, Cplex, Gurobi) Nice to Have Experienced with decomposition approaches to solving large-scale optimization problems Hands-on experience with time series forecasting Understanding of energy and capacity markets Experience with frameworks such as Redis, Kafka, Celery, Hadoop/Spark Start-up experience, entrepreneurial spirit, energetic! Benefits and Perks Working with a smart, collaborative, and fun group of people solving big important problems An exciting atmosphere, and an outstanding work/life balance Beautiful, spacious, modern office in Redwood Shores Flexible hours and choice of computer (Mac, Ubuntu, Windows) Competitive salary and equity Competitive health care, dental, and vision coverage Excellent 401(k) and flexible spending plans Three weeks of paid time off annually, in addition to 10 paid public holidays Life, short term and long-term disability, supplemental, and AD&D insurance Commuter transit, parking, biking, vanpool and park & ride benefits AutoGrid is an equal opportunity employer. We do not make hiring, employment or promotion decisions based on race, religion, color, sex, age, national origin, ancestry, sexual orientation, gender or identity or expression, pregnancy or pregnancy-related condition, marital status, height and/or weight. SPEnoK5oEq If you require alternative methods of application or screening, you must approach the employer directly to request this as Indeed is not responsible for the employer's application process.",https://www.indeed.com/jobs?q=Data+Scientist&l=San+Francisco%5D+%23%2C+CA&sc=0kf%3Aattr%286QC5F%252COR%29explvl%28SENIOR_LEVEL%29jt%28fulltime%29%3B&vjk=5141d5aae99a423f
8,1773acea98181197,Machine Learning Engineer,"San Francisco, CA",ENTRY_LEVEL,BACHELORS_DEGREE,fulltime,"Data Scientist/Senior Data Scientist, Metabolomics - job post CALICO 2 reviews South San Francisco, CA 94080 $133,000 - $162,000 a year -  Full-time CALICO 2 reviews Read what people are saying about working here. You must create an Indeed account before continuing to the company website to apply Apply on company site save-icon Job details Salary $133,000 - $162,000 a year Job Type Full-time Who we are: Calico (Calico Life Sciences LLC) is an Alphabet-founded research and development company whose mission is to harness advanced technologies and model systems to increase our understanding of the biology that controls human aging. Calico will use that knowledge to devise interventions that enable people to lead longer and healthier lives. Calico’s highly innovative technology labs, its commitment to curiosity-driven discovery science and, with academic and industry partners, its vibrant drug-development pipeline, together create an inspiring and exciting place to catalyze and enable medical breakthroughs. Position Description: Calico is seeking an expert Data Scientist to join our multidisciplinary team of mass spectrometrists, biologists and computer scientists to become an integral part of our solution for metabolomics and lipidomics experiments. At Calico we’re producing substantial mass spectrometry data related to metabolomics and lipidomics, including LC-QQQ-MS, LC-HRMS, and direct-infusion-MS data modalities to support experiments ranging from custom one-offs to large cohort studies and spanning models that include yeast, tissue culture, and in vivo systems. This role will work collaboratively with members of the Metabolomics group, the Computing team, and the broader research organization to design experiments, get the most out of the data generated to improve biological understanding, and contribute to changes in the analytical methods that will lead to improved data generation. The ideal candidate is someone who sees themselves as adept at mass spectrometry data analysis and thrives when given space to innovate. This role will have the support of a multidisciplinary team that includes engineers, physicists, biochemists, biologists, machine learning experts, software engineers, and data analysts. Position responsibilities: Work with scientists throughout R&D to design experiments and contribute to the analysis of the resulting data Develop new methods for the analysis and visualization of metabolomics and lipidomics data to enhance biological insights, and implement them for use by others (preferably in R) as needed Assess and implement external software solutions as needed to complement in-house software Apply cutting-edge statistical methods to derive robust & reproducible biological insights Empower and coach fellow scientists on their own experimental analysis needs Position requirements: Ph.D. with 1-2 years or M.S. with 5+ years B.S. with 7+ years relevant data science and software development experience Experience working with mass spectrometry data Biology and metabolism background sufficient to guide and inform analysis approaches Successful track record of performing data analysis on biological data sets to extract additional biological understanding Experience applying statistical and machine learning methods Extremely collaborative, with a mentality of trying to add value to many projects across Calico Must be willing to work onsite three days a week Nice-to-haves: Familiarity with externally available mass spectrometry and metabolism-related software tools Experience in joining metabolomics data with other data modalities, including proteomics and genomics Knowledge of in silico representations of metabolism, such as genome-scale metabolic models Comfort with additional programming languages (e.g., Python, SQL, Julia) The estimated base salary range for this role is $134,000 - $172,000. Actual pay will be based on a number of factors including experience and qualifications. This position is also eligible for two annual cash bonuses. Calico requires all new hires to be fully vaccinated for COVID-19 prior to the first date of employment. As required by applicable law, Calico will consider requests for Reasonable Accommodations. Job Type: Full-time Pay: $133,000.00 - $162,000.00 per year",https://www.indeed.com/jobs?q=Data+Scientist&l=San+Francisco%5D+%23%2C+CA&sc=0kf%3Aattr%286QC5F%252COR%29explvl%28SENIOR_LEVEL%29jt%28fulltime%29%3B&vjk=1773acea98181197
