,job_id,job_title,location,experience,education,job_type,job_description,job_link
4,488bd62f192b600f,Data Scientist,"San Francisco, CA",MID_LEVEL,BACHELORS_DEGREE,fulltime,"Director, Data Science & Analytics - job post Premier Nutrition 12 reviews Emeryville, CA 94608 • Remote Full-time You must create an Indeed account before continuing to the company website to apply Apply on company site save-icon Job details Job Type Full-time Business Unit Description: Here's what all the hype is about Premier Nutrition Company, LLC (PNC) is a clear leader in the convenient nutrition category and makes great-tasting food products under the brand names Premier Protein, Dymatize, and PowerBar, and is part of publicly-traded BellRing Brands (NYSE:BRBR). With its people-first culture, PNC empowers its people to create the best work of their lives alongside some truly astounding colleagues. PNC treats its people like adults with respect and trust. One of our five core values is to Connect & Belong because we bring our diverse backgrounds, life experiences, and ways of thinking to each challenge grounded in our belief that everyone should have a seat at the table and be listened to deeply. Whever makes you, you - you belong here. We strive to avoid many of the outdated processes of conventional workplaces. We don't have performance reviews we have quarterly conversations. We don't have management we have inspiring leaders to coach and mentor. We don't have a casual dress code we simply don't have a dress code; wear what you like. And we have a lot of fun. Bringing dogs to work, company-wide give-days days, philanthropy and sustainability programs, in-office massages, walking meetings, and free daily exercise classes on-site and at the adjacent gym are just a few ways we make work feel less like work. And the results of our great culture speak for itself: we were certified as a Great Place to Work™ for the sixth year-running in 2022 and ranked in the top 12 on Fortune Magazine’s Best Workplaces in our category for the past four years. So, what's it like to work here? If you're local, you'll walk into our Emeryville office each Monday morning and find 100 of your colleagues sitting on sofas, beanbag chairs, or the floor excitedly talking through the week ahead and watching one of their colleagues tell their personal life and career journey. Picture a casual and collaborative environment of a start-up, the innovative mindset of a tech company, and the stability of a company with revenue last year of over $1.3 billion, and you'll find us in the sweet spot where world-class culture meets robust business results. PNC seeks individuals who will thrive in this work environment and will help us build our culture and this high-growth company for the next phase in our amazing journey. Does this sound like you? Then read on. Responsibilities: The Role… This individual will be the leader of this practice and manage directly a talented yet small team. The goal of this position is for the hands-on director to extract and tell the story from the data to improve the efficiency and effectiveness of all things possible. The goal is to use data to positively impact the bottom line of the company. The Director, Data Science & Analytics position is responsible for executing the full-scope of advanced analytic techniques with the objectives of creating causal inferences, predictions, and recommendations for improvements to business processes, and the metrics to monitor those improvements. This position requires a strong command of techniques and algorithms as well as a demonstrated practical ability to determine where to invest time, synthesize actionable findings across diverse assignments, and present these findings to an audience with varying levels of background in analytics. This leadership position is responsible for recruiting and supervising a small staff, formulating and managing projects, and working with key stakeholders to establish roadmaps, present results, and resolve issues. This position can be based remotely, but the individual MUST live in California. If the incumbent lives outside of the Bay Area, monthly trips to our Emeryville, California office will be required. The expected pay scale this role is $190k to $210k, which may vary based on relevant experience, qualifications, geographic area (if applicable), and internal equity for the role. You’re excited about this opportunity because your time will be filled with… Platform Management: 35% of Time Deep knowledge and hands-on experience with driving data platform architectures, tools, & technologies including data acquisition, master data management, data quality & governance, compliance, data access layer, and analytics tools. Plan and lead the execution of the analytics life-cycle, leveraging significant experience in leading this type of work in previous roles. Perform problem formulation, requirements analysis, and planning, including selection of appropriate algorithms and execution. In conjunction with IT Team, injest and normalize new data sources, including data from customers, co-manufacturers and general market data. Responsible for data integrity at all stages, including pre-processing and creation / maintenance of data sources. Working with cross-functional teams, align on master data across the organization. Partner with the User Experience & Design organization to ensure reports and dashboards are usable, elegant and industry leading. Roadmap Development & Execution: 35% of Time Develop and maintain project intake, roadmap, staffing plans, and budget with support from CIO. Provides leadership on current and emerging developments/trends for assigned area(s) of responsibility, assesses the impact, and collaborates with senior management to incorporate new trends and developments in current and future strategies. Develop advanced forecasting models in collaboration with cross-functional partners. Responsible for interpretation of results - for both causal inferences and predictive effectiveness. Exercise thought leadership and discretion in tailoring the tools, approaches, and data used to meet the needs of the particular problem. Present findings, suggested actions and changes to a broad audience, and manage follow-ups and execution. Work with the technical and leadership team to ensure that all individual projects are appropriately supported and fully completed on time. Manage internal relationships, including planning, budgeting, roadmap, issue resolution, and overall accountability for results and satisfaction. Team Management & Development: 30% of Time Manage a small staff in support of the above activities. Provide coaching and mentoring to achieve a high-performing team. Help teach and explain techniques and tools used to business-intelligence, data, and analytics professionals with varied backgrounds. Other administrative duties as required for team management. Qualifications: What are we looking for? Education: Bachelor’s degree or equivalent work experience. Data related certifications desirable. Experience: 10+ years of relevant Data Science experience. 5+ years of people management experience. Consumer Product Goods-research background, focused on standard processes including Procure-to-Pay, Order-to-cash, Plan-to-Make, and Revenue Growth Management. Skills: Expert-level skills and experience with the Tableau, Snowflake, DBT, ETL tools or similar technologies. Advanced-level skills with relational databases, including SQL and utilizing data stored in complex schemas. Expert ability to analyze, interpret and present data. Data profiling, distributions, confidence intervals, hypothesis testing. Ability to communicate results and recommendations to a wide variety of audiences. Advanced understanding of data architecture, data warehouse, data lake and data marts. Demonstrated ability and desire to continually expand skill set, and learn from and teach others. Experience with Roadmap development and prioritization with cross-functional teams. Effective business acumen and sense of urgency to achieve business results. Must be willing to travel up to 25% of the time, if you’re not local to the Bay Area. So, if after reading through this long list you’re thinking—I’m not sure I meet 100% of these requirements, should I still apply? YES—if you embody a growth mindset, see challenges as opportunities to develop, and find innovative ways to get the real work that matters done, you sound like our kind of candidate! Select 5 Key Capabilities & Traits Important to Add to and Diversify your Current Team: Thrive in ambiguity amid competing priorities Enterprise-wide savvy and view Drive and own results Be a builder Challenge ideas respectfully You will thrive here and may just do the best work of your life if… You want to be an integral part of shaping and nurturing an amazing work culture You like trying out novel minimum viable product people-related ideas You can be flexible in your approach to people challenges and abandon past practices if they don’t make sense or would lead to a poor outcome You are comfortable being natural, casual, open, and even a bit playful at work You don’t have a big ego and hate siloed thinking You like to get sh*t, I mean—stuff done You can be friendly, vulnerable, and self-deprecating in one moment, and deal with a challenging, delicate people-related matter as a professional in the next You can do periods of focused, deep work on projects that drive the needle This may not be your ideal next career move if… You like a lot of structure, rules, and uniformity You like hierarchy, command and control management You want to build lots of processes, systems, governance, or policies and make a beautiful bureaucracy Dealing with ambiguity or experimentation is not your jam You try to resolve challenging interpersonal situations over instant messaging or passive aggression You tend to chase whatever shiny object presents itself during the day instead of real results If we haven’t convinced you to apply already, here are some of our favorite perks and benefits: Friday afternoons off year-round (and of course a hefty PTO package plus 11 holidays) 6% 401K match. Literally free money Hybrid work with an average of 2-3 days a week in the office for local folks All jobs are bonus-eligible Work-out time during work Free custom lunch twice a week. Plus, plenty of snacks and shakes. 2 weeks of work from anywhere time to move your Big Rocks Quarterly team building events/happy hours (city-wide scavenger hunt, bowling, ropes course, putt-putt) Bring your dog to work (3 days/week) Extended paid parental leave regardless of gender or familial make-up We strive to create an equitable and inclusive environment to contribute to the success of our organization. Premier Nutrition provides equal employment opportunities to all employees and applicants for employment without regard to race, color, religion, gender, sexual orientation, national origin, age, disability, genetic information, marital status, status as a covered veteran and any other category protected under applicable federal, state, provincial and local laws.",https://www.indeed.com/jobs?q=Data+Scientist&l=San+Francisco%2C+CA&sc=0kf%3Aattr%28FCGTU%7CHFDVW%7CQJZM9%7CUTPWG%252COR%29explvl%28MID_LEVEL%29jt%28fulltime%29%3B&start=10&pp=gQAPAAAAAAAAAAAAAAAB_jBEtQARAQAB1v1ds2Bmj2SdYKuqLTAAAA&vjk=488bd62f192b600f
5,8e567aaad63ac993,Data Scientist,"San Francisco, CA",MID_LEVEL,BACHELORS_DEGREE,fulltime,"Machine Learning Engineer/Scientist - job post GotIt! Burlingame, CA Full-time You must create an Indeed account before continuing to the company website to apply Apply on company site save-icon Job details Job Type Full-time At Got It, Machine Learning Engineers and Scientists develop cutting edge technology and integrate it into our conversational AI platform. Our engineers and scientists bring fresh ideas from a diverse set of areas, including natural language processing, speech and conversational AI, cloud computing, large-scale system design, security, artificial intelligence, UI design and more. We need our team to be enthusiastic and versatile, display leadership and take on problems across the full stack. As an ML engineer or a scientist, you would work with a fast paced team on mission critical R&D projects towards specific, and ever evolving, business goals. With your technical expertise, you would manage project priorities, deadlines, and deliverables. Minimum requirements: Bachelor’s degree in Computer Science or related field or equivalent practical experience 3 years of software development experience, or 1 year with an advanced degree. Experience in applied machine learning, NLP or artificial intelligence. Experience with one or more general purpose programming languages including but not limited to: Python, Java, or C/C++. Preferred qualifications: Masters or PhD with specialization in one of the following areas: NLP, Conversational AI or machine learning 3+ years of experience with one or more of the following: natural language processing, conversational AI, speech recognition, text understanding, classification, pattern recognition, recommendation systems, targeting systems, ranking systems or similar Research Publications Strong software design and development skills and experience working effectively with science, data processing, and software engineering teams Excellent written and spoken communication skills Experience with relevant technologies (e.g., PyTorch, Tensorflow, machine learning libraries) Entrepreneurial spirit combined with strong architectural and problem solving skills",https://www.indeed.com/jobs?q=Data+Scientist&l=San+Francisco%2C+CA&sc=0kf%3Aattr%28FCGTU%7CHFDVW%7CQJZM9%7CUTPWG%252COR%29explvl%28MID_LEVEL%29jt%28fulltime%29%3B&start=10&pp=gQAPAAAAAAAAAAAAAAAB_jBEtQARAQAB1v1ds2Bmj2SdYKuqLTAAAA&vjk=8e567aaad63ac993
6,b20aa49766db20c8,Data Scientist,"San Francisco, CA",MID_LEVEL,BACHELORS_DEGREE,fulltime,"ML Data Engineer - Generative AI - job post MetaVoice San Francisco, CA Full-time Apply now Apply now save-icon Job details Job Type Full-time We’re looking for an ambitious ML Engineer to play a leading role in managing the infrastructure to efficiently store & process 100’s of TB of audio data. You’ll also collaborate with Vatsal (ex Amazon Alexa & Cambridge) to train or fine-tune generative models on this data. The resulting models will be used to enhance our core products to better meet our customer’s needs. You’ll be the first full-time ML hire at a well-funded startup and play a critical role in shaping the future of MetaVoice as a core member of the founding team. We’re particularly interested in candidates who have been founders themselves or built impressive side projects. If you think you have what it takes to be a part of an ambitious & high-performing team, please share links to Github code you've written, contributions you've made & papers you’ve published. Check out our Notion careers page for more information & FAQs on MetaVoice. KEY RESPONSIBILITIES Set up cost efficient & highly performant data infrastructure for storing & transforming large quantities of audio data. Work with ML Audio or Digital Signal Processing techniques to analyse, clean, segment & filter speech data Manage the storage & usage of terrabytes of cloud data & deeply understand of the cost/benefit tradeoffs of each solution Build efficient ML model training pipelines in PyTorch that utilise large datasets Participate in research activities, including the application and evaluation of generative voice & speech-to-speech techniques Research and implement novel ML and statistical approaches to add value to the business. Setup testing pipelines to evaluate ML model performance on audio data BASIC REQUIREMENTS PhD in fields such as Deep Generative Models, STS, Deep Learning, TTS, ASR, NLU. Bachelor’s/Master’s degree considered with existing applied experience in industry Deep Knowledge in fields such as Voice Conversion, Deep Generative Models, Machine Learning, Deep Learning, TTS, ASR, NLU or Statistical modelling Hands on experience with machine learning frameworks such as PyTorch, Keras, Tensorflow Significant experience with scaleable data processing tools like PySpark, Kubernetes, Databricks, Apache Arrow etc. Experience with Python & C/C++. Experience managing GPU intensive data processing jobs 4 years of applied research experience Creative thinker & problem solver who can execute independently & quickly with a bias for action An unrelenting desire to built world-class products which delight users Outstanding written, spoken & interpersonal communication skills PREFERRED REQUIREMENTS Extensive experience of applied research. Ideally developing voice conversion, speech synthesis and natural language processing models PhD with specialisation in voice conversion, text-to-speech, natural language processing, or machine learning Scientific thinking and the ability to invent, a track record of thought leadership and contributions that have advanced the field If you require alternative methods of application or screening, you must approach the employer directly to request this as Indeed is not responsible for the employer's application process.",https://www.indeed.com/jobs?q=Data+Scientist&l=San+Francisco%2C+CA&sc=0kf%3Aattr%28FCGTU%7CHFDVW%7CQJZM9%7CUTPWG%252COR%29explvl%28MID_LEVEL%29jt%28fulltime%29%3B&start=10&pp=gQAPAAAAAAAAAAAAAAAB_jBEtQARAQAB1v1ds2Bmj2SdYKuqLTAAAA&vjk=b20aa49766db20c8
7,ffac4fef8dc7a9ed,Data Scientist,"San Francisco, CA",MID_LEVEL,BACHELORS_DEGREE,fulltime,"Data Science Consultant - job post Sia Partners 29 reviews San Francisco, CA 94105 • Hybrid remote $94,000 - $122,000 a year -  Full-time Apply now Apply now save-icon Job details Salary $94,000 - $122,000 a year Job Type Full-time Company Description Sia Partners is a next-generation consulting firm dedicated to creating state-of-the-art narratives for transformation and innovation and deploying them at scale. Our goal is to deliver superior value and tangible results to our clients as they navigate the digital revolution and achieve transformations which generate a positive impact. Our global footprint and expertise in more than 40 sectors and services allow us to enhance our clients’ businesses worldwide. We guide their projects and initiatives in strategy, business transformation, IT & digital strategy, and Data Science. Why Join The Sia Village? Excellence | Entrepreneurship | Innovation | Teamwork | Care & Support | Employee Wellbeing These are the six core values that guide all our actions. As an expression of our values, our Sia Village concept describes our commitment to fostering a sense of community within and among our offices. We believe that knowledge sharing is the key, not only to innovation, but to the growth and development of our people. Your experience at Sia Partners will be enriched by a(n): Entrepreneurial journey Career advocacy program that supports achieving professional development goals through guidance, and real-time feedback Continuous learning & development opportunities Diversity, equity, and inclusion programs with an ever-growing list of global affinity initiatives Annual seminar, an in-person value-add experience, that allows you to network with colleagues throughout North America Job Description Sia Partners is looking for a talented Data Scientist to support our activities within the Data Science Business Unit. You will be working alongside our Data Science consultants and our clients on Data Science topics, including data acquisition and exploration, creating relevant data models and presenting results to stakeholders. You will also contribute to internal Data Science projects hosted on Heka, our internal accelerator for Data Science projects. As part of the global Data Science team you will contribute to the development of various solutions designed to address our clients’ needs. Key Responsibilities Partner with our client’s leadership teams, engineers, program managers and data analysts to understand data needs. Identify, acquire, process and explore relevant data sources. Analyze large amounts of structured and unstructured information to discover trends and patterns. Use your data analytics and science expertise to derive valuable insights from datasets, build predictive models and machine-learning algorithms. Communicate at scale, through multiple mediums: presentations, dashboards, datasets, bots and more. Propose solutions and strategies to business challenges. Collaborate with engineering and product development teams. Broad range of partners equates to a broad range of projects and deliverables, including Models, algorithms, datasets, measurements, services, tools and process. Qualifications 4+ years’ experience as a Data Scientist or Data Analyst Experience with building models, machine-learning, NLP 4+ years’ experience in R, SQL and Python 4+ years’ experience with data visualization tools (e.g. Tableau, PowerBi, R Shiny) Problem-solving aptitude and business acumen Excellent communication and presentation skills BSc/BA in Data Science, Computer Science, Engineering Preferred experience: Experience with more than one coding language. Experience in data mining Good understanding of Machine Learning techniques Good understanding of statistical techniques and concepts Experience with data visualization tools Experience with Object Oriented Programming Additional Information Compensation & Benefits Salary + Annual Discretionary Bonus Healthcare coverage that includes medical, dental, vision and life insurance policies Generous time off Parental leave paid at 100% of base pay for all new parents regardless of gender Future Moms Program 9 Company Holidays + 1 Floating Holiday 401(k) matching College save-up plan & college loan repayment plan Monthly cell phone stipend Commuter Benefits Gym Reimbursement through firm medical plan Compensation Information California compensation for this role is between $94,000 to $122,000 per year. Actual compensation within that range will be dependent upon the individual’s skills, experience, qualifications, and market location. Our Commitment To Diversity Diversity, equity, inclusion, and belonging (DEIB) are part of Sia Partners’ DNA. Thanks to our expertise in several sectors and our international growth, our teams include a variety of experiences and cultures. We’re confident that promoting DEIB creates an environment in which everyone can reach their full potential. Our global network, DEIB@Sia Partners, brings together our people worldwide to facilitate local and global progress, focused on the following areas: Gender equality (global Gender Equality Index score of 91/100 for FY19-20) LGBTQ+ Race & Ethnicity Working Parents Disabilities Sia Partners is an equal opportunity employer. All aspects of employment, including hiring, promotion, remuneration, or discipline, are based solely on performance, competence, conduct, or business needs. Covid-19 Update Please note that, to the extent permitted by state and local law, Sia Partners requires all employees in this position to be fully vaccinated against COVID-19 as a condition of employment. “Fully vaccinated” means that the individual can provide acceptable proof that the individual has received, at least fourteen (14) days prior to the individual’s start date, either both doses of a two-dose COVID-19 vaccine plus all boosters recommended for you, or one dose of a single-dose COVID-19 vaccine plus all boosters recommended for you. Vaccines must be authorized and/or approved by the FDA. The Company will engage in an interactive process to determine if an exemption to this requirement as a reasonable accommodation is appropriate. Hybrid Workplace Guidelines Sia Partners maintains its hybrid workplace arrangements and provides a flexible workplace environment that is driven by client and business/market needs. While our firm does support hybrid work, there are times that we may require our consultants to work onsite at one of our Sia offices or a client office full-time. Consultants are expected to have the ability to be flexible with work location depending upon business needs. When in-between client engagements, Consultants typically work onsite at a local Sia office 2+ times per week. To learn more about our mission, values, and business sectors, please visit our website. Sia Partners is an equal opportunity employer. All aspects of employment, including hiring, promotion, remuneration, or discipline, are based solely on performance, competence, conduct, or business needs. If you require alternative methods of application or screening, you must approach the employer directly to request this as Indeed is not responsible for the employer's application process.",https://www.indeed.com/jobs?q=Data+Scientist&l=San+Francisco%2C+CA&sc=0kf%3Aattr%28FCGTU%7CHFDVW%7CQJZM9%7CUTPWG%252COR%29explvl%28MID_LEVEL%29jt%28fulltime%29%3B&start=10&pp=gQAPAAAAAAAAAAAAAAAB_jBEtQARAQAB1v1ds2Bmj2SdYKuqLTAAAA&vjk=ffac4fef8dc7a9ed
