,job_id,job_title,location,experience,education,job_type,job_description,job_link
7,f03d7bf0bf979c93,Data Engineer,"Dallas, TX",SENIOR_LEVEL,BACHELORS_DEGREE,fulltime,"AWS Data Engineer (remote) - job post Cognizant 15,426 reviews Plano, TX 75024 • Remote $109,000 - $115,000 a year -  Full-time You must create an Indeed account before continuing to the company website to apply Apply on company site save-icon Job details Salary $109,000 - $115,000 a year Job Type Full-time AWS Data Engineer We are Cognizant Artificial Intelligence Digital technologies, including analytics and AI, give companies a once-in-a-generation opportunity to perform orders of magnitude better than ever before. But clients need new business models built from analyzing customers and business operations at every angle to really understand them. With the power to apply artificial intelligence and data science to business decisions via enterprise data management solutions, we help leading companies prototype, refine, validate and scale the most desirable products and delivery models to enterprise scale within weeks! Location - Remote; United States or Canada Responsibilities Design and build scalable data pipelines using Big Data stack Databricks, Spark Scala, AWS – Athena, S3, Glue ETL, Redshift, Dynamo DB Design Ingress and Egress patterns for data lake to support self-service use cases and improve time to business value. Implement CI/CD data pipelines using Git Hub, Jenkins and Artifactory to automate the code build and promotion process. Engage with customers and principal architects, understand the business requirements and build AWS cloud big data platform and solutions. Create proof of concepts, evaluate new products and develop a roadmap for NextGen Technology and Digital Cloud First strategy. Required Skills & Experience Possess a Bachelor’s degree or higher from an accredited institution 7+ years proven ability performing software and/or data analytics requirements gathering and analysis Good Communication Skills Why Choose Cognizant? It takes a lot to succeed in today’s fast-paced market, and Cognizant Digital Business has become a proven leader in the industry. Cognizant love big ideas and even bigger ambitions. We stand out because we put human experiences at the core. We help clients engage customers by envisioning and building innovative products and services. But we don’t stop there. We develop go-to-market strategies and invent entirely new business models, ensuring that every company we work with walks away with both inspiration and a plan. Everything we do at Cognizant we do with passion—for our clients, our communities, and our organization. It’s the defining attribute that we look for in our people. Cognizant US Corporation is an Equal Opportunity Employer. If you require accessibility assistance applying for open positions in the US, please send an email with your request to CareersNA2@cognizant.com Salary and Other Compensation : The annual salary for this position is between $109,000- $115,000 USD depending on experience and other qualifications of the successful candidate. This position is also eligible for Cognizant’s discretionary annual incentive program, based on performance and subject to the terms of Cognizant’s applicable plans. Benefits : Cognizant offers the following benefits for this position, subject to applicable eligibility requirements: Medical/Dental/Vision/Life Insurance Paid holidays plus Paid Time Off 401(k) plan and contributions Long-term/Short-term Disability Paid Parental Leave Employee Stock Purchase Plan Disclaimer: The salary, other compensation, and benefits information is accurate as of the date of this posting. Cognizant reserves the right to modify this information at any time, subject to applicable law. Employee Status : Full Time Employee Shift : Day Job Travel : No Job Posting : Mar 21 2023 About Cognizant Cognizant (Nasdaq-100: CTSH) is one of the world's leading professional services companies, transforming clients' business, operating and technology models for the digital era. Our unique industry-based, consultative approach helps clients envision, build and run more innovative and efficient businesses. Headquartered in the U.S., Cognizant is ranked 185 on the Fortune 500 and is consistently listed among the most admired companies in the world. Learn how Cognizant helps clients lead with digital at www.cognizant.com or follow us @USJobsCognizant. Applicants may be required to attend interviews in person or by video conference. In addition, candidates may be required to present their current state or government issued ID during each interview. Cognizant is an equal opportunity employer. All qualified applicants will receive consideration for employment without regard to sex, gender identity, sexual orientation, race, color, religion, national origin, disability, protected Veteran status, age, or any other characteristic protected by law. If you have a disability that requires a reasonable accommodation to search for a job opening or submit an application, please email CareersNA2@cognizant.com with your request and contact information.",https://www.indeed.com/jobs?q=Data+Engineer&l=Dallas%2C+TX&sc=0kf%3Aattr%28FCGTU%7CHFDVW%7CQJZM9%7CUTPWG%252COR%29explvl%28SENIOR_LEVEL%29jt%28fulltime%29%3B&vjk=f03d7bf0bf979c93
8,005f163c9a611b96,Data Engineer,"Dallas, TX",SENIOR_LEVEL,BACHELORS_DEGREE,fulltime,"Sr Data Engineer (CDP), Platform Engineering (REMOTE) - job post Splunk 71 reviews Plano, TX 75023 • Remote $136,800 - $188,100 a year -  Full-time You must create an Indeed account before continuing to the company website to apply Apply on company site save-icon Job details Salary $136,800 - $188,100 a year Job Type Full-time Join us as we pursue our disruptive new vision to make data accessible, usable, and valuable to everyone. We are a company filled with people who are passionate about our product and seek to deliver the best experience for our customers. At Splunk, we’re committed to our work, our customers, having fun, and most importantly to each other’s success. Learn more about Splunk careers and how you can become a part of our journey! Role Splunk's Platform Engineering team is a dynamic, best-in-class & talented set of individuals. The Platform Engineering team is responsible for handling and implementing various marketing use cases with CDP as a centralized profile store and segmentation engine for Splunk’s marketing. This role is for the Platform Engineering team, as a Sr CDP Data Engineer, you will be responsible for CDP schema design, data ingestion, data analysis, and taking on requests as part of the sprint cycle. As part of this role, you will be closely working with the scrum master, marketing teams, and architects to plan and execute sprints. The ideal candidate should have relevant and extensive experience in AEP, ETL, Schema, and data loads to support day-to-day activities. Responsibilities Create all required Adobe XDM (Experience Data Model) in JSON based on an approved data model for all loading data files. Be thorough with the data modeling techniques using AEP (Adobe Experience Platform). Utilize Adobe Experience Platform (AEP) UI & POSTMAN to automate all customer schema data lake & profile design setups within each sandbox environment. Create necessary technical documentation, and Entity Relationship Diagrams (ERD) to review & sign off with the architecture team. Manage the data pipelines and transformations from a variety of sources and assure the data flowing into the CDP data lake and updating profile stores. A proven track record of manipulating a variety of data sources. Assist with building the data governance policies to be in line with our privacy and legal policies. Work in agile, rapid development, and prototyping environments. Assist in ongoing process refinements, including the updating or creation of customer-facing material and templates. Assists with Proof of Concepts (POCs), and project estimation and engages in performance testing and tuning activities for large data sets. Requirements B.S. or M.S. preferably in Computer Science or a related field or equivalent work experience with a strong CS foundation. 8+ years of experience as a data engineer, supporting data warehousing, or related data platform with at least 2+ years of experience supporting AEP. Strong expertise in data management including data strategy, data quality, and data governance. Expertise in Java, Python, or any scripting language, SQL/NoSQL Database systems. Experience in data modeling and architecture. Excellent SQL skills. Strong understanding of Marketing Technology tools (Email/Marketing automation system, Personalization tools, Analytics tools) Experience with loading data in and out of CDP from Data Lake. Experience with agile development methodologies. Exposure to cloud platforms - AWS, GCP, or Azure and APIs via Postman. Experience working/collaborating with Sr Technical and Leadership teams. What Sets You Apart Adobe CDP Certification Cloud Certification Involved with 1 to 2 Projects on Adobe Experience Platform (Adobe CDP) We value diversity at our company. All qualified applicants will receive consideration for employment without regard to race, color, religion, sex, sexual orientation, gender identity, national origin, or any other applicable legally protected characteristics in the location in which the candidate is applying. Note: Splunk provides flexibility and choice in the working arrangement for most roles, including remote and/or in-office roles. We have a market-based pay structure which varies by location. Please note that the base pay range is a guideline and for candidates who receive an offer, the base pay will vary based on factors such as work location as set out below, as well as the knowledge, skills and experience of the candidate. In addition to base pay, this role is eligible for incentive compensation and benefits, and may be eligible for equity or long-term cash awards. Benefits are an important part of Splunk's Total Rewards package. This role is eligible for a competitive benefits package which includes medical, dental, vision, a 401(k) plan and match, paid time off, an ESPP and much more! Learn more about our comprehensive benefits and wellbeing offering here. Base Pay Range SF Bay Area, Seattle Metro, and New York City Metro Area Base Pay Range: $163,200 - 224,400 per year California (excludes SF Bay Area), Washington (excludes Seattle Metro), Washington DC Metro, and Massachusetts Base Pay Range: $148,000 - 203,500 per year All other cities and states excluding California, Washington, Massachusetts, New York City Metro Area and Washington DC Metro Area. Base Pay Range: $136,800 - 188,100 per year",https://www.indeed.com/jobs?q=Data+Engineer&l=Dallas%2C+TX&sc=0kf%3Aattr%28FCGTU%7CHFDVW%7CQJZM9%7CUTPWG%252COR%29explvl%28SENIOR_LEVEL%29jt%28fulltime%29%3B&vjk=005f163c9a611b96
9,1d0e1d057fe87298,Data Engineer,"Dallas, TX",SENIOR_LEVEL,BACHELORS_DEGREE,fulltime,"Staff Data Engineer, Health & Wellness - Dallas, TX - job post HEB 9,837 reviews 3890 W Northwest Hwy Ste 300, Dallas, TX 75220 Full-time You must create an Indeed account before continuing to the company website to apply Apply on company site save-icon Job details Job Type Full-time Overview: H-E-B is one of the largest, independently owned food retailers in the nation operating over 420+ stores throughout Texas and Mexico, with annual sales generating over $34 billion. Described by industry experts as a daring innovator and smart competitor, H-E-B has led the way with creative new concepts, outstanding service and a commitment to diversity in our workforce, workplace and marketplace. H-E-B offers a wealth of career opportunities to our 145,000+ Partners (employees), competitive compensation and benefits program and comprehensive training that lead to successful careers. Responsibilities: About H-E-B H-E-B is one of the largest, independently owned food retailers in the nation operating over 400 stores throughout Texas and Mexico, with annual sales generating over $34 billion. Described by industry experts as a daring innovator and smart competitor, H-E-B has led the way with creative new concepts, outstanding service and a commitment to diversity in our workforce, workplace and marketplace. H-E-B offers a wealth of career opportunities to our 145,000+ Partners (employees), competitive compensation and benefits program and comprehensive training that lead to successful careers. H-E-B Digital is seeking new team members (Partners)! Since our inception, we’ve been investing heavily in our customers’ digital experience, reinventing how they find inspiration from food, how they make food decisions, and how they ultimately get food into their homes. This is an exciting time to join H-E-B Digital, and we’re hiring across the stack: front-end web and mobile, full-stack, and backend engineering. We’re using the best available technologies to deliver modern, engaging, reliable, and scalable experiences to meet the needs of our growing audience. Our digital solutions are growing in popularity and adoption—like Curbside and Home Delivery—so you’ll get the opportunity to define the user experience for millions of customers and hundreds of thousands of Partners. If you’re someone who enjoys taking on new challenges, working in a rapidly changing environment, learning new skills, and applying it all to solve large and impactful business problems, we want you as part of our team. Our Partners thrive The H-E-B Way . In the Staff Data Engineer position, that means you have a… HEART FOR PEOPLE… you can organize multiple engineers, negotiate solutions, and provide upward communication HEAD FOR BUSINESS… you consistently demonstrate and uphold the standards of coding, infrastructure, and process PASSION FOR RESULTS… you’re capable of high-velocity contributions in multiple technical domains What you’ll do Work with HEB Digital teams to provide data solutions for health and wellness Contribute to existing data platforms and implement new technologies Develop a deep understanding of HEB’s data and become a domain expert Ensure data is distributed in a timely and accurate manner Make data discoverable and accessible to business users Coach and mentor junior engineers in engineering techniques, processes, and new technologies; enable others to succeed Contribute to overall system design, architecture, security, scalability, reliability, and performance of applications Identify, scope, and architect solutions for new features while applying sound technical judgment that considers technology alternatives, impact on affected / adjacent systems, and tradeoffs. Get the opportunity to stay ahead of new technologies with an eye to evaluating and potentially incorporating them into your team’s architecture Projects you’ll impact Implement data pipelines on AWS using Argo, Kubernetes, Spark and Python Integrate health, pharmacy and nutritional data systems Evaluate new technologies to improve quality, performance and cost of data pipelines Who You Are 7+ years of data engineering experience Proficient with data technologies (e.g. Spark, Kinesis, Kafka, Airflow, Oracle, PostgreSQL, Redshift, Presto, etc.) Experienced with designing and developing ETL data pipelines using tools such as Airflow, Nifi, or Kafka. Strong understanding of SQL and data modeling Understanding of Linux, Amazon Web Services (or other cloud platforms), Python, Docker, and Kubernetes Experienced with common software engineering tools (e.g., Git, JIRA, Confluence, or similar) Bachelor's degree in computer science or comparable field or equivalent experience A proven understanding and application of computer science fundamentals: data structures, algorithms, design patterns, and data modeling What are the Perks? A robust Benefits plan with coverage starting Day One Dental, vision, life, and other insurance plans; flexible spending accounts; short term / long term disability coverage Partner Care Team, for any time you have healthcare or coverage questions Telehealth offers 24/7 access to board-certified doctors by phone Partner Guidance allows free counselor visits Funeral leave, jury duty, and military pay (subject to applicable law) Maternal / paternal leave for new parents, including adoptions 10% off H-E-B brand products in-store and online Eligibility to participate in 401(k) Opportunity to become a “Partner-Owner” after 12 months Who We Are H-E-B is one of the largest, independently owned food retailers in the nation, operating over 400 stores throughout Texas and Mexico, with annual sales generating over $25 billion We hire talented people (109,000+ Partners), and give them autonomy to be creative in how they impact the business We’re a Partner-driven company with a Bold Promise – Because People Matter We embrace Diversity and Inclusion as core values, and support them with thriving company-wide programs We’re a truly original Texas-based company that created the Spirit of Giving to help Texas communities every day Once eligible, our Partners become Owners in the company. “Partner-owned” means our most important resources—People—drive the innovation, growth, and success that make H-E-B The Greatest Retailing Company Hiring in Dallas! DATA3232",https://www.indeed.com/jobs?q=Data+Engineer&l=Dallas%2C+TX&sc=0kf%3Aattr%28FCGTU%7CHFDVW%7CQJZM9%7CUTPWG%252COR%29explvl%28SENIOR_LEVEL%29jt%28fulltime%29%3B&vjk=1d0e1d057fe87298
10,499e84e01ea618ed,Data Engineer,"Dallas, TX",SENIOR_LEVEL,BACHELORS_DEGREE,fulltime,"Senior Data Engineer-- ETL (Snowflake and AWS) - job post Texas Capital Bank 101 reviews 2350 Lakeside Blvd, Richardson, TX 75082 Full-time You must create an Indeed account before continuing to the company website to apply Apply on company site save-icon Job details Job Type Full-time Overview: Texas Capital Bank is built to help businesses and their leaders. Our depth of knowledge and expertise allows us to bring the best of the big banks at a scale that makes sense for our clients, with highly experienced bankers who truly invest in people’s success — today and tomorrow. While we are rooted in core financial products, we are differentiated by our approach. Our bankers are seasoned financial experts who possess deep experience across a multitude of industries. Equally important, they bring commitment — investing the time and resources to understand our clients’ immediate needs, identify market opportunities and meet long-term objectives. At Texas Capital Bank, we do more than build business success. We build long lasting relationships. Headquartered in Dallas with offices in Austin, Fort Worth, Houston, Richardson, Plano and San Antonio, Texas Capital Bank was recently named the #1 most trusted bank in the country on Newsweek ’s inaugural list of America’s Most Trusted Companies. For more information about joining our team, please visit us at www.texascapitalbank.com. Brief Overview of Position A Sr. Data Engineer is proficient in the development of all aspects of data processing including data warehouse architecture/modeling and ETL processing. The position focuses on development and delivery of analytical solutions using various tools including AWS Glue, Lambda, Snowflake and AWS RDS. A Sr. Data Engineer must be able to work autonomously with little guidance or instruction to deliver business value. Responsibilities: Partner with business stakeholders to gather requirements and translate them into technical specifications and process documentation for IT counterparts (onshore and offshore) Highly proficient in the architecture and development of an event driven data warehouse; streaming, batch, data modeling, and storage Advanced database knowledge; creating/optimizing SQL queries, stored procedures, functions, partitioning data, indexing, and reading execution plans Skilled experience in writing and troubleshooting Python/PySpark scripts to generate extracts, cleanse, conform and deliver data for consumption Expert level of understanding and implementing ETL architecture; data profiling, process flow, metric logging, and error handling Support continuous improvement by investigating and presenting alternatives to processes and technologies to an architectural review board Develop and ensure adherence to published system architectural decisions and development standards Lead and foster junior data engineers in their careers to produce higher quality solutions at a faster velocity through optimization training and code review Multi-task across several ongoing projects and daily duties of varying priorities as required Interact with global technical teams to communicate business requirements and collaboratively build data solutions The duties listed above are the essential functions, or fundamental duties within the job classification. The essential functions of individual positions within the classification may differ. May assign reasonably related additional duties to individual employees consistent with standard departmental policy. Qualifications: Education Bachelor’s degree in computer science or MIS related area required or equivalent experience (industry experience substitutable) Job experience 6-8 years of total experience in data engineering development activity. 2+ years of experience in Banking and financial domain Technical Requirement Must be extremely proficient in Data Warehouse ETL Design/Architecture , dimensional/relational data modelling. Experience in atleast one ETL development project, writing/analyzing complex stored procedures. Should have entry level/intermediate experience in Python/PySpark – working knowledge on spark/pandas dataframe, spark multi-threading, exception handling, familiarity with different boto3 libraries, data transformation and ingestion methods, ability to write UDF. Snowflake – Familiarity with stages and external tables, commands in snowflake like copy, unload data to/from S3, working knowledge of variant data type, flattening nested structure thru SQL, familiarity with marketplace integrations, role-based masking, pipes, data cloning, logs, user and role management is nice to have . AWS – Should have hands-on experience with S3, Glue (jobs, triggers, workflow, catalog, connectors, crawlers), CloudWatch, RDS and secrets manager. AWS - VPC, IAM, Lambda, SNS, SQS, MWAA and Athena is nice to have . Should have hands-on experience with version controlling tools like github , working knowledge on configuring, setting up CI/CD pipelines using yaml, pip files. Streaming Services – Familiarity with Confluent Kafka or spark streaming or Kinesis (or equivalent) is nice to have . Interpersonal Highly proficient in Publisher, PowerPoint, SharePoint, Visio, Confluence and Azure DevOps Working knowledge of best practices in value-driven development (requirements management, prototyping, hypothesis-driven development, usability testing) Good communicator with problem solving mindset and focus on process improvement Strong time management skills and a proven track record of meeting various deadlines Strong executive presentation skills with expertise in PowerPoint and presentation best practices. Consistently demonstrates clear and concise written and verbal communication skills Good interpersonal skills, ability to interact with Senior Management Highly self-motivated with a strong sense of initiative Excellent multitasking skills and task management strategies Ability to work well in a team environment, meet deadlines, demonstrate good time management, and multi-task in a fast-paced project environment.",https://www.indeed.com/jobs?q=Data+Engineer&l=Dallas%2C+TX&sc=0kf%3Aattr%28FCGTU%7CHFDVW%7CQJZM9%7CUTPWG%252COR%29explvl%28SENIOR_LEVEL%29jt%28fulltime%29%3B&vjk=499e84e01ea618ed
