,job_id,job_title,location,experience,education,job_type,job_description,job_link
33,bd77e407b55f87a3,Machine Learning Engineer,"San Francisco, CA",ENTRY_LEVEL,BACHELORS_DEGREE,fulltime,"Senior/Staff Machine Learning Engineer - Prediction - job post Zoox (part of Amazon.com) 9 reviews Foster City, CA $221,000 - $319,000 a year -  Full-time Zoox 9 reviews Read what people are saying about working here. You must create an Indeed account before continuing to the company website to apply Apply on company site save-icon Job details Salary $221,000 - $319,000 a year Job Type Full-time The Prediction team is responsible for forecasting the future states of all the dynamic agents around our vehicle. To account for the inherent uncertainty of predicting the future, our job is to compute a probabilistic representation over the intentions and movements of other agents. Our probabilistic predictions are then tightly integrated into our Planning system to deliver a safe and comfortable ride. Responsibilities Develop new algorithms to model and recognize the future behavior of all other agents in the world Leverage our large-scale machine learning infrastructure to discover new solutions and push the boundaries of the field Engineer software that runs on-vehicle to efficiently execute our algorithms in real time Develop metrics and tools to analyze errors and understand improvements of our systems Collaborate with engineers on Perception and Planning to solve the overall Autonomous Driving problem in complex urban environments Qualifications BS, MS, or PhD degree in computer science or related field Experience with training and deploying Deep Learning models Experience with production Machine Learning pipelines: dataset creation, training frameworks, metrics pipelines Fluency in C++ Extensive experience with programming and algorithm design Strong mathematics skills 8+ years of experience in a related field Bonus Qualifications Conference or Journal publications in Machine Learning or Robotics related venues Prior experience with Prediction and/or autonomous vehicles in general Fluency in Python Compensation There are three major components to compensation for this position: salary, Amazon Restricted Stock Units (RSUs), and Zoox Stock Appreciation Rights. The salary will range from $221,000 to $319,000. A sign-on bonus may be part of a compensation package. Compensation will vary based on geographic location, job-related knowledge, skills, and experience. Zoox also offers a comprehensive package of benefits including paid time off (e.g. sick leave, vacation, bereavement), unpaid time off, Zoox Stock Appreciation Rights, Amazon RSUs, health insurance, long-term care insurance, long-term and short-term disability insurance, and life insurance. Vaccine Mandate Employees working in this position will be required to have received a single dose of the J&J/Janssen COVID-19 vaccine OR have completed the two-dose Pfizer or Moderna vaccine series. In addition, employees will be required to receive a COVID-19 booster vaccine within two months of becoming eligible for the booster vaccine. Employees will be required to show proof of vaccination status upon receipt of a conditional offer of employment. That offer of employment will be conditioned upon, among other things, an Applicant’s ability to show proof of vaccination status. Please note the Company provides reasonable accommodations in accordance with applicable state, federal, and local laws. About Zoox Zoox is developing the first ground-up, fully autonomous vehicle fleet and the supporting ecosystem required to bring this technology to market. Sitting at the intersection of robotics, machine learning, and design, Zoox aims to provide the next generation of mobility-as-a-service in urban environments. We’re looking for top talent that shares our passion and wants to be part of a fast-moving and highly execution-oriented team. Follow us on LinkedIn A Final Note: You do not need to match every listed expectation to apply for this position. Here at Zoox, we know that diverse perspectives foster the innovation we need to be successful, and we are committed to building a team that encompasses a variety of backgrounds, experiences, and skills.",https://www.indeed.com/jobs?q=Data+Scientist&l=San+Francisco%5D+%23%2C+CA&sc=0kf%3Aattr%28EXSNN%7CFCGTU%7CHFDVW%7CQJZM9%7CUTPWG%252COR%29explvl%28SENIOR_LEVEL%29jt%28fulltime%29%3B&start=20&pp=gQAeAAAAAAAAAAAAAAAB_gIBfgARAQEBBzhZhFoNT88m3HZ0hgMAAA&vjk=bd77e407b55f87a3
34,f0093b4829343be7,Machine Learning Engineer,"San Francisco, CA",ENTRY_LEVEL,BACHELORS_DEGREE,fulltime,"Associate Director, Statistical Programming - job post Gilead Sciences 519 reviews Foster City, CA 94404 Full-time Gilead Sciences 519 reviews Read what people are saying about working here. You must create an Indeed account before continuing to the company website to apply Apply on company site save-icon Job details Job Type Full-time For Current Gilead Employees and Contractors: Please log onto your Internal Career Site to apply for this job. At Gilead we believe every employee deserves a great leader. As a people leader now or in the future, we expect that you will model and create an environment of inclusion, be intentionally focused on the hiring, development, growth and retention of talent, and empower teams to align and achieve goals. Job Description Associate Director, Statistical Programming Job Responsibilities and Skills: Works collaboratively with Clinical Development staff to meet project deliverables and timelines for statistical data analysis and reporting. Generates or oversees the production of programming deliverables (e.g., tables, listings) for study reports and integrated summaries. Anticipates resource needs and works with management and HR to ensure adequate long-term resource allocation within a therapeutic project. Manage a team of diversified statistical programmers. Ensures programming and corresponding documentation is completed in a manner that is consistent with departmental procedures. Directs the design and/or coding of analysis files. Provides primary and secondary programming support as needed and harmonizes strategic initiatives (e.g., process improvement) across a therapeutic area or equivalent. Excellent verbal and written communication skills and interpersonal skills are required. Has a thorough understanding of clinical trials design and reporting process, as well as regulatory reporting requirements including electronic data submissions with FDA, PMDA, and other global agencies. Has hands-on and leading experience with regulatory submissions and post-filing activities such as FDA, EMA, PMDA filing, RtQs, and inspections. Experience with and demonstrated ability to interact with others departments to define and produce user-defined statistical reports (e.g., ad hoc requests). Has the proven ability to anticipate and resolve study related issues and conflicts within a therapeutic project. Experience with and proven ability in oversight or managing outsourced study. Proven ability to create buy-in and support and has demonstrated ability to negotiate timelines. Has the ability to directly supervise personnel. Manages critical deadlines, demonstrates ability to resolves issues, and ensures studies will be completed within designated timeframe. Responsible for all statistical programming activities within a therapeutic project or equivalent. Proven ability and Viewed as a key resource by more senior individuals on technical initiatives and may represent the Company on contracts. Identifies and leads strategic initiatives for the programming group. Serves as project leader on studies of greater complexity. May attend CST (Clinical Sub- Team) meetings as a representative of Programming group Typical Education and Experience: 10 years of experience and a BS degree in Biostatistics/Computer Science or equivalent. 8 years of experience and a MS degree in Biostatistics/Computer Science or equivalent. 2 years of experience and a PhD degree in Biostatistics/Computer Sciences or equivalent. For jobs in the United States: As an equal opportunity employer, Gilead Sciences Inc. is committed to a diverse workforce. Employment decisions regarding recruitment and selection will be made without discrimination based on race, color, religion, national origin, gender, age, sexual orientation, physical or mental disability, genetic information or characteristic, gender identity and expression, veteran status, or other non-job related characteristics or other prohibited grounds specified in applicable federal, state and local laws. In order to ensure reasonable accommodation for individuals protected by Section 503 of the Rehabilitation Act of 1973, the Vietnam Era Veterans' Readjustment Act of 1974, and Title I of the Americans with Disabilities Act of 1990, applicants who require accommodation in the job application process may contact careers@gilead.com for assistance. Following extensive monitoring, research, consideration of business implications and advice from internal and external experts, Gilead has made the decision to require all U.S., Canada, Australia, Singapore, and Hong Kong employees and contractors to receive the COVID-19 vaccines as a condition of employment. “Full vaccination” is defined as two weeks after both doses of a two-dose vaccine or two weeks since a single-dose vaccine has been administered. Anyone unable to be vaccinated, either because of a sincerely held religious belief or a medical condition or disability that prevents them from being vaccinated, can request a reasonable accommodation. For more information about equal employment opportunity protections, please view the 'Know Your Rights' poster. NOTICE: EMPLOYEE POLYGRAPH PROTECTION ACT YOUR RIGHTS UNDER THE FAMILY AND MEDICAL LEAVE ACT PAY TRANSPARENCY NONDISCRIMINATION PROVISION Our environment respects individual differences and recognizes each employee as an integral member of our company. Our workforce reflects these values and celebrates the individuals who make up our growing team. Gilead provides a work environment free of harassment and prohibited conduct. We promote and support individual differences and diversity of thoughts and opinion. For Current Gilead Employees and Contractors: Please log onto your Internal Career Site to apply for this job.",https://www.indeed.com/jobs?q=Data+Scientist&l=San+Francisco%5D+%23%2C+CA&sc=0kf%3Aattr%28EXSNN%7CFCGTU%7CHFDVW%7CQJZM9%7CUTPWG%252COR%29explvl%28SENIOR_LEVEL%29jt%28fulltime%29%3B&start=20&pp=gQAeAAAAAAAAAAAAAAAB_gIBfgARAQEBBzhZhFoNT88m3HZ0hgMAAA&vjk=f0093b4829343be7
35,954d78ae713dc999,Machine Learning Engineer,"San Francisco, CA",ENTRY_LEVEL,BACHELORS_DEGREE,fulltime,"Senior GPU Performance Engineer - job post Zoox (part of Amazon.com) 9 reviews Foster City, CA $210,000 - $300,000 a year Zoox 9 reviews Read what people are saying about working here. You must create an Indeed account before continuing to the company website to apply Apply on company site save-icon Zoox is building the world's most advanced self-driving hardware and software solution. The efficiency demands of such a system require an expert fine tuning of both the compute hardware architecture as well as the algorithms and middleware that runs on it to achieve maximum throughput at the most optimal power levels. The Core Performance team’s mission is to analyze, optimize and provide guidance to the software and hardware teams in order to meet the required specifications. As a GPU performance software engineer within the Core Performance team, you will instrument, monitor, analyze and optimize GPU based algorithms that are performance-critical for our solution. The scope for GPU usage ranges from traditional computer vision and deep learning architectures to complex geometric reasoning and multi-agent decision making. Responsibilities Build real-time instrumentation for performance monitoring (CPU, GPU, latency, memory) of the system at hand and offline benchmarking frameworks to support performance evaluation Build tools and scripts to evaluate & analyze performance at scale in CI as well as in vehicle. Establish budgets for existing architectures, and provide data to define next-gen architectures. Analyze performance metrics to identify GPU hotspots and root causes, and propose and co-implement actionable solutions with component teams. Support teams on bringing serial algorithms to the GPU to maximize compute utilization and improve overall latency. Work as part of the Core team to build a middleware framework that promotes by default efficient and performant code development by maximizing CPU and GPU. Qualifications BS in computer science or related field Strong knowledge of C++ and experience in large code bases Strong knowledge of CUDA as applied to recent GPU microarchitectures (e.g., Turing, Ampere) Strong knowledge in linear algebra; 3D geometry and/or dynamical systems and control Experiencing debugging and optimizing GPU kernels using tools like Nsight Systems and Compute Comfortable in Linux development environments Bonus Qualifications GPU kernel development experience in a firm/hard real-time environment Experience in development, debugging and profiling of complex multiprocess systems (e.g. game engines, robotic systems) Experience with PTX-level programming Experience with CPU SIMD instructions (e.g., AVX intrinsics) Experience with TensortRT and custom CUDA layers Compensation There are three major components to compensation for this position: salary, Amazon Restricted Stock Units (RSUs), and Zoox Stock Appreciation Rights. The salary range for this position is $210,000 to $300,000. A sign-on bonus may be offered as part of the compensation package. Compensation will vary based on geographic location and level. Leveling, as well as positioning within a level, is determined by a range of factors, including, but not limited to, a candidate's relevant years of experience, domain knowledge, and interview performance. The salary range listed in this posting is representative of the range of levels Zoox is considering for this position. Zoox also offers a comprehensive package of benefits including paid time off (e.g. sick leave, vacation, bereavement), unpaid time off, Zoox Stock Appreciation Rights, Amazon RSUs, health insurance, long-term care insurance, long-term and short-term disability insurance, and life insurance. Vaccine Mandate Employees working in this position will be required to have received a single dose of the J&J/Janssen COVID-19 vaccine OR have completed the two-dose Pfizer or Moderna vaccine series. In addition, employees will be required to receive a COVID-19 booster vaccine within two months of becoming eligible for the booster vaccine. Employees will be required to show proof of vaccination status upon receipt of a conditional offer of employment. That offer of employment will be conditioned upon, among other things, an Applicant’s ability to show proof of vaccination status. Please note the Company provides reasonable accommodations in accordance with applicable state, federal, and local laws. About Zoox Zoox is developing the first ground-up, fully autonomous vehicle fleet and the supporting ecosystem required to bring this technology to market. Sitting at the intersection of robotics, machine learning, and design, Zoox aims to provide the next generation of mobility-as-a-service in urban environments. We’re looking for top talent that shares our passion and wants to be part of a fast-moving and highly execution-oriented team. Follow us on LinkedIn A Final Note: You do not need to match every listed expectation to apply for this position. Here at Zoox, we know that diverse perspectives foster the innovation we need to be successful, and we are committed to building a team that encompasses a variety of backgrounds, experiences, and skills.",https://www.indeed.com/jobs?q=Data+Scientist&l=San+Francisco%5D+%23%2C+CA&sc=0kf%3Aattr%28EXSNN%7CFCGTU%7CHFDVW%7CQJZM9%7CUTPWG%252COR%29explvl%28SENIOR_LEVEL%29jt%28fulltime%29%3B&start=20&pp=gQAeAAAAAAAAAAAAAAAB_gIBfgARAQEBBzhZhFoNT88m3HZ0hgMAAA&vjk=954d78ae713dc999
36,a0d83d60d0880c6f,Machine Learning Engineer,"San Francisco, CA",ENTRY_LEVEL,BACHELORS_DEGREE,fulltime,"Director, Commercial Data Science & AI (3 roles) - job post AstraZeneca 2,270 reviews South San Francisco, CA 94080 Full-time AstraZeneca 2,270 reviews Read what people are saying about working here. You must create an Indeed account before continuing to the company website to apply Apply on company site save-icon Job details Job Type Full-time Make a greater impact on lives through a digitally-enabled enterprise We are working towards our aspiration of shaping the future of Pharma. Backed by investment at every step, we harness the latest technology, data, and innovative ways of working to introduce new approaches that put Digital at AstraZeneca’s heart. Be part of a chapter that’s still being written. Trusted and empowered to change the way things are done, with the tools and support to get you there. Here we are free to unleash our curiosity and turn thinking into reality where smart risks and quick decisions come together to power disruption and innovation. Office Locations: This is an on-site - office-based role. Please consider the following AZ US HUB locations – Gaithersburg, MD/ Wilmington, DE/South San Francisco, CA The Role: The US - Director, Commercial Data Sciences & AI (3 roles) is a key leader in the Commercial Data Science & AI team whose mission is to take a patient-centric, data-driven approach to personalize and transform healthcare delivery to the millions of patients along with a multi-disciplinary team of physicians who care for them. This responsibility involves working closely with cross-functional Science, Medical, and Business leaders to identify, prioritize, and develop Data Science, AI, and Advanced Analytics Platforms & Products across AZ Oncology and Bio-pharma businesses. The scope of this role is Global with a focus on US markets where AstraZeneca’s life-changing medicines are approved to help patients live longer and realize AZ’s bold ambition of eliminating Cancer as a cause of death. The team is responsible for value creation through innovation at a global scale. In addition to impeccable technical skills, the ability to communicate and influence a diverse stakeholder set is crucial. Not infrequently, the problems we solve are first identified by its senior members – introducing and gaining traction for these concepts requires tact and subtlety. Key Responsibilities: Develop a deep understanding of the business and its core markets. Leverage AI/ML, mathematical programming, and statistical modeling to develop solutions that create a competitive advantage for our commercial organization. Be responsible for the full solution architecture cycle: identification & definition of business questions/opportunities, data acquisition & preparation, model implementation & optimization, and method of deployment to the consuming system or team. Collaborate with ML Ops to prepare and document Skunkworks solutions for transition to maturity/industrialization team. Collaborate with matrix teams (sales, marketing, IT, external vendors, etc.) to ensure effective and efficient deployment of capabilities. Actively seek out, develop, and share best practices. Stay abreast of the evolving technical landscape, and remain current on the major data science libraries/stack Incentivize and pursue continuous improvement of existing capabilities and skills. Manage onshore and offshore external consultants. Competencies Minimum Requirements Bachelor’s Degree plus 5-7 years of progressive professional work experience in mathematics, computer science, engineering, physics, statistics, economics, computational sciences, or a quantitative discipline . * 7+ years of qualified professional experience can be substituted for Bachelor’s degree Track record of Developing Data Science and AI products that have generated business value, and impact across multiple Industries. In-depth experience with modern data science approaches, including unsupervised and supervised classification and regression algorithms such as k-means clustering, support vector machines, random forests, neural networks, and deep 8+ years of hands-on experience in the application of data science methods on large and disparate datasets, specifically: Statistical Analysis and Modelling: (e.g. Design of Experiments, Time Series Analysis, Regression Analysis, Bayesian methods, etc), Hands-on experience and theoretical expertise in modern deep learning (e.g. transformers). Advanced software development skills in at least two of the standard data science languages (such as R, Julia, or Python) and familiarity with database systems (e.g. SQL, NoSQL, graph) Understanding of algorithm design, development, optimization, scaling, and applications Excellent written and verbal communication, business analysis, and consultancy skills Proficiency in manipulating and utilizing large, longitudinal data sources, such as Claims, EMR, and other patient-level data sets. Experience using complex, non-tabular data structures Desirable Requirements Quantitative Master’s or PhD degree from an accredited college or university is required in one of the following or related fields: Engineering, Economics, Statistics, Applied Mathematics, Physics, Computer Science, Data Science, or Operations Research. Comfortable working in high-performance computing or cloud environment Proven track record of publishing relevant predictive modeling results and tools in peer-reviewed journals, conferences, and other scientific proceedings. Experience in understanding biomedical data sets and real-world data sets relevant to life sciences and healthcare Experience in novel methods development and application, complex global organization, and people management Experience in influencing and controlling budgets Pharmaceutical domain knowledge. Strong entrepreneurial drive to identify/pursue opportunities and take ownership of outcomes. Mature leadership and interpersonal skills. Track record of working collaboratively with a significant number of leaders and building ambitious solutions in a matrix environment. Strong organizational skills and time management Are you already imagining yourself joining our team? Good, because we can’t wait to hear from you. To be considered for this exciting opportunity, please complete the full application on our website at your earliest convenience - it is the only way that our Recruiter and Hiring Manager can know that you feel well qualified for this opportunity. Where can I find out more? Our Social Media, Follow AstraZeneca on LinkedIn https://www.linkedin.com/company/1603/ Follow AstraZeneca on Facebook https://www.facebook.com/astrazenecacareers/ Follow AstraZeneca on Instagram https://www.instagram.com/astrazeneca_careers/?hl=en",https://www.indeed.com/jobs?q=Data+Scientist&l=San+Francisco%5D+%23%2C+CA&sc=0kf%3Aattr%28EXSNN%7CFCGTU%7CHFDVW%7CQJZM9%7CUTPWG%252COR%29explvl%28SENIOR_LEVEL%29jt%28fulltime%29%3B&start=20&pp=gQAeAAAAAAAAAAAAAAAB_gIBfgARAQEBBzhZhFoNT88m3HZ0hgMAAA&vjk=a0d83d60d0880c6f
