,job_id,job_title,location,experience,education,job_type,job_description,job_link
0,7e4bb4278d9c80cc,Machine Learning Engineer,"San Francisco, CA",ENTRY_LEVEL,BACHELORS_DEGREE,fulltime,"Sr. Data Scientist - job post Adobe 749 reviews San Francisco, CA 94103 $122,400 - $223,000 a year -  Full-time Adobe 749 reviews Read what people are saying about working here. You must create an Indeed account before continuing to the company website to apply Apply on company site save-icon Job details Salary $122,400 - $223,000 a year Job Type Full-time Our Company Changing the world through digital experiences is what Adobe’s all about. We give everyone—from emerging artists to global brands—everything they need to design and deliver exceptional digital experiences! We’re passionate about empowering people to create beautiful and powerful images, videos, and apps, and transform how companies interact with customers across every screen. We’re on a mission to hire the very best and are committed to creating exceptional employee experiences where everyone is respected and has access to equal opportunity. We realize that new ideas can come from everywhere in the organization, and we know the next big idea could be yours! The Opportunity As a data scientist within the Creative Cloud Experience and Engagement organization, you will be a core part of the data science and analytics team, driving analytics-based insights that enable engaging experiences for our Creative Cloud customers, and bring users to experience core product value quickly across the Creative Cloud business. We’re looking for a candidate who is passionate about deriving impactful customer insights from large datasets, through descriptive, diagnostic, predictive and prescriptive analytics techniques. The ideal candidate will have a combination of strong analytical and technical skills, along with the ability to work with multi-functional teams, and the curiosity and ability to influence data-driven decision making by key partners. What you'll Do Drive analytics for user revenue/engagement growth programs and A/b tests through analyzing results and communicating insights. Partner with product managers to understand product/customer behavior and features, and use insights generated to make recommendations to improve customer experience and engagement. Be a specialist of stitching and calibrating sparse and noisy data across various data sources. Support regular ad-hoc data and analysis needs to better understand customer behavior. Build reporting frameworks / resources that enable partners to self-serve information. Partner with teams including product analytics, Go-To-Market and Campaign. What you need to succeed Master's / PhD degree in Computer Science, Analytics/Data Science, Statistics, or related quantitative field, or a Bachelor's degree in a similar field with relevant practical experience Strong skills in a data science/analytics role with a proven track record of success Experience in hypothesis testing and A/b test analytics Expertise in working with large data sets using Hive/SQL Hands-on experience working with Hadoop. Bonus points for prior experience working on any Cloud Platform eg Databricks. Expertise in developing sophisticated reports/dashboards using Tableau Good attention to detail and ability to stitch and QA multiple data sources. Strong analytical and quantitative problem-solving ability Excellent oral and written communication skills Ability to synthesize large scale data sets to generate a clear story and impactful insights A curious mind, passion, and motivation to learn new skills, tools, and analytics techniques critical to tackle business challenges. Our compensation reflects the cost of labor across several U.S. geographic markets, and we pay differently based on those defined markets. The U.S. pay range for this position is $122,400 -- $223,000 annually. Pay within this range varies by work location and may also depend on job-related knowledge, skills, and experience. Your recruiter can share more about the specific salary range for the job location during the hiring process. At Adobe, for sales roles starting salaries are expressed as total target compensation (TTC = base + commission), and short-term incentives are in the form of sales commission plans. Non-sales roles starting salaries are expressed as base salary and short-term incentives are in the form of the Annual Incentive Plan (AIP). In addition, certain roles may be eligible for long-term incentives in the form of a new hire equity award.",https://www.indeed.com/jobs?q=Data+Scientist&l=San+Francisco%5D+%23%2C+CA&sc=0kf%3Aattr%286QC5F%252COR%29explvl%28SENIOR_LEVEL%29jt%28fulltime%29%3B&vjk=7e4bb4278d9c80cc
1,301ee9e9399b1203,Machine Learning Engineer,"San Francisco, CA",ENTRY_LEVEL,BACHELORS_DEGREE,fulltime,"Senior AI Scientist, Perturbation Biology (Artificial Intelligence/Machine Learning) - job post Genentech (part of Roche) 1,023 reviews San Francisco, CA Full-time Genentech 1,023 reviews Read what people are saying about working here. You must create an Indeed account before continuing to the company website to apply Apply on company site save-icon Job details Job Type Full-time The Position We are building the Artificial Intelligence and Machine Learning Department in Research Biology, within Genentech Research and Early Development (gRED). The successful candidate will develop and apply novel machine learning methods to analyze high-content perturbation datasets with the ultimate goal of accelerating drug discovery and improving human health. The Role You will join the growing department of AI/ML within Research Biology. Your peers will be machine learning and computational scientists working across different areas of the life sciences. You will closely collaborate with chemists, biologists and computational scientists across departments in gRED. You will develop machine learning methods for the analysis of omics, image, graph and/or sequence data in the context of perturbation datasets. You will help build and scale machine learning techniques to massive datasets and aid in the deployment of novel machine learning algorithms. You will contribute to and drive publications in scientific journals and machine learning conferences, and present results at internal and external scientific meetings. Desired Qualifications PhD degree in quantitative field (e.g., Computer Science, Statistics, Mathematics) or, in the physical or life sciences (e.g., Chemistry, Biology). Excellent communication and interpersonal skills. Fluent in Python and strong experience with the analysis of omics data and/or graph data. Demonstrated experience with modern Python frameworks for deep learning (e.g., PyTorch, TensorFlow-Keras, or JAX). Demonstrated interest in problems across biology and chemistry as applied to the discovery and development of treatments for disease. Record of scientific experience, as evidenced by a strong publication record in scientific journals or by contribution to large-scale scientific efforts. One or more of the following: Experience with developing deep learning algorithms applied to omics datasets, in particular multimodal ones Experience with sequential decision making algorithms (e.g., Active Learning, Reinforcement Learning, Contextual Bandits) Experience with the analysis and/or predictive modeling of perturbation datasets with high-content readout (e.g., transcriptomics or image data) Experience with mechanistic modeling of gene-regulation (e.g., inference of gene-regulatory networks) Additional Desired Qualifications Experience with best practices in Data Engineering and Machine Learning Ops. Public portfolio of computational projects (available on e.g., GitHub) Record of machine learning research excellence as evidenced by publications in computer science and machine learning conferences (e.g., NeurIPS, ICLR, ICML) Experience with representation learning and probabilistic programming (e.g., Pyro). #LI-GL2 #gREDInformatics Who We Are A member of the Roche Group, Genentech has been at the forefront of the biotechnology industry for more than 40 years, using human genetic information to develop novel medicines for serious and life-threatening diseases. Genentech has multiple therapies on the market for cancer & other serious illnesses. Please take this opportunity to learn about Genentech where we believe that our employees are our most important asset & are dedicated to remaining a great place to work. Genentech is an equal opportunity employer & prohibits unlawful discrimination based on race, color, religion, gender, sexual orientation, gender identity/expression, national origin/ancestry, age, disability, marital & veteran status. For more information about equal employment opportunity, visit our Genentech Careers page Relocation benefits are available for this job posting. The expected salary range for this position based on the primary location of California is $137,300 - $255,100 and max of hiring range. Actual pay will be determined based on experience, qualifications, geographic location, and other job-related factors permitted by law. A discretionary annual bonus may be available based on individual and Company performance. This position also qualifies for the benefits detailed at the link provided below. Benefits Genentech is an equal opportunity employer, and we embrace the increasingly diverse world around us. Genentech prohibits unlawful discrimination based on race, color, religion, gender, sexual orientation, gender identity or expression, national origin or ancestry, age, disability, marital status and veteran status. Genentech requires all new hires to be fully vaccinated against COVID-19 as of their start date. This requirement is a condition of employment at Genentech, and it applies regardless of whether the position is located at a Genentech campus or is fully remote. If you are unable to receive the vaccine due to a disability or serious medical condition, or because it is prohibited as a result of your sincerely held religious beliefs, you will have an opportunity to request a reasonable accommodation. Genentech is an equal opportunity employer, and we embrace the increasingly diverse world around us. Genentech prohibits unlawful discrimination based on race, color, religion, gender, sexual orientation, gender identity or expression, national origin or ancestry, age, disability, marital status and veteran status. Genentech requires all new hires to be fully vaccinated against COVID-19 as of their start date. This requirement is a condition of employment at Genentech, and it applies regardless of whether the position is located at a Genentech campus or is fully remote. If you are unable to receive the vaccine due to a disability or serious medical condition, or because it is prohibited as a result of your sincerely held religious beliefs, you will have an opportunity to request a reasonable accommodation.",https://www.indeed.com/jobs?q=Data+Scientist&l=San+Francisco%5D+%23%2C+CA&sc=0kf%3Aattr%286QC5F%252COR%29explvl%28SENIOR_LEVEL%29jt%28fulltime%29%3B&vjk=301ee9e9399b1203
2,2955f8f17323b018,Machine Learning Engineer,"San Francisco, CA",ENTRY_LEVEL,BACHELORS_DEGREE,fulltime,"Senior/Principal Data Scientist - Finance - job post Genentech (part of Roche) 1,023 reviews San Francisco, CA Full-time Genentech 1,023 reviews Read what people are saying about working here. You must create an Indeed account before continuing to the company website to apply Apply on company site save-icon Job details Job Type Full-time The Position At Genentech we work to deliver better outcomes to more patients, faster. As a Senior/Principal Data Scientist in Finance, you will collaborate to create actionable insights, analyses, visualizations and models - and help apply them in teams and systems to drive decisions and build value across the business. Finance plays a central role in our mission to provide better outcomes to patients faster. We partner locally and globally across the business, including with Commercial Sales and Marketing, Research, Clinical, Medical, Manufacturing and other core business units. Our goals is to leverage data to augment decision making, reduce cost, increase revenue, and ultimately bring better outcomes to patients. Your main focus will be partnering with business stakeholders, and aligning in our technical groups, to develop and apply analyses and predictive models that provide actionable insights to run the business. At the principal level, you will not only be an expert in data science and analytics, but will play a larger role with focused areas of the business like Commercial Finance, R&D, and Personal Health. Your will be able to influence the direction of data-driven decision making at a high level. You will also help lead the integration of data systems, dashboards, and suites of predictive models tailored to produce data-driven insights for specific functions in the company. Your business acumen and teamwork skills will allow you to work closely, and deliver tangible value, with business partners. Having a high level of technical proficiency is also needed to deliver well validated models, insightful analyses, and work within our team of data scientists, engineers and analysts. The successful candidate will be effective integrating data science and analytics into business practice, and embedding predictive models and visualizations into data-centric products and processes that run at scale. This is an excellent opportunity to take on cutting edge projects with significant scope, and work in a strong team with an excited set of business partners. You will be a respected member of a vibrant data science and analytics community of thousands. This is an opportunity to make lasting contributions that improve patient health, at a company that provides great benefits and an excellent work environment. Minimum Requirements: PhD with 2+ years of industry experience as a data scientist, or a Master’s degree with thesis work and 4+ years of experience, in Computer Science, Computational Biology/Chemistry, Engineering, or similar areas. Industry experience in team settings with strong demonstrated contributions as shown by attributable revenue generation, cost savings, quality product releases, patents, publications and conference presentations. Desired Experience: The successful candidate will have a mixture of technical and organizational experience. Technical expertise desired includes: Consultative work with stakeholders across the business, and contributing as a valued member of the team to influence decisions using insights from data, analytics and data science. Operating in data environments with multiple complex data sources: finding, accessing, cleansing, merging, validating and annotating data. Performing data exploration to identify actionable insights - including finding trends, key features, feature engineering, discovering and showing relationships and developing visualizations. Developing, validating predictive models will include familiarity with test and training sets, supervised and unsupervised methods, and understanding strengths and weaknesses of algorithms (such as clustering techniques, Random Forests, Gradient Boosting etc.). Characterizing the accuracy of models across use cases, creating benchmarks, developing unit tests, bringing models to production deployment, monitoring usage and accuracy of models in production, refreshing models, and phasing the updated model into production in frameworks such as A/B testing is desired. Automating data processes and data quality metrics to detect and account for irregularities in data quality. Communicating key findings within data science, in cross-disciplinary project teams, and to partnered groups across the business with different needs and perspectives (such as Commercial, Research and Manufacturing). On the hands-on technical side, we work primarily in an AWS-based environment, and are looking for substantial experience with platforms like AWS, languages like Python and R, libraries like Pandas and SKLearn, familiarity with software development and version control systems, tools like Anaconda and Jupyter Notebooks, systems like SageMaker, and visualization in R Shiny or Tableau. Softer skills desired include understanding the perspectives of team members from other disciplines or backgrounds, analyzing business and project needs and opportunities, building consensus, communicating your findings to create actionable insight, and running data-centric meetings for purposes ranging from discovery to confirming decisions. The expected salary range for this position based on the primary location of California is $172,224 to $233,662. Actual pay will be determined based on experience, qualifications, geographic location, and other job-related factors permitted by law. A discretionary annual bonus may be available based on individual and Company performance. This position also qualifies for the benefits detailed at the link provided below. Benefits #ITcareers #LI-PK1 Genentech is an equal opportunity employer, and we embrace the increasingly diverse world around us. Genentech prohibits unlawful discrimination based on race, color, religion, gender, sexual orientation, gender identity or expression, national origin or ancestry, age, disability, marital status and veteran status. Genentech requires all new hires to be fully vaccinated against COVID-19 as of their start date. This requirement is a condition of employment at Genentech, and it applies regardless of whether the position is located at a Genentech campus or is fully remote. If you are unable to receive the vaccine due to a disability or serious medical condition, or because it is prohibited as a result of your sincerely held religious beliefs, you will have an opportunity to request a reasonable accommodation.",https://www.indeed.com/jobs?q=Data+Scientist&l=San+Francisco%5D+%23%2C+CA&sc=0kf%3Aattr%286QC5F%252COR%29explvl%28SENIOR_LEVEL%29jt%28fulltime%29%3B&vjk=2955f8f17323b018
