,job_id,job_title,location,experience,education,job_type,job_description,job_link
47,693dc05f9a2ca936,Machine Learning Engineer,"San Francisco, CA",ENTRY_LEVEL,BACHELORS_DEGREE,fulltime,"Group Product Manager, Product Insights (Remote) - job post The Estée Lauder Companies 2,346 reviews New York, NY • Remote $113,500 - $195,000 a year -  Full-time The Estée Lauder Companies 2,346 reviews Read what people are saying about working here. You must create an Indeed account before continuing to the company website to apply Apply on company site save-icon Job details Salary $113,500 - $195,000 a year Job Type Full-time Do you want to be part of a team defining and transforming the digital beauty shopping and discovery experience? By deeply understanding consumer needs and trends, uncovering business value, and working with user experience, design, data, technology and brand teams you can be at the forefront of innovation in one of the most exciting verticals in eCommerce and omnichannel innovation. Do you want to participate in the creation and growth of empowered product teams? Does the idea of seeing your impact directly with customers across the world excite you? If so, we want you! The Global Product Management Team delivers best-in-class consumer experiences globally for Estée Lauder Companies’ brands. Role Summary We at Estee Lauder Companies are on a journey of completely re-envisioning our ecommerce platform. We are looking for a product leader to focus solely on the web commerce core data & insights product areas who can effectively maintain and innovate the products that are powering our web consumer platform. The Group Product Manager, Product Insights will oversee product teams that are responsible for Data Layer & Analytics, Testing & Experimentation, and Personalization. The ideal candidate is someone who has a combined knowledge of ecommerce platforms, strong data & insights product and tool knowledge, retail technology and vendor integrations and can drive the transformation of the platform's core products. The Group Product Manager (GPM), Product Insights will create value from our unique, rich, and rapidly growing data, side by side with engineering, data science, marketing, MarTech, product, UX and design leads for our product areas. We expect you to drive actionable insights into customer behavior and operational efficiency, support decision-making and strategy create strong feedback loops through data visualization, experimentation and analysis and enable others to self-serve data needs. You will be a consumer advocate, empowering a personalized and holistic consumer experience. Responsibilities will include hiring, leading, and developing PMs (Product Manager) of various experience levels, defining and executing product strategy for the analytics, experimentation and personalization products roadmap. You will work closely with other Product teams, UX, Engineering, Customer Service, markets/affiliates, and other key groups to bring the product vision to market and being a champion for the vision across the organization. As a team and people leader, you will coach and empower your product team leads to define and refine their product strategies and execute iteratively to deliver value to the organization and to the consumer. Key Responsibilities Lead a team of Product Managers, including coaching existing team leads, hiring new team members, talent development, and day-to-day management responsibilities and drive the adoption of product iteration mindset through data driven decisioning, analytical experiments, personalization and calculated risks Drive a team of product managers and work with other group product managers to formulate and articulate a clear and compelling product vision that allows Estee Lauder Companies to stay ahead of emerging trends and drive product strategy and champion innovation Define and execute product roadmap in alignment with overall product vision, strategy, and roadmap and work closely with customers, partners, analysts, and other important groups to chart a winning course Partner with key stakeholders in the organization to position and launch winning product go-to-market strategies and use the understanding of the problem set to lead the team in creating a roadmap that elevates the customer’s e-commerce experience. Actively engage with Brands, Regions/Markets, Customer Success, MarTech, CDP, Data Science teams to ensure successful product launches and adoption Understand business strategy, define the critical moments by supporting teams and tools that provide insights from onsite behavior, and order data to identify and expand on opportunities for all ecommerce product, brand and marketing teams. Drive a data-first mentality and lead to the adoption and expansion of the analytics, experimentation and personalization roadmaps that unlocks revenue opportunities across customer cohorts (first time purchaser/repeat purchase, anonymous/identified) Conduct ongoing competitive analysis of other sites, apps, and products to continually identify ways to improve our user experience Build and improve team workflows, program governance and activation processes with your product managers to activate our roadmap and communicate with partners to lead to successful onboarding for brands and markets Knowledgeable on personalization, data layer & tag management, analytics and visualization tools, and testing & experimentation. Who We Are Sure, you know Estée Lauder, but do you know the Estée Lauder Companies Inc. full family of brands? We’re also MAC, Clinique, La Mer, Origins, Bobbi Brown, Aveda, Jo Malone London, Bumble and Bumble and Too Faced… just to name a few. You know us. You love us. Why not work with us? With headquarters in the heart of New York in Manhattan’s Flatiron District, we connect with our customers anytime, anywhere, from any device. We’re committed to innovation, working with the best tools and technologies available to help our shoppers seamlessly navigate the digital world of beauty. ELC Online is a collaborative work environment that hums with the buzz of 80% female leadership. It’s also home to bold technologists, marketers and commerce renegades who are shaping the future of beauty. Qualifications Who You Are Deeply curious: you operate with a sense of urgency and always look for new ways to understand our customers and create value on their behalf Data-fluent: you use data to solve problems, identify opportunities, and are capable of inventing and using new metrics in order to learn and make decisions Biased for action: you make good decisions with incomplete data and are constantly optimizing for learning. An owner: you can seamlessly straddle thinking about both the product and the business and are equally comfortable talking about funnel metrics and P+L's.. You are willing to get your hands dirty and do whatever it takes to ensure success What We Are Looking For BA/BS degree in digital marketing, visual communication, marketing, communications or related field 6+ years of product management or related experience creating software products of product management, technical delivery or related experience creating software products 5+ years of product and technical experience working with analytics, voice of the consumer (VOC) tools, and testing & experimentation. Technical know-how: While you need not be an engineer, you understand the technical implications of the product decisions you make. 5+ years of product management or related experience working on personalization, machine learning, recommendations, or similar 3+ years of people manager experience, either as a direct or functional leader, coaching and building teams Equipped with the digital technical fluency, understanding technical constraints and prioritizing and discussing tradeoffs between development and business teams Ability to translate business intent, customer needs, and/or technical direction into clear, concise, well-documented product requirements Capable of building partnerships, managing stakeholders, and working collaboratively with cross-functional partners to drive projects to completion and meet shared objectives Strong prioritization and leadership skills, including timely and proactive communications of timelines, status, issue escalation Extreme attention to detail and ability to self-audit work Strong analytical skills: You’re facile with data analysis and have familiarity with Excel, databases, and SQL and running A/B tests at scale. Tag Management system experience (Tealium and GTM preferred) GA360 experience is preferred Past experience working internationally is a plus A proven track record of planning and shipping successful products - ideally with some experience building consumer products A consumer-first orientation: you think about products from the end users’ perspective, and have experience with relevant tools, including running usability studies and qualitative user research Excellent communication skills: you communicate clearly and concisely, including with leadership, and can tailor your message to your audience The anticipated base salary range for this position is $113,500 to $195,000. Exact salary depends on several factors such as experience, skills, education, and budget. Salary range may vary based on geographic location. In addition to base salary, this position is eligible for participation in a highly competitive bonus program with possibility for overachievement based on performance and company results as well as participation in the share incentive plan. In addition, The Estée Lauder Companies offers a variety of benefits to eligible employees, including health insurance coverage, wellness and family support programs, life and disability insurance, retirement savings plans, paid leave programs, education-related programs, paid holidays and vacation time, and many others. Many of these benefits are subsidized or fully paid for by the company. #LI-Remote Job: Online / E-Commerce Primary Location: Americas-US-NY- Job Type: Standard Schedule: Full-time Shift: 1st (Day) Shift Job Number: 2225936 We are an equal opportunity employer. Minorities, women, veterans, and individuals with disabilities are encouraged to apply. It is Company's policy not to discriminate against any employee or applicant for employment on the basis of race, color, creed, religion, national origin, ancestry, citizenship status, age, sex or gender (including pregnancy, childbirth and related medical conditions), gender identity or gender expression (including transgender status), sexual orientation, marital status, military service and veteran status, physical or mental disability, protected medical condition as defined by applicable state or local law, genetic information, or any other characteristic protected by applicable federal, state, or local laws and ordinances. The Company will endeavor to provide a reasonable accommodation consistent with the law to otherwise qualified employees and prospective employees with a disability and to employees and prospective employees with needs related to their religious observance or practices. Should you wish to apply for this position or any other position with the Company and you believe you require assistance to complete an application or participate in an interview, please contact USApplicantAccommodations@Estee.com.",https://www.indeed.com/jobs?q=Machine+Learning+Engineer&l=New+York%2C+NY&sc=0kf%3Aattr%28FCGTU%7CHFDVW%7CQJZM9%7CUTPWG%252COR%29explvl%28MID_LEVEL%29jt%28fulltime%29%3B&radius=50&start=30&pp=gQAtAAAAAAAAAAAAAAAB_gKCswAoAQIBCBIICGoh3Ye2VvFf_AAByd_47cS2lEoyWi0w3RwW7ECd7yruRAAA&vjk=693dc05f9a2ca936
48,8b62e33dbc8e89fa,Machine Learning Engineer,"San Francisco, CA",ENTRY_LEVEL,BACHELORS_DEGREE,fulltime,"Senior Software Engineer - job post Intuit 1,898 reviews New York, NY 10012 Full-time Intuit 1,898 reviews Read what people are saying about working here. You must create an Indeed account before continuing to the company website to apply Apply on company site save-icon Job details Job Type Full-time Overview Come join Intuit as part of the IDS Risk Data Analytics team as a Senior Software Engineer (data) . We are looking for creative problem solvers with a passion for innovation to join our team and revolutionize the way the world does business. This is a full-time position in our New York City, NY location. This position may also require some occasional travel to our corporate offices in Mountain View, CA or Los Angeles, CA.The primary role of a Senior Software Engineer (data) is to provide timely technical, analytical and data support to the policy analyst and data science community to define, test, implement, and maintain strategies and procedures that will assist Intuit in growing revenue and profit by developing and maintaining innovative products and techniques in the target markets we serve. What you'll bring BS in Computer Science, Mathematics, or a similar field. Object Oriented programming skills in Python, and a willingness to learn other languages (e.g. Bash, Scala, R) as needed. Experience developing data processing applications using Spark. Strong understanding of HADOOP-based technologies and systems, including Hive QL, MR, and Spark programming, Spark cluster/job optimization techniques, Lambda, streaming data with Kafka Familiarity with database fundamentals including SQL, and schema design. 4+ years of experience integrating technical processes and business outcomes – specifically: data architecture and models, data and process analysis, data quality metrics / monitoring, developing policies / standards & supporting processes. 4+ years of hands-on data engineering experience. 2+ years DevOps experience including configuration, monitoring and version control. Record of accomplishment working with data from multiple sources, willingness to dig-in and understand the data and to leverage creative thinking and problem solving. Excellent interpersonal and communication skills, including business writing and presentations. Ability to communicate objectives, plans, status and results clearly, focusing on critical few key points. Preferred Qualifications MS in Computer Science, Mathematics, or a similar field. 2+ years of experience building and operating scalable and reliable data pipelines based on Big Data processing technologies like Hadoop, MR, Spark in the AWS cloud, Lambda, Kafka, S3. Advanced programming skills in Python, Bash Shell. Familiarity with Scala. 5+ years of experience integrating technical processes and business outcomes – specifically: data architecture and models, data and process analysis, data quality metrics / monitoring, developing policies / standards & supporting processes. 5+ years of hands-on data engineering experience. 2+ years of hands-on experience with analytics, building and operating DW on Redshift or Vertica MPP. Demonstrated ability to work in a matrix environment, ability to influence at multiple levels, and build strong relationships. Knowledge of enacting service level agreements and the appropriate escalation and communication plans to maintain them. How you will lead Work in the Risk Data Analytics data engineering team. The team has 10 engineers working on Risk & Compliance Management, Security, Fraud Prevention, EMR/Spark/Python data pipelines, Kafka streaming pipelines, Data Warehousing (DW), and Business Intelligence (BI) solutions. Work closely with the Risk Decision Science team to design, build, deploy and operate their data science, data analytics solutions. Work in fast-moving development team using agile methodologies. Partner closely with Data Scientists, BI developers and Product Managers to design and implement data models, database schemas, data structures, and processing logic to support various data science, analytics, machine learning, and BI workflows. Design and develop ETL (extract-transform-load) processes to validate and transform data, calculate metrics and model features, populate data models etc., using Spark, Python, SQL, Lambda, Kafka, and other technologies in the AWS cloud. Lead by example, demonstrating best practices for code development and optimization, unit testing, CI/CD, performance testing, capacity planning, documentation, monitoring, alerting, and incident response in order to ensure data availability, data quality, usability and required performance. Define SLAs for data availability and correctness. Automate data availability and quality monitoring and alerts. Respond to alerts when data delivery SLAs are not being met. Communicate progress across organizations and levels from individual contributor to executive. Identify and clarify the critical few issues that need action and drive appropriate decisions and actions. Communicate results clearly and in actionable form.",https://www.indeed.com/jobs?q=Machine+Learning+Engineer&l=New+York%2C+NY&sc=0kf%3Aattr%28FCGTU%7CHFDVW%7CQJZM9%7CUTPWG%252COR%29explvl%28MID_LEVEL%29jt%28fulltime%29%3B&radius=50&start=30&pp=gQAtAAAAAAAAAAAAAAAB_gKCswAoAQIBCBIICGoh3Ye2VvFf_AAByd_47cS2lEoyWi0w3RwW7ECd7yruRAAA&vjk=8b62e33dbc8e89fa
49,0c52eb598f8a6a72,Machine Learning Engineer,"San Francisco, CA",ENTRY_LEVEL,BACHELORS_DEGREE,fulltime,"Senior Product Manager, Delivery Home Feed - job post Uber 2,766 reviews New York, NY 10007 $174,000 a year -  Full-time Uber 2,766 reviews Read what people are saying about working here. You must create an Indeed account before continuing to the company website to apply Apply on company site save-icon Job details Salary $174,000 a year Job Type Full-time About the Role Whether it’s a sandwich, a burrito, or groceries, the Uber Delivery team builds technology to connect people with what they want, when, and where they want it. The Intelligent Customer Experiences team owns all of the search and discovery surfaces on the Uber app. As a Sr. Product Manager on this team, you will lead the product charter for Home Feed ranking and intelligence. You will help accelerate our mission to help customers land their next order, encourage exploration and delight them with new and exciting recommendations right when they open the app. You will work with a team of world class scientists, designers and engineers to bake personalization and inquisitive ranking into our home feed such that customers can seamlessly discover restaurants, grocery stores, pharmacies and other offerings from Uber. What the Candidate Will Do: Define a product vision and strategy for the team; identify near and long-term initiatives to implement an effective product roadmap Translate user needs into product requirements by distilling user problems, writing hypotheses, and describing desired outcomes Clearly communicate product plans, tradeoffs and results to a wide audience, including internal partner teams, executives, end users and external customers Launch experiments to test changes and analyze results, tradeoffs to drive launch decisions Build, launch, and drive usage of brand new, innovative features and experiences that deeply embed Uber’s reservations product into earner's routines Partner with teams throughout Uber and collaborate with them to adapt their features and plans for consumers with planning use cases Work closely with a team of world-class engineers, designers, data scientists, and user researchers, setting team deliverables, roadmap, and driving execution Build and cultivate a strong team culture with a focus on collaboration, execution and results Basic Qualifications: Computer science undergraduate (or other engineering degree equivalent) or business/management undergraduate degree. Minimum 4 years of Product Management experience delivering highly successful and innovative technology products. Passion for working on machine learning, personalization based products. Experience with running experiments and data-driven decision-making ability. High standards across the board - from your own contributions to the people you work with to the products you work on. Preferred Qualifications Experience working on Search and/or Ranking systems Finger-trippiness with data: you just go get the data you need with no muss/fuss and can whip it into an insightful story with no help Experience running experiments to assess the effectiveness of releases Stellar design instincts and product taste. Experience applying machine learning to develop premier product Uber is proud to be an Equal Opportunity/Affirmative Action employer. All qualified applicants will receive consideration for employment without regard to sex, gender identity, sexual orientation, race, color, religion, national origin, disability, protected Veteran status, age, or any other characteristic protected by law. We also consider qualified applicants regardless of criminal histories, consistent with legal requirements. If you have a disability or special need that requires accommodation, please let us know by completing this form. Offices continue to be central to collaboration and Uber’s cultural identity. Unless formally approved to work fully remotely, Uber expects employees to spend at least half of their work time in their assigned office. For certain roles, such as those based at green-light hubs, employees are expected to be in-office for 100% of their time. Please speak with your recruiter to better understand in-office expectations for this role. For New York, NY-based roles: The base salary range for this role is $174,000 per year - $193,500 per year. For San Francisco, CA-based roles: The base salary range for this role is $174,000 per year - $193,500 per year. For Seattle, WA-based roles: The base salary range for this role is $174,000 per year - $193,500 per year. For all US locations, you will be eligible to participate in Uber's bonus program, and may be offered an equity award & other types of comp. You will also be eligible for various benefits. More details can be found at the following link https://www.uber.com/careers/benefits.",https://www.indeed.com/jobs?q=Machine+Learning+Engineer&l=New+York%2C+NY&sc=0kf%3Aattr%28FCGTU%7CHFDVW%7CQJZM9%7CUTPWG%252COR%29explvl%28MID_LEVEL%29jt%28fulltime%29%3B&radius=50&start=30&pp=gQAtAAAAAAAAAAAAAAAB_gKCswAoAQIBCBIICGoh3Ye2VvFf_AAByd_47cS2lEoyWi0w3RwW7ECd7yruRAAA&vjk=0c52eb598f8a6a72
