,job_id,job_title,location,experience,education,job_type,job_description,job_link
0,7b90fd91a52823a0,Data Engineer,"Dallas, TX",SENIOR_LEVEL,BACHELORS_DEGREE,fulltime,"Senior Data Engineer - job post Unleashed Brands 2 reviews Bedford, TX 76022 Full-time Apply now Apply now save-icon Job details Pay Types Paid semi-monthly Job Type Full-time SENIOR DATA ENGINEER Role Summary: Unleashed Brands is seeking a Senior Data Engineer to join a team using cutting edge data technology to solve business, operations, and analytical challenges. This individual must be highly experienced, detail-oriented, and incredibly organized to gather requirements, architect solutions, implement deliverables while mixing in regular maintenance, troubleshooting, and performance tuning of existing systems. To ensure success, you should be an excellent problem-solver and communicator that is fluent in most data manipulation languages with extensive knowledge, sound technical skills and administrative aptitude. This is a full-time position (not C2C or C2H) based in Bedford, TX Duties / Responsibilities: Collaborate in creating data architectures and support mechanisms. Creating ETL and ELT processes. Regularly liaising with IT project managers, database programmers, and data scientists. Designing databases with both front-end and back-end users in mind. Instituting/maintaining regular database maintenance plans. Monitoring system performance and identifying problems that arise. Regular performance tuning. Responding in a timely manner reported errors. Protecting the database against threats or unauthorized access. Ensuring that the database is adequately backed up and able to be recovered in the event of memory loss. Reporting on metrics regarding usage and performance. Suggesting changes and improvements for database maintenance or protection. Performs other duties as assigned. Job Skills & Qualifications: A bachelor's degree in Computer Science or related field or equivalent experience A minimum of 5-years’ experience as a database administrator Extensive experience with Microsoft SQL Server, Azure SQL, and other Azure technologies Experience with Azure Data Factory Experience with Azure Synapse a plus Proficient with PowerShell and Azure CLI Advanced certification as an MCDBA is advantageous Expert T-SQL abilities Experience with Power BI Analytical mindset and good problem-solving skills Excellent verbal and written communication skills Self-Starter Highly organized and responsible Capable of working under pressure Up-to-date with trends and developments in database administration Physical Requirements: Prolonged periods of sitting at a desk and working on a computer. Perks: Paid semi-monthly Company Paid Holidays Flexible Paid Time Off Multiple health care insurance plans that cover medical, dental, prescription, vision, and employer HSA contributions Competitive 401(k) Program with employer matching contributions Daily dress code of “business casual” A positive work environment And much, much more Company Description Unleashed Brands was founded to curate and grow a portfolio of the most innovative and profitable brands that help kids learn, play and grow. Over the last 10 years, the team at Unleashed Brands has built a proven platform and know-how for scaling businesses focused on serving families. Its mission is to impact the lives of every kid by providing fun, engaging and inspiring experiences that help them become who they are destined to be. Unleashed Brands has more than 350 locations open and in development with plans to open more than 100+ new units annually over the next 5 years. For more information, please visit www.unleashedbrands.com. Unleashed Brands is headquartered in the Dallas/Fort Worth Metroplex. Commitment to Equal Opportunity Unleashed Brands is committed to diversity in its workforce and is proud to be an Equal Opportunity Employer. All qualified applicants will receive consideration for employment without regard to race, color, religion, creed, gender, national origin, age, disability, veteran status, sex, gender expression or identity, sexual orientation or any other basis protected by applicable law. #UBHQ If you require alternative methods of application or screening, you must approach the employer directly to request this as Indeed is not responsible for the employer's application process.",https://www.indeed.com/jobs?q=Data+Engineer&l=Dallas%2C+TX&sc=0kf%3Aattr%28FCGTU%7CHFDVW%7CQJZM9%7CUTPWG%252COR%29explvl%28SENIOR_LEVEL%29jt%28fulltime%29%3B&vjk=7b90fd91a52823a0
1,486f6b8e6c1ff8fd,Data Engineer,"Dallas, TX",SENIOR_LEVEL,BACHELORS_DEGREE,fulltime,"Data Engineer - APM Technology (Hybrid) - job post Citi 19,181 reviews Irving, TX $116,880 - $175,320 a year -  Full-time You must create an Indeed account before continuing to the company website to apply Apply on company site save-icon Job details Salary $116,880 - $175,320 a year Job Type Full-time The Data Engineer/APM Lead Analyst is a senior-level position responsible for leading a variety of engineering activities including the design, acquisition and deployment of hardware, software and network infrastructure in coordination with the technology team. The overall objective of this role is to lead efforts to ensure quality standards are being met within existing and planned frameworks. Responsibilities: Expert in Application Performance Management/APM technology such as AppDynamics Experience creating product strategy Define necessary system enhancements to deploy new products and process enhancements Experience in automating solutions at wide or global scale Performance optimization and root cause analysis Exhibit knowledge of how employee's own specialty area contributes to the business and apply knowledge of competitors, products and services Advise or mentor junior team members Impact engineering functions by influencing decisions through advice, counsel or facilitating services Appropriately assess risk when business decisions are made, demonstrating particular consideration for the firm's reputation and safeguarding Citigroup, its clients and assets, by driving compliance with applicable laws, rules and regulations, adhering to policy, applying sound ethical judgment regarding personal behavior, conduct and business practices, and escalating, managing and reporting control issues with transparency. Qualifications: 6-10 years of relevant experience in an engineering role Experience working in financial services or a large complex and/or global environment Project management experience Consistently demonstrates clear and concise written and verbal communication Comprehensive knowledge of design metrics, analytics tools, benchmarking activities and related reporting to identify best practices Demonstrated analytic/diagnostic skills Ability to work in a matrix environment and partner with virtual/globally-distributed teams Ability to work independently, multi-task, and take ownership of various parts of a project or initiative Ability to work under pressure and manage tight deadlines or unexpected changes in requirements Proven track record of operational process change and improvement Education: Bachelor’s degree/University degree or equivalent experience Master’s degree preferred - Job Family Group: Technology - Job Family: Systems & Engineering - Time Type: Full time - Primary Location: Irving Texas United States - Primary Location Salary Range: $116,880.00 - $175,320.00 - Citi is an equal opportunity and affirmative action employer. Qualified applicants will receive consideration without regard to their race, color, religion, sex, sexual orientation, gender identity, national origin, disability, or status as a protected veteran. Citigroup Inc. and its subsidiaries (""Citi”) invite all qualified interested applicants to apply for career opportunities. If you are a person with a disability and need a reasonable accommodation to use our search tools and/or apply for a career opportunity review Accessibility at Citi . View the "" EEO is the Law "" poster. View the EEO is the Law Supplement . View the EEO Policy Statement . View the Pay Transparency Posting",https://www.indeed.com/jobs?q=Data+Engineer&l=Dallas%2C+TX&sc=0kf%3Aattr%28FCGTU%7CHFDVW%7CQJZM9%7CUTPWG%252COR%29explvl%28SENIOR_LEVEL%29jt%28fulltime%29%3B&vjk=486f6b8e6c1ff8fd
2,a15e33188c2c5a42,Data Engineer,"Dallas, TX",SENIOR_LEVEL,BACHELORS_DEGREE,fulltime,"Data Engineer/Senior Engineer - job post Toyota 110 reviews Plano, TX 75024 Full-time You must create an Indeed account before continuing to the company website to apply Apply on company site save-icon Job details Job Type Full-time Overview Who we are Collaborative. Respectful. A place to dream and do. These are just a few words that describe what life is like at Toyota. As one of the world’s most admired brands, Toyota is growing and leading the future of mobility through innovative, high-quality solutions designed to enhance lives and delight those we serve. We’re looking for diverse, talented team members who want to Dream. Do. Grow. with us. An important part of the Toyota family is Toyota Financial Services (TFS), the finance and insurance brand for Toyota and Lexus in North America. While TFS is a separate business entity, it is an essential part of this world-changing company – delivering on Toyota’s vision to move people beyond what’s possible. At TFS, you will help create best-in-class customer experiences in an innovative, collaborative environment. Who We’re Looking For Toyota Financial Services (TFS) is looking for highly motivated and hands-on people to fill multiple Data Engineering openings (junior to senior, depending on experience) for our growing team. The primary responsibilities of these roles are to prototype, build, operationalize, and support full-stack data solutions across the entire data processing pipeline. Aligning with the solution architecture team, these roles will develop and productionize reusable and repeatable data frameworks to leverage and extend existing data feeds to deliver new capabilities to support TFS’ digital modernization. Reporting to the Manager, Data Engineering, these roles will participate in functional requirements, define non-functional requirements, and build a pipeline for data to be stored, consumed, integrated, and managed by different data entities and systems, both operational and analytical systems using or processing that data. What You’ll Be Doing Apply data and systems engineering principles to develop code spanning the data lifecycle including ingest, transform, consume end to end from source to consumption for operational and analytical workloads that minimize complexity and maximize business value. Work as part of an agile scrum team to deliver business value. Participate in design sessions to understand customers' functional needs. Work with solution architect and development team to build quick prototypes leveraging existing or new architecture. Provide end-to-end flow for a data process, map technical solutions to the process. Develop and deploy code in continuous development pipelines leveraging off-the-shelf and open-source components of Enterprise Data Warehouse, ETL, and Data Management processes adhering to the solution architecture. Perform software analysis, code analysis, requirements analysis, release analysis and deployment. What You Bring Bachelor’s degree (or higher), or May 2023 graduate Hands-on development experience in distributed, analytical, cloud-based, and/or open-source technologies. At least 6 months to 5 years of professional experience, could be via an internship or co-op, building software for Data Ingestion/Data Movement ETL pipelines for operational and/or analytical systems. Expertise with coding and implementing data pipelines in cloud-based data infrastructure, analytical, and no-SQL databases (i.e.: AWS, Snowflake, MongoDB, Postgres). Hands-on programming experience in Python and/or Java, and/or SnowSQL. Experience leveraging build and deploy tools (i.e.: Github, Gradle, Maven, Jenkins). Ability to travel up to 10% of the time, if not less. Added Bonus If You Have Experience Implementing software leveraging flow-based pipelines such as NiFi or Airflow and Streaming services such as Kafka. Experience building data pipeline framework. What We’ll Bring During your interview process, our team can fill you in on all the details of our industry-leading benefits and career development opportunities. A few highlights include: A work environment built on teamwork, flexibility and respect. Professional growth and development programs to help advance your career, as well as tuition reimbursement. Vehicle purchase & lease programs Comprehensive health care and wellness plans for your entire family Flextime and virtual work options (if applicable) Toyota 401(k) Savings Plan featuring a company match, as well as an annual retirement contribution from Toyota regardless of whether you contribute. Paid holidays and paid time off. Referral services related to prenatal services, adoption, childcare, schools and more. Flexible spending accounts Relocation assistance (if applicable) Belonging at Toyota Our success begins and ends with our people. We embrace diverse perspectives and value unique human experiences. Respect for all is our North Star. Toyota is proud to have 10+ different Business Partnering Groups across 100 different North American chapter locations that support team members’ efforts to dream, do and grow without questioning that they belong. As a company that has been one of DiversityInc’s Top 50 Companies for Diversity and a member of The Billion Dollar Roundtable supporting minority and woman-owned suppliers for over 10 years, we are proud to be an equal opportunity employer that celebrates the diversity of the communities where we live and do business. Applicants for our positions are considered without regard to race, ethnicity, national origin, sex, sexual orientation, gender identity or expression, age, disability, religion, military or veteran status, or any other characteristics protected by law. Have a question or need assistance with your application? Please send an email to talent.acquisition@toyota.com.",https://www.indeed.com/jobs?q=Data+Engineer&l=Dallas%2C+TX&sc=0kf%3Aattr%28FCGTU%7CHFDVW%7CQJZM9%7CUTPWG%252COR%29explvl%28SENIOR_LEVEL%29jt%28fulltime%29%3B&vjk=a15e33188c2c5a42
3,2f3001d096faa013,Data Engineer,"Dallas, TX",SENIOR_LEVEL,BACHELORS_DEGREE,fulltime,"Data Platform Engineer, Big Data - job post Toyota 110 reviews Plano, TX 75024 • Hybrid remote Full-time You must create an Indeed account before continuing to the company website to apply Apply on company site save-icon Job details Job Type Full-time Overview Who we are At Toyota, we are reimagining mobility through innovative, high-quality technology solutions designed to enhance lives and meet our company mission of “Producing Happiness for All.” If you are interested in reimagining mobility with us in an inclusive environment built on teamwork that puts respect for people first, we want to talk to you. This position is based in Plano, TX . Toyota encourages all employees to live within a reasonable commuting distance of their assigned work location. Hybrid work from outside the assigned work location may be permitted in a pre-approved list of states with certain stipulations. Speak with your Recruiter and the Hiring Manager to learn more about our hybrid work program. Who we’re looking for Toyota’s Data and Analytics Department is looking for a passionate and highly motivated Data Ops Engineer, Toyota Big Data Platform. The primary responsibility of this role is to identify and implement automations that reduce or eliminate manual work, reduce downtime, and provide self-service capabilities for Big data developers, data engineers, and analysts. This is an Individual Contributor role that requires developing frameworks and cloud infrastructure solutions on the best-in-class enterprise Data Analytics Platform with cutting-edge technologies and guided by principles of Agility, DevSecOps, Infrastructure as a code, and continuous innovation. Reporting to the Director of Big Data Solutions, the person in this role will support the Data and Analytics department's objective to enable data-driven decisioning as a core competency in our journey towards creating mobility for all. What you’ll be doing Develop innovative frameworks to automate data pipeline testing to meet the business expectation and improve the data quality. Implement automation of infrastructure, security components, and Continuous Integration & Continuous delivery for optimal execution of data pipelines (ELT/ETL). Develop solutions to build resiliency in data pipelines with platform health checks, monitoring, and alerting mechanisms, so quality, timeliness, recency, and accuracy of data delivery are improved. Apply DevSecOps & Agile approaches to deliver the holistic and integrated solution in iterative increments. Liaison and collaborate with enterprise security, digital engineering, and cloud operations to gain consensus on architecture solution frameworks. Review system issues, incidents, and alerts to identify root causes and continuously implement features to improve platform performance. Be current on the latest industry developments and technology trends to effectively lead and design new features/capabilities. What you bring Bachelor’s degree in Information Systems, Computer Science, related discipline, or equivalent work experience. Progressive years of hands-on experience developing DevOps pipelines involving version control, continuous integration servers, configuration management, deployment automation, infrastructure orchestration, monitoring, and analytics. Progressive years of professional experience in data engineering and data management involving the development of ETL/ELT pipelines and programming in SQL, Python, Java, Scala-Spark, Bash, and other scripting languages. Solid understanding of Big Data Cloud technologies such as AWS EMR, Apache Spark, Databricks, AWS Redshift, Snowflake, S3, GCP Big Query, Google Cloud Storage, and Google Data Proc. Proficiency in cloud administration with experience developing infrastructure automation (Terraform, Cloud Formation) and provisioning Lambda, SNS, EC2, Airflow, Elastic Cache, Redis, RESTful APIs in AWS. Experience in DevOps, data pipeline development, and automation using Jenkins, Ansible, Chef, XL Release, and XL Deploy. Ability to research the latest trends and propose advanced tooling/solutions for data virtualization & digital twin concepts. Excellent written, oral communication and presentation skills to present architecture, features, and solution recommendations to senior management. Added bonus if you have AWS/GCP cloud certifications. AWS/GCP Data Engineering certifications. DevOps certifications. Experience with Automobile and/or Manufacturing organizations. What we’ll bring During your interview process, our team can fill you in on all the details of our industry-leading benefits and career development opportunities. A few highlights include: A work environment built on teamwork, flexibility, and respect. Professional growth and development programs to help advance your career, as well as tuition reimbursement. Vehicle purchase & lease programs. Comprehensive health care and wellness plans for your entire family. Flextime and virtual work options (if applicable). Toyota 401(k) Savings Plan featuring a company match, as well as an annual retirement contribution from Toyota regardless of whether you contribute. Paid holidays and paid time off. Referral services related to prenatal services, adoption, childcare, schools, and more. Flexible spending accounts. Relocation assistance (if applicable). #LI-REMOTE Belonging at Toyota Our success begins and ends with our people. We embrace diverse perspectives and value unique human experiences. Respect for all is our North Star. Toyota is proud to have 10+ different Business Partnering Groups across 100 different North American chapter locations that support team members’ efforts to dream, do and grow without questioning that they belong. As a company that has been one of DiversityInc’s Top 50 Companies for Diversity and a member of The Billion Dollar Roundtable supporting minority and woman-owned suppliers for over 10 years, we are proud to be an equal opportunity employer that celebrates the diversity of the communities where we live and do business. Applicants for our positions are considered without regard to race, ethnicity, national origin, sex, sexual orientation, gender identity or expression, age, disability, religion, military or veteran status, or any other characteristics protected by law. Have a question or need assistance with your application? Check out the How to Apply section of our careers page on Toyota.com or send an email to talent.acquisition@toyota.com.",https://www.indeed.com/jobs?q=Data+Engineer&l=Dallas%2C+TX&sc=0kf%3Aattr%28FCGTU%7CHFDVW%7CQJZM9%7CUTPWG%252COR%29explvl%28SENIOR_LEVEL%29jt%28fulltime%29%3B&vjk=2f3001d096faa013
