,job_id,job_title,location,experience,education,job_type,job_description,job_link
5,a591ccda02d70efb,Machine Learning Engineer,"San Francisco, CA",ENTRY_LEVEL,BACHELORS_DEGREE,fulltime,"Biological Data Scientist - job post Eikon Therapeutics Hayward, CA 94545 $117,000 - $134,000 a year -  Full-time You must create an Indeed account before continuing to the company website to apply Apply on company site save-icon Job details Salary $117,000 - $134,000 a year Job Type Full-time Company Description Eikon Therapeutics is a new biopharmaceutical company employing revolutionary technology at the intersection of chemistry, engineering, computation, and biology to discover novel treatments for life-threatening diseases. Eikon’s discovery platform is built on groundbreaking innovations from its founders (Nobel Prize, 2014), culminating in the creation of microscopes which enable real time, molecular-resolution measurements of protein movement in living cells, thereby unlocking otherwise intractable classes of proteins as drug targets. Position As a Biological Data Scientist, you will work to better understand large high-throughput datasets. You will support data analysis for external scientific collaborations while developing novel analysis tools and workflows. About You You have a passion for understanding biology via novel high-throughput data generation. You enjoy multidisciplinary scientific collaborations. You are conscientious and value scientific reproducibility and intelligibility as much as innovation. You can juggle competing priorities and stay focused on long-term goals, while having the flexibility to keep up with the pace of experimental science. What You’ll Do Collaborate both internally and externally with biologists and chemists to better understand large datasets Work with research, software development, engineering, and product teams to create data analysis tools for internal and external stakeholders Communicate complex analyses internally and to external scientific collaborators Work with Eikon Applications Scientist to deliver reports summarizing significant findings to collaborators following analysis of data. Demonstrate the Eikon software analysis platform and obtain customer feedback (VoC). Regularly report to internal teams on collaboration progress and latest feedback. Qualifications Ph.D. in computer science / bioinformatics / computational biology or equivalent experience 5+ years of experience (inclusive of PhD) with biological data analysis Strong expertise in scientific python (e.g., pandas, scipy, matplotlib) Experience with large image derived datasets a plus Cell imaging experience is a plus Excellent verbal and written communication skills Team oriented, flexible, able to adapt to rapidly evolving goals and challenges Enthusiasm for gaining biological and drug discovery experience essential At Eikon, employee compensation also includes bonus and equity compensation, in addition to several generous benefit programs, including: 401k plan with company matching Medical (premiums covered by Eikon at 95%), dental and vision insurance (premiums covered by Eikon at 100%) Mental health and wellness benefits Weeklong summer and winter holiday shutdowns Generous paid time off and holiday policies Life/AD&D Insurance (premiums covered by Eikon at 100%) and optional supplemental employee-paid life/AD&D policies Enhanced parental leave benefit Daily subsidized lunch program when on-site The expected salary range for this role is $117,000 to $134,000 depending on skills, competency, and the market demand for your expertise.",https://www.indeed.com/jobs?q=Data+Scientist&l=San+Francisco%5D+%23%2C+CA&sc=0kf%3Aattr%286QC5F%252COR%29explvl%28MID_LEVEL%29jt%28fulltime%29%3B&vjk=a591ccda02d70efb
6,28e9617bf7d80c9a,Machine Learning Engineer,"San Francisco, CA",ENTRY_LEVEL,BACHELORS_DEGREE,fulltime,"Machine Learning Scientist (Remote) - job post BigHat Biosciences San Mateo, CA • Remote Full-time You must create an Indeed account before continuing to the company website to apply Apply on company site save-icon Job details Job Type Full-time The role: At BigHat Biosciences our machine learning stack is tightly integrated with a high-throughput wetlab to rapidly design and validate ML-engineered antibodies. The Machine Learning Scientist* will work to advance the state of the art at each step in this integrated, iterative antibody optimization platform, improving the effectiveness with which it can be used to design new therapeutics to address unmet patient need. *At BigHat we believe in titles that commensurate with skill set, relative organizational impact, and value contribution; more experienced candidates are encouraged to apply, with the understanding that responsibilities and title would adjust as appropriate. Job Responsibilities Rapidly design, implement, and evaluate predictive machine learning models of diverse antibody biophysical properties, for dataset scales from hundreds to millions, to support BigHat’s therapeutic portfolio. Develop and implement improved active learning / bayesian optimization methodologies as validated experimentally in BigHat’s lab. Design and develop production-grade infrastructure for better model training, tracking, benchmarking and evaluation across diverse tasks in a continuous data generation setting. Support and oversee the application of ML-guided antibody engineering within ongoing therapeutics programs at BigHat. Source, implement, improve and integrate state of the art approaches from the literature and public domain to accelerate optimization campaigns. Collaborate closely with the BigHat lab, data science, and software engineering teams to ensure ML tooling is tailored to our experimental platform and therapeutic development goals. Preferred Qualifications PhD or MS with 2+ years of experience in a relevant domain. 3+ years of developing, evaluating, and applying AI/ML and statistical models from classical machine learning (GLMs, SVMs, tree-based models), deep learning (CNNs, LSTMs, LLMs, GANs) and/or Bayesian modeling (Bayesian optimization, active learning) Strong competency in Python, familiarity with pytorch. Excellent communication skills, sufficient biomedical domain knowledge to interact effectively with diverse scientific teams. Enjoys a fast paced environment and executing across multiple projects. Nice-to-haves include experience with protein structure modeling and biophysics, and NGS data. About BigHat Biosciences BigHat Biosciences designs safer, more effective biologic therapies for patients using machine learning and synthetic biology. BigHat integrates a wet lab for high-speed characterization with machine learning technologies to guide the search for better antibodies. We apply these design capabilities to develop new generations of safer and more effective treatments for patients suffering from today’s most challenging diseases. BigHat is a Series B biotech outside San Francisco with a team-oriented, inclusive, and family-friendly culture. Our broad pipeline of wholly-owned and partnered therapeutic programs span many disparate indications with high unmet need, such as cancer, inflammation, and infectious disease. BigHat has raised >$100M from top investors, including Section 32, a16z, and 8VC. Apply Now",https://www.indeed.com/jobs?q=Data+Scientist&l=San+Francisco%5D+%23%2C+CA&sc=0kf%3Aattr%286QC5F%252COR%29explvl%28MID_LEVEL%29jt%28fulltime%29%3B&vjk=28e9617bf7d80c9a
7,36ace7f9fe5a48a5,Machine Learning Engineer,"San Francisco, CA",ENTRY_LEVEL,BACHELORS_DEGREE,fulltime,"Data Scientist - Data Modeler (San Bruno, CA) - job post Walmart Connect San Bruno, CA 94066 • Hybrid remote $130,000 - $140,000 a year -  Full-time Apply now Apply now save-icon Job details Salary $130,000 - $140,000 a year Job Type Full-time Measurement Data Scientist - Modeler As part of Walmart Connect, you’ll be part of building industry defining omni-channel retail analytics capabilities that enable brand advertiser to invest strategically, confidently, and effectively. If you are motivated by complex, purposeful challenges, this role at Walmart Connect could be the fit you’ve been looking for. We are looking for a Data Scientist , to drive advertiser media strategy and performance through advanced statistical modeling and machine learning techniques. In this fast-growing team, the Sr. Data Scientist will build predictive models, derive media insights, define statistically sound solutions including but not limited to marketing mix models, multi touch attribution, uplift targeting, automated optimization strategies, and advertiser-facing recommendations. This role combines science leadership, client-facing communication, organizational ability, technical strength, product focus and business understanding. You’ll sweep us off our feet if… You’re proficient in modeling algorithms and programming languages You have knowledge in Digital Advertising, retail media and ad measurement You’re comfortable influencing others, communicating clearly with clients and working with cross functional stakeholders You’re customer-centric in spirit and in execution You have a test and learn mentality and an agile way of working to improve your solutions You are adaptable and don’t miss a beat with changing asks Responsibilities Build and enhance media mix models to connect the impact of marketing tactics and business short-term and long-term outcomes Run optimization and simulation scenarios to help provide the marketing investment and allocation recommendations to stakeholders Perform hands-on modeling and complex analyses using SQL & Python Explain complex modeling approaches in simple terms and develop compelling narratives that connect modeling results with business problems Partner with cross-functional team to streamline data science solutions Minimum Qualifications Master's degree in statistics, economics, operations research, engineering, or related field 2+ years of experience in MMM, measurement, marketing strategy & analytics Proficient coding skills (Python/SQL) and database knowledge Extensive experience with predictive modeling algorithms Strong project management skills Communicate technical material to a range of audiences and to ‘tell a story’ that provides insight into the business You have a passion for working in a fast-paced agile environment. A collaborative mindset and sense of curiosity Preferred Qualifications PhD degree in Statistics, Economics, Operations Research, or related field Experienced in building market mix and multi-touch attribution models Experience with advertising, measurement, and/or digital marketing analytics Experience with advertising technology platforms Ad servers, DSPs, DMPs, etc. Job Type: Full-time Pay: $130,000.00 - $140,000.00 per year Benefits: 401(k) 401(k) matching Dental insurance Employee discount Health insurance Life insurance Paid time off Relocation assistance Tuition reimbursement Vision insurance Schedule: 8 hour shift Monday to Friday Supplemental pay types: Bonus pay Ability to commute/relocate: San Bruno, CA 94066: Reliably commute or planning to relocate before starting work (Required) Experience: Data modeling: 1 year (Preferred) Work Location: Hybrid remote in San Bruno, CA 94066 Health insurance If you require alternative methods of application or screening, you must approach the employer directly to request this as Indeed is not responsible for the employer's application process.",https://www.indeed.com/jobs?q=Data+Scientist&l=San+Francisco%5D+%23%2C+CA&sc=0kf%3Aattr%286QC5F%252COR%29explvl%28MID_LEVEL%29jt%28fulltime%29%3B&vjk=36ace7f9fe5a48a5
8,8e567aaad63ac993,Machine Learning Engineer,"San Francisco, CA",ENTRY_LEVEL,BACHELORS_DEGREE,fulltime,"Machine Learning Engineer/Scientist - job post GotIt! Burlingame, CA Full-time You must create an Indeed account before continuing to the company website to apply Apply on company site save-icon Job details Job Type Full-time At Got It, Machine Learning Engineers and Scientists develop cutting edge technology and integrate it into our conversational AI platform. Our engineers and scientists bring fresh ideas from a diverse set of areas, including natural language processing, speech and conversational AI, cloud computing, large-scale system design, security, artificial intelligence, UI design and more. We need our team to be enthusiastic and versatile, display leadership and take on problems across the full stack. As an ML engineer or a scientist, you would work with a fast paced team on mission critical R&D projects towards specific, and ever evolving, business goals. With your technical expertise, you would manage project priorities, deadlines, and deliverables. Minimum requirements: Bachelor’s degree in Computer Science or related field or equivalent practical experience 3 years of software development experience, or 1 year with an advanced degree. Experience in applied machine learning, NLP or artificial intelligence. Experience with one or more general purpose programming languages including but not limited to: Python, Java, or C/C++. Preferred qualifications: Masters or PhD with specialization in one of the following areas: NLP, Conversational AI or machine learning 3+ years of experience with one or more of the following: natural language processing, conversational AI, speech recognition, text understanding, classification, pattern recognition, recommendation systems, targeting systems, ranking systems or similar Research Publications Strong software design and development skills and experience working effectively with science, data processing, and software engineering teams Excellent written and spoken communication skills Experience with relevant technologies (e.g., PyTorch, Tensorflow, machine learning libraries) Entrepreneurial spirit combined with strong architectural and problem solving skills",https://www.indeed.com/jobs?q=Data+Scientist&l=San+Francisco%5D+%23%2C+CA&sc=0kf%3Aattr%286QC5F%252COR%29explvl%28MID_LEVEL%29jt%28fulltime%29%3B&vjk=8e567aaad63ac993
9,e371f12eb59e5dc1,Machine Learning Engineer,"San Francisco, CA",ENTRY_LEVEL,BACHELORS_DEGREE,fulltime,"Machine Learning Scientist - job post Beepi 19 reviews San Francisco Bay Area, CA Full-time Beepi 19 reviews Read what people are saying about working here. You must create an Indeed account before continuing to the company website to apply Apply on company site save-icon Job details Job Type Full-time Overview Beepi is the fastest growing marketplace to buy and sell cars 100% online. Beepi makes the process simple, trustworthy and, dare we say it, fun. Gone are the days of haggling with the used car salesman on the lot. Instead, after cars pass our comprehensive 185-point inspection, our algorithm determines the pricing. We take care of all of the paperwork and deliver the car wrapped in a big bow right to your door. We’re are a small team with a big dream: to change the way cars are bought and sold – moving them from the people who own them to the people who need them as economically and efficiently as possible – and delighting customers along the way. Don’t think anyone would buy a car entirely online? Just watch what happens when you replace the average 4 hours wasted at a dealership with a five-minute checkout. Beepi is seeking a driven and detail-oriented Machine Learning Scientist to revolutionize our products using predictive modeling and real time analytics. The ideal candidate will own complex data modeling projects from inception to execution and have a passion for using data to dynamically improve the customer’s experience. The ideal candidate will have a strong programming and statistics background and several years of industry experience in machine learning. Graduate degrees are preferred but strong college graduates are also encouraged to apply if they can exhibit relevant projects. Most importantly, candidates need to demonstrate the ability to analyze large data sets to drive real time decision-making, and show a passion for the Beepi model. RESPONSIBILITIES Leverage Machine Learning models to interpret user behavior based on demographic and geographic information, as well as past behavior Use statistics, NLP and machine learning techniques to create scalable solutions for business problems Build out real time analytics that dynamically adjust the Beepi product suite to adapt to the needs of the user at breakneck speeds Develop models for pricing used cars Build customer segmentation mechanisms based on user and browsing data Support analytics requirements for different business teams Design and implement novel large scale structured text processing and information retrieval tools Design and implement production quality code for mission critical Java server applications Company: Beepi Qualifications: MS/PhD in Computer Science, Statistics, or Business 3+ years of experience in machine learning or related field Proven track record of working on complex modular projects, and assuming a leading role in such projects Highly motivated, self-driven, capable of defining own design and test scenarios Expert knowledge of SQL. Able to optimize complex queries Able to execute research projects, and generate practical results and recommendations Experience with K-means clustering, factor analysis, regression, neural networks, decision trees, SVM, Naive Bayesian classifications, and different simulation approaches like Monte Carlo methods a plus Experience with scripting languages (i.e. Javascript, Python) preferred • Experience with natural language processing, lexical analysis and semantic processing a plus Educational level: Master Degree Level of experience (years): Mid Career (2+ years of experience) How to apply: Please mention NLP People as a source when applying https://jobs.lever.co/beepi/70554c0c-b8a0-421f-8f6f-e74828dbf326?lever-source=Linkedin Tagged as: Academia, Classification, Clustering, Machine Learning, Master Degree, Neural Networks, United States About Beepi Buying and Selling a Car. More than Improved. Elevated.",https://www.indeed.com/jobs?q=Data+Scientist&l=San+Francisco%5D+%23%2C+CA&sc=0kf%3Aattr%286QC5F%252COR%29explvl%28MID_LEVEL%29jt%28fulltime%29%3B&vjk=e371f12eb59e5dc1
10,56a886aea73c938a,Machine Learning Engineer,"San Francisco, CA",ENTRY_LEVEL,BACHELORS_DEGREE,fulltime,"Machine Learning Engineer - job post RIOS Intelligent Machines Menlo Park, CA 94025 $100,000 - $180,000 a year -  Full-time You must create an Indeed account before continuing to the company website to apply Apply on company site save-icon Job details Salary $100,000 - $180,000 a year Job Type Full-time About RIOS RIOS Intelligent Machines, Inc. (""RIOS"") is a technology company helping enterprises automate their entire factories, warehouses, or supply chain operations – by deploying AI-powered end-to-end robotic workcells that integrate within existing workflows. RIOS is the leader of fullstack AI-powered robotic workcells for factory automation and deploys its robotic fleet at scale to transform labor-intensive factories into ""lights-out"" factories of the future powered by robotics and AI. RIOS was founded by former Xerox PARC engineers and is headquartered in Menlo Park, CA. More information is available at www.rios.ai. RIOS is looking for a Machine Learning Engineer who can design, prototype, train and deliver machine learning models to revolutionize manufacturing, supply chains, e-commerce, and other industrial applications. Responsibilities of the role include: Understand application space and system performance requirements by communicating with application engineers Work with Data acquisition engineers to collect appropriate data for model training and development Architect, prototype, test, and help deploy and help maintain modem ML models and algorithms Work with software engineers to turn prototypes into products Support deployments by tuning model performance in the field through continual data acquisition Solve real world robotics problems using ML, participate in bringing forward novel solutions to robotics and perception problems Work with a multidisciplinary team to solve previously unsolvable problems Continuous integration/development/training driven development for both codebases and model performance Technical attributes of candidates may include: 3 years industry experience (likely with M.S. or Ph.D. in Computer Science, Data Science, Machine Learning, or related field) Experience training custom/in-house datasets with State-of-the-Art models Familiarity with State-of-the-Art algorithms and real world performance on GPUs High degree of familiarity with ML/DL frameworks: TensorFlow, PyTorch, Theano, Keras, MXNet, Scikit Learn, etc. Familiarity with experiment tracking and management Attention to details such as documentation, version control and reproducibility Advanced proficiency working with Python (C++ a plus) Understanding of data typing and interaction with learning frameworks Nice to Have: Specialization in applications including computer vision, robotic control Familiarity with ROS (Robot Operating System) Perks: Competitive salary package & Stock options for every employee Healthcare + dental + vision insurance plans 401(k) plan Free lunch on-site at headquarters Flexible time off & paid holidays Social events + happy hours + team parties *No search firm submissions at this time. Job Type: Full-time Pay: $100,000.00 - $180,000.00 per year Benefits: 401(k) Dental insurance Health insurance Paid time off Vision insurance Work Location: One location Health insurance",https://www.indeed.com/jobs?q=Data+Scientist&l=San+Francisco%5D+%23%2C+CA&sc=0kf%3Aattr%286QC5F%252COR%29explvl%28MID_LEVEL%29jt%28fulltime%29%3B&vjk=56a886aea73c938a
11,0f9752c0332f3619,Machine Learning Engineer,"San Francisco, CA",ENTRY_LEVEL,BACHELORS_DEGREE,fulltime,"Machine Learning Scientist - Prescient Design - job post Genentech (part of Roche) 1,023 reviews San Francisco, CA Full-time Genentech 1,023 reviews Read what people are saying about working here. You must create an Indeed account before continuing to the company website to apply Apply on company site save-icon Job details Job Type Full-time The Position The Position The Machine Learning (ML) group within Prescient Design seeks exceptional researchers who have a demonstrated research background in machine learning and the physical sciences, a passion for independent research and technical problem-solving, and a proven ability to develop and implement ideas from research. The group provides a dynamic and challenging environment for cutting-edge, multidisciplinary research including access to heterogeneous data sources, close links to top academic institutions around the world, as well as internal Genentech Research and Early Development (gRED) partners and research units. Our mission is to develop and apply machine learning methods in designing novel macromolecules. Researchers in this role will develop and apply new geometric deep learning approaches for large molecule property prediction and generative design. The Role Participate in cutting-edge research in ML and applications to drug discovery and design. Collaborate closely with cross-functional teams across gRED to solve complex problems including developing models to predict antigen-antibody affinity and developability properties and to perform generative design. Refine models and workflows by performing exploratory data analysis, interrogating scientific hypotheses, and rigorous model selection. Contribute to publications and present results at internal and external scientific conferences, workshops, and venues. Qualifications Ph.D. in Computer Science, Statistics, Applied Math, Physics, Chemistry, or related technical field Experience in implementing equivariant neural networks and molecular dynamics (MD) simulations. Strong publication record and experience contributing to research communities, including conferences like NeurIPS, ICML, ICLR, etc. Strong programming skills in languages like Python and C/C++. Experience with one or more of the following: PyTorch, TensorFlow, JAX. Intense curiosity about the biology of disease and eagerness to contribute to scientific and computational efforts. The expected salary range for this position based on the primary location of South San Francisco or New York City is $137,300 and $255,100 of hiring range. Actual pay will be determined based on experience, qualifications, geographic location, and other job-related factors permitted by law. A discretionary annual bonus may be available based on individual and Company performance. This position also qualifies for the benefits detailed at the link provided below. Benefits #LI-DC2 Genentech is an equal opportunity employer, and we embrace the increasingly diverse world around us. Genentech prohibits unlawful discrimination based on race, color, religion, gender, sexual orientation, gender identity or expression, national origin or ancestry, age, disability, marital status and veteran status. Genentech requires all new hires to be fully vaccinated against COVID-19 as of their start date. This requirement is a condition of employment at Genentech, and it applies regardless of whether the position is located at a Genentech campus or is fully remote. If you are unable to receive the vaccine due to a disability or serious medical condition, or because it is prohibited as a result of your sincerely held religious beliefs, you will have an opportunity to request a reasonable accommodation.",https://www.indeed.com/jobs?q=Data+Scientist&l=San+Francisco%5D+%23%2C+CA&sc=0kf%3Aattr%286QC5F%252COR%29explvl%28MID_LEVEL%29jt%28fulltime%29%3B&vjk=0f9752c0332f3619
