,job_id,job_title,location,experience,education,job_type,job_description,job_link
17,d866d23cbda1df8e,Machine Learning Engineer,"San Francisco, CA",ENTRY_LEVEL,BACHELORS_DEGREE,fulltime,"Software Engineer (Incident Insights) - job post Shoreline Software, Inc. Redwood City, CA 94063 $120,000 - $180,000 a year -  Full-time Apply now Apply now save-icon Job details Salary $120,000 - $180,000 a year Job Type Full-time Shoreline.io is a cloud automation company - we detect production issues with hardware & software and automatically resolve them. Companies today are seeing an explosion in their infrastructure as their businesses grow with much slower growth in their DevOps teams. To close this gap, Shoreline has created the world's first production operations platform that provides powerful real-time debugging and tools for automating incident remediation. Shoreline recently launched a new tool, Incident Insights: https://www.shoreline.io/insights and are rapidly hiring engineers to join this new team. Incident Insights ingests PagerDuty and OpsGenie data, applies ML to automatically cluster the incidents, and then surfaces the top problems for automation. We are looking for software engineers with experience in frontend development, backend development, data pipelines, and machine learning to join the team. Insights is both a systems and machine learning project - team members must work on the system end to end. The system is developed in python and javascript. What you'll be doing Improving end to end customer experience by implementing new reports, extending existing reports, and enhancing the UI. Integrating Incident Insights with our core platform to create an end to end automation engine. Developing data pipelines for PagerDuty, Opsgenie, ServiceNow, and other ticketing tools. Enhancing machine learning clustering algorithms with natural language processing, hierarchical clustering, and data mining. Improving overall systems performance by adjusting hardware types, tuning sql queries & indices, optimizing algorithms, and adding caches. Participating in product and system design conversations and co-write design docs to guide overall Incident Insights development. What you should have Bachelors and masters degree in computer science, statistics, electrical & computer engineering, data science, or related technical field. Experience in computer science, data structures, algorithms and software design. Experience in software development and coding in a general purpose programming language with emphasis on Python and/or Javascript/Typescript. Experience with optimization such as linear regression, time series (e.g. ARIMA), decision trees (e.g. XGBoost), or statistical robustness (E.g. A/B testing). Experience with databases such as Postgres, Redshift, and/or Redis. Experience with development tools for CI/CD such as Github, Jenkins and/or shell scripts. Experience developing large scale systems that process logs, tickets, or other semi structured data via ETL data pipelines. Experience tuning systems to increase performance via improving data structures, parallelization, or tuning data models. Happy to see you are still with us, let’s get to know each other better So, we start first Blog post from the Founder and CEO Anurag Gupta about why hed Shoreline and his vision for Shoreline: https://shoreline.io/blog/why-i-built-shoreline-incident-automation Shoreline story and culture: https://shoreline.io/company A talk from Anurag about why systems fail and how Shoreline can help: https://shoreline.io/blog/why-systems-fail-and-what-you-can-do-about-it Shoreline blog with more posts about use cases and problems solved: https://shoreline.io/blog Shoreline product demo: https://www.youtube.com/watch?v=2sdEkBfxGs8 Shoreline product documentation: https://docs.shoreline.io/ What about you? Please reach out to cristina@shoreline.io to learn more about Shoreline and the opportunities here and share your interests and goals or fill in the form and we will reach out to you. If you require alternative methods of application or screening, you must approach the employer directly to request this as Indeed is not responsible for the employer's application process.",https://www.indeed.com/jobs?q=Machine+Learning+Engineer&l=San+Francisco%5D+%23%2C+CA&sc=0kf%3Aattr%28FCGTU%7CHFDVW%7CQJZM9%7CUTPWG%252COR%29explvl%28ENTRY_LEVEL%29jt%28fulltime%29%3B&start=10&pp=gQAPAAAAAAAAAAAAAAAB_f7eaAANAQAAkibmHNDgUJtLYgAA&vjk=d866d23cbda1df8e
18,cdf24862798485c8,Machine Learning Engineer,"San Francisco, CA",ENTRY_LEVEL,BACHELORS_DEGREE,fulltime,"Research Data Analyst 1 - job post Stanford University 797 reviews Stanford, CA $64,480 - $93,000 a year -  Full-time Stanford University 797 reviews Read what people are saying about working here. You must create an Indeed account before continuing to the company website to apply Apply on company site save-icon Job details Salary $64,480 - $93,000 a year Job Type Full-time Stanford University's Cardiothoracic Department is seeking a highly skilled and motivated researcher to join our team as a Research Data Analyst 1. In this role, you will be responsible for managing and analyzing large amounts of health information with the goal of improving patient care and management. As a researcher, you will work closely with the department's surgeons, physicians, and researchers to develop and implement advanced data analysis and modeling techniques. You will be responsible for creating and implementing machine learning algorithms that can predict patient outcomes and improve clinical decision-making. You will also be responsible for designing and implementing new data collection methods to improve the accuracy and quality of the data. To be successful in this role, you should have a strong background in machine learning, data analysis, and statistics. You should also have experience working with large and complex data sets, as well as the ability to develop and implement machine learning models in Python, R, or other programming languages. Additionally, experience with medical data and electronic health records is highly desirable. Duties include: Collect, manage and clean datasets. Employ new and existing tools to interpret, analyze, and visualize multivariate relationships in data. Create databases and reports, develop algorithms and statistical models, and perform statistical analyses appropriate to data and reporting requirements. Use system reports and analyses to identify potentially problematic data, make corrections, and determine root cause for data problems from input errors or inadequate field edits, and suggest possible solutions. Develop reports, charts, graphs and tables for use by investigators and for publication and presentation. Analyze data processes in documentation. Collaborate with faculty and research staff on data collection and analysis methods. Provide documentation based on audit and reporting criteria to investigators and research staff. Communicate with government officials, grant agencies and industry representatives. - Other duties may also be assigned. DESIRED QUALIFICATIONS: Strong foundation in computer science and mathematics, including data structures, algorithms, linear algebra, calculus, and probability theory. Expertise in data processing and ETL (Extract, Transform, Load) pipelines, including data integration, data quality, data normalization, and data transformation. Proficiency in programming languages such as Python. Strong knowledge of machine learning algorithms and models, including deep learning, natural language processing, computer vision, and recommendation systems. Familiarity with data visualization and reporting tools such as matplotlib. Excellent communication and collaboration skills to work effectively with cross-functional teams, including physicians, and software engineers. EDUCATION & EXPERIENCE (REQUIRED): Bachelor's degree or a combination of education and relevant experience. Experience in a quantitative discipline such as economics, finance, statistics or engineering. KNOWLEDGE, SKILLS AND ABILITIES (REQUIRED): Substantial experience with MS Office and analytical programs. Strong writing and analytical skills. Ability to prioritize workload. PHYSICAL REQUIREMENTS*: Sitting in place at computer for long periods of time with extensive keyboarding/dexterity. Occasionally use a telephone. Rarely writing by hand. - Consistent with its obligations under the law, the University will provide reasonable accommodation to any employee with a disability who requires accommodation to perform the essential functions of his or her job. WORKING CONDITIONS: Some work may be performed in a laboratory or field setting. WORK STANDARDS: Interpersonal Skills: Demonstrates the ability to work well with Stanford colleagues and clients and with external organizations. Promote Culture of Safety: Demonstrates commitment to personal responsibility and value for safety; communicates safety concerns; uses and promotes safe behaviors based on training and lessons learned. Subject to and expected to comply with all applicable University policies and procedures, including but not limited to the personnel policies and other policies found in the University's Administrative Guide, http://adminguide.stanford.edu. The expected pay range for this position is $ 64,480 to $ 93,000 per annum. Stanford University provides pay ranges representing its good faith estimate of what the university reasonably expects to pay for a position. The pay offered to a selected candidate will be determined based on factors such as (but not limited to) the scope and responsibilities of the position, the qualifications of the selected candidate, departmental budget availability, internal equity, geographic location and external market pay for comparable jobs. As an organization that receives federal funding, Stanford University has a COVID-19 vaccination requirement that will apply to all university employees, including those working remotely in the United States and applicable subcontractors. To learn more about COVID policies and guidelines for Stanford University Staff, please visit https://cardinalatwork.stanford.edu/working-stanford/covid-19/interim-policies/covid-19-surveillance-testing-policy .",https://www.indeed.com/jobs?q=Machine+Learning+Engineer&l=San+Francisco%5D+%23%2C+CA&sc=0kf%3Aattr%28FCGTU%7CHFDVW%7CQJZM9%7CUTPWG%252COR%29explvl%28ENTRY_LEVEL%29jt%28fulltime%29%3B&start=10&pp=gQAPAAAAAAAAAAAAAAAB_f7eaAANAQAAkibmHNDgUJtLYgAA&vjk=cdf24862798485c8
19,85a90e7a9bc5c774,Machine Learning Engineer,"San Francisco, CA",ENTRY_LEVEL,BACHELORS_DEGREE,fulltime,"Mechanical Design Engineer - Prototyping - job post Zoox (part of Amazon.com) 9 reviews Foster City, CA $128,000 - $210,000 a year -  Full-time Zoox 9 reviews Read what people are saying about working here. You must create an Indeed account before continuing to the company website to apply Apply on company site save-icon Job details Salary $128,000 - $210,000 a year Job Type Full-time The Zoox Prototyping Team is responsible for unblocking the intricacies of Autonomous Mobility. Our team serves as a technical hub to resolve any challenging engineering and design problems. Together with the Prototyping Engineering team, you will accelerate the progress of hardware and software development through your innovative ideas, applied to newly discovered and interesting topics. You will develop a wide range of skills in fast prototyping scenarios, as you unlock the future of transportation. If you enjoy cross-functional and meaningful work, then come join this passionate team where conceptual ideas are materialized into the physical world. As a team, we will make cities safer, smarter, and more sustainable. Responsibilities Design, in CATIA V6, prototype hardware, and electromechanical systems Generate 3D models and 2D drawing packages for fabrication and assembly Evaluate the dynamic, static, structural, and thermal-mechanical performances of mechanical assemblies Collaborate with experts in Industrial Design, Vehicle Engineering, Electronic Components, Mechatronics, and Robotics from all teams throughout Zoox Qualifications Experience with 2D drawing packages, including GD&T Design with CAD tools, such as CATIA V6, within 3DX PLM Bachelor’s Degree, or equivalent experience, in Mechanical or Mechatronics Engineering At least 7 years of relevant industry experience Bonus Qualifications Integrating electromechanical systems Designing consumer products or industrial equipment FEM Simulation Cinematic and Dynamic Simulation Software: SOLIDWORKS, SimWise4D, or similar; MATLAB, Simulink Prototyping experience Automotive environment Compensation There are three major components to compensation for this position: salary, Amazon Restricted Stock Units (RSUs), and Zoox Stock Appreciation Rights. The salary range for this position is $128,000 to $210,000. A sign-on bonus may be offered as part of the compensation package. Compensation will vary based on geographic location and level. Leveling, as well as positioning within a level, is determined by a range of factors, including, but not limited to, a candidate's relevant years of experience, domain knowledge, and interview performance. The salary range listed in this posting is representative of the range of levels Zoox is considering for this position. Zoox also offers a comprehensive package of benefits including paid time off (e.g. sick leave, vacation, bereavement), unpaid time off, Zoox Stock Appreciation Rights, Amazon RSUs, health insurance, long-term care insurance, long-term and short-term disability insurance, and life insurance. Vaccine Mandate Employees working in this position will be required to have received a single dose of the J&J/Janssen COVID-19 vaccine OR have completed the two-dose Pfizer or Moderna vaccine series. In addition, employees will be required to receive a COVID-19 booster vaccine within two months of becoming eligible for the booster vaccine. Employees will be required to show proof of vaccination status upon receipt of a conditional offer of employment. That offer of employment will be conditioned upon, among other things, an Applicant’s ability to show proof of vaccination status. Please note the Company provides reasonable accommodations in accordance with applicable state, federal, and local laws. About Zoox Zoox is developing the first ground-up, fully autonomous vehicle fleet and the supporting ecosystem required to bring this technology to market. Sitting at the intersection of robotics, machine learning, and design, Zoox aims to provide the next generation of mobility-as-a-service in urban environments. We’re looking for top talent that shares our passion and wants to be part of a fast-moving and highly execution-oriented team. Follow us on LinkedIn A Final Note: You do not need to match every listed expectation to apply for this position. Here at Zoox, we know that diverse perspectives foster the innovation we need to be successful, and we are committed to building a team that encompasses a variety of backgrounds, experiences, and skills.",https://www.indeed.com/jobs?q=Machine+Learning+Engineer&l=San+Francisco%5D+%23%2C+CA&sc=0kf%3Aattr%28FCGTU%7CHFDVW%7CQJZM9%7CUTPWG%252COR%29explvl%28ENTRY_LEVEL%29jt%28fulltime%29%3B&start=10&pp=gQAPAAAAAAAAAAAAAAAB_f7eaAANAQAAkibmHNDgUJtLYgAA&vjk=85a90e7a9bc5c774
20,5775e477b969e945,Machine Learning Engineer,"San Francisco, CA",ENTRY_LEVEL,BACHELORS_DEGREE,fulltime,"Full-stack Software Engineer - job post Juji San Jose, CA 95117 Full-time You must create an Indeed account before continuing to the company website to apply Apply on company site save-icon Job details Job Type Full-time We are seeking highly motivated and talented full-stack engineers at both senior and junior level, who are eager to help us build out the Juji platform to meet customer demands and tackle great technical challenges in a wide variety of areas, ranging from data management, natural language processing to information visualization. Qualifications Our ideal candidates are open-minded, multi-talented individuals who are willing and able to tackle full-stack technical challenges from databases to CSS. They are also eager and fast learners of new software and technologies. Required Expertise and Experience Expert-level programming experience with one or more programming languages (e.g., Java, JavaScript, C/C++, Python, or equivalent) Good experience in building and deploying web-based systems Familiar with software development lifecycle and corresponding tools Experience in functional programming (e.g., Clojure, Scheme, Scala, Haskell, or equivalent) Preferred Expertise and Experience Experience in building large-scale, web-based SaaS production systems Familiar with Clojure/Clojurescript and the related ecosystem Comfortable with *nix command line, scripting and system automation tools Good understanding of database systems (e.g., SQL and Datalog) Knowledge in one or more relevant fields: Artificial Intelligence, Machine Learning, Natural Language Processing/Generation, Distributed Computing, and Visualization Required Education A bachelor or higher degree in the area of Computer Science, Computer Engineering or equivalent disciplines. Employee Type Full Time How to Apply Email a copy of your resume to jobs AT (using the symbol @ to connect) juji-inc.com with a subject line ""Full Stack Software Engineer"".",https://www.indeed.com/jobs?q=Machine+Learning+Engineer&l=San+Francisco%5D+%23%2C+CA&sc=0kf%3Aattr%28FCGTU%7CHFDVW%7CQJZM9%7CUTPWG%252COR%29explvl%28ENTRY_LEVEL%29jt%28fulltime%29%3B&start=10&pp=gQAPAAAAAAAAAAAAAAAB_f7eaAANAQAAkibmHNDgUJtLYgAA&vjk=5775e477b969e945
21,fb72a1152723aff2,Machine Learning Engineer,"San Francisco, CA",ENTRY_LEVEL,BACHELORS_DEGREE,fulltime,"Restraints Engineer - job post Zoox (part of Amazon.com) 9 reviews Foster City, CA $155,000 - $255,000 a year -  Full-time Zoox 9 reviews Read what people are saying about working here. You must create an Indeed account before continuing to the company website to apply Apply on company site save-icon Job details Salary $155,000 - $255,000 a year Job Type Full-time Imagine a vehicle that can drive in either direction, that is fully symmetrical, and where the passengers sit in a carriage arrangement. The front-row occupant is rearward facing. Now, imagine the restraint system can protect all four passengers at NCAP 5 start performance levels. In this role, you will be responsible for the design, release, and launch of a new generation of passive restraint systems for Zoox's autonomous vehicles. You will support the development and help integrate restraint performance to deliver this complete system, rather than just components. Zoox is setting the bar for autonomous vehicle safety. Come join the team! Responsibilities You will redefine the occupant restraint systems for future mobility. You will work cross-functionally with engineering teams across Zoox to align on packaging, design, styling studio surfaces, and manufacturing processes to deliver the optimal balance of form vs. function vs. cost. You will lead world-class suppliers to develop one of the most advanced, comprehensive occupant restraint systems ever conceived. You will work cross-functionally within the Zoox Vehicle Engineering, Manufacturing Engineering, and Procurement teams to ensure the restraint systems manufacturing and assembly feasibility and serviceability. You will complete technical documentation, including documentation of DFMEAs and DVP&Rs. Qualifications BS in mechanical engineering or equivalent 5+ years of experience in automotive restraint systems component and subsystem engineering (OEM or Tier I level) Design of components and assemblies in CATIA V6 or the equivalent in experience Working knowledge of Design for Manufacturing, including familiarity with GD&T and dimensional engineering Experience with restraint modules or restraint subsystems testing and data analysis Experience with technical documentation to include DVP&R and DFMEA. Experience with technical documentation in at least 1 full lifecycle vehicle program, including the documentation of DVP&Rs and DFMEAs. Compensation There are three major components to compensation for this position: salary, Amazon Restricted Stock Units (RSUs), and Zoox Stock Appreciation Rights. The salary range for this position is $155,000 to $255,000. A sign-on bonus may be offered as part of the compensation package. Compensation will vary based on geographic location and level. Leveling, as well as positioning within a level, is determined by a range of factors, including, but not limited to, a candidate's relevant years of experience, domain knowledge, and interview performance. The salary range listed in this posting is representative of the range of levels Zoox is considering for this position. Zoox also offers a comprehensive package of benefits including paid time off (e.g. sick leave, vacation, bereavement), unpaid time off, Zoox Stock Appreciation Rights, Amazon RSUs, health insurance, long-term care insurance, long-term and short-term disability insurance, and life insurance. Vaccine Mandate Employees working in this position will be required to have received a single dose of the J&J/Janssen COVID-19 vaccine OR have completed the two-dose Pfizer or Moderna vaccine series. In addition, employees will be required to receive a COVID-19 booster vaccine within two months of becoming eligible for the booster vaccine. Employees will be required to show proof of vaccination status upon receipt of a conditional offer of employment. That offer of employment will be conditioned upon, among other things, an Applicant’s ability to show proof of vaccination status. Please note the Company provides reasonable accommodations in accordance with applicable state, federal, and local laws. About Zoox Zoox is developing the first ground-up, fully autonomous vehicle fleet and the supporting ecosystem required to bring this technology to market. Sitting at the intersection of robotics, machine learning, and design, Zoox aims to provide the next generation of mobility-as-a-service in urban environments. We’re looking for top talent that shares our passion and wants to be part of a fast-moving and highly execution-oriented team. Follow us on LinkedIn A Final Note: You do not need to match every listed expectation to apply for this position. Here at Zoox, we know that diverse perspectives foster the innovation we need to be successful, and we are committed to building a team that encompasses a variety of backgrounds, experiences, and skills.",https://www.indeed.com/jobs?q=Machine+Learning+Engineer&l=San+Francisco%5D+%23%2C+CA&sc=0kf%3Aattr%28FCGTU%7CHFDVW%7CQJZM9%7CUTPWG%252COR%29explvl%28ENTRY_LEVEL%29jt%28fulltime%29%3B&start=10&pp=gQAPAAAAAAAAAAAAAAAB_f7eaAANAQAAkibmHNDgUJtLYgAA&vjk=fb72a1152723aff2
