,job_id,job_title,location,experience,education,job_type,job_description,job_link
0,66326b94a7d818da,Machine Learning Engineer,"San Francisco, CA",ENTRY_LEVEL,BACHELORS_DEGREE,fulltime,"Senior Software Engineer, Families - job post Cash App 3 reviews Los Angeles, CA Full-time Cash App 3 reviews Read what people are saying about working here. You must create an Indeed account before continuing to the company website to apply Apply on company site save-icon Job details Encouraged to Apply Fair chance Job Type Full-time Company Description It all started with an idea at Block in 2013. Initially built to take the pain out of peer-to-peer payments, Cash App has gone from a simple product with a single purpose to a dynamic ecosystem, developing unique financial products, including Afterpay, to provide a better way to send, spend, invest, borrow and save to our 47 million monthly active customers. We want to redefine the world’s relationship with money to make it more relatable, instantly available, and universally accessible. This is our mission, and it’s why working at Cash App means so much more than a job. Today, Cash App has thousands of employees working globally across office and remote locations, with a culture geared toward innovation, collaboration and impact. We’ve been a distributed team since day one, and many of our roles can be done remotely from the countries where Cash App operates. No matter the location, we tailor our experience to ensure our employees are creative, productive, and happy. Check out our locations, benefits, and more at cash.app/careers! Job Description As a senior software engineer on the Cash App Families engineering team, you will lead the technical design, execution, and delivery of new experiences that empower families to manage their personal financial life in ways that are universally accessible, magically relevant, and impossibly simple. Our current focus is to build unique experiences tailored to teenagers and their respective parents/guardians. In addition, you'll drive architectural decisions and infrastructure improvements to make our systems more robust and scalable. The products that you build will create significant impact at scale and will fundamentally change how families manage their money. As a member of the team, you’ll: Partner closely with product managers, designers, engineers, and business leads to scope, plan, design, and build new features as well as maintain existing functionality of families features Lead and participate in critical technical, design, and product discussions with leaders across the organization and company Design systems to work within our microservice and event-driven architectures Hold your teammates—and yourself—to high engineering standards Leverage your experience and knowledge to grow your teammates’ technical breadth and depth through direct coaching and mentoring Qualifications Drive to find flaws in a system with many moving parts and take whatever steps are necessary to fix them The ability to design and build creative solutions to complex problems A strong desire to perform and grow as an engineer Bachelor’s Degree or Diploma in Computer Science, Computer Engineering, Software Engineering, or equivalent experience Technologies we use and teach (you don’t need to have experience using these): Java, Kotlin AWS HTTP, JSON, gRPC, Protocol Buffers OkHttp, Jetty, JUnit, Guice Hibernate, MySQL, DynamoDB Kafka, events, microservices DataDog, Prometheus, SignalFx Additional Information Block takes a market-based approach to pay, and pay may vary depending on your location. U.S. locations are categorized into one of four zones based on a cost of labor index for that geographic area. The successful candidate’s starting pay will be determined based on job-related skills, experience, qualifications, work location, and market conditions. These ranges may be modified in the future. Zone A: USD $167,300 - USD $204,500 Zone B: USD $158,900 - USD $194,300 Zone C: USD $150,600 - USD $184,000 Zone D: USD $142,200 - USD $173,800 To find a location’s zone designation, please refer to this resource. If a location of interest is not listed, please speak with a recruiter for additional information. Benefits include the following: Healthcare coverage Retirement Plans including company match Employee Stock Purchase Program Wellness programs, including access to mental health, 1:1 financial planners, and a monthly wellness allowance Paid parental and caregiving leave Paid time off Learning and Development resources Paid Life insurance, AD&D. and disability benefits Perks such as WFH reimbursements and free access to caregiving, legal, and discounted resources This role is also eligible to participate in Block's equity plan subject to the terms of the applicable plans and policies, and may be eligible for a sign-on bonus. Sales roles may be eligible to participate in a commission plan subject to the terms of the applicable plans and policies. Pay and benefits are subject to change at any time, consistent with the terms of any applicable compensation or benefit plans. We’re working to build a more inclusive economy where our customers have equal access to opportunity, and we strive to live by these same values in building our workplace. Block is a proud equal opportunity employer. We work hard to evaluate all employees and job applicants consistently, without regard to race, color, religion, gender, national origin, age, disability, pregnancy, gender expression or identity, sexual orientation, citizenship, or any other legally protected class. We believe in being fair, and are committed to an inclusive interview experience, including providing reasonable accommodations to disabled applicants throughout the recruitment process. We encourage applicants to share any needed accommodations with their recruiter, who will treat these requests as confidentially as possible. Learn more about our efforts to promote inclusion and diversity at block.xyz/inclusion Additionally, we consider qualified applicants with criminal histories for employment on our team, assessing candidates in a manner consistent with the requirements of the San Francisco Fair Chance Ordinance. Block, Inc. (NYSE: SQ) is a global technology company with a focus on financial services. Made up of Square, Cash App, Spiral, TIDAL, and TBD, we build tools to help more people access the economy. Square helps sellers run and grow their businesses with its integrated ecosystem of commerce solutions, business software, and banking services. With Cash App, anyone can easily send, spend, or invest their money in stocks or Bitcoin. Spiral (formerly Square Crypto) builds and funds free, open-source Bitcoin projects. Artists use TIDAL to help them succeed as entrepreneurs and connect more deeply with fans. TBD is building an open developer platform to make it easier to access Bitcoin and other blockchain technologies without having to go through an institution.",https://www.indeed.com/jobs?q=Software+Engineer&l=Los+Angeles%2C+CA&sc=0kf%3Aattr%28FCGTU%7CHFDVW%7CQJZM9%7CUTPWG%252COR%29explvl%28SENIOR_LEVEL%29jt%28fulltime%29%3B&vjk=66326b94a7d818da
1,41626d4fd325662d,Machine Learning Engineer,"San Francisco, CA",ENTRY_LEVEL,BACHELORS_DEGREE,fulltime,"Advanced Software Engineer - job post Benefitfocus 212 reviews Los Angeles, CA 90001 • Remote Full-time Benefitfocus 212 reviews Read what people are saying about working here. You must create an Indeed account before continuing to the company website to apply Apply on company site save-icon Job details Job Type Full-time Advanced Java Software Engineer – 100% Remote Benefitfocus Inc. Benefitfocus, Inc. (NASDAQ: BNFT) is a leading provider of cloud-based benefits software solutions for consumers, employers, insurance carriers and brokers. Benefitfocus has served numerous consumers on its platform that consists of an integrated portfolio of products and services enabling clients to more efficiently shop, enroll, manage and exchange benefits information. With a user-friendly interface and consumer-centric design, the Benefitfocus Platform provides one place for consumers to access all their benefits. Benefitfocus solutions support the administration of all types of benefits including core medical, dental and other voluntary benefits plans as well as wellness programs. We are seeking an Advanced Full-Stack Software Engineer that is passionate about planning, designing and developing software system. The ideal candidate would be an advanced professional with broad experience in both creatively and effectively working on complex issues while also being able to lead and mentor others on the team. Key Responsibilities: Designs complete and complex frameworks, systems or products. Conceives system interfaces and business application prototypes. Identifies, analyzes and resolves system design weaknesses. Influences the shaping of future products by contributing to the framework (architecture) used across multiple products or systems. Contributes to the definition and refinement of development processes for application components. Evaluates performance of critical application components and optimizes them to assure maximum performance. Mentors other engineers in application architecture issues. Participates in the performance review of team members and in the interview process for new candidates Other Duties as assigned. Technical competencies span across multiple frameworks and/or products. Demonstrates technical leadership of large teams. Broad knowledge of key architecture elements; able to creatively define new features that meet all customer needs, that perform well and that are stable in multiple delivery environments. Creative thinker with the ability to balance customer requirements, competitive pressures, and technical resource limitations across product families. Recognized as a role model for senior team members in all aspects of software development (technical skills and knowledge, work ethic, interactions with other, etc.). Other duties as assigned Skills and Competencies: Required Bachelor's degree or comparable work experience in software development. 7+ years of experience in software development recommended in addition to education requirements. Java (Java 8 +) Javascript (React JS, Node JS, single page app experience a plus) RESTful API services (required) SQL, PL/SQL Preferred Git/Bitbucket Jira Maven/Gradle Intellij IDE Spring Boot OpenAPI Specification (Formerly known as Swagger Specification) Test automation - (Junit/Mockito/PowerMock/Robot/Karate frameworks a plus) Agile Development SDLC Mymap Title Software Engineer III",https://www.indeed.com/jobs?q=Software+Engineer&l=Los+Angeles%2C+CA&sc=0kf%3Aattr%28FCGTU%7CHFDVW%7CQJZM9%7CUTPWG%252COR%29explvl%28SENIOR_LEVEL%29jt%28fulltime%29%3B&vjk=41626d4fd325662d
2,b50a8c22091698c7,Machine Learning Engineer,"San Francisco, CA",ENTRY_LEVEL,BACHELORS_DEGREE,fulltime,"Senior Python Software Engineer (Onsite) - job post Raytheon Intelligence & Space (part of Raytheon) 237 reviews El Segundo, CA 90245 Full-time Raytheon Intelligence & Space 237 reviews Read what people are saying about working here. You must create an Indeed account before continuing to the company website to apply Apply on company site save-icon Job details Job Type Full-time Date Posted: 2023-03-21 Country: United States of America Location: CA320: El Seg.-So. Campus Bldg E01 2000 East El Segundo Boulevard Building E01, El Segundo, CA, 90245 USA Position Role Type: Unspecified Raytheon Intelligence and Space (RIS) is seeking a Senior Python Software Engineer in El Segundo, CA . You will gain experience with the full software lifecycle and advance software concepts. Our developers work with various technologies including machine learning, cloud services, and microservice architectures. Our program also follows modern Agile/DevOps development practices. Location: El Segundo, CA Security Clearance: An Active and In-Scope Top Secret/Sensitive Compartmented Information (TS/SCI) U.S. Security Clearance This position is eligible for a sign on bonus of up to $12K for a person with an active /in-scope TS/SCI clearance that can be verified and hired here at Raytheon Intelligence Space Required Skills Experience with object-oriented software development using Python Experience working in an Agile, Cloud environment. Experience with unit testing Active and transferable U.S. government issued TS/SCI or upgradeable TS security clearance prior to start. Desired Skills Experience programming in C++ and MATLAB Experience using Jira and Confluence Experience with Jenkins, Ansible, and Kubernetes Experience integrating microservices Experience with Behave, Machine Learning, and Deep Neural Networks Experience with Apache Spark Experience and Education Requirements: Typically requires a Bachelor's degree and minimum 5 years' relevant or equivalent experience unless prohibited by local laws/regulations Employee Referral Award Eligibility: Only employees currently within RMD and RIS have the potential to receive a Referral Award for submitting a referral to RMD and RIS roles. ALL eligibility requirements must be met to receive the Referral Awarding. The salary range for this role is 82,000 USD - 176,000 USD; however, Raytheon Technologies considers several factors when extending an offer, including but not limited to, the role and associated responsibilities, a candidate’s work experience, location, education/training, and key skills. Hired applicants may be eligible for benefits, including but not limited to, medical, dental, vision, life insurance, short-term disability, long-term disability, 401(k) match, flexible spending accounts, flexible work schedules, employee assistance program, Employee Scholar Program, parental leave, paid time off, and holidays. Specific benefits are dependent upon the specific business unit as well as whether or not the position is covered by a collective-bargaining agreement. Hired applicants may be eligible for annual short-term and/or long-term incentive compensation programs depending on the level of the position and whether or not it is covered by a collective-bargaining agreement. Payments under these annual programs are not guaranteed and are dependent upon a variety of factors including, but not limited to, individual performance, business unit performance, and/or the company’s performance. Raytheon Technologies is An Equal Opportunity/Affirmative Action Employer. All qualified applicants will receive consideration for employment without regard to race, color, religion, sex, sexual orientation, gender identity, national origin, disability or veteran status, age or any other federally protected class. Privacy Policy and Terms: Click on this link to read the Policy and Terms",https://www.indeed.com/jobs?q=Software+Engineer&l=Los+Angeles%2C+CA&sc=0kf%3Aattr%28FCGTU%7CHFDVW%7CQJZM9%7CUTPWG%252COR%29explvl%28SENIOR_LEVEL%29jt%28fulltime%29%3B&vjk=b50a8c22091698c7&advn=6781381351210116
3,e828ebf9ce9edd9b,Machine Learning Engineer,"San Francisco, CA",ENTRY_LEVEL,BACHELORS_DEGREE,fulltime,"Senior Software Engineer - job post Edmunds.com 49 reviews Santa Monica, CA 90404 $137,000 - $205,000 a year -  Full-time Edmunds.com 49 reviews Read what people are saying about working here. You must create an Indeed account before continuing to the company website to apply Apply on company site save-icon Job details Salary $137,000 - $205,000 a year Encouraged to Apply Fair chance Job Type Full-time Edmunds offers flexibility to work fully remote, from our Edquarters, or a combination of both At Edmunds we’re driven to make car buying easier. Ever since we began publishing printed car guides in the 60’s, the company has been in the business of trust, innovating ways to empower and support car shoppers. When Edmunds launched the car industry’s first Internet site in 1994, we established a leadership position online and have never looked back. Now, as one of the most trusted review sites on the Internet, millions of visitors use our research, shopping and buying tools every month to make an easy and informed decision on their next car. For consumers, we bring peace of mind. For dealers, we make tools to help them solve their problems and sell more cars. How do we do it, you ask? The key ingredients are our enthusiastic employees, progressive company culture and cutting-edge technology. Want to join the team? Read on to find out how! What You’re Applying For: Buying a car is a daunting process. At Edmunds, we are constantly looking to improve and create tools to make this process easier. The Edmunds Carcode team is part of our Dealer Product Innovation portfolio working on multi-channel messaging and conversational commerce solutions to take the stress out of Car Buying. We are looking for a Software Engineer to help build, support and improve our evolving platform. You will work on a cross-functional team using our modern technology stacks. Experience working with multiple parts of the stack is desired. We value curiosity about how systems work and support a hunger to keep learning. What You’ll Do : Work with our team of Engineers, Product Managers and Visual Designers to build effective and engaging conversational interfaces. Develop tools and SDKs to administer and configure message-based automotive transactions. Identify and lead efforts to improve our existing systems. Help ensure that our platform provides a robust user experience, by continuously improving on client-side performance metrics. Practice sustainable incident response and blameless postmortems. Practice collective code ownership and mutually beneficial code reviews What You Need : Experience writing, documenting, and delivering maintainable client-side JavaScript software based on business and technical requirements. Proficiency with web markup including HTML5, CSS3, and server-side preprocessing such as SASS. Proficiency with ES6 JavaScript and modern React (or a similar framework) development. Experience working with REST and RPC services (internal and third party), Websockets and handling asynchronous communications is highly desired. Knowledge of modern web development best practices and ability to write performant cross-browser compatible code. Familiarity with CI/CD, Application monitoring and Logging systems is desirable. Nice to have: experience writing client-side AB test experiments. Nice to have: familiarity with Google Analytics. Nice to have: Working knowledge of Angular framework. The compensation range for this position is $137,000-$205,000 per year. The base pay will take into account internal equity as well as job-related knowledge, skills, and experience among other factors. In addition, Edmunds offers full-time employees a comprehensive total rewards package including the benefits listed below. Edmunds Perks: Flexible time off 13 Paid Holidays Comprehensive Health Benefits (medical, dental, vision, life and disability) Flexible Spending Accounts (Employees) and Health Savings Accounts (Employee and Employer Contributions) 401K Plan with company matching at 100%, up to 6% of eligible salary with immediate vesting Stock purchase program CarMax vehicle discount Up to 4 months Paid Parental Leave HeartCash matches employee donations to the causes that are important to them 2 Days of Paid Time Off for time to dedicate to social impact causes FitCash covers a portion of gym or fitness activity fees Well being sessions and events such as yoga, meditation and walking challenges On-going career development sessions and an annual learning event Pet insurance Sabbatical leave Education Reimbursement Pre-tax spending accounts for qualified transportation expenses Plus a coffee bar, frozen yogurt and more! Working @ Edmunds.com: Employees think it’s a pretty great place to work and some pretty impressive publications think it is too: we have been recognized as one of the best places to work by the Fortune Magazine and Great Places to Work, LA Business Journal (for the last 6 years!), Computerworld, Built in LA and Inc. Magazine. We've also been identified as one of the best workplaces specifically in Technology and also for Diversity and Asian Americans. If you’re interested in learning more and joining our mission, we’d love to hear from you! E dmunds will consider for employment qualified candidates with criminal histories in a manner consistent with the requirements of all applicable laws. #BI-Remote Flexible work from home options available.",https://www.indeed.com/jobs?q=Software+Engineer&l=Los+Angeles%2C+CA&sc=0kf%3Aattr%28FCGTU%7CHFDVW%7CQJZM9%7CUTPWG%252COR%29explvl%28SENIOR_LEVEL%29jt%28fulltime%29%3B&vjk=e828ebf9ce9edd9b
4,7762de9e93cc982e,Machine Learning Engineer,"San Francisco, CA",ENTRY_LEVEL,BACHELORS_DEGREE,fulltime,"Senior Software Engineer, Payments - job post Xometry Inc 31 reviews Los Angeles, CA Full-time Xometry Inc 31 reviews Read what people are saying about working here. You must create an Indeed account before continuing to the company website to apply Apply on company site save-icon Job details Job Type Full-time Xometry (NASDAQ: XMTR) powers the industries of today and tomorrow by connecting the people with big ideas to the manufacturers who can bring them to life. Xometry’s digital marketplace gives manufacturers the critical resources they need to grow their business while also making it easy for buyers at Fortune 1000 companies to tap into global manufacturing capacity. We are looking for a Senior-level Software Engineer to join our growing software engineering organization. The right person will help move our platform to the next level. You’ll be working as part of a skilled, collaborative team to jointly design and implement high visibility applications. This is an IDEAL position if you are an experienced software engineer who also has previous leadership experience. You want to be part of a small, intensely skilled team, who feel total ownership of their work, and can’t imagine a day without learning & coding. You will play a crucial role in the Xometry platform and everything you do will matter. Your role will involve: Active participation on a software development team designing, coding, testing, and releasing functionality to our customers Close collaboration with other engineers and product managers to become a valued member of an autonomous, cross-functional team Operational responsibility for the services that are owned by your team, potentially including taking part in an on-call rotation Work in an environment that supports your individual growth In return you will bring: 6+ years of experience in a fast-paced marketplace, SaaS, or product-led tech environment Experience working on FinServ/Payments products is a plus Strong object-oriented programming skills with TypeScript/JavaScript Exposure to architectural patterns of large, high-scale web applications, such as well-designed APIs, and high volume data pipelines, and efficient algorithms. Advanced knowledge of web technologies and protocols Experience with Authentication protocols like OAuth 2.0, OpenID Connect and SAML is a plus Experience with AWS, Kubernetes, Snowflake, Postgres, MongoDB, React.js, Node.js, GraphQL, and ETL Experience with continuous build and integration using one or more of the following Git, GitLab, Jenkins, or similar Advanced knowledge of enterprise concepts such as security, scalability, transaction management, and multi-threading Demonstrated knowledge of principles of service-oriented architectures and ability to lead efforts in defining and implementing a service strategy Experience with relational and/or NoSQL databases with understanding of Normalization/Denormalization, Constraints, Logical/Physical Design, Transaction Management, JDBC, Hibernate Experience with agile methodologies and short release cycles Strong attention to detail, good work ethic, ability to work on multiple projects simultaneously, and good communication skills BS, MS or PhD in Computer Science, Math, Physics, or related field Must be a US citizen, green card holder, or a legal permanent resident of the United States What's in it for you? Competitive salary Stock options Medical, dental and vision insurance Flexible time off + 13 Holidays 401(k) with match Life insurance Paid volunteer time Commuter and parking benefits Maternity & Paternity leave Dog friendly office spaces Free coffee And more! If this job isn’t for you but you have a friend who may be a perfect fit - share this job with them! Xometry is an equal opportunity employer. All applicants will be considered for employment without attention to race, color, religion, sex, sexual orientation, gender identity, national origin, veteran or disability status. Xometry participates in E-Verify and after a job offer is accepted, will provide the federal government with your Form I-9 information to confirm that you are authorized to work in the U.S.",https://www.indeed.com/jobs?q=Software+Engineer&l=Los+Angeles%2C+CA&sc=0kf%3Aattr%28FCGTU%7CHFDVW%7CQJZM9%7CUTPWG%252COR%29explvl%28SENIOR_LEVEL%29jt%28fulltime%29%3B&vjk=7762de9e93cc982e
