,job_id,job_title,location,experience,education,job_type,job_description,job_link
17,17ed50409f71cfa5,Machine Learning Engineer,"San Francisco, CA",ENTRY_LEVEL,BACHELORS_DEGREE,fulltime,"Machine Learning Platform Lead - job post Liftoff San Francisco, CA • Remote Full-time Apply now Apply now save-icon Job details Job Type Full-time Liftoff is the leading growth acceleration platform for the mobile industry, helping advertisers, publishers, game developers and DSPs scale revenue growth with solutions to market and monetize mobile apps. Liftoff's solutions, including Accelerate, Direct, Influence, Monetize, Intelligence, and Vungle Exchange, support over 6,600 mobile businesses across 74 countries in sectors such as gaming, social, finance, ecommerce, and entertainment. Founded in 2012 and headquartered in Redwood City, CA, Liftoff has a diverse, global presence. With our success over the past 10 years, we are ready to move beyond our current technologies and build the next generation ML Platform to align with our current business needs as we continue to grow. Currently using a custom setup, we handle 1.5 billion ML inferences per second, every day. We are now building a new ML platform to support neural networking in order to increase the intelligence of our models. We are looking for a strong, hands-on tech leader who is able to guide a team through building and utilizing this new ML platform. As a Machine Learning Platform Lead: Lead an experienced team of ML, Software, and Infrastructure Engineers that will build the next generation ML platform for Liftoff Utilize the new ML Platform to deliver business results via next generation ML models Drive ML cost optimization for training and serving ML models Utilize vendor-based products (AWS SageMaker, Databricks, etc.), open-source technologies (PyTorch, xgboost, etc.) and in-house tooling Work with modeling techniques at the state-of-the-art of probability prediction, as well as a multitude of other ML areas (NLP, Computer Vision) Desired qualities and experience: 10+ years of industry experience in machine learning, software engineering and/or infrastructure engineering 5+ years of industry experience applying Machine Learning to large scale problems 3+ years experience leading an engineering team Hands-on experience building Machine Learning tooling and/or platforms Very strong coding ability (any backend language) B.S. or higher in Computer Science (PhD is a plus) Location: This role eligible for full-time remote work in one of our entities: CA, CO, ID, IL, FL, GA, MA, MN, MO, NJ, NV, NC, OR, RI, TX, UT, and WA. We are a remote-first company with US hubs in Redwood City, Los Angeles, and NYC. Compensation: Liftoff offers all employees a full compensation package that includes equity and health/vision/dental benefits associated with your country of residence. Base compensation will vary based on candidate location and experience. The following are our base salary ranges for this role: SF Bay Area, NYC, Los Angeles/Orange County: $177,000 - $280,700 Seattle/Olympia, Austin, San Diego, Santa Barbara, Boston: $159,300 - $252,630 All other cities and towns in our approved states: $150,450 - $238,595 Working at Liftoff is fast-paced, fun, and challenging, and we thrive on innovation. Come join the rocket ship and help shape the future of the mobile app ecosystem with us! #LI-LM1 #LI-Remote Liftoff is committed to providing and maintaining a work environment where all employees and candidates are treated with dignity and respect and that is free of bias, prejudice, and harassment. Liftoff is further committed to providing an equal employment opportunity for all employees and candidates for employment free from discrimination and harassment on the basis of sex, gender (including sexual harassment, gender harassment, and harassment due to pregnancy, childbirth, breastfeeding, and related conditions), sexual orientation, gender identity, gender expression, gender nonconformity, race, creed, religion, color, national origin, ancestry (including association, affiliation, or participation with persons or activities related to national origin, English-proficiency or accent, or immigration status), physical or mental disability, medical condition(s), genetic information of an individual or family member of the individual, marital or domestic partner status, age, veteran or military status, family care status, requesting or taking pregnancy, parental or disability leave, requesting an accommodation, or any other characteristic protected by federal, state, or local law, regulation, or ordinance. All such discrimination and harassment is unlawful and will not be tolerated. Liftoff maintains a continued commitment to equal employment opportunity and expects the full cooperation of all personnel. Agency and Third Party Recruiter Notice: Liftoff does not accept unsolicited resumes from individual recruiters or third-party recruiting agencies in response to job postings. No fee will be paid to third parties who submit unsolicited candidates directly to our hiring managers or Recruiting Team. All candidates must be submitted via our Applicant Tracking System by approved Liftoff vendors who have been expressly requested to make a submission by our Recruiting Team for a specific job opening. No placement fees will be paid to any firm unless such a request has been made by the Liftoff Recruiting Team and such a candidate was submitted to the Liftoff Recruiting Team via our Applicant Tracking System. If you require alternative methods of application or screening, you must approach the employer directly to request this as Indeed is not responsible for the employer's application process.",https://www.indeed.com/jobs?q=Data+Scientist&l=San+Francisco%5D+%23%2C+CA&sc=0kf%3Aattr%286QC5F%252COR%29explvl%28MID_LEVEL%29jt%28fulltime%29%3B&start=10&pp=gQAPAAAAAAAAAAAAAAAB_ec4oAAKAQALoX3aoOYoKAAA&vjk=17ed50409f71cfa5
18,39d22d05560e6abd,Machine Learning Engineer,"San Francisco, CA",ENTRY_LEVEL,BACHELORS_DEGREE,fulltime,"Engineering/Machine Learning Lead, Life Science Project - job post Loon South San Francisco, CA Full-time You must create an Indeed account before continuing to the company website to apply Apply on company site save-icon Job details Job Type Full-time X is Alphabet’s moonshot factory. We are a diverse group of inventors and entrepreneurs who build and launch technologies that aim to improve the lives of millions, even billions, of people. Our goal: 10x impact on the world’s most intractable problems, not just 10% improvement. We approach projects that have the aspiration and riskiness of research with the speed and ambition of a startup. About the team We are a team of scientists and engineers dedicated to creating transformative computational tools for biology. Our moonshot is to accelerate discovery and innovation in human health and other life science applications. A biology background is helpful but not required; curiosity and passion for learning are essential. If you are excited to make a difference in this space, we’d love to talk with you. About the role You will be leading the software and ML platform for the project. This includes iterating quickly through prototypes and deciding which projects to evolve into longer-term designs, as well as scaling up solutions to robust software components. This position calls for passion for early stage projects and comfort with ambiguity. You will work closely with experimental and computational biologists to identify the most impactful ways to accelerate their research, and with partners inside and outside Alphabet to understand and translate their needs. Our team is developing technologies that redefine what is possible in a rapidly evolving field. How you will make 10x impact: Set the technical direction for a team of software and machine learning engineers. Work cross-functionally with biologists and machine learning experts to define and build stage-appropriate infrastructure. Drive tight innovation loops to build tools that are useful today without losing track of the big picture. Communicate effectively with team leads, product managers, industry and academic partners, and experts in biology and related disciplines. Roll up your sleeves and get stuff done as an early member of the team. What you should have We’re looking for a motivated and versatile engineering lead who understands the requirements of an early-stage environment. BS/MS in CS or equivalent practical experience Experience leading software development for data-heavy scientific applications PhD in CS or a natural science is preferred People management experience Startup experience, or equivalent experience on early stage teams 5+ years of experience building software in an enterprise environment The US base salary range for this full-time position is $174,000-$ 276,000 + bonus + equity + benefits. Our salary ranges are determined by role, level, and location. Within the range, individual pay is determined by work location and additional factors, including job-related skills, experience, and relevant education or training. Your recruiter can share more about the specific salary range for your location during the hiring process. Please note that the compensation details listed in US role postings reflect the base salary only, and do not include bonus, equity, or benefits. At X, we don't just accept difference - we celebrate it, we support it, and we thrive on it for the benefit of our employees, our products and our community. We are proud to be an equal opportunity workplace and is an affirmative action employer. We are committed to equal employment opportunity regardless of race, color, ancestry, religion, sex, national origin, sexual orientation, age, citizenship, marital status, disability, gender identity or Veteran status. We also consider qualified applicants regardless of criminal histories, consistent with legal requirements. If you have a disability or special need that requires accommodation, please contact us at: x-accommodation-request@x.team.",https://www.indeed.com/jobs?q=Data+Scientist&l=San+Francisco%5D+%23%2C+CA&sc=0kf%3Aattr%286QC5F%252COR%29explvl%28MID_LEVEL%29jt%28fulltime%29%3B&start=10&pp=gQAPAAAAAAAAAAAAAAAB_ec4oAAKAQALoX3aoOYoKAAA&vjk=39d22d05560e6abd
19,a1859bb7f36d72bc,Machine Learning Engineer,"San Francisco, CA",ENTRY_LEVEL,BACHELORS_DEGREE,fulltime,"Lead AI/Machine Learning Specialty Engineer - job post WELLS FARGO BANK 43,952 reviews San Francisco, CA WELLS FARGO BANK 43,952 reviews Read what people are saying about working here. You must create an Indeed account before continuing to the company website to apply Apply on company site save-icon Job Description At Wells Fargo, we are looking for talented people who will put our customers at the center of everything we do. We are seeking candidates who embrace diversity, equity and inclusion in a workplace where everyone feels valued and inspired. Help us build a better Wells Fargo. It all begins with outstanding talent. It all begins with you. About this role: The Enterprise Functions Technology (EFT) group provides technology solutions and support for Risk, Audit, Finance, Marketing, Human Resources, Corporate Properties, and Stakeholder Relations business lines. In addition, EFT provides unique technology solutions and innovation for Wells Fargo Technology, Enterprise Shared Services, and Enterprise Data Management. This combined portfolio of applications and tools are continually engineered to meet the challenges of stability, security, scalability, and speed. Compliance, Legal, Audit & Regulatory Technology (CLAR) provides technology support and development for Legal & Data Controls, Compliance Risk & Audit, Financial Crimes, Front Office and Second Line Risk, Employee Compliance, Regulator Regulations, Market Surveillance, and Regulator Change Management. And more specifically, we are seeking an AI/Machine Learning technologist with Natural Language Processing (NLP) specialties. This role will be part of Conduct Risk/Complaint Oversight Technology team, helping the company to put some of the best-in-class analytical work and technology solution in place to enhance our capabilities to independently monitor our risks in complaints and Conduct Risk areas. Key duties and responsibilities of this position include: Develop data driven analytics capabilities to identify anomalies, outliers, emerging trends with Conduct Risk and Complaint Oversight focuses across the Enterprise. Leverage text analytics techniques to extract value and insights from unstructured conduct and complaint data. Partner with other Corporate Risk and LOB stakeholders to develop, and enhance analytical capabilities related to Conduct Risk and Complaints at the first line. Work closely with AI (MD) CoE in model development and performance monitoring, including working on Model Development Documents Partner with Corporate Model Risk to ensure alignment with relevant policies, guidelines, and best practice. Work on AI/ML model production and deployment Collaborate with other model developers and software engineers on these tasks Potential solutions could include but not limited to: Text summarization Calculating text similarity Develop contextual question and answer systems Natural language generation Clustering, etc. Collaborate in producing executive-level insights and presentations that provide a clear line of sight in trends and metrics. Collaborating closely with developers and business stakeholders on the transition of your research into high-value business applications, such as replacement of manual testing processes with systematic, data-driven approaches. Independently designing and undertaking new research as well as partner in a team environment across the organization. Implementing policies, procedures and measurements to support program, including on-going monitoring and reporting and documentation Required Qualifications : 5+ years of Specialty Software Engineering experience, or equivalent demonstrated through one or a combination of the following: work experience, training, military experience, education 5+ years of experience in one or a combination of the following: securities, quants, artificial intelligence, or machine learning 2+ years of experience one or a combination of the following: reporting, analytics, or modeling in an information security environment, information technology environment, or a combination of both A Master's degree or higher DESIRED QUALIFICATIONS: 3+ years of financial industry experience 3+ years of risk management experience 3+ years of SAS programming experience 4+ years of Python or R experience 4+ years of SQL experience Knowledge of Octave, Matlab and C/C++ Extensive knowledge and understanding of research and analysis Strong analytical skills with high attention to detail and accuracy Basic knowledge of industry regulations related to building technological solutions Excellent verbal, written, and interpersonal communication skills Wells Fargo software engineering experience A PhD in a quantitative discipline A professional certification in technology JOB EXPECTATIONS: Ability to travel up to 10% of the time Ability to work outside of regular business hours We Value Diversity At Wells Fargo, we believe in diversity, equity and inclusion in the workplace; accordingly, we welcome applications for employment from all qualified candidates, regardless of race, color, gender, national origin, religion, age, sexual orientation, gender identity, gender expression, genetic information, individuals with disabilities, pregnancy, marital status, status as a protected veteran or any other status protected by applicable law. Employees support our focus on building strong customer relationships balanced with a strong risk mitigating and compliance-driven culture which firmly establishes those disciplines as critical to the success of our customers and company. They are accountable for execution of all applicable risk programs (Credit, Market, Financial Crimes, Operational, Regulatory Compliance), which includes effectively following and adhering to applicable Wells Fargo policies and procedures, appropriately fulfilling risk and compliance obligations, timely and effective escalation and remediation of issues, and making sound risk decisions. There is emphasis on proactive monitoring, governance, risk identification and escalation, as well as making sound risk decisions commensurate with the business unit's risk appetite and all risk and compliance program requirements. Candidates applying to job openings posted in US: All qualified applicants will receive consideration for employment without regard to race, color, religion, age, sex, sexual orientation, gender identity, national origin, disability, or status as a protected veteran. Candidates applying to job openings posted in Canada: Applications for employment are encouraged from all qualified candidates, including women, persons with disabilities, aboriginal peoples and visible minorities. Accommodation for applicants with disabilities is available upon request in connection with the recruitment process.",https://www.indeed.com/jobs?q=Data+Scientist&l=San+Francisco%5D+%23%2C+CA&sc=0kf%3Aattr%286QC5F%252COR%29explvl%28MID_LEVEL%29jt%28fulltime%29%3B&start=10&pp=gQAPAAAAAAAAAAAAAAAB_ec4oAAKAQALoX3aoOYoKAAA&vjk=a1859bb7f36d72bc
20,05f24296c4fc0b93,Machine Learning Engineer,"San Francisco, CA",ENTRY_LEVEL,BACHELORS_DEGREE,fulltime,"Senior Product Manager, Machine Learning - job post Tubi San Francisco, CA • Remote Full-time Apply now Apply now save-icon Job details Encouraged to Apply Fair chance Job Type Full-time Join Tubi (www.tubi.tv), a division of FOX Technology, a premium streaming service leading the charge in making entertainment accessible to all. Headquartered in San Francisco, Tubi is an ad-supported video-on-demand (AVOD) service with movies and television shows. With over 40,000 titles from every major Hollywood studio, Tubi gives fans of movies and television shows an easy way to discover new content that is available completely free. Tubi's library has something for every member of our diverse audience, and we're committed to building a workforce that reflects that diversity. We're looking for great people who are creative thinkers, self-motivators, and impact-makers looking to help shape the future of streaming. Our services are currently available in the US, Canada, Australia, New Zealand, Mexico, Costa Rica, Ecuador, El Salvador, Guatemala, and Panama. About the Role: This is an opportunity to build the content cold starting ecosystem at Tubi and other state of art ML products. You will partner closely with Machine Learning Engineering, Content, Data Science, Legal, UX Research, and Platform PM teams to build world-class ML products for one of the largest AVOD streaming services in the world. Responsibilities: You will be leading end-to-end product development of ecosystem for content Cold Starting Translate and communicate the core value proposition of complex technical products to both executive and less-technical audiences Your vision and ability to develop and deliver will be critical to working closely with Engineering, Content, Legal, and Partnerships to drive our most critical product initiatives in ML Partner with cross-departmental stakeholders to develop a comprehensive multi-year vision and define an ML strategy focused on maximizing business impact Co-define product vision, strategies, and roadmaps based on a shared view of product priorities with the product owner and team Address prioritization challenges via data-driven rationale Ability to evaluate alternatives and make compelling recommendations based on quantitative and qualitative analysis Work closely with UI/UX designers, data scientists, data engineers, full stack engineers, infrastructure engineers and strategists in ensuring product backlogs and story creation are aligned with the product strategy As a Senior Product Manager, you will be part of the larger product leadership on ML products and you will be seen as the subject matter expert on ML products Ability to Influence cross-functional decisions among stakeholders without direct authority Your Background: Master's degree or PhD from an accredited university, or equivalent work experience 5+ years as a Product Manager 2-3 years of ML experience You have worked on developing an ML product by understanding business problems, validating them with data and developing ML solutions to make an impact on business KPIs Both theoretical and practical experience in data-mining and labeling, feature selection, statistical techniques, and machine learning / deep learning algorithms Knowledge of machine learning algorithms; classification, regression, clustering, reinforcement learning, algorithm design etc Familiarity with natural language processing and text analytics Familiarity with Big Data frameworks #LI-Remote #LI-WW1 Pursuant to state and local pay disclosure requirements, the pay range for this role, with final offer amount dependent on education, skills, experience, and location is listed annually below. This role is also eligible for an annual discretionary bonus, long term incentive plan, and various benefits, including medical/dental/vision, insurance, a 401(k) plan, paid time off, and other benefits in accordance with applicable plan documents. California, New York City, Westchester County, NY and Seattle, WA $200,000—$230,000 USD Colorado and Washington (excluding Seattle, WA) $165,000—$201,000 USD Tubi is a division of Fox Technology, and the majority of all US-employee benefits are covered by FOX Employee Benefits, summarized here. The following distinctions below outline the differences between the Tubi and FOX benefits: For US-based non-exempt Tubi employees, the FOX Employee Benefits summary accurately captures the Vacation and Sick Time For all US-based employees, Tubi offers 12 paid ""Tubi Holidays"" in addition to the 11 FOX Corporate Company paid holidays For all salaried/exempt employees, in lieu of the FOX Vacation policy, Tubi offers a Flexible Time off Policy to manage all personal matters For all full-time, regular employees, in lieu of FOX Paid Parental Leave, Tubi offers a generous Parental Leave Program, which allows parents twelve (12) weeks of paid bonding leave within the first year of the birth, adoption, surrogacy or foster placement of a child. This time is 100% paid through a combination of any applicable state, city, and federal leaves and wage-replacement programs in addition to contributions made by Tubi For all full-time, regular employees, Tubi offers a monthly wellness reimbursement Tubi is proud to be an equal opportunity employer and consider qualified applicants without regard to race, color, religion, sex, national origin, ancestry, age, genetic information, sexual orientation, gender identity, marital or family status, veteran status, medical condition or disability. Pursuant to the San Francisco Fair Chance Ordinance, we will consider for employment qualified applicants with arrest and conviction records. We are an E-Verify company. If you require alternative methods of application or screening, you must approach the employer directly to request this as Indeed is not responsible for the employer's application process.",https://www.indeed.com/jobs?q=Data+Scientist&l=San+Francisco%5D+%23%2C+CA&sc=0kf%3Aattr%286QC5F%252COR%29explvl%28MID_LEVEL%29jt%28fulltime%29%3B&start=10&pp=gQAPAAAAAAAAAAAAAAAB_ec4oAAKAQALoX3aoOYoKAAA&vjk=05f24296c4fc0b93
