,job_id,job_title,location,experience,education,job_type,job_description,job_link
23,e3a4b7f422317551,Machine Learning Engineer,"San Francisco, CA",ENTRY_LEVEL,BACHELORS_DEGREE,fulltime,"Senior Data Scientist, Machine Learning: Platform - job post Rockstar Games New York & New England New York, NY • Hybrid remote $120,500 - $168,700 a year -  Full-time You must create an Indeed account before continuing to the company website to apply Apply on company site save-icon Job details Salary $120,500 - $168,700 a year Job Type Full-time Job reference 5365459003 Company Name Rockstar Games New York & New England Salary Competitive Location New York, United States Country United States Industry sector Programming Job start date ASAP Posted date 02/03/2023 Experience Level Mid-Senior Level Job type Permanent | Full Time Remote / Hybrid No At Rockstar Games, we create world-class entertainment experiences. A career at Rockstar Games is about being part of a team working on some of the most creatively rewarding and ambitious projects to be found in any entertainment medium. You would be welcomed to a dedicated and inclusive environment where you can learn and collaborate with some of the most talented people in the industry. Rockstar Games is on the lookout for talented Data Scientists with strong software development skills who possess a passion for both games, and big data. This is a full-time permanent position based out of Rockstar's unique game development studio in the heart of Manhattan. WHAT WE DO The Rockstar Analytics team provide insights and actionable results to a wide variety of stakeholders across the organization in support of their decision making. We partner with multiple departments across the company to design and implement data and pipelines. We collaborate as a global team to develop cutting-edge data pipelines, data products, data models, reports, analyses, and machine learning applications. The ML Platform vertical on the Analytics Team is tasked to build out high impact ML products for internal tooling and for personalizing in-game experiences for our players. We design, build, and maintain the foundational infrastructure of Rockstar's Player Analytics ML platform. We work alongside an exploding team of innovative data-driven decision makers directly impacting Rockstar's future. RESPONSIBILITIES Build out foundational high impact infrastructure and tooling to enable Rockstar to leverage modern ML practices to drive company-wide strategy. Build common library tooling to enable data science staff to easily use Big Data and Cloud resources with a high level of abstraction. Collaborate closely with internal Data Science members and external stakeholders to ensure we leverage ML to provide the best player experience for our critical titles. Build standard toolsets for entry to resources across Machine Learning Engineers and Data Scientists, following proper Python OOD best practices. Design, develop, and maintain product-level Machine Learning application packages in an Agile product-focused CI/CD environment. Use and optimize advanced distributed techniques to automate continuous training pipelines for traditional and Deep Learning (DL) models. Remain current with state of the industry to ensure products are meeting modern DL/ML standards and best practices Innovate and produce top quality ML data applications that are easy to iterate as stakeholder requirements evolve. QUALIFICATIONS 5+ years in data science or similar role in the gaming, marketing, finance, or technology fields required. 5+ years of experience in machine learning application development with Python. Strong understanding of distributed computing and cloud tech for machine learning products. Bachelor's degree in Computer Science or related field, with a strong quantitative background. Extensive experience designing and developing ML pipelines for distributed training on billions of rows of high dimensional data through to production. Experience designing and developing cloud-based PySpark applications. Experience with back-end infrastructure for serving models at batch and real time with unified code base. Deep knowledge of ML algorithms for supervised regression and classification tasks, unsupervised tasks, reinforcement learning tasks, as well as bagging, boosting, and stacking ensemble techniques. Experience developing cloud-based infrastructure tooling following proper Software Development Lifecycle practices. Understanding of Docker for application packaging and versioning. Experience building and working with infrastructure central to MLOps and how MLFlow manages the model lifecycle for model lineage tracking and environment agnostic model containerization. SKILLS Strong skills in diagramming complex data application architecture and data flows. Good understanding of practical deep learning techniques and implementation schemes. Ability to develop and maintain good relations and communicate with people at all hierarchical levels. Proficiency in statistics such as distributions, predictive modeling, data validation, statistical testing, and regression. Strong problem-solving skills. Ability to reconcile technical and business perspectives. Autonomy and entrepreneurship. Strong team spirit. PLUSES Please note that these are desirable skills and are not required to apply for the position. Experience with Azure ML & other base Azure Services. Experience with Databricks, MLFlow. Experience serving models for real-time applications. Experience with Snowflake. Graduate degree (MSc or Master's, PHD), an asset. Game industry experience strongly desired. ADDITIONAL INFORMATION This position can be based out of either our NYC or San Diego studios. HOW TO APPLY Please apply with a resume demonstrating how you meet the skills above. If we would like to move forward with your application, a Rockstar recruiter will reach out to you to explain next steps and guide you through the process. Rockstar is proud to be an equal opportunity employer, and we are committed to hiring, promoting, and compensating employees based on their qualifications and demonstrated ability to perform job responsibilities. If you've got the right skills for the job, we want to hear from you. We encourage applications from all suitable candidates regardless of age, disability, gender identity, sexual orientation, religion, belief, or race. The pay range for this position in New York City at the start of employment is expected to be between the range below* per year. However, base pay offered is based on market location, and may vary further depending on individualized factors for job candidates, such as job-related knowledge, skills, experience, and other objective business considerations. Subject to those same considerations, the total compensation package for this position may also include other elements, including a bonus and/or equity awards, in addition to a full range of medical, financial, and/or other benefits. Details of participation in these benefit plans will be provided if an employee receives an offer of employment. If hired, employee will be in an ""at-will position"" and the company reserves the right to modify base salary (as well as any other discretionary payment or compensation or benefit program) at any time, including for reasons related to individual performance, company or individual department/team performance, and market factors. NYC Pay Range $120,500-$168,700 USD",https://www.indeed.com/jobs?q=Machine+Learning+Engineer&l=New+York%2C+NY&sc=0kf%3Aattr%28FCGTU%7CHFDVW%7CQJZM9%7CUTPWG%252COR%29explvl%28MID_LEVEL%29jt%28fulltime%29%3B&radius=50&start=10&pp=gQAPAAAAAAAAAAAAAAAB_gKCswAcAQEJBhmV55DLOlLoDLEC0XJkJxxtNuObjEjOFgAA&vjk=e3a4b7f422317551
24,0178cf8a143399c3,Machine Learning Engineer,"San Francisco, CA",ENTRY_LEVEL,BACHELORS_DEGREE,fulltime,"Senior Manager, Product Management, (Machine Learning Feature Materialization) - job post Capital One 10,036 reviews New York, NY 10011 Full-time, Part-time Capital One 10,036 reviews Read what people are saying about working here. You must create an Indeed account before continuing to the company website to apply Apply on company site save-icon Job details Encouraged to Apply Fair chance Job Type Full-time Part-time 11 West 19th Street (22008), United States of America, New York, New York Senior Manager, Product Management, (Machine Learning Feature Materialization) Capital One is a high-tech company, a scientific laboratory, and a nationally recognized brand all in one reaching tens of millions of consumers. We are a passionate and entrepreneurial team that embraces bold ideas, fosters collaboration and delivers great experiences for our customers. Machine learning is at the heart of our approach. Our teams provide millions of customers with individualized, real-time experiences, protection, and decisions driven by machine learning and advanced analytic capabilities. In order to further scale our efforts in this space, we are building a world class machine learning platform. This platform will enable our data scientists and machine learning engineers to take models from conception to production faster and safer than ever before. This work is core to Capital One’s mission, changing banking for good. As a Sr. Product Manager on the Machine Learning Experience (MLX) Product team, you will be part of the ML Enterprise Feature Platform Development Team designing and delivering a best in class managed compute product for Capital One Data Scientists. This team is focused on building a fast, frictionless compute experience for data scientists and analysts so they can focus on building and training business-critical ML models that power our one-of-a-kind banking experiences. We’re passionate about building platform software for the next generation of data science at Capital One and are looking for someone excited to build managed compute services at scale. This role represents the needs of the customer to inform the platform roadmap ensuring the capabilities being delivered are aligned with the intended business outcomes. You will be responsible for feature definition and partnering with tech teams to deliver platform components. The ideal candidate for this role is passionate about technology and deeply empathizes with internal and external customer needs. They are comfortable in conversation with engineering teams as well as stakeholders ranging from data scientists to senior leaders. Specific responsibilities include, but are not limited to: Develop and communicate the product vision and strategy for key components of the platform. Responsible for a team of direct reporting product managers. Deeply understand the needs of data scientists and engineers across Capital One. Prioritize the Product Backlog to maximize business and customer outcomes. Incorporate design thinking and analytics to inform product design. Enable collaboration and ensure communication between teams. Maintain a healthy backlog of work and play a critical role in many agile ceremonies. Support the team with escalation and resolution of impediments. Serve as the connection between customers, Capital One’s mission, and your team. We want you if you are: Passionate about building impactful products. You enjoy putting yourself in the shoes of customers. Even better if you have experience doing this with internal customers. You have expertise in, or are excited about, cloud services experience or managed compute experience. You are a learner who is able to quickly get up to speed in a highly technical environment. You are experienced working in an Agile environment You are a do-er who can also zoom out and think strategically. You have excellent oral and written communication skills. You are highly collaborative and have the ability to influence and lead. Basic Qualifications: Bachelor’s Degree or military experience At least 5 years of experience in product management or at least 5 years of experience in product design, agile delivery, business analysis, data science, or software engineering Preferred Qualifications: Bachelor’s Degree in Computer Science or Engineering MBA or Master’s degree 3+ years of experience in Agile product management 2 years of people leadership experience leading product manager teams At this time, Capital One will not sponsor a new applicant for employment authorization for this position. The minimum and maximum full-time annual salaries for this role are listed below, by location. Please note that this salary information is solely for candidates hired to perform work within one of these locations, and refers to the amount Capital One is willing to pay at the time of this posting. Salaries for part-time roles will be prorated based upon the agreed upon number of hours to be regularly worked. Location is New York City: $195,200 - $222,800 for Sr. Mgr, Product Management Location is San Francisco, California: $206,800 - $236,000 for Sr. Mgr, Product Management Candidates hired to work in other locations will be subject to the pay range associated with that location, and the actual annualized salary amount offered to any candidate at the time of hire will be reflected solely in the candidate’s offer letter. This role is also eligible to earn performance based incentive compensation, which may include cash bonus(es) and/or long term incentives (LTI). Incentives could be discretionary or non discretionary depending on the plan. Capital One offers a comprehensive, competitive, and inclusive set of health, financial and other benefits that support your total well-being. Learn more at the Capital One Careers website. Eligibility varies based on full or part-time status, exempt or non-exempt status, and management level. No agencies please. Capital One is an Equal Opportunity Employer committed to diversity and inclusion in the workplace. All qualified applicants will receive consideration for employment without regard to sex, race, color, age, national origin, religion, physical and mental disability, genetic information, marital status, sexual orientation, gender identity/assignment, citizenship, pregnancy or maternity, protected veteran status, or any other status prohibited by applicable national, federal, state or local law. Capital One promotes a drug-free workplace. Capital One will consider for employment qualified applicants with a criminal history in a manner consistent with the requirements of applicable laws regarding criminal background inquiries, including, to the extent applicable, Article 23-A of the New York Correction Law; San Francisco, California Police Code Article 49, Sections 4901-4920; New York City’s Fair Chance Act; Philadelphia’s Fair Criminal Records Screening Act; and other applicable federal, state, and local laws and regulations regarding criminal background inquiries. If you have visited our website in search of information on employment opportunities or to apply for a position, and you require an accommodation, please contact Capital One Recruiting at 1-800-304-9102 or via email at RecruitingAccommodation@capitalone.com. All information you provide will be kept confidential and will be used only to the extent required to provide needed reasonable accommodations. For technical support or questions about Capital One's recruiting process, please send an email to Careers@capitalone.com Capital One does not provide, endorse nor guarantee and is not liable for third-party products, services, educational tools or other information available through this site. Capital One Financial is made up of several different entities. Please note that any position posted in Canada is for Capital One Canada, any position posted in the United Kingdom is for Capital One Europe and any position posted in the Philippines is for Capital One Philippines Service Corp. (COPSSC).",https://www.indeed.com/jobs?q=Machine+Learning+Engineer&l=New+York%2C+NY&sc=0kf%3Aattr%28FCGTU%7CHFDVW%7CQJZM9%7CUTPWG%252COR%29explvl%28MID_LEVEL%29jt%28fulltime%29%3B&radius=50&start=10&pp=gQAPAAAAAAAAAAAAAAAB_gKCswAcAQEJBhmV55DLOlLoDLEC0XJkJxxtNuObjEjOFgAA&vjk=0178cf8a143399c3
25,8726f70ed0211a10,Machine Learning Engineer,"San Francisco, CA",ENTRY_LEVEL,BACHELORS_DEGREE,fulltime,"Control Systems Engineer - job post Brock Solutions 53 reviews New York, NY Full-time Brock Solutions 53 reviews Read what people are saying about working here. You must create an Indeed account before continuing to the company website to apply Apply on company site save-icon Job details Job Type Full-time Brock Solutions is an innovative engineering solutions and professional services company specializing in the design, build and implementation of real-time operational solutions for broad based industrial/manufacturing and transportation/logistics organizations worldwide. Some interesting areas we are exploring include industrial automation, machine learning, IIOT, cyber security, AI, robotics, and other technologies. With approximately 700 employees globally, Brock Solutions is a privately held, employee owned organization with over 30 years in the real-time operational solutions space. As Brock Solutions continues to grow and respond to the on-going requirements of major clients, we need to add talent to our base of outstanding professionals. We are currently seeking a Control Systems Engineer to join our team of experienced professionals located at our Queens, NY location. Working with other highly motivated Engineers, you will be involved with designing, programming, integrating, troubleshooting, and supporting new and existing automated controls systems. Employee-owned company with profit sharing, comprehensive benefits, company events and charitable initiatives, a diverse workplace, BBQs and Lunch and Learns, Sports teams, Group fitness initiatives, and a ""We win as as a Team"" culture are just some of the reasons our employees love working at Brock! Brock Solutions offers a flexible work environment that includes a combination of at home, in the office, and on-site options such that individuals can balance work and life. In the end, the intent is to enable you an your team to work effectively and collaboratively to produce results that matter. Why Work at Brock? Competitive compensation package Profit sharing Extended Health benefits Continuous career growth Flexible working hours Company events and celebrations Travel Opportunities Responsibilities may include: Control System design PLC Programming Electrical design Design/programming of Human Machines Interfaces (HMI) Troubleshooting of electrical, PLC, and HMI systems Interfacing with real-time database applications to manage critical production information Supporting project proposals and estimation Preparing functional specifications Assisting with equipment selection and procurement Site commissioning and installation Performing other duties as assigned by Project Manager On-call service/support for existing installations Qualifications Required: Ability to problem solve Aptitude for Programming (C,C#,VBA, SQL, Ladder Logic, or other languages) Knowledge of PLCs (e.g. ControlLogix, Modicon, Siemens S7) is an asset Knowledge of HMIs (e.g. FactoryTalkView, Wonderware, iFix) is an asset Familiarity with IT/Networking and database applications is an asset Ability to read electrical schematics is an asset Excellent communication skills, both verbal and written Understanding of industrial environments, engineering, and production processes Bachelor degree in Electrical Engineering, Mechatronics, Systems design, Automation, Industrial Engineering or College equivalent Ability to complete all security clearance requirements that may be required for the performance of the work Willing to travel up to 40% throughout the year Other Job Information (if applicable): New grads are welcome to apply. If you have graduated within the last 3 years, please also submit a soft copy of your transcript (unofficial copy is fine). Brock Solutions strives to create a respectful, accessible and inclusive work environment. Upon individual request, Brock Solutions will endeavour to remove barriers to the hiring process to accommodate those candidates with disabilities. Please be advised that, outside of our official applicant tracking system, Brock Solutions will never solicit personal information upfront. We send formal offer documentation in writing first, and wait until your acceptance before aking for any additional personal information.",https://www.indeed.com/jobs?q=Machine+Learning+Engineer&l=New+York%2C+NY&sc=0kf%3Aattr%28FCGTU%7CHFDVW%7CQJZM9%7CUTPWG%252COR%29explvl%28MID_LEVEL%29jt%28fulltime%29%3B&radius=50&start=10&pp=gQAPAAAAAAAAAAAAAAAB_gKCswAcAQEJBhmV55DLOlLoDLEC0XJkJxxtNuObjEjOFgAA&vjk=8726f70ed0211a10
