,job_id,job_title,location,experience,education,job_type,job_description,job_link
0,a15473a20a6a57cb,Machine Learning Engineer,"San Francisco, CA",ENTRY_LEVEL,BACHELORS_DEGREE,fulltime,"Staff, Machine Learning Engineer - job post Warner Bros. Discovery 882 reviews New York, NY 10010 $172,200 - $319,800 a year -  Full-time Warner Bros. Discovery 882 reviews Read what people are saying about working here. You must create an Indeed account before continuing to the company website to apply Apply on company site save-icon Job details Salary $172,200 - $319,800 a year Job Type Full-time Every great story has a new beginning, and yours starts here. Welcome to Warner Bros. Discovery… the stuff dreams are made of. Who We Are… When we say, “the stuff dreams are made of,” we’re not just referring to the world of wizards, dragons and superheroes, or even to the wonders of Planet Earth. Behind WBD’s vast portfolio of iconic content and beloved brands, are the storytellers bringing our characters to life, the creators bringing them to your living rooms and the dreamers creating what’s next… From brilliant creatives, to technology trailblazers, across the globe, WBD offers career defining opportunities, thoughtfully curated benefits, and the tools to explore and grow into your best selves. Here you are supported, here you are celebrated, here you can thrive. Every great story has a new beginning, and yours starts here. Welcome to Warner Bros. Discovery… the stuff dreams are made of. Who We Are… When we say, “the stuff dreams are made of,” we’re not just referring to the world of wizards, dragons and superheroes, or even to the wonders of Planet Earth. Behind WBD’s vast portfolio of iconic content and beloved brands, are the storytellers bringing our characters to life, the creators bringing them to your living rooms and the dreamers creating what’s next… From brilliant creatives, to technology trailblazers, across the globe, WBD offers career defining opportunities, thoughtfully curated benefits, and the tools to explore and grow into your best selves. Here you are supported, here you are celebrated, here you can thrive. Your New Role... We are looking for a passionate and self-motivated Staff Machine Learning Engineering for our Search Browse Experience team, which is a part of the Content Discovery Organization. As the name implies, the Search team is responsible for enabling a delightful content discovery experience through the Search feature for the WBD (D+, HBOMax, new combined product) users. This role is critical in empowering the Search team with cognitive computing capabilities that would drive a differential search experience. In this role, you will be responsible to independently architect, design, develop and deploy scalable ML systems, and data science models for WBD Streaming content discovery Search experience. This role would need a heavy and proactive collaboration with the product and engineering leadership besides partnering with the Search team engineers. Key Job Responsibilities: As the Staff Machine Learning Engineer of Search Browse Experience, you will: Research, design, experiment with and build high-impact machine learning systems for consumer facing Search framework that provides real-time low latency search results. Partner with Data Scientists to A/B test Search ML models and launch them into production. Explore and navigate existing ML serving frameworks and use them for deploying ML models in production. Build ML Pipelines and productionize ML modes for Search query prediction, query re-ranking, Pointwise Mutual Information Models. Optimize and fine tune real time prediction for end-to-end latency in ML models Qualifications : M.S or B.S.in a Computer Science/Statistics/Data Science/Quant or related field. 5+ years of experience applying Machine Learning techniques solving real world industry problems. Deep understanding of traditional and deep learning based ML and NLP methodologies. Expertise with ML-frameworks such as TensorFlow, PyTorch, scikit-learn Strong Python coding skills Excellent written and verbal communication skills with the ability to effectively advocate technical solutions to scientists, engineers, and product audiences. Passion for data-driven research, development, and experimentation Self-motivated, growth-oriented, and driven to pursue solutions to challenging problems Prior experience applying machine learning in semantic search query transformation or other search related areas such as Search Knowledge graph would be a plus How We Get Things Done… This last bit is probably the most important! Here at WBD, our guiding principles are the core values by which we operate and are central to how we get things done. You can find them at www.wbd.com/guiding-principles/ along with some insights from the team on what they mean and how they show up in their day to day. We hope they resonate with you and look forward to discussing them during your interview. How We Get Things Done… This last bit is probably the most important! Here at WBD, our guiding principles are the core values by which we operate and are central to how we get things done. You can find them at www.wbd.com/guiding-principles/ along with some insights from the team on what they mean and how they show up in their day to day. We hope they resonate with you and look forward to discussing them during your interview. The Legal Bits… In compliance with local law, we are disclosing the compensation, or a range thereof, for roles in locations where legally required. $172,200.00 - $319,800.00 salary per year. Other rewards may include annual bonuses, short- and long-term incentives, and program-specific awards. In addition, Warner Bros. Discovery provides a variety of benefits to employees, including health insurance coverage, an employee wellness program, life and disability insurance, a retirement savings plan, paid holidays and paid time off (PTO). Warner Bros. Discovery embraces the opportunity to build a workforce that reflects the diversity of our society and the world around us. Being an equal opportunity employer means that we take seriously our responsibility to consider qualified candidates on the basis of merit, without regard to race, color, religion, national origin, gender, sexual orientation, gender identity or expression, age, mental or physical disability, and genetic information, marital status, citizenship status, military status, protected veteran status or any other category protected by law. If you’re a qualified candidate with a disability and you need a reasonable accommodation in order to apply for this position, please contact us at recruitadmin@wbd.com.",https://www.indeed.com/jobs?q=Machine+Learning+Engineer&l=New+York%2C+NY&sc=0kf%3Aattr%28FCGTU%7CHFDVW%7CQJZM9%7CUTPWG%252COR%29explvl%28MID_LEVEL%29jt%28fulltime%29%3B&vjk=a15473a20a6a57cb
1,df3fef6629c30f62,Machine Learning Engineer,"San Francisco, CA",ENTRY_LEVEL,BACHELORS_DEGREE,fulltime,"Video Conferencing Support Engineer - job post Capital One 10,036 reviews New York, NY 10012 Full-time, Part-time Capital One 10,036 reviews Read what people are saying about working here. You must create an Indeed account before continuing to the company website to apply Apply on company site save-icon Job details Encouraged to Apply Fair chance Job Type Full-time Part-time Center 1 (19052), United States of America, McLean, Virginia Video Conferencing Support Engineer Are you looking to influence decision makers with your own technological ideas and innovations? Do you want to be on the forefront of cloud adoption and emerging technologies? If yes, join us in Capital One Unified Communications, where we develop best-in-class strategy and solutions for key internal business domains, provide key capabilities for critical cross-organization programs, and prove out emerging technologies and DevOps best practices. We are looking for an engineer in video conferencing and conference room technology. You love keeping up to date with the ever changing technology, troubleshooting issues that arise and help the team grow. In this role, you will Maintain all aspects of Polycom,Crestron Fusion, and Mersive Solstice servers and applications which includes but not limited to AWS lambda, cloud formation, and application services; application and service monitoring and alerting integrations; usage statistics and reporting; application patching / upgrade releases to include software testing, implementation and service validation Ability to create and manage technical documentation (including the ability to identify and address process gaps) Create, update, & resolve trouble tickets as assigned as well as monitoring the queue. Work across teams to diagnose and resolve issues Use your knowledge of video conferencing protocols, signaling, call setup, backend infrastructure, end devices Assist with the evaluation of new and emerging technologies Identify and propose ways to apply AI and Machine learning to the supported platforms Support cloud migration efforts Identify solutions to remove technology debt It's expected this role will involve some work during nights and weekends. Basic qualifications: High School Diploma, GED, or equivalent certification At least 3 years of experience in video conferencing support Preferred qualifications: Bachelor’s Degree 3+ years of experience with video infrastructure support 3+ years of experience with Windows and Linux server support 3+ years of experience with assessing, installing, operating, maintaining, and troubleshooting video conferencing room systems/technologies 1+ years of experience with AWS, Azure, Google Cloud, Elk, Kibaba, PagerDuty 1+ years of experience of deploying applications in the Cloud Certifications in Polycom, Cisco, Pexip, Crestron, Biamp, Extron, Infocomm or Microsoft At this time, Capital One will not sponsor a new applicant for employment authorization for this position. The minimum and maximum full-time annual salaries for this role are listed below, by location. Please note that this salary information is solely for candidates hired to perform work within one of these locations, and refers to the amount Capital One is willing to pay at the time of this posting. Salaries for part-time roles will be prorated based upon the agreed upon number of hours to be regularly worked. Location is New York City: $131,400 - $150,000 for Senior Platform Engineer Location is San Francisco, California: $139,200 - $158,900 for Senior Platform Engineer Candidates hired to work in other locations will be subject to the pay range associated with that location, and the actual annualized salary amount offered to any candidate at the time of hire will be reflected solely in the candidate’s offer letter. This role is also eligible to earn performance based incentive compensation, which may include cash bonus(es) and/or long term incentives (LTI). Incentives could be discretionary or non discretionary depending on the plan. Capital One offers a comprehensive, competitive, and inclusive set of health, financial and other benefits that support your total well-being. Learn more at the Capital One Careers website. Eligibility varies based on full or part-time status, exempt or non-exempt status, and management level. No agencies please. Capital One is an Equal Opportunity Employer committed to diversity and inclusion in the workplace. All qualified applicants will receive consideration for employment without regard to sex, race, color, age, national origin, religion, physical and mental disability, genetic information, marital status, sexual orientation, gender identity/assignment, citizenship, pregnancy or maternity, protected veteran status, or any other status prohibited by applicable national, federal, state or local law. Capital One promotes a drug-free workplace. Capital One will consider for employment qualified applicants with a criminal history in a manner consistent with the requirements of applicable laws regarding criminal background inquiries, including, to the extent applicable, Article 23-A of the New York Correction Law; San Francisco, California Police Code Article 49, Sections 4901-4920; New York City’s Fair Chance Act; Philadelphia’s Fair Criminal Records Screening Act; and other applicable federal, state, and local laws and regulations regarding criminal background inquiries. If you have visited our website in search of information on employment opportunities or to apply for a position, and you require an accommodation, please contact Capital One Recruiting at 1-800-304-9102 or via email at RecruitingAccommodation@capitalone.com. All information you provide will be kept confidential and will be used only to the extent required to provide needed reasonable accommodations. For technical support or questions about Capital One's recruiting process, please send an email to Careers@capitalone.com Capital One does not provide, endorse nor guarantee and is not liable for third-party products, services, educational tools or other information available through this site. Capital One Financial is made up of several different entities. Please note that any position posted in Canada is for Capital One Canada, any position posted in the United Kingdom is for Capital One Europe and any position posted in the Philippines is for Capital One Philippines Service Corp. (COPSSC).",https://www.indeed.com/jobs?q=Machine+Learning+Engineer&l=New+York%2C+NY&sc=0kf%3Aattr%28FCGTU%7CHFDVW%7CQJZM9%7CUTPWG%252COR%29explvl%28MID_LEVEL%29jt%28fulltime%29%3B&vjk=df3fef6629c30f62&advn=4418968771450209
2,b065fb7f3ea64bf1,Machine Learning Engineer,"San Francisco, CA",ENTRY_LEVEL,BACHELORS_DEGREE,fulltime,"Machine Learning Engineer - job post Neal Analytics 3 reviews New York, NY • Remote From $135,000 a year -  Full-time, Contract Neal Analytics 3 reviews Read what people are saying about working here. Apply now Apply now save-icon Job details Salary From $135,000 a year Job Type Full-time Contract Machine Learning Engineer Join our Team: The Data Science & Analytics chapter is responsible for providing Data Science, machine learning engineering expertise, and solution delivery across Chevron. Data Science & Analytics practitioners collaborate to drive innovation and digital transformation to support the future of energy. Machine Learning Engineering (MLE) touches all parts of the Chevron value chain (Upstream, Midstream, and Downstream) as we try to enhance business decision making process through deploying and productionizing machine learning models. The Role The function of this role is to partner with the business to identify opportunities to apply MLE techniques to achieve greater business value, faster. Our team is highly technical, creative, innovative, cross-functional, and passionate about delivering creative solutions that drive significant business value first and foremost. We do this through the agility of a small start-up while ensuring scale and model/code reuse to a larger federated, world-wide organization by leveraging agile practices, continuous delivery, and automation techniques. As a Machine Learning Engineer, you will: Consult, identify and frame opportunities to implement AI solutions that help Chevron businesses gain insight and improve decision making, workflow, and automation Identify data, appropriate technology, and architectural design patterns to solve business challenges using analytical tools and AI design patterns and architectures Partner with Data Scientists and Chevron IT Foundational services to implement complex algorithms and models into enterprise scale machine learning pipelines Run machine learning experiments and fine-tune algorithms to ensure optimal performance Consistently deliver complex, innovative, and complete solutions, driving them through design, planning, development, and deployment that simplify business processes and workflows to drive business value Work collaboratively with a large variety of different teams, including data scientists, data engineers, and solution architects from various organizations within business units and IT Transform data science prototypes into appropriate scale solutions in a production environment Orchestrate and configure infrastructure that assists Data Scientists and analysts in building low latency, scalable and resilient machine learning, and optimization workloads into an enterprise software product Requirements Requirements: Experience Minimum 5 years’ experience in Object Oriented Design and Programming and Python development. Experience implementing machine learning frameworks and libraries Development experience with a JavaScript framework, experience building machine learning pipelines in Microsoft Azure Machine Learning service Experience developing cloud first solutions using Microsoft Azure Services Skills Working knowledge of mathematics (primarily linear algebra, probability, statistics), and algorithms. Proficient in applying common design patterns, ability to communicate design ideas effectively. Must have a disciplined, methodical, minimalist approach to designing and constructing layered software components that can be embedded within larger frameworks or applications. Proficient at orchestrating large-scale ML/DL jobs, leveraging big data tooling and modern container orchestration infrastructure, to tackle distributed training and massive parallel model executions on cloud infrastructure. Experience designing custom APIs for machine learning models for training and inference processes and designing, implementing, and delivering frameworks for MLOps. Experience implementing and incorporating ML models on unstructured data using cognitive services and/or computer vision as part of AI solutions and workflows. History of working with large scale model optimization and hyperparameter tuning, applied to ML/DL models. Hands-on experience in deploying machine learning pipelines with Azure Machine Learning SDK. Knowledge of enterprise SaaS complexities including security/access control, scalability, high availability, concurrency, online diagnoses, deployment, upgrade/migration, internationalization, and production support. Knowledge of data engineering and transformation tools and patterns such as DataBricks, Spark, Azure Data Factory. Mature software engineering skills, such as source control versioning, requirement spec, architecture and design review, testing methodologies, CI/CD, etc. Ability to engage business and technical experts at all organizational levels and assess opportunities to apply machine learning and analytics to improve their workflows and deliver information and insight to support business decisions. Proven ability to take leadership role in projects that span multiple teams and ability to work with product managers to clarify and prune requirements. Ability to build collaborative relationships across functional and geographic areas to plan, facilitate, and architect and develop scalable AI solutions for Chevron’s key business units and functions. Ability to communicate in a clear, concise, and understandable manner both orally and in writing. Preferred Education BS or MS in Computer Science, Mathematics, or related fields Flexible Working Job Types: Full-time, Contract Pay: From $135,000.00 per year Benefits: Dental insurance Health insurance Life insurance Vision insurance Schedule: 8 hour shift Experience: Python: 1 year (Preferred) SQL: 1 year (Preferred) Work Location: Remote Health insurance If you require alternative methods of application or screening, you must approach the employer directly to request this as Indeed is not responsible for the employer's application process.",https://www.indeed.com/jobs?q=Machine+Learning+Engineer&l=New+York%2C+NY&sc=0kf%3Aattr%28FCGTU%7CHFDVW%7CQJZM9%7CUTPWG%252COR%29explvl%28MID_LEVEL%29jt%28fulltime%29%3B&vjk=b065fb7f3ea64bf1
3,2f5dedeb1664ae9b,Machine Learning Engineer,"San Francisco, CA",ENTRY_LEVEL,BACHELORS_DEGREE,fulltime,"Machine Learning Engineer - job post shaped.ai Inc. New York, NY $120,000 - $160,000 a year -  Full-time Apply now Apply now save-icon Job details Salary $120,000 - $160,000 a year Job Type Full-time Shaped is an API for ranking. We help developers create frictionless discovery experiences using feeds, recommendations and notifications. Ultimately, our goal is to make AI accessible for everyone and we see machine-learning for discovery (e.g. TikTok ""For-You Page"", FB “News feed” and YouTube ""What to watch next"") as the best place to start. Shaped is a YC-backed seed-stage startup. The founders built many of the ranking models at Facebook and have also worked at Uber, Afterpay and Google. We're a team of 5 working remotely across the globe and are about to get an office in NYC. We are looking for a machine learning engineer to design, build and optimize Shaped's ranking engine. You will be a founding engineer working on state-of-the-art machine-learning infrastructure. You will have the chance to touch all parts of the production and experimentation ML stack - from modeling to infrastructure. As one of Shaped’s early employees you will help shape our product roadmaps and engineering culture. We’re excited to work, collaborate, grow, teach, and learn from you. This role is for a full-time engineer at $120k - $160k a year and 0.3% - 1.0% equity. Responsibilities: Experiment and develop predictive ranking models for customer's discovery use-cases. Experiment and develop with pre-trained image, language, audio and video embedding models that understand our customer's discovery data. Build the infrastructure to train and deploy Shaped's embedding and ranking models. Implement data validation and logging infrastructure for monitoring our production models. Optimize machine-learning libraries and accelerate models to serve real-time inference. Work on our real-time and batch data ingestion pipelines using modern data engineering pipelines/streams. Work closely with a small team to inform the roadmap and co-develop a strong engineering culture with best practices. Requirements: Bachelor's in computer science, data science or mathematics related field. Master's degree or PhD will be advantageous. 3+ years of machine learning engineering industry experience. Proficient with Python, SQL. Extensive knowledge of ML frameworks, modeling, and data engineering tools. In-depth knowledge of mathematics, statistics and algorithms. Excellent written and verbal communication skills. We’re building the future of AI. Come join us! If you require alternative methods of application or screening, you must approach the employer directly to request this as Indeed is not responsible for the employer's application process.",https://www.indeed.com/jobs?q=Machine+Learning+Engineer&l=New+York%2C+NY&sc=0kf%3Aattr%28FCGTU%7CHFDVW%7CQJZM9%7CUTPWG%252COR%29explvl%28MID_LEVEL%29jt%28fulltime%29%3B&vjk=2f5dedeb1664ae9b
