,job_id,job_title,location,experience,education,job_type,job_description,job_link
0,a6191c240f75a634,Machine Learning Engineer,"San Francisco, CA",ENTRY_LEVEL,BACHELORS_DEGREE,fulltime,"Machine Learning Engineer - job post DeepMotion San Francisco Bay Area, CA Full-time You must create an Indeed account before continuing to the company website to apply Apply on company site save-icon Job details Job Type Full-time DeepMotion is a leader in the thriving field of motion intelligence, with a mission to breathe life into digital characters using AI-powered motion capture and real-time 3D body tracking. It's an exciting time to join, with the rapid advancement of AI technologies, we are continuously bringing innovative new solutions to our users, whose stories you get to tell. Led by members from Blizzard, Disney, ROBLOX and Ubisoft, we're leveraging decades of experience to build a platform that creators of all levels can use for accessible 3D animation generation. Machine Learning Engineer We are building the next-generation animation creation platform that enables a new level of interactivity with cloud-based machine learning models. We are looking for a machine learning engineer who can help us create the server-side engine that powers our interactive tools for AI based motion capture and motion synthesis. We are looking for someone who is deeply interested in the intersection of machine learning and systems design, and has extensive experience building web-based content creation applications. Responsibilities: Develop and train algorithms and models to power the motion perception and generation engine Design, build and manage large scale text, video and motion datasets for the training of multi-model motion perception and generation models Develop, deploy and optimize the inference frameworks for motion perception and generation on the cloud Research, analyze, develop and test machine learning components necessary for business strategies and roadmap Requirements: A BS or MS is required in Computer Science, Engineering specializing in computer vision, machine learning, robotics, or artificial intelligence Solid knowledge of at least one machine learning research framework (e.g. PyTorch, Tensorflow) Solid knowledge of at least one high-performance inference framework (e.g. TensorRT, Apache TVM) Experience profiling and optimizing deep neural networks, including knowledge of GPU profiling tools such as NVIDIA Nsight Nice to have: Familiarity with Python-based image and video manipulation/encoding/decoding frameworks, such as OpenCV and PyAV Experience with cloud orchestration systems such as Kubernetes and cloud providers such as AWS, GCP, and Azure Knowledge of transformers, diffusion models and multimodal discrimitive and generative models Ability to write robust and maintainable client-server architectures and APIs Please send your resume and cover letter to jobs@deepmotion.com",https://www.indeed.com/jobs?q=Machine+Learning+Engineer&l=San+Francisco%5D+%23%2C+CA&sc=0kf%3Aattr%28FCGTU%7CHFDVW%7CQJZM9%7CUTPWG%252COR%29explvl%28ENTRY_LEVEL%29jt%28fulltime%29%3B&vjk=a6191c240f75a634
1,b408b8391b20cc7b,Machine Learning Engineer,"San Francisco, CA",ENTRY_LEVEL,BACHELORS_DEGREE,fulltime,"Machine Learning Engineer - job post AICrete Corp. San Francisco Bay Area, CA Full-time Apply now Apply now save-icon Job details Job Type Full-time Our Company AICrete is a venture-backed startup focused on unlocking automation and machine learning in the concrete industry. Our innovative ""concrete mixture and testing-as-a-service"" model combines data, automation, and cutting-edge machine learning with a firm understanding of concrete materials science to enable concrete producers and contractors to make cost-effective, durable, and sustainable concrete mixes quickly, efficiently, and with minimal risk. Our mission is to make concrete mixture design and testing fast, cheap, and sustainable. Role Summary At AICrete, we are looking for a Machine Learning (ML) Engineer to design and develop machine learning and deep learning systems. Your responsibilities include data collection, cleaning, and preprocessing, creating machine learning models and retaining systems. To do this job successfully, you need exceptional skills in statistics and programming. If you also have knowledge of data science, data engineering, and software engineering, we'd like to meet you. Your ultimate goal will be to shape and build efficient self-learning applications. Duties and Responsibilities Study and transform data science prototypes Explore and visualize data to gain an understanding of it, identifying differences in data distribution that could affect performance Supervising the data acquisition process Verifying data quality and ensuring it via data cleaning Defining data augmentation pipelines Design machine learning systems Research and implement appropriate ML algorithms and tools Develop machine learning applications according to requirements Select appropriate datasets and data representation methods Run machine learning tests and experiments Perform analysis and hyper-parameter tuning Train and retain systems when necessary Extend existing ML libraries and frameworks Deploying models to production Keep abreast of developments in the field Qualifications Proven experience as a Machine Learning Engineer or similar role Deep understanding of data structures, data modeling, and software architecture Strong knowledge of math, probability, statistics, and algorithms Ability to write robust code in Python, Java, and R Familiarity with machine learning frameworks (like Keras, TensorFlow, PyTorch, etc.) and libraries (like scikit-learn, pandas, etc.) Experience in visualizing and manipulating big datasets Familiarity with Linux Ability to select hardware to run an ML model with the required latency Excellent communication skills and ability to work in a team Outstanding analytical and problem-solving skills Great attention to details, organizational skills, and an analytical mind Motivated by achieving goals and willing to learn and get results Act with integrity, keep commitments, and practice transparency BS in Computer Science Additional Qualifications Master's degree or PhD in Computer Science Familiarity with Reinforcement Learning Familiarity with Optimization Methods and Algorithms Benefits Health insurance (medical, dental, vision, and life) Equity in a fast-growing tech startup Unlimited paid time off Flexible work schedule Home office allowance for office set-up If you require alternative methods of application or screening, you must approach the employer directly to request this as Indeed is not responsible for the employer's application process.",https://www.indeed.com/jobs?q=Machine+Learning+Engineer&l=San+Francisco%5D+%23%2C+CA&sc=0kf%3Aattr%28FCGTU%7CHFDVW%7CQJZM9%7CUTPWG%252COR%29explvl%28ENTRY_LEVEL%29jt%28fulltime%29%3B&vjk=b408b8391b20cc7b
2,102a85a9dbdb0243,Machine Learning Engineer,"San Francisco, CA",ENTRY_LEVEL,BACHELORS_DEGREE,fulltime,"Machine Learning Engineer - Collision Avoidance System - job post Zoox (part of Amazon.com) 9 reviews Foster City, CA $173,000 - $246,000 a year -  Full-time Zoox 9 reviews Read what people are saying about working here. You must create an Indeed account before continuing to the company website to apply Apply on company site save-icon Job details Salary $173,000 - $246,000 a year Job Type Full-time The Collision Avoidance System (CAS) is responsible for detecting and reacting to imminent collision situations in support of our vehicle’s overall safety goals. CAS Perception is responsible for processing raw sensor data from our vehicle’s world-class sensor suite using a combination of geometric, interpretable algorithms and deep learning to detect near-collisions with obstacles along our intended driving path, in the most challenging dense urban environments and under tight compute resource constraints. Overall CAS is parallel and complementary to our Main AI autonomy stack, and has a close relationship with our vehicle hardware and safety teams in order to architect redundancy into our overall driving system. Responsibilities You will develop new algorithms that consume raw sensor data input to detect dynamic entities in the world You will leverage our large-scale machine learning infrastructure to discover new solutions and push the boundaries of the field You will engineer software that runs on-vehicle to efficiently execute our algorithms in real time You will develop metrics and tools to analyze errors and understand improvements of our systems You will collaborate with engineers on the other parts of CAS Perception, CAS Verification & Validation, CAS Planner, and the Main AI teams to solve the overall Autonomous Driving problem in complex urban environments Qualifications BS, MS, or PhD degree in computer science or related field Experience with training and deploying Deep Learning models Experience with production Machine Learning pipelines: dataset creation, training frameworks, metrics pipelines Fluency in C++ Extensive experience with programming and algorithm design Strong mathematics skills Bonus Qualifications Conference or Journal publications in Machine Learning or Robotics related venues Prior experience with Prediction and/or autonomous vehicles in general Fluency in Python Compensation There are three major components to compensation for this position: salary, Amazon Restricted Stock Units (RSUs), and Zoox Stock Appreciation Rights. The salary will range from $173,000 to $246,000. A sign-on bonus may be part of a compensation package. Compensation will vary based on geographic location, job-related knowledge, skills, and experience. Zoox also offers a comprehensive package of benefits including paid time off (e.g. sick leave, vacation, bereavement), unpaid time off, Zoox Stock Appreciation Rights, Amazon RSUs, health insurance, long-term care insurance, long-term and short-term disability insurance, and life insurance. Vaccine Mandate Employees working in this position will be required to have received a single dose of the J&J/Janssen COVID-19 vaccine OR have completed the two-dose Pfizer or Moderna vaccine series. In addition, employees will be required to receive a COVID-19 booster vaccine within two months of becoming eligible for the booster vaccine. Employees will be required to show proof of vaccination status upon receipt of a conditional offer of employment. That offer of employment will be conditioned upon, among other things, an Applicant’s ability to show proof of vaccination status. Please note the Company provides reasonable accommodations in accordance with applicable state, federal, and local laws. About Zoox Zoox is developing the first ground-up, fully autonomous vehicle fleet and the supporting ecosystem required to bring this technology to market. Sitting at the intersection of robotics, machine learning, and design, Zoox aims to provide the next generation of mobility-as-a-service in urban environments. We’re looking for top talent that shares our passion and wants to be part of a fast-moving and highly execution-oriented team. Follow us on LinkedIn A Final Note: You do not need to match every listed expectation to apply for this position. Here at Zoox, we know that diverse perspectives foster the innovation we need to be successful, and we are committed to building a team that encompasses a variety of backgrounds, experiences, and skills.",https://www.indeed.com/jobs?q=Machine+Learning+Engineer&l=San+Francisco%5D+%23%2C+CA&sc=0kf%3Aattr%28FCGTU%7CHFDVW%7CQJZM9%7CUTPWG%252COR%29explvl%28ENTRY_LEVEL%29jt%28fulltime%29%3B&vjk=102a85a9dbdb0243
3,85962f31fd69681f,Machine Learning Engineer,"San Francisco, CA",ENTRY_LEVEL,BACHELORS_DEGREE,fulltime,"Software Engineer, Data Science - job post Forward 22 reviews San Francisco, CA Full-time Forward 22 reviews Read what people are saying about working here. You must create an Indeed account before continuing to the company website to apply Apply on company site save-icon Job details Encouraged to Apply Fair chance Job Type Full-time Forward is on a bold mission to make high quality healthcare available to a billion people across the globe. We’re building the world’s most advanced healthcare platform from the ground up, combining hardware, software and doctors under one roof. We are scaling our engineering team and looking for world-class engineers with experience and expertise in Data Science, Machine Learning and AI. As an early member of our engineering team, you’ll have a key role in building the future of healthcare from first principles. Forward was founded in January 2016 by former executives and engineering leaders from Google and Uber. We are funded by some of the world's best investors and entrepreneurs including Founder's Fund, Khosla Ventures, First Round Capital, Eric Schmidt (Google/Alphabet Chairman), Marc Benioff (Salesforce Founder), Joe Lonsdale (Palantir Founder), Joshua Kushner (Oscar co-Founder) and Garrett Camp (Uber co-Founder). You can read our story here or check out a quick YouTube video. WHAT YOU'LL DO: Develop algorithms and design highly scalable software solutions for real world problems using data science and machine learning. Collaborate with domain experts in fields like AI and NLP. Our engineers made major contributions to projects such as Amazon Go and TensorFlow. Work with top-flight software and hardware engineering talent from places like Google, Amazon, Nvidia, Palantir, and NASA JPL. Own entire projects while working alongside cross-functional teams of doctors, designers, and operators. Your work will directly contribute to saving and improving people’s lives. For real. :) WHAT WE'RE LOOKING FOR: Impact - You’re deeply mission-driven and you think there’s more to life than software that enables puppy ears to be superimposed on photos. Although we concede those are cute. Data Science - You have experience developing production software involving building data models for consumer or industrial applications. You are familiar with robust and scalable infrastructure for visualization and presentation. Product passion - You care about the bits you ship ending up in users’ hands, and work backwards from user needs to come up with solutions to problems. Entrepreneurship - You’re a self-starter who loves to own things end-to-end. You don’t ask for permission - you’re too busy making things happen. Team player - You know how to make those around you better and feed off their energy. You take care of your teammates. Curiosity - You like to prototype mobile apps based on the latest psychological research in habit formation in your free time? You open sourced your own neural network library? Boy have we got some fun things for you… You have a BS, MS or PhD in computer science or a related field with focus on data science or machine learning. The base salary range for this full-time position is $100,000-$220,000, plus equity and benefits. The range displayed on each job posting reflects the minimum and maximum target for new hire salaries for the position across all locations. Within the range, individual pay is determined by factors including job-related skills, experience, relevant education or training, and location. WHY JOIN FORWARD? We don’t want to just move dollars around the healthcare industry - we want to rebuild it and fix it. All of it. You’d be a major part of the story behind one of the most ambitious startup attempts of the past decade and you’d work with a team of people who want to use their talents for good. We are an equal opportunity employer. In accordance with anti-discrimination law, it is the purpose of this policy to effectuate these principles and mandates. We prohibit discrimination and harassment of any type and affords equal employment opportunities to employees and applicants without regard to race, color, religion, sex, national origin, disability status, protected veteran status, or any other characteristic protected by law. We conform to the spirit as well as to the letter of all applicable laws and regulations. Pursuant to the San Francisco Fair Chance Ordinance and the Los Angeles Fair Chance Initiative for Hiring, we will consider for employment qualified applicants with arrest and conviction records. Information collected and processed as part of any job application you choose to submit is subject to Forward’s Privacy Notice to California Job Applicants.",https://www.indeed.com/jobs?q=Machine+Learning+Engineer&l=San+Francisco%5D+%23%2C+CA&sc=0kf%3Aattr%28FCGTU%7CHFDVW%7CQJZM9%7CUTPWG%252COR%29explvl%28ENTRY_LEVEL%29jt%28fulltime%29%3B&vjk=85962f31fd69681f
4,6e60e5181666e1f7,Machine Learning Engineer,"San Francisco, CA",ENTRY_LEVEL,BACHELORS_DEGREE,fulltime,"Software Engineer - Rider Support Tools - job post Zoox (part of Amazon.com) 9 reviews San Francisco, CA $160,000 - $225,000 a year -  Full-time Zoox 9 reviews Read what people are saying about working here. You must create an Indeed account before continuing to the company website to apply Apply on company site save-icon Job details Salary $160,000 - $225,000 a year Job Type Full-time Zoox is looking for a software engineer to help build our full-stack web-based platform for rider support operations. These internal tools are critical to the roll out of our robotaxi service. They will ensure that riders have a safe and enjoyable ride experience, provide quick and efficient support when necessary, and collect feedback and metrics to improve our autonomous driving business. You will work closely with autonomous driving software engineers and vehicle engineers to design feature-rich applications and identify new opportunities for internal tools at Zoox. Responsibilities Develop intuitive user interfaces with React, HTML & CSS Collaborate with engineers, product managers, designers to define and iterate on great solutions to their product needs Maintain high service uptime and stability as Zoox scales Solve complex technical challenges to deliver consistently great performance in a large and constantly evolving application Qualifications Bachelor's degree in an engineering, mathematics, or related field Expert developer experience with TypeScript and Node.JS Well-rounded understanding of one, or more, of the following web technologies: Map technology (mapbox, etc); Communication protocols (REST / Web Sockets / Protobuf); Video / audio streaming; Test automation ; Web development frameworks and tools (Yarn, eslint, Vite, swc, esbuild) Bonus Qualifications Experience with Amazon Web Services Experience integrating 3rd party software solutions Experience with full stack build and infrastructure tools (Bazel, Docker, Terraform) Experience with Linux and Shell scripting Experience with mobility-as-a-service and/or related products Compensation There are three major components to compensation for this position: salary, Amazon Restricted Stock Units (RSUs), and Zoox Stock Appreciation Rights. The salary range for this position is $160,000 to $225,000. A sign-on bonus may be offered as part of the compensation package. Compensation will vary based on geographic location and level. Leveling, as well as positioning within a level, is determined by a range of factors, including, but not limited to, a candidate's relevant years of experience, domain knowledge, and interview performance. The salary range listed in this posting is representative of the range of levels Zoox is considering for this position. Zoox also offers a comprehensive package of benefits including paid time off (e.g. sick leave, vacation, bereavement), unpaid time off, Zoox Stock Appreciation Rights, Amazon RSUs, health insurance, long-term care insurance, long-term and short-term disability insurance, and life insurance. Vaccine Mandate Employees working in this position will be required to have received a single dose of the J&J/Janssen COVID-19 vaccine OR have completed the two-dose Pfizer or Moderna vaccine series. In addition, employees will be required to receive a COVID-19 booster vaccine within two months of becoming eligible for the booster vaccine. Employees will be required to show proof of vaccination status upon receipt of a conditional offer of employment. That offer of employment will be conditioned upon, among other things, an Applicant’s ability to show proof of vaccination status. Please note the Company provides reasonable accommodations in accordance with applicable state, federal, and local laws. About Zoox Zoox is developing the first ground-up, fully autonomous vehicle fleet and the supporting ecosystem required to bring this technology to market. Sitting at the intersection of robotics, machine learning, and design, Zoox aims to provide the next generation of mobility-as-a-service in urban environments. We’re looking for top talent that shares our passion and wants to be part of a fast-moving and highly execution-oriented team. Follow us on LinkedIn A Final Note: You do not need to match every listed expectation to apply for this position. Here at Zoox, we know that diverse perspectives foster the innovation we need to be successful, and we are committed to building a team that encompasses a variety of backgrounds, experiences, and skills.",https://www.indeed.com/jobs?q=Machine+Learning+Engineer&l=San+Francisco%5D+%23%2C+CA&sc=0kf%3Aattr%28FCGTU%7CHFDVW%7CQJZM9%7CUTPWG%252COR%29explvl%28ENTRY_LEVEL%29jt%28fulltime%29%3B&vjk=6e60e5181666e1f7
