,job_id,job_title,location,experience,education,job_type,job_description,job_link
9,3999d86f0422eed7,Machine Learning Engineer,"San Francisco, CA",ENTRY_LEVEL,BACHELORS_DEGREE,fulltime,"Principal Data Scientist - job post PG&E Corporation 967 reviews Oakland, CA 94612 • Hybrid remote Full-time PG&E Corporation 967 reviews Read what people are saying about working here. You must create an Indeed account before continuing to the company website to apply Apply on company site save-icon Job details Job Type Full-time Requisition ID # 144688 Job Category: Accounting / Finance Job Level: Manager/Principal Business Unit: Information Technology Work Type: Hybrid Job Location: Oakland Department Overview The Data Science & Decision Science Department is both a “Delivery” team that is a sophisticated practitioner of data science and a “Center of Excellence” team that supports other practitioners in an enterprise-wide Hub & Spoke analytics adoption model. As a Delivery team, this Department uses industry leading data science and change management practices to drive PG&E’s transition to the sustainable grid of the future. The Department works cross-functionally across the company to enable data driven decisions applying analytics, as well as improvements to relevant business processes. Deployed to some of PG&E’s highest priority arenas, the Department does not specialize in a traditional utility domain, such as asset management or program administration, but instead specializes in extracting useful insights from disparate data sets and facilitating actions informed by these insights. As a Center of Excellence team, this Department listens to the needs of practitioners across the company, along with emerging industry practices, and builds standards, processes, tools, knowledge and best practices that meet the current and future needs of the enterprise. This team works on a wide variety of difficult problems, offering great variety in the work, and constant opportunity to explore and learn. Current and past engagements include: Creating wildfire risk models that are used by regulators and the utility to prioritize asset management Developing computer vision models that improve, accelerate, and automate asset inspections processes Predicting electric distribution equipment failure before it occurs, allowing for proactive maintenance Forming the analytical framework behind PG&E’s Transmission Public Safety Power Shutoff Optimizing non-wires alternative resource portfolios, like the Oakland Clean Energy Initiative, including location and resource adequacy considerations Analyzing customer demographic, program participation, and SmartMeter interval data to build program targeted propensity models, e.g. for customer owned distributed energy resource technologies Identifying and investigating anomalous customer natural gas usage, in order to resolve dangerous customer side leaks Position Summary PG&E is looking for two Principal Data Scientists with large experience in delivery of data science products as well as standards & processes development, but with specific focus on Center of Excellence programs. In this role the successful candidates will be uniquely positioned at the forefront of utility industry analytics, having the opportunity to advance PG&E’s triple bottom line of People, Planet, and Prosperity. Working as part of cross functional teams, including data engineers, data scientists, technologists, subject matter experts, and change management professionals – these individuals will co-lead the development of standards and best practices for strategic decision making and operational processes. They will also explore delivery opportunities and lead delivery work, as needed. This Delivery piece could be both hands-on and collaborating with other data science teams (depending on scope and complexity). The responsibilities of these positions include: Develop Standards and Processes as part of the Center of Excellence (COE) for data science based on research about PG&E analytic portfolio products, acting as a servant leader of delivery teams across the enterprise so said Standards and Processes facilitate strong and reliable product delivery for those teams. Advise others in data science matters as well as deliver hands-on data science work as part of the “Delivery” piece of the job. Support the identification and implementation of process improvement at the department level. Support building data science capability both within the Department and across the enterprise. Present findings and makes recommendations to officers and cross-functional management. Build and maintain strong relationships with business units and external agencies. PG&E is providing the salary range that the company in good faith believes it might pay for this position at the time of the job posting. This compensation range is specific to the locality of the job. The actual salary paid to an individual will be based on multiple factors, including, but not limited to, specific skills, education, licenses or certifications, experience, market value, geographic location, and internal equity. We would not anticipate that the individual hired into this role would land at or near the top half of the range described below, but the decision will be dependent on the facts and circumstances of each case.​ A reasonable salary range is: ​ Bay Area Minimum: $151,000.00 Bay Area Mid-point: $204,000.00 Bay Area Maximum: $257,000.00 &/OR​ California Minimum: $143,000.00 California Mid-point: $194,000.00 California Maximum: $244,000.00 This position is hybrid, working from your remote office and your assigned work location based on business need. The assigned work location will be within the PG&E Service Territory. Reporting Relationship This position reports to the Director, Enterprise Decision Science/Data Science & Analytics Products. Job Responsibilities: Works closely with domain experts to develop relevant domain knowledge in the electric and gas utility, as well as knowledge of related datasets. Documents data sources, methodology, and model evaluation metrics. Collaborates with analytics platform owners to prioritize and drive development of scalable data science capabilities. Mentors junior data scientists and drives standardization in process and toolsets across the data science community at PG&E. Works with enterprise leaders as an advocate for digital transformation of the business through the adoption of data science, analytics, and data-driven business processes. Applies machine learning and other analytical modeling methods to develop robust and reliable analytical models, including visualizations, within PG&E’s software development environment. Manages development of complex quantitative models and tools. Recognizes and prioritizes the most important work related to data science models to achieve highest operational impact for analytics in the business. Utilizes deep understanding of business drivers and financial levers to provide strategic decision support. Presents findings and makes recommendations to executive leadership and cross-functional management. Education Minimum Bachelor’s Degree in Computer Science, Econometrics, Economics, Engineering, Mathematics, Applied Sciences, Statistics or job-related discipline or equivalent experience. Experience Minimum Job-related experience (e.g., data analytics and modeling), 10 years, OR Master’s Degree and job-related experience, 8 years, OR Doctorate and job-related experience, 5 years. Knowledge, Skills, Abilities and (Technical) Competencies Proficiency with the elements of the data management lifecycle (data acquisition, security, storage, architecture, integration, governance, compliance, reference data management, data quality and metadata) and best practices Competency with relevant project management tools, theories and techniques as needed to support the timely and successful execution of project requirements Knowledge of industry trends and current issues in job-related area of responsibility as demonstrated through peer reviewed journal publications, conference presentations, open source contributions or similar activities Proficiency with commonly used data science and/or operations research programming languages, packages, and tools Expertise in data science/machine learning models and algorithms Proficient at systems thinking and structuring complex problems Proficiency in synthesizing complex information into clear insights and translating those insights into decisions and actions Ability to clearly communicate complex technical details and insights to colleagues, stakeholders, and leadership Knowledge of the mathematical and statistical fields that underpin data science Ability to develop, coach, teach and mentor others to meet both their career goals and the organization goals #featuredjob",https://www.indeed.com/jobs?q=Data+Scientist&l=San+Francisco%5D+%23%2C+CA&sc=0kf%3Aattr%28EXSNN%7CFCGTU%7CHFDVW%7CQJZM9%7CUTPWG%252COR%29explvl%28SENIOR_LEVEL%29jt%28fulltime%29%3B&vjk=3999d86f0422eed7
10,6dd4e270709392b4,Machine Learning Engineer,"San Francisco, CA",ENTRY_LEVEL,BACHELORS_DEGREE,fulltime,"Head of Data Science (Remote) - job post Tesorio San Francisco, CA • Remote Full-time You must create an Indeed account before continuing to the company website to apply Apply on company site save-icon Job details Job Type Full-time Tesorio has created a platform to help the Fortune 5,000,000 run as if they had a Fortune 500 finance team. We plug into a company’s data sources about cash in/out and our job is to leverage data science to surface the most impactful actions they can take to optimize their cash flow—and let them implement those actions with the click of a button. We’re looking for a talented leader for our small but mighty data team to help us ideate, design, and implement impactful data-driven features and reinvent how complex financial transactions can be simplified to the click of a button. We are developing machine learning algorithms to understand business cash needs, predictive algorithms to forecast future cash flow, and a sleek UI/UX to make our products enjoyable to work with. You’ll be joining an early-stage company with a small, tight-knit team, backed by top-tier VCs (including First Round, Floodgate, Fuel and Y Combinator). You’ll work closely with the entire engineering team and the co-founders. Learn more at tesorio.com. About You [Modeling / ML] Excited by solving hard technical statistical modeling and machine learning problems. Constantly stretching your toolbox of capabilities. Specific experience or knowledge in forecasting a big plus. [Strategy] Adept at partnering with product and engineering leadership to establish a clear strategy for data driven products and features [Product Experience] Enjoy building data products that elegantly leverage math/stats/machine learning to delight customers. [Hands on] Experience (preferably in AWS) deploying large-scale, production machine learning systems. Proficient with production code delivery in our current stack, which includes Astronomer/Airflow, S3, Snowflake, DBT, python, sci-kit learn, and Metabase [Startup mindset] Enjoys working on challenges in a fast-paced startup environment and delivering value to customers and to our business Ideal Candidate B.S./M.S. in Computer Science or equivalent experience preferred 8+ years of work experience, including 2+ as a manager of DS/ML in a strategic role Excited to lead a small but highly impactful and strategic team Player-coach who can make an impact either as a hands-on contributor or as a manager for their team Expert at translating strategy and ideas into concrete deliverables to move the needle for the business Strong communications skills Solid understanding of forecasting with time series / machine learning / deep learning techniques and tabular data Exciting Projects [Visualization] Help our users get deeper understanding of their customers based on their payment profiles [Predictive] Build large scale models with top banking partners to enable their customers to forecast and understand their cash flow [Visualization] Discover trends in how companies are growing and understand their financial situation [Language models] Leverage GPT language models to improve efficiency for our customers (e.g by performing sentiment analysis and suggesting email responses). [Matching/Recommendation] Enable customers to automatically match payment transactions from various data sources",https://www.indeed.com/jobs?q=Data+Scientist&l=San+Francisco%5D+%23%2C+CA&sc=0kf%3Aattr%28EXSNN%7CFCGTU%7CHFDVW%7CQJZM9%7CUTPWG%252COR%29explvl%28SENIOR_LEVEL%29jt%28fulltime%29%3B&vjk=6dd4e270709392b4
11,7989140edb0b8214,Machine Learning Engineer,"San Francisco, CA",ENTRY_LEVEL,BACHELORS_DEGREE,fulltime,"Sr. Mgr. of Quantitative Finance and Data Science - job post SunPower 160 reviews Richmond, CA 94804 • Hybrid remote $157,872 - $197,340 a year -  Full-time SunPower 160 reviews Read what people are saying about working here. Apply now Apply now save-icon Job details Salary $157,872 - $197,340 a year Job Type Full-time Do you want to change the world? We do, too. SunPower is changing the way our world is powered every day with a passionate and driven team of more than 3,660 full-time employees in North America and the Philippines. SunPower provides world-class solar solutions to residential customers across the U.S. with a commitment to a superior customer experience. We welcome forward thinkers, freedom chasers and all those demanding better, cleaner energy to join us. Sr. Manager, Quantitative Finance and Data Science SunPower’s mission is to change the way the world is powered. Solar is one of the fastest-growing industries in the US. Not only is solar energy clean; for most Americans it also saves money vs. buying power from the utility. Studies show that the #1 barrier to solar adoption is concern over upfront cost. The mission of the SunPower Financial team is to remove that barrier by making it cheap and easy for homeowners to go solar with no money down. Reporting to the Senior Director, Capital Markets, this role will design, implement, and own complex financial models in support of our residential solar loan and lease business. This includes transaction modeling, forecasting, scenario analysis, and stochastic analysis to measure risk. The solar industry enjoys a complex array of Federal and State incentives and tax benefits designed to spur solar adoption, build a green manufacturing sector in the US, and combat climate change. Maximizing the value of these unique benefits requires particularly complex financing arrangements, which in turn require advanced financial modeling capabilities. As the lead financial modeling expert of our team, you will be at the center of this complexity. Your models will be in production at the heart of our automated pricing and underwriting systems. You will be a trusted expert advisor to SunPower senior leadership on how to optimize the lease and loan business. This is a senior position that brings immediate opportunities for real-world impact. Your work will translate directly into savings for our customers, which in turn will lead to faster growth and meaningful P&L upside for SunPower. The ideal candidate has a track record building and operating complex financial and statistical models for asset-backed securities or project finance transactions, including running stress scenarios. Your understanding of statistical methods is robust. You are proficient in the tools of the quantitative practitioner, e.g. Python, R, and/or Matlab. You are comfortable working with very large datasets, and with modern scientific platforms such as Sagemaker, Azure ML, Datalab, etc. The ideal candidate will be an independent and curious thinker who can build robust, high performing models that will scale for the future, and can make convincing, information-based arguments to influence the direction of the company. This role has C-level visibility and requires delivery and operation of a complex set of solutions at a high bar for quality in a fast-paced environment. Superior analytical training and abilities are essential. Basic qualifications: Bachelors’ degree in Financial Engineering, Computer Science, Mathematics, Statistics, or similar technical field. 8+ years’ experience in a financial modeling role, with at least some of that period working on problems related to ABS, structured credit, and/or project finance transactions or investments. Proven ability to write performant code in at least one programming language (e.g. C, C++, Java, or Python). Proven ability to analyze large data sets and draw useful commercial conclusions. A sound understanding of fixed income mathematical concepts. A keen interest in solving analytical problems. Demonstrated ability to work in a fast-paced environment, prioritizing tasks to maximize value. Preferred qualifications: Master’s degree in an analytical area such as Financial Engineering, Computer Science, Mathematics, Statistics, or similar technical field. Experience with solar loan or lease transactions, especially tax equity partnerships. Experience with time series forecasting methods. Strong verbal/written communication and data presentation skills, including an ability to effectively communicate with both business and technical teams. Ability to be a trusted expert advisor and partner who can work cross-functionally, building and maintaining trust with internal stakeholders. Professional traits that are not unique to this position but necessary for SunPower leaders: Exhibits excellent judgment Hires great people. Develops great people Has relentlessly high standards Expects and requires innovation of their team Thinks big and has convictions Delivers results Has the innate ability to inspire passion in others Pay Range $157,872-197,340* Other rewards may include annual bonus eligibility, short and long-term incentives, and a comprehensive and competitive benefits program which includes health insurance coverage, employee wellness, life and disability insurance, a retirement savings plan, paid holidays, paid time off, and so much more. Please note the pay range provided is a good faith estimate for this position only and in the geographical location noted. Don’t meet every single requirement? Studies have shown that women and underrepresented minorities are less likely to apply to jobs unless they meet every single qualification. At SunPower, we are dedicated to building a diverse, inclusive, and authentic workplace, so if you’re excited about this role but your past experience doesn’t align perfectly with every qualification in the job description, we encourage you to apply anyway. You may be just the right candidate for this or other roles. Equal Employment Opportunity The Company is an equal employment opportunity employer and makes employment decisions, including but not limited to, hiring, firing, promotion, demotion, training, and/or compensation, on the basis of merit. Employment decisions are based on an individual’s qualifications as they relate to the job under consideration. The Company’s policy prohibits unlawful discrimination based on sex (which includes pregnancy, childbirth, breastfeeding, or related medical conditions, the actual sex of the individual, or the gender identity or gender expression), race, color, religion, including religious dress practices and religious grooming practices, sexual orientation, national origin, ancestry, citizenship, marital status, familial status, age, physical disability, mental disability, medical condition, genetic information, protected veteran or military status, or any other consideration made unlawful by federal, state or local laws, ordinances, or regulations. The Company is committed to complying with all applicable laws providing equal employment opportunities. This commitment applies to all persons involved in the operations of the Company and prohibits unlawful discrimination by any employee of the Company, including supervisors and co-workers. EOE Minorities/All Genders/Protected Veterans/Disabled SunPower Supports EEO Accommodation for Applicants to SunPower Corporation SunPower Corporation is an Equal Employment Opportunity / Affirmative Action employer and provides reasonable accommodation for qualified individuals with disabilities and disabled veterans in job application procedures. If you have any difficulty using our online system and you need a reasonable accommodation due to a disability, you may use the following alternative email address to contact us about your interest in employment at SunPower Corporation: jobs@sunpower.com. Please indicate in the subject that line of your email that you are requesting accommodation. Only candidates being considered for a position who require an accommodation will receive a follow-up response. NOTICE TO ALL APPLICANTS AND EMPLOYEES Availability of Affirmative Action Plan for Review SunPower is a federal government contractor. As a part of the Company’s obligations under law, it must develop a written Affirmative Action Program (AAP) for the Disabled, Recently Separated Veterans, Armed Forces Service Medal Veterans, Disabled Veterans and Active Duty Wartime Or Campaign Badge Veterans and for Women and Minorities as specified by law. Non-confidential and non-proprietary aspects of the AAP are available for inspection by applicants and employees, consistent with applicable law, which will be made available during office hours by contacting the EEO Officer. If you require alternative methods of application or screening, you must approach the employer directly to request this as Indeed is not responsible for the employer's application process.",https://www.indeed.com/jobs?q=Data+Scientist&l=San+Francisco%5D+%23%2C+CA&sc=0kf%3Aattr%28EXSNN%7CFCGTU%7CHFDVW%7CQJZM9%7CUTPWG%252COR%29explvl%28SENIOR_LEVEL%29jt%28fulltime%29%3B&vjk=7989140edb0b8214
