,job_id,job_title,location,experience,education,job_type,job_description,job_link
30,3520629b92e86a70,Machine Learning Engineer,"San Francisco, CA",ENTRY_LEVEL,BACHELORS_DEGREE,fulltime,"Senior Web Developer - job post Curacao 250 reviews Los Angeles, CA 90015 $100,000 a year -  Full-time Curacao 250 reviews Read what people are saying about working here. Apply now Apply now save-icon Job details Salary $100,000 a year Job Type Full-time POSITION SUMMARY We are looking for experienced Sr. Web Developer who can be responsible for the development, maintenance of online websites. FUNCTIONS AND RESPONSABILITIES Developer will be responsible for data exchange and system integrations utilizing third party feeds, Web Services/API’s etc. As a senior member of the team, you will be expected to drive throughout development life cycle. Proven ability to translate business needs into technical solutions, develop, implement and troubleshoot production issues, ability to work well under tight schedules. SKILLS & ABILITIES (Technical Skills/ knowledge required) Experience with PHP, CodeIgniter, AJAX, JavaScript framework Experience with MySQL Database 3+ Years of experience with any framework Laravel or Zend or Symphony Experience with Building Web Services/API’s of REST, CURL, SOAP Secure development using GitHub experience with AWS cloud is a plus. Education B.S degree in related field or relevant work experience Job Type: Full-time Pay: $100,000.00 per year Benefits: Life insurance Paid time off Experience level: 5 years Schedule: 10 hour shift 8 hour shift Holidays Overtime Weekend availability Ability to commute/relocate: Los Angeles, CA 90015: Reliably commute or planning to relocate before starting work (Required) Experience: Front-end development: 1 year (Preferred) CSS: 1 year (Preferred) Angular: 1 year (Preferred) Work Location: In person If you require alternative methods of application or screening, you must approach the employer directly to request this as Indeed is not responsible for the employer's application process.",https://www.indeed.com/jobs?q=Software+Engineer&l=Los+Angeles%2C+CA&sc=0kf%3Aattr%28FCGTU%7CHFDVW%7CQJZM9%7CUTPWG%252COR%29explvl%28SENIOR_LEVEL%29jt%28fulltime%29%3B&radius=50&start=20&pp=gQAeAAAAAAAAAAAAAAAB_gjX5AAsAQEBBwEJvQHFEMEhEZR-SpeRCboum6lqVxyH7dA1CuzjW3Do-BZjZBggoiUAAA&vjk=3520629b92e86a70&advn=3321509883129033
31,6ef8987efc25c672,Machine Learning Engineer,"San Francisco, CA",ENTRY_LEVEL,BACHELORS_DEGREE,fulltime,"Senior Software Engineer - job post FEI-Zyfer Inc 5 reviews Garden Grove, CA 92845 $120,000 - $170,000 a year -  Full-time FEI-Zyfer Inc 5 reviews Read what people are saying about working here. Responded to 75% or more applications in the past 30 days, typically within 7 days. Apply now Apply now save-icon Job details Salary $120,000 - $170,000 a year Job Type Full-time Full-Time Position U.S. Citizenship Required for this Position Req #156 Senior Software Engineer Brief Description of Job Duties: Programming RTOS embedded systems and GUI using C/C++ Develop device drivers: RS232, SPI, I2C, Ethernet PHY, flash memory Develop and enhance networking protocol stacks: TCP/IP, SNMP, NTP, PTP, SSH Programming control and maintenance applications using C/C++ Maintain and enhance time and frequency product family Involving in system firmware quality verification Involving in product specifications, design software specification, and support of whole products lifecycle from concept through manufacturing and deployment JOB REQUIREMENTS The applicant MUST have the following qualifications: BSCE/BSEE or higher required U.S. Citizenship required Minimum of 7 years in developing firmware for embedded systems using C and C++ Knowledge of 64/32/16 bits CPU or microcontrollers hardware architecture. 10 or more years’ experience in embedded multitasking RTOS such as VxWorks, QNX, MQX or equivalent 5 or more years’ experience in device driver development: SPI, I2C, CAN, RS232, EEROM Good knowledge of SW system architecture, structured software development environments Know how to use/setup/configure common Electronic Test Equipment: Oscilloscope, EEPROM programmer, etc. Excellent troubleshooting skills Excellent written and verbal communication skills Self-motivated Attention to Detail Effectively manage time and tasks Ability to work on projects alone or as part of a team Additional Desirable Experiences: Knowledge of Visual Studio C++/C# Linux operating systems Knowledge of Scripting Languages: Python, Perl, etc. 1553 protocol Knowledge of GPS receivers E-Verify As a Federal Contractor, FEI-Zyfer is required to participate in the E-Verify Program to confirm eligibility to work in the United States. For information regarding your legal rights and protections, please click on the following links: E-Verify - https://e-verify.uscis.gov/web/media/resourcesContents/E-Verify_Participation_Poster.pdf Right to Work - https://www.e-verify.gov/sites/default/files/everify/posters/IER_RighttoWorkPoster.pdf AAP/EEO/Reasonable Accommodation As a federal government contractor, in accordance with applicable laws, regulations, Executive Orders, FEI-Zyfer, Inc. is required to develop annual Affirmative Action Plans (AAPs) and is committed to employ and advance in employment qualified minorities, women, individuals with disabilities, and protected veterans (including but not limited to, disabled veterans, recently separated veterans, Armed Forces service medal veterans, and any other protected veterans). Any employees or applicants who wish to review the Affirmative Action Plan (AAP) for individuals with Disabilities and Protected Veterans can contact us by calling Human Resources at (714) 933-4000. FEI-Zyfer expressly prohibits discrimination based on any protected status, workplace harassment/bullying, and retaliation for filing a complaint or providing information related to a complaint. FEI-Zyfer, Inc. provides equal employment opportunities (EEO) to all employees and applicants for employment without regards to race/ethnicity, color, ancestry, religion, creed, sex/gender, gender identity/expression, sexual orientation, marital/parental status, pregnancy/childbirth or related conditions, national origin, age, disability, genetic information, veteran status, or any other protected status. EEO is the law; go to https://www.dol.gov/ofccp/regs/compliance/posters/pdf/eeopost.pdf to find out more. If you are an individual with a disability or a disabled veteran and require reasonable accommodation in applying for any posted position, please contact Human Resources at (714) 933-4000. Job Type: Full-time Pay: $120,000.00 - $170,000.00 per year Benefits: 401(k) 401(k) matching Dental insurance Employee assistance program Flexible schedule Flexible spending account Health insurance Health savings account Life insurance Paid time off Parental leave Referral program Retirement plan Tuition reimbursement Vision insurance Schedule: Day shift Ability to commute/relocate: Garden Grove, CA 92841: Reliably commute or planning to relocate before starting work (Required) Experience: Embedded software: 7 years (Required) Work Location: One location Health insurance If you require alternative methods of application or screening, you must approach the employer directly to request this as Indeed is not responsible for the employer's application process.",https://www.indeed.com/jobs?q=Software+Engineer&l=Los+Angeles%2C+CA&sc=0kf%3Aattr%28FCGTU%7CHFDVW%7CQJZM9%7CUTPWG%252COR%29explvl%28SENIOR_LEVEL%29jt%28fulltime%29%3B&radius=50&start=20&pp=gQAeAAAAAAAAAAAAAAAB_gjX5AAsAQEBBwEJvQHFEMEhEZR-SpeRCboum6lqVxyH7dA1CuzjW3Do-BZjZBggoiUAAA&vjk=6ef8987efc25c672&advn=3552926748207387
32,16518e842ec950d2,Machine Learning Engineer,"San Francisco, CA",ENTRY_LEVEL,BACHELORS_DEGREE,fulltime,"Sr. UI/UX Software Engineer - job post industrial dynamics 11 reviews Torrance, CA 90505 $120,000 - $180,000 a year -  Full-time industrial dynamics 11 reviews Read what people are saying about working here. Apply now Apply now save-icon Job details Salary $120,000 - $180,000 a year Job Type Full-time Job Summary: The Senior UI/UX Software Engineer is responsible for the design of the UI architecture and development of the UI software, UI software components, and UI applications for food and beverage container inspection systems on high-speed production lines. The Senior UI/UX Software Engineer will play a pivotal role in design and implementation of the communication infrastructure within the inspection system, externally with devices on customer networks, and in cloud-based applications. The Senior UI/UX Software Engineer will be expected to work in collaboration with other members of the software and electronics teams. Essential Duties and Responsibilities: Design UI architecture suitable for touch screen-only industrial applications Design, develop, and implement UI components for real-time display of image data Design, develop, and implement UI components for seamless, user-friendly setup of imaging applications Design, develop, and implement intuitive screen layouts and workflows for enhanced user experience Develop graphical user interface software components and applications for inspection of moving containers on high-speed conveyor production lines Develop interfaces for the UI software to interact with real-time inspection, measurement, and control components of the inspection systems Integrate the UI software and applications into the inspection and control platform Design, develop, and implement communication protocols for real-time parameter setting and data collection Design, develop, and implement cloud-based communication protocols for higher-level data management applications Maintenance, troubleshooting, and debugging of legacy UI and communication-related software Knowledge, Skills, and Abilities: 10+ years of current experience in UI components and/or applications development with Java, Qt, Python, and/or other UI development languages and environments 10+ years of current experience with C/C++ 10+ years of current experience developing applications on cross-functional platforms (i.e., Linux and Windows) 10+ years of current experience with UX development, with a focus on ease of use Experience interfacing with relational databases (e.g., SQL, MySQL) Experience with communications protocols (e.g., MQTT, OPC-UA, Modbus TCP, HTTP, Serial Communications) Experience developing industrial graphical HMI’s Experience integrating with real-time systems and/or real-time embedded systems a plus General knowledge about machine vision equipment (cameras, lighting, processors, etc.) is a plus Experience developing web-based interfaces for embedded systems a plus Comfortable working in a fast-paced market-driven environment Experience working in teams with Agile workflows and integrated development operations Experience mentoring junior team members Minimum education and work experience required: B.S. degree in Computer Science, M.S. preferred 10+ years experience in UI/UX software development Experience writing software for real-time applications on complex systems If you require alternative methods of application or screening, you must approach the employer directly to request this as Indeed is not responsible for the employer's application process.",https://www.indeed.com/jobs?q=Software+Engineer&l=Los+Angeles%2C+CA&sc=0kf%3Aattr%28FCGTU%7CHFDVW%7CQJZM9%7CUTPWG%252COR%29explvl%28SENIOR_LEVEL%29jt%28fulltime%29%3B&radius=50&start=20&pp=gQAeAAAAAAAAAAAAAAAB_gjX5AAsAQEBBwEJvQHFEMEhEZR-SpeRCboum6lqVxyH7dA1CuzjW3Do-BZjZBggoiUAAA&vjk=16518e842ec950d2
33,62822a581f79c7a0,Machine Learning Engineer,"San Francisco, CA",ENTRY_LEVEL,BACHELORS_DEGREE,fulltime,"Sr. Software Engineer - job post BAXTER 3,974 reviews Irvine, CA $68,000 - $156,000 a year -  Full-time BAXTER 3,974 reviews Read what people are saying about working here. You must create an Indeed account before continuing to the company website to apply Apply on company site save-icon Job details Salary $68,000 - $156,000 a year Job Type Full-time This is where you save and sustain lives At Baxter, we are deeply connected by our mission. No matter your role at Baxter, your work makes a positive impact on people around the world. You’ll feel a sense of purpose throughout the organization, as we know our work improves outcomes for millions of patients. Baxter’s products and therapies are found in almost every hospital worldwide, in clinics and in the home. For over 85 years, we have pioneered significant medical innovations that transform healthcare. Together, we create a place where we are happy, successful and inspire each other. This is where you can do your best work. Join us at the intersection of saving and sustaining lives— where your purpose accelerates our mission. Your role at Baxter Your talent is needed across a wide variety of industries. As a Software Engineer , you have a wide array of career choices, but are motivated by the opportunity to work in a company that supports innovation, professional development, and a purposeful mission. Your team We are a team of inquisitive individuals who embrace a collaborative environment to tackle sophisticated challenges that meet the needs of our patients. In this role you will have the opportunity to lead by example and enjoy mentoring and learning from others. Here, you are trusted to manage your own time and are given opportunities to grow your career as you wish. What you'll be doing: You will be working on new product development for the Non-Invasive Ventilation products. Generate software requirements, designs, code and V&V protocols. Support human factors and usability workstreams to assure that products can be successfully validated and fulfill user needs. Collaborate with the Program Manager, R&D management, and other technical team members to assure that project plans are comprehensive and complete. Direct and drive the technical aspects of the embedded software used to run the device. Develop embedded software in accordance with FDA design controls. Prepare and present technical design reviews. Direct technician(s) and other assigned personnel to complete builds, testing, documentation on an as-needed basis. Plan, execute, and deliver all required Design History File (DHF) artifacts for assigned designs in a timely manner. What you'll bring: BS in Computer Science or related field required with 5 + years of experience or Masters with 3+ years Embedded system development experience Software development experience with RTOS and/or bare metal C/C++ experience is a must Software requirements, design and unit tests documentation experience required Bluetooth communication and DevOps experience are a plus We understand compensation is an important factor as you consider the next step in your career. At Baxter, we are committed to equitable pay for all our employees, and we strive to be more transparent with our pay practices. To that end, this position has a base salary range of $68,000 to $156,000 plus an annual incentive bonus. The above range represents the expected base salary range for this position. The actual salary may vary based upon several factors including, but not limited to, relevant skills/experience, time in the role, business line, and geographic/office location. #LI-MS1 #IND-USGBRD The successful candidate for this job may be required to verify that he or she has been vaccinated against COVID-19, subject to reasonable accommodations for individuals with medical conditions or religious beliefs that prevent vaccination, and in accordance with applicable law. Equal Employment Opportunity Baxter is an equal opportunity employer. Baxter evaluates qualified applicants without regard to race, color, religion, gender, national origin, age, sexual orientation, gender identity or expression, protected veteran status, disability/handicap status or any other legally protected characteristic. EEO is the Law EEO is the law - Poster Supplement Pay Transparency Policy Reasonable Accommodations Baxter is committed to working with and providing reasonable accommodations to individuals with disabilities globally. If, because of a medical condition or disability, you need a reasonable accommodation for any part of the application or interview process, please click on the link here and let us know the nature of your request along with your contact information. Recruitment Fraud Notice Baxter has discovered incidents of employment scams, where fraudulent parties pose as Baxter employees, recruiters, or other agents, and engage with online job seekers in an attempt to steal personal and/or financial information. To learn how you can protect yourself, review our Recruitment Fraud Notice. 093189",https://www.indeed.com/jobs?q=Software+Engineer&l=Los+Angeles%2C+CA&sc=0kf%3Aattr%28FCGTU%7CHFDVW%7CQJZM9%7CUTPWG%252COR%29explvl%28SENIOR_LEVEL%29jt%28fulltime%29%3B&radius=50&start=20&pp=gQAeAAAAAAAAAAAAAAAB_gjX5AAsAQEBBwEJvQHFEMEhEZR-SpeRCboum6lqVxyH7dA1CuzjW3Do-BZjZBggoiUAAA&vjk=62822a581f79c7a0
34,9229dda7ae41ce0b,Machine Learning Engineer,"San Francisco, CA",ENTRY_LEVEL,BACHELORS_DEGREE,fulltime,"Senior Software Development Engineer. Contract - HyBrid - job post Beola Le'Shaun Consulting Irvine, CA 92606 • Hybrid remote Full-time Apply now Apply now save-icon Job details Job Type Full-time Contract Client is Seeking a Senior Software Development Engineer - Hybrid Local Candidates Only Irvine, CA Job type: Contract, HYBRID Contract duration: 6 Months Desired start date: 03/13/2023 Job function: Information Technology Industry: Consumer Electronics Experience level: Mid-senior Education level: Bachelors degree Job classification: Professional Location: Irvine, CA Skills: IT, Information Technology, Software Engineering Experience required: 2 YearsRelocation assistance: No, Local candidates only Number of positions: 1 EOC JOB DESCRIPTION: This position offers a hybrid work schedule requiring you to be in the office Monday and Wednesday with an option to work from home the remainder of the week (unless a specific business need arises requiring in office attendance on other days). Note that work schedules and office reporting requirements may change from time to time based on business needs. We have an exciting opportunity in Irvine, CA to work in a fast-paced and challenging environment to develop new technologies and applications. We are looking for someone who: loves to try new things and making them work has an entrepreneurial spirit develops working code in a variety of languages enjoys working in a broadly skilled (from research to development) collaborative team on cutting edge technologies The ideal candidate will Be responsible for working in software development for a variety of platforms (cloud, VR, web, mobile, desktop). Experienced in one or more of the following: o Unreal Engine based development o C++ o Python o Have knowledge and/or experience in imaging QUALIFICATIONS: Bachelor's degree or higher and minimum 1 years of related experience Strong written and oral communication skills A history of innovative thinking WORK ENVIRONMENT: The software development team is currently working in a hybrid environment with a combination of on-site (up to two days per week) and remote work. If interested in this position please submit your resume.Please no phone calls, walk-ins, recruiters, C2C, LLCs or other agencies. EOE - Indigenous People, Black, People of Colour, Women identified, non-binary, LGBTTBQ2+ individuals are encouraged to apply Beola Le'Shaun Consulting: ID3#QY3R9Y79 If you require alternative methods of application or screening, you must approach the employer directly to request this as Indeed is not responsible for the employer's application process.",https://www.indeed.com/jobs?q=Software+Engineer&l=Los+Angeles%2C+CA&sc=0kf%3Aattr%28FCGTU%7CHFDVW%7CQJZM9%7CUTPWG%252COR%29explvl%28SENIOR_LEVEL%29jt%28fulltime%29%3B&radius=50&start=20&pp=gQAeAAAAAAAAAAAAAAAB_gjX5AAsAQEBBwEJvQHFEMEhEZR-SpeRCboum6lqVxyH7dA1CuzjW3Do-BZjZBggoiUAAA&vjk=9229dda7ae41ce0b
35,a9db1ed52d588ae7,Machine Learning Engineer,"San Francisco, CA",ENTRY_LEVEL,BACHELORS_DEGREE,fulltime,"Senior Software Engineer - job post Atkinson Aeronautics Woodland Hills, CA 91367 From $180,000 a year -  Full-time Apply now Apply now save-icon Job details Salary From $180,000 a year Job Type Full-time Atkinson Aeronautics & Technology Inc. is Hiring! Systems/Software Engineer Full Time – Immediate Start Woodland Hills, CA Summary: Candidate will support an engineering and manufacturing environment in aerospace and be familiar with end to end DO-178 requirements. The ideal candidate has working knowledge with the third iteration of the FAA’s avionics software standard and will ensure software performs and functions at this level. Experience with multiple programing languages, software testing and development programs is a plus. Minimum Qualifications: Bachelor’s degree in Systems/Software Engineering, Computer Science, or related field 7+ years of experience developing, creating, and maintaining operating systems/software 7+ years of experience with engineering and manufacturing environment in aerospace, with specific work experience in end to end DO-178 requirements Able to work in a multi-team environment with limited supervision Excellent written and verbal communication skills Experience determining Item Development Assurance Levels (IDAL) Expertise in the Safety Assessment Process and Hazard Analysis Must hold a Secret Clearance Preferred Qualifications: Solid skills with Microsoft 365: Outlook, Word, PowerPoint, SharePoint, Excel, and Teams Familiar with Software Consideration in Airborne Systems & Equipment Certification Familiarity working on DoD programs/systems Benefits We Have to Offer: Health Dental Vision STD/LTD Insurance Life/AD&D Insurance 401K Retirement Plan – including up to a 6% dollar-for-dollar match PTO (Paid time off) All Federal Paid Holidays Tuition Assistance and professional training Employee Assistance Program Competitive salary based on experience and technical qualifications Travel Required: Less than 10% If you require alternative methods of application or screening, you must approach the employer directly to request this as Indeed is not responsible for the employer's application process.",https://www.indeed.com/jobs?q=Software+Engineer&l=Los+Angeles%2C+CA&sc=0kf%3Aattr%28FCGTU%7CHFDVW%7CQJZM9%7CUTPWG%252COR%29explvl%28SENIOR_LEVEL%29jt%28fulltime%29%3B&radius=50&start=20&pp=gQAeAAAAAAAAAAAAAAAB_gjX5AAsAQEBBwEJvQHFEMEhEZR-SpeRCboum6lqVxyH7dA1CuzjW3Do-BZjZBggoiUAAA&vjk=a9db1ed52d588ae7
36,0cd649f8f7ed1fd0,Machine Learning Engineer,"San Francisco, CA",ENTRY_LEVEL,BACHELORS_DEGREE,fulltime,"Senior Fullstack Software Engineer - job post Cover Technologies Gardena, CA 90247 Full-time You must create an Indeed account before continuing to the company website to apply Apply on company site save-icon Job details Job Type Full-time Redefine how homes are designed, built, and lived in by joining our team as our newest software engineer. We're looking for someone to design, architect, and implement web applications for both client-facing and internal use. - You will be responsible for the end-to-end development of serverless web applications, from gathering requirements and designing the interface, to architecting and implementing both the data model and the interface. You’ll be expected to take a concept to a working prototype, to a production app in short periods of time. - You will be working alongside a small team of software engineers, with many opportunities to collaborate while also maintaining complete ownership of your own projects. - Collaborate with Cover’s multi-disciplinary team of software engineers, aerospace and automotive mechanical engineers, architects, and operations, marketing, design, and construction professionals to solve a wide range of problems. - Take on a wide variety of projects touching different parts of the business, from helping clients configure and understand their new home with full visualizations, to creating the crucial internal interfaces needed to efficiently design, manufacture, and assemble Cover homes. - You will be expected to mentor and set a good example for junior engineers as the team grows. - At least 6 months experience writing and launching production-quality web interfaces and services - Experience with at least one of the common frameworks: Vue.js, Angular, or React. Vue.js preferred - Experience designing REST-based API services - Strong familiarity with Javascript and Python - Comfortable working with HTML and CSS - Strong CS fundamentals - Can produce working code quickly without sacrificing quality. - BS/MS in computer science or related field preferred - Experience in related industries such as manufacturing or construction strongly preferred - Strong verbal and written communication - Can-do, get-it-done attitude",https://www.indeed.com/jobs?q=Software+Engineer&l=Los+Angeles%2C+CA&sc=0kf%3Aattr%28FCGTU%7CHFDVW%7CQJZM9%7CUTPWG%252COR%29explvl%28SENIOR_LEVEL%29jt%28fulltime%29%3B&radius=50&start=20&pp=gQAeAAAAAAAAAAAAAAAB_gjX5AAsAQEBBwEJvQHFEMEhEZR-SpeRCboum6lqVxyH7dA1CuzjW3Do-BZjZBggoiUAAA&vjk=0cd649f8f7ed1fd0
