,job_id,job_title,location,experience,education,job_type,job_description,job_link
8,3be7dc99d859ad8e,Machine Learning Engineer,"San Francisco, CA",ENTRY_LEVEL,BACHELORS_DEGREE,fulltime,"Network App Engineer - job post Baanyan Software Services 4 reviews 212 3rd Ln, South San Francisco, CA 94080 $50 - $63 an hour -  Full-time, Contract Baanyan Software Services 4 reviews Read what people are saying about working here. Apply now Apply now save-icon Job details Salary $50 - $63 an hour Job Type Full-time Contract Hello , Please find the requirement below and share the resumes. Position: Network App Engineer Location: San Francisco, CA (Day one onsite) Minimum Requirements: Education: Bachelor’s degree Field of Study: Information Technology, Information Systems, Engineering, or a related field Experience: Five (5) years’ experience in job offered or related position Engineer Requirements: Experience in Applications development and maintenance. Experience in designing and implementing Cloud based (SAAS) Vendor applications. Knowledge in System and Network Architecture Design (ITTAP). Knowledge in Security Configurations – Encryption, Authentication models. Experience with Agile/Scrum processes/tools like JIRA, Confluence. Experience with Change Control process, System and Process documentation. Preferred: Knowledge of AWS Architecture. Any Practitioner or Associate level AWS certification. Preferred: Knowledge in Security – Data, information security, Encryption. Preferred: Experience in any programming language. Job Description: Create system Physical, Network and Logical diagrams for Architecture and Design. Support the process of translating business needs into formal technical requirements and subsequent technical solution deliverables. Work with vendor on business needs. Understand system capacity and limitations. Assist the Tech Lead in maintaining relations with Business Stakeholders, vendors, and other technical teams Serve as a fully seasoned, proficient technical architect, engineer, designer, and subject matter expert in risk and compliance technology. Participate as an individual contributor on projects, and in completing activities as a part of a team, relating to special initiatives and/or operations. Perform enhancement and maintenance activities in support of all applications in the Regulatory and Compliance technology ecosystem, utilizing technical capabilities with various tools. Analyze and troubleshoot/remediate issues with both internally developed and vendor packaged solutions supporting the ecosystem. Utilize and perform various phases of the software development life cycle, including requirement analysis; preparation of high-level program technical specifications after analyzing business requirements, business operations, process modeling, software architecture, logical/functional ecosystem composition, and data analysis/mapping/lineage; and design, development, testing, implementation, documentation and troubleshooting of various capacities ranging from Team Member to a Project Leader under tight deadlines. Thanks & Best Regards, Job Types: Full-time, Contract Salary: $50.00 - $63.00 per hour Schedule: 8 hour shift Ability to commute/relocate: South San Francisco, CA 94080: Reliably commute or willing to relocate with an employer-provided relocation package (Required) Experience: Computer networking: 6 years (Preferred) LAN: 1 year (Preferred) Security clearance: Confidential (Preferred) Work Location: One location Speak with the employer +91 7842516676 If you require alternative methods of application or screening, you must approach the employer directly to request this as Indeed is not responsible for the employer's application process.",https://www.indeed.com/jobs?q=Software+Engineer&l=San+Francisco%5D+%23%2C+CA&sc=0kf%3Aattr%28FCGTU%7CHFDVW%7CQJZM9%7CUTPWG%252COR%29explvl%28MID_LEVEL%29jt%28contract%29%3B&start=10&pp=gQAPAAAAAAAAAAAAAAAB_coMuwALAQAPktdjWCW_OoYAAA&vjk=3be7dc99d859ad8e
9,880c46bf8622de27,Machine Learning Engineer,"San Francisco, CA",ENTRY_LEVEL,BACHELORS_DEGREE,fulltime,"Clinical SAS Programmer - job post Katalyst Healthcares & Life Sciences San Mateo, CA Contract Apply now Apply now save-icon Job details Job Type Contract Responsibilities: Interface/liaise with a variety of end users and can think holistically about data review approaches that will support Risk Based Monitoring, clinical review and other data related initiatives. Can think strategically regarding broad scope analytic solutions, including appropriate infrastructure and technological requirements. Leverage technical expertise to define feasible solutions and drive strategic use and implementation of new reports/visualizations, including any applicable training material. Can proactively identify data review gaps in current processes and projects and lead/drive discussions to define new opportunities for data review tools. Can interpret and translate a data review business need into a tangible report/visualization. Can create/develop prototypes for new solutions as applicable. As required by business needs, able to lead large scale cross-functional projects which require strong stakeholder management and project management skills. Requirements: BS computer science, programming, data management, scientific or analytic discipline with 5 years' experience in the Pharmaceutical Industry focused in the clinical trial space. Experience with varied reporting and analytic tools, Spotfire, Tableau, Qlik, Review, SAS, and/or SQL Emphasis in Biostatistics a plus Strong understanding of relational databases Varied Therapeutic Area knowledge. Strong analytic and problem-solving skills Proficient in stakeholder engagement and management If you require alternative methods of application or screening, you must approach the employer directly to request this as Indeed is not responsible for the employer's application process.",https://www.indeed.com/jobs?q=Software+Engineer&l=San+Francisco%5D+%23%2C+CA&sc=0kf%3Aattr%28FCGTU%7CHFDVW%7CQJZM9%7CUTPWG%252COR%29explvl%28MID_LEVEL%29jt%28contract%29%3B&start=10&pp=gQAPAAAAAAAAAAAAAAAB_coMuwALAQAPktdjWCW_OoYAAA&vjk=880c46bf8622de27
10,4c2efc8c7012ccb1,Machine Learning Engineer,"San Francisco, CA",ENTRY_LEVEL,BACHELORS_DEGREE,fulltime,"RF Design Engineer - job post GTA (Global Technology Associates) (part of Kelly) Walnut Creek, CA $95,000 - $105,000 a year -  Full-time, Contract Responded to 51-74% of applications in the past 30 days, typically within 12 days. Apply now Apply now save-icon Job details Salary $95,000 - $105,000 a year Job Type Full-time Contract Looking for RF Design Engineers - Walnut Creek CA. What you will be doing as RF Design Engineer: Perform RF design activities related to building the first standalone 5G broadband network in the US. Optimize the end-to-end RF design, propagation modeling and prediction, for deployment of Macro Cell deployment. Determine equipment and power configurations. Work with eNB / RAN and UE teams on RF solutions including modifications to RF link budgets on a per site level basis to meet operations requirements. Perform site candidate evaluation and selection as well as site walks. Work with RF Management to establish design criteria, link budget and traffic analysis as needed for network design and update existing performance parameters for ongoing improvements as required. What you bring to the table as a RF Design Engineer: BSEE/BSCS degree and/or at least 3-7 years of relevant LTE RF Design working experience, and 5+ years overall wireless experience in Design/Optimization or Operations roles including RF support of Site Acquisition and site Construction teams. Related Degree and Experience will be taken into consideration in lieu of BSEE/BSCS. Cellular/Mobile Technology proficiency in 4G/5G and NR theory and practical experience. Experience with macro and small cell nominal and final RF designs including development, operations, RF KPIs, and maintenance of RF link budgets for 3GPP technologies. Full proficiency in setting up, calibration, utilization and data processing of various LTE design and optimization equipment and software. Working knowledge of at least two of the common industry propagation/planning tools (like Planet or Atoll) and experience with model calibrations. Working knowledge of drive test data post-processing, map generation, frequency planning and interference matrix analysis and site database maintenance, using Windcatcher/Actix/Accuver. Understanding of equipment co-location requirements for multiple operators and experience performing inter-modulation and other external interference analysis. What you didn't know about us: Competitive salary Health, Dental and Vision Benefits Long-term growth potential 401k With this position, you will get the opportunity to work with a game changing client and further advance your already valuable experience in the telecom industry! We are Connectors . We thrive on 'quality over quantity' and put in the work building strong relationships. We create connections, discover qualities, uncover skills, and place people with accuracy. We are your true partners! We are collaborators . You'll be working with a wholly owned subsidiary of Kelly and part of the Kelly Telecom division. It allows us to be as nimble and fiercely competitive as a startup while having the backing of a multibillion dollar publicly traded company which has been in business for 75 years. With direct access to hiring managers, services don't stop at standard recruiting processes. We use our expertise to improve your application skills and provide ongoing career support. We give 24/7 support . We are in this together. We provide around the clock availability, competitive employee benefits, and continuously check-in to make sure things are going smoothly. Check out our Glassdoor page! Kelly Telecom is an equal opportunity employer and will consider all applications without regard to race, genetic information, sex, age, color, religion, national origin, veteran status, disability, or any other characteristic protected by law. For more information click Equal Employment Opportunity is the law. #JobsAtKellyTelecom Job Types: Full-time, Contract Salary: $95,000.00 - $105,000.00 per year Benefits: 401(k) Dental insurance Flexible schedule Health insurance Paid time off Referral program Vision insurance Work Location: In person Health insurance If you require alternative methods of application or screening, you must approach the employer directly to request this as Indeed is not responsible for the employer's application process.",https://www.indeed.com/jobs?q=Software+Engineer&l=San+Francisco%5D+%23%2C+CA&sc=0kf%3Aattr%28FCGTU%7CHFDVW%7CQJZM9%7CUTPWG%252COR%29explvl%28MID_LEVEL%29jt%28contract%29%3B&start=10&pp=gQAPAAAAAAAAAAAAAAAB_coMuwALAQAPktdjWCW_OoYAAA&vjk=4c2efc8c7012ccb1
11,a1115ba4a64ff31d,Machine Learning Engineer,"San Francisco, CA",ENTRY_LEVEL,BACHELORS_DEGREE,fulltime,"Radar Algorythms DSP_GPU Engineer - job post VASERJOB Belmont, CA • Hybrid remote $185,000 - $215,000 a year -  Full-time, Contract Apply now Apply now save-icon Job details Salary $185,000 - $215,000 a year Job Type Full-time Contract Position Overview: Title: Radar Algorithms DSP/GPU Engineer Core Notes Benefits- Medical, Life, Dental, Vision, 401k w/match, Stock options Signing bonus and a yearly bonus. In-office/semi-remote preferred but remote possible for a rock star Knows radar digital beam algorithms Ability to get a clearance required US citizenship required 6 years Software Engineering experience. Compensation Range: $185,000 - $215,000 Citizenship Requirements: *All candidates must have US citizenship status* Job Position Location: Belmont, CA (Hybrid/ Remote/ in-office: Local Candidates only) Relocation: Relocation Options Interview Schedule: Max 3. First: Zoom Meeting. Second: Face to Face. Third: Second Manager until interview request. Radar Algorithms DSP/GPU Engineer This position requires U.S. citizenship This position is located in: Belmont, CA (Remote option available for select candidates) Responsibilities ● Develop algorithms for digital beamforming on GPU architectures ● Receive analog RF data into the CUDA environment via GPUDirect RDMA ● Create a platform to test algorithms on stored/simulated data ● Design radar processing systems to optimize for real-time signal processing Requirements ● Education: Typically requires a bachelor's degree in Computer Science, Computer Engineering, Electrical Engineering, Mathematics, Software Engineering, or related field and 6+ years’ experience in software engineering. An advanced degree in a related field may be substituted for additional years of experience. ● Strong mathematical skills, intuitive understanding of signals and systems, can whiteboard an FFT algorithm ● Experience with Digital Beamforming ● Experience with Radar signal processing algorithms for Weather, Air Traffic Control, or defense applications ● The ability to obtain and maintain a U.S. security clearance. U.S. citizenship is required as only U.S. citizens are eligible for a security clearance Valued Qualifications ● Experience programming for distributed systems, GPUs, FPGAs and Microcontrollers ● Experience interfacing GPUs with FPGAs or 100G networks. ● RF/Analog/Digital Signal Engineering ● Machine Learning Experience ● Software development experience in a DoD or Air Traffic environment ● Experience developing software architectures ● Broad real-time, multi-threaded software development experience ● Active Secret Clearance Job Types: Full-time, Contract Pay: $185,000.00 - $215,000.00 per year Benefits: 401(k) Dental insurance Health insurance Vision insurance Schedule: 8 hour shift Supplemental pay types: Signing bonus Work Location: Remote Health insurance If you require alternative methods of application or screening, you must approach the employer directly to request this as Indeed is not responsible for the employer's application process.",https://www.indeed.com/jobs?q=Software+Engineer&l=San+Francisco%5D+%23%2C+CA&sc=0kf%3Aattr%28FCGTU%7CHFDVW%7CQJZM9%7CUTPWG%252COR%29explvl%28MID_LEVEL%29jt%28contract%29%3B&start=10&pp=gQAPAAAAAAAAAAAAAAAB_coMuwALAQAPktdjWCW_OoYAAA&vjk=a1115ba4a64ff31d
12,c71a664f8a6edcde,Machine Learning Engineer,"San Francisco, CA",ENTRY_LEVEL,BACHELORS_DEGREE,fulltime,"Google Cloud Platform Developer - job post Experfy Inc San Francisco, CA Contract Apply now Apply now save-icon Job details Job Type Contract Key Responsibilities : 1- Design, build and configure applications to meet business process and application requirements Technical Experience : 1-Deep knowledge of AngularJS practices and commonly used modules based on extensive work experience 2-Creating custom, general use modules and components which extend the elements and modules of core AngularJS3-Hands on experience in Qlik Sense development, dashboarding and data modeling and reporting ad hoc report generation techniques4-Experienced in application designing, architecting, development and deployment using Qlik Sense Strong database designing and SQL skills SSIS Minimum qualifications: Bachelor's degree in Computer Science, Computer Engineering, a related field of study or equivalent practical experience. 5 years of software development experience through coding in a general purpose programming language. Experience writing libraries and tools used by Java Developers. Preferred qualifications: Experience participating in online platforms (such as Open Source platforms, StackOverflow). Experience working with third party developer tools such as documentation, APIs, SDKs, and client libraries. Experience developing on a cloud computing platform, including full-stack or back-end application development experience. If you require alternative methods of application or screening, you must approach the employer directly to request this as Indeed is not responsible for the employer's application process.",https://www.indeed.com/jobs?q=Software+Engineer&l=San+Francisco%5D+%23%2C+CA&sc=0kf%3Aattr%28FCGTU%7CHFDVW%7CQJZM9%7CUTPWG%252COR%29explvl%28MID_LEVEL%29jt%28contract%29%3B&start=10&pp=gQAPAAAAAAAAAAAAAAAB_coMuwALAQAPktdjWCW_OoYAAA&vjk=c71a664f8a6edcde
