,job_id,job_title,location,experience,education,job_type,job_description,job_link
0,ccece1ba1c79f570,Data Scientist,"San Francisco, CA",MID_LEVEL,BACHELORS_DEGREE,fulltime,"Machine Learning Engineer - job post Presto US San Francisco Bay Area, CA $183,310 - $200,000 a year -  Full-time You must create an Indeed account before continuing to the company website to apply Apply on company site save-icon Job details Salary $183,310 - $200,000 a year Job Type Full-time The restaurant industry is currently going through a major labor shortage. This situation will only worsen if there is an economic downturn, especially for quick service restaurants. Presto is the leader in next-gen automation technologies that help restaurants increase capacity, lower costs, and enhance guest experience by significantly improving labor productivity. Voice: Guests and staff can place orders using conversational A.I. with over 95% accuracy (highest in the industry), even in noisy environments. Vision: Using just a few cameras equipped with computer vision, restaurants can measure throughput and order accuracy, identify issues, repeat visitors and implement real-time fixes. Touch: Designed for both drive-thru and dine-in applications, the same Presto Flex can be deployed as a pay-at-table, staff handheld, kiosk, or drive-thru line buster—offering wide front-of-house flexibility. Join us to be a part of a phenomenon that is revolutionizing the restaurant industry! E La Carte, Inc E La Carte, Inc. d.b.a. Presto in San Carlos, CA is seeking Sr. Machine Learning Engineer to design, engineer, test, deploy and maintain machine intelligence platforms and applications for real-world production use at scale. Responsibilities: Improve the accuracy, runtime, scalability and reliability of machine intelligence algorithms and software. Write and maintain robust technical documentation for new and existing intelligence platforms that results in quick transfer of information. Develop and implement machine intelligence platform APIs for multiple use-cases. Drive architecture of platform and application capabilities embedding machine intelligence. Collaborate with machine learning scientists and data scientists to develop prototyped solutions and translate leading-edge ideas into production-ready systems. Mentor junior members of the team to achieve greater impact through others. Communicate cross-team dependencies required for successful development and deployment. Keep up to date with current state-of-the-art machine learning approaches and advocate for directional change when applicable to improve the product. This position has no direct reports and does not supervise any other personnel. Minimum Requirements: Master’s degree in Computer Science, Information Systems, Computer or Software Engineering, Electrical Engineering or any related IT or Engineering field of study, plus at least three (3) years of experience in any related position(s). In lieu of the above-stated primary education and experience requirements, employer will accept a Bachelor’s degree in Computer Science, Information Systems, Computer or Software Engineering, Electrical Engineering or any related IT or Engineering field of study plus at least five (5) years of post-degree, progressively responsible experience in any related position(s). Qualified applicants must also have demonstrable proficiency and knowledge with the following: 1. Signal processing, machine learning, deep learning, and speech technologies including at least one of the following: Keyword Spotting, Speech Recognition or Speaker Identification. 2. Programming languages including Java, C, C++ and Python. 3. Machine learning packages including Tensorflow, Pytorch, Pandas and Numpy. No travel; no telecommunicating. Additional Information: Job Site: 985 Industrial Road, Suite 205 San Carlos, CA 94070 EOE Must be legally authorized to work in the United States without sponsorship $183,310 - $200,000 a year The U.S. base salary range for this position is $183,310 to 200,000 + equity + benefits. Our salary ranges are determined by role, level and location. The range displayed on each job posting reflects the minimum and maximum target for new hire salaries for the position across all U.S. locations. Within the range, individual pay is determined by location and additional factors, including job related skills, experience, and relevant education or training. At Presto, it is not typical for the individual to be hired at or near the top of the range for their role and compensation decisions are dependent on the facts and circumstances for each case. Presto is a publicompany (NASDAQ: PRST) and its compensation strategy aims to reward high performers and rein them for the long term. Other benefits to U.S.-based employees include medical, dental, and vision insurance, 401(k) program, and paid-time-off (PTO). To learn more, please visit: www.presto.com. With over 250,000 systems shipped, we are one of the largest labor automation technology providers in the industry. Founded at M.I.T. in 2008, Presto is headquartered in Silicon Valley, California, with customers including many of the top 20 restaurant chains in the U.S. We value people from all walks of life and are committed to creating an inclusive hiring process and work environment. We especially encourage historically underrepresented candidates to apply. We are an equal employment opportunity employer. All qualified applicants will receive consideration for employment without regard to race, color, religion, sex, national origin, disability status, protected veteran status or any other characteristic protected by law. If you need an accommodation to access the job application or interview process, please contact recruiting@presto.com.",https://www.indeed.com/jobs?q=Data+Scientist&l=San+Francisco%2C+CA&sc=0kf%3Aattr%28FCGTU%7CHFDVW%7CQJZM9%7CUTPWG%252COR%29explvl%28MID_LEVEL%29jt%28fulltime%29%3B&start=10&pp=gQAPAAAAAAAAAAAAAAAB_jBEtQARAQAB1v1ds2Bmj2SdYKuqLTAAAA&vjk=ccece1ba1c79f570
1,200eee6d56488486,Data Scientist,"San Francisco, CA",MID_LEVEL,BACHELORS_DEGREE,fulltime,"Applied Scientist - Personal and Platform Safety - job post Uber 2,771 reviews San Francisco, CA 94103 $149,000 a year -  Full-time You must create an Indeed account before continuing to the company website to apply Apply on company site save-icon Job details Salary $149,000 a year Job Type Full-time About the role In this role, you will partner closely with product management, operations, engineering, and actuarial teams, to build data science and machine learning solutions to support safety and insurance initiatives! You will use data platforms such as Hive and Spark and will work on structured and unstructured data to build machine learning models that will play an influential role in helping drive critical product and policy decisions. What you'll do Develop and lead statistical and machine learning efforts in relation to your projects. Our projects use machine learning, experimentation, signal processing, time series analysis, geospatial analysis, and more! We'll give you as many challenges as you can seek and help you grow to tackle more. Use large scale data processing such as Spark, Hive, and Uber's proprietary machine learning platform, and more. Collaborate with engineering to write and implement algorithms in production. Design and analyze experimental and observational studies; communicate findings; facilitate launch decisions. Work with a cross-functional team that includes product management, engineering, operations and others to complete projects. Basic Qualifications Ph.D., M.S. or Bachelors degree in Statistics, Economics, Machine Learning, Operations Research, or other quantitative fields. (If M.S. degree, a minimum of 1+ years of industry experience required and if Bachelor's degree, a minimum of 2+ years of industry experience as a Data Scientist or equivalent). Knowledge of underlying mathematical foundations of statistics, machine learning, optimization, economics, and analytics. Knowledge of experimental design and analysis. Experience with exploratory data analysis, statistical analysis and testing, and model development. Ability to use Python to work efficiently at scale with large data sets. Proficiency in languages and tools like SQL, R, and Spark. Preferred Qualifications Experience in algorithm development and prototyping. Experience with productionizing algorithms for real-time systems. Well-honed communication and presentation skills: able to transform a complex quantitative analysis into a succinct executive-level report. Uber is proud to be an Equal Opportunity/Affirmative Action employer. All qualified applicants will receive consideration for employment without regard to sex, gender identity, sexual orientation, race, color, religion, national origin, disability, protected Veteran status, age, or any other characteristic protected by law. We also consider qualified applicants regardless of criminal histories, consistent with legal requirements. If you have a disability or special need that requires accommodation, please let us know by completing this form. Offices continue to be central to collaboration and Uber’s cultural identity. Unless formally approved to work fully remotely, Uber expects employees to spend at least half of their work time in their assigned office. For certain roles, such as those based at green-light hubs, employees are expected to be in-office for 100% of their time. Please speak with your recruiter to better understand in-office expectations for this role. For San Francisco, CA-based roles: The base salary range for this role is $149,000 per year - $165,500 per year. You will be eligible to participate in Uber's bonus program, and may be offered an equity award & other types of comp. You will also be eligible for various benefits. More details can be found at the following link https://www.uber.com/careers/benefits.",https://www.indeed.com/jobs?q=Data+Scientist&l=San+Francisco%2C+CA&sc=0kf%3Aattr%28FCGTU%7CHFDVW%7CQJZM9%7CUTPWG%252COR%29explvl%28MID_LEVEL%29jt%28fulltime%29%3B&start=10&pp=gQAPAAAAAAAAAAAAAAAB_jBEtQARAQAB1v1ds2Bmj2SdYKuqLTAAAA&vjk=200eee6d56488486
2,a205569f807fdc2b,Data Scientist,"San Francisco, CA",MID_LEVEL,BACHELORS_DEGREE,fulltime,"Machine Learning Engineer - job post Lawrence Berkeley National Laboratory 190 reviews San Francisco Bay Area, CA $6,871 - $11,596 a month -  Full-time You must create an Indeed account before continuing to the company website to apply Apply on company site save-icon Job details Salary $6,871 - $11,596 a month Job Type Full-time Lawrence Berkeley National Lab’s (LBNL) Applied Mathematics and Computational Research Division has an opening for a Machine Learning Engineer to join the team. In this exciting role, you will contribute to ongoing efforts to design, implement, and test large language models to improve healthcare and biomedicine outcomes. You will work on 1) the HPC implementation of sophisticated deep learning models to predict outcomes such as suicide risk, complications from obstructive sleep apnea, and response to lung cancer treatment and 2) the development of large language models for information extraction from the unstructured data in Electronic Health Records as well as other textual data. What You Will Do: Develop a pipeline that utilizes large language models such as GPT3 to efficiently extract concepts from unstructured data with the goals to 1) develop or improve new or existing predictive models (e.g. suicide high-risk and response to lung cancer treatment) and 2) develop models for deep- phenotyping. Develop HPC methodologies to handle vast datasets containing Electronic Health Records (EHR) and surveys. Weekly interface with stakeholders on multiple projects. Store data and codes in a shared repository that can be accessed by the research team for future review and experimentation. Prepare and maintain code descriptions, tutorials, and data analyses up to date. Document work and results and participate in research group meetings. What is Required: Bachelor’s degree and a minimum of two years related experience or an equivalent combination of education and experience. Proven experience running on high-performance supercomputers. Proven knowledge and experience with the design, implementation, and testing of large language models and analytical capabilities. Familiar or proficient with deep learning frameworks like PyTorch(preferred) or TensorFlow. Familiar or proficient with HPC scheduling systems like SLURM or LSF. Familiar or proficient writing distributed algorithms using MPI (preferred) or SPARK. Familiar or proficient refactoring/troubleshooting SQL queries. Demonstrated analytical skills with the ability to troubleshoot problems of large scope where analysis of situations or data requires a review of a variety of factors. Desired Qualifications: Proven experience working with Electronic Healthcare Records (EHR). Proven knowledge and experience in computational linguistics. Excellent interpersonal skills for working in a diverse team environment. Able to work effectively while balancing multiple priorities/tasks. Takes initiative in tasks and shares creative insights with the team. Want to learn more about Berkeley Lab's Culture, Benefits and answers to FAQs? Please visit: https://recruiting.lbl.gov/ Notes: This is a full time, 1 year, term appointment with the possibility of extension or conversion to Career appointment based upon satisfactory job performance, continuing availability of funds and ongoing operational needs. This full salary range of this position is between $6,871 to $11,596 per month and is expected to pay between a targeted range of $7,730 to $9,449 per month depending upon candidates' full skills, knowledge, and abilities, including education, certifications, and years of experience. This position may be subject to a background check. Any convictions will be evaluated to determine if they directly relate to the responsibilities and requirements of the position. Having a conviction history will not automatically disqualify an applicant from being considered for employment. Work may be performed on-site, hybrid, full-time telework. The primary location for this role is Lawrence Berkeley National Lab, 1 Cyclotron Road, Berkeley, CA. Work must be performed within the United States. Based on University of California Policy - SARS-CoV-2 (COVID-19) Vaccination Program and U.S Federal Government requirements, Berkeley Lab requires that all members of our community obtain the COVID-19 vaccine as soon as they are eligible. As a condition of employment at Berkeley Lab, all Covered Individuals must Participate in the COVID-19 Vaccination Program by providing proof that vaccination requirements have been met or submitting a request for Exception or Deferral. Visit covid.lbl.gov for more information. Berkeley Lab is committed to Inclusion, Diversity, Equity and Accountability (IDEA) and strives to continue building community with these shared values and commitments. Berkeley Lab is an Equal Opportunity and Affirmative Action Employer. We heartily welcome applications from women, minorities, veterans, and all who would contribute to the Lab's mission of leading scientific discovery, inclusion, and professionalism. In support of our diverse global community, all qualified applicants will be considered for employment without regard to race, color, religion, sex, sexual orientation, gender identity, national origin, disability, age, or protected veteran status. Equal Opportunity and IDEA Information Links: Know your rights, click here for the supplement: Equal Employment Opportunity is the Law and the Pay Transparency Nondiscrimination Provision under 41 CFR 60-1.4.",https://www.indeed.com/jobs?q=Data+Scientist&l=San+Francisco%2C+CA&sc=0kf%3Aattr%28FCGTU%7CHFDVW%7CQJZM9%7CUTPWG%252COR%29explvl%28MID_LEVEL%29jt%28fulltime%29%3B&start=10&pp=gQAPAAAAAAAAAAAAAAAB_jBEtQARAQAB1v1ds2Bmj2SdYKuqLTAAAA&vjk=a205569f807fdc2b
3,954ac7034a7285c0,Data Scientist,"San Francisco, CA",MID_LEVEL,BACHELORS_DEGREE,fulltime,"Big Data Engineer - PySpark - job post Logic20/20 Inc. 17 reviews San Francisco, CA $130,000 - $162,500 a year -  Full-time Apply now Apply now save-icon Job details Salary $130,000 - $162,500 a year Job Type Full-time Company Description We’re a seven-time “Best Company to Work For,” where intelligent, talented people come together to do outstanding work—and have a lot of fun while they’re at it. Because we’re a full-service consulting firm with a diverse client base, you can count on a steady stream of opportunities to work with cutting-edge technologies on projects that make a real difference. Logic20/20's Global Delivery Model creates a connected experience for Logicians across geographies. You'll have access to projects in different locations, the technology to support Connected Teams, and in-person and online culture events in our Connected Hub cities. Job Description Bring your skillset to an exciting and meaningful initiative where we are leveraging data science, artificial intelligence, and machine learning to mitigate wildfires. By proactively identifying and addressing issues with power lines and related equipment, we’re increasing safety, saving lives, and protecting the environment. This is a highly visible, highly impactful project with implications for millions of customers. As a Big Data Engineer, you’ll join our Data Management team to design and develop scalable data processing infrastructure. Applying an Agile approach, you’ll work closely with our team of analysts, technical product owners, and data scientists to provide the structure for a highly anticipated solution. You’ll leverage your balance of technical skills and business acumen to help the client better understand their core needs and technical capabilities. Your efforts will result in greater protection for the community and our environment, long-term. Hear more about these efforts as Jeff Lovington shares his experience working in Data Science and Machine Learning for the Energy & Utilities sector. About the team The Logic20/20 Advanced Analytics team is where skilled professionals in data engineering, data science, and visual analytics join forces to build simple solutions for complex data problems. We make it look like magic, but for us, it’s all in a day’s work. As part of our team, you’ll collaborate on projects that help clients spin their data into a high-performance asset, all while enjoying the company of kindred spirits who are as committed to your success as you are. And when you’re ready to level up in your career, you’ll have access to the training, the project opportunities, and the mentorship to get you where you want to go. “We build an environment where we really operate as one team, building up each other’s careers and capabilities.” – Adam Cornille, Director, Advanced Analytics About you You are collaborative, working with partners to understand business needs and pain points You are determined and able to manage obstacles while maintaining a positive outlook You are patient and savvy in explaining technical benefits and deficits to non-technical audiences You have a passion for learning new data tools and best practices You have built large-scale machine learning pipelines, quickly developing and iterating solutions Qualifications Must have 3+ years of implementation experience using PySpark 5+ years of data engineering experience Strong understanding of high-performance ETL development with Python Experience with Big Data Technologies (Hadoop, Spark, MongoDB) Experience designing and developing cloud ELT and date pipeline with various technologies such as Python, Spark, PySpark, SparkSQL, Airflow, Talend, Matillion, DBT, and/or Fivetran Demonstrated ability to identify business and technical impacts of user requirements and incorporate them into the project schedule Preferred: Experience with Palantir’s Foundry and LiDAR Ideal, but not required: An undergraduate degree in technology or business Agile, Scrum, and/or SAFe experience and certifications Experience building data and computational systems that support machine learning Knowledge of AWS services Experience with modern software delivery practices, including source control, testing, and continuous delivery Experience with streaming data in Spark Additional Information All your information will be kept confidential according to EEO guidelines. Compensation range: $130,000 - $162,500 annually About Logic20/20 To learn more about Logic20/20, please visit: https://www.logic2020.com/careers/life-at-logic Core Values At Logic20/20, we are guided by three core values: Drive toward Excellence, Act with Integrity & Foster a Culture of We. These values were generated and agreed upon by our employees—and they help us pursue our goal of being one of the best companies to work for and to work with. Learn more at https://www.logic2020.com/company/our-values. Logic20/20 Benefits Why Logic20/20? It’s our goal to be one of the best companies to work for. One piece of the puzzle is an evolving set of benefits that extend past medical, dental, and 401(k). You will have Career Development – A built-in program from day 1, providing a mentor and individually-directed training opportunities, plus access to leaders across the company PTO, Paid Holidays, & Voluntary Leave – Worry-free time off to recharge and pursue your personal goals Community & Committees – As part of our “Culture of We,” Logic20/20 invests in providing many social, interest, and learning opportunities Recognition – From peer recognition, swag, and the chance to win a once-in-a-lifetime type of award, we make your Logic20/20 journey stand out Referral Programs & Bonuses – Employee, project, and sales referral programs with paid incentives Equal Opportunity Statement We believe that people should be celebrated: for their talents, ideas, and skills, but most of all, for what makes them unique. We prohibit harassment and/or discrimination based on age, race, creed, color, religion, sex, national origin, ancestry, disability status, veteran status, sexual orientation, gender identity or expression, genetic information, marital status, citizenship status, or any other basis as protected by federal, state, or local law. To learn more about our DE&I initiatives, please visit: https://www.logic2020.com/company/diversity-equity-inclusion Privacy Policy During the recruitment and hiring process, we gather, process, and store some of your personal data. We consider data privacy a priority. For further information, please view our company privacy policy. If you require alternative methods of application or screening, you must approach the employer directly to request this as Indeed is not responsible for the employer's application process.",https://www.indeed.com/jobs?q=Data+Scientist&l=San+Francisco%2C+CA&sc=0kf%3Aattr%28FCGTU%7CHFDVW%7CQJZM9%7CUTPWG%252COR%29explvl%28MID_LEVEL%29jt%28fulltime%29%3B&start=10&pp=gQAPAAAAAAAAAAAAAAAB_jBEtQARAQAB1v1ds2Bmj2SdYKuqLTAAAA&vjk=954ac7034a7285c0
