,job_id,job_title,location,experience,education,job_type,job_description,job_link
44,7815931aa06c0ee7,Machine Learning Engineer,"San Francisco, CA",ENTRY_LEVEL,BACHELORS_DEGREE,fulltime,"Senior Backend Engineer - job post Recruiting From Scratch Los Angeles, CA 90013 $165,000 - $225,000 a year -  Full-time Apply now Apply now save-icon Job details Salary $165,000 - $225,000 a year Job Type Full-time Who is Recruiting from Scratch: Recruiting from Scratch is a premier talent firm that focuses on placing the best product managers, software, and hardware talent at innovative companies. Our team is 100% remote and we work with teams across the United States to help them hire. We work with companies funded by the best investors including Sequoia Capital, Lightspeed Ventures, Tiger Global Management, A16Z, Accel, DFJ, and more. About our Client Our client is a serverless infrastructure company that has built a global state management platform for web developers. Their mission is to fundamentally change how software is built on the Internet and who gets to build it. They're looking for people who are passionate about improving the development experience for frontend engineers and who have strong opinions on what kinds of tools and workflows will remove barriers to getting things done. The early team at our client includes Principal Engineers and Engineering Directors who have led exabyte-scale storage projects, built custom global databases with trillions of records, and shipped desktop and mobile software onto billions of devices. They're a startup however and they're all excited about getting stuff done wherever is required in the stack. They've started to create something they believe is an entirely new and substantially better platform for teams of the future. They're eager to create the solution they wished they'd had for all those tricky frontend and backend problems they've wrestled to the ground over the years. They're motivated by the prospect of a new wave of teams using their product and excited to empower them to solve challenges that only recently were quite daunting. What excites them: They're looking for both junior and senior engineers who have a passion for building great things in a great environment. If you're highly-motivated, able to work independently, but also like to collaborate and work within a team, you're probably a good fit. Yes, they're building a state-of-the-art distributed database, so they have some very deep and very interesting systems challenges for infrastructure folks, but hopefully, folks who are also happy to also build a dashboard or work on developer SDKs. They're not just hiring infrastructure engineers however; most of their work is best applicable to general full-stack engineers with good taste and a product mindset. The Role: The Convex team has a lot of experience running large systems at scale but we have a growing infrastructure footprint across databases, servers, and devops. We are looking for a backend engineer to help build and maintain infrastructure for the future of Convex at scale. If you are passionate about building distributed systems and experienced with both designing and operating container infrastructure at scale, we would love to talk to you! What You’ll Do: Design, build, and maintain their global cloud infrastructure on AWS General ownership of SRE/DevOps which includes automating their monitoring and logging tools, developing traffic infrastructure for efficient and secure routing requests, managing release processing, versioning and CI/CD Establish reliability guidelines and ensuring systems meet our goals around durability, availability and performance Requirements: BS in Computer Science or related technical field or equivalent technical experience 7+ years of backend engineering experience working on infrastructure, production engineering, SRE, or systems engineering Good understanding of best practices for system configuration, building internal systems from scratch, and deploying services Experience scaling in a high growth startup environment Ability to write high quality code (knowledge of Rust is a plus) Location: They view in-person time as essential to make quick strategic decisions, to build empathy and to form early team culture. But they also value that working from home allows productive heads-down execution, extra time with family, commute breaks, and schedule flexibility. So, they're currently following a three/two hybrid schedule: three days in the office and (optionally) two days at home. Therefore, interested candidates need to be either in the NYC or willing to relocate. Fully remote is not an option at this time. Benefits: They have competitive salaries, generous early-employee equity packages, excellent benefits, and lots of plants in the office! Most of all however, they're a group of friendly, highly-motivated people who love working together and hope that you'll love working with them too. Base Salary Range: $165,000 to $225,000+ If you require alternative methods of application or screening, you must approach the employer directly to request this as Indeed is not responsible for the employer's application process.",https://www.indeed.com/jobs?q=Software+Engineer&l=Los+Angeles%2C+CA&sc=0kf%3Aattr%28FCGTU%7CHFDVW%7CQJZM9%7CUTPWG%252COR%29explvl%28SENIOR_LEVEL%29jt%28fulltime%29%3B&radius=50&start=20&pp=gQAeAAAAAAAAAAAAAAAB_gjX5AAsAQEBBwEJvQHFEMEhEZR-SpeRCboum6lqVxyH7dA1CuzjW3Do-BZjZBggoiUAAA&vjk=7815931aa06c0ee7
45,4cd6bb3e4c73f4df,Machine Learning Engineer,"San Francisco, CA",ENTRY_LEVEL,BACHELORS_DEGREE,fulltime,"Cyber Defense Software Engineer IV - Ground System Cybersecurity - job post JPL/NASA 191 reviews Pasadena, CA 91109 Full-time JPL/NASA 191 reviews Read what people are saying about working here. You must create an Indeed account before continuing to the company website to apply Apply on company site save-icon Job details Job Type Full-time Job Details New ideas are all around us, but only a few will change the world. That’s our focus at JPL. We ask the biggest questions, then search the universe for answers—literally. We build upon ideas that have guided generations, then share our discoveries to inspire generations to come. Your mission—your opportunity—is to seek out the answers that bring us one step closer. If you’re driven to discover, create, and inspire something that lasts a lifetime and beyond, you’re ready for JPL. Located in Pasadena, California, JPL has a campus-like environment situated on 177 acres in the foothills of the San Gabriel Mountains and offers a work environment unlike any other: we inspire passion, foster innovation, build collaboration, and reward excellence. Responsibilities: You will be a Cyber Defense Software Engineer on a JPL mission and report administratively to a 394 Group Supervisor. You will lead mission systems development and operations efforts, such as mission operations systems, ground data systems, science operations systems, and spacecraft operations systems; integrating subsystems within mission systems. You will Coordinate with your Lead in performing the following: Development and testing of cybersecurity mission operations processes and procedures Verification & Validation of mission-cybersecurity-scenario based testing Contributing to mission and line cybersecurity documentation Collaboration with project teams to meet cybersecurity success objectives Qualifications: Bachelor's degree in engineering, science, or related technical subject area with at least 9 years of related experience; Master's degree with at least 7 years of related experience; PhD with at least 5 years of related experience. Expertise in Mission Systems and Operations. Expertise in the application of cybersecurity practices and principles Ability to conduct, manage and complete technical and organizational trades involving mission science returns, mission design and risk. Collaboration skills with all levels of institutional and operations personnel. Understanding of ground systems and their use in mission operations Strong communications skills including writing and reviewing technical operations documentation Strong interpersonal skills and ability to work effectively with internal and external program leadership, as well as subcontractor teams Preferred Qualifications: Understanding of JPL and DoD organizations. Knowledge of JPL and DoD policies and procedures, as well as government regulations across a range of applications. Ability to meet commitments to produce quality products within budget through prioritization. System engineering experience at the system and/or subsystem levels. Aerospace industry experience. Experience with a scripting language(s), preferably python or java script Strong analytical skills JPL has a catalog of benefits and perks that span from the traditional to the unique. This includes a variety of health, dental, vision, wellbeing, and retirement plans, paid time off, learning, rideshare, childcare, flexible schedule, parental leave and many more. Our focus is on work-life balance, and living healthy, fulfilling lives as we Dare Mighty Things Together. For benefits eligible positions, benefits are effective the first day of the month coincident with or immediately following the employee’s start date. For further benefits information click Benefits and Perks The hiring range displayed below is specifically for those who will work in or reside in the location listed. In extending an offer, Jet Propulsion Laboratory considers factors including, but not limited to, the candidate’s job related skills, experience, knowledge, and relevant education/training. Hiring range for this job may be adjusted based on primary work location outside of Pasadena, California. This adjusted range will be provided to candidates by the Recruiter when applicable. The typical full time equivalent annual hiring range for this job in Pasadena, California. $163,592 - $204,880 JPL is an Equal Opportunity Employer. All qualified applicants will receive consideration for employment without regard to sex, race, color, religion, national origin, citizenship, ancestry, age, marital status, physical or mental disability, medical condition, genetic information, pregnancy or perceived pregnancy, gender, gender identity, gender expression, sexual orientation, protected military or veteran status or any other characteristic or condition protected by Federal, state or local law. In addition, JPL is a VEVRAA Federal Contractor. EEO is the Law. EEO is the Law Supplement Pay Transparency Nondiscrimination Provision The Jet Propulsion Laboratory is a federal facility. Due to rules imposed by NASA, JPL will not accept applications from citizens of designated countries or those born in a designated country unless they are Legal Permanent Residents of the U.S or have other protected status under 8 U.S.C. 1324b(a)(3). The Designated Countries List is available here.",https://www.indeed.com/jobs?q=Software+Engineer&l=Los+Angeles%2C+CA&sc=0kf%3Aattr%28FCGTU%7CHFDVW%7CQJZM9%7CUTPWG%252COR%29explvl%28SENIOR_LEVEL%29jt%28fulltime%29%3B&radius=50&start=30&pp=gQAtAAAAAAAAAAAAAAAB_gjX5AAyAQIBCSIKA1oeb6-vkTISkutoFQZwTUxEK2pkHQ-jKzAwEz-2hJJp1OgqnTLUFju1If8AAA&vjk=4cd6bb3e4c73f4df
46,ad6d7191ad9c672f,Machine Learning Engineer,"San Francisco, CA",ENTRY_LEVEL,BACHELORS_DEGREE,fulltime,"Principal Software Engineer - Radar C, C++ Onsite - job post Raytheon Missiles & Defense (part of Raytheon) 197 reviews Fullerton, CA 92834 Full-time Raytheon Missiles & Defense 197 reviews Read what people are saying about working here. You must create an Indeed account before continuing to the company website to apply Apply on company site save-icon Job details Job Type Full-time Date Posted: 2023-02-21-08:00 Country: United States of America Location: CA550: Fullerton, CA Bldg 675 1801 West Hughes Drive Building 675, Fullerton, CA, 92834 USA Position Role Type: Onsite About Us : One global team creating trusted, innovative solutions to make the world a safer place. Raytheon Missiles and defense offers an innovative and inclusive culture; welcoming diversity and collaboration and providing numerous opportunities for career growth. The Software Products Engineering (SPE) organization develops software applications, including integration and test on missiles, launchers, radars, naval systems, fire control and other complex systems. Our precision software and firmware integrates operating systems, device drivers, networking, and control software to bring together sensor, guidance, and flight control processing features to complete the mission. Our 2000+ software engineers design, develop, and build innovative solutions for our customers. We are currently seeking a Principal Software Engineer to join the Command and Control and Battlefield Radar (C2BFR) software team in Fullerton, California. The C2BFR team utilizes state-of-the-art technologies and real-time computing architectures to provide next-generation radar capabilities to our customers. The C2BFR department is the focal point for radar software development including target detection, tracking, identification/classification, and calibration/diagnostics. The Principal Software Engineer will be responsible for supporting multiple programs and multiple platforms within a software product line and expected to perform as an individual contributor, as part of a high performing Integrated Product Team. Tasks will include software design, software development, software debugging, integration and testing. There may be short term travel opportunities to sites across the United States and internationally to support system integration and test activities. There's no such thing as a perfect candidate, so don't hold back. Your qualifications could add tremendous value to our team. Our customers come from all different backgrounds, and so do our employees. If you're passionate about what you could accomplish here, we'd love to hear from you Qualifications You Must Have: Typically requires a BS with an emphasis in Software Engineering, Computer Science, Computer Engineering, Electrical Engineering, Mathematics, Physics, or other related field with 8+ years of experience. In absence of a degree a minimum of 12 years of experience is required. An advanced degree in a related field may be substituted for additional years of experience. Experience developing C++, Java or C applications Experience with Real-Time Operating Systems such as Linux and VxWorks The ability to obtain and maintain a U.S government issued security clearance is required. U.S. citizenship is required as only U.S. citizens are eligible for a security clearance. Qualifications We Value: Experience developing software in a team-based development environment, preferably Agile/SCRUM Broad real-time development experience (high performance, multi-threaded software designs) Experience in the radar domain such as receiver, exciter, waveforms, digital beamforming, signal processing Experience with MATLAB/Simulink Advanced experience developing with C++ using object-oriented design Software development experience in a Department of Defense environment Excellent communication, technical writing, oral presentation, and interpersonal skills Self-starter and ability to lead development, integration and test activities Experience with Software Integration, DevOps, test automation Experience with version control (such as git, cvs, svn, ClearCase) Focus on individual and team efficiency improvement The SPY-6 Family of Radars: Delivering Unmatched Air and Missile Defense to the Fleet KEYWORDS: software engineering, java, c, c++, ada, vxworks, matlab, real-time, embedded, radar, linux, agile, scrum, object-oriented design, devops, devsecops, test automation At Raytheon Technologies , we innovate to create solutions and solve complex challenges across all domains: from land and sea to air, space, and cyberspace. In doing so, we embrace the talent, expertise and perspectives of our diverse workforce, each bringing their skills, ideas and dedication to the work we do. We pride ourselves on our commitment to our customers, industry partners and our teammates, making a positive impact not only to our company, but also in our communities where we live and work. Our constant innovation is made possible by a strong culture, investing in our people, and an unwavering vision that’s shared by our employees across the globe – a vision of one global team creating trusted, innovative solutions to make the world a safer place. What We Offer : Whether you’re just starting out on your career journey or are an experienced professional, Raytheon Technologies offers a robust total rewards package that goes above and beyond with compensation; healthcare, wellness, retirement and work/life benefits; career development and recognition programs. Some of the superior benefits Raytheon Technologies offers include paternal leave, flexible work schedules, achievement awards, educational assistance and child/adult backup care. Employee Referral Award Eligibility: Only employees currently within RMD and RI&S have the potential to receive a Referral Award for submitting a referral to RMD and RI&S roles. ALL eligibility requirements must be met (see guidelines) to receive the Referral Awarding #LI-Onsite The salary range for this role is 94,000 USD - 196,000 USD; however, Raytheon Technologies considers several factors when extending an offer, including but not limited to, the role and associated responsibilities, a candidate’s work experience, education/training, and key skills. Raytheon Technologies is An Equal Opportunity/Affirmative Action Employer. All qualified applicants will receive consideration for employment without regard to race, color, religion, sex, sexual orientation, gender identity, national origin, disability or veteran status, age or any other federally protected class. Privacy Policy and Terms: Click on this link to read the Policy and Terms",https://www.indeed.com/jobs?q=Software+Engineer&l=Los+Angeles%2C+CA&sc=0kf%3Aattr%28FCGTU%7CHFDVW%7CQJZM9%7CUTPWG%252COR%29explvl%28SENIOR_LEVEL%29jt%28fulltime%29%3B&radius=50&start=30&pp=gQAtAAAAAAAAAAAAAAAB_gjX5AAyAQIBCSIKA1oeb6-vkTISkutoFQZwTUxEK2pkHQ-jKzAwEz-2hJJp1OgqnTLUFju1If8AAA&vjk=ad6d7191ad9c672f&advn=6781381351210116
47,d20108ca0bddea74,Machine Learning Engineer,"San Francisco, CA",ENTRY_LEVEL,BACHELORS_DEGREE,fulltime,"Sr. Software Engineer - job post ONG HUMAN CAPITAL Anaheim, CA $145,000 a year -  Full-time You must create an Indeed account before continuing to the company website to apply Apply on company site save-icon Job details Salary $145,000 a year Job Type Full-time Anaheim, CA We are looking for a seasoned senior software engineer with proven knowledge and proficiency in modern embedded software development principles, practices and technologies, who is also passionate about product quality and performance Write efficient code, review pull requests, and debug issues. Write embedded software and tools primarily using C++. Develop unit tests and performance tests, as necessary. Design and develop embedded software driving market-leading traffic controller products. Understand technical product requirements, design and develop innovative new features, and maintain existing functionality. Plan technical design and development tasks, provide effort estimates, and write code to implement technical plans. Work closely with the rest of the embedded software engineering team, and collaborate with Software Quality Assurance and other engineering teams as necessary to build and release high-quality products. DUTIES: Design and develop embedded software for traffic controllers, including new features and functionality as well as bug fixes. Collaborate with Hardware Engineering, Systems Engineering, and Software Quality Assurance teams, as necessary. Document technical plan, design, and implementation details on the Engineering Wiki. Assist with testing product functionality and troubleshooting product issues (reported internally or externally). Work closely with the rest of the team, discuss technical strategies, and coordinate the content and timing of code changes to meet project deadlines. QUALIFICATIONS: Bachelor’s degree in Engineering or other technical discipline 7+ years of experience designing and developing high-performance software running in embedded environments Strong object-oriented design experience, strong development experience with modern C++ (C++ 11 and later) Strong embedded Linux and real-time operating system experience; experience in hardware layer communication and considerations for safety-critical embedded environments a strong plus Strong written and oral communication skills, ability to clearly and effectively present and discuss technical design and implementation details Experience of working in Agile software development teams strongly desired Experience in software build systems and CI/CD integration a huge plus Job Type: Full-time Salary: $145,000.00 /year Experience: C++ Coding & Programming: 8 years (Required) Object Orientation: 4 years (Required) Python: 7 years (Required)",https://www.indeed.com/jobs?q=Software+Engineer&l=Los+Angeles%2C+CA&sc=0kf%3Aattr%28FCGTU%7CHFDVW%7CQJZM9%7CUTPWG%252COR%29explvl%28SENIOR_LEVEL%29jt%28fulltime%29%3B&radius=50&start=30&pp=gQAtAAAAAAAAAAAAAAAB_gjX5AAyAQIBCSIKA1oeb6-vkTISkutoFQZwTUxEK2pkHQ-jKzAwEz-2hJJp1OgqnTLUFju1If8AAA&vjk=d20108ca0bddea74
