,job_id,job_title,location,experience,education,job_type,job_description,job_link
37,49abd40c53733e51,Machine Learning Engineer,"Los Angeles, CA",MID_LEVEL,BACHELORS_DEGREE,fulltime,"Principal Data Engineer (Pre-IPO) - job post Recruiting From Scratch Hawthorne, CA 90250 • Remote $150,000 - $200,000 a year -  Full-time Apply now Apply now save-icon Job details Salary $150,000 - $200,000 a year Job Type Full-time About Our Client We are the global leader in e-commerce technology, helping companies seize the full potential of every transaction moment to grow revenue and acquire new customers at scale. Live Nation, Groupon, Staples, Lands’ End, Fanatics, UrbanStems, GoDaddy, Vistaprint and HelloFresh are among the more than 2,500 leading global businesses and advertisers that are using our solutions to drive more value through every transaction by offering highly relevant messages to their customers at the moment they are most likely to convert. With our December 2021 Series E raise of USD$325M, we're is expanding rapidly and globally – operating in 19 countries across North America, Europe and the Asia-Pacific region with the largest office in NYC and a major R&D hub in Sydney. With annual revenues of more than US$200M and vibrant company culture, we have been listed in ‘Great Places to Work’ in the US and Australia. Our award-winning culture is guided by our five core values: Smart with Humility, Own the Outcomes, Force for Good, Conquer New Frontiers, and Enjoy the Ride. These values help us attract, engage, and develop the right talent around the globe and ensure we have the right conditions to do our best work. Keen to join a fast-growing company and a vibrant culture? Our engineering team builds best-in-class e-commerce technology that provides personalized and relevant experiences for customers globally and empowers marketers with sophisticated, AI-driven tooling to better understand consumers. Our bespoke platform handles millions of transactions per day and considers billions of data points which give engineers the opportunity to build technology at scale, collaborate across teams and gain exposure to a wide range of technology. We are expanding rapidly in our major R&D centers in NYC and Sydney. We are passionate about using intelligent systems to improve the transaction moment for retailers everywhere. Come join us and build the future! The Role As a Senior Machine Learning Engineer, you are someone who has significant expertise in both machine learning and software engineering. You will be working with our engineering and product teams to design, build and productionize proprietary machine learning models to solve different business challenges including smart bidding, lookalike modelling, forecasting, and etc. Responsibilities Collaborate closely with product managers and other engineers to understand business priorities, frame machine learning problems, architect machine learning solutions. Build and productionize machine learning models including data preparation/processing pipelines, machine learning orchestrations, improvements of services performance and reliability and etc. Contribute and maintain the high quality of code base with tests that provide a high level of functional coverage as well as non-functional aspects with load testing, unit testing, integration testing, etc. Keep track of emerging tech and trends, research the state-of-art deep learning models, prototype new modelling ideas, and conduct offline and online experiments. Share your knowledge by giving brown bags, tech talks, and evangelizing appropriate tech and engineering best practices. Mentor other team members, facilitate within/across team workshops and lead the agile development. Requirements Bachelor’s degree in Computer Science, a similar technical field of study or equivalent practical experience. 3+ years of industry experience in building production-grade machine learning systems with all aspects of model training, tuning, deploying, serving and monitoring. 5+ years of industry experience in software engineering roles and development experience in Python, SQL, Go, and/or other programming languages. Strong understanding in software engineering, system design, data engineering and/or cloud architecture. Knowledge in at least one of following areas - Bayesian methods, Econometrics, Reinforcement learning, Gradient boosting machine, Natural language processing, Computer vision, etc. Be motivated, self-driven in a fast (we truly mean fast) paced environment with a proven track record demonstrating impact across several teams and/or organizations. Ability to communicate and collaborate effectively with business stakeholders and manage tasks in a timely manner. Our client encourages autonomy; teams have complete ownership of their systems including building, running and monitoring. As such, you may be required to be on-call and respond to systems alerts should they arise. Ideas, opinions, and the ability to share them through respectful proposals, presentations, and team-wide discussions, An eagerness to work and learn in the open and share your learnings with your teammates. Experience in DevOps, MLOps and SRE is a massive plus. Experience of Kubernetes, Kubeflow, TFX and Feature Store in a production environment is a massive plus. Benefits Force for Good. We actively invest in the growth of our people and the strengthening of our communities. Our NYC office is 100% vaccinated to keep our employees and community safe and healthy. We require all stars as well as anyone else who will be onsite at our NYC office – clients, contractors, vendors, and suppliers – to show proof of vaccination and their booster shot. Work with the greatest talent in town. Our recruiting process is tough. We hold a high bar because we have a high-performing, high-velocity culture - we only want the brightest and the best. Join a community. We believe the best things happen when we come together to solve complex problems and make meaningful connections with each other through interest groups, sports clubs, and social events. Accelerate your career. Develop through our global training events, ‘Level Up’ investment, online training courses, and our fantastic people leaders. Take your career to race car speed - Grow your career in our rapidly growing company. Take a break. When you work hard, we know you also need to rest. We offer generous time off and parental leave policies, as well as mental health and wellness days for all employees. We also offer a paid Sabbatical for employees who have been with us for 3 years or more. Stay happy and healthy. Enjoy catered lunch 3 times a week and healthy snacks in the office. Plus join the gym on us! In the US, access generous retirement plans like a 4% dollar-for-dollar 401K matching plan and get fully funded premium health insurance for your whole family. And our NYC office is dog-friendly! Become a shareholder. All employees have stock options. If we succeed, everyone enjoys the upside. See the world! Along with our global all-staff events in amazing locations (Phuket, Thailand in January 2020, Hawaii in May 2022), we also offer generous relocation packages for those interested in moving to another office. We have cool offices in great cities - New York, Sydney, London, Singapore, Tokyo. Get the best of both worlds with a hybrid workplace. We currently work 3 days a week in office, allowing you to enjoy the best of both worlds (please note: this is subject to change based on the needs of the business and some support roles still require a full time presence). One week per quarter, you also have the flexibility to work from anywhere. We believe in equality. We are an Equal Opportunity Employer and recognizes that a diverse workforce is crucial to our success as a business. We would love you to apply for one of our open roles - irrespective of socio-economic status or background, age, gender identity, race, religion, sexual orientation, color, pregnancy, carer/family responsibilities, national and social origin, political opinion, marital, veteran, or disability status. Salary range: $200,000 - $300,000 / year Location: Hybrid 3 days, of your choice, a week in office at the intersection of SoHo and TriBeCa within walking distance of the bike path and outdoor fields on the Hudson River. You’ll be tempted to skip the catered lunches to try out all of the delicious local eateries in the area. Who is Recruiting from Scratch: Recruiting from Scratch is a premier talent firm that focuses on placing the best product managers, software, and hardware talent at innovative companies. Our team is 100% remote and we work with teams across the United States to help them hire. We work with companies funded by the best investors including Sequoia Capital, Lightspeed Ventures, Tiger Global Management, A16Z, Accel, DFJ, and more. If you require alternative methods of application or screening, you must approach the employer directly to request this as Indeed is not responsible for the employer's application process.",https://www.indeed.com/jobs?q=Machine+Learning+Engineer&l=Los+Angeles%2C+CA&sc=0kf%3Aattr%28FCGTU%7CHFDVW%7CQJZM9%7CUTPWG%252COR%29explvl%28MID_LEVEL%29jt%28fulltime%29%3B&radius=50&start=40&pp=gQA8AAAAAAAAAAAAAAAB_ipiFgAXAQEJBwXuwx71JG6neQbHRY4WEC2u6dkAAA&vjk=49abd40c53733e51
38,981025209e46a2b2,Machine Learning Engineer,"Los Angeles, CA",MID_LEVEL,BACHELORS_DEGREE,fulltime,"Integration Engineer - job post Tickets.com 37 reviews Tickets.com in Costa Mesa, CA 92626 $70,000 - $120,000 a year -  Full-time Apply now Apply now save-icon Job details Salary $70,000 - $120,000 a year Job Type Full-time Tickets.com , an MLB company , delivers innovative, cutting-edge technologies to enable frictionless and unforgettable fan experiences in venues across the globe. Together with MLB, Tickets.com is changing the landscape of the live sports and entertainment industry, delivering new digital venue and ticketing experiences to millions of fans. Our Technology team builds platforms and products that provide a new smart ticketing solution and venue experience. Using cutting-edge technology, our platform and applications are consumed by fans, stadiums, and MLB teams We are assembling a world-class team to build on these experiences, to scale platforms and products that anticipate emerging opportunities, including dynamic pricing and offers and digital, contactless ticketing. Our mission is to provide premium, innovative live experiences for our clients and their patrons. Tickets.com is looking for an Integration Engineer passionate about building engaging products for our fans. The Opportunity: The Integration Engineer will join the Integrated Services team at Tickets.com and will assist in delivering high-quality and validated technology solutions for existing and emerging technology initiatives. The Integration Engineer will participate in extensive research on new technology to assist in documenting business opportunities and use cases. The Integration Engineer will evaluate, recommend, test, design, plan and coordinate the integration of emerging technology, software applications and equipment to deliver newly reimagined solutions across MLB properties. The Integration Engineer will aim to speed deployments of these technology innovations through use of automation or other robotics or machine learning to accelerate the company’s technology agenda. The Integration Engineer is a technology generalist who is a clear thinker who can understand and execute complex test plans and work with a wide range of production, broadcast, and IT products. With expert-level knowledge of emerging technology, networking, and application concepts you will have the opportunity to serve as a subject matter expert and be a point of escalation to operational support teams. Essential Job Functions: The ideal candidate would have been exposed to cutting-edge equipment and software application technologies focused on cloud connectivity in a patron-facing environment with an emphasis on providing highly reliable, resilient, efficient, and secure service. Act with integrity and respect. Apply and obey applicable statutes, laws, regulations, and internal policies. Apply general knowledge of technologies, computer processes and systems in support of project team and customer issues/requests to drive completion of all assignments. Act as a contributing team member with ownership over existing and new data communications equipment including installation, configuration, inventory management, and repairs. Accumulate extensive technical knowledge of proprietary software and hardware products and demonstrate a thorough understanding of product features, capabilities, standard error messages, operating systems, file relationships and complex software issues. Help to develop and communicate plans for investing in new technology solutions, including identifying cost reduction opportunities. Review and evaluate products in the pilot stage to further lead discussions on learnings and recommend the best way forward with business. Lead Proof of Concept requirements, technical evaluation and play a part in program maturity while taking a new product from pilot to production. Collaborate with other business units on the development of innovative ideas, processes and practices that will improve MLB offerings or patron experience. Elicit and consolidate information from stakeholders and industry to inform project activities ensuring alignment with strategic business objectives and future needs. Identify product issues, develop risk mitigation strategies and implementation plans; recognize problems, evaluate alternatives and recommend solutions. Build the framework for scaling emerging products. Research and recommend innovative approaches, tools, and techniques to further enhance solution efficiency. Ensure quality assurance and compliance obligations through the implementation of process improvements to maintain rigor and excellence in emerging technologies project activities. Provide escalation product support while triaging (identify, analyze, prioritize and classify) product deficiencies / enhancement requests and bug fixes. Perform Operational Readiness Testing for software and hardware products. Develop, document and recommend actionable bug fixes and enhancements to software products through daily interactions on a Sprint Team. Create, update and maintain documentation related to equipment or application configurations and configuration instructions. Requirements: Ability to execute tasks with high accuracy and thoroughness, maintain confidentiality while dealing with sensitive information. Bachelor's degree in Information Technology, Information Security, Cybersecurity, Computer Science, or a related technology field. Minimum of 5 years in a role exposed to delivering technology solutions. A flexible schedule with ability to provide weekend and evening support. Ability to travel to remote locations as needed. Must exhibit interest in new technology and apply to business solutions. Be able to demonstrate good knowledge of relational database concepts along with one or more of the following: SQL, VBScript PERL, JavaScript. Advanced knowledge of application delivery components and able to demonstrate skill in troubleshooting load-balanced, multi-tiered containerized & legacy applications. Excellent understanding of scripting and declarative languages is a plus. (e.g., Bash, GO, Python, HashiCorp Configuration Language HCL) A basic degree of comfort interacting with APIs is a plus. (e.g., Postman, Paw, Insomnia, etc.) Experience with enterprise support and communications tools and platforms like ServiceNow, Splunk, Jira, TestRails, Slack, Teams and Zoom. Basic knowledge of networking concepts, including topology, IP networking, protocols, components, and principles. Knowledge and experience setting up and troubleshooting broadcast equipment and IT equipment such as printers, routers, switches, Wi-Fi access points, and Android OS devices (handhelds & tablets). Experience working with an EMM solution such as Soti, VMWare, Samsung Knox, or JAMF. Basic understanding and experience working with logging and monitoring tools such as Splunk, Orion, GCP Logs Explorer, Datadog, Logstash, or Nagios. Excellent writing skills for technical and non-technical documents. Solid analytical, problem solving and decision-making skills. Strong verbal communication skills with ability to explain technical concepts to audiences at different levels. We offer an Outstanding Benefits Package that includes: Medical Dental Vision STD & LTD 401K Retirement Plan Basic Life & AD&D Supplemental Life Insurance Paid Time Off (PTO, STO, Holidays including Year-End Holiday Break) HSA & FSA Legal Plan Pet Insurance Tuition Reimbursement MLB Tickets The hiring range for this position is $70,000 to $120,000 Tickets.com is an Equal Opportunity Employer. Job Type: Full-time Pay: $70,000.00 - $120,000.00 per year Benefits: 401(k) Dental insurance Flexible spending account Health insurance Health savings account Life insurance Paid time off Tuition reimbursement Vision insurance Schedule: 8 hour shift Weekend availability Work Location: Hybrid remote in Costa Mesa, CA 92626 Health insurance If you require alternative methods of application or screening, you must approach the employer directly to request this as Indeed is not responsible for the employer's application process.",https://www.indeed.com/jobs?q=Machine+Learning+Engineer&l=Los+Angeles%2C+CA&sc=0kf%3Aattr%28FCGTU%7CHFDVW%7CQJZM9%7CUTPWG%252COR%29explvl%28MID_LEVEL%29jt%28fulltime%29%3B&radius=50&start=40&pp=gQA8AAAAAAAAAAAAAAAB_ipiFgAXAQEJBwXuwx71JG6neQbHRY4WEC2u6dkAAA&vjk=981025209e46a2b2
39,100bc19814410b77,Machine Learning Engineer,"Los Angeles, CA",MID_LEVEL,BACHELORS_DEGREE,fulltime,"Software Engineer, Backend, 3+ Years of Experience - job post Snapchat 59 reviews 63 Market Street, Los Angeles, CA 90291 $140,000 - $196,000 a year -  Full-time You must create an Indeed account before continuing to the company website to apply Apply on company site save-icon Job details Salary $140,000 - $196,000 a year Job Type Full-time Snap Inc is a technology company. We believe the camera presents the greatest opportunity to improve the way people live and communicate. Snap contributes to human progress by empowering people to express themselves, live in the moment, learn about the world, and have fun together. The Company’s three core products are Snapchat , a visual messaging app that enhances your relationships with friends, family, and the world; Lens Studio , an augmented reality platform that powers AR across Snapchat and other services; and its AR glasses, Spectacles . Snap Engineering teams build fun and technically sophisticated products that reach hundreds of millions of Snapchatters around the world, every day. We’re deeply committed to the well-being of everyone in our global community, which is why our values are at the root of everything we do. We move fast, with precision, and always execute with privacy at the forefront. We’re looking for a Backend Engineer to join Snap Inc! What you’ll do: Design, implement, and operate our most critical and scalable services - ranging from user identity services, friend graph, and our core persistence layer Work across teams to understand product requirements, evaluate trade-offs, and deliver the solutions needed to build innovative products You evaluate, appropriately test, and debug your work, striving for high quality Advocate for and apply best practices when it comes to availability, scalability, operational excellence, and cost management Knowledge, Skills & Abilities: Experience with backend services or distributed systems Experience in at least one of the following areas: Large-scale microservices and distributed systems Cloud computing and storage systems Infrastructure and large-scale system design Security Networking and data storage Machine learning and natural language processing tools Proven track record of operating highly-available systems at significant scale Experience with Java, C++, and/or Python Experience with NoSQL solutions, Memcache/Redis, Kubernetes, or Google/AWS services You can independently execute on medium sized features, taking a few weeks and multiple PRs to complete You understand the operational aspects of your system and may participate in incident or hotfix investigation and resolution Ability to collaborate and work well with others Minimum Qualifications: BS/BA degree in a technical field such as Computer Science or equivalent years of experience 3+ years of software development experience Compensation In the United States, work locations are assigned a pay zone which determines the salary range for the position. The successful candidate’s starting pay will be determined based on job-related skills, experience, qualifications, work location, and market conditions. These pay zones may be modified in the future. Zone A (CA, WA, NYC) : The base salary range for this position is $165,000 - 230,000 annually Zone B : The base salary range for this position is $157,000 - 219,000 annually Zone C : The base salary range for this position is $140,000 - 196,000 annually ""Default Together"" Policy at Snap: At Snap Inc. we believe that being together in person helps us build our culture faster, reinforce our values, and serve our community, customers and partners better through dynamic collaboration. To reflect this, we practice a “default together” approach and expect our team members to work in an office at least 80% of the time (an average of 4 days per week). If you are not based in the same location as this role and are open to relocation, we encourage you to apply to take advantage of our generous relocation policy. At Snap, we believe that having a team of diverse backgrounds and voices working together will enable us to create innovative products that improve the way people live and communicate. Snap is proud to be an equal opportunity employer, and committed to providing employment opportunities regardless of race, religious creed, color, national origin, ancestry, physical disability, mental disability, medical condition, genetic information, marital status, sex, gender, gender identity, gender expression, pregnancy, childbirth and breastfeeding, age, sexual orientation, military or veteran status, or any other protected classification, in accordance with applicable federal, state, and local laws. EOE, including disability/vets. If you have a disability or special need that requires accommodation, please don’t be shy and contact us at accommodations-ext@snap.com . Our Benefits : Snap Inc. is its own community, so we’ve got your back! We do our best to make sure you and your loved ones have everything you need to be happy and healthy, on your own terms. Our benefits are built around your needs and include paid parental leave, comprehensive medical coverage, emotional and mental health support programs, and compensation packages that let you share in Snap’s long-term success!",https://www.indeed.com/jobs?q=Machine+Learning+Engineer&l=Los+Angeles%2C+CA&sc=0kf%3Aattr%28FCGTU%7CHFDVW%7CQJZM9%7CUTPWG%252COR%29explvl%28MID_LEVEL%29jt%28fulltime%29%3B&radius=50&start=40&pp=gQA8AAAAAAAAAAAAAAAB_ipiFgAXAQEJBwXuwx71JG6neQbHRY4WEC2u6dkAAA&vjk=100bc19814410b77
