,job_id,job_title,location,experience,education,job_type,job_description,job_link
15,e6644af423894d46,Machine Learning Engineer,"Los Angeles, CA",MID_LEVEL,DOCTORAL_DEGREE,fulltime,"Postdoc: Lidar and PolinSAR/TomoSAR Data Fusion in Monitoring Changes of Vegetation Structure and Surface Topography - job post JPL/NASA 192 reviews 4800 Oak Grove Dr, Pasadena, CA 91109 Full-time You must create an Indeed account before continuing to the company website to apply Apply on company site save-icon Job details Job Type Full-time Job Details New ideas are all around us, but only a few will change the world. That’s our focus at JPL. We ask the biggest questions, then search the universe for answers—literally. We build upon ideas that have guided generations, then share our discoveries to inspire generations to come. Your mission—your opportunity—is to seek out the answers that bring us one step closer. If you’re driven to discover, create, and inspire something that lasts a lifetime and beyond, you’re ready for JPL. Located in Pasadena, California, JPL has a campus-like environment situated on 177 acres in the foothills of the San Gabriel Mountains and offers a work environment unlike any other: we inspire passion, foster innovation, build collaboration, and reward excellence. JPL is unique among NASA Centers in that its staff are Caltech employees, yet can access NASA technical resources. Cross-discipline teamwork is standard here: colleagues across JPL's science and engineering organizations and Caltech's academic campus often work together. Learning to speak and understand other disciplines' languages is a doorway to the creativity needed to do what has not been done before. JPL staff are encouraged to create mission concepts that address humanity's core questions through a combination of science and technology. They are supported in developing ideas into proposals and hardware, and communicating funded missions' results to the scientific community and the broader public. JPL seeks to employ scientists and engineers who are passionate about lifelong learning and excited to contribute to and lead team efforts. We emphasize the importance of partnering across discipline boundaries and creating a friendly, constructive work environment to overcome space exploration's challenges. The postdocs at JPL benefit from an informal mentoring network, an annual conference showcasing their results, a dedicated seminar series, exposure to diverse career paths, and social connections across the JPL and Caltech community for advice on housing, childcare, and other aspects of living in southern California. Existing and upcoming NASA (GEDI and NISAR) and ESA (BIOMASS) Lidar and SAR missions will provide an unprecedented view of changes of vegetation structure and biomass at regional to global scales. Jet Propulsion Laboratory is developing the next generation measurement approaches for a spaceborne implementation to provide high-resolution global Surface Topography and Vegetation structure (STV) as recommended by the National Academy Decadal Survey Study (2017-2027): https://science.nasa.gov/earth-science/decadal-stv. The new approaches will require optimal set of sensors (lidar, SAR, optical stereo photogrammetry) on multiple platforms (airborne and spaceborne) to allow data fusion for systematic and high-resolution observations of STV. The selected candidates will work with a team of scientists and engineers at JPL to study how different observational approaches can contribute to a global STV mission. The postdoc will work with physically-based electromagnetic models to simulate different interferometric SAR observations in PolinSAR and TomoSAR configurations and lidar waveforms over a variety of forest structures and surface topography. These simulations will be compared and analyzed along with observations from airborne and satellite InSAR and lidar sensors to develop data fusion algorithms using statistical or machine learning techniques. The postdoc will use the results of the study to help design different Observing System Simulation Experiments (OSSEs), system tradeoffs, and performance metrics for spaceborne observations. The candidates must have a PhD in one of the following areas: remote sensing, physics and applied mathematics, electrical engineering, computer science, with advanced understanding of lidar and radar remote sensing techniques in forest applications. More specific required qualifications include experience in SAR interferometry, machine learning algorithms, and quantitative geospatial analysis. The successful candidate must have strong programming skills in a scientific languages (e.g. python, MATHLAB, R) and strong background in statistical data analysis. Applicants should have demonstrated quantitative and computational skills, a successful publication record, and the ability to work in an interdisciplinary and innovative research environment. The appointee will carry out research in collaboration with the JPL advisor, resulting in publications in the open literature. Applicants may be subject to additional program requirements by NASA. Postdoc positions are awarded for a minimum of one-year period and may be renewed up to a maximum of three years. Candidates should submit the following to this site: CV, representative publications, contact information for three references, and a cover letter stating their research accomplishments and interests. JPL has a catalog of benefits and perks that span from the traditional to the unique. This includes a variety of health, dental, vision, wellbeing, and retirement plans, paid time off, learning, rideshare, childcare, flexible schedule, parental leave and many more. Our focus is on work-life balance, and living healthy, fulfilling lives as we Dare Mighty Things Together. For benefits eligible positions, benefits are effective the first day of the month coincident with or immediately following the employee’s start date. For further benefits information click Benefits and Perks The hiring range displayed below is specifically for those who will work in or reside in the location listed. In extending an offer, Jet Propulsion Laboratory considers factors including, but not limited to, the candidate’s job related skills, experience, knowledge, and relevant education/training. Hiring range for this job may be adjusted based on primary work location outside of Pasadena, California. This adjusted range will be provided to candidates by the Recruiter when applicable. The typical full time equivalent annual hiring range for this job in Pasadena, California. $82,180 - $82,180 JPL is an Equal Opportunity Employer. All qualified applicants will receive consideration for employment without regard to sex, race, color, religion, national origin, citizenship, ancestry, age, marital status, physical or mental disability, medical condition, genetic information, pregnancy or perceived pregnancy, gender, gender identity, gender expression, sexual orientation, protected military or veteran status or any other characteristic or condition protected by Federal, state or local law. In addition, JPL is a VEVRAA Federal Contractor. EEO is the Law. EEO is the Law Supplement Pay Transparency Nondiscrimination Provision The Jet Propulsion Laboratory is a federal facility. Due to rules imposed by NASA, JPL will not accept applications from citizens of designated countries or those born in a designated country unless they are Legal Permanent Residents of the U.S or have other protected status under 8 U.S.C. 1324b(a)(3). The Designated Countries List is available here.",https://www.indeed.com/jobs?q=Machine+Learning+Engineer&l=Los+Angeles%2C+CA&sc=0kf%3Aattr%286QC5F%252COR%29explvl%28MID_LEVEL%29jt%28fulltime%29%3B&radius=50&start=10&pp=gQAPAAAAAAAAAAAAAAAB_gVDpAAQAQABX26tZa_00AXk4KH4pgAA&vjk=e6644af423894d46
16,34c8b4588bc72cb3,Machine Learning Engineer,"Los Angeles, CA",MID_LEVEL,DOCTORAL_DEGREE,fulltime,"Software Engineer III - job post Teradata 492 reviews El Segundo, CA 90245 • Remote Full-time You must create an Indeed account before continuing to the company website to apply Apply on company site save-icon Job details Job Type Full-time Our Team Teradata Labs is where cutting-edge innovations in data management turn into business value. Our outstanding team of database architects and software engineers work together to understand and advance emerging technologies to produce the next wave of big data analytic solutions. Teradata Database is the core of Teradata Massively Parallel Processing (MPP) systems that run on-premises and in hybrid clouds to manage and optimize sophisticated workloads. The heart of Teradata Database is its best-in-class query optimization engine. We work on query optimization techniques in database and analytics engines, machine learning algorithms, scalability and elasticity issues, and many other exciting challenges related to performance, usability, accessibility and integration. Your Opportunity The Database Query Optimization group at Teradata Labs has an opening for Sr Software Engineer. In this role, you are expected to contribute to the design, development, and testing of new enhancements and advanced features for the Teradata Vantage Cloud Lake (VCL) Platform. Responsibilities / Interesting Work You’ll Do Responsible for all phases of agile software development life cycle from software design through customer support Perform competitive analysis of other database systems and data integration solutions, and provide recommendations on Teradata offering changes to close competitive gaps and enhance competitive advantages Design, implement, validate, and test new database and novel query optimization features in an Agile form, and perform functional and performance analysis of code defects and correction of the defects Contribute to the delivery and continuous support of robust, resilient, and quality database products Design, implementation, and maintenance of the LLVM-based query Parsing Engine Qualifications / Experience Bachelor’s Degree in Computer Science or related discipline, with at least five years of related research or industry, or Master’s Degree in Computer Science or related discipline, with at least three years of related research or industry experience, or Ph.D. in Computer Science or related discipline Ideally, you will also have the following Prior experience of working with LLVM open source project is a plus Familiarity with various database technologies Top-notch programming skills in C/C++, Java, Python, R, SQL Computer Science fundamentals in object-oriented design, design patterns, and test driver development System development experience Debugging with complex software in a parallel processing environment Passionate, self-motivated, risk taker, pro-active, initiative taker, good communicator (written & verbal), creative, and team-oriented Experience using Agile software development methods and tools Excellent programming/debugging skills at the Assembly level is a plus Basic Qualifications Bachelor’s Degree in Computer Science or related discipline, with 5+ years of related research or industry, or 10 years of related experience Location The work location for the open positions is El Segundo, California (primarily) or Rancho Bernardo in San Diego, California or Remote location within US. Travel requirements : 5%.",https://www.indeed.com/jobs?q=Machine+Learning+Engineer&l=Los+Angeles%2C+CA&sc=0kf%3Aattr%286QC5F%252COR%29explvl%28MID_LEVEL%29jt%28fulltime%29%3B&radius=50&start=10&pp=gQAPAAAAAAAAAAAAAAAB_gVDpAAQAQABX26tZa_00AXk4KH4pgAA&vjk=34c8b4588bc72cb3
17,e098a9ccb03f2f26,Machine Learning Engineer,"Los Angeles, CA",MID_LEVEL,DOCTORAL_DEGREE,fulltime,"Senior Software & Algorithm Engineer- ADAS - job post Mullen Technologies, Inc 6 reviews Irvine, CA $150,000 - $175,000 a year -  Full-time Apply now Apply now save-icon Job details Salary $150,000 - $175,000 a year Job Type Full-time Senior Software & Algorithm Engineer- ADAS Mullen Automotive, Inc. is a diverse group of people, partners, and organizations committed to the development, sustainability, and affordability of clean energy. Mullen is an electric vehicle manufacturer of USDOT certified vehicles utilizing state-of-the-art battery and energy technologies. Mullen is committed to providing superior quality and unparalleled customer service in all aspects of our business. We believe each employee contributes to the success and growth of our Company. The Senior Software & Algorithm Engineer is a vital part of our team. The position is responsible for handling ADAS algorithm & software development tasks. This is a fast-paced working environment in order to hit our high standards. Responsibilities (Included but not limited to): As Senior Software & Algorithm Engineer, you will develop and maintain software for vehicle perception using various sensor input devices including cameras, radars, ultrasonic parking sensors, GPS/GNSS, IMU, Lidars, compute unit, etc. on vehicle. · Develop, maintain, and deliver software with high quality control for ADAS features proposed. · Research, design, simulate, specify, implement, debug, and test the control and estimation algorithms for autonomous driving applications with motion planning both in along track and cross track directions. · Work with the hardware team to identify the best sensor locations for correct performance of the algorithms the software team proposes. · Develop unit test cases and write simulation test cases for software validation of the developed ADAS software in compliance with ISO26262. · Work collaboratively with responsible electrical, mechanical, and firmware engineers and establish control system capabilities. · Work with software contractors as needed to support development of driver side HMI-human machine interface that can be integrated into the infotainment system display. · Work on vehicle control integration and methodologies. Requirements/Qualifications (included but not limited to): · MS/PhD in ME, EE, Computer Science, or equivalent experience in ADAS development. · 3-5 Years of experience in automotive industry deploying control algorithms for ADAS applications. · Good communication skills, high level of interpersonal skills, self-motivated, comfortable operating independently as well as in a team environment. · Software Development in C++ and data analysis in Python. Expert programming ability in C, C++, and Python. · Strong experience in minimum of two areas: motion planning and control, camera perception algorithms, or sensor fusion. Great To Have · Experience with AI machine learning, deep neural networks, convolutional neural networks, data processing and perception modeling. · Professional experience in embedded software integration for complex electronic devices like ECUs-electronic control units. · Experience in software design and development of safety critical systems and components. · Experience in automotive network protocols such as CAN, Flex ray, Ethernet, Coax, etc. · Familiar with operating systems concepts-AUTOSAR, embedded Linux, Automotive Grade Linux, ROS, etc. · Experience in functional safety, and ISO 26262 · Software in the loop testing experience · Experience in agile methodology of software development. Travel Requirements · 20 % as needed to support development activities. Mullen Automotive is an Equal Opportunity/Affirmative Action Employer dedicated to a policy of compliance with all federal, state, and local laws regarding nondiscrimination in employment. No questions included in our application process are intended to secure information to be used for unlawful purposes. All qualified applicants will receive consideration for employment without regard to race, color, religion, sex, sexual orientation, gender identity, national origin, disability or veteran status. Consistent with the provisions of the Americans With Disabilities Act (ADA), applicants may request accommodations needed to participate in the application process. Job Type: Full-time Pay: $150,000.00 - $175,000.00 per year Benefits: Health insurance Life insurance Paid time off Vision insurance Schedule: 8 hour shift Monday to Friday Ability to commute/relocate: Irvine, CA: Reliably commute or planning to relocate before starting work (Required) Experience: ADAS: 1 year (Preferred) Work Location: One location Health insurance If you require alternative methods of application or screening, you must approach the employer directly to request this as Indeed is not responsible for the employer's application process.",https://www.indeed.com/jobs?q=Machine+Learning+Engineer&l=Los+Angeles%2C+CA&sc=0kf%3Aattr%286QC5F%252COR%29explvl%28MID_LEVEL%29jt%28fulltime%29%3B&radius=50&start=10&pp=gQAPAAAAAAAAAAAAAAAB_gVDpAAQAQABX26tZa_00AXk4KH4pgAA&vjk=e098a9ccb03f2f26
18,1d12999a6b3b6736,Machine Learning Engineer,"Los Angeles, CA",MID_LEVEL,DOCTORAL_DEGREE,fulltime,"Clinical Research Data Specialist II - Butte Lab - Department of Neurosurgery - job post CEDARS-SINAI 1,179 reviews Los Angeles, CA $64,800 - $110,000 a year -  Full-time You must create an Indeed account before continuing to the company website to apply Apply on company site save-icon Job details Salary $64,800 - $110,000 a year Job Type Full-time Grow your career at Cedars-Sinai! Cedars-Sinai offers a culture of happiness, passion, and dedication. This is one of the many reasons why we rank as one of the top hospitals in California and in the nation by U.S. News & World Report. The Clinical Research Data Specialist II manages the data for assigned research studies. The incumbent will be involved in the design, development and building of ground breaking medical imaging systems in addition to being part of the team conducting clinical trials. The role will provide an outstanding opportunity to work with a multidisciplinary team involving optical engineers, mechanical engineers, electrical engineers, biomedical engineers as well as surgeons and other medical personnel. The Clinical Research Data Specialist II will participate in the development and possible commercialization of medical device technology. In addition, the position will offer experience with other technicians, with clinical trials, collecting clinical data, and following clinical protocols. The position will also provide opportunity to work on medical technology with far reaching and immediate impact on patients’ lives. Working under direct supervision, the incumbent performs routine and increasingly complex laboratory tasks and procedures and develops technical expertise in one or more areas relevant to research projects. The talent in this position will participate in research activities involving all aspects of the research process, to include, but not limited to; development design, investigation, technical, testing/validation of results, and report findings (including developing independent presentations). The Clinical Research Data Specialist II will observe and follow safety standards and procedures, assist in preparation of data for publication and/or presentation at scholarly meetings, and assist in general laboratory maintenance. This position does not have supervisory responsibilities. #Jobs Primary Duties and Responsibilities: May work with bioinformatics in the development and maintenance of clinical trials management systems including validation of systems. May train clinical research staff to help improve the quality of the data being collected. May solve operational/data problems in consultation with other employees and/or supervisors. May perform basic statistical analysis in conjunction with a biostatistician. Manages data for research studies. Designs forms for data collection and performs clinical data abstraction. Develop machine learning (ML/AI) models for classification using biological signals. Develop neural network models for classification of time-series signals. Processes clinical data using a range of computer applications and database systems to support cleaning and management of subject or patient data. Produces project reports. Maintains the accuracy, integrity, and security of complex, large computerized records systems. Performs data searches and other related administrative tasks. Ensures compliance with all federal and local agencies including the Food and Drug Administration (FDA) and local Institutional Review Board. Maintains research practices using Good Clinical Practice (GCP) guidelines. Maintains strict patient confidentiality according to HIPAA regulations and applicable law. Department-Specific Responsibilities: Develops and maintains scalable python backend system code using best system architectural practices. Develops and maintains frontend system using either PyQt or cross platform UI system of your choice. Collaborates with engineering team to propose technical solutions to build and scale our clinical software system. Education: Bachelor's degree (BA or BS) is required. Master of Science degree or PhD in a related Science degree are preferred. Experience: 2+ years of relevant experience in a similar position is required. Experience with C, C++, or Rust. Extensive hands-on experience developing Python based front-end and back-end systems. Proficient-level DevOps experience in either AWS, GCS or similar to stand-up a system. Understanding of security best practices for an API system. Physical Demands: Position requires working with computers for extended periods and the use of specialized laboratory equipment. Must be able to sit, stand and/or stoop for long periods. Must be able to lift at least 20 pounds. Working Title: Clinical Research Data Specialist II - Butte Lab - Department of Neurosurgery Department: Home Dept-Black Business Entity: Academic / Research Job Category: Academic/Research Job Specialty: Research Studies/Clinical Trials Position Type: Full-time Shift Length: 8 hour shift Shift Type: Day Base Pay: $64,800.00 - $110,000.00",https://www.indeed.com/jobs?q=Machine+Learning+Engineer&l=Los+Angeles%2C+CA&sc=0kf%3Aattr%286QC5F%252COR%29explvl%28MID_LEVEL%29jt%28fulltime%29%3B&radius=50&start=10&pp=gQAPAAAAAAAAAAAAAAAB_gVDpAAQAQABX26tZa_00AXk4KH4pgAA&vjk=1d12999a6b3b6736
