,job_id,job_title,location,experience,education,job_type,job_description,job_link
8,65f17f9afae54104,Machine Learning Engineer,"Los Angeles, CA",MID_LEVEL,DOCTORAL_DEGREE,fulltime,"Propulsion Engineer II - job post JPL/NASA 192 reviews 4800 Oak Grove Dr, Pasadena, CA 91109 Full-time You must create an Indeed account before continuing to the company website to apply Apply on company site save-icon Job details Job Type Full-time Job Details New ideas are all around us, but only a few will change the world. That’s our focus at JPL. We ask the biggest questions, then search the universe for answers—literally. We build upon ideas that have guided generations, then share our discoveries to inspire generations to come. Your mission—your opportunity—is to seek out the answers that bring us one step closer. If you’re driven to discover, create, and inspire something that lasts a lifetime and beyond, you’re ready for JPL. Located in Pasadena, California, JPL has a campus-like environment situated on 177 acres in the foothills of the San Gabriel Mountains and offers a work environment unlike any other: we inspire passion, foster innovation, build collaboration, and reward excellence. Will be working for JPL's Propulsion, Thermal and Materials Engineering Section which provides leadership and unique world-class expertise in a wide range of technologies and technical discipline areas of chemical and electrical propulsion, thermal, materials, contamination control, analytical chemistry, geochemical instruments, physics-based modeling, and multiphase flow. Will be a member of the Chemical Propulsion and Fluid Flight Systems Group and will support senior propulsion engineers responsible for all phases of development of propulsion as well as instrument fluid systems. These phases include mission studies, system analyses, component procurement, component and subsystem testing and flight qualification, as well as flight operations. Your responsibilities include: In compliance with programmatic constraints, investigates, plans, designs and develops, mechanical products and systems such as spacecraft, instruments, robots, packaged electronics, controls, engines, and machines, and mechanical, thermal, hydraulic, propulsion, or heat transfer systems for the production, transmission, measurement, and use of energy. Maintains cognizance of and is responsible for all technical and programmatic aspects of the product being developed, reporting the status and performance to the appropriate organizations. Applies research to the planning, design, development, and testing of mechanical and/or electromechanical systems, instruments, controls, engines, and/or machines. Evaluates and devises approaches to meet engineering requirements. Partners with other engineers and project personnel to evaluate tests and verify mechanical products or systems. Develops new technologies and concepts for improvement of existing and future products. Attends subsystem reviews and answers questions regarding own analysis. Applies broad knowledge in field to evaluate customer engineering requirements and devises approaches to meet requirements. Develops and prepares complex requirements and interface agreements. Performs complex analyses and trade studies. Publishes own work at conference proceedings. Applies extensive understanding and application in field of knowledge to contribute proposal data and graphic analysis on Proposal or Concept Study Report (CSR) Development. Adapts complex technical models to create improved products for the organization. Performs complex and varied job functions and activities within discipline. Works independently on important assignments and projects with only limited supervision, typically receiving only general instructions. Exercises discretion and independent judgment to compare and evaluate various methods, approaches, and resources and decide which will best accomplish each aspect of such assignments and projects. Regular use of creativity and innovation to address important issues. Analysis of situation or data requires identification, review and interpretation of complex factors as well as decisions as to policies, procedures and practices. Exercises discretion and independent judgment in evaluating potential approaches and solutions to significant problems and determining appropriate resolutions. Interactions normally involve exchanging and validating comprehensive and analytical information. Frequent interaction with customers and peers inside and outside organization on significant matters. Occasional interactions with industry organizations. Contributes as a key team member on teams inside or outside own organization, project, activity or function. May lead teams. Required Qualifications: Typically requires a Bachelors in Mechanical or Aerospace Engineering, or related technical discipline with 3 years of related experience; Masters with 1 year of related experience; or PhD with 0 years of related experience. At least a 3.5 GPA if graduated within the last two years. Familiarity with Microsoft Office applications and with commercial computer-aided analysis and/or design programs. Educational background and/or work experience in the application of advanced fluid mechanics, thermodynamics, heat and mass transfer, advanced measurement techniques electromagnetic systems, and rocket propulsion principles for propulsion, power, and fluid systems. Desired Skills: Knowledge of applicable Laboratory policies and procedures, NASA policies and procedures, and government regulations. Experience in advanced propulsion technology, design and analysis of spacecraft or satellite propulsion systems and knowledge of attitude control systems. Ability to work as a member of a team as well as independently. Ability to work under general supervision and use independent judgment to perform assignments of moderate complexity. Experience with commercial computer-aided analysis and design programs such as MatLab and Unigraphics CAD. Good verbal and written communication skills. JPL has a catalog of benefits and perks that span from the traditional to the unique. This includes a variety of health, dental, vision, wellbeing, and retirement plans, paid time off, learning, rideshare, childcare, flexible schedule, parental leave and many more. Our focus is on work-life balance, and living healthy, fulfilling lives as we Dare Mighty Things Together. For benefits eligible positions, benefits are effective the first day of the month coincident with or immediately following the employee’s start date. For further benefits information click Benefits and Perks The hiring range displayed below is specifically for those who will work in or reside in the location listed. In extending an offer, Jet Propulsion Laboratory considers factors including, but not limited to, the candidate’s job related skills, experience, knowledge, and relevant education/training. Hiring range for this job may be adjusted based on primary work location outside of Pasadena, California. This adjusted range will be provided to candidates by the Recruiter when applicable. The typical full time equivalent annual hiring range for this job in Pasadena, California. $96,096 - $117,104 JPL is an Equal Opportunity Employer. All qualified applicants will receive consideration for employment without regard to sex, race, color, religion, national origin, citizenship, ancestry, age, marital status, physical or mental disability, medical condition, genetic information, pregnancy or perceived pregnancy, gender, gender identity, gender expression, sexual orientation, protected military or veteran status or any other characteristic or condition protected by Federal, state or local law. In addition, JPL is a VEVRAA Federal Contractor. EEO is the Law. EEO is the Law Supplement Pay Transparency Nondiscrimination Provision The Jet Propulsion Laboratory is a federal facility. Due to rules imposed by NASA, JPL will not accept applications from citizens of designated countries or those born in a designated country unless they are Legal Permanent Residents of the U.S or have other protected status under 8 U.S.C. 1324b(a)(3). The Designated Countries List is available here.",https://www.indeed.com/jobs?q=Machine+Learning+Engineer&l=Los+Angeles%2C+CA&sc=0kf%3Aattr%286QC5F%252COR%29explvl%28MID_LEVEL%29jt%28fulltime%29%3B&vjk=65f17f9afae54104
9,522ea97272c25970,Machine Learning Engineer,"Los Angeles, CA",MID_LEVEL,DOCTORAL_DEGREE,fulltime,"Robotics Mechanical Engineer II - job post JPL/NASA 192 reviews 4800 Oak Grove Dr, Pasadena, CA 91109 Full-time You must create an Indeed account before continuing to the company website to apply Apply on company site save-icon Job details Job Type Full-time Job Details New ideas are all around us, but only a few will change the world. That’s our focus at JPL. We ask the biggest questions, then search the universe for answers—literally. We build upon ideas that have guided generations, then share our discoveries to inspire generations to come. Your mission—your opportunity—is to seek out the answers that bring us one step closer. If you’re driven to discover, create, and inspire something that lasts a lifetime and beyond, you’re ready for JPL. Located in Pasadena, California, JPL has a campus-like environment situated on 177 acres in the foothills of the San Gabriel Mountains and offers a work environment unlike any other: we inspire passion, foster innovation, build collaboration, and reward excellence. New ideas are all around us, but only a few will change the world. That’s our focus at JPL. We ask the biggest questions, then search the universe for answers—literally. We build upon ideas that have guided generations, then share our discoveries to inspire generations to come. Your mission—your opportunity—is to seek out the answers that bring us one step closer. If you’re driven to discover, create, and inspire something that lasts a lifetime and beyond, you’re ready for JPL. Located in Pasadena, California, JPL has a campus-like environment situated on 177 acres in the foothills of the San Gabriel Mountains and offers a work environment unlike any other: we inspire passion, foster innovation, build collaboration, and reward excellence. Responsibilities: The Jet Propulsion Laboratory (JPL) is NASA’s lead center for robotic space exploration. Our core proficiency is the end-to-end implementation of unprecedented robotic space missions to study Earth, the Solar System, and the Universe. This outstanding opportunity is within the Autonomous Systems Division. This division is responsible for technology development, advanced concepts, design, development, delivery, integration and test, verification and validation, and operation of Command and Data Handling (C&DH) Hardware, Flight Software, Power Systems, Robotic Systems, and Guidance and Control. The opportunity is being offered by the Robotics and Autonomous Systems Section. Wanted: A Robotics Mechanical Engineer who is passionate about supporting the development of robotic systems, e.g. chassis, actuation, and instrumentation systems for climbing/roving/flying robots, robotic arms, testbeds, and ground support equipment (GSE) for terrestrial and space systems. The systems you will work on span the range of early technology development, to verification and validation of flight systems relative to project requirements. Future roles may include concept development for robotic systems or components, trade studies and documentation, detailed design and analysis, presentation of designs and analysis to review boards, fabrication of parts, specification of purchased parts, assembly of prototypes and flight hardware, and development/verification testing. You may be working at the individual level with some oversight, as a part of a larger team, or leading a small technical team. The role is directed by the Group Supervisor within the Extreme Environment Robotics Systems Group . Potential work includes both research and flight projects such as: Mars Sample Return Lander Mars Sample Recovery Helicopters Mars Sample Return Capture/Contain, and Return System Robotic Arm Technology demonstration mission for the Moon Collaborative Robotics demonstration mission for the Moon Europa and Enceladus Sampling Concepts Mine exploration and rescue robots Autonomous underwater vehicles Climbing robots Unmanned aerial vehicles Qualifications: Bachelor’s degree in Mechanical Engineering, Mechatronics, Robotics, or related technical field with typically a minimum of 3 years related experience; Master’s degree with a minimum of 1 years related experience; PhD with 0 years of experience. Hands-on experience with analysis, design, and fabrication of mechatronic systems or actuated and instrumented robotic systems, including robotic arms, unmanned aerial vehicles, submersible vehicles, rovers, or autonomous cars. Understanding and history applying engineering principles, theories, concepts and techniques in solving mechanical design problems; performing trade studies; developing design requirements. Experience developing piece-parts and mechanical systems; and taking part in fabrication, assembly, and test of mechanical, aerospace or robotic systems. Experience and skill in design and analysis using one or more CAD programs tools such as: SolidWorks, Siemens NX, Pro/ENGINEER, Autodesk Fusion 360. High level of proficiency in use of one more numerical analysis tool kits such as MATLAB, Python, Excel etc. Experience applying bolted joint analysis, finite element analysis, geometric dimensioning and tolerancing, traditional manufacturing processes, additive manufacturing, rapid prototyping, material selection, structures, and mechanisms. Experience working on small teams, project planning, and task management. Proficiency using MS Office suite of business software. Ability to detail, document, and communicate work performed through verbal and written means. Desired qualifications: Hands on experience working with two or more of the following: Mechatronics, Electro-Mechanical, or Automation Systems Motor Controllers Robotic Mobility Systems Robotic Sampling Systems Robotic Grasping Systems Robotic Manipulation Systems Machine Vision Systems Robotic Motion Planning Experience within robotics, aerospace, or automotive student or hobbyist clubs, or competition teams, such as FIRST, RoboSub, Robocup, FSAE, etc. Past involvement with makerspaces or manufacturing studios. Familiarity with UNIX operating systems. Familiarity with robotic operating systems, machine vision, simulation and/or autonomy software such as ROS, OpenCV, Gazebo, etc. Outdoor field testing experience; outdoor field work/hiking/rock climbing/mountaineering/off-roading experience. Experience with maintaining and piloting small unmanned aerial vehicles / drones. JPL has a catalog of benefits and perks that span from the traditional to the unique. This includes a variety of health, dental, vision, wellbeing, and retirement plans, paid time off, learning, rideshare, childcare, flexible schedule, parental leave and many more. Our focus is on work-life balance, and living healthy, fulfilling lives as we Dare Mighty Things Together. For benefits eligible positions, benefits are effective the first day of the month coincident with or immediately following the employee’s start date. For further benefits information click Benefits and Perks The hiring range displayed below is specifically for those who will work in or reside in the location listed. In extending an offer, Jet Propulsion Laboratory considers factors including, but not limited to, the candidate’s job related skills, experience, knowledge, and relevant education/training. Hiring range for this job may be adjusted based on primary work location outside of Pasadena, California. This adjusted range will be provided to candidates by the Recruiter when applicable. The typical full time equivalent annual hiring range for this job in Pasadena, California. $109,408 - $139,672 JPL is an Equal Opportunity Employer. All qualified applicants will receive consideration for employment without regard to sex, race, color, religion, national origin, citizenship, ancestry, age, marital status, physical or mental disability, medical condition, genetic information, pregnancy or perceived pregnancy, gender, gender identity, gender expression, sexual orientation, protected military or veteran status or any other characteristic or condition protected by Federal, state or local law. In addition, JPL is a VEVRAA Federal Contractor. EEO is the Law. EEO is the Law Supplement Pay Transparency Nondiscrimination Provision The Jet Propulsion Laboratory is a federal facility. Due to rules imposed by NASA, JPL will not accept applications from citizens of designated countries or those born in a designated country unless they are Legal Permanent Residents of the U.S or have other protected status under 8 U.S.C. 1324b(a)(3). The Designated Countries List is available here.",https://www.indeed.com/jobs?q=Machine+Learning+Engineer&l=Los+Angeles%2C+CA&sc=0kf%3Aattr%286QC5F%252COR%29explvl%28MID_LEVEL%29jt%28fulltime%29%3B&vjk=522ea97272c25970
10,8bede6df40f2fe2c,Machine Learning Engineer,"Los Angeles, CA",MID_LEVEL,DOCTORAL_DEGREE,fulltime,"Computational Scientist 2, Structural and Computational Biology - job post Genentech (part of Roche) 1,023 reviews Los Angeles, CA 90001 Full-time You must create an Indeed account before continuing to the company website to apply Apply on company site save-icon Job details Job Type Full-time The Position We are looking for talented Senior Scientific Researchers to join Prescient Design, a division devoted to developing new methods for protein design, combining structural and machine learning based approaches, within Genentech’s Research and Early Development (gRED) organization. The successful candidate will be part of dynamic, motivated, and multidisciplinary teams to analyze and design biomolecular sequences and structures, with special application to protein therapeutics. The Role: You will join Prescient Design within gRED. You will contribute to cross-functional teams including machine learning scientists and computational biologists within Prescient Design, as well as biologists and engineers in other departments in gRED. You will develop structural/computational biology workflows and/or machine learning methods to analyze existing, and design new, biomolecular structures You will be expected to form close working relationships with protein therapeutic development efforts across the gRED organization. You will be expected to contribute to and drive publications and present results at internal and external scientific conferences. Qualifications: PhD degree in Computational, Chemical, or Structural Biology or related disciplines, or a BS/MS degree in the above disciplines with 2+ years of research experience. Demonstrated experience with Python and analysis of protein structure and/or sequence data. Record of achievement, including at least one first author publication or equivalent. Strong communication and collaboration skills. Additional desired qualifications: Familiarity with data analysis in Pandas and related scientific Python libraries. Experience with structural modeling platforms such as those devised to model and design biological macromolecules (e.g., Rosetta; OpenMM; Modeller). Experience in one of these areas: antibody optimization or discovery, protein or peptide structure, computational chemistry. Public portfolio of computational projects (available on e.g. GitHub). Relocation will be offered to the Los Angeles area for the selected candidate. The expected salary range for this position based on the primary location of Los Angeles, CA is insert $104,500 and $194,100. Actual pay will be determined based on experience, qualifications, geographic location, and other job-related factors permitted by law. A discretionary annual bonus may be available based on individual and Company performance. This position also qualifies for the benefits detailed at the link provided below. Benefits #LI-DC1 Genentech is an equal opportunity employer, and we embrace the increasingly diverse world around us. Genentech prohibits unlawful discrimination based on race, color, religion, gender, sexual orientation, gender identity or expression, national origin or ancestry, age, disability, marital status and veteran status. Genentech requires all new hires to be fully vaccinated against COVID-19 as of their start date. This requirement is a condition of employment at Genentech, and it applies regardless of whether the position is located at a Genentech campus or is fully remote. If you are unable to receive the vaccine due to a disability or serious medical condition, or because it is prohibited as a result of your sincerely held religious beliefs, you will have an opportunity to request a reasonable accommodation.",https://www.indeed.com/jobs?q=Machine+Learning+Engineer&l=Los+Angeles%2C+CA&sc=0kf%3Aattr%286QC5F%252COR%29explvl%28MID_LEVEL%29jt%28fulltime%29%3B&vjk=8bede6df40f2fe2c
