,job_id,job_title,location,experience,education,job_type,job_description,job_link
26,1fa7612b0669ed1e,Machine Learning Engineer,"Los Angeles, CA",MID_LEVEL,BACHELORS_DEGREE,fulltime,"Automation / Controls Engineer - job post Meissner Filtration Products 32 reviews 1001 Flynn Rd, Camarillo, CA 93012 Full-time You must create an Indeed account before continuing to the company website to apply Apply on company site save-icon Job details Job Type Full-time Overview: Do you love the idea of working with a passionate and professional Engineering team in an environment dedicated to having a positive impact on the human condition? Who is Meissner? The goal at Meissner is to be more than simply good; it is to be extraordinary. Extraordinary performance comes from extraordinary people. Meissner as a group is passionate about helping our clients manufacture lifesaving and life enhancing drugs, therapies, and vaccines. We develop, manufacture, supply and service advanced microfiltration products and single-use systems worldwide. We know that when you are passionate about what you do, it’s more than just a job. Meissner is focused on the development of the whole individual, and we have programs and tools in place to help us stay at our best mentally and physically. In alignment with our commitment to support the growth and development of the whole individual, Meissner has inaugurated a Learning and Development department to solely focus on cultivating our team. When you grow, we grow. Responsibilities: The Automation / Controls Engineer will develop wiring diagrams, program logic and specify components for electrical controls in new machine equipment design. Assist in building and troubleshooting of new equipment as well as assist with troubleshooting, maintaining, and upgrading existing equipment. How you will make an impact: Work with engineering to develop and build new equipment. Design/Layout electrical schematics/systems. Develop PLC logic and HMI interface. Integrate motor controls including Stepper Motors, Servo’s and VFD’s. Design panel layouts for new equipment. Utilize CAD skills to develop 2D electrical schematics and drawings. Qualifications: The skills and experience you’ll need: Bachelor’s Degree in an appropriate Engineering discipline such as Electrical Engineering, Computer Engineering, Manufacturing Engineering, Mechanical Engineering or 3 to 5 years working experience in a similar position preferred. PLC Programming experience with ladder logic is preferred. HMI/SCADA programming is preferred. Proficient in 2D CAD and drafting software, AutoCAD or AutoCAD Electrical preferred. Proficient with MS Office software including Outlook, Word, PowerPoint, Excel and a working knowledge of a wide variety of software packages, operating systems, and equipment. Must have strong English Language written and verbal communication skills. Don’t meet every single requirement? Apply anyway. What we can offer you: Full Medical, Dental and Vision coverage with HSA Employer Contributions for eligible plans Additional Perks- HQ Onsite Full Gym, Ultramodern Coffee Bars, Free EV Charging Stations, Employee Discounts 401k, Profit Sharing, 401k Advisory Services Employee Assistance Program Paid Time Off, Paid Holidays, Anniversary Holiday Ready to make an impact? Let’s talk. Meissner Filtration Products is proud to be an Equal Opportunity Employer. The base pay scale for this role is what Meissner reasonably expects to pay for the position although actual pay may vary from this scale depending on an applicant's experience.",https://www.indeed.com/jobs?q=Machine+Learning+Engineer&l=Los+Angeles%2C+CA&sc=0kf%3Aattr%28FCGTU%7CHFDVW%7CQJZM9%7CUTPWG%252COR%29explvl%28MID_LEVEL%29jt%28fulltime%29%3B&radius=50&start=30&pp=gQAtAAAAAAAAAAAAAAAB_ipiFgAeAQIBBxAGH3aw_8v2YbZPhXOfxmMkINwN2NeWQmoRAAA&vjk=1fa7612b0669ed1e
27,53e6366e879beedf,Machine Learning Engineer,"Los Angeles, CA",MID_LEVEL,BACHELORS_DEGREE,fulltime,"Digital Solutions Architect - Orora - job post Orora Packaging Soultions Buena Park, CA 90620 • Hybrid remote $130,000 - $133,000 a year -  Full-time Apply now Apply now save-icon Job details Salary $130,000 - $133,000 a year Job Type Full-time Roles & Responsibilities : Lead a software engineering team in the design, implementation and support of full stack applications running on cloud and on-prem infrastructure. This role will leverage a wide range of advanced skills like frontend and backend programming, database and cloud services to architect innovative modern applications to solve complex problems. Principal Duties: Design and implementation of full stack applications/services running on AWS and Azure. Leverage cloud services like machine learning in a hybrid cloud environment with a microservices based architecture Follow software development best practices and processes to ensure the delivery of robust, secure, scalable and high-quality solutions. Develop and mentor software engineers to develop quality code Work within the Agile framework of continuous delivery Manage day to day team deliverables, assist in troubleshooting, and design reviews. Provide project management and technical leadership for every phase of software delivery. Required Experience: 5+ years of software engineering experience, 3+ years of architecting software applications Ability to lead the development and support of a large software applications Thorough understanding of wide range of business processes Experience working in a fast-paced, agile environment with lean teams Experience using cloud services from AWS and Azure in a DevOps environment Software development expertise with Java, .Net, Python, PHP Expertise with modern web frameworks like HTML5, Javascript, Angular, Typescript, CSS3 Expertise with relational and non-relational Database: mySql, Sql server, NoSql, Redis Virtualization expertise with Docker and Kubernetes. Expertise in CI/CD pipeline design, implementation, and management using Jenkins Software code repository management using GIT Integration experience with Boomi or similar integration tools Working knowledge of operating systems: Linux, Windows Experience with webserver administration Working knowledge of networking concepts like DNS, load balancing & proxying Experience with Adobe AEM, Adobe Mageno, SAP Ariba, and similar cloud technologies desirable. Education: Bachelor’s degree in Computer Science or related field; Or comparable experience. Job Type: Full-time Pay: $130,000.00 - $133,000.00 per year Benefits: 401(k) Dental insurance Health insurance Paid time off Tuition reimbursement Vision insurance Compensation package: Yearly pay Experience level: 5 years Schedule: Monday to Friday Experience: Software development: 5 years (Preferred) Python: 5 years (Preferred) Work Location: Hybrid remote in Buena Park, CA 90620 Health insurance If you require alternative methods of application or screening, you must approach the employer directly to request this as Indeed is not responsible for the employer's application process.",https://www.indeed.com/jobs?q=Machine+Learning+Engineer&l=Los+Angeles%2C+CA&sc=0kf%3Aattr%28FCGTU%7CHFDVW%7CQJZM9%7CUTPWG%252COR%29explvl%28MID_LEVEL%29jt%28fulltime%29%3B&radius=50&start=30&pp=gQAtAAAAAAAAAAAAAAAB_ipiFgAeAQIBBxAGH3aw_8v2YbZPhXOfxmMkINwN2NeWQmoRAAA&vjk=53e6366e879beedf
28,1315684f05475286,Machine Learning Engineer,"Los Angeles, CA",MID_LEVEL,BACHELORS_DEGREE,fulltime,"Lead Support Engineer - job post Elevance Health 5,930 reviews Woodland Hills, CA • Remote Full-time You must create an Indeed account before continuing to the company website to apply Apply on company site save-icon Job details Job Type Full-time Job Family: Development and Engineering Type: Full time Date Posted: Mar 22, 2023 Req #: JR60465 Description Candidates must be authorized to work in the US without current or future sponsorship requirements Responsible for full delivery of end to end system development and maintenance on medium Enterprise wide technology platforms. Primary duties may include, but are not limited to: Customer Service Support Maintains active relationships with customers to determine business requirements and leads requirements gathering meetings and reviews designs with the business. Respond to support inquiries from SNOW/JIRA tickets. Manage war room and rapid response chat support . Coordinate with App Dev team on defect prioritization. Troubleshooting and resolution of all P5/P4 incidents. Working with end users daily on incident management. Monitoring batch and data loading activities. Real-time data quality issue resolution . Environment Support / DevOps Support Providing Environment Services for the entire portfolio. DevOPs integration and configuration management. Agile SAFe PI Train representation and alignment. New environment build, configuration, and setup; may implement improvements in stability, performance, and scalability across major business-critical systems. System configuration changes. Working with business leads on service provisioning. Recommend stability & performance improvements; may implement processes to reduce barriers and roadblocks in projects, services, and processes to operate more efficiently. Code deployment and environment coordination activities; performs technical design reviews and code reviews. Monthly & Off Cycle application release coordination . Coordinate critical business enterprise readiness activities. Owner of N-1 Hardware and Software refresh activities. Machine learning, AI, and Robotics initiative activities. Review and recommend changes based on architecture and capacity reviews. Maintaining vendor relationships with external vendors Operations Support Coordinates and manages on-call support and owns the system monitoring process Provide 24X7 support for all Medical Care Management Applications . SWAT call triage and recovery for outages. Perform root cause analysis for P3-P0 incident tickets. Enterprise patching support and application verification. Ensures unit test is completed and meets the test plan requirements, system testing is completed and system is implemented according to plan; conduct application smoke testing & verification post patching; coordinate annual Disaster Recovery testing. Actively monitor systems and provide system health reports; real-time hardware and resource monitoring support. End to end internal and external system audit support. Security Exception and certificate renewal. Maintain updated software licenses and renewals. Leads multiple and / or large projects and owns the technical development environment Leads vendor evaluation and analysis. Qualifications: Requires an BA/BS degree in Information Technology, Computer Science or related field of study Minimum of 7 years related experience; multi-platform, multi-dimensional experience, and expert level experience with business and technical applications; Or any combination of education and experience, which would provide an equivalent background. Healthcare domain experience required. Experience in Splunk administration including Splunk installation and configuration in client system, dashboard and alert setup and log monitoring. Experience & expertise in DevOps process with implementation of CI/CD model using Atlassian tools (BitBucket, Bamboo) and IBM tools (Urban Deploy) . Preferred Experience Minimum of 6 years experience in healthcare / care management business domain Experience mentoring others and provide troubleshooting support strongly preferred. Multi database and/or multi language strongly preferred. Server Technologies (2 or more): AIX, Unix/Linux, Windows Web/App Servers (2 or more): IBM WebSphere, Liberty, MS IIS, Apache Tomcat Database Technologies (2 or more): MS SQL Server, Oracle DB, IBM DB2 LUW, MongoDB Agile & CI/CD (3 or more): JIRA, Confluence, JFrog, Bamboo, Bitbucket, GIT, BuildForge, uDeploy Monitoring (3 or more): Splunk, Sitescope, Control-M, WLM, Wily Introscope, Netcool, EGMonitor Other Technologies (2 or more): AWS, OpenShift, Informatica, MS SSIS/SSRS For candidates working in person or remotely in California, the salary* range for this specific position is $131,120 to $214,560 In addition to your salary, Elevance Health offers benefits such as, a comprehensive benefits package, incentive and recognition programs, equity stock purchase and 401k contribution (all benefits are subject to eligibility requirements). The salary offered for this specific position is based on a number of legitimate, non-discriminatory factors set by the company. The company is fully committed to ensuring equal pay opportunities for equal work regardless of gender, race, or any other category protected by federal, state, and local pay equity laws. The salary range is the range Elevance Health in good faith believes is the range of possible compensation for this role at the time of this posting. This range may be modified in the future and actual compensation may vary from posting based on geographic location, work experience, education and/or skill level. Even within the range, the actual compensation will vary depending on the above factors as well as market/business considerations. No amount is considered to be wages or compensation until such amount is earned, vested, and determinable under the terms and conditions of the applicable policies and plans. The amount and availability of any bonus, commission, benefits, or any other form of compensation and benefits that are allocable to a particular employee remains in the Company's sole discretion unless and until paid and may be modified at the Company’s sole discretion, consistent with the law Please be advised that Elevance Health only accepts resumes from agencies that have a signed agreement with Elevance Health. Accordingly, Elevance Health is not obligated to pay referral fees to any agency that is not a party to an agreement with Elevance Health. Thus, any unsolicited resumes, including those submitted to hiring managers, are deemed to be the property of Elevance Health. Be part of an Extraordinary Team Elevance Health is a health company dedicated to improving lives and communities – and making healthcare simpler. A Fortune 20 company with a longstanding history in the healthcare industry, we are looking for leaders at all levels of the organization who are passionate about making an impact on our members and the communities we serve. You will thrive in a complex and collaborative environment where you take action and ownership to solve problems and lead change. Do you want to be part of a larger purpose and an evolving, high-performance culture that empowers you to make an impact? We offer a range of market-competitive total rewards that include merit increases, paid holidays, Paid Time Off, and incentive bonus programs (unless covered by a collective bargaining agreement), medical, dental, vision, short and long term disability benefits, 401(k) +match, stock purchase plan, life insurance, wellness programs and financial education resources, to name a few. The health of our associates and communities is a top priority for Elevance Health. We require all new candidates in certain patient/member-facing roles to become vaccinated against COVID-19. If you are not vaccinated, your offer will be rescinded unless you provide – and Elevance Health approves – a valid religious or medical explanation as to why you are not able to get vaccinated that Elevance Health is able to reasonably accommodate. Elevance Health will also follow all relevant federal, state and local laws. Elevance Health has been named as a Fortune Great Place To Work in 2022, has been ranked for five years running as one of the 2023 World’s Most Admired Companies by Fortune magazine, and is a growing Top 20 Fortune 500 Company. To learn more about our company and apply, please visit us at careers.ElevanceHealth.com. Elevance Health is an Equal Employment Opportunity employer and all qualified applicants will receive consideration for employment without regard to age, citizenship status, color, creed, disability, ethnicity, genetic information, gender (including gender identity and gender expression), marital status, national origin, race, religion, sex, sexual orientation, veteran status or any other status or condition protected by applicable federal, state, or local laws. Applicants who require accommodation to participate in the job application process may contact ability@icareerhelp.com for assistance.",https://www.indeed.com/jobs?q=Machine+Learning+Engineer&l=Los+Angeles%2C+CA&sc=0kf%3Aattr%28FCGTU%7CHFDVW%7CQJZM9%7CUTPWG%252COR%29explvl%28MID_LEVEL%29jt%28fulltime%29%3B&radius=50&start=30&pp=gQAtAAAAAAAAAAAAAAAB_ipiFgAeAQIBBxAGH3aw_8v2YbZPhXOfxmMkINwN2NeWQmoRAAA&vjk=1315684f05475286
29,2e2b496527309071,Machine Learning Engineer,"Los Angeles, CA",MID_LEVEL,BACHELORS_DEGREE,fulltime,"Senior Firmware Engineer - job post DPI LABS, INC. 1350 Arrow Highway, La Verne, CA 91750 $95,000 - $145,000 a year -  Full-time Apply now Apply now save-icon Job details Salary $95,000 - $145,000 a year Job Type Full-time SENIOR FIRMWARE ENGINEER Job description DPI Labs is a mid-size player in the aerospace market, our employees get the opportunity to contribute to our success on multiple levels. With limited bureaucracy, as well as a nimble and collaborative environment, the chosen candidate will operate as part of a collaborative. Our client roster runs the gamut of the aerospace industry resulting in a variety of project opportunities in terms of responsibility, deliverables, and scope. SUMMARY : This position is primarily responsible for design, development, and testing of all aspects of embedded system firmware/ software for aircraft management systems. The ideal candidate is comfortable learning new programming languages and technologies as needed to deal with challenges as they present themselves. DUTIES AND RESPONSIBILITES : This individual has the responsibility to carry out assigned tasks. Develop firmware and software for current and future embedded products such as Power supply, lighting system and smart controllers. Participate in the process of Aircraft CMS configuration development and maintenance. Provide documentation and support to the quality department for hardware testing. Applies knowledge of engineering principles to develop new products. Provide engineering support to customers and the field team. Travel domestically and internationally to support existing and new aircraft installation. SUPERVISORY RESPONSIBILITIES : None QUALIFICATIONS : Required Skills: Minimum Five (5) years’ experience with standalone / Network based Embedded firmware and software development experience. Strong knowledge of C, C++, and Assembly language programming. Advanced experience with 32-bit micro controllers, ARM core (M0/M3/M4 type) and Atmel AVR32 Experience with programming platforms, Microchip Studio (Visual Studio), ATMEL Studio. CAN, RS232, RS485 protocols, UART, SPI MS Office and technical writing skills Basic Math skills and logical debugging skills. Experience with Serial terminal emulator (TeraTerm, Realterm, Putty etc.) Ability to work independently with little or no direction and as part of a team. Excellent communication, technical writing, oral presentation, and interpersonal skills. Desired Skills: Linux based device programming skills Experience with Android programming loT experience MacOS experience is desirable. EDUCATION AND/OR EXPERIENCE : Requires Bachelor of Science or advanced degree in Electrical engineering or Computer science. LANGUAGE SKILLS : Must be proficient in reading, speaking, and writing in English. PHYSICAL DEMANDS : Must be able to lift a maximum of 45 lbs. without harming oneself. This position requires bending, stooping, lifting, pulling, reaching, kneeling, standing, and sitting for periods of time. WORK ENVIRONMENT : Machine shop / light manufacturing environment. The noise is usually quiet to moderate. Job Type: Full-time Pay: $95,000.00 - $145,000.00 per year Benefits: 401(k) Dental insurance Health insurance Life insurance Paid time off Retirement plan Vision insurance Schedule: 8 hour shift Ability to commute/relocate: La Verne, CA 91750: Reliably commute or planning to relocate before starting work (Preferred) Education: Bachelor's (Required) Experience: Firmware development: 5 years (Required) Work Location: In person Health insurance If you require alternative methods of application or screening, you must approach the employer directly to request this as Indeed is not responsible for the employer's application process.",https://www.indeed.com/jobs?q=Machine+Learning+Engineer&l=Los+Angeles%2C+CA&sc=0kf%3Aattr%28FCGTU%7CHFDVW%7CQJZM9%7CUTPWG%252COR%29explvl%28MID_LEVEL%29jt%28fulltime%29%3B&radius=50&start=30&pp=gQAtAAAAAAAAAAAAAAAB_ipiFgAeAQIBBxAGH3aw_8v2YbZPhXOfxmMkINwN2NeWQmoRAAA&vjk=2e2b496527309071
