,job_id,job_title,location,experience,education,job_type,job_description,job_link
11,9ccaf3b650ba2ad3,Machine Learning Engineer,"Los Angeles, CA",MID_LEVEL,DOCTORAL_DEGREE,fulltime,"Optical Scientist - job post MetroLaser, Inc. 22941 Mill Creek Dr, Laguna Hills, CA 92653 $90,000 - $110,000 a year -  Full-time Apply now Apply now save-icon Job details Salary $90,000 - $110,000 a year Job Type Full-time Please indicate your current work authorization in your cover letter. A US citizenship or Green Card is a must to meet defense contractual requirements. MetroLaser, Inc. is a leading R & D company world-wide recognized for its laser-based measurement and diagnostic technologies for industrial, military, and space applications. Since its inception in 1988, MetroLaser has been at the forefront of state-of-the-art research and development as well as the commercialization of optical diagnostics systems to measure flow velocity, temperature, chemical composition, surface temperature, non-destructive inspection of components, etc. The core business of MetroLaser is in the defense sector, NASA and Department of Energy (DOE), and as a commercial provider of flow, combustion and imaging instruments. We have an exciting opening for an Optical Scientist at our office in Laguna Hills, CA. The new appointee will support the scientific staff in implementation, investigation and analysis of laboratory-based experiments and various engineering problems. The successful candidate is expected to work under moderate supervision while using technical skills and judgment to solve problems encountered during the course of the experimental/analytical investigation. The appointee is expected to prioritize time to stay on schedule, be proactive in documenting the results and findings, and in communicating them to the scientific staff. He/she is expected to work as a part of a team and may also lead efforts with other engineers and technicians. Job Responsibilities Design, analysis and construction of optical systems for measurements, right from inception to prototyping Develop timelines and resources to implement solutions for the project execution Layout of breadboard for experimental work and instrument development Write, test, document, and debug software, and interactive graphics Document findings/results and analyses for reporting Interface with other technical stuff to jointly investigate and solve engineering problems Prepare technical presentations for internal use, conferences and customers Qualifications BS/MS/Ph.D. in optical sciences/engineering or equivalent, with 2 or more years of work experience after the MS degree or 4 or more years of experience after the BS degree. Thorough understanding of optics, lens design, optical systems design Working knowledge of Schlieren, interferometry, holography for instrument development is a major plus Knowledge of spectroscopy, fluorescence and microscopy would be highly desirable Experience with lasers and optical detectors, and interfacing electronics Experience with Zemax or a similar optical design software Experience in image processing and software coding using C/C++/Python/MATLAB Experience with LabVIEW and SOLIDWORKS programming Experience with algorithms for data visualization, 3D reconstructions and interactive graphics Experience with data compression, high-rate data and video transfers Knowledge of machine learning and data science would be a plus Highly-motivated and a self-starter with ability to quickly absorb new concepts and subsequent application within prescribed timelines and resources Strong communication and inter-personal skills, and the ability to work in a team towards a larger company objective MetroLaser, Inc. offers highly competitive compensation and fringe benefit package that includes retirement plan, matching contributions; health, dental and vision benefits; generous paid time-offs; sick leaves and a highly intellectual, work environment. MetroLaser is an equal opportunity employer. Candidates must be US citizens or US permanent residents as required by Department of Defense contracts . For full consideration, Please email your application package (cover letter and resume). Job Type: Full-time Pay: $90,000.00 - $110,000.00 per year Benefits: Dental insurance Flexible spending account Health insurance Paid time off Parental leave Relocation assistance Retirement plan Schedule: Monday to Friday Ability to commute/relocate: Laguna Hills, CA 92653: Reliably commute or willing to relocate with an employer-provided relocation package (Required) Work Location: In person Health insurance If you require alternative methods of application or screening, you must approach the employer directly to request this as Indeed is not responsible for the employer's application process.",https://www.indeed.com/jobs?q=Machine+Learning+Engineer&l=Los+Angeles%2C+CA&sc=0kf%3Aattr%286QC5F%252COR%29explvl%28MID_LEVEL%29jt%28fulltime%29%3B&vjk=9ccaf3b650ba2ad3
12,65b0c4a24f9b0aee,Machine Learning Engineer,"Los Angeles, CA",MID_LEVEL,DOCTORAL_DEGREE,fulltime,"Lead Research Scientist, Computer Vision - job post Snapchat 59 reviews 63 Market Street, Los Angeles, CA 90291 $196,000 - $285,000 a year -  Full-time You must create an Indeed account before continuing to the company website to apply Apply on company site save-icon Job details Salary $196,000 - $285,000 a year Job Type Full-time Snap Inc is a technology company. We believe the camera presents the greatest opportunity to improve the way people live and communicate. Snap contributes to human progress by empowering people to express themselves, live in the moment, learn about the world, and have fun together. The Company’s three core products are Snapchat , a visual messaging app that enhances your relationships with friends, family, and the world; Lens Studio , an augmented reality platform that powers AR across Snapchat and other services; and its AR glasses, Spectacles . Snap Research serves as an innovation engine for the company. Our projects range from solutions to hard technical problems that significantly enhance Snap’s existing products, to riskier explorations that can lead to fundamental paradigm shifts in the way people communicate and express themselves. The team consists of scientists and engineers who experiment with and invent new technology that has a lasting impact on Snap’s products. We are looking for a Lead Research Scientist to join the Creative Vision Research Team! At Creative Vision, we focus on making everyone into a creator. We believe creativity is achieved when technology understands the world, humans and objects, provides a range of creative generation and manipulation tools and efficient real-time experiences. Our technology impacts and contributes to multiple products at Snap. What you’ll do: Define and own a roadmap of large-scale generative model projects from inception to completion Participate in strategic decision-making across the company Mentor and lead other teammates and interns Publish your work to top conferences Partner with engineering teams to deliver your technology to millions of Snapchatters Knowledge, Skills, & Abilities: Strong technical knowledge of statistics, machine learning, vision and state-of-the-art deep learning literature Demonstrated ability in defining, leading and executing high impact and large-scope research projects Strong computer science fundamentals, problem solving skills, programming (Python, C, C++) Proven ability to lead interns, PhD students, and junior researchers Proven ability to impact product with cutting edge research technology Minimum Qualifications: PhD in a related technical field such as computer science, statistics, mathematics, machine learning or equivalent years of experience 4+ years of post-PhD experience building impactful research projects Experience with leading successful large scale generative computer vision, machine learning, deep learning, or graphics projects in an academic or industrial research lab Track record of publications in top-tier international research venues (e.g. ICLR, AAAI, NeurIPS, CVPR, ECCV, ICCV, SIGGRAPH) Experience with large-scale data collection and annotation best practices Preferred Qualifications: Experience with multimodal machine learning with images, videos, audio, text, speech Knowledge of 3D computer vision, non-rigid and articulated 3D registration and synthesis Compensation In the United States, work locations are assigned a pay zone which determines the salary range for the position. The successful candidate’s starting pay will be determined based on job-related skills, experience, qualifications, work location, and market conditions. These pay zones may be modified in the future. Zone A (CA, WA, NYC) : The base salary range for this position is $230,000 - $335,000 annually Zone B : The base salary range for this position is $219,000 - 318,000 annually Zone C : The base salary range for this position is $196,000 - $285,000 annually This position is eligible for equity in the form of RSUs ""Default Together"" Policy at Snap: At Snap Inc. we believe that being together in person helps us build our culture faster, reinforce our values, and serve our community, customers and partners better through dynamic collaboration. To reflect this, we practice a “default together” approach and expect our team members to work in an office at least 80% of the time (an average of 4 days per week). If you are not based in the same location(s) listed for this role and are open to relocation, we encourage you to apply to take advantage of our generous relocation policy. At Snap, we believe that having a team of diverse backgrounds and voices working together will enable us to create innovative products that improve the way people live and communicate. Snap is proud to be an equal opportunity employer, and committed to providing employment opportunities regardless of race, religious creed, color, national origin, ancestry, physical disability, mental disability, medical condition, genetic information, marital status, sex, gender, gender identity, gender expression, pregnancy, childbirth and breastfeeding, age, sexual orientation, military or veteran status, or any other protected classification, in accordance with applicable federal, state, and local laws. EOE, including disability/vets. If you have a disability or special need that requires accommodation, please don’t be shy and contact us at accommodations-ext@snap.com. Our Benefits : Snap Inc. is its own community, so we’ve got your back! We do our best to make sure you and your loved ones have everything you need to be happy and healthy, on your own terms. Our benefits are built around your needs and include paid parental leave, comprehensive medical coverage, emotional and mental health support programs, and compensation packages that let you share in Snap’s long-term success!",https://www.indeed.com/jobs?q=Machine+Learning+Engineer&l=Los+Angeles%2C+CA&sc=0kf%3Aattr%286QC5F%252COR%29explvl%28MID_LEVEL%29jt%28fulltime%29%3B&vjk=65b0c4a24f9b0aee
13,10bb0611e40d535e,Machine Learning Engineer,"Los Angeles, CA",MID_LEVEL,DOCTORAL_DEGREE,fulltime,"GN&C Robotics II - job post JPL/NASA 192 reviews 4800 Oak Grove Dr, Pasadena, CA 91109 Full-time You must create an Indeed account before continuing to the company website to apply Apply on company site save-icon Job details Job Type Full-time Job Details New ideas are all around us, but only a few will change the world. That’s our focus at JPL. We ask the biggest questions, then search the universe for answers—literally. We build upon ideas that have guided generations, then share our discoveries to inspire generations to come. Your mission—your opportunity—is to seek out the answers that bring us one step closer. If you’re driven to discover, create, and inspire something that lasts a lifetime and beyond, you’re ready for JPL. Located in Pasadena, California, JPL has a campus-like environment situated on 177 acres in the foothills of the San Gabriel Mountains and offers a work environment unlike any other: we inspire passion, foster innovation, build collaboration, and reward excellence. This unique opportunity is part of the Autonomous Systems Division , which is responsible for technology development, advanced concepts, design, development, delivery, integration and test, verification and validation, and operation of Command and Data Handling (C&DH) Hardware, Flight Software, Power Systems, Robotic Systems, and Guidance and Control (G&C). As a Robotics Engineer in the Guidance, and Control Analysis Group , you will be working for JPL’s Guidance and Control Section . We do system engineering, design and analysis, hardware development/procurement, testing, and operations support in G&C areas for unique deep-space/earth-orbiting/astrophysics missions. We also do world class research and technology development in autonomous guidance, navigation and control systems including pin-point and safe landing, space rendezvous, formation flying, and precision pointing, among others. Responsibilities: Uses multi-disciplinary expertise to build Robotics Systems defined as autonomous or remotely-controlled machines which can perform sensing, understanding, and useful actions in unknown and unstructured environments. Typical sub-disciplines include computer vision and perception, multi-sensor estimation and control, autonomous planning and decision making, mobility and manipulation, mechatronics design and implementation, and modeling and simulation. This Robotics Systems Engineer will be responsible for leading the development and deployment of robotics surface systems for some of the following applications: Technology development or flight projects Research systems for NASA and non-NASA sponsors as well as NASA missions destined for space Concept development, publication of novel concepts, and proposal writing for NASA and non-NASA programs Perception, planning, navigation, machine learning, and autonomy for surface, underwater, and aerial mobility systems Intelligent manipulation Manipulator and vehicle concepts and advanced control Autonomous navigation and mobility Sensor fusion for localization and mapping Multi-robot architecture and behavior design Learning and estimation of system and interaction models Distributed estimation, world model building, knowledge sharing Distributed task recognition, allocation, and scheduling Embedded C/C++/Python robotic software development for controls and autonomy Qualifications: This position requires a Bachelor’s degree in Electrical Engineering, Aerospace Engineering, Computer Engineering or related technical discipline with a minimum of 3 years of related experience, a Master’s degree in a technical discipline with a minimum of 1 years of related experience, or a PhD in a technical discipline Other requirements include: Knowledge in one or more of the following areas: spacecraft guidance navigation and control hardware, software, advanced algorithm development; pointing, acquisition and tracking systems. Knowledge of applicable industry and/or academic practices and standards in precision optical sensor pointing, spacecraft instrument disturbance rejection, instrument pointing systems. Understanding of principles, theories, concepts and techniques in high precision pointing systems. Ability to conceive, design, analyze, simulate, and assesses highly complex and critical performance at G&C subsystem level. Familiar with the design, development, V&V, and delivery of guidance & control flight software. Proven team player and effective leader with excellent communication, interpersonal, verbal and presentation skills. Familiar with designing, analyzing, implementing, calibrating, verifying, and simulating complex and advanced GN&C on-orbit systems. Desired experience and skills include: Software development skills in C/C++. Experience in the design and software implementation of spacecraft guidance, control, and estimation algorithms. Experience in model development, closed-loop simulation, and V&V of spacecraft GNC systems. JPL has a catalog of benefits and perks that span from the traditional to the unique. This includes a variety of health, dental, vision, wellbeing, and retirement plans, paid time off, learning, rideshare, childcare, flexible schedule, parental leave and many more. Our focus is on work-life balance, and living healthy, fulfilling lives as we Dare Mighty Things Together. For benefits eligible positions, benefits are effective the first day of the month coincident with or immediately following the employee’s start date. For further benefits information click Benefits and Perks The hiring range displayed below is specifically for those who will work in or reside in the location listed. In extending an offer, Jet Propulsion Laboratory considers factors including, but not limited to, the candidate’s job related skills, experience, knowledge, and relevant education/training. Hiring range for this job may be adjusted based on primary work location outside of Pasadena, California. This adjusted range will be provided to candidates by the Recruiter when applicable. The typical full time equivalent annual hiring range for this job in Pasadena, California. $109,408 - $139,672 JPL is an Equal Opportunity Employer. All qualified applicants will receive consideration for employment without regard to sex, race, color, religion, national origin, citizenship, ancestry, age, marital status, physical or mental disability, medical condition, genetic information, pregnancy or perceived pregnancy, gender, gender identity, gender expression, sexual orientation, protected military or veteran status or any other characteristic or condition protected by Federal, state or local law. In addition, JPL is a VEVRAA Federal Contractor. EEO is the Law. EEO is the Law Supplement Pay Transparency Nondiscrimination Provision The Jet Propulsion Laboratory is a federal facility. Due to rules imposed by NASA, JPL will not accept applications from citizens of designated countries or those born in a designated country unless they are Legal Permanent Residents of the U.S or have other protected status under 8 U.S.C. 1324b(a)(3). The Designated Countries List is available here.",https://www.indeed.com/jobs?q=Machine+Learning+Engineer&l=Los+Angeles%2C+CA&sc=0kf%3Aattr%286QC5F%252COR%29explvl%28MID_LEVEL%29jt%28fulltime%29%3B&vjk=10bb0611e40d535e
14,c061e9286a3861fe,Machine Learning Engineer,"Los Angeles, CA",MID_LEVEL,DOCTORAL_DEGREE,fulltime,"Instrumentation Engineer - job post Noria Water Technologies, Inc. 2288 Westwood Boulevard, Los Angeles, CA 90064 $35 - $60 an hour -  Full-time, Permanent Apply now Apply now save-icon Job details Salary $35 - $60 an hour Job Type Full-time Permanent Instrumentation Engineer Noria Water Technologies is a pioneering company revolutionizing the water treatment and desalination industry by combining decades of scientific insight with the latest technologies in surface imaging, industrial control, and machine learning for monitoring membrane-based plants. Using machine vision techniques to provide real-time, actionable information, Noria enables water desalination/treatment plants to make a quantum leap in operational efficiency. Noria Water Technologies is inviting applicants with formal training and work experience in integration of fluid systems with process sensors (e.g., flow rate, pressure, conductivity, temperature), data acquisition, and system control. The candidate will join Noria's team of engineering and software experts who are developing and deploying innovative technologies for monitoring water desalination/treatment systems with advanced machine vision and process sensors and data analytics for real-time plant operational decision support. KEY RESPONSIBILITIES: Integrate system electronics and sensors with system hydraulics (e.g., valves, actuators, pump, sensors), and perform system specification reviews. Implement control scheme for maintain flow rate settings Interface imaging hardware with system data acquisition Drive the development of bill of material for all system electrical/electronic components. Define and purchase system components including sensors, VFDs, and control board/system components, display, computing hardware, etc. Facilitate and develop a supply chain for all components which are robust and meets high quality standards. Develop and integrate Noria's monitoring with a PLC, microcontroller and other control board environments and data transmission to remote server. Provide in-house expertise for assembly and testing of Noria's monitoring system's process flow/instrument/electronics assembly. Develop key process indicators to measure the efficacy of Noria's product assembly and reliability. As a Product Development Engineer, you will leverage advanced tools and techniques to deliver the next generation of Noria’s desalination membrane monitoring systems. The candidate will bring product design experience to improve on the current technology. Create diagrams using tools to support electrical and process system designs. Assemble and test complete monitoring system that includes online sensors of pressure, low rate, temperature, and conductivity, in addition to a vision module that provides for image capture in a flowing system. Incorporate advanced design methods in product design, prototyping and assembly. Work with the Noria team to conceptualize, design, engineer, and execute the next generation development project from start to finish. REQUIRED QUALIFICATIONS Advanced degree in Electrical Engineering, Mechanical Engineering, Mechatronics or related Engineering field (M.S. or Ph.D.). 5-10 years of experience involving integration of sensors and electronics/electrical systems, sensors, actuators, and small-scale hydraulic components (pumps, valves, tubing). Expert knowledge of electrical and flow components (valves, actuators, VFD, pumps), sensors (e.g., temperature, flow rate, pressure, conductivity) Broad knowledge of electronic products, process technologies, fluid flow systems, data acquisition and control technology. Experience with electrical and mechanical design tools. Minimum three years of control/automation experience At least 3 years of AutoCAD electrical design experience At least 3 years of safety control system experience At least 3 years of Modbus knowledge (or Profibus, EthernetIP, ControlNet etc.). At least three years of experience with Programable Logic Controller (PLC) and Microcontrollers. Dedication to safe working practices in laboratory and industrial environments. Self-motivated, responsible, excellent written and verbal interpersonal skills Enjoys working in the flexible and fast-paced environment of a young company and is comfortable with reprioritizing and multitasking. Positive attitude and willingness to collaborate with team members toward mutual success. Beneficial Qualifications Experience with assembly of small water filtration equipment Experience with developing/implementing simple control algorithms Experience with data analytics Experience with computer software/electrical systems for data acquisition and control (i.e., SCADA for industrial automation). Basic programming skills in one or more of the following: MATLAB, Python, LabView. Ability to travel (on occasion) and perform work at industrial environments (industrial/municipal, water/wastewater treatment facilities, desalination plants, power plants, and other heavy industrial environments). Job Types: Full-time, Permanent Pay: $35.00 - $60.00 per hour Benefits: Health insurance Paid time off Experience level: 5 years Schedule: Monday to Friday Ability to commute/relocate: Los Angeles, CA 90064: Reliably commute or planning to relocate before starting work (Required) Education: Master's (Required) Experience: work: 5 years (Required) Sensors: 3 years (Required) Work Location: In person Health insurance If you require alternative methods of application or screening, you must approach the employer directly to request this as Indeed is not responsible for the employer's application process.",https://www.indeed.com/jobs?q=Machine+Learning+Engineer&l=Los+Angeles%2C+CA&sc=0kf%3Aattr%286QC5F%252COR%29explvl%28MID_LEVEL%29jt%28fulltime%29%3B&vjk=c061e9286a3861fe
