,job_id,job_title,location,experience,education,job_type,job_description,job_link
0,31ad96aa0a8b912a,Machine Learning Engineer,"Los Angeles, CA",MID_LEVEL,BACHELORS_DEGREE,fulltime,"ADAS Feature Integration Engineer - job post Canoo Technologies Inc. 19951 Mariner Avenue, Torrance, CA 90503 Full-time You must create an Indeed account before continuing to the company website to apply Apply on company site save-icon Job details Encouraged to Apply Fair chance Job Type Full-time About Canoo: Canoo’s mission is to bring EVs to Everyone and build a world-class team to deploy this sustainable mobility revolution. We have developed breakthrough electric vehicles that are reinventing the automotive landscape with pioneering technologies, award-winning designs, and a unique business model that spans all owners in the full lifecycle of the vehicle. Canoo is starting production and is distinguished by its pioneering and experienced team of technologists, engineers, and designers. With offices around the country, the company is scaling quickly and seeking candidates who love to challenge themselves, are motivated by purpose, and possess a strong desire to get things done. The “Canoo Way” Canoo’s success is the direct result of our disciplined application of our core operating principles and drills, which are based on three main principles: Think 80/20 (“Important versus less important”), Act 30/30 (“Reduce waste and increase output”), and Live 90/10 (“We have each other’s back”). We hire based on “MET” - Mindset, Equipment and willingness to Train - and seek individuals that take accountability and deliver results while being Humble, Hungry to succeed, and Hunting for opportunities to win. We train our team to engage with each other by modulating between their intellect (iQ) and emotional intelligence (eQ), applying Facts, Finesse, and Force when they communicate. The principles and drills of the CANOO Way have been fundamental to our success, our ability to grow, continuously improve, innovate and are at the core of our day-to-day operations. Overview: Canoo is building an effective ADAS system for its vehicle program. The goal is to provide an elegant solution over a brute force approach. The team is looking to add more skills to the current team with an engineer who is focused on delivering the ADAS Feature software stack. Responsibilities: Responsible for deriving the software requirements to be consumed by internal and external development teams while ensuring support from the systems engineering and algorithms teams Develop Software component integration plan working closely with internal and external software development teams Work with the scrum master to create the backlog of tasks for new features and plan tasks for each sprint Properly documenting development with software requirements Work with the test and validation team to verify functional operation to technical specification Work with all stakeholders to integrate final design into the vehicle or subsystem Assist in the development of detailed DVP&R plans, including statistical confidence intervals Ensure all product issues are identified, logged, tracked, and resolved during each testing phase Effectively communicate with the rest of the organization when issues or failures arise Create detailed component level and support system level DFMEA and DVP&R documentation. #LI-SK1 Qualifications: Required Experience Bachelor’s degree in CS/EE or a related technical field 2+ years of professional work experience Strong proficiency in C++ and Python Familiarity with system level software and deep knowledge on hardware-software interaction Familiarity with SW testing tools, SW versioning tools (Git). Self-motivated, comfortable operating without direct supervision Strong written and verbal communications Preferred Experience High level of oral and written communication skills Strong interpersonal effectiveness and able to manage and escalate issues to management Expertise in MATLAB/SIMULINK and C programming Experience in Software integration of a large code base Experience in embedded programming for automotive Experience profiling and debugging c++ code stack Experience with POSIX compliant OS Experience in data structures and advanced algorithms Knowledge of supervised machine learning algorithms, Kalman filters, and controls algorithms Self-motivated and comfortable operating without direct supervision Professional experience in ADAS or autonomous driving applications Travel Requirements None Physical Requirements While performing the duties of this job, employees may be required to sit for prolonged periods of time, occasionally bending or stooping, lifting up to 10 pounds, and prolonged periods of computer use. Reasonable Accommodations Reasonable accommodations may be made to enable individuals with disabilities to perform the essential functions of the position. What's Cool About Working Here...: Meaningful, challenging work that will redefine the automotive landscape and make EVs available to everyone Comprehensive Health Insurance Equity Compensation Flexible Paid Time Off Casual workplace with an unbelievable feeling of energy Canoo is an equal opportunity-affirmative action employer and considers all qualified applicants for employment based on business needs, job requirements and individual qualifications, without regard to race, color, religion, sex, age, disability, sexual orientation, gender identity or expression, marital status, past or present military service or any other status protected by the laws or regulations in the locations where we operate. We also consider qualified applicants with criminal histories consistent with applicable federal, state and local law. Any unsolicited resumes or candidate profiles submitted in response to our job posting shall be considered the property of Canoo Inc. and its subsidiaries and are not subject to payment of referral or placement fees if any such candidate is later hired by Canoo unless you have a signed written agreement in place with us which covers the applicable job posting. Canoo maintains compliance with the OFCCP. As such, please feel free to review the following information: https://www.dol.gov/agencies/ofccp/posters https://www.dol.gov/agencies/olms/poster/labor-rights-federal-contractors If you are a person with a disability needing assistance with the application process, please call (310) 702-7907 or email us at talentacquisitionteam@canoo.com Salary will be determined based on a number of factors, including but not limited to years of experience, training, skillset, location, etc. Expected salary range in CA: $108,800 - $130, 600 annually",https://www.indeed.com/jobs?q=Machine+Learning+Engineer&l=Los+Angeles%2C+CA&sc=0kf%3Aattr%28FCGTU%7CHFDVW%7CQJZM9%7CUTPWG%252COR%29explvl%28MID_LEVEL%29jt%28fulltime%29%3B&radius=50&start=20&pp=gQAeAAAAAAAAAAAAAAAB_ipiFgAcAQIBBxAGAnly6f0rlpJIh92f0QJhIDsbIX5KhwAA&vjk=31ad96aa0a8b912a
1,db3828afde6329e5,Machine Learning Engineer,"Los Angeles, CA",MID_LEVEL,BACHELORS_DEGREE,fulltime,"Big Data Engineer - PySpark - job post Logic20/20 Inc. 17 reviews Los Angeles, CA $130,000 - $162,500 a year -  Full-time Apply now Apply now save-icon Job details Salary $130,000 - $162,500 a year Job Type Full-time Company Description We’re a seven-time “Best Company to Work For,” where intelligent, talented people come together to do outstanding work—and have a lot of fun while they’re at it. Because we’re a full-service consulting firm with a diverse client base, you can count on a steady stream of opportunities to work with cutting-edge technologies on projects that make a real difference. Logic20/20's Global Delivery Model creates a connected experience for Logicians across geographies. You'll have access to projects in different locations, the technology to support Connected Teams, and in-person and online culture events in our Connected Hub cities. Job Description Bring your skillset to an exciting and meaningful initiative where we are leveraging data science, artificial intelligence, and machine learning to mitigate wildfires. By proactively identifying and addressing issues with power lines and related equipment, we’re increasing safety, saving lives, and protecting the environment. This is a highly visible, highly impactful project with implications for millions of customers. As a Big Data Engineer, you’ll join our Data Management team to design and develop scalable data processing infrastructure. Applying an Agile approach, you’ll work closely with our team of analysts, technical product owners, and data scientists to provide the structure for a highly anticipated solution. You’ll leverage your balance of technical skills and business acumen to help the client better understand their core needs and technical capabilities. Your efforts will result in greater protection for the community and our environment, long-term. Hear more about these efforts as Jeff Lovington shares his experience working in Data Science and Machine Learning for the Energy & Utilities sector. About the team The Logic20/20 Advanced Analytics team is where skilled professionals in data engineering, data science, and visual analytics join forces to build simple solutions for complex data problems. We make it look like magic, but for us, it’s all in a day’s work. As part of our team, you’ll collaborate on projects that help clients spin their data into a high-performance asset, all while enjoying the company of kindred spirits who are as committed to your success as you are. And when you’re ready to level up in your career, you’ll have access to the training, the project opportunities, and the mentorship to get you where you want to go. “We build an environment where we really operate as one team, building up each other’s careers and capabilities.” – Adam Cornille, Director, Advanced Analytics About you You are collaborative, working with partners to understand business needs and pain points You are determined and able to manage obstacles while maintaining a positive outlook You are patient and savvy in explaining technical benefits and deficits to non-technical audiences You have a passion for learning new data tools and best practices You have built large-scale machine learning pipelines, quickly developing and iterating solutions Qualifications Must have 3+ years of implementation experience using PySpark 5+ years of data engineering experience Strong understanding of high-performance ETL development with Python Experience with Big Data Technologies (Hadoop, Spark, MongoDB) Experience designing and developing cloud ELT and date pipeline with various technologies such as Python, Spark, PySpark, SparkSQL, Airflow, Talend, Matillion, DBT, and/or Fivetran Demonstrated ability to identify business and technical impacts of user requirements and incorporate them into the project schedule Preferred: Experience with Palantir’s Foundry and LiDAR Ideal, but not required: An undergraduate degree in technology or business Agile, Scrum, and/or SAFe experience and certifications Experience building data and computational systems that support machine learning Knowledge of AWS services Experience with modern software delivery practices, including source control, testing, and continuous delivery Experience with streaming data in Spark Additional Information All your information will be kept confidential according to EEO guidelines. Compensation range: $130,000 - $162,500 annually About Logic20/20 To learn more about Logic20/20, please visit: https://www.logic2020.com/careers/life-at-logic Core Values At Logic20/20, we are guided by three core values: Drive toward Excellence, Act with Integrity & Foster a Culture of We. These values were generated and agreed upon by our employees—and they help us pursue our goal of being one of the best companies to work for and to work with. Learn more at https://www.logic2020.com/company/our-values. Logic20/20 Benefits Why Logic20/20? It’s our goal to be one of the best companies to work for. One piece of the puzzle is an evolving set of benefits that extend past medical, dental, and 401(k). You will have Career Development – A built-in program from day 1, providing a mentor and individually-directed training opportunities, plus access to leaders across the company PTO, Paid Holidays, & Voluntary Leave – Worry-free time off to recharge and pursue your personal goals Community & Committees – As part of our “Culture of We,” Logic20/20 invests in providing many social, interest, and learning opportunities Recognition – From peer recognition, swag, and the chance to win a once-in-a-lifetime type of award, we make your Logic20/20 journey stand out Referral Programs & Bonuses – Employee, project, and sales referral programs with paid incentives Equal Opportunity Statement We believe that people should be celebrated: for their talents, ideas, and skills, but most of all, for what makes them unique. We prohibit harassment and/or discrimination based on age, race, creed, color, religion, sex, national origin, ancestry, disability status, veteran status, sexual orientation, gender identity or expression, genetic information, marital status, citizenship status, or any other basis as protected by federal, state, or local law. To learn more about our DE&I initiatives, please visit: https://www.logic2020.com/company/diversity-equity-inclusion Privacy Policy During the recruitment and hiring process, we gather, process, and store some of your personal data. We consider data privacy a priority. For further information, please view our company privacy policy. If you require alternative methods of application or screening, you must approach the employer directly to request this as Indeed is not responsible for the employer's application process.",https://www.indeed.com/jobs?q=Machine+Learning+Engineer&l=Los+Angeles%2C+CA&sc=0kf%3Aattr%28FCGTU%7CHFDVW%7CQJZM9%7CUTPWG%252COR%29explvl%28MID_LEVEL%29jt%28fulltime%29%3B&radius=50&start=20&pp=gQAeAAAAAAAAAAAAAAAB_ipiFgAcAQIBBxAGAnly6f0rlpJIh92f0QJhIDsbIX5KhwAA&vjk=db3828afde6329e5
2,43581b5a90d44216,Machine Learning Engineer,"Los Angeles, CA",MID_LEVEL,BACHELORS_DEGREE,fulltime,"Sr. Software Engineer - Data - job post Deep 6 AI Pasadena, CA • Remote $140,000 - $170,000 a year -  Full-time You must create an Indeed account before continuing to the company website to apply Apply on company site save-icon Job details Salary $140,000 - $170,000 a year Job Type Full-time Deep 6 AI is a fast-growing tech startup headquartered in Los Angeles, California looking for talented, dynamic team members who want to help shape our groundbreaking artificial intelligence platform. This is a remote opportunity, and we have a significant number of team members in Chicago, Seattle, SF Bay Area, NYC and Nashville. We are transforming and accelerating clinical trials, to help get life-saving treatments to patients faster and accelerate innovation in healthcare. To that end, we build a cutting-edge software suite that connects all clinical research stakeholders, from research teams to treating physicians, patients, and study sponsors on a real-time, real-world data SaaS platform, powered by AI. We are currently seeking a Sr. Software Engineer - Data to join our team. This engineer will have significant impact at Deep 6 AI by ensuring our data pipelines are robust, fault-tolerate, and capable of handling kilobytes to petabytes of complex medical data. They'll also work cross-functionally to support a variety of data needs ranging from analytics and machine learning through product development. What You'll Do Software Development Strong object-oriented and functional language familiarity including fluency in at least one major JVM language including Java, Scala, Kotlin, Clojure; Python is a plus. Experience with advanced data modeling as it relates to: o Database storage technologies including relational, columnar, key-value, document-oriented, etc. o Serialization technologies and relevant applications beyond JSON/XML such as Avro, Protobuf, and Thrift Experience with AWS DynamoDB, Lambda, and Kinesis is a plus Experience with the Linux ecosystem ranging from provisioning VMs and containers to authoring and executing command line tools Experience working with cloud provider ecosystems including but not limited to AWS Data Engineering Strong understanding of distributed data processing concepts: o Scalability o Streaming o Fault tolerance o ACID o CAP Experience optimizing performance metrics, such as o Latency o Throughput o Cost o Memory Usage About You A minimum of 5 years of technical experience developing data-intensive software Experience working with internal stakeholders to build technical roadmaps consistent with organizational goals Experience designing software for self-directed use by both technical and non-technical internal consumers Experience working with personally identifiable information (PII), ideally in a HIPAA-compliant context A major plus if the applicant has experience working with healthcare data, specifically HL7 or FHIR standards Bachelor’s degree in a Computer Science-related field or equivalent combination of training and experience Cloud services (AWS, GCP, Azure) certifications or equivalent combination of training and experience Exact compensation may vary based on skills, experience, and location Base salary: 140-170k per year Full remote or work in our Pasadena office Our Engineering Culture We are a very collaborative group that is inclusive, fun, and hard-working. We appreciate the value in diverse backgrounds and experiences so that we can create the best product through different perspectives and ideas. Deep 6 AI welcomes remote work and has fully-remote teams throughout the country; we strive to create an environment where you can do your best work in the environment and location that is best suited for each individual. As a member of our team, you can expect to work with intelligent, curious, and motivated peers who value and respect your perspectives. - Deep 6 AI is headquartered in Los Angeles and has a significant number of employees Chicago, Seattle, SF Bay Area, NYC and Nashville. Benefits In addition to competitive salary and a unique opportunity to thrive at a growing company, Deep 6 AI offers various formal benefits as well as a generous PTO plan which includes sick and vacation days, and as well as employer-paid medical, Dental, Vision, and Life insurance. In addition, wwe offer Voluntary Life and Long-Term Disability coverage. A 401k plan is available, too. Our Culture We are a very collaborative group that is inclusive, fun, and hard-working. We appreciate the value in diverse backgrounds and experiences so that we can create the best product through different perspectives and ideas. Deep 6 AI welcomes remote work and has fully-remote teams throughout the country; we strive to create an environment where you can do your best work in the environment and location that is best suited for each individual. As a member of our team, you can expect to work with intelligent, curious, and motivated peers who value and respect your perspectives. - Deep 6 AI is headquartered in Los Angeles and has a significant number of employees Chicago, Seattle, SF Bay Area, NYC and Nashville. Benefits In addition to competitive salary and a unique opportunity to thrive at a growing company, Deep 6 AI offers various formal benefits as well as a generous PTO plan which includes sick and vacation days, and as well as employer-paid medical (including a Health Savings Account with an employer contribution), Dental, Vision, and Life insurance. In addition, we're proud to offer Voluntary Life & AD&D, Short Term Disability, and Long-Term Disability coverage. A 401k plan is available, too. The above statements describe the general nature and level of work being performed in this job function. They're not intended to be an exhaustive list of all duties, and indeed additional responsibilities may be assigned by Deep 6. At Deep 6, we appreciate the opportunity to benefit from the diverse backgrounds and experiences of others. Because of our deep commitment to respect every individual, Deep 6 is an equal opportunity employer.",https://www.indeed.com/jobs?q=Machine+Learning+Engineer&l=Los+Angeles%2C+CA&sc=0kf%3Aattr%28FCGTU%7CHFDVW%7CQJZM9%7CUTPWG%252COR%29explvl%28MID_LEVEL%29jt%28fulltime%29%3B&radius=50&start=20&pp=gQAeAAAAAAAAAAAAAAAB_ipiFgAcAQIBBxAGAnly6f0rlpJIh92f0QJhIDsbIX5KhwAA&vjk=43581b5a90d44216
3,675643660ef1e1f0,Machine Learning Engineer,"Los Angeles, CA",MID_LEVEL,BACHELORS_DEGREE,fulltime,"Product Manager - job post Jerry 14 reviews Ontario, CA • Remote Full-time Apply now Apply now save-icon Job details Job Type Full-time We'd love to hear from you if you like: Making a big impact with a Forbes Top Startup Employer Working on products that have traction (40X revenue growth in 4 years | #1 rated app in the insurance comparison category) Solving problems in a huge market ($2T market size) Working closely with serial entrepreneurs and seasoned leaders who have scaled companies like Robinhood, Amazon, LinkedIn, Wayfair, SoFi, Microsoft, etc. About the opportunity: We are looking for a data-driven Product Manager who is passionate about solving complex, tangible problems to come join our insurance platform team. Making car ownership effortless and creating a world-class user experience is what drives every decision we make as a company. Reporting directly to our cofounder/CEO and partnering with our brilliant software engineers, designers, data scientists, and operations teams, you will own a core segment of our flagship insurance product and make shopping for insurance a delightful experience. If you are looking for an opportunity to make a measurable difference in the lives of millions and help us disrupt a massive industry, we'd love to hear from you! Responsibilities: Own the shopping or post-purchase experience for our core insurance product Comb through a massive amount of data, run analyses, and identify opportunities to optimize our operations and backend systems to improve operational efficiency Leverage automation to solve our user pain points and reduce friction in our app flow Partner with engineers, data scientists, designers, and operations teams to launch new features designed to make the insurance shopping and maintenance experience instantaneous and delightful What we are looking for: Creative problem-solver: No challenge is too complex, no issue is too hard, and “no” is not an acceptable answer Data-driven: You're extremely analytical and live in data. At the same time, you're confident enough to make decisions when the data is limited Tenacious: You’re a hustler at heart and you thrive under pressure Super organized: You balance a packed schedule, an endless to-do list, can manage a team, and never let anything drop Ideal profile: Bachelor's Degree in a quantitative discipline (engineering, computer science, econometrics, statistics or related) 3+ years of experience in management consulting or business operations Jerry is proud to be an Equal Employment Opportunity employer. We prohibit discrimination based on race, religion, color, national origin, sex, pregnancy, reproductive health decisions or related medical conditions, sexual orientation, gender identity, gender expression, age, veteran status, disability, genetic information, or other characteristics protected by applicable local, state or federal laws. Jerry is committed to providing reasonable accommodations for individuals with disabilities in our job application process. If you need assistance or an accommodation due to a disability, please contact us at recruiting@getjerry.com About Jerry: Jerry is building the first Super App to save car owners time and money on all their car expenses. Drivers deserve better. That’s why we’re committed to making shopping for insurance, financing, maintenance, repairs, parking and more just a few clicks, texts, or swipes away. Jerry is taking processes that haven’t substantively changed in decades and reimagining and redesigning them. Using artificial intelligence, machine learning and bots, Jerry eliminates the need for long forms and phone calls while providing personalized services for all car-owners’ needs. Today, Jerry is the #1 rated and most downloaded app in its category and the fastest way to compare and buy car insurance. We have more than 2M customers and we are just getting started. Join our team of curious and passionate people who love tackling real-world problems and be a part of building a revolutionary product that’s disrupting a massive market. Jerry was founded in 2017 by serial entrepreneurs and has raised more than $130 million in financing. If you require alternative methods of application or screening, you must approach the employer directly to request this as Indeed is not responsible for the employer's application process.",https://www.indeed.com/jobs?q=Machine+Learning+Engineer&l=Los+Angeles%2C+CA&sc=0kf%3Aattr%28FCGTU%7CHFDVW%7CQJZM9%7CUTPWG%252COR%29explvl%28MID_LEVEL%29jt%28fulltime%29%3B&radius=50&start=20&pp=gQAeAAAAAAAAAAAAAAAB_ipiFgAcAQIBBxAGAnly6f0rlpJIh92f0QJhIDsbIX5KhwAA&vjk=675643660ef1e1f0
