,job_id,job_title,location,experience,education,job_type,job_description,job_link
0,3067549f98da703a,Machine Learning Engineer,"Los Angeles, CA",MID_LEVEL,DOCTORAL_DEGREE,fulltime,"Machine Learning Engineer, Generative ML , 3+ Years of Experience - job post Snapchat 59 reviews 63 Market Street, Los Angeles, CA 90291 $149,000 - $213,000 a year -  Full-time You must create an Indeed account before continuing to the company website to apply Apply on company site save-icon Job details Salary $149,000 - $213,000 a year Job Type Full-time Snap Inc is a technology company. We believe the camera presents the greatest opportunity to improve the way people live and communicate. Snap contributes to human progress by empowering people to express themselves, live in the moment, learn about the world, and have fun together. The Company’s three core products are Snapchat , a visual messaging app that enhances your relationships with friends, family, and the world; Lens Studio , an augmented reality platform that powers AR across Snapchat and other services; and its AR glasses, Spectacles . Snap’s Augmented Reality team invents the immersive (and fun!) camera experiences that are at the core of our products. From developing creative new Lens features for Snapchat, to supporting the continuous growth and evolution of Lens Studio (our platform for an ever-increasing community of AR creators), to designing the cutting-edge computer vision and machine learning technology that makes face transformation Lenses possible — our Augmented Reality team is working hard on their mission to bring AR to more people, places, and moments, every day. We're looking for a Machine Learning Engineer to join our Generative ML team! What you’ll do: Create machine learning models for Snapchat lenses used by millions of Snapchatters Build cutting-edge augmented reality experiences Develop machine learning solutions for AR wearables Build the fastest machine learning inference frameworks Work closely with other Snap teams to explore and prototype new product features Knowledge, Skills & Abilities: A proven passion for machine learning; you stay up-to-date with research and are excited about prototyping new ideas quickly Knowledge of mathematics and deep learning foundations Desire to solve open ambiguous problems Desire to grow professionally, learn and help others Ability to effectively collaborate with internal teams and external partners Ability to work independently Minimum Qualifications: Bachelor’s Degree in a technical field such as computer science, mathematics, statistics or equivalent years of experience 3+ years of research or engineering experience in one or more of the following: neural rendering, generative models, segmentation, object detection, classification, tracking, or other related applications of machine learning Experience with the major deep learning frameworks: PyTorch or TensorFlow Strong track record of software development in Python or C++ Preferred Qualifications: Master's degree or PhD in a related technical field Experience developing real-time software for mobile applications Knowledge of computer graphics foundations Examples of your work such as open source projects, blog posts, Kaggle contests, top conference or journal publications, etc. Compensation: In the United States, work locations are assigned a pay zone which determines the salary range for the position. The successful candidate’s starting pay will be determined based on job-related skills, experience, qualifications, work location, and market conditions. These pay zones may be modified in the future. Zone A (CA, WA, NYC) : The base salary range for this position is $175,000 - $250,000 annually Zone B : The base salary range for this position is $166,000 - $238,000 annually Zone C : The base salary range for this position is $149,000 - $213,000 annually This position is eligible for equity in the form of RSUs ""Default Together"" Policy at Snap: At Snap Inc. we believe that being together in person helps us build our culture faster, reinforce our values, and serve our community, customers and partners better through dynamic collaboration. To reflect this, we practice a “default together” approach and expect our team members to work in an office at least 80% of the time (an average of 4 days per week). If you are not based in the same location(s) listed for this role and are open to relocation, we encourage you to apply to take advantage of our generous relocation policy. At Snap, we believe that having a team of diverse backgrounds and voices working together will enable us to create innovative products that improve the way people live and communicate. Snap is proud to be an equal opportunity employer, and committed to providing employment opportunities regardless of race, religious creed, color, national origin, ancestry, physical disability, mental disability, medical condition, genetic information, marital status, sex, gender, gender identity, gender expression, pregnancy, childbirth and breastfeeding, age, sexual orientation, military or veteran status, or any other protected classification, in accordance with applicable federal, state, and local laws. EOE, including disability/vets. If you have a disability or special need that requires accommodation, please don’t be shy and contact us at accommodations-ext@snap.com. Our Benefits : Snap Inc. is its own community, so we’ve got your back! We do our best to make sure you and your loved ones have everything you need to be happy and healthy, on your own terms. Our benefits are built around your needs and include paid parental leave, comprehensive medical coverage, emotional and mental health support programs, and compensation packages that let you share in Snap’s long-term success!",https://www.indeed.com/jobs?q=Machine+Learning+Engineer&l=Los+Angeles%2C+CA&sc=0kf%3Aattr%286QC5F%252COR%29explvl%28MID_LEVEL%29jt%28fulltime%29%3B&vjk=3067549f98da703a
1,dba519596849d87f,Machine Learning Engineer,"Los Angeles, CA",MID_LEVEL,DOCTORAL_DEGREE,fulltime,"Robotics and Machine Learning Engineer - job post HRL Laboratories 32 reviews Calabasas, CA • Hybrid remote Full-time Apply now Apply now save-icon Job details Job Type Full-time Based in Southern California with locations in Malibu, Calabasas and Camarillo; HRL has been on the leading edge of technology, conducting pioneering research and advancing the state of the art. Essential Duties: Primary job function is the development of autonomous systems that satisfy strong safety and reliability requirements. Concretely, this will involve the development of new software systems and the integration of research software on existing autonomous systems platforms. The ideal candidate will have hands-on experience in one of autonomous systems control, planning or perception. Tasks will include the development, implementation, training, evaluation and use of algorithms for control, planning and perception on autonomous systems platforms. Additional job functions include solving customer problems, writing invention disclosures, publishing papers, briefing customers, and assisting in marketing HRL expertise. Required Skills: Hands-on experience in robotics (ideally working with autonomous systems platforms). Experience in ROS. Experience with machine learning for control, planning or perception. Software development experience in languages such as C/C++ and Python. Experience using libraries/frameworks such as OpenCV, PyTorch, TensorFlow, or similar. Experience in the use of formal methods (e.g., reachability analysis, control barrier functions, runtime monitoring, etc.) for assuring the safety of autonomous systems. Background in robotics including a strong understanding of the roles of control, perception and planning in robotics systems is desired. Understanding of the fundamentals of how formal methods can be used to assure safety of autonomous or cyber-physical systems is desired. Required Education: Ph.D. or M.S. in Computer Science, EE or related fields. Special Requirements: U.S. Person status. Compensation: The base salary range for this full-time position is $104,000 - $174,000 + bonus + benefits. Our salary ranges are determined by role, level, and location. The range displayed on each job posting reflects the minimum and maximum target for new hire salaries for the position. Within the range, individual pay is determined by work location and additional factors, including job-related skills, experience, and relevant education or training. Your recruiter can share more about the specific salary range during the hiring process. Please note that the compensation details listed reflect the base salary only, and do not include potential bonus or benefits. This position must meet Export Control compliance requirements, therefore a ""U.S. Person"" as defined by 22 C.F.R. § 120.15 is required. ""U.S. Person"" includes U.S. Citizen, lawful permanent resident, refugee, or asylee. HRL offers a very competitive compensation and benefits package. Our Regular/Full Time benefits include medical, dental, vision, life insurance, 401K match, gym facilities, PTO, growth potential, and an exciting and challenging work environment. HRL Laboratories is an Equal Employment Opportunity employer and does not discriminate in recruiting, hiring, training or promoting, on the basis of race, ethnicity, color, creed, religion, sex, sexual orientation, gender, gender identity, genetic information, national origin, physical or mental disability, pregnancy, medical condition, age, U.S. military or protected veteran status, union membership, or political affiliation. We maintain a drug-free workplace and perform pre-employment substance abuse testing. For our privacy policy please visit : www.hrl.com/privacy If you require alternative methods of application or screening, you must approach the employer directly to request this as Indeed is not responsible for the employer's application process.",https://www.indeed.com/jobs?q=Machine+Learning+Engineer&l=Los+Angeles%2C+CA&sc=0kf%3Aattr%286QC5F%252COR%29explvl%28MID_LEVEL%29jt%28fulltime%29%3B&vjk=dba519596849d87f
2,361456729305462e,Machine Learning Engineer,"Los Angeles, CA",MID_LEVEL,DOCTORAL_DEGREE,fulltime,"Research Scientist - job post Q-CTRL Los Angeles, CA • Remote Full-time You must create an Indeed account before continuing to the company website to apply Apply on company site save-icon Job details Job Type Full-time About us We hold the key to making quantum useful! Q-CTRL is a company with a deep start-up spirit with offices in Sydney, Los Angeles and Berlin. Our goal is to revolutionize the quantum future of technology by delivering transformational, real-life outcomes for the world’s most innovative and impactful industry. Simply put, we make quantum technology useful. We’re led by our values; to be real, be trusted, be just, and be revered. They guide us in everything we do - how we work together and how we shape the future of the quantum field. We want the best talent in the world to join our team - from operations, product, design and marketing through to quantum research. So whether you’re a quantum expert or simply unsure where you fit into a business like ours, we want to hear from you! About the role: As a Research Scientist, you’ll be responsible for developing solutions for quantum technologies and deploying them in the Q-CTRL product suite. What you'll be doing: Develop efficient and reliable methods and tools that solve challenges facing real quantum computers. Implement and innovate the latest techniques and algorithms from machine learning and quantum control. In particular, you will use these tools for improving the performance of real devices, quantum algorithms, near-term quantum applications, and quantum error correction schemes. Collaborate with your colleagues in the Quantum product team and Quantum Professional Services in order to better direct the research goals. Explain and document sophisticated control and machine learning solutions in accessible language. Use numerical packages like NumPy, Scipy, Tensorflow, and Scikit-learn to build high-quality research code to develop, test, and demonstrate new algorithms and methods. About you: A Senior Research Scientist should have a PhD in Physics, CS, Engineering, or a closely related discipline. Candidates with a bachelor's degree in these disciplines are encouraged to apply, and will be considered for a mid-level role. You have at least 3 years of experience conducting research and ideally some publications to your name or a presentation track record in recognized academic journals/conferences in a relevant field. Familiarity with at least one of the quantum computing platforms, such as, superconducting circuits, trapped ions, neutral atoms, photonics is highly regarded A keen understanding of Quantum/Optimal control or Machine Learning tools for optimization, optimal selection and model learning. You have a background in quantum algorithms and applications ideally working within a Python environment (highly desirable, but not essential) Familiarity in executing circuits in Qiskit is also highly desirable, but not essential The base salary for this full-time position ranges from $82,500 - $198,000. This range reflects both the minimum and maximum annual target salary which is based on a number of factors such as experience, job related-skills, education and work location. Please note, the base salary range provided does not include additional benefits, bonuses, employee stock options or any other forms of compensation which may be offered dependent on position level. Why Q-CTRL? Flexibility: We embrace flexibility and remote work so you worry more about your global impact vs a rigid work schedule Attractive salary: You’ll get to live the start-up life without start-up wages Equity: We want people to have a sense of ownership in what they do and offer the potential for equity share and annual bonuses Resources: We are well funded by the world’s best technology investors, letting us chase our ambitions with minimal constraints Parental support: We offer paid parental leave to support you and your loved ones! Diversity: We’re an equal employment opportunity employer. We value diversity, inclusion and providing equal opportunities to all, actively supporting initiatives like the ‘ Global Women in Quantum ’ program among others Unique culture: You’ll be surrounded by some of the world’s leading physicists, engineers, product, marketing and design people (to name a few!) with a strong desire to learn and transfer knowledge Meaningful values: You’ll work with an incredibly supportive team who work consistently to deliver our core values to be real, be trusted, be just and to be revered Personal development: We provide you with a personal development and wellness budget Impactful work: Last but not least! You’ll have the opportunity to work in the world’s leading field of technology and truly make an impact that matters! Please note: Q-CTRL is an Equal Employment Opportunity employer that values the strength diversity brings to the workplace. We are committed to being inclusive in the way we hire. We strongly encourage you to apply even if you do not meet all of the requirements mentioned in the job posting. To recruitment agencies, we do not accept unsolicited branded profiles and are not responsible for any fees related to unsolicited resumes.",https://www.indeed.com/jobs?q=Machine+Learning+Engineer&l=Los+Angeles%2C+CA&sc=0kf%3Aattr%286QC5F%252COR%29explvl%28MID_LEVEL%29jt%28fulltime%29%3B&vjk=361456729305462e
3,5b0e959c4e862b00,Machine Learning Engineer,"Los Angeles, CA",MID_LEVEL,DOCTORAL_DEGREE,fulltime,"Thermal Engineer I - job post JPL/NASA 192 reviews 4800 Oak Grove Dr, Pasadena, CA 91109 Full-time You must create an Indeed account before continuing to the company website to apply Apply on company site save-icon Job details Job Type Full-time Job Details New ideas are all around us, but only a few will change the world. That’s our focus at JPL. We ask the biggest questions, then search the universe for answers—literally. We build upon ideas that have guided generations, then share our discoveries to inspire generations to come. Your mission—your opportunity—is to seek out the answers that bring us one step closer. If you’re driven to discover, create, and inspire something that lasts a lifetime and beyond, you’re ready for JPL. Located in Pasadena, California, JPL has a campus-like environment situated on 177 acres in the foothills of the San Gabriel Mountains and offers a work environment unlike any other: we inspire passion, foster innovation, build collaboration, and reward excellence. This unique opportunity is part of the Mechanical Systems Engineering, Fabrication and Test Division which engages in research, technology development, and the creation of advanced mechanical, thermal, propulsion, and electronic packaging systems with expertise that spans the full breath of mechanical disciplines and is applied from architectural concept development through operations. As a Thermal Engineer, you will be working for JPL's Propulsion, Thermal and Materials Engineering Section which provides leadership and distinct world-class expertise in a wide range of technologies and technical discipline areas of chemical and electrical propulsion, thermal, materials, contamination control, analytical chemistry, geochemical instruments, physics-based modeling, and multiphase flow. A thermal engineer investigates, plans, designs and develops mechanical products and systems such as spacecraft, instruments, robots, packaged electronics, controls, engines, and machines, and mechanical, thermal, hydraulic, propulsion, or heat transfer systems for the production, transmission, measurement, and use of energy. Responsibilities: Perform the thermal design and analysis of spacecraft and space-based instruments applying the best practices, latest research, and incorporating qualified technologies. Designs include hardware and control systems to manage system temperatures within safe operating ranges through the use of radiation, conduction, convection, single- and two-phase heat transfer methods. Analyses include closed-form analytical methods as well as computational methods. Identify viable thermal designs, conduct trade studies and establishing thermal requirements, hardware specifications, and installation instructions. Quantify required thermal resources and partner with other subsystem engineers to establish interface agreements. Conduct complex design and thermal analyses to show acceptable margins for bounding nominal and fault mission conditions. Support implementation of thermal control designs through selection and procurement of thermal hardware, oversight of hardware fabrication, and integration of hardware into larger assemblies. Plan, conduct, and support thermal testing of spacecraft, instruments, subsystems and components including pre- and post-test thermal analyses, test plans/procedures, and test reports to validate the flight system design and flight readiness. Prepare for technical design and test review presentations and close review action items. Support mission operations for flight instruments, payloads, landers, rovers, or spacecraft. Perform daily health checks and review planed uplink sequences. Run and modify thermal models to compare with flight telemetry. Maintain cognizance of and be responsible for all technical and programmatic aspects of the product being developed, and to report on the status and performance to the appropriate organizations. Required Qualifications: Bachelor's with at least one year related work experience. Master's or PhD with 0 years of experience with a degree in Aerospace, Mechanical, or Chemical Engineering, Applied Physics or similar disciplines. Minimum 3.0 out of 4.0 cumulative GPA. Experience with computer aided design tools. Must have some knowledge in one or more of the following areas: heat transfer (radiation, conduction, convection), fluid mechanics, numerical methods, engineering design, and engineering lab work. Must have general understanding and application of standard principles, theories, concepts and techniques in heat transfer (especially fundamental radiation heat transfer principles) and thermal engineering. Desired Qualifications: Working experience in a student engineering internship programs in a thermal or space engineering domain. Working knowledge of typical instrumentation and ground support equipment used in thermal tests and/or thermal environments across the solar system for flight system development. Software experience: Thermal (Thermal Desktop, TMG, TSS/SINDA and/or NX Space Systems Thermal), mechanical CAD (NX, AutoCAD, SolidWorks) and Matlab or LabView expertise. Working experience with natural and forced convection, linear conduction, radiation and numerical algorithms; Development of solvers for general algebraic systems of equations, code in C and/or other programming language. Excellent verbal, written, and interpersonal skills. JPL has a catalog of benefits and perks that span from the traditional to the unique. This includes a variety of health, dental, vision, wellbeing, and retirement plans, paid time off, learning, rideshare, childcare, flexible schedule, parental leave and many more. Our focus is on work-life balance, and living healthy, fulfilling lives as we Dare Mighty Things Together. For benefits eligible positions, benefits are effective the first day of the month coincident with or immediately following the employee’s start date. For further benefits information click Benefits and Perks The hiring range displayed below is specifically for those who will work in or reside in the location listed. In extending an offer, Jet Propulsion Laboratory considers factors including, but not limited to, the candidate’s job related skills, experience, knowledge, and relevant education/training. Hiring range for this job may be adjusted based on primary work location outside of Pasadena, California. This adjusted range will be provided to candidates by the Recruiter when applicable. The typical full time equivalent annual hiring range for this job in Pasadena, California. $83,720 - $99,424 JPL is an Equal Opportunity Employer. All qualified applicants will receive consideration for employment without regard to sex, race, color, religion, national origin, citizenship, ancestry, age, marital status, physical or mental disability, medical condition, genetic information, pregnancy or perceived pregnancy, gender, gender identity, gender expression, sexual orientation, protected military or veteran status or any other characteristic or condition protected by Federal, state or local law. In addition, JPL is a VEVRAA Federal Contractor. EEO is the Law. EEO is the Law Supplement Pay Transparency Nondiscrimination Provision The Jet Propulsion Laboratory is a federal facility. Due to rules imposed by NASA, JPL will not accept applications from citizens of designated countries or those born in a designated country unless they are Legal Permanent Residents of the U.S or have other protected status under 8 U.S.C. 1324b(a)(3). The Designated Countries List is available here.",https://www.indeed.com/jobs?q=Machine+Learning+Engineer&l=Los+Angeles%2C+CA&sc=0kf%3Aattr%286QC5F%252COR%29explvl%28MID_LEVEL%29jt%28fulltime%29%3B&vjk=5b0e959c4e862b00
