,job_id,job_title,location,experience,education,job_type,job_description,job_link
13,10bb0611e40d535e,Machine Learning Engineer,"Los Angeles, CA",MID_LEVEL,BACHELORS_DEGREE,fulltime,"GN&C Robotics II - job post JPL/NASA 191 reviews 4800 Oak Grove Dr, Pasadena, CA 91109 Full-time You must create an Indeed account before continuing to the company website to apply Apply on company site save-icon Job details Job Type Full-time Job Details New ideas are all around us, but only a few will change the world. That’s our focus at JPL. We ask the biggest questions, then search the universe for answers—literally. We build upon ideas that have guided generations, then share our discoveries to inspire generations to come. Your mission—your opportunity—is to seek out the answers that bring us one step closer. If you’re driven to discover, create, and inspire something that lasts a lifetime and beyond, you’re ready for JPL. Located in Pasadena, California, JPL has a campus-like environment situated on 177 acres in the foothills of the San Gabriel Mountains and offers a work environment unlike any other: we inspire passion, foster innovation, build collaboration, and reward excellence. This unique opportunity is part of the Autonomous Systems Division , which is responsible for technology development, advanced concepts, design, development, delivery, integration and test, verification and validation, and operation of Command and Data Handling (C&DH) Hardware, Flight Software, Power Systems, Robotic Systems, and Guidance and Control (G&C). As a Robotics Engineer in the Guidance, and Control Analysis Group , you will be working for JPL’s Guidance and Control Section . We do system engineering, design and analysis, hardware development/procurement, testing, and operations support in G&C areas for unique deep-space/earth-orbiting/astrophysics missions. We also do world class research and technology development in autonomous guidance, navigation and control systems including pin-point and safe landing, space rendezvous, formation flying, and precision pointing, among others. Responsibilities: Uses multi-disciplinary expertise to build Robotics Systems defined as autonomous or remotely-controlled machines which can perform sensing, understanding, and useful actions in unknown and unstructured environments. Typical sub-disciplines include computer vision and perception, multi-sensor estimation and control, autonomous planning and decision making, mobility and manipulation, mechatronics design and implementation, and modeling and simulation. This Robotics Systems Engineer will be responsible for leading the development and deployment of robotics surface systems for some of the following applications: Technology development or flight projects Research systems for NASA and non-NASA sponsors as well as NASA missions destined for space Concept development, publication of novel concepts, and proposal writing for NASA and non-NASA programs Perception, planning, navigation, machine learning, and autonomy for surface, underwater, and aerial mobility systems Intelligent manipulation Manipulator and vehicle concepts and advanced control Autonomous navigation and mobility Sensor fusion for localization and mapping Multi-robot architecture and behavior design Learning and estimation of system and interaction models Distributed estimation, world model building, knowledge sharing Distributed task recognition, allocation, and scheduling Embedded C/C++/Python robotic software development for controls and autonomy Qualifications: This position requires a Bachelor’s degree in Electrical Engineering, Aerospace Engineering, Computer Engineering or related technical discipline with a minimum of 3 years of related experience, a Master’s degree in a technical discipline with a minimum of 1 years of related experience, or a PhD in a technical discipline Other requirements include: Knowledge in one or more of the following areas: spacecraft guidance navigation and control hardware, software, advanced algorithm development; pointing, acquisition and tracking systems. Knowledge of applicable industry and/or academic practices and standards in precision optical sensor pointing, spacecraft instrument disturbance rejection, instrument pointing systems. Understanding of principles, theories, concepts and techniques in high precision pointing systems. Ability to conceive, design, analyze, simulate, and assesses highly complex and critical performance at G&C subsystem level. Familiar with the design, development, V&V, and delivery of guidance & control flight software. Proven team player and effective leader with excellent communication, interpersonal, verbal and presentation skills. Familiar with designing, analyzing, implementing, calibrating, verifying, and simulating complex and advanced GN&C on-orbit systems. Desired experience and skills include: Software development skills in C/C++. Experience in the design and software implementation of spacecraft guidance, control, and estimation algorithms. Experience in model development, closed-loop simulation, and V&V of spacecraft GNC systems. JPL has a catalog of benefits and perks that span from the traditional to the unique. This includes a variety of health, dental, vision, wellbeing, and retirement plans, paid time off, learning, rideshare, childcare, flexible schedule, parental leave and many more. Our focus is on work-life balance, and living healthy, fulfilling lives as we Dare Mighty Things Together. For benefits eligible positions, benefits are effective the first day of the month coincident with or immediately following the employee’s start date. For further benefits information click Benefits and Perks The hiring range displayed below is specifically for those who will work in or reside in the location listed. In extending an offer, Jet Propulsion Laboratory considers factors including, but not limited to, the candidate’s job related skills, experience, knowledge, and relevant education/training. Hiring range for this job may be adjusted based on primary work location outside of Pasadena, California. This adjusted range will be provided to candidates by the Recruiter when applicable. The typical full time equivalent annual hiring range for this job in Pasadena, California. $109,408 - $139,672 JPL is an Equal Opportunity Employer. All qualified applicants will receive consideration for employment without regard to sex, race, color, religion, national origin, citizenship, ancestry, age, marital status, physical or mental disability, medical condition, genetic information, pregnancy or perceived pregnancy, gender, gender identity, gender expression, sexual orientation, protected military or veteran status or any other characteristic or condition protected by Federal, state or local law. In addition, JPL is a VEVRAA Federal Contractor. EEO is the Law. EEO is the Law Supplement Pay Transparency Nondiscrimination Provision The Jet Propulsion Laboratory is a federal facility. Due to rules imposed by NASA, JPL will not accept applications from citizens of designated countries or those born in a designated country unless they are Legal Permanent Residents of the U.S or have other protected status under 8 U.S.C. 1324b(a)(3). The Designated Countries List is available here.",https://www.indeed.com/jobs?q=Machine+Learning+Engineer&l=Los+Angeles%2C+CA&sc=0kf%3Aattr%28FCGTU%7CHFDVW%7CQJZM9%7CUTPWG%252COR%29explvl%28MID_LEVEL%29jt%28fulltime%29%3B&radius=50&start=20&pp=gQAeAAAAAAAAAAAAAAAB_ipiFgAcAQIBBxAGAnly6f0rlpJIh92f0QJhIDsbIX5KhwAA&vjk=10bb0611e40d535e
14,fc7c42501a69be13,Machine Learning Engineer,"Los Angeles, CA",MID_LEVEL,BACHELORS_DEGREE,fulltime,"Chief Engineer - Electric Aircraft - job post Seaflight Technologies Los Angeles, CA Full-time Apply now Apply now save-icon Job details Job Type Full-time We're looking for a world-class, experienced Chief Engineer to direct our engineering efforts and the engineering team in developing novel electric fixed wing high-lift drones that achieve real-world ranges and payloads that will read like a typo compared to the competition. What you'll do : You’ll lead and mentor a team of engineers in the design and development of (at first) novel drones that fly over water in ground effect, and (later) those that operate with extreme efficiency in all capacities and situations. You'll help to grow that team over time with diverse top tier talent that you help bring on board to fill roles in mechanical, robotics, electrical, powertrain, aerodynamics, and software engineering. You’ll take the initiative for technical leadership on both small-scale prototypes and full scale versions, and be a positive hands-on contributor to the building and testing of any hardware. You’ll have a lot of responsibility for setting (and meeting!) specific and ambitious engineering requirements for a full craft, and on down into systems and sub-systems – you'll educate your collaborators on the why and the how, as well as learning from your team. You’ll work directly with the CEO on macro and micro facets of the engineering as well as some aspects of the business, and be a comfortable communicator to internal and external stakeholders alike. You’ll pro-actively help to project manage the engineering progress towards specific milestones, on time and on budget, adhering to best practices and industry standards for quality and safety. You’ll set the tone. Who you are : You love airplanes. Experience Essential! Several (>5 preferred) years in an industry setting working on design and/or development of flying machines, from the conceptual through to real hardware (experience on the powertrain side also valued). We definitely value direct experience with electric/electrified aircraft, but you'd at least have the enthusiasm to be a very fast learner. Ideally you also have direct personal experience in – and passion for - prototyping and rapid incremental testing and development of full systems at the simulation, benchtop and small/RC scale. You have had direct reports and have experience managing engineers to successful completion of impressive milestones – those who have worked under you will have good things to say about that time if we ask them. Your approach to work You feel comfortable working in grey areas and can take intelligent action without all the information being available, but you can justify with the best numbers you can run in the moment Vibrant curiosity; you take a keen interest in the product and the tools and processes you use, to continually improve the work of the whole company and deepen your own knowledge and capability. Extremely high levels of self-motivation – this is a small team that requires everyone to take the initiative even if it’s outside their comfort zone. You care about quality and safety in everything you do You have the demonstrated ability to collaborate effectively and with empathy with colleagues, suppliers, and other stakeholders from a wide range of disciplines and backgrounds. Education Bachelors or higher degree in aerospace/aeronautical, mechanical, electrical engineering or a related field. You must also: Have the pre-existing right to work in the US (we can transfer an H1-B but are not sponsoring any new visas for this role other than an E-3 Australia-to-USA if applicable) Be able to start work with us inside 8 weeks from offer accepted. Be available for full time work on-site in Carson, Los Angeles (some remote work flexibility may be available once you are up and running but this is primarily in-person) Our process After screening, we'll do an initial call with the hiring manager. If promising, you would be invited to chat to the rest of the team and present some prior project work, and we’ll do our best to show you why this is going to be a really, really impactful thing for you to do with your talent. This will be a deep dive, and may require more than one session. If still successful, you'd be invited to our facility for a last stage. Who We Are Seaflight is a young company on a mission to accelerate an electric and equitable future for flight. And we’re doing it with friendly robots! We design, build, test and manufacture uncrewed (drone) electric flying machines to deliver cargo with world-beating aerodynamic efficiency. We’re a Y Combinator (S22) startup that’s venture-backed by top-tier VCs, with R&D funding from the government too. We’re based in sunny South Bay Los Angeles, not too far from the beaches. The company is first developing remote-piloted wingships that will fly in ground effect to offer a highly efficient, extremely low-cost, quick-to-market way to establish logistics service in some of the world’s most difficult-to-serve markets. Taking advantage of several proprietary, cutting-edge technologies we’re developing to do this, a much broader range of applications is on the horizon as we aim to be a global leader in middle mile drone capability as well as a high-value developer of key tech for all forms of electric flight. We're showing it’s possible now to cut costs, cut emissions, cut time, and cut worries with electric flight that is focused on extreme efficiency, not crazy complexity. We celebrate differences and are committed to a diverse workplace that fosters inclusion for employees from different backgrounds and experiences. You see sentences like that that a lot, so here’s the most obvious real example - sure, we’re dealing with small number statistics right now, but our current workforce is 50% female and features citizens of 4 different countries. Benefits Flexible time off (just need manager approval) Employee equity Health insurance: medical, vision, dental, short-term disability, and life Relocation assistance Flexible hours (deliverable-based goals) Personal recognition for your work through technical publishing, social media features, industry events 4KexZwPMt0 If you require alternative methods of application or screening, you must approach the employer directly to request this as Indeed is not responsible for the employer's application process.",https://www.indeed.com/jobs?q=Machine+Learning+Engineer&l=Los+Angeles%2C+CA&sc=0kf%3Aattr%28FCGTU%7CHFDVW%7CQJZM9%7CUTPWG%252COR%29explvl%28MID_LEVEL%29jt%28fulltime%29%3B&radius=50&start=20&pp=gQAeAAAAAAAAAAAAAAAB_ipiFgAcAQIBBxAGAnly6f0rlpJIh92f0QJhIDsbIX5KhwAA&vjk=fc7c42501a69be13
15,0f937f7dc9fc9826,Machine Learning Engineer,"Los Angeles, CA",MID_LEVEL,BACHELORS_DEGREE,fulltime,"Mechanical Engineer - job post SMP Engineering, Inc. 1815 Flower Street, Glendale, CA 91201 $28 - $48 an hour -  Full-time Responded to 51-74% of applications in the past 30 days, typically within 9 days. Apply now Apply now save-icon Job details Salary $28 - $48 an hour Job Type Full-time About SMP Engineering: In a nutshell, we work on the hard stuff. Our customers come to us to quickly engineer, cost effective solutions to a wide range of technical challenges. These include product development and design to manufacturing/factory automation and everything in between. Project like these requires us to be fast and accurate since time lost getting to market reduces profits. We take these projects from the concept phase all the way to delivery of production hardware to the end customer. To do this, we are constantly looking for the best engineering talent. We are looking for someone who can: Conceptualize, design and prototype novel products. Design and build specialty manufacturing equipment and tooling. Meet directly with customers to develop project descriptions and scope. Use our modern, fully equipped machine shop to utilize your hands-on experience to build and assemble prototypes and mock-ups. Work closely with our interdisciplinary engineering team to deliver cost effective solutions in a timely manner. Requirements: Must have a Bachelor's Degree in Mechanical Engineering Must have 3-5 years of experience, preferably in the Aerospace Industry A background in a 'hands-on' environment CNC background is a PLUS! Facilities: SMP has state of the art machining, molding and fabrication capabilities and software that are continuously being improved and expanded. We provide you with all the tools necessary for you to perform at your best. Our culture: We support our employees continually by providing them with on-going high-quality training and education. We are a tight knit interdisciplinary team, exchanging ideas and learning from each other – we communicate openly with one another providing valuable, yet honest feedback. We also offer an attractive compensation package, modern workplace environment and companywide passion to give our best every day! Benefits: Subsidized health insurance for you and your dependents, optional dental insurance Ability to accrue 2 weeks of paid vacation! Paid Holidays Onsite Expresso/Coffee maker/Vending machines & refillable water provided Onsite parking lot Bonus Pay Job Type: Full-time Pay: $28.00 - $48.00 per hour Benefits: 401(k) Health insurance Paid time off Schedule: 8 hour shift Monday to Friday Ability to commute/relocate: Glendale, CA 91201: Reliably commute or planning to relocate before starting work (Required) Education: Bachelor's (Required) Experience: Mechanical engineering: 3 years (Required) Work Location: One location Health insurance If you require alternative methods of application or screening, you must approach the employer directly to request this as Indeed is not responsible for the employer's application process.",https://www.indeed.com/jobs?q=Machine+Learning+Engineer&l=Los+Angeles%2C+CA&sc=0kf%3Aattr%28FCGTU%7CHFDVW%7CQJZM9%7CUTPWG%252COR%29explvl%28MID_LEVEL%29jt%28fulltime%29%3B&radius=50&start=30&pp=gQAtAAAAAAAAAAAAAAAB_ipiFgAeAQIBBxAGH3aw_8v2YbZPhXOfxmMkINwN2NeWQmoRAAA&vjk=0f937f7dc9fc9826&advn=51552666613348
16,eaa742e706221c13,Machine Learning Engineer,"Los Angeles, CA",MID_LEVEL,BACHELORS_DEGREE,fulltime,"Developer - job post CuraPatient, Inc. 2 reviews CuraPatient, Inc. in Irvine, CA 92618 $115,000 - $135,000 a year -  Full-time Responded to 51-74% of applications in the past 30 days, typically within 22 days. Apply now Apply now save-icon Job details Salary $115,000 - $135,000 a year Job Type Full-time Who We Are CuraPatient is a digital public health SaaS solution focused on reducing preventable disease and death, addressing health disparities by linking vulnerable populations to available resources, and empowering the front line public health workforce to help reduce burnout. We are experts at designing simple tools powered by Artificial Intelligence to solve public health problems. Headquartered in Irvine, California, our products are built by fast-moving, talented, “roll-up-your-sleeves-and-make-it-happen” team players. If you’re someone who thinks big, who can move fast, and who wants to make an impact in Public Health, then get ready to join the CuraPatient team! About the Role: We are seeking a highly skilled Developer to join our CuraPatient Engineering Team of creators, who are consistently raising the bar on user experiences. The ideal candidate should have extensive experience coding for modular monolithic Java applications based on PostgreSQL, Spring (SpringBoot), and Hibernate hosted on AWS. You should be comfortable working alongside a team as well as working independently in the design and development of mission-critical websites, applications, and layers of the infrastructure. You’ll be working with highly complex tasks in the Healthcare field that will test your abilities and you’ll need to resolve technical issues through debugging, research, and investigation. Our Back End Developers have an immediate effect on our business success, as well as the success of our clients. Success in this Role Looks Like: Develop, maintain, and improve backend systems for large-scale, modular monolithic Java applications. Write clean, efficient, modular code that adheres to industry best practices and coding standards. Collaborate with cross-functional teams, including front-end developers, QA engineers, and DevOps professionals, to design, implement and deploy high-quality software solutions. Design and develop scalable database schemas and optimize queries to ensure system performance. Monitor and optimize the application and infrastructure performance, identifying and resolving any bottlenecks or issues as they arise. Implement and maintain security measures to ensure data privacy and compliance with industry standards and regulations. Stay updated with the latest industry trends, technologies, and tools to improve the system continually. What You’ll Bring: At least five years of experience as a backend developer, with a focus on Java programming and PostgreSQL databases. Experience with AWS cloud services such as EC2, S3, RDS, and Lambda. Strong understanding of software development methodologies, design patterns, and industry best practices. Experience with modular monolithic architecture and microservices. Knowledge of API design and implementation. Ability to work independently as well as part of a team in a fast-paced environment. Excellent communication skills and ability to collaborate effectively with cross-functional teams. Education: Bachelor's or Master's degree in Computer Science, Software Engineering, or a related field. Must be able to work onsite, in our Irvine office location. Orange County (CA) residents strongly preferred. Sorry, no relocation assistance. What’s in it for you PTO benefits for full-time salaried employees will take effect after a ninety (90) day probation period. Health Benefits start within sixty (60) days of employment. Current benefits included are: CuraPatient offers employees competitive Platinum Health packages, with HMO plans being covered 100% for the employee, and PPO plans being covered 80% for the employee. PPO Vision + Dental benefits covering 99% of the cost for the employee and their dependent(s). Personal Time Off (PTO): PTO is accrued at 3.07 hours per pay period (26), which is equivalent to 80 hours or two weeks on an annual basis (PTO is capped at 120 hours). Paid Holidays: 9 paid holidays (plus 1 paid floating holiday - you get the day off on your birthday!) Education, learning, development and lots of room for career growth Occasional company-wide and team-building events Casual attire office. At CuraPatient, our work environment for employees encourages employees to dress comfortably for work. Located at The Irvine Spectrum all employees can use Irvine Company facilities, which include: bike rentals, onsite dining, car wash & detailing services, dry cleaning service, Envoy on-demand electric vehicles and free access to KINETIC Fitness Centers (cardio machines, weight machines, free weights and studio). Salary Range Transparency: $120,000 - $140,000 - you know your worth and we want to hear you out. We’re open to a salary that best reflects your experience, skills, knowledge and talents. Come as you are: CuraPatient considers applications for employment without regard to the applicant’s race, color, national origin, sex, religion, creed, age, sexual orientation, gender identity, marital status, disability, protected veterans or any other characteristics protected by applicable law. Equity starts with everyone: CuraPatient is dedicated to fostering and maintaining a fair and equal work environment based on mutual respect for the dignity and diversity of each individual. We believe that a diverse and inclusive workplace is important for success and we are committed to building an environment that cultivates collaboration and embraces different perspectives. We firmly believe that a diverse, equitable and inclusive workplace is essential to shared success and fulfilling our company’s mission. COVID-19 Precautions: CuraPatient strongly encourages employees to get vaccinated. Employees are encouraged to practice additional safety precautions that keeps them and their loved ones protected. A hand washing station, hand sanitizer, masks and COVID test kits are supplied in the office. Principals only. Recruiters, please don't contact this job poster. Please do not contact employees about other services, products, or commercial interests. Job Type: Full-time Pay: $115,000.00 - $135,000.00 per year Benefits: Dental insurance Health insurance Professional development assistance Vision insurance Experience level: 5 years Schedule: 10 hour shift 8 hour shift Ability to commute/relocate: Irvine, CA 92618: Reliably commute or planning to relocate before starting work (Required) Application Question(s): Will you now or in the future require sponsorship for employment visa status (e.g., H-1B visa status)?"" Education: Bachelor's (Preferred) Experience: AWS: 5 years (Preferred) Java: 5 years (Preferred) APIs: 5 years (Preferred) Spring Boot: 5 years (Preferred) Hibernate: 5 years (Preferred) PostgreSQL: 5 years (Preferred) Back-end development: 5 years (Preferred) Work Location: In person Health insurance If you require alternative methods of application or screening, you must approach the employer directly to request this as Indeed is not responsible for the employer's application process.",https://www.indeed.com/jobs?q=Machine+Learning+Engineer&l=Los+Angeles%2C+CA&sc=0kf%3Aattr%28FCGTU%7CHFDVW%7CQJZM9%7CUTPWG%252COR%29explvl%28MID_LEVEL%29jt%28fulltime%29%3B&radius=50&start=30&pp=gQAtAAAAAAAAAAAAAAAB_ipiFgAeAQIBBxAGH3aw_8v2YbZPhXOfxmMkINwN2NeWQmoRAAA&vjk=eaa742e706221c13
