,job_id,job_title,location,experience,education,job_type,job_description,job_link
0,e5ed97af2b12cf81,Software Engineer,"San Francisco, CA",ENTRY_LEVEL,EXSNN|FCGTU|HFDVW|QJZM9|UTPWG%2COR,fulltime,"Analyst, Enterprise Analytics - job post DoorDash, Inc. 9,406 reviews San Francisco, CA 94105 $73,000 - $117,000 a year -  Full-time DoorDash, Inc. 9,406 reviews Read what people are saying about working here. Apply now Apply now save-icon Job details Salary $73,000 - $117,000 a year Encouraged to Apply Fair chance Job Type Full-time About the Team The Analytics Center of Excellence uses data to create and deliver best in class insight and awareness for the organization and global partners. This team is responsible for building data standards and practices, creating new tools, and implementing analytic solutions that are innovative and scalable. About the Role This role will support the Enterprise organization by uncovering strategic insights in our data, packaging recommendations into compelling presentations, and building internal tools and dashboards to grow and empower the organization. You will report into the Manager, Ads & Promos on our Analytics Center of Excellence team in our Enterprise organization. You will work closely with the non-restaurant sales and account management team as well as with business analysts on other business verticals for the Enterprise org. Once our offices reopen, we expect this role to be hybrid with some time in-office and some time remote. You’re excited about this opportunity because you will… Use SQL to explore DoorDash and merchant data and uncover strategic insights and recommendations Conduct analysis and share data-driven insights in succinct presentations with data visualizations to showcase the results of past initiatives, diagnose issues in merchant performance, and propose the value of new endeavors. Design, build and evolve automated reporting and dashboards that drive strategic decisions making across the Enterprise organization Develop and standardize analytic methodologies and operational metrics to improve the efficiency and effectiveness of the team Ensure data integrity by understanding and identifying opportunities to improve the back end data structure We’re excited about you because… You have 1-2 years experience in data analytics with a strong attention to detail and accuracy, and you are passionate about telling the story behind the numbers. You are well skilled in SQL, and able to build advanced queries and fetch the data necessary to answer any business question. You are able to craft your data insights into presentations that are relatable, succinct, sophisticated, and impactful. You are a self-motivated, rapid learner, excited about developing your analytical and problem-solving skills. You are curious and an owner, always looking for opportunities to learn and better your work product. You are comfortable in a fast-paced, constantly changing team-oriented environment and able to manage multiple deadlines simultaneously. About DoorDash At DoorDash, our mission to empower local economies shapes how our team members move quickly, learn, and reiterate in order to make impactful decisions that display empathy for our range of users—from Dashers to merchant partners to consumers. We are a technology and logistics company that started with door-to-door delivery, and we are looking for team members who can help us go from a company that is known for delivering food to a company that people turn to for any and all goods. DoorDash is growing rapidly and changing constantly, which gives our team members the opportunity to share their unique perspectives, solve new challenges, and own their careers. We're committed to supporting employees’ happiness, healthiness, and overall well-being by providing comprehensive benefits and perks including premium healthcare, wellness expense reimbursement, paid parental leave and more. Our Commitment to Diversity and Inclusion We’re committed to growing and empowering a more inclusive community within our company, industry, and cities. That’s why we hire and cultivate diverse teams of people from all backgrounds, experiences, and perspectives. We believe that true innovation happens when everyone has room at the table and the tools, resources, and opportunity to excel. Statement of Non-Discrimination: In keeping with our beliefs and goals, no employee or applicant will face discrimination or harassment based on: race, color, ancestry, national origin, religion, age, gender, marital/domestic partner status, sexual orientation, gender identity or expression, disability status, or veteran status. Above and beyond discrimination and harassment based on “protected categories,” we also strive to prevent other subtler forms of inappropriate behavior (i.e., stereotyping) from ever gaining a foothold in our office. Whether blatant or hidden, barriers to success have no place at DoorDash. We value a diverse workforce – people who identify as women, non-binary or gender non-conforming, LGBTQIA+, American Indian or Native Alaskan, Black or African American, Hispanic or Latinx, Native Hawaiian or Other Pacific Islander, differently-abled, caretakers and parents, and veterans are strongly encouraged to apply. Thank you to the Level Playing Field Institute for this statement of non-discrimination. Pursuant to the San Francisco Fair Chance Ordinance, Los Angeles Fair Chance Initiative for Hiring Ordinance, and any other state or local hiring regulations, we will consider for employment any qualified applicant, including those with arrest and conviction records, in a manner consistent with the applicable regulation. Pursuant to the Colorado Fair Pay Act, the base salary range in Colorado for this position is $78,030 - $105,570, plus opportunities for equity and commission. Compensation in other geographies may vary. If you need any accommodations, please inform your recruiting contact upon initial connection. XJ6 If you require alternative methods of application or screening, you must approach the employer directly to request this as Indeed is not responsible for the employer's application process.",https://www.indeed.com/jobs?q=Software+Engineer&l=San+Francisco%2C+CA&sc=0kf%3Aattr%28EXSNN%7CFCGTU%7CHFDVW%7CQJZM9%7CUTPWG%252COR%29explvl%28ENTRY_LEVEL%29jt%28fulltime%29%3B&radius=50&start=10&pp=gQAPAAAAAAAAAAAAAAAB_iDBCAAeAQBSabTA9edema6Cf8tNOegvxrD-fypUTndlxSmeAAA&vjk=e5ed97af2b12cf81
1,5775e477b969e945,Software Engineer,"San Francisco, CA",ENTRY_LEVEL,EXSNN|FCGTU|HFDVW|QJZM9|UTPWG%2COR,fulltime,"Full-stack Software Engineer - job post Juji San Jose, CA 95117 Full-time You must create an Indeed account before continuing to the company website to apply Apply on company site save-icon Job details Job Type Full-time We are seeking highly motivated and talented full-stack engineers at both senior and junior level, who are eager to help us build out the Juji platform to meet customer demands and tackle great technical challenges in a wide variety of areas, ranging from data management, natural language processing to information visualization. Qualifications Our ideal candidates are open-minded, multi-talented individuals who are willing and able to tackle full-stack technical challenges from databases to CSS. They are also eager and fast learners of new software and technologies. Required Expertise and Experience Expert-level programming experience with one or more programming languages (e.g., Java, JavaScript, C/C++, Python, or equivalent) Good experience in building and deploying web-based systems Familiar with software development lifecycle and corresponding tools Experience in functional programming (e.g., Clojure, Scheme, Scala, Haskell, or equivalent) Preferred Expertise and Experience Experience in building large-scale, web-based SaaS production systems Familiar with Clojure/Clojurescript and the related ecosystem Comfortable with *nix command line, scripting and system automation tools Good understanding of database systems (e.g., SQL and Datalog) Knowledge in one or more relevant fields: Artificial Intelligence, Machine Learning, Natural Language Processing/Generation, Distributed Computing, and Visualization Required Education A bachelor or higher degree in the area of Computer Science, Computer Engineering or equivalent disciplines. Employee Type Full Time How to Apply Email a copy of your resume to jobs AT (using the symbol @ to connect) juji-inc.com with a subject line ""Full Stack Software Engineer"".",https://www.indeed.com/jobs?q=Software+Engineer&l=San+Francisco%2C+CA&sc=0kf%3Aattr%28EXSNN%7CFCGTU%7CHFDVW%7CQJZM9%7CUTPWG%252COR%29explvl%28ENTRY_LEVEL%29jt%28fulltime%29%3B&radius=50&start=10&pp=gQAPAAAAAAAAAAAAAAAB_iDBCAAeAQBSabTA9edema6Cf8tNOegvxrD-fypUTndlxSmeAAA&vjk=5775e477b969e945
2,354ee132d038b811,Software Engineer,"San Francisco, CA",ENTRY_LEVEL,EXSNN|FCGTU|HFDVW|QJZM9|UTPWG%2COR,fulltime,"Software Engineer - job post Lawrence Livermore National Laboratory 198 reviews Livermore, CA 94550 $103,290 - $139,128 a year -  Full-time Lawrence Livermore National Laboratory 198 reviews Read what people are saying about working here. You must create an Indeed account before continuing to the company website to apply Apply on company site save-icon Job details Salary $103,290 - $139,128 a year Job Type Full-time Company Description Join us and make YOUR mark on the World! Are you interested in joining some of the brightest talent in the world to strengthen the United States’ security? Come join Lawrence Livermore National Laboratory (LLNL) where our employees apply their expertise to create solutions for BIG ideas that make our world a better place. We are committed to a diverse and equitable workforce with an inclusive culture that values and celebrates the diversity of our people, talents, ideas, experiences, and perspectives. This is essential to innovation and creativity for continued success of the Laboratory’s mission. Pay Range $103,290.00 - $139,128.00 Annually for the SES.1 level $123,960.00 - $166,992.00 Annually for the SES.2 level Please note that the pay range information is a general guideline only. Many factors are taken into consideration when setting starting pay including education, experience, the external labor market, and internal equity. Job Description We have multiple openings for Software Engineers to work as members of the Rapid Application Development (RAD) team. You will design, test, deploy and maintain software solutions. These positions will be within ASQ in the Computing Directorate. These positions will be filled at either the SES.1 or SES.2 level based on knowledge and related experience as assessed by the hiring team. Additional job responsibilities (outlined below) will be assigned if hired at the higher level. In this role you will Gather, analyze, and formally document new systems requirements and changes to existing systems. Develop detailed design specifications, schema design and entity relationship models, and test plans. Actively participate in code/design reviews. Apply computer science knowledge in the development of software using industry standard practices and modern programming languages and operating systems. Adhere to established software development and data modeling design practices, in addition to project management and version release practices. Support and coordinate with team management and stakeholders’ prioritization of work. Engage other developers frequently to share relevant knowledge, opinions, and recommendations. Contribute to the fulfillment of technical projects and organizational objectives, functioning as a team member on multi-disciplinary teams and participate in the entire software development lifecycle. Perform other duties as assigned. Additional job responsibilities at the SES.2 Level Independently lead requirements gathering, software design, schema development and testing. Apply highly advanced knowledge to use of development platforms and mentoring others. Develop advanced technical solutions to highly complex and ambiguous problems across multiple domains and socialize work of the team and growing visibility within WCI and LLNL. Qualifications Ability to obtain and maintain a U.S. DOE Q-level security clearance, which requires U.S. Citizenship. Bachelor’s degree in Computer Science or a related field, or the equivalent combination of education and related experience. Demonstrated knowledge and/or experience with relational databases, web development, and object-oriented design principles. Skilled in all aspects of software development life cycle: feasibility, requirements, design, implementation, integration, test and deployment. Ability to work independently and/or as part of a multi-disciplinary team environment and resolve user issues, data problems, and code defects. Problem-solving skills and the ability to find solutions to complex problems. Effective interpersonal and critical thinking skills necessary to contribute to team objectives. Sufficient written and verbal communication skills necessary to prepare, present, and document technical information. Additional Qualifications at the SES.2 Level Comprehensive knowledge and experience with relational databases and modern web development technologies and languages, such as, Oracle Apex, FileMaker Pro, Javascript, Ajax, CSS, and HTML. Broad experience with information systems application development. Excellent written and verbal communication skills necessary to prepare, present, and document technical information. Qualifications We Desire Experience with backend technologies such as Node, Spring, Java Persistence Architecture (JPA), MongoDB or Oracle databases. Experience in software design and architecture principles. Experience with data modeling tools. Additional Information By the start of employment, you must live within a commutable distance to LLNL. Commutable distance means up to 3 hours each way in normal commute traffic—or approximately 100 miles—from your LLNL official worksite*, and within the state of California (if your normal work site is in California). Position Information This is a Career Indefinite position, open to Lab employees and external candidates. Why Lawrence Livermore National Laboratory? Flexible Benefits Package 401(k) Relocation Assistance Education Reimbursement Program Flexible schedules (*depending on project needs) Inclusion, Diversity, Equity and Accountability (IDEA) - visit https://www.llnl.gov/diversity Our core beliefs - visit https://www.llnl.gov/diversity/our-values Employee engagement - visit https://www.llnl.gov/diversity/employee-engagement Security Clearance This position requires a Department of Energy (DOE) Q-level clearance. If you are selected, we will initiate a Federal background investigation to determine if you meet eligibility requirements for access to classified information or matter. Also, all L or Q cleared employees are subject to random drug testing. Q-level clearance requires U.S. citizenship. Pre-Employment Drug Test External applicant(s) selected for this position must pass a post-offer, pre-employment drug test. This includes testing for use of marijuana as Federal Law applies to us as a Federal Contractor. Equal Employment Opportunity We are an equal opportunity employer that is committed to providing all with a work environment free of discrimination and harassment. All qualified applicants will receive consideration for employment without regard to race, color, religion, marital status, national origin, ancestry, sex, sexual orientation, gender identity, disability, medical condition, pregnancy, protected veteran status, age, citizenship, or any other characteristic protected by applicable laws. We invite you to review the Equal Employment Opportunity posters which include EEO is the Law and Pay Transparency Nondiscrimination Provision. Reasonable Accommodation Our goal is to create an accessible and inclusive experience for all candidates applying and interviewing at the Laboratory. If you need a reasonable accommodation during the application or the recruiting process, please use our online form to submit a request. California Privacy Notice The California Consumer Privacy Act (CCPA) grants privacy rights to all California residents. The law also entitles job applicants, employees, and non-employee workers to be notified of what personal information LLNL collects and for what purpose. The Employee Privacy Notice can be accessed here.",https://www.indeed.com/jobs?q=Software+Engineer&l=San+Francisco%2C+CA&sc=0kf%3Aattr%28EXSNN%7CFCGTU%7CHFDVW%7CQJZM9%7CUTPWG%252COR%29explvl%28ENTRY_LEVEL%29jt%28fulltime%29%3B&radius=50&start=10&pp=gQAPAAAAAAAAAAAAAAAB_iDBCAAeAQBSabTA9edema6Cf8tNOegvxrD-fypUTndlxSmeAAA&vjk=354ee132d038b811
3,41e529fe17bb9049,Software Engineer,"San Francisco, CA",ENTRY_LEVEL,EXSNN|FCGTU|HFDVW|QJZM9|UTPWG%2COR,fulltime,"This job has expired on Indeed Reasons could include: the employer is not accepting applications, is not actively hiring, or is reviewing applications Software Engineer, Automation (Maps & Navigation) - job post Tesla Palo Alto, CA Full-time Job details Job Type Full-time The Role: Tesla is looking for a Software Engineer to join our Maps, Routing, and Guidance Automation Engineering team. This team is focused on creating the world's best in-car navigation experience that runs on the various vehicle Infotainment displays (Model S, 3, X, Y etc). You will work with other developers, automation engineers, user experience testers to ensure new features are well built and tested through automation. You will be responsible for developing new features and creating automated tests to cover all new and legacy features. Responsibilities: Develop/build new features & frameworks. Develop automated test scripts that validate UI/UX functionality specific to maps and navigation. Work closely with automation engineers, developers, and user experience testers to ensure the features are well tested through automation. Collaborate with our frameworks team to integrate these automated test cases into our continuous integration pipeline. Investigate failures of automated test executions and maintain regression tests. Requirements: BS in Computer Science, Physics, Computer Engineering, Electrical Engineering or proof of exceptional skills in related fields or practical software engineering experience. Min of 1+ year of software testing, automation development and/or QA Engineering experience (hiring all levels: Senior, Staff, Lead). Desire to work in a fast paced, demanding and highly collaborative environment. Familiar with Linux/Unix environments. Strong experience with industry standard development and/or automation tools (Stash, JIRA, Jenkins, Git, Docker, etc). Familiarity with industry continuous integration concepts. Strong coding skills with one of the following: Python, C++, Java or Ruby.",https://www.indeed.com/jobs?q=Software+Engineer&l=San+Francisco%2C+CA&sc=0kf%3Aattr%28EXSNN%7CFCGTU%7CHFDVW%7CQJZM9%7CUTPWG%252COR%29explvl%28ENTRY_LEVEL%29jt%28fulltime%29%3B&radius=50&start=10&pp=gQAPAAAAAAAAAAAAAAAB_iDBCAAeAQBSabTA9edema6Cf8tNOegvxrD-fypUTndlxSmeAAA&vjk=41e529fe17bb9049
4,9aff724d0060942c,Software Engineer,"San Francisco, CA",ENTRY_LEVEL,EXSNN|FCGTU|HFDVW|QJZM9|UTPWG%2COR,fulltime,"Software Engineer - job post Mudrasys Pleasanton, CA 94588 $150,176 - $155,000 a year -  Full-time You must create an Indeed account before continuing to the company website to apply Apply on company site save-icon Job details Salary $150,176 - $155,000 a year Job Type Full-time Mudrasys Job Duties: Plans, develops, tests, and documents computer programs, applying knowledge of programming techniques and computer systems. Formulate plan and outline steps required to develop program, using structured analysis and design. Consult with users to identify current operating procedures and clarify program objectives. Prepares flowcharts and diagrams to illustrate sequence of steps program must follow and to describe logical operations involved. Converts project specifications, using flowcharts and diagrams, into sequence of detailed instructions and logical steps for coding. Troubleshoot and debug any software related issues with the application residing on the cloud. Set up the development environment and guide the team. Fine-tune software at different layers for optimal performance at scale; use system profiling tools and stress testing to find and fix weak spots. Preparation of testing strategy and test scripts. Perform analysis, reviews, and alters program to increase operating efficiency or adapt to new requirements. Provide technical assistance and monitor performance post implementation. Job Requirements: Required Master’s or foreign equivalent in CS, CIS, MIS, Engineering (Any), or any related field. Must be able to travel/relocate to various client sites throughout the U.S. Job duration: 40 Hours / Week, Permanent position, Full time Salary: $150176.00/Year to $155000.00/Year Location of work: 6200 Stoneridge Mall Road, Suite 300, Pleasanton, CA 94588 To contact or apply please send resumes to HR, Mudrasys, Inc., 6200 Stoneridge Mall Road Suite 300 Pleasanton, CA 94588 or email resumes to hr@mudrasys.com",https://www.indeed.com/jobs?q=Software+Engineer&l=San+Francisco%2C+CA&sc=0kf%3Aattr%28EXSNN%7CFCGTU%7CHFDVW%7CQJZM9%7CUTPWG%252COR%29explvl%28ENTRY_LEVEL%29jt%28fulltime%29%3B&radius=50&start=10&pp=gQAPAAAAAAAAAAAAAAAB_iDBCAAeAQBSabTA9edema6Cf8tNOegvxrD-fypUTndlxSmeAAA&vjk=9aff724d0060942c
