,job_id,job_title,location,experience,education,job_type,job_description,job_link
20,f6139b8ecf1cd79e,Software Engineer,"San Francisco, CA",ENTRY_LEVEL,EXSNN|FCGTU|HFDVW|QJZM9|UTPWG%2COR,fulltime,"Software Quality Assurance Engineer - job post Lawrence Livermore National Laboratory 198 reviews Livermore, CA 94550 $113,730 - $153,264 a year -  Full-time Lawrence Livermore National Laboratory 198 reviews Read what people are saying about working here. You must create an Indeed account before continuing to the company website to apply Apply on company site save-icon Job details Salary $113,730 - $153,264 a year Job Type Full-time Company Description Join us and make YOUR mark on the World! Are you interested in joining some of the brightest talent in the world to strengthen the United States’ security? Come join Lawrence Livermore National Laboratory (LLNL) where our employees apply their expertise to create solutions for BIG ideas that make our world a better place. We are committed to a diverse and equitable workforce with an inclusive culture that values and celebrates the diversity of our people, talents, ideas, experiences, and perspectives. This is essential to innovation and creativity for continued success of the Laboratory’s mission. Pay Range $113,730 - $153,264 Annually for the TSS.2 level $136,500 - $183,888 Annually for the TSS.3 level Please note that the pay range information is a general guideline only. Many factors are taken into consideration when setting starting pay including education, experience, the external labor market, and internal equity. Job Description We have an opening for a Software Quality Assurance (SQA) Engineer to apply the principles and practices of Software Quality Engineering, by ensuring laboratory developed and acquired software meet regulatory, contract and customer requirements. You will assist the SQA Manager with the interpretation of contract requirements, DOE Orders, and consensus standards and determining those that apply to LLNL software and help develop institutional program descriptions, procedures, guidelines, and implementation mechanisms to evaluate SQA implementation in formal assessments, as well as mentor developers in the application of SQA in their projects and activities. This position is in the Applications Simulations and Quality (ASQ) Division within the Computing Directorate and will be matrixed to the Mission Assurance Office (MAO). This position will be filled at either the TSS.2 or TSS.3 level depending on your qualifications. Additional job responsibilities (outlined below) will be assigned if you are selected at the higher level. In this role you will Review interpretation of contract requirements and consensus standards that apply to LLNL software. Review and/or update implementation mechanisms for institutional software quality program descriptions, policies, procedures, and guidance to satisfy contract requirements. Review nuclear/radiological safety software (aka 830 software) qualification packages for adequacy and completeness to determine if the software should be authorized for use at LLNL. Maintain the LLNL 830 Software Inventory. Collaborate with internal and external stakeholders on the implementation of the SQA program. Provide guidance/education to code teams in the applications of SQA best practices to ensure compliance and continuous improvement. Participate in performance and compliance assessments of programmatic implementation of the Institutional SQA Program (ISQAP). Back-up the LLNL SQA Manager as needed. Perform other duties as assigned. Additional job responsibilities at the TSS.3 Level Lead performance and compliance assessments of programmatic implementation of the Institutional SQA Program (ISQAP). Create, review, and/or update implementation mechanisms for institutional software quality program descriptions, policies, procedures, and guidance to satisfy contract requirements. Evaluate software risk rankings, mitigation strategies, and 830 software qualification documentation to assure appropriate quality standards and policies are met. Qualifications Ability to obtain and maintain a US DOE Q-level security clearance which requires U.S. Citizenship. Bachelor’s degree in Computer Science, Quality Assurance, Software Engineering, or related field or an equivalent combination of technical training and experience. Comprehensive knowledge of the American Society for Quality’s Software Quality Engineering Body of Knowledge. Experience in Software QA Engineering in the technology industry and executing SQA policy. Comprehensive experience in implementing SQA practices and techniques. Broad knowledge of product lifecycle management and configuration management. Demonstrated ability to effectively manage concurrent technical tasks with competing priorities. Proficient verbal and written skills to effectively collaborate, present, explain, influence, and advise stakeholders and/or external sponsors. Additional qualifications at the TSS.3 Level Significant experience conducting SQA-related performance and compliance assessments and program evaluations. Advanced knowledge of software quality applications and quality standards that govern the control of software quality. Advanced verbal and written skills to effectively collaborate, present, explain, influence, and advise stakeholders and/or external sponsors. Ability to work independently with minimal direction. Qualifications We Desire Certified as a Software Quality Engineer by the American Society for Quality, as well as certified as a Lead Auditor for ISO 9001:2015 or NQA-1. Familiar with the DOE requirements of DOE O 414.1D for nuclear safety software, NQA-1-2008, IEEE Std. 730, IEEE Std. 828, IEEE Std. 1012, and NAP-401.1A. Knowledge of Confluence, Jira, and Microsoft Teams. Additional Information All your information will be kept confidential according to EEO guidelines. Position Information This is a Career Indefinite position, open to Lab employees and external candidates. Why Lawrence Livermore National Laboratory? Flexible Benefits Package 401(k) Relocation Assistance Education Reimbursement Program Flexible schedules (*depending on project needs) Inclusion, Diversity, Equity and Accountability (IDEA) - visit https://www.llnl.gov/diversity Our core beliefs - visit https://www.llnl.gov/diversity/our-values Employee engagement - visit https://www.llnl.gov/diversity/employee-engagement Security Clearance This position requires a Department of Energy (DOE) Q-level clearance. If you are selected, we will initiate a Federal background investigation to determine if you meet eligibility requirements for access to classified information or matter. Also, all L or Q cleared employees are subject to random drug testing. Q-level clearance requires U.S. citizenship. Pre-Employment Drug Test External applicant(s) selected for this position must pass a post-offer, pre-employment drug test. This includes testing for use of marijuana as Federal Law applies to us as a Federal Contractor. Equal Employment Opportunity We are an equal opportunity employer that is committed to providing all with a work environment free of discrimination and harassment. All qualified applicants will receive consideration for employment without regard to race, color, religion, marital status, national origin, ancestry, sex, sexual orientation, gender identity, disability, medical condition, pregnancy, protected veteran status, age, citizenship, or any other characteristic protected by applicable laws. We invite you to review the Equal Employment Opportunity posters which include EEO is the Law and Pay Transparency Nondiscrimination Provision. Reasonable Accommodation Our goal is to create an accessible and inclusive experience for all candidates applying and interviewing at the Laboratory. If you need a reasonable accommodation during the application or the recruiting process, please use our online form to submit a request. California Privacy Notice The California Consumer Privacy Act (CCPA) grants privacy rights to all California residents. The law also entitles job applicants, employees, and non-employee workers to be notified of what personal information LLNL collects and for what purpose. The Employee Privacy Notice can be accessed here.",https://www.indeed.com/jobs?q=Software+Engineer&l=San+Francisco%2C+CA&sc=0kf%3Aattr%28EXSNN%7CFCGTU%7CHFDVW%7CQJZM9%7CUTPWG%252COR%29explvl%28ENTRY_LEVEL%29jt%28fulltime%29%3B&radius=50&start=20&pp=gQAeAAAAAAAAAAAAAAAB_iDBCAAnAQEBCAlR5A0J_Ug3OLxtckb1MJGH5gBqkFLAKtA8TJhgkS8UwBkIAAA&vjk=f6139b8ecf1cd79e
21,168fee73314b6846,Software Engineer,"San Francisco, CA",ENTRY_LEVEL,EXSNN|FCGTU|HFDVW|QJZM9|UTPWG%2COR,fulltime,"web developer - job post Mental Health Association of San Francisco 7 reviews San Francisco, CA 94102 • Hybrid remote $28 - $30 an hour -  Full-time Mental Health Association of San Francisco 7 reviews Read what people are saying about working here. You must create an Indeed account before continuing to the company website to apply Apply on company site save-icon Job details Salary $28 - $30 an hour Job Type Full-time Website Developer POSITION TITLE : Website Developer JOB STATUS : Full-Time (40 hours per week); non-exempt; permanent PAY RANGE : $28 to $30 per hour BENEFITS : 100% Employer Paid Medical: Kaiser HMO or Blue Shield PPO 100% Dental, vision, life & long-term disability coverage; EAP Over 30+ days of PTO including: 10 vacation-days (baseline), 12 sick-days, personal days, and major holidays Health and Dependent Care FSA, Commuter Check, and 403(b) available Ongoing access to MHASF continuing education and skill-building workshops—all training time paid Excellent opportunity for advancement—over 70% of our staff have been promoted internally at least once! HOURS : 9am – 5pm, with some evenings and weekends as required Days: Monday to Friday; some weekends; flexibility is required Hybrid remote work flexibility REPORTS TO : Marketing Manager ABOUT THE MENTAL HEALTH ASSOCIATION OF SAN FRANCISCO (MHASF) MHASF is a mental health peer-run nonprofit located in downtown San Francisco and serving people and agencies across the Bay Area since 1947. As mental health consumers ourselves, we center the lived expertise of people with mental health challenges in our advocacy, education, and support programs, and believe that dignity and recovery in mental health are something everyone can experience. Our staff are dedicated to creating spaces for learning and healing around stigmatized and under-resourced areas in mental health—hoarding and cluttering behavior; post-hospitalization peer support; mental health and nutrition; peer mental health workforce development, and much more. OVERVIEW OF POSITION MHASF is seeking a driven Web Developer to join a mission driven and growing organization. The Web Developer is responsible for the development and maintenance of MHASF web site content to motivate, inform, educate, and intrigue users so that they regularly access the site and use it for information and decision making. They will seek out users to gather feedback and will utilize Google Analytics and other data to inform improvements and enhancements. Maintains technical integrity of web site. Maintains and upgrades hardware and software. Communicates router configuration changes, troubleshoots system errors and bugs. Maintains servers, creates monitoring reports and logs. Monitors site for user accessibility. Establishes back-ups and monitors site security. TOP 3 RESPONSIBILITIES Updates MHASF’s websites to improve UX/UI, ensuring structure, content, and graphics are alignment with MHASF’s communications, branding, and ADA guidelines With the Marketing Manager and CEO, develops and maintains guidelines and procedures on how to submit requests to update website functionality, content, and third-party app integration Conduct website and social media analytics to identify trends in website traffic and social media engagement to inform MHASF’s Marketing, Outreach, and Development teams in developing marketing strategies, SEO optimization, and content development. GENERAL RESPONSIBILITIES With the Marketing Manager, develops and implements an external and internal user support ticketing system for website issues Conducts continuous UX/UI improvement and development of MHASF websites to ensure its up to date with common coding and technology standards Act as MHASF’s cross-department liaison in support of the IT team with web development adjacent projects that require the use of the same or similar programs Integrates approved third-party applications and back-end databases like Constant Contact with the websites Conducts compatibility, mobile, and A/B testing of the website and marketing campaigns Ensures that MHASF’s website(s) are secure and compliant with any applicable laws, regulatory standards, company policies, industry best practices and/or branding guidelines Support the editing, writing, and designing of website and social media content Support and collaborate with the MOD team in the design and development of marketing, outreach, and development campaigns Maintains MHASF’s hosting, domain name registration accounts and DNS records As job descriptions cannot be exhaustive, the above list of responsibilities is intended to provide a general overview of duties to be assigned and in no way is a comprehensive list of position duties and responsibilities. POSITION QUALIFICATIONS & SKILLS Commitment to upholding the mission and values of MHASF Familiarity with the recovery movement, peer support model, and Bay Area resources Bachelor’s degree or certification in web development or related field or relevant experience Proficient and preferably certified website coding language (HTML, CSS, JavaScript, PHP, etc.) Proficiency in content management and databases: WordPress, MySQL Excellent written and oral communication skills; ability to organize and present complex information in a clear, accurate and concise manner Professional-level computer skills and experience working with modern online collaborative tools such as Office 365, SharePoint, Slack, Asana and/or other web-based applications Ability to explain step –by-step processes, create useful documentation, and help others learn Demonstrated ability to move projects forward, organize information, and support staff for successful and timely completion Demonstrated ability to organize, prioritize and coordinate work involving a wide variety of tasks, projects, and teams Take initiative and work independently and collaboratively in following through on assignments To gather and/or prepare background materials; to work and deal effectively with people of diverse cultural backgrounds Work under the pressure of deadlines and competing demands; to acquire and maintain knowledge of and appropriately apply various policies and procedures Demonstrated experience with maintaining high level of confidentiality and handling sensitive information appropriately Working knowledge of HIPPA regulations and compliance Experience with Paycom and other HR Management software a plus SUCCESSFUL ATTITUDES & WORK APPROACHES Highly organized and resourceful, attention to detail, ability to multi-task and manage time well to accomplish all key tasks and deadlines Willingness to learn and support others, take, and provide constructive feedback, and adjust communication and behavior Affirmative and accepting towards people from diverse backgrounds and experiences Experience taking initiative to self-educate about unfamiliar subjects or concepts Bilingual/Bi-cultural individuals are strongly encouraged to apply. HOW TO APPLY We only accept applications through our online portal: https://mentalhealthsf.formstack.com/forms/website_developer Applications require all the items to be considered complete; applications that do not include all of these documents will not be considered: (MS Word or PDF format) An up-to-date résumé A thoughtful cover letter describing your unique qualifications for and interest in this role We endeavor to maintain an accessible and transparent application process. We will confirm receipt of all complete applications, and will strive to notify applicants of the status of their application as soon as possible. No phone calls about this position, please. Equal Employement Opportunity Statement Mental health challenges can affect anyone at any time, regardless of identity or background, and consequently the communities we serve are highly diverse. As a peer-run organization, we also recognize the importance of lived experience as an irreplaceable form of expertise and as a basis for building trust and providing effective services. We welcome and strongly encourage people from historically marginalized and economically disadvantaged groups, including people who identify as disabled or neuro-divergent, to apply to work with us. MHASF is committed to providing equal employment opportunities to all qualified applicants for employment and does not discriminate on the basis of race, religion, color, national origin, ancestry, physical or mental disability, medical condition, genetic information, marital status, sex, gender or gender identity, gender expression, age, sexual orientation, military or veteran status, or any other factor not related to ability to successfully fulfill the requirements of the position.",https://www.indeed.com/jobs?q=Software+Engineer&l=San+Francisco%2C+CA&sc=0kf%3Aattr%28EXSNN%7CFCGTU%7CHFDVW%7CQJZM9%7CUTPWG%252COR%29explvl%28ENTRY_LEVEL%29jt%28fulltime%29%3B&radius=50&start=20&pp=gQAeAAAAAAAAAAAAAAAB_iDBCAAnAQEBCAlR5A0J_Ug3OLxtckb1MJGH5gBqkFLAKtA8TJhgkS8UwBkIAAA&vjk=168fee73314b6846
22,e73b375598e786f1,Software Engineer,"San Francisco, CA",ENTRY_LEVEL,EXSNN|FCGTU|HFDVW|QJZM9|UTPWG%2COR,fulltime,"iOS, Software Engineer - job post Apple 11,768 reviews Cupertino, CA Full-time Apple 11,768 reviews Read what people are saying about working here. You must create an Indeed account before continuing to the company website to apply Apply on company site save-icon Job details Job Type Full-time Summary Posted: Mar 27, 2023 Weekly Hours: 40 Role Number: 200463823 The Wallet engineering team is looking for hardworking software developers to join our growing team! Wallet allows you to collect your boarding passes, movie tickets, coupons, and more, all in one place. It’s also the home for Apple Pay, the easiest and most convenient way to pay in stores, apps, and on the web. The Wallet team has been hard at work, creating ground-breaking experiences with Apple Cash and Apple Card, and we’ve revolutionized how our customers ride public transit. Join us and work on an exciting roadmap of features that change the lives of people around the world. Apple Pay Engineering is the place to be if you're passionate about working on incredible technology that is used by millions of people every day. As part of the Apple Pay Engineering team, you'll have the opportunity to explore and contribute to a variety of interesting projects within Apple Pay. Will you help us design the next generation of revolutionary Apple products? As part of Apple's team, you will help build the coolest next generation products in the world. If you're determined, curious, motivated, and you want to make an impact, we'd love to hear from you. Key Qualifications Strong software programming skills User-interface programming experience Excellent communication and collaborative skills Passion for product quality and attention to detail Comfortable with rapid development cycles, tight schedules Excellent understanding of optimization and performance issues across OS software layers Description As an engineer on our team, your responsibilities will range from high-level user interfaces, to writing background processing and networking code, to developing frameworks used by other teams at Apple and third party developers. You'll maintain and improve existing features and implement new and innovative ideas for the future. You will also deliver the best possible application performance including fast launch times and smooth scrolling. We work closely with the other iOS engineering teams, human interface designers, diverse groups across Apple, and our partners at other companies. Our goals are simple but the task is large; build the most amazing products in the world that our customers will love. Apple is an Equal Opportunity Employer that is committed to inclusion and diversity. We also take affirmative action to offer employment and advancement opportunities to all applicants, including minorities, women, protected veterans, and individuals with disabilities. Apple will not discriminate or retaliate against applicants who inquire about, disclose, or discuss their compensation or that of other applicants. Education & Experience BS or MS in Computer Science, related technical field or equivalent experience Additional Requirements iOS programming experience Swift, Objective-C and/or C++ experience Core Animation experience Familiarity with NFC and related technologies Understanding of security, digital signatures, and PKI Performance analysis including Instruments and DTrace Pay & Benefits At Apple, base pay is one part of our total compensation package and is determined within a range. This provides the opportunity to progress as you grow and develop within a role. The base pay range for this role is between $130,000 and $242,000, and your base pay will depend on your skills, qualifications, experience, and location. Apple employees also have the opportunity to become an Apple shareholder through participation in Apple’s discretionary employee stock programs. Apple employees are eligible for discretionary restricted stock unit awards, and can purchase Apple stock at a discount if voluntarily participating in Apple’s Employee Stock Purchase Plan. You’ll also receive benefits including: Comprehensive medical and dental coverage, retirement benefits, a range of discounted products and free services, and for formal education related to advancing your career at Apple, reimbursement for certain educational expenses — including tuition. Additionally, this role might be eligible for discretionary bonuses or commission payments as well as relocation. Learn more about Apple Benefits. Note: Apple benefit, compensation and employee stock programs are subject to eligibility requirements and other terms of the applicable plan or program.",https://www.indeed.com/jobs?q=Software+Engineer&l=San+Francisco%2C+CA&sc=0kf%3Aattr%28EXSNN%7CFCGTU%7CHFDVW%7CQJZM9%7CUTPWG%252COR%29explvl%28ENTRY_LEVEL%29jt%28fulltime%29%3B&radius=50&start=20&pp=gQAeAAAAAAAAAAAAAAAB_iDBCAAnAQEBCAlR5A0J_Ug3OLxtckb1MJGH5gBqkFLAKtA8TJhgkS8UwBkIAAA&vjk=e73b375598e786f1
