,job_id,job_title,location,experience,education,job_type,job_description,job_link
14,45fe56209e8f66d9,Software Engineer,"Chicago, IL",SENIOR_LEVEL,EXSNN|FCGTU|HFDVW|QJZM9|UTPWG%2COR,fulltime,"Research Software Development Engineer/Senior Research Software Development Engineer - job post University of Illinois 416 reviews 601 S Morgan, Chicago, IL 60607 Full-time University of Illinois 416 reviews Read what people are saying about working here. You must create an Indeed account before continuing to the company website to apply Apply on company site save-icon Job details Job Type Full-time Research Software Development Engineer/Senior Research Software Development Engineer Discovery Partners Institute Posting Category: The Discovery Partners Institute provides a platform for people to jumpstart their tech careers or companies in Chicago. Led by the University of Illinois System in partnership with local and global research universities, DPI does three things: train people for high-demand tech jobs, conduct applied R&D, and build businesses to grow Chicago's tech ecosystem. With state investment and a new urban innovation district in development just south of the Chicago Loop, DPI has the resources to attract, develop and leverage the most driven people and companies the region has to offer and keep them here. DPI invites nominations and applications for the position of (Sr.) Research Software Development Engineer. This position offers an extraordinary opportunity for versed engineers to build technology-based products and services. The (Sr.) Research Software Development Engineer will work closely with the system architect, other members of the cross-functional & cross-organizational teams, and external researchers/industry partners to create best-in-class scalable technology-based platforms and services, and solutions. Additional responsibilities included: Provide technology based objective thinking through experience and knowledge in the latest platforms, and software infrastructure (including cloud-based) applications and services to support ongoing and new projects by gathering and analyzing software requirements and investigating optimal solutions. Collaborate with a cross-functional team of stakeholders, software developers, and architects to design, implement, and test the solutions. Connect the dots between project needs, innovation, and good design. Document and conduct testing to evaluate software robustness, identify bugs and defects, and verify requirements gaps. Provides basic system administration support (e.g., keeping applications, operating system, and security settings up to date, ensuring regular data backups, etc.) for LAMP (Linux, Apache, MySQL, PHP/Perl/Python) servers. Write detailed supporting documentation including software requirements specification, system architecture specification, operational requirements specification, and user interface specification. Build user interfaces that are interactive, consistent and fast, that thrive under heavy customization and varying use cases, that encourage exploration, and that earn the trust of our customers through reliable, accessible and thoughtful interactions. Code solutions to problems using a structured approach, keeping in mind long-term maintainability and accessibility. Test coded solutions properly to ensure a quality application. Work with end-users during and after development to ensure needs are met. Provide support and training to other technical teams, empowering them to train their team members on using web-based tools. Collaborate with Digital Experience and Analysis team members and interfaces with Information Services and third-party product support to ensure that servers and applications run smoothly and efficiently. Prepare activity reports to monitor progress and track the status of the projects Assume additional appropriate and related duties to further the mission of the institute as needed. Qualifications: Required: Software Engineer Level: Bachelor's degree in computer science or engineering with 1-3 years of industry experience or an advanced degree with at least one year of industry experience. Senior Level: Bachelor's degree in computer science or engineering with more than 5 years of industry experience. Knowledge and Experience: Software Engineer Level Qualifications Solid Computer Science foundation in data structures and algorithms, object-oriented programming (OOP), and modern software engineering practices Demonstrated proficiency with Python, C++, Java, Matlab, HTML/CSS, jQuery, or other programming languages Experience working with REST APIs Demonstrated experience debugging and testing software systems Strong verbal and written communication skills Excellent problem-solving and multi-tasking skills Preferred Master's Degree in computer science or engineering Three plus years of industry experience Experience working with open-source applications and frameworks Experience with agile software development Experience with version control systems (GIT, P4, ClearCase, etc.), bug tracking systems (Jira, Bugzilla, GitHub, etc.) Experience with cloud computing or other distributed programming environments Experience with database programming Experience working with machine learning algorithms to solve classification and clustering problems, perform information retrieval from unstructured and semi-structured data, and build supervised and semi-supervised learning solutions Experience with big data and analytics Senior Level Qualifications Demonstrated experience debugging and testing software systems Experience working with open-source applications and frameworks Experience with agile software development Experience with version control systems (GIT, P4, ClearCase, etc.), bug tracking systems (Jira, Bugzilla, GitHub, etc.) Experience with cloud computing or other distributed programming environments Experience with database programming Experience working with REST APIs Experience working with machine learning algorithms to solve classification and clustering problems, perform information retrieval from unstructured and semi-structured data, and build supervised and semi-supervised learning solutions Experience with big data and analytics Preferred Master's degree in computer science or engineering with four-plus years of industry experience or Ph.D. in CS, Engineering, Physics, or Math with 0-2 year experience Experience mentoring junior engineers/students. Experience with project management Track record of designing, building, and deploying software solutions and supporting them. Working knowledge of Distributed computing, Distributed Decisions making, and data science. Appointment Information This is a full-time, 12-month Academic Professional position. Application Procedures & Deadline Information For full consideration, candidates must apply and submit a letter of application, resume, and names/addresses/phone numbers of three professional references by 6pm 5/8/2023 or visit at http://hr.uillinois.edu/employment. System Human Resource Services (217) 333-2600 erhr@uillinois.edu The University of Illinois conducts criminal background checks on all job candidates upon acceptance of a contingent offer. Convictions are not a bar to employment. The University of Illinois System requires candidates selected for hire to disclose any documented finding of sexual misconduct or sexual harassment and to authorize inquiries to current and former employers regarding findings of sexual misconduct or sexual harassment. For more information, visit Policy on Consideration of Sexual Misconduct in Prior Employment. Applicants with disabilities are encouraged to apply and may request a reasonable accommodation under the Americans with Disabilities Act (2008) to complete the application and/or interview process. Requests may be submitted through the reasonable accommodations portal, or by contacting the Accessibility & Accommodations Division of the Office for Access and Equity at 217-333-0885, or by emailing accessibility@illinois.edu. As a qualifying federal contractor, the University of Illinois System uses E-Verify to verify employment eligibility. University of Illinois faculty, staff and students are required to be fully vaccinated against COVID-19. If you are not able to receive the vaccine for medical or religious reasons, you may seek approval for an exception in accordance with applicable University processes. Requisition ID: 9000209 Job Category: Academic Professional Extended Search",https://www.indeed.com/jobs?q=Software+Engineer&l=Chicago%2C+IL&sc=0kf%3Aattr%28EXSNN%7CFCGTU%7CHFDVW%7CQJZM9%7CUTPWG%252COR%29explvl%28SENIOR_LEVEL%29jt%28fulltime%29%3B&radius=50&start=10&pp=gQAPAAAAAAAAAAAAAAAB_h8FDAAdAQAIy1KBtXU64PbNXg8KeeG1s3wY_awj0Ybhm-IAAA&vjk=45fe56209e8f66d9
15,ac294f4f3c8fc20a,Software Engineer,"Chicago, IL",SENIOR_LEVEL,EXSNN|FCGTU|HFDVW|QJZM9|UTPWG%2COR,fulltime,"Sr. Systems Software Engineer - job post Zurn Elkay Water Solutions 3 reviews Downers Grove, IL $88,545 - $106,635 a year -  Full-time Zurn Elkay Water Solutions 3 reviews Read what people are saying about working here. You must create an Indeed account before continuing to the company website to apply Apply on company site save-icon Job details Salary $88,545 - $106,635 a year Job Type Full-time The Company Zurn Elkay Water Solutions Corporation is a thriving, values-driven company focused on doing the right things. We’re a fast growing, publicly traded company (NYSE: ZWS), with an enduring reputation for integrity, giving back, and providing an engaging, inclusive environment where careers flourish and grow. Named by Newsweek as One of America’s Most Responsible Companies and an Energage USA Top Workplace, at Zurn Elkay Water Solutions Corporation, we never forget that our people are at the center of what makes us successful. They are the driving force behind our superior quality, product ingenuity, and exceptional customer experience. Our commitment to our people and their professional development is a recipe for success that has fueled our growth for over 100 years, as one of today’s leading international suppliers of plumbing and water delivery solutions. Headquartered in Milwaukee, WI, Zurn Elkay Water Solutions Corporation employs over 2800 employees worldwide, working from 24 locations across the U.S., China, Canada, Dubai, and Mexico, with sales offices available around the globe. We hope you’ll visit our website and learn more about Zurn Elkay at zurnelkay.com. If you’re ready to join a company where what you do makes a difference and you have pride in the work you are doing, talk to us about joining the Zurn Elkay Water Solutions Corporation family! SR. SYSTEMS SOFTWARE ENGINEER OPPORTUNITY IN DOWNERS GROVE! This role will report to the Lead Engineer, and will manage the technical/software relationship with software development vendors, and review deliverables for quality and security. You will have close collaboration with key business and technical functions for development and maintenance of the Elkay product portfolio. You will be responsible for the design, development and installation of the application software for water delivery product prototypes as well as: Developing documentation, flowcharts, layouts, diagrams and charts to clarify requirements to Elkay Engineering, Marketing and Third Party Software Development Vendors. Select and Manage outside design partners for large software development projects. Ensure that software quality and reliability adhere to Elkay standards. Work closely with Elkay IT personnel on projects related to outside cloud and data services for a high-quality end to end customer experience. Develop and execute software testing. Develop and update embedded, application and driver-level software to help develop concepts and prototypes for a wide variety of products in the Elkay water delivery portfolio. Learn and maintain software in current products. Serve as the technical lead when problem solving software issues. Responsible for developing and maintaining an Elkay product software management process and system. Qualifications: Bachelor’s degree in Software Engineering or Electrical Engineering with experience in Software Engineering 7+ years experience in developing product based embedded software, applications and interfaces to Cloud Platforms as a Service Knowledgeable in C, C++, Java, Linux, Android and Python High level knowledge of electrical/electronic design and interfacing with numerous hardware components, buses and protocols preferred Experience with IOT embedded systems using protocols such as UDP, COAP, and other wired and wireless technologies preferred Experience with communications code over Ethernet, USB, Firewire, I2C or other interfaces preferred Experience with standard operating systems and shell utilities preferred Strong interpersonal and collaboration skills required Strong verbal and visual communication skills required Total Rewards and Benefits Competitive Salary Medical, Dental, Vision, STD, LTD, AD&D, and Life Insurance Matching 401(k) Contribution Health Savings Account Educational Reimbursement Matching Gift Program Equal Opportunity Employer – Minority/Female/Disability/Veteran Job Type: Full-time Pay: $88,545.25 - $106,635.14 per year Benefits: Dental insurance Health insurance Paid time off Vision insurance Schedule: 8 hour shift Ability to commute/relocate: Downers Grove, IL: Reliably commute or planning to relocate before starting work (Required) Experience: REST: 1 year (Preferred) Java: 1 year (Preferred) Work Location: In person Health insurance",https://www.indeed.com/jobs?q=Software+Engineer&l=Chicago%2C+IL&sc=0kf%3Aattr%28EXSNN%7CFCGTU%7CHFDVW%7CQJZM9%7CUTPWG%252COR%29explvl%28SENIOR_LEVEL%29jt%28fulltime%29%3B&radius=50&start=20&pp=gQAeAAAAAAAAAAAAAAAB_h8FDAAnAQEBEAkoKfKlAdONotxJ2YSLOxuKEsssal0ADntWynjsUGf2W6sEAAA&vjk=ac294f4f3c8fc20a&advn=2610628081441340
16,7eafe591169dcca0,Software Engineer,"Chicago, IL",SENIOR_LEVEL,EXSNN|FCGTU|HFDVW|QJZM9|UTPWG%2COR,fulltime,"Senior Developer (.NET) - job post Zurn Elkay Water Solutions 3 reviews Downers Grove, IL $93,231 - $112,278 a year -  Full-time Zurn Elkay Water Solutions 3 reviews Read what people are saying about working here. You must create an Indeed account before continuing to the company website to apply Apply on company site save-icon Job details Salary $93,231 - $112,278 a year Job Type Full-time The Company Zurn Elkay Water Solutions Corporation is a thriving, values-driven company focused on doing the right things. We’re a fast growing, publicly traded company (NYSE: ZWS), with an enduring reputation for integrity, giving back, and providing an engaging, inclusive environment where careers flourish and grow. Named by Newsweek as One of America’s Most Responsible Companies and an Energage USA Top Workplace, at Zurn Elkay Water Solutions Corporation, we never forget that our people are at the center of what makes us successful. They are the driving force behind our superior quality, product ingenuity, and exceptional customer experience. Our commitment to our people and their professional development is a recipe for success that has fueled our growth for over 100 years, as one of today’s leading international suppliers of plumbing and water delivery solutions. Headquartered in Milwaukee, WI, Zurn Elkay Water Solutions Corporation employs over 2800 employees worldwide, working from 24 locations across the U.S., China, Canada, Dubai, and Mexico, with sales offices available around the globe. We hope you’ll visit our website and learn more about Zurn Elkay at zurnelkay.com. If you’re ready to join a company where what you do makes a difference and you have pride in the work you are doing, talk to us about joining the Zurn Elkay Water Solutions Corporation family! Job Summary We are seeking a Senior .NET developer responsible for building cloud native .NET applications. Your primary responsibility will be to design and develop all layers of our applications, and to coordinate with the rest of the team working on different layers of the infrastructure. A commitment to collaborative problem solving, sophisticated design, and quality product delivery is essential. Responsibilities Design, Develop, and Maintain websites and custom applications Work with other developers and a variety of end users to ensure technical compatibility and user satisfaction. Follow web standards, governance, and provide input and oversight regarding applications development and change management methodologies. Align site design with industry standards, social networking capabilities, device and browser support Develop positive customer relationships which make it possible to influence positive change and contribute to collaboration in defining and implementing IT solutions. Analyze reasons for application issues and revise programs and/or procedures as necessary Assist in troubleshooting software application issues Modernize and update legacy applications Qualifications Bachelor’s Degree in Computer Science, Computer Engineering or a closely related field 5+ years .NET Core C# experience with web application development 3+ years of experience with backend/database and API development Excellent programming skills in Asp.net core, .NET, C# language / Razor is a plus Strong Web technology skill set, such as HTML, CSS, Java Script, Bootstrap and Angular Extensive hands-on experience with the Azure cloud platform and related devOps process and automation / AWS experience is a plus Good understanding of Object-Oriented Programming, Architectural and Design patterns Experience with eCommerce platforms and related development is a plus Total Rewards and Benefits Competitive Salary Medical, Dental, Vision, STD, LTD, AD&D, and Life Insurance Matching 401(k) Contribution Health Savings Account Educational Reimbursement Matching Gift Program Equal Opportunity Employer – Minority/Female/Disability/Veteran Job Type: Full-time Pay: $93,230.90 - $112,278.07 per year Benefits: Dental insurance Health insurance Paid time off Vision insurance Schedule: 8 hour shift Ability to commute/relocate: Downers Grove, IL: Reliably commute or planning to relocate before starting work (Required) Experience: AWS: 1 year (Preferred) ASP.NET: 1 year (Preferred) APIs: 1 year (Preferred) Work Location: In person Health insurance",https://www.indeed.com/jobs?q=Software+Engineer&l=Chicago%2C+IL&sc=0kf%3Aattr%28EXSNN%7CFCGTU%7CHFDVW%7CQJZM9%7CUTPWG%252COR%29explvl%28SENIOR_LEVEL%29jt%28fulltime%29%3B&radius=50&start=20&pp=gQAeAAAAAAAAAAAAAAAB_h8FDAAnAQEBEAkoKfKlAdONotxJ2YSLOxuKEsssal0ADntWynjsUGf2W6sEAAA&vjk=7eafe591169dcca0&advn=2610628081441340
17,c79c1b8bedbddd92,Software Engineer,"Chicago, IL",SENIOR_LEVEL,EXSNN|FCGTU|HFDVW|QJZM9|UTPWG%2COR,fulltime,"Director, Software Engineering - job post AMETEK 518 reviews Mount Prospect, IL 60056 • Hybrid remote $170,000 - $200,000 a year -  Full-time AMETEK 518 reviews Read what people are saying about working here. Apply now Apply now save-icon Job details Salary $170,000 - $200,000 a year Job Type Full-time Your Impact: Rauland is looking for a talented and passionate software leader to make an impact in the medical space. We are seeking an experienced developer and software architect to be a hands-on leader of our software team and execute on the transformation of the business software solutions toward an enterprise-class cloud platform that supports AI and analytics. Rauland is a leader in the critical clinical communications market with a majority market share in the acute hospital healthcare space. Its solutions encompass Nurse Call capability facilitating high quality of care between patient and caregivers as well as coordination and collaboration between caregivers resulting in better patient outcomes. We are looking for an individual to lead the software engineering team to deliver significantly increased value in our offerings by establishing scalable and extensible solutions to the marketplace. The systems must scale from single to multi facility Enterprise class hospitals. The platform design must take the business from its current state and extend into new spaces including additional capabilities in business intelligence and analytics. The ideal candidate will be able to leverage their experiences to define the technology roadmap needed to achieve our vision and integrate it with a commercially acceptable release roadmap that brings our large installed base of clients with us in our transformation of the market space. This individual must define and hire the right skillsets to execute this strategy. The position reports into the Division VP of Engineering and requires close collaboration with all executive leadership, product management, and other functions within the broader engineering organization. Accountabilities: Drive the creation of an integrated product and technology road map in collaboration with the Product Management team and with other R&D leaders. Design, develop, and implement the integrated roadmap across a multi-disciplined team of software engineers. Build and lead a high performing team with the skills needed to support the vision of the business. Drive a performance and innovation-oriented culture. Fuel passion within the team for designing and building innovative products. Institutionalize best practices to assure the quality development of software deliverables to the verification and validation team and ultimately to the client base. In close coordination with the Quality and Regulatory lead for the business, assure that all software development maintains compliance to design controls and risk management commensurate with an FDA Class 2 medical device. Requirements: Bachelor’s Degree in Computer Science or equivalent. A Master of Science is preferred Minimum of 15+ years of software development and architecture experience 10+ years experience developing within and leading Enterprise-class software solution teams Experience managing the full product engineering lifecycle including specification, development, test and validation using Agile delivery methodologies Strong enterprise-class software architectural experience with a solid understanding of considerations of scale, support, and implementation Working knowledge on defining and creating private and secure solutions for the healthcare market space Proven ability to attract, motivate, and retain strong talented team members Experience delivering in Hybrid Cloud, IaaS and PaaS environments, including architecture for cloud and migration of legacy applications to the cloud Good knowledge of FDA Design Controls and Risk Management compliant processes and tools Knowledge of or experience with micro-services and Actor based architectures Experience with REST API, ASP.NET Core, SignalR, Angular, Angular, Docker, and Azure all desired Experience implementing Agile development methodologies across a team Why Us? Rauland, a division of AMETEK, is a business unit in the Measurement, Communications and Technologies division of AMETEK. We are a leader in integrated communications technology, designing and manufacturing Nurse Call Systems for the medical industry and school critical communication systems for the education K-12 market. Website: www.rauland.com Job Type: Full-time Pay: $170,000.00 - $200,000.00 per year Benefits: 401(k) 401(k) matching Dental insurance Flexible schedule Health insurance Health savings account Paid time off Tuition reimbursement Vision insurance Schedule: 8 hour shift Day shift Monday to Friday No nights No weekends Supplemental pay types: Bonus pay Work Location: Hybrid remote in Mount Prospect, IL 60056 Health insurance If you require alternative methods of application or screening, you must approach the employer directly to request this as Indeed is not responsible for the employer's application process.",https://www.indeed.com/jobs?q=Software+Engineer&l=Chicago%2C+IL&sc=0kf%3Aattr%28EXSNN%7CFCGTU%7CHFDVW%7CQJZM9%7CUTPWG%252COR%29explvl%28SENIOR_LEVEL%29jt%28fulltime%29%3B&radius=50&start=20&pp=gQAeAAAAAAAAAAAAAAAB_h8FDAAnAQEBEAkoKfKlAdONotxJ2YSLOxuKEsssal0ADntWynjsUGf2W6sEAAA&vjk=c79c1b8bedbddd92
