,job_id,job_title,location,experience,education,job_type,job_description,job_link
9,90eeddd83a9c1f90,Software Engineer,"Chicago, IL",SENIOR_LEVEL,EXSNN|FCGTU|HFDVW|QJZM9|UTPWG%2COR,fulltime,"Senior Software Engineer .NET/Python - job post Certec Consulting Chicago, IL Full-time, Part-time, Internship, Seasonal Apply now Apply now save-icon Job details Job Type Full-time Part-time Internship Seasonal Senior Software Engineer REMOTE Must have: SQL Server, Python, Python math libraries (NumPy etc), C#, .NET, JavaScript, ASP.NET MVC Razor, BANKING EXPERIENCE Nice to have: VUE, Telerik Controls, Automic UC4 Automation, Airflow automation, CI/CD automation, TeamCity, Octopus Need a Senior SW Engineer for a long term, multi-year (18-24+ months) consulting engagement New Strategic project to Rewrite the Fixed Income Portfolio Optimization & Modeling applications used by the Portfolio Managers to generate a basket of FI investments for clients Project is underway and in the Architecture Design and Tech Stack selection stage. Consultant will interact with the Product Owner, and several Technical Managers, as well as the Fixed Income Portfolio Managers on occasion. Convert business requirements in to code design, and develop and implement the code. Ability to Refactor code and SQL databases take existing Portfolio Models and convert them to new code based on current business requirements MUST HAVE STRONG MATHEMATICAL AND ANALYTICAL SKILLS to be able to understand the models and rewrite new code and models for the Portfolio Modeling and Optimizations. A Fixed Income Quant Developer background is not required, but is a PLUS Experience in and understanding of Fixed Income assets is a PLUS. Equities only should be OK with ability to pick up FI assets Experience in Investments Portfolio Optimization and Modeling is a Big Plus, in either FI or Equities Strong communications and collaboration skills. Very strong Problem Solver. Be a Self Starter, and propose new ideas and ways of doing things For Contract only, Work location can be anywhere in the US, but must work in CST time zone. PLEASE USE EASY APPLY BUTTON TO SUBMIT Please download and complete this Matrix prior to submission. PM 1049 Thanks, Jay Kernes Certec Consulting, inc We are certified as a Women's Business Enterprise (WBE) If you require alternative methods of application or screening, you must approach the employer directly to request this as Indeed is not responsible for the employer's application process.",https://www.indeed.com/jobs?q=Software+Engineer&l=Chicago%2C+IL&sc=0kf%3Aattr%28EXSNN%7CFCGTU%7CHFDVW%7CQJZM9%7CUTPWG%252COR%29explvl%28SENIOR_LEVEL%29jt%28fulltime%29%3B&radius=50&start=10&pp=gQAPAAAAAAAAAAAAAAAB_h8FDAAdAQAIy1KBtXU64PbNXg8KeeG1s3wY_awj0Ybhm-IAAA&vjk=90eeddd83a9c1f90
10,29485408b4e0da7c,Software Engineer,"Chicago, IL",SENIOR_LEVEL,EXSNN|FCGTU|HFDVW|QJZM9|UTPWG%2COR,fulltime,"Senior Software Engineer - job post Bectran Inc 1475 E Woodfield Rd, Schaumburg, IL 60173 Full-time Apply now Apply now save-icon Job details Job Type Full-time Description: Since its inception in 2010, Bectran has pioneered affordable credit management and accounts receivable automation solutions for all sizes of organizations. Bectran’s SaaS solutions — credit, collections and accounts receivable — provide seamless user experiences across various industries and empower users with robust credit evaluation services, providing more oversight, control and efficiency to companies of all sizes. Our dedication to improving the efficiency of the order-to-cash cycle has helped companies cut down the time to process and approve credit by over 90% while significantly lowering the risk of default. We are committed to helping businesses make the transition to powerful SaaS technology solutions that save you time and money. And we’re looking for a driven, experienced software developer passionate about hands-on work to join our on-site, Schaumburg-based software engineering team as a full time Senior Software Engineer. Our software engineering team is responsible for having a breadth of knowledge of contemporary SaaS-based architecture and practical development experience using Java/J2EE and other services languages. We are searching for a practical and results-oriented developer to join the Bectran team as Senior Software Engineer — a role dedicated to producing and implementing functional software solutions to drive application development and lead operational and technical projects. In this role, you should be able to work independently with little supervision. You should have excellent organization and problem-solving skills. Your goal will be to develop high-quality software that is aligned with our user needs and goals. Key Responsibilities: Contribute directly to full stack development efforts , UI updates and testing methodology while actively designing and creating Java-based computer systems and applications to solve complex client problems. Develops software solutions by studying information needs, conferring with users, studying systems flow, data usage and work processes; investigating problem areas; and following the software development lifecycle. Determines operational feasibility by evaluating analysis, problem definition, requirements, solution development and proposed solutions. Documents and demonstrates solutions by developing documentation , flowcharts, layouts, diagrams, charts, code comments and clear code. Prepares and installs solutions by determining and designing system specifications, standards, and programming. Improves operations by conducting systems analysis and recommending changes in policies and procedures. Updates job knowledge by studying state-of-the-art development tools, programming techniques, and computing equipment, and by participating in educational opportunities, reading professional publications, maintaining personal networks and participating in professional organizations. Protects operations by keeping information confidential. Provides information by collecting, analyzing and summarizing development and service issues. Accomplishes engineering and organization mission by completing related results as needed. Supports and develops software engineers by providing advice, mentoring and educational opportunities. Requirements: Desired Qualifications/Skills: JAVA experience Communication skills Leadership Teamwork Analyzing information Software design Software documentation Software testing General programming skills Software development fundamentals Software development process Software requirements Software architecture Desired Education and Experience: B.S. in computer science, information technology, computer engineering or related discipline M.S. preferred Four years of job related experience Four years of experience as software engineer Experience with computer programming If you require alternative methods of application or screening, you must approach the employer directly to request this as Indeed is not responsible for the employer's application process.",https://www.indeed.com/jobs?q=Software+Engineer&l=Chicago%2C+IL&sc=0kf%3Aattr%28EXSNN%7CFCGTU%7CHFDVW%7CQJZM9%7CUTPWG%252COR%29explvl%28SENIOR_LEVEL%29jt%28fulltime%29%3B&radius=50&start=10&pp=gQAPAAAAAAAAAAAAAAAB_h8FDAAdAQAIy1KBtXU64PbNXg8KeeG1s3wY_awj0Ybhm-IAAA&vjk=29485408b4e0da7c
11,d468218e69c08d28,Software Engineer,"Chicago, IL",SENIOR_LEVEL,EXSNN|FCGTU|HFDVW|QJZM9|UTPWG%2COR,fulltime,"EBAM & Additive Mfg Machine Software Engineer - job post Sciaky Inc. 3 reviews 4915 W 67th St, Chicago, IL 60638 Full-time Sciaky Inc. 3 reviews Read what people are saying about working here. Apply now Apply now save-icon Job details Job Type Full-time About us: Sciaky Inc. Established in 1939, Sciaky, Inc. is the most trusted provider of advanced welding systems and job shop welding services in the fabrication market. Our wide selection of electron beam welders, electron beam additive manufacturing (EBAM®) solutions and advanced arc welders makes us the most versatile welding solutions supplier on the planet. Sciaky is at the forefront of electron beam welding technology and pioneers of metal additive manufacturing (AM) processes, also referred to as 3D printing. We are dedicated to world-class engineering, as well as extensive research and development. When customers talk to Sciaky about their 3D printing or welding requirements, they’re dealing with the best in the business. Our welding systems and EBAM industrial 3D printing machines are distributed internationally and found in manufacturing plants and advanced research centers around the world. Located in Chicago, Illinois, Sciaky's world headquarters occupies more than 140,000 square feet of clean and modern facilities. All welding services, design, manufacturing, hardware and software development, testing, as well as research and development is conducted here. Job Location(s) Chicago, IL (near Midway Airport) Role – Software Engineer (full-time) Sciaky is seeking a Software Engineer who will assist in planning and coordinating all activities related to software requirements of our EBAM and Additive Manufacturing systems. You’ll be doing a lot of this: Maintaining, supporting, and upgrading existing systems and applications Communicating and collaborating to solve problems Applying knowledge of best practices Design, develop and deploy software Presenting products and ideas Represent Sciaky in front of customers and users So, you should have this: Bachelor’s degree in Computer Science or related engineering degree Minimum of 7 years of prior direct experience in software development, programming design and systems management Experience and understanding with C#, C++, C, Labview, Visual Studio Experience with hardware-software integration, good understanding of various communications protocols such as TCP/IP, UDP, RS232 Experience with real-time system development Experience preferred with TwinCAT real time development PLC, HMI industrial technology programming Strong knowledge of version control (Git or similar) Strong ability to grasp and apply new information quickly, high attention to detail, excellent problem-solving skills, ability to multi-task and enthusiastic attitude Extensive experience with Microsoft Office applications Great communication and documentation skills Ability to to work well in a team setting and make decisions in high-stress situations Travel to the client for installation, test, debug, start-up, commissioning and training NvIjHdSxCf If you require alternative methods of application or screening, you must approach the employer directly to request this as Indeed is not responsible for the employer's application process.",https://www.indeed.com/jobs?q=Software+Engineer&l=Chicago%2C+IL&sc=0kf%3Aattr%28EXSNN%7CFCGTU%7CHFDVW%7CQJZM9%7CUTPWG%252COR%29explvl%28SENIOR_LEVEL%29jt%28fulltime%29%3B&radius=50&start=10&pp=gQAPAAAAAAAAAAAAAAAB_h8FDAAdAQAIy1KBtXU64PbNXg8KeeG1s3wY_awj0Ybhm-IAAA&vjk=d468218e69c08d28
12,371c546552b03f23,Software Engineer,"Chicago, IL",SENIOR_LEVEL,EXSNN|FCGTU|HFDVW|QJZM9|UTPWG%2COR,fulltime,"Senior Software Test Engineer - job post S & C Electric Company 222 reviews Chicago, IL Full-time S & C Electric Company 222 reviews Read what people are saying about working here. You must create an Indeed account before continuing to the company website to apply Apply on company site save-icon Job details Job Type Full-time Job Summary: Our products are intelligent embedded software devices including microprocessor-based capacitor, switch, and fault interrupting controls; as well as patented peer-to-peer feeder restoration systems and large-scale energy storage management systems. We are seeking a Senior Software Test Engineer to join the Product Experience Validation team at S&C Electric Company. The main responsibility of the team member is to ensure S&C product experience exceeds customers’ expectation by identifying and demonstrating product experience issues and facilitating their resolution. Product experience validation is similar to software QA but focuses on high-level and generic customers’ workflow and metric. Besides working on product experience tasks, the contractor also has responsibilities in general software QA testing and automation support, so experience in those area are also required. In this position, you will report to the Product Experience Validation manager located in Chicago, IL. This position is in Chicago, IL with remote eligibility. The work associated with this position includes, but is not limited to, the following: Create and execute product experience and functional test cases Automate test cases in existing S&C framework Knowledge of python scripting Knowledge of Electrical Power concepts is big plus. To select this job as one of interest to you, at a minimum, you must have the following: BS degree in Electrical/Computer Engineering, Computer Science, or related disciplines; with hardware/software knowledge 1+ years with product experience testing 5+ years in software testing 2+ Python experience 2+ years of experience in managing projects, and working in a large, matrixed organization Excellent written and verbal communication skills to deliver user research finding with cross-functional partners Up to 5% potential travel per year",https://www.indeed.com/jobs?q=Software+Engineer&l=Chicago%2C+IL&sc=0kf%3Aattr%28EXSNN%7CFCGTU%7CHFDVW%7CQJZM9%7CUTPWG%252COR%29explvl%28SENIOR_LEVEL%29jt%28fulltime%29%3B&radius=50&start=10&pp=gQAPAAAAAAAAAAAAAAAB_h8FDAAdAQAIy1KBtXU64PbNXg8KeeG1s3wY_awj0Ybhm-IAAA&vjk=371c546552b03f23
13,3d40ba6f119509a5,Software Engineer,"Chicago, IL",SENIOR_LEVEL,EXSNN|FCGTU|HFDVW|QJZM9|UTPWG%2COR,fulltime,"Senior Manager, Software Engineering, Back End (Remote-Eligible) - job post Capital One 10,039 reviews Chicago, IL 60695 • Remote Full-time, Part-time Capital One 10,039 reviews Read what people are saying about working here. You must create an Indeed account before continuing to the company website to apply Apply on company site save-icon Job details Encouraged to Apply Fair chance Job Type Full-time Part-time West Creek 1 (12071), United States of America, Richmond, Virginia Senior Manager, Software Engineering, Back End (Remote-Eligible) Do you love building and pioneering in the technology space? Do you enjoy solving complex business problems in a fast-paced, collaborative, inclusive, and iterative delivery environment? At Capital One, you'll be part of a big group of makers, breakers, doers and disruptors, who love to solve real problems and meet real customer needs. We are seeking Back End Software Engineers who are passionate about marrying data with emerging technologies. As a Capital One Software Engineer, you’ll have the opportunity to be on the forefront of driving a major transformation within Capital One. Team Info: You will be joining the Authorizations Fraud Control team in charge of validating Credit and Debit card authorizations from a fraud standpoint. The environment, running on Kubernetes, operates at a high Transactions Per Second, extremely low latencies and high availability. In addition, the team manages a simulator that allows fraud analysts to refine rules and models using past production transaction data . We are looking for a people leader with a strong technology background to lead the team to upgrade the simulator and replace the Kubernetes engine with a microservice based solution. What You’ll Do: Lead a portfolio of diverse technology projects and a team of developers with deep experience in distributed microservices, and full stack systems to create solutions that help meet regulatory needs for the company Share your passion for staying on top of tech trends, experimenting with and learning new technologies, participating in internal & external technology communities, mentoring other members of the engineering community, and from time to time, be asked to code or evaluate code Collaborate with digital product managers, and deliver robust cloud-based solutions that drive powerful experiences to help millions of Americans achieve financial empowerment Utilize programming languages like Java, Python, SQL, and Scala, NoSQL databases, CICD tools including Jenkins, Container Orchestration services including Docker and Kubernetes, and a variety of AWS tools and services Capital One is open to hiring a Remote Employee for this opportunity. Basic Qualifications: Bachelor’s Degree At least 8 years of professional software engineering experience (Internship experience does not apply) At least 1 year experience with cloud computing (AWS, Microsoft Azure, Google Cloud) At least 4 years of people management experience Preferred Qualifications: Master’s Degree 9+ years of experience in at least one of the following: Java, Scala, or Python 3+ years of experience with AWS 2+ years experience in DevOps deploying and supporting CICD including Jenkins 4+ years of experience in open source frameworks 7+ years of people management experience 2+ years of experience in Agile practices Capital One will consider sponsoring a new qualified applicant for employment authorization for this position. The minimum and maximum full-time annual salaries for this role are listed below, by location. Please note that this salary information is solely for candidates hired to perform work within one of these locations, and refers to the amount Capital One is willing to pay at the time of this posting. Salaries for part-time roles will be prorated based upon the agreed upon number of hours to be regularly worked. Location is New York City: $230,100 - $262,700 for Sr. Mgr, Software Engineering Location is San Francisco, California: $243,800 - $278,200 for Sr. Mgr, Software Engineering Remote roles in other areas of New York & California, and across Colorado & Washington: $195,000 - $222,600 for Sr. Mgr, Software Engineering Candidates hired to work in other locations will be subject to the pay range associated with that location, and the actual annualized salary amount offered to any candidate at the time of hire will be reflected solely in the candidate’s offer letter. This role is also eligible to earn performance based incentive compensation, which may include cash bonus(es) and/or long term incentives (LTI). Incentives could be discretionary or non discretionary depending on the plan. Capital One offers a comprehensive, competitive, and inclusive set of health, financial and other benefits that support your total well-being. Learn more at the Capital One Careers website. Eligibility varies based on full or part-time status, exempt or non-exempt status, and management level. No agencies please. Capital One is an Equal Opportunity Employer committed to diversity and inclusion in the workplace. All qualified applicants will receive consideration for employment without regard to sex, race, color, age, national origin, religion, physical and mental disability, genetic information, marital status, sexual orientation, gender identity/assignment, citizenship, pregnancy or maternity, protected veteran status, or any other status prohibited by applicable national, federal, state or local law. Capital One promotes a drug-free workplace. Capital One will consider for employment qualified applicants with a criminal history in a manner consistent with the requirements of applicable laws regarding criminal background inquiries, including, to the extent applicable, Article 23-A of the New York Correction Law; San Francisco, California Police Code Article 49, Sections 4901-4920; New York City’s Fair Chance Act; Philadelphia’s Fair Criminal Records Screening Act; and other applicable federal, state, and local laws and regulations regarding criminal background inquiries. If you have visited our website in search of information on employment opportunities or to apply for a position, and you require an accommodation, please contact Capital One Recruiting at 1-800-304-9102 or via email at RecruitingAccommodation@capitalone.com. All information you provide will be kept confidential and will be used only to the extent required to provide needed reasonable accommodations. For technical support or questions about Capital One's recruiting process, please send an email to Careers@capitalone.com Capital One does not provide, endorse nor guarantee and is not liable for third-party products, services, educational tools or other information available through this site. Capital One Financial is made up of several different entities. Please note that any position posted in Canada is for Capital One Canada, any position posted in the United Kingdom is for Capital One Europe and any position posted in the Philippines is for Capital One Philippines Service Corp. (COPSSC).",https://www.indeed.com/jobs?q=Software+Engineer&l=Chicago%2C+IL&sc=0kf%3Aattr%28EXSNN%7CFCGTU%7CHFDVW%7CQJZM9%7CUTPWG%252COR%29explvl%28SENIOR_LEVEL%29jt%28fulltime%29%3B&radius=50&start=10&pp=gQAPAAAAAAAAAAAAAAAB_h8FDAAdAQAIy1KBtXU64PbNXg8KeeG1s3wY_awj0Ybhm-IAAA&vjk=3d40ba6f119509a5&advn=4418968771450209
