,job_id,job_title,location,experience,education,job_type,job_description,job_link
0,af0cbfe9eba90ec7,Software Engineer,"Los Angeles, CA",SENIOR_LEVEL,BACHELORS_DEGREE,fulltime,"Sr. CyberArk Engineer – Woodland Hills, California - job post Universal Music Group 362 reviews Woodland Hills, CA 91367 Full-time Universal Music Group 362 reviews Read what people are saying about working here. You must create an Indeed account before continuing to the company website to apply Apply on company site save-icon Job details Job Type Full-time We are UMG, the Universal Music Group. We are the world’s leading music company. In everything we do, we are committed to artistry, innovation and entrepreneurship. We own and operate a broad array of businesses engaged in recorded music, music publishing, merchandising, and audiovisual content in more than 60 countries. We identify and develop recording artists and songwriters, and we produce, distribute and promote the most critically acclaimed and commercially successful music to delight and entertain fans around the world. How we LEAD: We are currently seeking a privilege access management specialist with deep level expertise in CyberArk, and enterprise experience with Active Directory and Cloud PAM Solutions. As a key member of the UMG Technical team, the Sr CyberArk Engineer is responsible to ensure our CyberArk environment functions at peak technical efficiency across UMG’s diverse global environment. You will be a team player working to expand and mature the integration of our CyberArk solution with our enterprise applications, dev-ops, implementation, day-to-day administration, and operations teams. As a senior member of the team, you will be comfortable in a global fast-paced environment, adjusting to changing priorities and schedules, be accountable to successfully balance support and project work, and mentor other team members as required. In addition to having strong technical skills, you must be comfortable in effectively communicating with business end users, technical IT teams, business partners, network providers, and business process outsourced vendors, all while being sensitive to a wide diversity of cultural and technical backgrounds in a global business environment. How you'll CREATE: Using your expertise in CyberArk and background in identity and privilege access management, evaluate/update and make recommendation for UMG’s CyberArk installation. Review, update, install, and train others on the features and best practices of CyberArk, creating a secure, sustainable, and highly automated environment that meets UMG’s requirements across all on-prem and cloud-based footprints. Working with the team, identify the tools and techniques to translate UMG needs and future goals into a plan that will enable secure and effective solutions. Apply expertise in the installation and configuration of the CyberArk platform, including conducting routine solution maintenance, monitoring the health of the platform, and conducting daily proactive monitoring of the CyberArk production environment. Automate processes across the CyberArk products Monitor CyberArk and support any break/fix, upgrades, patches, and performance or integration related issues. Create automated periodic reports as required, and address any discrepancies found. Support critical CyberArk functions, including maintenance, patch identification and publication, and upgrades of CyberArk and related modules. Maintain responsibility for privilege user incident management support, user acceptance testing of privilege accounts, load testing, performance testing, and validation testing of the CyberArk solution. Maintain & support CyberArk on a daily basis, troubleshooting Vault, CPM, PTA, PSM/PSMP, PVWA, LCD/EPM issues as required. Resolution of trouble tickets including password rotations, password malfunctions, account creations, account changes, scheduling. Installation of CyberArk vault including multiple CPMs, PVWAs, and as built documentation Collaborate to define access control, user entitlements, and user access policy management Collaborate to develop, execute and be accountable for overall project plan and timelines for key CyberArk program deliverables. Work with development teams on integration with UMG’s PAM solutions Bring your VIBE: CyberArk Expertise CyberArk administration, configuration, implementations, designs, and troubleshooting Minimum of 7-10 years directly related experience in CyberArk toolset, including Vault, CPM, PVWA, PSM, and PTA Experience in Privileged Account Management with CyberArk PIM Administration Extensive experience in implementation and integration of Cyber-Ark's Privileged Identity Management (PIM) Suite Advanced experience with script development (PowerShell/Python preferred) Experience with PAM tasks – Defining Access Control, User Entitlements, Manage Applications Credentials, User Access Policy Management. Able to work with confidential and sensitive information, maintaining confidentiality. A high level of technical ability for diagnosis, troubleshooting and problem analysis with the ability to clearly communicate the results of problem analysis to business stakeholders, IT support teams, and network providers to quickly and effectively resolve issues. Technical competence in the following: PAM & PIM via CyberArk product suite CyberArk Administration/Development Security protocols such as LDAP-S, SAML, WS-Federation, SCIM, OAuth, and OIDC Component services & areas: domain design, DDNS, DHCP, Directory Services including directory services replication/synchronization, Kerberos, Active Directory compliance for Schema Extensions, DEA (Directory Enabled Applications), LDAP-S, AD integration security, federation services and Forest system context management for application services Azure AD, PAM/PIM, AAD P2 Cloud entitlement management solutions such as Saviynt and Cyberark, in addition to AWS, GCP, and Azure options Adept at scripting in Python, PowerShell and/or one or more additional scripting languages Demonstrated current work experience engineering, customizing, and integrating IAM solutions such as Azure Active Directory, Duo, MIM, CyberArk, Duo, Okta, and Sailpoint/Saviynt Demonstrated organizational skills, attention to detail and ability to work both independently and as part of a team. As a senior member of the team, ability to work unsupervised, prioritize own workload, and mentor other team members as required is essential Comfortable in a global fast-paced enterprise team environment, with ability to adjust to changing priorities and schedules, and balance support and project work Customer service driven/focused with a proactive and positive can-do approach, demonstrating effective communication with multiple internal/external stakeholders in a global business environment Desirable Bachelor’s Degree in Computer Science, Engineering, Network Security or related field Demonstrated excellent technical writing skills and project/program management experience IT Certifications including CyberArk Sentry/Guardian, Microsoft Certification specialization in Identity Management, CISSP, AWS, GCP, and ITIL v3 Foundations certifications International experience beneficial; multiple language skills a plus Perks Playlist: Be part of an entrepreneurial, global organization that values authenticity, drive, creativity, relationships, and a competitive spirit Comprehensive medical, dental, vision, and FSA options, as well as: 100% coverage for out-patient mental health services Wellbeing reimbursements for fitness classes, spa treatments, meal services, travel, and so much more (up to $720/year) A lifetime fertility support allowance of $30,000 to plan participants Student Loan Repayment Assistance and Tuition Reimbursement 100% immediately vested 401(k) match on the first 5% of your contribution on eligible compensation Variety of ways to prioritize much-needed time away from work including: Flexible Paid Time Off (PTO) for exempt employees 3-weeks PTO for non-exempt employees 2-weeks paid Winter Break 10 Paid Holidays (including Juneteenth and Wellbeing Day) Summer Fridays (between Memorial Day and Labor Day) Generous paid parental leave for every type of parent Disclaimer: This job description only provides an overview of job responsibilities that are subject to change. All UMG employees are currently required to be fully vaccinated against COVID-19 or provide proof of a negative PCR or Antigen test before entering any Company offices unless they have been approved for an exemption or unless prohibited by applicable law. Universal Music Group is an Equal Opportunity Employer We are an E-Verify employer. For more information, please click on the following links. E-Verify Participation Poster: English / Spanish E-Verify Right to Work Poster: English | Spanish Job Category: Technology Salary Range: $74,520 - 189,151 The actual base salary offered depends on a variety of factors, which may include, as applicable, the qualifications of the individual applicant for the position, years of relevant experience, specific and unique skills, level of education attained, certifications or other professional licenses held, and the location in which the applicant lives and/or from which they will be performing the job. All candidates are encouraged to apply.",https://www.indeed.com/jobs?q=Software+Engineer&l=Los+Angeles%2C+CA&sc=0kf%3Aattr%28FCGTU%7CHFDVW%7CQJZM9%7CUTPWG%252COR%29explvl%28SENIOR_LEVEL%29jt%28fulltime%29%3B&radius=50&start=50&pp=gQBLAAAAAAAAAAAAAAAB_jANOQA8AQEBDwynmrZqhfNMoI5uGmoqhzQIeV00dTnCW7g1P1m0Xhn7-hXC28tUuig9nOQ4PiT0BeUIoVNFOkDFAAA&vjk=af0cbfe9eba90ec7
1,712987ac71f0fff1,Software Engineer,"Los Angeles, CA",SENIOR_LEVEL,BACHELORS_DEGREE,fulltime,"SR. SQL DATABASE DEVELOPER - job post DNTG Software 4 reviews Cerritos, CA 90703 Full-time DNTG Software 4 reviews Read what people are saying about working here. You must create an Indeed account before continuing to the company website to apply Apply on company site save-icon Job details Job Type Full-time Looking for an experienced and super sharp Transact SQL Developer for a large Transactional Processing System. The Sr. SQL Database Developer will be responsible for leading database efforts and document customer requirements, create system specifications, develop, test and implement application solutions. DUTIES: Design database schema based on data modeling of business requirements and entities. Write new stored procedures, functions, views, triggers, constraints, etc. Review SQL code written by application developers to ensure compliance to coding standards and best practices as well as maximum performance. Analyze access patterns and propose the best combination of indexes, constraints, foreign keys, and queries. Create SSIS packages for data transformation, cleansing, caching, aggregation, staging, and transfer. Troubleshoot problems that may come up with database environments: performance issues; replication issues; or operational issues. Code, install, optimize, and debug database queries and store procedures using appropriate tools and editors. REQUIREMENTS 10+ years of experience in SQL Development for Microsoft SQL Server. Developing and reporting with large and complex databases. Excellent Transact SQL Programming Skills in MS SQL Server. Must have a good background in financial processing, business logic, application design. Background in SQL Broker a plus. Must be able to read C# code. Good troubleshooting and support skills. Advanced data analysis, validation, and processing skills. Strong communication and organizational skills. ADDITIONAL INFORMATION Location: Buena Park, CA Job-Type: Full-Time Education-level: Bachelor’s degree in Computer Science, Information Systems or closely related field is preferred Salary: Above Market + Benefits + Bonus Local candidates preferred; work sponsorship and relocation assistance not offered. No subcontractors, offshore development teams or agency resumes.",https://www.indeed.com/jobs?q=Software+Engineer&l=Los+Angeles%2C+CA&sc=0kf%3Aattr%28FCGTU%7CHFDVW%7CQJZM9%7CUTPWG%252COR%29explvl%28SENIOR_LEVEL%29jt%28fulltime%29%3B&radius=50&start=50&pp=gQBLAAAAAAAAAAAAAAAB_jANOQA8AQEBDwynmrZqhfNMoI5uGmoqhzQIeV00dTnCW7g1P1m0Xhn7-hXC28tUuig9nOQ4PiT0BeUIoVNFOkDFAAA&vjk=712987ac71f0fff1
2,553b3354f3af4ec5,Software Engineer,"Los Angeles, CA",SENIOR_LEVEL,BACHELORS_DEGREE,fulltime,"Cloud Engineer, Sr. (Infrastructure) - job post CalOptima 96 reviews Orange, CA 92868 Full-time CalOptima 96 reviews Read what people are saying about working here. You must create an Indeed account before continuing to the company website to apply Apply on company site save-icon Job details Job Type Full-time Cloud Engineer, Sr. (Infrastructure) Job Description Department(s): ITS - Infrastructure Reports to: Sr Manager, Information Technology Services FLSA status: Non-Exempt Salary Grade: P - $117,000 - $181,500 About CalOptima Health CalOptima Health is the single largest health plan in Orange County, serving one in four residents. Our motto - ""Better. Together."" - is at the heart of our mission to serve members with excellence, dignity and respect. We are a public agency made up of compassionate leaders and professionals working together to strengthen our community's health. We are continuing to build a culture that promotes diversity and inclusion within our community where employees have a sense of belonging, and are valued for their ideas, contributions, and their unique individual perspectives they bring. CalOptima Health has been recognized as one of Orange County's best places to work, so we know there is something special about our organization. It is why people choose to work here and why they choose to stay! About the Position The Cloud Engineer, Sr. will work independently and be responsible for the day-to-day design, development and operations of CalOptima Health's cloud platform (Microsoft Azure, Microsoft Office 365, Active Directory and additional services). The incumbent will be an experienced engineer who has the capability to embrace and expand the existing cloud architecture and will serve as the subject matter expert. The incumbent will lead large sized and complex projects by planning, developing, testing and implementing new projects. The incumbent will provide expertise as workloads are transitioned to the cloud while ensuring minimal business disruptions. The incumbent will be responsible for extensive coordination with respective internal support, engineering teams and various external partners and vendors on multiple projects and initiatives. Lastly, the incumbent will need to perform other duties as assigned by the Manager of Information Technology Services (ITS) that may be outside of his/her technical area of expertise. Position Responsibilities: Participates in a mission-driven culture of high-quality performance, with a member focus on customer service, consistency, dignity and accountability. Assists the team in carrying out department responsibilities and collaborates with others to support short- and long-term goals/priorities for the department. Designs, develops and deploys cloud-based systems and services, in collaboration with Architects and in accordance with best practices and strategic direction. Leads and optimizes cloud infrastructure initiatives and assists other departments with moving their workloads to the cloud. Leads large sized and complex projects including but not limited to planning, developing, testing and implementing new projects. Mentors and supports other Cloud Engineers with complex cloud infrastructure issues. Provides input on technical architecture and direction for the cloud environments. Compiles and updates cloud reference architecture as well as provides support for Microsoft Azure, Office 365, SaaS, PaaS and IaaS Integrations, along with other cloud services. Provides insight on cloud technologies (modules, applications, hardware and new software) and presents solutions to senior leadership. Ensures efficient performance and utilization of cloud services (compute, storage and network). Works closely with and advises Information Security on cloud vulnerabilities and threats by identifying, analyzing and resolving infrastructure vulnerabilities and application deployment issues. Advises other Cloud Engineers with administering Active Directory, Exchange, Group Policy, Active Directory Federation Services (ADFS) and certificates. Works closely with the ITS Application team on service performance by migrating workloads to Microsoft Azure and automating tasks using Microsoft PowerShell, Python, etc. Installs and configures traditional servers, storage and associated equipment. Responds to updates and closes complex service desk tickets generated by internal business partners. Works closely with the ITS team by reviewing legacy systems and provides recommendations for improvements. Monitors network/system performance by identifying system and network events, security and environmental alarms. Develops, implements and testis data contingency/disaster recovery planning. Completes other projects and duties as assigned. Experience & Education: Bachelor's degree in Computer Science, Engineering, Technology, or a related field required. 8 years of experience working with Microsoft Azure, Microsoft 365, Windows Servers and Active Directory (AD) required. Experience with Microsoft Azure AD integrations required. Cloud-based certification (Microsoft Azure, AWS, or GCP) required. Experience in a multi-cloud or hybrid cloud environment required. An equivalent combination of education and experience sufficient to successfully perform the essential duties of the position such as those listed above is also qualifying. Preferred Qualifications: Experience with ITIL Foundations or relevant best-practice framework. About our Benefits & Wellness options: At CalOptima Health, we know that a healthy and happy workforce is a thriving workforce, which is why we offer a comprehensive benefits package, including participation in the California Public Employees Retirement System (CalPERS), low-cost medical/vision/dental insurance options, and paid time off. To support quality work-life balance, we allow flexible scheduling during core business hours, telework options for some positions, work schedules that allow every other Monday or Friday off (9/80 schedule), and a wellness program featuring diverse activities. Additionally, CalOptima Health contributes 4% of pensionable earnings to a 401(a) retirement program with no required employee contribution. Employees also have access to 457(b) retirement plans with pre/post-tax contribution options. CalOptima is an equal employment opportunity employer and makes all employment decisions on the basis of merit. CalOptima wants to have qualified employees in every job position. CalOptima prohibits unlawful discrimination against any employee, or applicant for employment, based on race, religion/religious creed, color, national origin, ancestry, mental or physical disability, medical condition, genetic information, marital status, sex, sex stereotype, gender, gender identity, gender expression, transitioning status, age, sexual orientation, immigration status, military status as a disabled veteran, or veteran of the Vietnam era, or any other consideration made unlawful by federal, state, or local laws. CalOptima also prohibits unlawful discrimination based on the perception that anyone has any of those characteristics or is associated with a person who has, or is perceived as having, any of those characteristics. If you are a qualified individual with a disability or a disabled veteran, you may request a reasonable accommodation if you are unable or limited in your ability to access job openings or apply for a job on this site as a result of your disability. Job Location: Orange, California Position Type: To apply, visit https://jobs.silkroad.com/CalOptima/Careers/jobs/4141 jeid-4eafc9b0c9508149a7888c90f04f4cf1",https://www.indeed.com/jobs?q=Software+Engineer&l=Los+Angeles%2C+CA&sc=0kf%3Aattr%28FCGTU%7CHFDVW%7CQJZM9%7CUTPWG%252COR%29explvl%28SENIOR_LEVEL%29jt%28fulltime%29%3B&radius=50&start=50&pp=gQBLAAAAAAAAAAAAAAAB_jANOQA8AQEBDwynmrZqhfNMoI5uGmoqhzQIeV00dTnCW7g1P1m0Xhn7-hXC28tUuig9nOQ4PiT0BeUIoVNFOkDFAAA&vjk=553b3354f3af4ec5
