,job_id,job_title,location,experience,education,job_type,job_description,job_link
25,2d54642be37cb40f,Software Engineer,"Los Angeles, CA",SENIOR_LEVEL,BACHELORS_DEGREE,fulltime,"Director, Software Engineering - job post CoStar Group 473 reviews Irvine, CA 92618 • Hybrid remote Full-time CoStar Group 473 reviews Read what people are saying about working here. You must create an Indeed account before continuing to the company website to apply Apply on company site save-icon Job details Job Type Full-time Director, Software Engineering <br> Job Description <br> Overview CoStar Group (NASDAQ: CSGP) is a leading global provider of commercial and residential real estate information, analytics, and online marketplaces. Included in the S&P 500 Index and the NASDAQ 100, CoStar Group is on a mission to digitize the world’s real estate, empowering all people to discover properties, insights and connections that improve their businesses and lives. We have been living and breathing the world of real estate information and online marketplaces for over 35 years, giving us the perspective to create truly unique and valuable offerings to our customers. We’ve continually refined, transformed and perfected our approach to our business, creating a language that has become standard in our industry, for our customers, and even our competitors. We continue that effort today and are always working to improve and drive innovation. This is how we deliver for our customers, our employees, and investors. By equipping the brightest minds with the best resources available, we provide an invaluable edge in real estate. LoopNet, the most popular place to find a space, is the #1 global commercial real estate marketplace. With more than 12 million global unique monthly visitors, LoopNet provides brokers, buyers and sellers with what they need to meet and make deals. LoopNet has established itself as the most effective and far-reaching digital marketplace for commercial real estate owners and brokers. We are not done yet! We continue to focus on driving expansion by increasing market share in the US and abroad, continuously innovating and enhancing the product and growing a powerhouse global team to reach our goals. Learn more about LoopNet. Our team is searching for another Director to lead our application development efforts on mobile web, tablet, and desktop. With over 11 Million unique monthly visits across US, CAN, UK (and more coming soon) LoopNet.com is the #1 Commercial Property Marketplace website in the world. The Technical Director is responsible for managing multiple software development teams, guiding system architecture, ensuring project ownership and team leadership. Your teams will design, develop, test, debug and implement operating systems components, software tools, and utilities; as well as determine systems software design requirements in addition to ensuring that system improvements are successfully implemented and monitored to increase efficiency. This position is located in Irvine, CA and offers the following hybrid schedule options: 3 days onsite, 2 days remote 4x10 schedule, 1 day remote Responsibilities Act as a player coach with 7+ years of industry experience managing multiple project development teams working on multiple concurrent projects Coordinate the activities and deliverables across multiple teams while resolving issues and ensuring appropriate priorities Mentor and manage Technical Managers in the normal execution of their responsibilities. Interact regularly with technology and business executives Translate business requirements into technical requirements, develop project plan and work schedules for use by scrum development teams Successfully implement software development projects to specification and within scheduled timelines and budget parameters. Ensure proper software development practices are followed and provide guidance and/or assistance when necessary Provide status reports and feedback to Business Management Act as release manager to ensure product components are released for production deployment as tested Drive continuous improvement within Scrum team by focusing on engineering excellence Work with recruiting to identify, hire and onboard top industry talent Coach, motivate, train, and retain key contributors Continually evaluate emerging technologies to identify opportunities, trends and best practices that can be used to strengthen CoStar’s technology platform and development practices Act as ""Voice of the Customer"" when participating in product readiness reviews Basic Qualifications Bachelor’s Degree 5+ years of multi-team development management experience with two or more direct manager reports Experience with complex Web, Service and Database technologies Demonstrated expert knowledge of Service Oriented Architecture and design patterns Solid experience with the following technologies: .Net Core, JavaScript, Cloud Managed Services, Database, Web, JavaScript High proficiency in testing methodology, Agile methodology, test documentation procedures and QA Best Practices Strong written and verbal communication skills; Must be able to communicate at a level appropriate to the audience (direct reports, peers, and senior management) Excellent team building, negotiation and consensus building abilities Ability to motivate and build high performance testing and software development teams Preferred Qualifications And Skills Solid Experience with .NetCore, MVC, Svelte, AWS Managed Services, Kafka, Elasticsearch, SQL Experience with Kubernetes and Microsoft Infrastructure is preferred Understanding & implementation of automated test processes What’s in it for You When you join CoStar Group, you’ll experience a collaborative and innovative culture working alongside the best and brightest to empower our people and customers to succeed. We offer you generous compensation and performance-based incentives. CoStar Group also invests in your professional and academic growth with internal training, tuition reimbursement, and an inter-office exchange program. Our benefits package includes (but is not limited to): Comprehensive healthcare coverage: Medical / Vision / Dental / Prescription Drug Life, legal, and supplementary insurance Virtual and in person mental health counseling services for individuals and family Commuter and parking benefits 401(K) retirement plan with matching contributions Employee stock purchase plan Paid time off Tuition reimbursement On-site fitness center and/or reimbursed fitness center membership costs (location dependent), with yoga studio, Pelotons, personal training, group exercise classes Access to CoStar Group’s Diversity, Equity, & Inclusion Employee Resource Groups Complimentary gourmet coffee, tea, hot chocolate, fresh fruit, and other healthy snacks We welcome all qualified candidates who are currently eligible to work full-time in the United States to apply. However, please note that CoStar Group is not able to provide visa sponsorship for this position. <br> CoStar Group is an Equal Employment Opportunity Employer; we maintain a drug-free workplace and perform pre-employment substance abuse testing",https://www.indeed.com/jobs?q=Software+Engineer&l=Los+Angeles%2C+CA&sc=0kf%3Aattr%28FCGTU%7CHFDVW%7CQJZM9%7CUTPWG%252COR%29explvl%28SENIOR_LEVEL%29jt%28fulltime%29%3B&radius=50&start=60&pp=gQBaAAAAAAAAAAAAAAAB_jANOQA4AQEBDxt8xUePOn6luBzWE3FH1wcvWwRwetEHwcEg5oHnZbOjv9Ha2baCnWzm2uT9cSS2U4HRrmEAAA&vjk=2d54642be37cb40f
26,b4346e0cd43bbedf,Software Engineer,"Los Angeles, CA",SENIOR_LEVEL,BACHELORS_DEGREE,fulltime,"Sr Robotics Software Engineer - Active Clearance - job post ANDURIL INDUSTRIES Costa Mesa, CA 92626 Full-time You must create an Indeed account before continuing to the company website to apply Apply on company site save-icon Job details Job Type Full-time Anduril Industries is a defense technology company with a mission to transform U.S. and allied military capabilities with advanced technology. By bringing the expertise, technology, and business model of the 21st century’s most innovative companies to the defense industry, Anduril is changing how military systems are designed, built, and sold. Anduril’s family of systems is powered by Lattice OS, an AI-powered operating system that turns thousands of data streams into a real-time, 3D command and control center. As the world enters an era of strategic competition, Anduril is committed to bringing cutting-edge autonomy, AI, computer vision, sensor fusion, and networking technology to the military in months, not years. The Robotics team at Anduril develops aerial and ground-based robotic systems. The team is responsible for taking products like Ghost, Anvil, and our Sentry Tower from paper sketches to operational systems. We work in close coordination with specialist teams like Perception, Autonomy, and Manufacturing to solve some of the hardest problems facing our customers. We are looking for software engineers and roboticists excited about creating a powerful robotics stack that includes computer vision, motion planning, SLAM, controls, estimation, and secure communications. WHAT YOU’LL DO Write and maintain core libraries (frame transformations, targeting and guidance, etc.) that all robotics platforms at Anduril will use Own major feature development and rollout of large features for our products - recent examples include building a Software-in-the-Loop simulator for our Anvil product and characterizing and improving Ghost helicopter battery consumption with route planning Work closely with our hardware and manufacturing teams during product development, providing quick feedback that contributes to the final hardware design REQUIRED QUALIFICATIONS BS in Robotics, Computer Science, Mechatronics, Electrical Engineering, Mechanical Engineering, or related field Proven understanding of data structures, algorithms, concurrency, and code optimization Experience troubleshooting and analyzing remotely deployed software systems Experience working with and testing electrical and mechanical systems Strong C++ or Rust experience in a Linux development environment An active security clearance (Secret, Top Secret, TS with SCI, or equivalent) PREFERRED QUALIFICATIONS MS or PhD Experience in one or more of the following: motion planning, perception, localization, mapping, controls, and related system performance metrics. Python, Rust, and/or Go experience Experience programming for embedded and physical devices Multi-agent coordination of UAVs Complex frame transformation problems, such as target localization or multi degree of freedom robotic arms Anduril is an equal-opportunity employer, and we encourage candidates from all backgrounds to apply. If you are someone passionate to work on problems that matter, we’d love to hear from you!",https://www.indeed.com/jobs?q=Software+Engineer&l=Los+Angeles%2C+CA&sc=0kf%3Aattr%28FCGTU%7CHFDVW%7CQJZM9%7CUTPWG%252COR%29explvl%28SENIOR_LEVEL%29jt%28fulltime%29%3B&radius=50&start=60&pp=gQBaAAAAAAAAAAAAAAAB_jANOQA4AQEBDxt8xUePOn6luBzWE3FH1wcvWwRwetEHwcEg5oHnZbOjv9Ha2baCnWzm2uT9cSS2U4HRrmEAAA&vjk=b4346e0cd43bbedf
27,ebd1d63667803415,Software Engineer,"Los Angeles, CA",SENIOR_LEVEL,BACHELORS_DEGREE,fulltime,"Lead Gameplay Engineer - job post Madison Square Garden Entertainment 585 reviews Burbank, CA 91504 Full-time Madison Square Garden Entertainment 585 reviews Read what people are saying about working here. You must create an Indeed account before continuing to the company website to apply Apply on company site save-icon Job details Job Type Full-time Who are we hiring? As a Lead Gameplay Engineer at MSG Entertainment Interactive you head game logic development for a veteran multidisciplinary team creating bleeding edge entertainment that’s equal parts video game, amusement park ride, and spectacle. Your production hardware is The Sphere – a massive 16K 4D theater with beam-formed audio – and the mobile phones of our guests. You iterate, you take pride in your work, and your creations range from rapid prototypes to ultra-high-definition multimedia. You design and implement software systems – but you’re also a force multiplier who drives and enables those around you to excel, with the ability to work alone or in teams. Your in-depth technical knowledge and strong aesthetic inclination let you tackle projects and provide support on complicated technical issues for artists and engineers alike across our real-time content development ecosystem. As an ideal candidate you bring deep and broad software development expertise, people-first agile leadership skills, creative vision and a passion for scaling game concepts and mechanics from prototypes to massively multiplayer real-time experiences. What will you do? Lead assigned projects and the technical work of the associated development team; pull together input from other team members into a cohesive and stable system; maintain an inclusive process that empowers the entire project team to contribute to final results Mentor peers and more junior team members through individual feedback, code and design reviews Deliver prototypes and production-quality code as a hands-on leader Interface directly with high level stakeholders to champion appropriate technical approaches for the development of new projects Prioritize tasks for multiple concurrent projects, interacting and collaborating with others to solve problems; mentor peers and more junior team members through individual feedback, code and design reviews Implement new tools and processes in response to production needs and support production teams in their use; partner across departments to define, guide and create production technology Lead best practices in efficient and effective development, seeking and executing on opportunities to streamline and fully utilize current and new technology solutions Identify areas that require attention, and work with the project management team to ensure time and resources are dedicated to continually improving and reducing areas of concern Stay on top of the latest industry developments, sharing key findings with the team at regular intervals. Attend and update in daily scrums, bi-weekly sprint planning sessions, reviews, and retrospectives in accordance with the team’s Agile practices Attend and update in daily scrums, bi-weekly sprint planning sessions, reviews, and retrospectives in accordance with the team’s Agile practices What do you need to succeed? Computer Science BS/MS or equivalent experience 10+ years of experience in relevant fields Excellent communications and team relations skills Expertise in C++ and the Unreal game engine Understanding of software development and release cycles and agile methodologies Experience across all phases (concept to end-of-life) of at least one shipped AAA-equivalent multiplayer interactive entertainment product Experience working within a high-definition VFX or game content production pipeline Demonstrated track record of gaining trust and respect by consistently demonstrating sound creative, strategic, and analytical thinking skills, while maintaining composure in stressful situations Additional Preferred Qualifications: Experience with AR, VR, 360 or other immersive content Professional experience developing for iOS/Android mobile devices Professional experience developing using the Unity game engine Experience with common games industry production software (MS Office, JIRA, Miro) a plus. Interest and/or secondary skills in another key game development discipline (Game Design, Product Management, Art, Audio) Why is MSG for me? With MSG Sphere, we are creating an entirely new medium that will deliver immersive entertainment experiences at an unparalleled scale. Beyond a venue, Sphere is a multi-sensory platform with experiential technology programming directly to your senses. You will see in ways never imagined, hear with every fiber of your being, and experience like never before. To deliver on this promise, we are building the largest immersive venue in the world, MSG Sphere at The Venetian in Las Vegas, with a second Sphere venue planned for London, pending necessary approvals. In addition to building a breakthrough venue, we’re building a production studio team, a technology venture team, and a full commercial organization to make the MSG Sphere a world class brand and business for our fans, our artists, and our partners. We have offices and roles in Burbank CA, Las Vegas NV, New York, NY and London. We focus on Career Development and Invest in YOU At MSG, we recognize the importance of upskilling employees’ talents and strengths so they can drive their careers forward. We are proud to offer a robust set of tools and resources to help employees understand their interests and purpose, harness their talents and obtain the skills they need to reach the next step in their careers. Growth and longevity for our employees are top priorities here. We value diversity and are looking for extraordinary employees of all backgrounds At MSG we value diversity and are looking for extraordinary employees of all backgrounds! MSG is an Equal Opportunity Employer and provides equal employment opportunities to all employees and applicants for employment without regard to race, color, religion, gender, sexual orientation, gender identity or expression, sexual and reproductive health choices, national origin, citizenship, age, genetic information, disability, or veteran status. In addition to federal law mandates, MSG complies with all applicable state and local laws governing nondiscrimination in all locations and will consider requests for reasonable accommodations as required. #LI-SN1",https://www.indeed.com/jobs?q=Software+Engineer&l=Los+Angeles%2C+CA&sc=0kf%3Aattr%28FCGTU%7CHFDVW%7CQJZM9%7CUTPWG%252COR%29explvl%28SENIOR_LEVEL%29jt%28fulltime%29%3B&radius=50&start=60&pp=gQBaAAAAAAAAAAAAAAAB_jANOQA4AQEBDxt8xUePOn6luBzWE3FH1wcvWwRwetEHwcEg5oHnZbOjv9Ha2baCnWzm2uT9cSS2U4HRrmEAAA&vjk=ebd1d63667803415
28,08bc1618eaf56bf6,Software Engineer,"Los Angeles, CA",SENIOR_LEVEL,BACHELORS_DEGREE,fulltime,"Senior Firmware Engineer - job post Korrus Los Angeles, CA 90012 • Remote $105,000 - $146,000 a year -  Full-time Apply now Apply now save-icon Job details Salary $105,000 - $146,000 a year Job Type Full-time About Us: Korrus is a Los Angeles-based technology company and pioneer in Human Light Interaction (HLI), the next frontier in human health and wellness. Our technologies enable an ecosystem of novel products and applications at the intersection of light and wellbeing. We operate through a collection of sub-brands with specific market segment mandates. Learn more at Korrus.com Primary Role and Responsibility: The Senior Firmware Engineer will participate in all phases of software development targeting embedded systems, including design, coding, integration, and debugging of major portions of software projects. The candidate will demonstrate self-motivation and own the execution of project/program tasks, confidently challenge traditional conventions, and recommend new effective approaches. Deliverables may require extensive technical analysis and inventive design recommendations for cost effective resolutions. Contributions may lead to new ideas that support the generation of intellectual property. The Firmware Engineer will synchronize across functional groups to ensure all inputs are received and guide technical support staff in testing and analysis. To design and develop critical firmware architecture that will be utilized across leading-edge platforms Design and develop organized, easy to read and modify software source code for embedded systems Debug software/firmware using emulators, analyzers, simulators, and similar tools Develop applications using industry standard technologies to generate efficient and portable code Design and develop communication protocols, standard and proprietary for device communications via wired technologies Create applications and drivers deployed inside embedded hardware devices Document software designs and code with specifications and source comments, and create end user documentation Program in high level and low-level languages as appropriate including C/C++ and assembly. Demonstrate strong knowledge of cross functional and related technical areas such as Software Quality techniques, Systems-level integration & Test, software configuration management, and release management Participate in peer to peer and cross functional design review meetings Required Skills/Qualifications: Bachelor's degree or greater in Computer Science or Electrical Engineering 5 to 7 years of professional experience directly related experience in embedded control systems design and development Experience in C, C++ and embedded programming Understanding of RTOS concepts and expertise in designing event driven real-time system firmware Experience in design and develop Test Cases/Procedures for complex embedded system Experience in using test equipment such as DMM, power analyzer, Oscilloscope, etc. Experienced using communication API to control test equipment Excellent written and verbal communication skills Willingness to travel domestically and internationally (less than 20%) Possess the ability and willingness to roll up sleeves and execute to get the job done Nice to have Skills/Qualifications: Direct experience in using FreeRTOS is desirable Product development experience in multi-channel LED systems including advanced color, circadian stimulus, or other spectral tuning color algorithms is desirable Product development experience in lighting control application or LED drivers is desired Experience in designing firmware using one or more of the lighting control communication protocols such as DALI, DMX, BLE, BLE-Mesh, ZigBee, Z-Wave etc. Proof of Covid-19 vaccination required as a condition of employment. Exemptions may be sought for documented medical conditions and sincerely held religious beliefs. All qualified applicants will receive equal consideration for employment without regard to race, color, national origin, religion, sex, pregnancy, marital status, sexual orientation, gender identity, age, physical or mental disability, or covered veteran status. This is a remote position. If you require alternative methods of application or screening, you must approach the employer directly to request this as Indeed is not responsible for the employer's application process.",https://www.indeed.com/jobs?q=Software+Engineer&l=Los+Angeles%2C+CA&sc=0kf%3Aattr%28FCGTU%7CHFDVW%7CQJZM9%7CUTPWG%252COR%29explvl%28SENIOR_LEVEL%29jt%28fulltime%29%3B&radius=50&start=60&pp=gQBaAAAAAAAAAAAAAAAB_jANOQA4AQEBDxt8xUePOn6luBzWE3FH1wcvWwRwetEHwcEg5oHnZbOjv9Ha2baCnWzm2uT9cSS2U4HRrmEAAA&vjk=08bc1618eaf56bf6
