,job_id,job_title,location,experience,education,job_type,job_description,job_link
9,ada969602bd14229,Software Engineer,"Austin, TX",SENIOR_LEVEL,EXSNN|FCGTU|HFDVW|QJZM9|UTPWG%2COR,fulltime,"Sr Manager, Software Development & Engineering Senior (PL) - job post Charles Schwab 1,559 reviews Austin, TX 78758 $101,000 - $224,400 a year -  Full-time Charles Schwab 1,559 reviews Read what people are saying about working here. You must create an Indeed account before continuing to the company website to apply Apply on company site save-icon Job details Salary $101,000 - $224,400 a year Job Type Full-time Your Opportunity This is a Senior Software Engineering Manager position and is part of Enterprise Middleware Online Security Team at Schwab. This team focuses on driving client-centricity, reducing time to market & increasing efficiency. The model is insights-driven and focuses on rapid iterations to drive innovation and transformation. Ideal candidates enjoy fast-paced environments, thrive under ambiguity and embrace change passionately. This is a unique opportunity to grow and transform our business through driving significant step-change in our time to market, building more integrated client-centric experiences, and enabling project success via cross-functional coordination and ownership. What you are good at In this position you will have a broad range of responsibilities with a central focus on working with developers and engineers to support and build and deliver a highly-scalable, cloud-based platform. You will: Facilitate technical discussions and drive solutions forward to achieve business needs and ensure alignment to strategic technology vision Be the delivery manager for multiple scrum teams and also for multiple professional services teams Provide hands-on technical mentoring and leadership Manage and coordinate team interaction with business, technology and operations support partners Develop and manage resource roadmaps, budgets and schedules Identify gaps/risks early and establish mitigation plans (both technical and people) Continually strive for improvements in process, talent acquisition/retention, application time-to-market and quality Increase the overall visibility of this team; celebrate/track accomplishments and build relationships with key leaders in other groups Identify and document the roles, tasks, and responsibilities of each team member Lead all recruiting activities across teams (create different avenues when necessary) Be the front-line manager for 8+ full time employees, in addition to managing contractors and international third party resources What you have You must possess a solid technology background in the required technology areas to provide oversight and guidance to teams and facilitate technological decisions. To be successful in this position you will have a strong relationship with product/business, technology, infrastructure and production support teams. Basic Qualifications: 7+ years of software development management/leadership experience 3+ years of people management experience with at least 5 direct reports 5+ years of experience with running medium to large/complex projects with multiple dependencies using Agile (Scrum/XP/Kanban) processes in planning, implementation and support of business application components, including change & release management Bachelor's degree in technology, business, or related discipline Leadership and Management: Proven track record successfully building, leading and growing technology teams including work in the agile process, objective setting, career path guidance, and staff performance History of delivering solutions consistently and managing the complexity of large project implementations. Demonstrated ability to interact and communicate successfully with business partners, technology team, production support and infrastructure teams Strong influencing, negotiation, and, problem-solving skills with an ability to identify stakeholders, assess their needs and manage their expectations through effective communication Demonstrated ability and curiosity to evangelize vision and direction in a way that drives team engagement and motivation Adaptability to thrive in a dynamic fast paced environment with many moving parts and a large variety of responsibilities including geographical diversity of technical functions Self-starter with strong prioritization and multitasking capabilities Demonstrated ability to thrive in a flexible and fast-paced environment, including the ability to think big in a rapidly evolving technology space. Ability to successfully handle ambiguity. Technical Qualifications: Experience with .NET, C#, Java, Java Script, web services, CI/CD automation preferred Experience with security or authentication solutions. Experience with high volume, performance driven distributed systems Demonstrated ability to analyze, propose and implement timely, cost effective, quality solutions for all issues or problems within area of responsibility Demonstrated ability to facilitate technical discussions and drive solutions forward to achieve business needs and ensure alignment to strategic technology vision Strong skills in risks identification, tracking and planned mitigation Extremely strong written and verbal communication skills Strong innovation, creativity, and problem-solving skills Familiarity with enterprise IT systems and environments (e.g. networking, capacity planning, operations, multiple IT divisions, etc.) preferred Demonstrated experience with designing or working with highly available and reliable systems including work on technical design, defining SLAs, KPIs for tracking and improving software reliability Why work for us? Own Your Tomorrow embodies everything we do! We are committed to helping our employees ignite their potential and achieve their dreams. Our employees get to play a central role in reinventing a multi-trillion-dollar industry, creating a better, more modern way to build and manage wealth. Benefits: A competitive and flexible package designed to empower you for today and tomorrow. We offer a competitive and flexible package designed to help you make the most of your life at work and at home—today and in the future. TD Ameritrade, a subsidiary of Charles Schwab, is an Equal Opportunity Employer. At TD Ameritrade we believe People Matter. We value diversity and believe that it goes beyond all protected classes, thoughts, ideas, and perspectives.",https://www.indeed.com/jobs?q=Software+Engineer&l=Austin%2C+TX&sc=0kf%3Aattr%28EXSNN%7CFCGTU%7CHFDVW%7CQJZM9%7CUTPWG%252COR%29explvl%28SENIOR_LEVEL%29jt%28fulltime%29%3B&radius=50&start=10&pp=gQAPAAAAAAAAAAAAAAAB_hQcvAAVAQApedO3Eo4vT2cuwBQr4yqjn0puAAA&vjk=ada969602bd14229
10,6189fd6ae9655bf8,Software Engineer,"Austin, TX",SENIOR_LEVEL,EXSNN|FCGTU|HFDVW|QJZM9|UTPWG%2COR,fulltime,"Developer Software Principal I (Remote) - job post Everi Games Inc 82 reviews Austin, TX • Remote Full-time Everi Games Inc 82 reviews Read what people are saying about working here. You must create an Indeed account before continuing to the company website to apply Apply on company site save-icon Job details Job Type Full-time Be a part of the team creating modern systems using modern technologies. The hottest, fastest-growing team at Everi is looking for Developer Software Principal to join the team - see below for more details! What Will You Be Doing? Design, modify and implement Java server-side features. Build a modern microservices system that is hosted in a part cloud-native application, part on-premise virtualized network. Create the next big thing using a lot of the same technologies Netflix uses. Be a team player in this highly collaborative group, learning from senior members and mentoring junior ones all along. Recommend alterations to designs and processes to improve the quality of products and procedures. Skills, Knowledge, & Expertise Needed for the Job: 6-8 years of experience with design, development or modifying of software programming applications. 6-8 years of experience and practical application of software development practices, such as the software development life cycle (SDLC), agile software development, feature driven development, or other similar processes. 6- 8 years of programming experience in Java, if you have gaming or casino experience that's a HUGE plus. Bachelor’s Degree in Computer Science, Engineering, or equivalent work experience in a related field required. Experience in working within microservices. Cassandra experience is a Plus. Knowledgeable in utilizing spring boot on a daily basis. Experience building REST APIs is a Plus Knowledge of Agile methodology (daily standups, weekly demos, 2-week sprints). Why Us? Everi's benefits package includes Medical, Dental, Vision, 401k with company match, life insurance, maternity and paternity leave, adoption assistance, pet insurance, gym reimbursement, and more! Discretionary Time Off (DTO) - No more ""banking hours"" to take a day off and the perfect way to prevent burnout and improve productivity. Building on a strong culture and resounding positive feedback from Everi employees in 2021, Everi continues to receive recognition as a Top Workplace in 2022. Everi was recognized nationally as a Top Workplace 2022 USA and received a second regional award for its HQ in Las Vegas as a Nevada Top Workplace 2022. This most recent award brings Everi's total number of Top Workplaces awards in 2021 and 2022 to a whopping 10 awards!!!!﻿ ﻿﻿ ﻿ ﻿ Play 00:00 00:24 Mute Enter fullscreen Play ﻿Everi Corporate HQ is committed to expanding its innovative and creative reach, building a culture based on the tenets of respect and transparency. We are proud to be the gaming industry’s single-source provider of financial technology, loyalty solutions, games, and intelligence solutions. Let’s Go! Everi is an Equal Opportunity Employer. All qualified applicants and employees will be afforded equal employment opportunities without discrimination because of race, creed, color, national origin, sex, age, disability, marital status, or any other characteristic or class protected by federal, state, or local law. ** For All External Staffing Agencies ** Everi does not accept agency submittals. Please do not forward resumes to our Executive team, Management team, or any current Everi employee for review without proper approval. Everi is not responsible for any fees related to unsolicited resumes. #LI-MW1 #USREMOTE About Everi We believe in the values of Collaboration, Integrity, Inclusion, Excellence, and Fun! Apply Now Our Hiring Process Previous Stage 2: Review Stage 3: Background Check Stage 4: Hired Stage 1: Applied Stage 2: Review Stage 3: Background Check Stage 4: Hired Stage 1: Applied Stage 2: Review Stage 3: Background Check Stage 4: Hired Next 1 2",https://www.indeed.com/jobs?q=Software+Engineer&l=Austin%2C+TX&sc=0kf%3Aattr%28EXSNN%7CFCGTU%7CHFDVW%7CQJZM9%7CUTPWG%252COR%29explvl%28SENIOR_LEVEL%29jt%28fulltime%29%3B&radius=50&start=10&pp=gQAPAAAAAAAAAAAAAAAB_hQcvAAVAQApedO3Eo4vT2cuwBQr4yqjn0puAAA&vjk=6189fd6ae9655bf8
11,980f334fecd71e7d,Software Engineer,"Austin, TX",SENIOR_LEVEL,EXSNN|FCGTU|HFDVW|QJZM9|UTPWG%2COR,fulltime,"Senior Software Engineer C# - job post Big Fish Games, Inc. 42 reviews Austin, TX 78757 • Hybrid remote $120,703 - $224,162 a year -  Full-time Big Fish Games, Inc. 42 reviews Read what people are saying about working here. You must create an Indeed account before continuing to the company website to apply Apply on company site save-icon Job details Salary $120,703 - $224,162 a year Job Type Full-time Job Posting Title Senior Software Engineer C# Pay Range $120,703-$224,162 Summary Senior Software Engineer – C# Are you looking to play a key role in a global gaming company? Are you passionate about producing high-quality, robust and maintainable products? Do you thrive in an Agile environment? Are you interested working on the newest and greatest technology within the gaming industry? Aristocrat is looking for an extremely motivated, energetic, team-oriented, and experienced Software Engineer for our team based out of our Austin or Las Vegas offices. This role will play a key role in an Agile based software development environment by creating robust platforms and innovative gaming products. The Senior Software Engineer has a high-level of proficiency in software design producing high quality, robust, and maintainable products. This engineer has strong SDLC (Software Development Life Cycle) experience in C#, can mentor junior developers, and is expected to work with little or no supervision. What You'll Do Roles and Responsibilities: Follow a disciplined Agile/Kanban software development process in task estimation, design, development, code reviews, unit/integration testing and defect fixing of products Develop for our latest Platform and challenge your expertise with C#/.NET, architecture and design, and advanced constructs like multi-threading Assists in the overall schedule estimations of product releases Assists other Software Engineers in the estimation of design and development tasks Authors technical design documents for the products Works with senior staff to design code that adheres to the written specifications Initiates and/or participates in peer reviews of code design and written code Documents new/modified code, and develops/automates unit and integration tests to verify the changes Analyzes existing software to debug and troubleshoot field issues that may arise Identifies and proposes software development process improvement initiatives Assists in the technical analysis of potential tools and commercial products Mentors junior Software Engineers in SDLC processes and design/coding patterns Performs all other tasks as assigned What We're Looking For Required Skills and Experience: Bachelor’s Degree in Computer Science/ related field or equivalent experience 8+ years professional software engineering experience Advanced experience in object-oriented programming using C# for Microsoft .NET platform on Windows operating systems Experience in writing multi-threaded desktop applications Knowledge of design/modeling with tools such as UML Proven analytical abilities applied to system design and software implementation Ability to keep up with new technologies/tools, and design techniques and lead adoption of those technologies with the team Excellent communication, planning and organizational skills Ability to work well in a team environment Experience with continuous integration systems Preferred Skills and Experience: Casino gaming or related technology experience Strong working knowledge in one or more of the following: WPF, WCF, LINQ Experience with Windows or Linux Embedded OS Experience in network protocols Experience with automated testing C++ This is a hybrid position that requires 3 days onsite. Office Locations: Austin, Texas Franklin, Tennessee Las Vegas, Nevada Why Aristocrat? Aristocrat is a world leader in gaming content and technology, and a top-tier publisher of free-to-play mobile games. We deliver great performance for our B2B customers and bring joy to the lives of the millions of people who love to play our casino and mobile games. And while we focus on fun, we never forget our responsibilities. We strive to lead the way in responsible gameplay, and to lift the bar in company governance, employee wellbeing and sustainability. We’re a diverse business united by shared values and an inspiring mission to bring joy to life through the power of play. We aim to create an environment where individual differences are valued, and all employees have the opportunity to realize their potential. We welcome and encourage applications from all people regardless of age, gender, race, ethnicity, cultural background, disability status or LGBTQ+ identity. We offer a range of flexible working options through all.flex, our flexible hybrid work model and invite you to have a conversation with us about flexible working. EEO M/F/D/V World Leader in Gaming Entertainment Robust benefits package Global career opportunities Our Values All about the Player Talent Unleashed Collective Brilliance Good Business Good Citizen The US based roles may require registration with the Nevada Gaming Control Board (NGCB) and/or other gaming jurisdictions in which we operate.",https://www.indeed.com/jobs?q=Software+Engineer&l=Austin%2C+TX&sc=0kf%3Aattr%28EXSNN%7CFCGTU%7CHFDVW%7CQJZM9%7CUTPWG%252COR%29explvl%28SENIOR_LEVEL%29jt%28fulltime%29%3B&radius=50&start=10&pp=gQAPAAAAAAAAAAAAAAAB_hQcvAAVAQApedO3Eo4vT2cuwBQr4yqjn0puAAA&vjk=980f334fecd71e7d
12,c57f8bc529ec5041,Software Engineer,"Austin, TX",SENIOR_LEVEL,EXSNN|FCGTU|HFDVW|QJZM9|UTPWG%2COR,fulltime,"eCommerce Senior Software Engineer - job post Calendar Holdings LLC 30 reviews Austin, TX 78744 Full-time Calendar Holdings LLC 30 reviews Read what people are saying about working here. You must create an Indeed account before continuing to the company website to apply Apply on company site save-icon Job details Job Type Full-time eCommerce Senior Software Engineer Who we are: Calendar Holdings, LLC, based in Austin, Texas, is the parent company to several retail brands, including Calendars.com , Go! Games & Toys, and Attic Salt. We are the world’s largest operator of holiday pop-up stores with nearly a thousand stores in malls, outlets, and lifestyle centers across the United States. Established almost 30 years ago, we still operate with a “start-up” mentality where ideas flourish. This is a great opportunity to jumpstart your professional career while getting to work alongside intelligent, like-minded people. Our team is highly collaborative, motivated, nimble, and dedicated to optimize the business . . . not because they have to, but because they want to. We're serious about having fun at work, but our success is built on insight and hard work. We are dedicated to happy employees and nurturing professional growth. As part of our core values, we are committed to the highest standards of ethics and business conduct. These standards are demonstrated in our relationships with customers, supplier, competitors and the communities in which we operate, and with each other, as employees, at every organizational level. We want our employees to embrace our core values of commitment, integrity and openness, while always working as a team to achieve optimum profitability for the company. What we are looking for: Calendars. Com is seeking a dynamic eCommerce Software Engineer who is passionate about reaching objectives and goals. This role will report directly to the VP of IS. The successful candidate must demonstrate strong attention to detail, have excellent organizational skills, and possess in-depth knowledge of eCommerce support. This person will be responsible for the technical operations and oversight of the eCommerce platform for Calendars.com suite of websites. Essential Responsibilities and Duties: Responsible for ensuring that the design & engineering of eCommerce applications lead to a reliable, efficient, and maintainable platform. High degree of focus will be on site availability and performance. Ensure that key operational aspects such as monitoring, DR, documentation, etc. are available, functional and kept up to date. Substantial interaction, coordination and management of key partners and vendors that deliver parts of the eCommerce solution. Management of the eCommerce efforts around security, PCI and ADA compliance. Manage the production releases, approving the application developers code changes and coordinating deployments to stage and production systems. From time-to- time, key off-hours support required during peak periods of the retail calendar, including holidays. Management and coordination of technical activities including capacity planning, certificate management, demand management and others. Provide oversite and guidance for a small team of off site developers. Qualifications: 5–10 years’ experience with high-volume, public facing, transactional web applications with high levels of availability, scalability and resilience. Bachelor’s Degree in computer science or other technical degrees, specialized training, or equivalent work experience preferred. Experience working with multiple vendor’s eCommerce platforms. Kibo Commerce experience is a huge plus. Experience with cloud hosting technologies such as AWS. Experience developing AWS Lambdas a big plus. Experience with RESTful web services, Micro services and Api-First Architecture. Front-end development experience utilizing JavaScript and JS Frameworks. Node.JS preferred. Experience with one or more object oriented programming languages like Java and C# Experience with root-cause analysis and troubleshooting infrastructure issues. Experience with software configuration management tools. Git/Bit Bucket preferred. Ability to work with various stakeholders and effectively communicate tech speak to the non-technical. Benefits and perks: Medical, Dental, Vison, Life Insurance, Short Term & Long Term Disability Employee Assistance Program (EAP) Bonus opportunities Very relaxed dress code Strong 401K Match Job Type: Full-time Supplemental pay types: Bonus pay Ability to commute/relocate: Austin, TX 78744: Reliably commute or planning to relocate before starting work (Preferred) Education: Bachelor's (Preferred) Calendar Holdings is an EEO employer.",https://www.indeed.com/jobs?q=Software+Engineer&l=Austin%2C+TX&sc=0kf%3Aattr%28EXSNN%7CFCGTU%7CHFDVW%7CQJZM9%7CUTPWG%252COR%29explvl%28SENIOR_LEVEL%29jt%28fulltime%29%3B&radius=50&start=10&pp=gQAPAAAAAAAAAAAAAAAB_hQcvAAVAQApedO3Eo4vT2cuwBQr4yqjn0puAAA&vjk=c57f8bc529ec5041
13,f45c7fdba52ab969,Software Engineer,"Austin, TX",SENIOR_LEVEL,EXSNN|FCGTU|HFDVW|QJZM9|UTPWG%2COR,fulltime,"Senior Software Engineer IV - job post TCP 40 reviews Austin, TX • Remote $20 an hour -  Full-time TCP 40 reviews Read what people are saying about working here. Apply now Apply now save-icon Job details Salary $20 an hour Job Type Full-time TCP is hiring a Software Engineer IV to work collaboratively to develop software using modern software development principles and state of the art technologies in a cross functional agile development environment. As a Software Engineer IV you will: Design, Develop, Test, and document cloud hosted web applications. Deliver quality code based on unit and automated acceptance tests. Review, define, analyze, and improve detailed specifications and implement feature development. Ensure that development/integration documentation is adequate, complete, and published. Work on test automation to help ensure fast delivery of quality products. Participate in peer-reviews of code and offer suggestions in line with best-practice design patterns. Mentor junior team members and provide technical leadership. You are a strong fit for this role if you have: Bachelor's Degree in Computer Science, Software Engineering or related field. 4-6+ years of hands-on software development experience with C#, .NET, MS SQL or SQL, Angular, REST API’s, HTML, and CSS Strong expertise in TypeScript and modern JavaScript Experience implementing AWS Cognito across a multi-product portfolio preferred Experience working with other AWS native services Strong experience with git or other modern revision control system A comprehensive understanding of computer science concepts Excellent coding skills Strong communication skills Passion for ingenuity Ability to analyze and solve increasingly complicated problems. Extensive knowledge of Agile and Scrum development methodologies Ability to understand requirements and solve technical issues with minimal supervision About TCP TCP is a leader in cloud-based workforce management and time and labor solutions. For more than 30 years, TimeClock Plus has helped organizations engage their people by providing flexible, mobile timekeeping and workforce management software and employee time tracking devices. TimeClock Plus delivers best-in-class technology and personalized support to organizations of all sizes in the public and private sector to meet their complex timekeeping, employee scheduling, leave management, and other workforce needs. For more, visit www.tcpsoftware.com or follow us on LinkedIn or Facebook. TCP is an equal opportunity employer. We celebrate diversity and are committed to creating an inclusive environment for all employees. * Benefits* Competitive salary based on experience 20 days PTO and 13 days of companywide holidays 8 hours to volunteer and impact the community Comprehensive benefits (Health/Dental/Vision/401K) The work/life set up you need to be successful. Job Type: Full-time Pay: $20.00 per hour If you require alternative methods of application or screening, you must approach the employer directly to request this as Indeed is not responsible for the employer's application process.",https://www.indeed.com/jobs?q=Software+Engineer&l=Austin%2C+TX&sc=0kf%3Aattr%28EXSNN%7CFCGTU%7CHFDVW%7CQJZM9%7CUTPWG%252COR%29explvl%28SENIOR_LEVEL%29jt%28fulltime%29%3B&radius=50&start=10&pp=gQAPAAAAAAAAAAAAAAAB_hQcvAAVAQApedO3Eo4vT2cuwBQr4yqjn0puAAA&vjk=f45c7fdba52ab969
