,job_id,job_title,location,experience,education,job_type,job_description,job_link
14,c4cb5022147a7dd6,Software Engineer,"Austin, TX",SENIOR_LEVEL,EXSNN|FCGTU|HFDVW|QJZM9|UTPWG%2COR,fulltime,"Sr Software Developer - job post Citizens Inc 33 reviews Austin, TX Full-time Citizens Inc 33 reviews Read what people are saying about working here. You must create an Indeed account before continuing to the company website to apply Apply on company site save-icon Job details Job Type Full-time Job Description: Senior Software Developer Citizens Inc. is seeking a Senior Software Developer (full stack). The successful applicant will write new code for enhancements and new features for our web portals, internal applications, APIs, and reports/reporting system, provide support and maintenance fixes as needed, and assist in the design and execution of changes to make the system more flexible and responsive to the changing needs of the business. The Senior Software Engineer will be responsible for working cross-functionally with other developers, business analysts, project managers, management, and business stakeholders to design, document, and develop new features, enhancements, file feeds, reports, and integrations to meet the needs of the business. To be successful in this role, you should have a solid knowledge of and experience with SQL Server, C#, .NET, data design, SSRS. Knowledge/experience in Angular, the Ionic platform, SSIS, Azure, and Service Oriented Architecture design principles a definite plus. You should be self-motivated, results-driven, have excellent communication skills, and be willing, able, and excited by the opportunity to help us transform our business. A working knowledge of life insurance and a desire to learn is strongly preferred. Essential Job Duties: Design and develop code for enhancements and new features for our web portals, internal applications, APIs, and reports/reporting system Provide support and maintenance fixes as needed Participate in requirements and design reviews and provide input on requirements, design, and potential problems Unit testing and bug fixes Create system and technical documentation as needed Ability to work with autonomy in a fast-paced environment and a strong sense of accountability as well as a proven track record of delivering results Strong attention to detail, goal oriented. Must be able to effectively manage multiple activities and/or projects concurrently. Coordinate with the Project Manager and project stakeholders on project timelines, requirements, and stakeholder feedback on suitability and usability of software designs and systems Minimum Qualifications: 5+ years of experience in SQL Server, C#/.NET, and software development Working knowledge of programming and the software development process Good organizational skills, a detail-oriented mindset, and strong critical-thinking skills Solid understanding and experience in SDLC and Project Methodologies (Agile, SCRUM, Waterfall etc.) Solid written and verbal communication skills Proven ability to work creatively and analytically in a problem-solving scenario Able to comprehend new concepts, ask pertinent questions, execute and document ideas and concepts with minimal day-to-day direction Preferred Qualifications: 1. Bachelor™s Degree in Information Systems, Computer Science, or a related major 2. A working knowledge of life insurance 3. Working knowledge/experience with any of the following technologies: SSRS, SSIS, Angular, Ionic Framework 4. Experience with SaaS platforms, Cloud hosting, ERP systems and Custom development solutions hosted on-premise or in the Cloud 5. Fluency in Spanish and/or Mandarin.",https://www.indeed.com/jobs?q=Software+Engineer&l=Austin%2C+TX&sc=0kf%3Aattr%28EXSNN%7CFCGTU%7CHFDVW%7CQJZM9%7CUTPWG%252COR%29explvl%28SENIOR_LEVEL%29jt%28fulltime%29%3B&radius=50&start=10&pp=gQAPAAAAAAAAAAAAAAAB_hQcvAAVAQApedO3Eo4vT2cuwBQr4yqjn0puAAA&vjk=c4cb5022147a7dd6
15,a0f6467ba02e20a2,Software Engineer,"Austin, TX",SENIOR_LEVEL,EXSNN|FCGTU|HFDVW|QJZM9|UTPWG%2COR,fulltime,"Senior/Lead Software Engineer, EOS Routing (Austin, Nashua NH or 100% Remote) - job post Arista Networks 36 reviews Austin, TX • Remote Full-time Arista Networks 36 reviews Read what people are saying about working here. You must create an Indeed account before continuing to the company website to apply Apply on company site save-icon Job details Job Type Full-time Company Description Arista Networks was founded to pioneer and deliver software-driven cloud networking solutions for large data center storage and computing environments. Arista’s award-winning platforms, ranging in Ethernet speeds from 10M to 400G bits per second, redefine scalability, agility and resilience. Arista has shipped more than 10 million cloud networking ports worldwide with CloudVision and EOS, an advanced network operating system. Committed to open standards, Arista is a founding member of the 25/50GbE consortium. Arista Networks products are available worldwide directly and through partners. At the core of Arista's platform is the Extensible Operating System (EOS™), a ground-breaking network operating system with single-image consistency across hardware platforms, and modern core architecture enabling in-service upgrades and application extensibility. Job Description The EOS Routing team is responsible for developing IP routing protocols (BGP, OSPF, IS-IS, PIM, etc), MPLS signaling protocols (LDP, RSVP, etc ), and DC and SP technologies like VxLAN, Segment Routing and EVPN. This team has broad ownership of developing software for the control plane, software datapath and the hardware abstraction layer (HAL) for managing unicast and multicast routing for IPv4 and IPv6 as part of Arista Extensible Operating System (EOS). This team is also responsible for developing innovative routing features based on programmable RPC/REST APIs, SDK and monitoring of routing state through protocols and streaming telemetry. This is a global team spanning multiple geographies working on cutting edge software that is deployed in the largest Data Center (DC), Cloud provider, Internet/WAN and Service Provider (SP) environments with a constant eye on scale and performance. Arista provides an open Engineering-driven culture which fosters innovation and enables engineers to Learn, Lead and Thrive. Our adoption of modern software tools and processes and strong focus on automation enables our engineers to be amongst the most productive in the industry. Arista's products are purpose built with the scale, performance and quality required to operate in some of the most demanding environments in the industry. This provides engineers the platform and rigor to learn and gain experience in building complex, distributed and scalable software systems. Arista engineers collaborate and work seamlessly across various feature areas to deliver top-notch network solutions. Responsibilities Understand requirements from customers, product managers and field engineers, and write functional specifications Architect, design, develop and maintain Layer 3/Routing protocols, solutions and features using C, C++ and Python Author test plans, build automated tests and infrastructure to test the features. Work with support engineers and customers to troubleshoot and resolve problems in their networks Own all aspects of development and delivery of software Provide technical leadership across features, projects and tools Mentor new and junior engineers to bring them up to speed in Arista's software development environment Work with the System Test Engineers to analyze problems found in their tests and provide fixes for those problems Qualifications BS Computer Science/Electrical Engineering/Computer Engineering + 8 years experience, or MS Computer Science/Electrical Engineering/Computer Engineering + 6 years experience, or Ph.D. in Computer Science/Electrical Engineering/Computer Engineering + 3 years experience, or equivalent work experience Proficiency in C or C++ and Python Software development experience with Linux Understanding and ability to apply software engineering principles Strong problem solving and software troubleshooting skills Strong communication skills and the ability to work in a small team environment Ability to design a solution and implement features independently Hands on experience developing networking or distributed systems software is a plus Knowledge and experience in networking protocols and technologies such as BGP, IS-IS, LDP, OSPF, PIM, RSVP, EVPN, Segment Routing, VPWS, VPLS, LDP Pseudowires is a plus Additional Information All your information will be kept confidential according to EEO guidelines.",https://www.indeed.com/jobs?q=Software+Engineer&l=Austin%2C+TX&sc=0kf%3Aattr%28EXSNN%7CFCGTU%7CHFDVW%7CQJZM9%7CUTPWG%252COR%29explvl%28SENIOR_LEVEL%29jt%28fulltime%29%3B&radius=50&start=20&pp=gQAeAAAAAAAAAAAAAAAB_hQcvAAeAQEBCCCM7KlLhumFxqq_1W-m7ljNWsMHvgJF5O18AAA&vjk=a0f6467ba02e20a2
16,3a0f094db9f285d6,Software Engineer,"Austin, TX",SENIOR_LEVEL,EXSNN|FCGTU|HFDVW|QJZM9|UTPWG%2COR,fulltime,"Principal Software Development Engineer - job post Expedia Group 1,065 reviews Austin, TX 78758 Full-time Expedia Group 1,065 reviews Read what people are saying about working here. You must create an Indeed account before continuing to the company website to apply Apply on company site save-icon Job details Job Type Full-time If you need assistance during the recruiting process due to a disability, please reach out to our Recruiting Accommodations Team through the Accommodation Request form . This form is used only by individuals with disabilities who require assistance or adjustments in applying and interviewing for a job. This form is not for inquiring about a position or the status of an application. Principal Software Development Engineer Expedia Global Payments (EGP) is looking for top engineering talent to help drive the development of our payment platform, seamlessly roll out new payment methods, and continuously improve on our operational excellence and engineering practices. We offer a highly dynamic set of services that enable customers from all over the world to pay for travel in a variety of ways. We build, operate, and improve payment services for Expedia Group's brands, our suppliers (hoteliers, airlines, vacation rental owners/agencies, etc.), and our corporate needs. We do this accurately and at scale, processing over $100 billion payments in 55+ currencies in over 155 countries every year, and across a diverse set of payment options! This opportunity presents great technical challenges and the ability to have a tremendous business impact. Technology and innovation are at the heart of our organization. We provide solutions that reduce the cost of payments and improve performance, scalability, availability, and resiliency. We also provide an abundance of functional support to services in our platform, and the needs are ever-growing, as we adapt to new payment solutions and capabilities. What you'll do: Implementing innovative software solutions for e-commerce systems Be a role model and mentor to your fellow engineers You will get to expand your skills in building highly scalable solutions while influencing others Raising the bar on the overall level of excellence within the team You will also get the opportunity to influence decisions across the technology ecosystem within Expedia Group by being a key domain guide Your input will be critical to the selection of new senior-level hires on the team Who you are: Bachelors in computer science or related technical field;or Equivalent related professional experience 10+ years of Software Development work experience (Java experience strongly preferred) 6+ years creating and supporting Web Services in a high transactional environment 4+ years developing software using Dependency Injection Frameworks First-class communication skills in written and verbal form Proven record in technical mentoring of Software Engineers Critical thinking skills and the ability to produce across your team and beyond Rock solid coding skills Strong Object-Oriented Programming concepts, data structure, algorithms, and system-level programming (including multi-threaded programming) History of building your own automation and reporting tools to provide capabilities around your service Ability to lead code reviews and technical design meetings Proven record in successfully delivering highly available and scalable solutions with large transaction volume on a 24x7 operational cycle Architectural knowledge of designing and developing software in distributed architecture for multi-tier applications High degree of competency within all phases of SDLC - Estimation, Scheduling, Design, Development, Testing and Delivery, and Maintenance Ability to articulate technical design decisions and software implementation in technical forums Knowledge of performance testing, application tuning, and load testing A BS degree in computer science or equivalent experience Prior experience in building and operating services in AWS is preferred Prior experience with e-Commerce systems, Payments Solutions, and Providers is also preferred Experience developing fault-tolerant distributed systems is highly desirable Solid grasp of Agile Software Development mechanics Background in Service Oriented Architecture implementation, service versioning, and backward compatibility The total cash range for this position in Austin is $207,500.00 to $290,500.00. Employees in this role have the potential to increase their pay up to $332,000.00, which is the top of the range, based on ongoing, demonstrated, and sustained performance in the role. Starting pay for this role will vary based on multiple factors, including location, available budget, and an individual’s knowledge, skills, and experience. Pay ranges may be modified in the future. Expedia Group is proud to offer a wide range of benefits to support employees and their families, including medical/dental/vision, paid time off, and an Employee Assistance Program. To fuel each employee’s passion for travel, we offer a wellness & travel reimbursement, travel discounts, and an International Airlines Travel Agent (IATAN) membership.View our full list of benefits. About Expedia Group Expedia Group (NASDAQ: EXPE) powers travel for everyone, everywhere through our global platform. Driven by the core belief that travel is a force for good, we help people experience the world in new ways and build lasting connections. We provide industry-leading technology solutions to fuel partner growth and success, while facilitating memorable experiences for travelers. Expedia Group's family of brands includes: Brand Expedia®, Hotels.com®, Expedia® Partner Solutions, Vrbo®, trivago®, Orbitz®, Travelocity®, Hotwire®, Wotif®, ebookers®, CheapTickets®, Expedia Group™ Media Solutions, Expedia Local Expert®, CarRentals.com™, and Expedia Cruises™. © 2021 Expedia, Inc. All rights reserved. Trademarks and logos are the property of their respective owners. CST: 2029030-50 Employment opportunities and job offers at Expedia Group will always come from Expedia Group’s Talent Acquisition and hiring teams. Never provide sensitive, personal information to someone unless you’re confident who the recipient is. Expedia Group does not extend job offers via email or any other messaging tools to individuals to whom we have not made prior contact. Our email domain is @expediagroup.com. The official website to find and apply for job openings at Expedia Group is careers.expediagroup.com/jobs. Expedia iscommittedto creating an inclusive workenvironmentwith a diverse workforce. All qualified applicants will receive consideration for employment without regard to race, color, religion, gender, gender identity or expression, sexual orientation, national origin, genetics, disability, age, or veteran status. This employer participates in E-Verify. The employer will provide the Social Security Administration (SSA) and, if necessary, the Department of Homeland Security (DHS) with information from each new employee's I-9 to confirm work authorization.",https://www.indeed.com/jobs?q=Software+Engineer&l=Austin%2C+TX&sc=0kf%3Aattr%28EXSNN%7CFCGTU%7CHFDVW%7CQJZM9%7CUTPWG%252COR%29explvl%28SENIOR_LEVEL%29jt%28fulltime%29%3B&radius=50&start=20&pp=gQAeAAAAAAAAAAAAAAAB_hQcvAAeAQEBCCCM7KlLhumFxqq_1W-m7ljNWsMHvgJF5O18AAA&vjk=3a0f094db9f285d6
17,7cde0c87ad9e266c,Software Engineer,"Austin, TX",SENIOR_LEVEL,EXSNN|FCGTU|HFDVW|QJZM9|UTPWG%2COR,fulltime,"Senior Full Stack Software Developer - Remote - job post IMAGINiT Technologies 46 reviews Austin, TX • Remote Full-time IMAGINiT Technologies 46 reviews Read what people are saying about working here. Apply now Apply now save-icon Job details Job Type Full-time Company Description IMAGINiT Technologies , a division of Rand Worldwide, advances the way companies use 3D technology to design, develop, and manage complex engineering projects. As the market leader in North America, we continue to enjoy a great deal of success even in these unprecedented times. Our culture is supportive, dynamic, collaborative, and driven to meet the ever changing needs of our customers and our employees. Job Description We are seeking an innovative, collaborative, Senior Full Stack Software Developer to join our software products group (a group within the company that produces our own software, including IMAGINiT Clarity, IMAGINiT Pulse, and more). We are looking for an experienced technology professional who can quickly grow into a leadership role for web-centric product development within the team, defining the technical direction and approach for existing and new products. As a Senior Software Developer, you will create impact by: Translating product requirements into plans Leading the design, planning and estimation process Establishing technical approach and standards for each product Leading the development effort for the web side of the products Contributing best practices and lessons learned for the team. ABOUT YOU: Development Skills Full stack web developer Develop quality code and deliverables, utilizing best practices and processes Team leadership / product ownership Communicate with stakeholders, and occasionally customers Develop new products and features, but also maintain various existing products Remote Work Ability to work productively in a remote/home environment Ability to collaborate with team members in a primarily-remote team / cross-timezone team You may also be able to work in one of 40+ IMAGINiT offices, if you choose. Hours 40+ hours per week, with a high degree of flexibility. Deadline-driven Occasional travel for industry conferences Travel: 1-2 weeks per year Qualifications WHAT SETS YOU APART? BS in computer science, engineering or mathematics Experience in the Architecture/Engineering/Construction industry Self-starting, energetic, fast learner and motivated individual who works well in a small and distributed environment Ability to work effectively across multiple functions, departments, cultures, geographies and time zones Proven excellence in written & verbal communication & organizational skills Has worked within a small team of developers with source control tools and formalized development methodology. Ability to manage multiple duties and projects. 7+ years as a Full Stack Developer, particularly C# and .NET Experience in javascript frameworks Experience with Blazor Experience with Azure DevOps Experience with using and diagnosing Azure services Additional Information Our employees at IMAGINiT work here because of our vision into the future of technology solutions and our goal in developing higher quality deliverables for existing clients and new markets. We give our employees the ability to create and verbalize their ideas. It is an important part of who we are at IMAGINiT. Those ideas come from collaboration with our customers and subsequent design and deployment, creating a solution that redefines our customer’s future. Join our team of highly creative and innovative individuals who thrive to not only grow IMAGINiT, but also our customer’s business through consultative solution selling. Visit us at http://www.rand.com for more information. We celebrate employment equity and diversity! We encourage applications from all qualified individuals and do not discriminate on the basis of disability, race, ethnicity, religion, gender, sexual orientation, age, veteran status or any other basis protected under federal, state, provincial or local laws. We are committed to providing reasonable accommodations for persons with disabilities. If you require reasonable accommodation during the application process, we will work with you to meet your needs. We thank all applicants in advance for their interest, but only those applicants who are to be considered will be contacted. You must be authorized to work in The U.S. for any employer without company sponsorship If you require alternative methods of application or screening, you must approach the employer directly to request this as Indeed is not responsible for the employer's application process.",https://www.indeed.com/jobs?q=Software+Engineer&l=Austin%2C+TX&sc=0kf%3Aattr%28EXSNN%7CFCGTU%7CHFDVW%7CQJZM9%7CUTPWG%252COR%29explvl%28SENIOR_LEVEL%29jt%28fulltime%29%3B&radius=50&start=20&pp=gQAeAAAAAAAAAAAAAAAB_hQcvAAeAQEBCCCM7KlLhumFxqq_1W-m7ljNWsMHvgJF5O18AAA&vjk=7cde0c87ad9e266c
