,job_id,job_title,location,experience,education,job_type,job_description,job_link
68,cccff7eadd40e1ba,Software Engineer,"Los Angeles, CA",SENIOR_LEVEL,BACHELORS_DEGREE,fulltime,"Sr. .NET Developer - job post Edify Technologies Inc. Irvine, CA 92602 $50 - $60 an hour -  Full-time Apply now Apply now save-icon Job details Salary $50 - $60 an hour Job Type Full-time Bachelor’s Degree in Computer Science or equivalent education required. 8+ years professional experience as Software Developer/Engineer. 3+ years professional experience with C# and .NET. 3+ years professional experience with any of the following languages: JavaScript, jQuery, CSS, HTML, XHTML, C#, SQL and XML 3+ years professional experience working with relational database such as SQL Server, MySQL, etc. 2+ years with REST API. Expert level understanding of CI/CD pipelines, and version control tool such as Git, TFS, etc. Job Type: Full-time Salary: $50.00 - $60.00 per hour Experience level: 8 years Schedule: 8 hour shift Ability to commute/relocate: Irvine, CA 92602: Reliably commute or planning to relocate before starting work (Required) Experience: .NET (Preferred) Work Location: One location If you require alternative methods of application or screening, you must approach the employer directly to request this as Indeed is not responsible for the employer's application process.",https://www.indeed.com/jobs?q=Software+Engineer&l=Los+Angeles%2C+CA&sc=0kf%3Aattr%28FCGTU%7CHFDVW%7CQJZM9%7CUTPWG%252COR%29explvl%28SENIOR_LEVEL%29jt%28fulltime%29%3B&radius=50&start=90&pp=gQCHAAAAAAAAAAAAAAAB_jANOQA7AQEBEQJtnedp-ZkSUFtWbNU3VTWvvFyN7QtbZ6yMoHWMob1UrDCELPRtlAsyR12XbT9ZiN_G4czrhI8AAA&vjk=cccff7eadd40e1ba
69,52f0deb2ff1ed30f,Software Engineer,"Los Angeles, CA",SENIOR_LEVEL,BACHELORS_DEGREE,fulltime,"Senior C# .NET Developer - job post dot818 LLC Glendale, CA 91203 Full-time Apply now Apply now save-icon Job details Job Type Full-time Job description Do you find yourself searching for a truly unique working environment? Do you have a go-getter attitude? Well, are you ready to take on a new challenge? We have an exciting opportunity for a full-time Senior C# .NET Developer to join Dot818’s growing team! We’re looking for a special kind of candidate – someone who appreciates challenging projects, is comfortable working with a supportive team, and hungers for the freedom to think outside of the box. We also want you to care about our core values too. We have a deep commitment to success, we build strong relationships through tenacious effort, and we keep a firm focus on our client’s needs. If this sounds like your dream job, take the first step toward joining our team and apply now with your resume. Responsibilities Develop high-quality APIs and implement new architecture as needed. Develop and maintain an internal MVC web portal. Identify, prioritize, and execute tasks in the software development life cycle Develop automated tests and create unit tests through appropriate tools and scripting Peer code reviews Collaborate with an internal team of front end developers, backend developers, and quality assurance team to implement requirements Ensure code is adhering to necessary security standards Monitor infrastructure and identify issues Follow the Agile Scrum framework Required Skills Proven experience as a Senior Software Engineer 5+ years’ experience with .Net using C# Experience with Entity Framework Knowledge of relational databases Analytical mind with problem-solving aptitude Ability to work independently Excellent organizational and leadership skills BS/BA in Computer Science or a related degree Desired Skills REST API .Net core Microsoft Azure Entity Framework MVC TDD Experience in the Financial industry is a plus Problem-solving and Mathematics education is a plus Benefits and Perks 401(k) and employee health and wellness benefits Paid time off (PTO) Company-sponsored gym membership Company-provided parking Luncheons, outings, after-hour events, and team-building festivities Casual Fridays and paid company holidays Opportunities to travel for conferences Healthy selection of free snacks, drinks, fresh brewed organic coffee, and breakfast options Employee discounts (ex: theme parks, hotels, etc.) Onsite game room Last, but not least, you will get to work with an amazing group of people! Location: Glendale, California (Required) Job Type: Full-time If you have the experience, drive to succeed and have a can-do attitude then we are looking for you. Click apply and come join a fast-growing technology company! Employment Type Full-time If you require alternative methods of application or screening, you must approach the employer directly to request this as Indeed is not responsible for the employer's application process.",https://www.indeed.com/jobs?q=Software+Engineer&l=Los+Angeles%2C+CA&sc=0kf%3Aattr%28FCGTU%7CHFDVW%7CQJZM9%7CUTPWG%252COR%29explvl%28SENIOR_LEVEL%29jt%28fulltime%29%3B&radius=50&start=90&pp=gQCHAAAAAAAAAAAAAAAB_jANOQA7AQEBEQJtnedp-ZkSUFtWbNU3VTWvvFyN7QtbZ6yMoHWMob1UrDCELPRtlAsyR12XbT9ZiN_G4czrhI8AAA&vjk=52f0deb2ff1ed30f
70,7944dceceda4e94d,Software Engineer,"Los Angeles, CA",SENIOR_LEVEL,BACHELORS_DEGREE,fulltime,"Senior C++ Engineer - job post Masimo 180 reviews Irvine, CA Full-time Masimo 180 reviews Read what people are saying about working here. You must create an Indeed account before continuing to the company website to apply Apply on company site save-icon Job details Job Type Full-time As a Senior Software Engineer you will design, develop, and implement applications for our next generation handheld patient monitoring devices. The selected candidate will develop the user interface working closely with our UX designers to develop the framework for our devices. Day to day: Develop UI frameworks for the interface of our medical devices Work closely with our UX designers to develop the framework Design, Implementation and Maintenance of Software Software Documentation Software Specification and Testing Requirements: 7+years of C++ software development experience Experience with graphical user interface (GUI) design & development Excellent conceptual, analytical, and problem-solving abilities Experience with software configuration management Strong knowledge of operating system concepts (scheduling, memory management, multi-threading) Ability to excel in a fast paced and dynamic work environment. Excellent verbal and written communication skills BS or MS degree in Computer Science or Engineering Preferred Qualifications: Qt Graphic Framework Computer Graphics library (OpenGL, DirectX, etc.) Mobile application development Scripting languages (JavaScript, etc.) The anticipated range for this position is $114,000 - $170,000. Actual placement within the range is dependent on multiple factors, including but not limited to skills, education, and experience.",https://www.indeed.com/jobs?q=Software+Engineer&l=Los+Angeles%2C+CA&sc=0kf%3Aattr%28FCGTU%7CHFDVW%7CQJZM9%7CUTPWG%252COR%29explvl%28SENIOR_LEVEL%29jt%28fulltime%29%3B&radius=50&start=90&pp=gQCHAAAAAAAAAAAAAAAB_jANOQA7AQEBEQJtnedp-ZkSUFtWbNU3VTWvvFyN7QtbZ6yMoHWMob1UrDCELPRtlAsyR12XbT9ZiN_G4czrhI8AAA&vjk=7944dceceda4e94d
71,3eedffce42ec4666,Software Engineer,"Los Angeles, CA",SENIOR_LEVEL,BACHELORS_DEGREE,fulltime,"Director Enterprise Transformation PHP - job post Providence Health Plan Irvine, CA 92604 Full-time You must create an Indeed account before continuing to the company website to apply Apply on company site save-icon Job details Job Type Full-time Description PHP is dedicated to continually transforming, striving to set the pace for the healthcare plan industry in pursuit of the PHP and PHS vision of “Health for a Better World”. The Director of Enterprise Transformation, reporting to the AVP of Transformation Program Strategy, is responsible for imagining what it will take to continually pursue the PHP vision and facilitate the methodologies and processes to achieve success. At a specific level, the Director is responsible for: supporting executive leaders in establishing an adaptive strategic plan and framework to establish the ‘north star’, anchor decision making, and drive results. supporting corporate-level governance and cross-functional processes and forums for efficiency and effectiveness of transformational activities. managing the transformation agenda, transformation initiative roadmaps, cross-enterprise teams supporting initiatives, and executing successful delivery of transformational projects through the planning, execution and closure phases. This position is directly responsible for the following functional departments: Transformation Strategy and Planning, Transformation Business Requirements and Management, Business Analytics, and Business Process Improvement. The successful candidate is expected to be a visionary leader, who provides thought leadership to the AVP of Transformation Program Strategy, Sr. Leaders, and the members of the Executive Leadership Team throughout the end-to-end transformational process. This position relies on a matrix of executives and function leaders that serve as project sponsors and business owners. Thus, the successful candidate must quickly form strategic relationships with key executives and individual contributors across the organization, bringing the right capabilities togethers to enable alignment, and realize expansion, growth, and value. ESSENTIAL FUNCTIONS Overall Management Responsibilities: Leads with a social justice orientation in alignment with Providence Health Plan mission and values, fostering a sense of belonging and commitment to a diverse staff and organization. Lives out the highest levels of integrity every day and expects the same for the organization. Behaves in a manner consistent with PHP policies and promotes the mission and values of PHP. Leads a virtual / hybrid team of Program Managers and transformational resources from impacted functions, including Plan Operations (i.e., Enrollment, Configuration, Claims), Medical Policy and Utilization Management, Healthcare Experience & Advocacy Delivery, and Finance Collaborates with the executive leadership team and other core leaders to identify interdependencies and ensure workstreams maintain continuous alignment with scope and objectives. Works with the team to identify and resolve issues and problems affecting their area and provides them with counsel, guidance, and direction as appropriate to foster a culture of empowerment. Attracts, develops, and retains talent to create high-performing teams. Establishes positive working relationships with vendors and other business entities throughout Providence Health Plan and Providence St Joseph Health Identifies key capital needs and develops and manages annual operating budget as appropriate. Core Functional Competencies Drives the end-to-end delivery of a large-scale transformation events and organizational change management across the enterprise. Accountable for successful design, build, testing, and deployment / go-live and associated project timelines, key milestones, and communication of project status to senior leadership. Oversees and manages program scope across all impacted functions, ensuring transformation events deliver according to the project charter and task order and adheres to stated business objectives / requirements. Defines the scope of transformational events architectural design / upgrade, considering implications on technical and business process designs. Defines key outcomes of transformational events and oversees the progression and achievement of these outcomes throughout the process. Oversees project change requests / documents amendments to scope changes. Leads a team of Program Managers, Data Analysts, and cross-functional transformation resources. Directs the timing and prioritization of tasks to transformational event teams. Provides guidance on resolving issues / roadblocks and constraints / dependencies, with support of functional leadership, to successful re-implementation. Oversees and provides guidance on implementation timeline, resource plans, and cost plans to ensure that project objectives and business outcomes drive the intended change across the organization. Manages and provides guidance on project communication plans to ensure impacted teams, internal / external stakeholders, and sponsors are informed of project accomplishments, status, health, risks and issues; and responds to the needs of impacted stakeholders. Establishes and oversees guardrails and processes to ensure that transformation events processes are performed in a coordinated, structured, tested, and well documented manner to maintain ongoing critical business operations across the organization. Oversees and anticipates potential program delays, risks, and dependencies and drives accountability with impacted stakeholders. Ensures impacted stakeholders develop and deliver mitigation plans as needed. Oversees the tracking and reporting of resource constraints and project costs against budgetary requirements. Drive adherence to regulatory requirements associated with transformational activity / ongoing project maintenance. Performs other duties as assigned. QUALIFICATIONS Bachelor's Degree in any relevant field; or equivalent experience Master's degree in business administration, Healthcare Administration, Public Health, or a related field; or equivalent experience Completion of advanced-level educational program in business process improvement, project management, change and transition management, or equivalent experience. 7+ years of work experience in health care, preferably in an integrated health system, health plan, hospital, or public health setting 7+ years of recent health plan/payor leadership experience 7+ years of leadership or management experience consistent with the duties described. 7+ years of demonstrated experience with program planning and execution. 7+ years of experience with organizational development and change and transition management. Demonstrated visionary and thought leader. Uncanny ability to solve tough problems, manage ambiguity, and navigate paradox. Establishes a team culture that looks to disrupt, improve, and evolve ways of working when it is necessary. Identify gaps in the market and spots opportunities to create value propositions. Continuously scans the landscape for best practices that yield market-differentiated solutions. Experience partnering with senior executives on business planning and optimization. Ability to lead meaningful change. Exhibits high emotional intelligence and prefers to work in a collaborative team-based environment. Ability to manage in a complex matrix environment. Capable of managing cross-functional initiatives and balancing extensive data and detail Strong analytical skills, problem solving tools/methods. Possesses the ability to establish / maintain relationships with a variety of business and health care executives while collaborating across multiple functional areas, businesses and organizations. Demonstrates the ability to lead and work within virtual/hybrid team settings, and to influence senior stakeholders during times of significant change, transition, complexity, and ambiguity. Is highly detail-oriented, independent, and self-directed with demonstrated strategic thinking and sound business judgment to account for the complexities of large-scale initiatives. Possesses the ability to balance multiple projects simultaneously while maintaining the ability to exercise rapid business acumen and judgment to support effective real time decisions as urgent and emergent needs arise. Possesses the ability to inspire and motivate managers to build and grow high-performing teams. Has a nuanced understanding of complexities of the healthcare industry, health plan dynamics / operations. Has knowledge of core health plan operational functions and their interdependencies (e.g., claims, benefits, enrollment, billing) Has basic experience with Facets core administrative platform in a project management and / or implementation role. Has strong business acumen. Demonstrates project management skills with an ability to implement multiple, large-scale and complex, cross-functional projects simultaneously. Ability to work under pressure and in time-sensitive environments. Possesses a high level of creativity and problem-solving skills to resolve unexpected issues in real-time as they arise. Possesses proven ability to handle end-to-end platform migration / implementation starting from platform assessment to platform selection and deployment. Demonstrates the ability to develop and present executive level reports and presentations. Ability to persuade and influence cross-functional stakeholders, and senior executives. Exhibits high emotional intelligence, prefers to work in a collaborative team-based environment across internal departments and possesses the ability to build rapport and credibility with business leaders. About Providence At Providence, our strength lies in Our Promise of “Know me, care for me, ease my way.” Working at our family of organizations means that regardless of your role, we’ll walk alongside you in your career, supporting you so you can support others. We provide best-in-class benefits and we foster an inclusive workplace where diversity is valued, and everyone is essential, heard and respected. Together, our 120,000 caregivers (all employees) serve in over 50 hospitals, over 1,000 clinics and a full range of health and social services across Alaska, California, Montana, New Mexico, Oregon, Texas and Washington. As a comprehensive health care organization, we are serving more people, advancing best practices and continuing our more than 100-year tradition of serving the poor and vulnerable. The amounts listed are the base pay range; additional compensation may be available for this role, such as shift differentials, standby/on-call, overtime, premiums, extra shift incentives, or bonus opportunities. Check out our benefits page for more information about our Benefits and Rewards. Requsition ID: 167591 Company: Providence Jobs Job Category: Strategy & Planning Job Function: Administration Job Schedule: Full time Job Shift: Day Career Track: Leadership Department: 5018 GA OTHER OR REGION Address: OR Portland 4400 NE Halsey St Pay Range: $73.31 - $121.88 The amounts listed are the base pay range; additional compensation may be available for this role, such as shift differentials, standby/on-call, overtime, premiums, extra shift incentives, or bonus opportunities. Check out our benefits page for more information about our Benefits and Rewards. Providence is proud to be an Equal Opportunity Employer. Providence does not discriminate on the basis of race, color, gender, disability, veteran, military status, religion, age, creed, national origin, sexual identity or expression, sexual orientation, marital status, genetic information, or any other basis prohibited by local, state, or federal law.",https://www.indeed.com/jobs?q=Software+Engineer&l=Los+Angeles%2C+CA&sc=0kf%3Aattr%28FCGTU%7CHFDVW%7CQJZM9%7CUTPWG%252COR%29explvl%28SENIOR_LEVEL%29jt%28fulltime%29%3B&radius=50&start=90&pp=gQCHAAAAAAAAAAAAAAAB_jANOQA7AQEBEQJtnedp-ZkSUFtWbNU3VTWvvFyN7QtbZ6yMoHWMob1UrDCELPRtlAsyR12XbT9ZiN_G4czrhI8AAA&vjk=3eedffce42ec4666
72,f816d7a4f2e23982,Software Engineer,"Los Angeles, CA",SENIOR_LEVEL,BACHELORS_DEGREE,fulltime,"Director, Software Engineering - job post Guitar Center 1,645 reviews Westlake Village, CA 91362 $145,800 - $182,200 a year -  Full-time Guitar Center 1,645 reviews Read what people are saying about working here. You must create an Indeed account before continuing to the company website to apply Apply on company site save-icon Job details Salary $145,800 - $182,200 a year Job Type Full-time Description PURPOSE OF THE JOB Lead the architecture, design, build, and operation of scalable enterprise-grade software platforms in an omni-channel retail environment. We are looking for a transformational software engineering leader that can drive adoption of best-practices and development using modern, full-stack technologies to develop new capabilities and transform legacy enterprise systems. RESPONSIBILITIES/DUTIES 10+ years of experience in various areas of full stack software development including – web front end, back end, databases, data analytics, dev-ops, with prior hands-on coding Deep technical domain expertise in Direct-to-Consumer (DTC), eCommerce / Digital, Business-to-Business (B2B), and marketplaces in a multi-tenant, Retail / Omni-channel environment is required. Lead our Digital Innovation Labs. Provide technical direction for future-state architecture across development teams, multiple product lines, and enterprise-level software applications Lead Rapid Prototyping of emerging technologies (Apache Pinot, React, Swift, Node.js, Java). Analyze industry/market trends to assist in project development & operational support. Lead transformation to microservices / headless architectures and containerized applications. Lead Architecture Review Board (ARB). Create & validate reference architectures, POCs, and evangelize design patterns & technical / operational best practices for digital solutions. Including DevOps, Security Manage portfolio of customer facing applications (web & mobile) for Web, Lessons, and Retail associate applications Design, develop, and operate existing software platforms: web-ops, app-ops, metrics-driven operational dashboards/alerting Lead team of at least 8 top notch developers. Experience building and retaining high performance teams and leading global software engineering teams. Excellent project management/leadership required to create and deliver on the roadmap. Additional duties as assigned. Working hours may extend beyond the typical workday as required. MINIMUM REQUIREMENTS & SPECIAL ATTRIBUTES Bachelor’s Degree in a Computer Science/Engineering, STEM (science, technology, engineering, math), or other related field (or 7 years of equivalent work experience) Experience leading software engineering teams in a Product & SAFe environment Direct implementation and/or operational experience with one or more of the following: o JS, TypeScript, Python, Golang, Java Spring Boot, React, jQuery, Node.js, o Cloud Computing – AWS, GCP, Azure o Databases – SQL, NoSQL o DevOps – Jenkins, Ansible, Chef, Puppet o WebOps / AppOps / Monitoring / Alerting – New Relic, Dynatrace, Splunk, AppDynamics o Containerization – Docker, Swarm, Kubernetes, AWS ECR Why Guitar Center? Here's just some of the rewards: For our employees who are musicians we offer the unique opportunity of gig leave-take time off to share your music with the world and return to your job after your tour! Guitar Center offers robust benefits and perks, including Medical, Dental, Vision, 401K plus company match, mental health support, paid sick/holiday/vacation time, employee discount program, and tuition reimbursement options. Pay Rate: $145,800- $182,200/yr depending on background and experience. This position is eligible to participate in the Guitar Center Company bonus program based on Company performance. The job posting is not necessarily reflective of actual compensation that may be earned, nor a promise of any specific pay for any specific employee, which is always dependent on actual experience, education, and other factors. The pay range(s) listed are provided in compliance with state specific laws. Pay ranges may be different in other locations. The job posting is not necessarily reflective of actual compensation that may be earned, nor a promise of any specific pay for any specific employee, which is always dependent on actual experience, education, and other factors. The pay range(s) listed are provided in compliance with state specific laws. Pay ranges may be different in other locations.",https://www.indeed.com/jobs?q=Software+Engineer&l=Los+Angeles%2C+CA&sc=0kf%3Aattr%28FCGTU%7CHFDVW%7CQJZM9%7CUTPWG%252COR%29explvl%28SENIOR_LEVEL%29jt%28fulltime%29%3B&radius=50&start=90&pp=gQCHAAAAAAAAAAAAAAAB_jANOQA7AQEBEQJtnedp-ZkSUFtWbNU3VTWvvFyN7QtbZ6yMoHWMob1UrDCELPRtlAsyR12XbT9ZiN_G4czrhI8AAA&vjk=f816d7a4f2e23982
