,job_id,job_title,location,experience,education,job_type,job_description,job_link
4,b0b69952ce50551e,Software Engineer,"Austin, TX",SENIOR_LEVEL,EXSNN|FCGTU|HFDVW|QJZM9|UTPWG%2COR,fulltime,"Senior Software Engineer (Remote) - job post PlayQ Austin, TX • Remote Full-time You must create an Indeed account before continuing to the company website to apply Apply on company site save-icon Job details Job Type Full-time About Us: PlayQ is a rapidly growing global entertainment and technology company delivering high-quality mobile titles and innovative game development solutions to a worldwide audience. Our games have been downloaded more than 60 million times across the globe, with millions of users playing every day! Our dedicated teams, based in downtown Santa Monica, CA, work together to craft the clever, visually stunning, and unforgettable experiences that our players love. Our emphasis on individual leadership means each team member has the opportunity to make a big impact, while our commitment to creative freedom gives them the ability to create whatever they can imagine. It's this mindset that has led us to develop our own IP, infuse games with rich storytelling, build our own development tools, and solve the deepest technical challenges - all in the name of disrupting the mobile gaming landscape. Why you'll want to come to work: Our Senior Software Engineer role offers a unique opportunity to contribute to the development of our current and future mobile titles. As an integral part of our Engineering team, you will help extend our game development framework while also designing, implementing, and maintaining software systems and game features across multiple titles. You will work in close collaboration with, and provide technical guidance to, the Production, Art, Design, Product, and Quality Assurance teams. Our ideal candidate is a passionate programmer with strong coding fundamentals, experience shipping titles using the Unity platform, and a drive to push projects to quality completion. What you'll get to create: Participate in the full software development lifecycle of our products and tech stack, including software design, coding, debugging, and delivering new features, support systems, and frameworks for our current and future mobile titles. Design robust and extensible software architecture Implement highly performant features. Partner with our Production team to align on task estimates and schedules, and then complete projects on time and within budget. Proactively seek technical solutions to improve sprint velocity and product quality. Create and refactor engineering tools and processes to increase team effectiveness. Be a strong voice for software quality, future-proofing, and technical performance metrics such as framerate and memory allocation. Surface and advocate for technical needs to aid leadership in balancing against other business needs. Support, mentor, and help develop expertise in other engineers. Identify technical requirements of upcoming game features. Communicate with management, team leads, and other engineers regarding programming needs and performance. What you'll bring to the team: B.S. in Computer Science, or equivalent experience 6+ years game development experience Experience working on multiple Android and/or iOS applications while publishing at least one Solid understanding of Agile development, continuous integration systems, games-as-a-service, and source control Expertise in C#, object oriented programming, asynchronous programming, and component oriented architectures Experience with Unity, including non-game loop features such as addressables, shaders, particle systems, and editor tool creation A habit of writing super-clean, encapsulated, testable, and well documented code A desire to work very closely with a small, high-energy team of designers, QA, and programmers Self-motivated with a strong desire to learn and stay up with industry changes and new technologies Ability to work on fixed deadlines A strong commitment to stability, performance, & outstanding user experience Proactively supports colleagues in meeting their objectives, regardless of department Bonus Points: Experience using mobile platform native features Experience implementing and/or creating native iOS and Android plugins for Unity If you gotten this far, we hope you're feeling excited about this role. Even if you don't feel you meet every single requirement, we still encourage you to apply. We're eager to meet people who believe in PlayQ's mission and can contribute to our team in a variety of ways—not just candidates who check all the boxes. What we can offer you: Competitive compensation and equity options Comprehensive medical, dental, vision, life, long term disability & pet insurance Flexible time off Unmatched learning opportunities and mission driven team Advancement and mentorship opportunities 401K plan with company match Flexible Workplace: PlayQ's workplace includes a combination of both in-office, hybrid and remote roles. Our flexible approach to the workplace experience, internal comms, and tech stack promote collaboration, communication, and camaraderie! Brand new creative office space equipped with tons of natural light, communal areas for collaboration and free parking Walking distance to restaurants, coffee shops, and the metro Stocked kitchen with snacks and beverages Monthly team building events and cross departmental lunches Help build and support awesome GAMES. For a living! Who doesn't love games? At PlayQ, we leverage competitive benchmarking data when setting each role's base pay range. Individual base salary will be determined based on job-related factors which may include knowledge, skills, experience, scope of role, business need and geographic location. The estimated base pay range for this role is listed below. $115,000-$160,000 USD Additional information: In-office location: Santa Monica, CA This role is open to remote employees located in select US states including California, Washington, Nevada, Texas, Florida, Pennsylvania, New York. This role is offered as a full time position.",https://www.indeed.com/jobs?q=Software+Engineer&l=Austin%2C+TX&sc=0kf%3Aattr%28EXSNN%7CFCGTU%7CHFDVW%7CQJZM9%7CUTPWG%252COR%29explvl%28SENIOR_LEVEL%29jt%28fulltime%29%3B&radius=50&start=10&pp=gQAPAAAAAAAAAAAAAAAB_hQcvAAVAQApedO3Eo4vT2cuwBQr4yqjn0puAAA&vjk=b0b69952ce50551e
5,2cf88c67855bf5ea,Software Engineer,"Austin, TX",SENIOR_LEVEL,EXSNN|FCGTU|HFDVW|QJZM9|UTPWG%2COR,fulltime,"Principal Software Quality Engineer - job post Expedia Group 1,065 reviews Austin, TX 78758 Full-time Expedia Group 1,065 reviews Read what people are saying about working here. You must create an Indeed account before continuing to the company website to apply Apply on company site save-icon Job details Job Type Full-time If you need assistance during the recruiting process due to a disability, please reach out to our Recruiting Accommodations Team through the Accommodation Request form . This form is used only by individuals with disabilities who require assistance or adjustments in applying and interviewing for a job. This form is not for inquiring about a position or the status of an application. Principal Software Quality Engineer At Expedia, we believe in helping millions of travelers find their perfect vacation or getaway.We are building a world class quality engineering organization for the next generation Technology Platform that empowers our travelers and partners to leverage and configure products and services needed to succeed in the travel ecosystem. Are you a Software Quality Engineer passionate about technology and in providing customers with the very best experience? Do you enjoy sharing knowledge and mentoring others? Then the Quality Engineering team is looking for you! As a Principal Quality engineer, you will play a critical role in creating quality engineering solutions of significant scope and importance to ensure that all externalized capabilities operate as expected and provide a delightful experience to Expedia’s customers. What you'll do: Be a key contributor to the Data Quality function and provide technical leadership to all quality processes Influence and build-in quality in all phases of the Software Development Life Cycle Architect, design and develop automation frameworks, quality tools including ML/AI/data validation solutions, dashboards and automation that enable fast-cycle small release development processes Platform certification through automation, and continuous improvement of the reliability of APIs and experiences delivered Participate in product development to ensure early detection of defects Lead collaboration with key stakeholders and contribute subject matter expertise to develop unique solutions to complex issues Use your professional experience to resolve complex issues and achieve quality goals creatively and effectively Influence quality best practices, and adoption of quality vision, strategy, process, standards, tools, automation frameworks and solutions Enable the team to execute all the required types of tests Coach the team on testing methodologies and automating all types of automatable tests and meet the release criteria. Help create a high-quality testing culture Influence quality best practices and shift left for early detection and resolution of defects Who you are: Bachelor's or Masters degree in a related technical field; or Equivalent related professional experience 10+ years relevant work experience Experienced in innovating, architecting, designing and developing test automation frameworks and quality tools including ML/AI/data validation solutions that increase the velocity, quality and efficiency of testing Experienced in QA processes, building in quality in all phases of the product life cycle, test automation and execution of all types functional and non-functional tests Technical lead with Quality mind-set, ability to lead and coach teams on quality engineering best practices, methodologies, solutions and large scale E2E testing across multiple teams Experienced with identifying, leveraging and influencing industry standard and leading-edge technologies in quality engineering to improve test automation techniques Able to test, monitor, debug, fix issues within established SLAs, using testing and monitoring tools Experienced with REST APIs, ML, AI, Data pipelines, CICD, Java and NoSQL technologies The total cash range for this position in Austin is $207,500 to $290,500. Employees in this role have the potential to increase their pay up to $332,000, which is the top of the range, based on ongoing, demonstrated, and sustained performance in the role. The total cash range for this position in Seattle is $207,500 to $290,500. Employees in this role have the potential to increase their pay up to $332,000, which is the top of the range, based on ongoing, demonstrated, and sustained performance in the role. The total cash range for this position in San Francisco is $228,500.00 to $320,000.00. Employees in this role have the potential to increase their pay up to $365,500.00, which is the top of the range, based on ongoing, demonstrated, and sustained performance in the role. Starting pay for this role will vary based on multiple factors, including location, available budget, and an individual’s knowledge, skills, and experience. Pay ranges may be modified in the future. Expedia Group is proud to offer a wide range of benefits to support employees and their families, including medical/dental/vision, paid time off, and an Employee Assistance Program. To fuel each employee’s passion for travel, we offer a wellness & travel reimbursement, travel discounts, and an International Airlines Travel Agent (IATAN) membership.View our full list of benefits. About Expedia Group Expedia Group (NASDAQ: EXPE) powers travel for everyone, everywhere through our global platform. Driven by the core belief that travel is a force for good, we help people experience the world in new ways and build lasting connections. We provide industry-leading technology solutions to fuel partner growth and success, while facilitating memorable experiences for travelers. Expedia Group's family of brands includes: Brand Expedia®, Hotels.com®, Expedia® Partner Solutions, Vrbo®, trivago®, Orbitz®, Travelocity®, Hotwire®, Wotif®, ebookers®, CheapTickets®, Expedia Group™ Media Solutions, Expedia Local Expert®, CarRentals.com™, and Expedia Cruises™. © 2021 Expedia, Inc. All rights reserved. Trademarks and logos are the property of their respective owners. CST: 2029030-50 Employment opportunities and job offers at Expedia Group will always come from Expedia Group’s Talent Acquisition and hiring teams. Never provide sensitive, personal information to someone unless you’re confident who the recipient is. Expedia Group does not extend job offers via email or any other messaging tools to individuals to whom we have not made prior contact. Our email domain is @expediagroup.com. The official website to find and apply for job openings at Expedia Group is careers.expediagroup.com/jobs. Expedia iscommittedto creating an inclusive workenvironmentwith a diverse workforce. All qualified applicants will receive consideration for employment without regard to race, color, religion, gender, gender identity or expression, sexual orientation, national origin, genetics, disability, age, or veteran status. This employer participates in E-Verify. The employer will provide the Social Security Administration (SSA) and, if necessary, the Department of Homeland Security (DHS) with information from each new employee's I-9 to confirm work authorization.",https://www.indeed.com/jobs?q=Software+Engineer&l=Austin%2C+TX&sc=0kf%3Aattr%28EXSNN%7CFCGTU%7CHFDVW%7CQJZM9%7CUTPWG%252COR%29explvl%28SENIOR_LEVEL%29jt%28fulltime%29%3B&radius=50&start=10&pp=gQAPAAAAAAAAAAAAAAAB_hQcvAAVAQApedO3Eo4vT2cuwBQr4yqjn0puAAA&vjk=2cf88c67855bf5ea
6,1e10cb8bfee39af7,Software Engineer,"Austin, TX",SENIOR_LEVEL,EXSNN|FCGTU|HFDVW|QJZM9|UTPWG%2COR,fulltime,"Sr. software engineer (Embedded) - job post DiamondPick Austin, TX 78701 $90,000 - $150,000 a year -  Full-time, Contract Apply now Apply now save-icon Job details Salary $90,000 - $150,000 a year Job Type Full-time Contract Qualification Requirements: Bachelor’s degree in computer science or equivalent working knowledge of object-oriented programming languages. 8+ years of software development experience within Windows environments C# and .NET Core coding experience using Visual Studio IDE Strong object-oriented and multi-threading programming skills Strong knowledge with design patterns Team player and self-starter with minimal supervision Ability to effectively communicate with others, both verbally and in writing Preferred Qualifications: Real-time embedded development experience, preferably in Windows CE / IoT environment TCP/IP socket, serial communication, USB, video/audio development experience Comfortable working with hardware simulators and tools for software development Payment software development experience, such as PCI, P2PE, and EMV, is a huge plus Fleet software development experience is a plus SignalR and RabbitMQ experience is a plus Familiar with front end technologies such as Angular / HTML5 / React Experience working with one virtualization technology (Docker / Kubernetes / VMWare) Job Types: Full-time, Contract Salary: $90,000.00 - $150,000.00 per year Benefits: 401(k) Dental insurance Schedule: 8 hour shift Monday to Friday Work Location: One location If you require alternative methods of application or screening, you must approach the employer directly to request this as Indeed is not responsible for the employer's application process.",https://www.indeed.com/jobs?q=Software+Engineer&l=Austin%2C+TX&sc=0kf%3Aattr%28EXSNN%7CFCGTU%7CHFDVW%7CQJZM9%7CUTPWG%252COR%29explvl%28SENIOR_LEVEL%29jt%28fulltime%29%3B&radius=50&start=10&pp=gQAPAAAAAAAAAAAAAAAB_hQcvAAVAQApedO3Eo4vT2cuwBQr4yqjn0puAAA&vjk=1e10cb8bfee39af7
7,51d934083cf1f05a,Software Engineer,"Austin, TX",SENIOR_LEVEL,EXSNN|FCGTU|HFDVW|QJZM9|UTPWG%2COR,fulltime,"Software Development Engineer in Test (SDET) - job post i3 Patterns Inc Austin, TX $55 - $60 an hour -  Full-time, Contract Apply now Apply now save-icon Job details Salary $55 - $60 an hour Job Type Full-time Contract Need strong Testng, Selenium, Java Coding experience and Appium Must have: Bachelors or Masters in CS or related degrees. Minimum of 6+ years with Master or 8+ years with Bachelors of hand on experience in software development in test automation, concurrent coding skills in Java. Test automation experience using open source technologies and/or in-house frameworks -- MUST Experience in API testing (SOAP and MicroServices). Experience in UI and Mobile Testing. Experience with test frameworks like Junit, TestNG. Familiarity with BDD and/or Cucumber Experience in Continuous Integration and Continuous Deployment. Experience with code versioning tools (Git, SVN) Excellent knowledge SQL and ability to write complex queries to validate. Following Scrum/Agile development methodology. Strong application debugging skills. Experience with Jira or similar Agile process tools. Experience with using defect management and test management tools. Ability to thrive in a fast-paced environment where resourcefulness, determination, and strong problem-solving skills are necessary for success. Positive attitude and the ability to complete assigned objectives with minimal supervision. Excellent communications skills both written and verbal. Nice-to-have: Javascript and NodeJS, server-side experience is preferred. Experience with shell scripting Experience with Security Testing and/or ADA testing Job Types: Full-time, Contract Pay: $55.00 - $60.00 per hour Experience level: 7 years Schedule: 8 hour shift Work Location: One location If you require alternative methods of application or screening, you must approach the employer directly to request this as Indeed is not responsible for the employer's application process.",https://www.indeed.com/jobs?q=Software+Engineer&l=Austin%2C+TX&sc=0kf%3Aattr%28EXSNN%7CFCGTU%7CHFDVW%7CQJZM9%7CUTPWG%252COR%29explvl%28SENIOR_LEVEL%29jt%28fulltime%29%3B&radius=50&start=10&pp=gQAPAAAAAAAAAAAAAAAB_hQcvAAVAQApedO3Eo4vT2cuwBQr4yqjn0puAAA&vjk=51d934083cf1f05a
8,32d5f95f94df16ea,Software Engineer,"Austin, TX",SENIOR_LEVEL,EXSNN|FCGTU|HFDVW|QJZM9|UTPWG%2COR,fulltime,"Software Engineer Senior - job post Texas Capital Bank 101 reviews Austin, TX 78701 Full-time Texas Capital Bank 101 reviews Read what people are saying about working here. You must create an Indeed account before continuing to the company website to apply Apply on company site save-icon Job details Job Type Full-time Overview: Texas Capital Bank is built to help businesses and their leaders. Our depth of knowledge and expertise allows us to bring the best of the big banks at a scale that makes sense for our clients, with highly experienced bankers who truly invest in people’s success — today and tomorrow. While we are rooted in core financial products, we are differentiated by our approach. Our bankers are seasoned financial experts who possess deep experience across a multitude of industries. Equally important, they bring commitment — investing the time and resources to understand our clients’ immediate needs, identify market opportunities and meet long-term objectives. At Texas Capital Bank, we do more than build business success. We build long lasting relationships. Headquartered in Dallas with offices in Austin, Fort Worth, Houston, Richardson, Plano and San Antonio, Texas Capital Bank was recently named the #1 most trusted bank in the country on Newsweek ’s inaugural list of America’s Most Trusted Companies. For more information about joining our team, please visit us at www.texascapitalbank.com. Responsibilities: Work with the business to gather requirements for Digital Banking and Onboarding platforms. Assist in design, develop, test and deploy product and application releases and enhancements using MS SQL Server, .NET, JavaScript, Java, hosted on Azure, AWS cloud platforms to support line of businesses. Assist in identifying, troubleshooting, and resolving application software defects encountered during various stages of testing and production, including during the deployment and implementation of the code in production environments. Follow best practices and guidelines set by the Digital Enterprise team. Prepare Knowledge Base articles for design, code, errors, and recovery procedures for Digital assets. Develop proof of concepts (POCs) as needed, integrating new components with back-office systems during the design and requirements phase to evaluate products and integration strategies. Partner with business line to address business and technology needs and/or deficiencies involving process, products or technology. Build strong relationships with internal partners, such as Core Technology, Risk, Strategy, Product Management, Reporting and Analytics. Install application software and complete complex web application configurations to meet business and application needs. Perform application configuration and maintenance to support business as usual application needs. Become subject matter expert on systems in order to assist with application upgrades and enhancements. Support business line by investigating operations-related problems/inquiries and recommend, facilitate, and implement solutions. Assist with vendor management activities with assigned vendors for the applications owned / supported including, but not limited to upgrades, enhancements, implementations, customer impacts, vendor oversight and management. Handle day to day application and product issues, including daily health checks of applications and processes. Thoroughly document system and feature level details. Own incidents and issues in order to conduct detailed root cause analysis to avoid further impacts and decrease the risk of recurring issues. Handle day to day application and product issues, including daily health checks of applications and processes. Qualifications: Master's degree in Computer Information Systems or a related field and 7 years experience working with Enterprise applications, Databases, C#, .NET, and Javascript. 10% domestic travel required.",https://www.indeed.com/jobs?q=Software+Engineer&l=Austin%2C+TX&sc=0kf%3Aattr%28EXSNN%7CFCGTU%7CHFDVW%7CQJZM9%7CUTPWG%252COR%29explvl%28SENIOR_LEVEL%29jt%28fulltime%29%3B&radius=50&start=10&pp=gQAPAAAAAAAAAAAAAAAB_hQcvAAVAQApedO3Eo4vT2cuwBQr4yqjn0puAAA&vjk=32d5f95f94df16ea
