,job_id,job_title,location,experience,education,job_type,job_description,job_link
0,6abb29e1c83b9f6f,Software Engineer,"Chicago, IL",MID_LEVEL,EXSNN|FCGTU|HFDVW|QJZM9|UTPWG%2COR,fulltime,"Manager, Software Engineer, Full Stack - job post Capital One 10,039 reviews Chicago, IL 60695 Full-time, Part-time Capital One 10,039 reviews Read what people are saying about working here. You must create an Indeed account before continuing to the company website to apply Apply on company site save-icon Job details Encouraged to Apply Fair chance Job Type Full-time Part-time Center 3 (19075), United States of America, McLean, Virginia Manager, Software Engineer, Full Stack Do you love building and pioneering in the technology space? Do you enjoy solving complex business problems in a fast-paced, collaborative, inclusive, and iterative delivery environment? At Capital One, you'll be part of a big group of makers, breakers, doers and disruptors, who solve real problems and meet real customer needs. We are seeking Full Stack Software Engineers who are passionate about marrying data with emerging technologies. As a Capital One Manager Software Engineer, you’ll have the opportunity to be on the forefront of driving a major transformation within Capital One. What You’ll Do: Lead a portfolio of diverse technology projects and a team of developers with deep experience in distributed microservices, and full stack systems to create solutions that help meet regulatory needs for the company Share your passion for staying on top of tech trends, experimenting with and learning new technologies, participating in internal & external technology communities, mentoring other members of the engineering community Collaborate with digital product managers, and deliver robust cloud-based solutions that drive powerful experiences to help millions of Americans achieve financial empowerment Utilize programming languages like JavaScript, Java, HTML/CSS, TypeScript, SQL, Python, and Go, Open Source RDBMS and NoSQL databases, Container Orchestration services including Docker and Kubernetes, and a variety of AWS tools and services Capital One is open to hiring a Remote Employee for this opportunity. Basic Qualifications: Bachelor’s Degree At least 6 years of experience in software engineering (Internship experience does not apply) At least 1 year experience with cloud computing (AWS, Microsoft Azure, Google Cloud) At least 2 years of people management experience Preferred Qualifications: Master's Degree 7+ years of experience in at least one of the following: JavaScript, Java, TypeScript, SQL, Python, or Go 3+ years of experience with AWS, GCP, Microsoft Azure, or another cloud service 4+ years of experience in open source frameworks 5+ years of people management experience 2+ years of experience in Agile practices At this time, Capital One will not sponsor a new applicant for employment authorization for this position. The minimum and maximum full-time annual salaries for this role are listed below, by location. Please note that this salary information is solely for candidates hired to perform work within one of these locations, and refers to the amount Capital One is willing to pay at the time of this posting. Salaries for part-time roles will be prorated based upon the agreed upon number of hours to be regularly worked. Location is New York City: $197,400 - $225,300 for Manager, Software Engineering Candidates hired to work in other locations will be subject to the pay range associated with that location, and the actual annualized salary amount offered to any candidate at the time of hire will be reflected solely in the candidate’s offer letter. This role is also eligible to earn performance based incentive compensation, which may include cash bonus(es) and/or long term incentives (LTI). Incentives could be discretionary or non discretionary depending on the plan. Capital One offers a comprehensive, competitive, and inclusive set of health, financial and other benefits that support your total well-being. Learn more at the Capital One Careers website. Eligibility varies based on full or part-time status, exempt or non-exempt status, and management level. No agencies please. Capital One is an Equal Opportunity Employer committed to diversity and inclusion in the workplace. All qualified applicants will receive consideration for employment without regard to sex, race, color, age, national origin, religion, physical and mental disability, genetic information, marital status, sexual orientation, gender identity/assignment, citizenship, pregnancy or maternity, protected veteran status, or any other status prohibited by applicable national, federal, state or local law. Capital One promotes a drug-free workplace. Capital One will consider for employment qualified applicants with a criminal history in a manner consistent with the requirements of applicable laws regarding criminal background inquiries, including, to the extent applicable, Article 23-A of the New York Correction Law; San Francisco, California Police Code Article 49, Sections 4901-4920; New York City’s Fair Chance Act; Philadelphia’s Fair Criminal Records Screening Act; and other applicable federal, state, and local laws and regulations regarding criminal background inquiries. If you have visited our website in search of information on employment opportunities or to apply for a position, and you require an accommodation, please contact Capital One Recruiting at 1-800-304-9102 or via email at RecruitingAccommodation@capitalone.com. All information you provide will be kept confidential and will be used only to the extent required to provide needed reasonable accommodations. For technical support or questions about Capital One's recruiting process, please send an email to Careers@capitalone.com Capital One does not provide, endorse nor guarantee and is not liable for third-party products, services, educational tools or other information available through this site. Capital One Financial is made up of several different entities. Please note that any position posted in Canada is for Capital One Canada, any position posted in the United Kingdom is for Capital One Europe and any position posted in the Philippines is for Capital One Philippines Service Corp. (COPSSC).",https://www.indeed.com/jobs?q=Software+Engineer&l=Chicago%2C+IL&sc=0kf%3Aattr%28EXSNN%7CFCGTU%7CHFDVW%7CQJZM9%7CUTPWG%252COR%29explvl%28MID_LEVEL%29jt%28fulltime%29%3B&vjk=6abb29e1c83b9f6f&advn=4418968771450209
1,1264ed99293c6af0,Software Engineer,"Chicago, IL",MID_LEVEL,EXSNN|FCGTU|HFDVW|QJZM9|UTPWG%2COR,fulltime,"Senior Software Engineer- Back End - job post Capital One 10,039 reviews Chicago, IL 60695 Full-time, Part-time Capital One 10,039 reviews Read what people are saying about working here. You must create an Indeed account before continuing to the company website to apply Apply on company site save-icon Job details Encouraged to Apply Fair chance Job Type Full-time Part-time Plano 1 (31061), United States of America, Plano, Texas Senior Software Engineer- Back End Do you love building and pioneering in the technology space? Do you enjoy solving complex business problems in a fast-paced, collaborative, inclusive, and iterative delivery environment? At Capital One, you'll be part of a big group of makers, breakers, doers and disruptors, who love to solve real problems and meet real customer needs. We are seeking Back End Software Engineers who are passionate about marrying data with emerging technologies. As a Capital One Software Engineer, you’ll have the opportunity to be on the forefront of driving a major transformation within Capital One. You will become part of Capital One’s Identity and Asset Management team focusing on Privileged Access Management. The team is a group of Software developers and DevOps Engineers building on their skills with Cyberark PSM, Open Source RDBMS and NoSQL databases. You and your new team will be supporting development and DevOps/SRE for applications and all teams within PAM. What You’ll Do: Collaborate with and across Agile teams to design, develop, test, implement, and support technical solutions in full-stack development tools and technologies Share your passion for staying on top of tech trends, experimenting with and learning new technologies, participating in internal & external technology communities, mentoring other members of the engineering community Collaborate with digital product managers, and deliver robust cloud-based solutions that drive powerful experiences to help millions of Americans achieve financial empowerment Utilize programming languages like Java, Python, SQL, Node, Go, and Scala, Open Source RDBMS and NoSQL databases, Container Orchestration services including Docker and Kubernetes, and a variety of AWS tools and services Basic Qualifications: Bachelor’s Degree At least 4 years of professional software engineering experience (Internship experience does not apply) Preferred Qualifications: 5+ years of experience in at least one of the following: Java, Scala, Python, Go, or Node.js 3+ years of experience in open source frameworks 2+ years of experience in Agile practices 1+ years of experience with AWS, GCP, Azure, or another cloud service At this time, Capital One will not sponsor a new applicant for employment authorization for this position. The minimum and maximum full-time annual salaries for this role are listed below, by location. Please note that this salary information is solely for candidates hired to perform work within one of these locations, and refers to the amount Capital One is willing to pay at the time of this posting. Salaries for part-time roles will be prorated based upon the agreed upon number of hours to be regularly worked. Location is New York City: $161,900 - $184,800 for Senior Software Engineer Candidates hired to work in other locations will be subject to the pay range associated with that location, and the actual annualized salary amount offered to any candidate at the time of hire will be reflected solely in the candidate’s offer letter. This role is also eligible to earn performance based incentive compensation, which may include cash bonus(es) and/or long term incentives (LTI). Incentives could be discretionary or non discretionary depending on the plan. Capital One offers a comprehensive, competitive, and inclusive set of health, financial and other benefits that support your total well-being. Learn more at the Capital One Careers website. Eligibility varies based on full or part-time status, exempt or non-exempt status, and management level. No agencies please. Capital One is an Equal Opportunity Employer committed to diversity and inclusion in the workplace. All qualified applicants will receive consideration for employment without regard to sex, race, color, age, national origin, religion, physical and mental disability, genetic information, marital status, sexual orientation, gender identity/assignment, citizenship, pregnancy or maternity, protected veteran status, or any other status prohibited by applicable national, federal, state or local law. Capital One promotes a drug-free workplace. Capital One will consider for employment qualified applicants with a criminal history in a manner consistent with the requirements of applicable laws regarding criminal background inquiries, including, to the extent applicable, Article 23-A of the New York Correction Law; San Francisco, California Police Code Article 49, Sections 4901-4920; New York City’s Fair Chance Act; Philadelphia’s Fair Criminal Records Screening Act; and other applicable federal, state, and local laws and regulations regarding criminal background inquiries. If you have visited our website in search of information on employment opportunities or to apply for a position, and you require an accommodation, please contact Capital One Recruiting at 1-800-304-9102 or via email at RecruitingAccommodation@capitalone.com. All information you provide will be kept confidential and will be used only to the extent required to provide needed reasonable accommodations. For technical support or questions about Capital One's recruiting process, please send an email to Careers@capitalone.com Capital One does not provide, endorse nor guarantee and is not liable for third-party products, services, educational tools or other information available through this site. Capital One Financial is made up of several different entities. Please note that any position posted in Canada is for Capital One Canada, any position posted in the United Kingdom is for Capital One Europe and any position posted in the Philippines is for Capital One Philippines Service Corp. (COPSSC).",https://www.indeed.com/jobs?q=Software+Engineer&l=Chicago%2C+IL&sc=0kf%3Aattr%28EXSNN%7CFCGTU%7CHFDVW%7CQJZM9%7CUTPWG%252COR%29explvl%28MID_LEVEL%29jt%28fulltime%29%3B&vjk=1264ed99293c6af0&advn=4418968771450209
2,cfebf01465d752ff,Software Engineer,"Chicago, IL",MID_LEVEL,EXSNN|FCGTU|HFDVW|QJZM9|UTPWG%2COR,fulltime,"Principal Software Development Engineer - job post Expedia Group 1,065 reviews Chicago, IL 60661 Full-time Expedia Group 1,065 reviews Read what people are saying about working here. You must create an Indeed account before continuing to the company website to apply Apply on company site save-icon Job details Job Type Full-time If you need assistance during the recruiting process due to a disability, please reach out to our Recruiting Accommodations Team through the Accommodation Request form . This form is used only by individuals with disabilities who require assistance or adjustments in applying and interviewing for a job. This form is not for inquiring about a position or the status of an application. Principal Software Development Engineer Would you like to be part of a team that delights millions of travelers from all over the world by creating the best possible booking experience? If you're passionate about building captivating, robust, and blazingly fast websites then come and join us! We're looking for a Software Development Engineer to join our team where the mission is to power the next generation of Expedia,Hotels.com, and Vrbo customer experiences! We scale and optimize the performance for applications serving the travel shopping customer experiences. Using a modern technology stack of Node.js, React, and GraphQL, we focus on writing accessible, scalable, and performant code, as well as building and being part of a thriving community of like-minded engineers. What you'll do: Partner with technologists across all EG to collaboratively solve performance challenges Support and inform EG technologists via a community of practice, advocating for performance best practices Build relationships with leaders across the organization to understand performance problems and apply a technology lens to solve them Collectively design a technology stack that is tied to business outcomes and our bottom line, always keeping a watchful eye on performance You will share knowledge and skills in more than one functional area to promote effectiveness in the department or business unit/function Participate in active mentorship and rising talent identification Recognize the ability to fill in for peer engineering director as the need arises in setting technical next steps in coordination with engineering management Develop a north star vision for the domain in which you are focused You will interpret internal/external business challenges and recommend integration of the appropriate systems, applications and technology to provide a fully functional solution to a business problem Identify areas for improvement and develop innovative enhancements using available software development tools while following the design requirements of the customer Have mastered software design best practices, shape coding methodologies and best practices and evangelize adoption of new platform technologies Advocate for designing software that is scalable, resilient, and stable Deep knowledge of the entire system and can jump into any codebase to provide urgent consultation and contribute. Make decisions on product direction based on deep subject matter knowledge Expertise in professional software engineering practices & best practices for the full software development life cycle, including coding standards, code reviews, source control management, build processes, testing, and operations Lead collaboration with key stakeholders and contribute subject matter expertise to develop unique solutions to complex issues Enable optimum organizational efficiency by taking a whole systems approach and thinking across boundaries to identify which polices/processes should be standardized and which should differ Provide guidance when evaluating the impacts of a solution to ensure linkages between structure, people, process, and technology. Keep abreast of broad industry trends and develop methods for implementing them in our environment Identify when the latest trends may be too disruptive for a reasonable implementation or spot the ephemerality of new trends. You understand that technology or automation does not solve every problem Champion prioritized initiatives across the local organization and work with others across EG to investigate those initiatives. Ensure documentation is not overwhelming or obsolete Who you are: Bachelor's or Master's degree in a related field; or equivalent related professional experience Equivalent experience includes: Experience having participated in peer’s performance reviews by providing technical assessment and feedback You have defined software engineering/architecture best practices at a Department/Organizational level Makes choices across teams to apply technologies or languages with experience in multiple domains Presents innovative technology choice to technical and non-technical observers, able to guide others to make well defined technology choices Mentors other engineers (IC I, II, III, Sr IC) Creates systems that interact across a business unit Understands systems being created across EG and how your own business unit would integrate with them Able to understand and design highly complex systems Ability to establish standards for operational excellence and code quality at a multi-project level Drives principles and practices to guide others in design of software that is easily testable and observable Understands cross domain capabilities and how they integrate Hands-on experience collecting performance data, analyzing, troubleshooting, and tuning #LI-JT The total cash range for this position in Chicago is $191,000.00 to $267,500.00. Employees in this role have the potential to increase their pay up to $305,500.00, which is the top of the range, based on ongoing, demonstrated, and sustained performance in the role. Starting pay for this role will vary based on multiple factors, including location, available budget, and an individual’s knowledge, skills, and experience. Pay ranges may be modified in the future. Expedia Group is proud to offer a wide range of benefits to support employees and their families, including medical/dental/vision, paid time off, and an Employee Assistance Program. To fuel each employee’s passion for travel, we offer a wellness & travel reimbursement, travel discounts, and an International Airlines Travel Agent (IATAN) membership.View our full list of benefits. About Expedia Group Expedia Group (NASDAQ: EXPE) powers travel for everyone, everywhere through our global platform. Driven by the core belief that travel is a force for good, we help people experience the world in new ways and build lasting connections. We provide industry-leading technology solutions to fuel partner growth and success, while facilitating memorable experiences for travelers. Expedia Group's family of brands includes: Brand Expedia®, Hotels.com®, Expedia® Partner Solutions, Vrbo®, trivago®, Orbitz®, Travelocity®, Hotwire®, Wotif®, ebookers®, CheapTickets®, Expedia Group™ Media Solutions, Expedia Local Expert®, CarRentals.com™, and Expedia Cruises™. © 2021 Expedia, Inc. All rights reserved. Trademarks and logos are the property of their respective owners. CST: 2029030-50 Employment opportunities and job offers at Expedia Group will always come from Expedia Group’s Talent Acquisition and hiring teams. Never provide sensitive, personal information to someone unless you’re confident who the recipient is. Expedia Group does not extend job offers via email or any other messaging tools to individuals to whom we have not made prior contact. Our email domain is @expediagroup.com. The official website to find and apply for job openings at Expedia Group is careers.expediagroup.com/jobs. Expedia iscommittedto creating an inclusive workenvironmentwith a diverse workforce. All qualified applicants will receive consideration for employment without regard to race, color, religion, gender, gender identity or expression, sexual orientation, national origin, genetics, disability, age, or veteran status. This employer participates in E-Verify. The employer will provide the Social Security Administration (SSA) and, if necessary, the Department of Homeland Security (DHS) with information from each new employee's I-9 to confirm work authorization.",https://www.indeed.com/jobs?q=Software+Engineer&l=Chicago%2C+IL&sc=0kf%3Aattr%28EXSNN%7CFCGTU%7CHFDVW%7CQJZM9%7CUTPWG%252COR%29explvl%28MID_LEVEL%29jt%28fulltime%29%3B&vjk=cfebf01465d752ff
