,job_id,job_title,location,experience,education,job_type,job_description,job_link
11,36d6007f6772bdeb,Software Engineer,"Chicago, IL",MID_LEVEL,EXSNN|FCGTU|HFDVW|QJZM9|UTPWG%2COR,fulltime,"Software Engineer - job post Guggenheim Partners 81 reviews Chicago, IL 60606 $100,000 - $110,000 a year -  Full-time Guggenheim Partners 81 reviews Read what people are saying about working here. You must create an Indeed account before continuing to the company website to apply Apply on company site save-icon Job details Salary $100,000 - $110,000 a year Job Type Full-time Guggenheim is seeking an exceptional Software Engineer to join its IT Application Development team. This individual’s primary day to day responsibility will be designing, developing, modifying, adapting and implementing short- and long-term solutions to information technology (IT) needs through new and existing applications, systems architecture, and network systems and applications infrastructure. In addition, this group reviews system requirements and business processes and codes, tests, debugs and implements software solutions. The position located in our Chicago office. Essential Job Functions Support the development of applications, which provide essential solutions for clients; may include debugging current systems or programming simple enhancements Take ownership of tasks as assigned to ensure successful implementation; get support from experienced Software Engineers as needed Work with business representatives and senior Software Engineers to understand business requirements and the reasons for them Assist in developing detailed specs for straightforward fixes and enhancements that are clearly aligned to system requirements as defined by business representatives and can be easily interpreted by the business representatives and other engineers Write code according to specs and maintain continuous integrations and processes May maintain databases used for development and testing, depending on the area and technical specialty Work with business representatives to understand outcomes of testing phase; engage senior Software Engineers as needed to develop solutions Support business representatives and other Software Engineers as needed with implementation and release activities as needed to ensure a successful delivery Apply compliance requirements within scope of responsibility, provide documentation as necessary, and participate in compliance activities as required Monitor system-wide tests to continually improve products, services and processes Monitor the implementation of system improvements and documents results Assist in solving a range of problems within area of expertise and apply known toolkit to new problems Preferred Qualifications Working understanding of generally accepted software development methodologies, tools, and techniques Must have experience in one or more of the following: in C#, SharePoint, SQL server, T-SQL, writing queries, JavaScript, database engineering, service architecture, object relational mappings, scripting, IIS, Azure, DevOps, Angular, Docker, Kubernetes, Terraform and HTML Prefer some experience in Azure, C#, Angular, Docker and Terraform Prefer a working knowledge of the financial services industry Basic Qualifications At least 2-4+ years of relevant experience BA/BS degree in Electrical Engineering, Computer Science, Management Information Systems or related field. Salary Details Annual base salary between $100,000 and $110,000. The base salary range represents the low and high end of the anticipated base salary range for this position. Actual base salaries may vary depending on factors such as location and experience. The range listed reflects base salary only, and the total compensation package may include other components such as incentive compensation. About Us Guggenheim Partners is a diversified financial services firm that delivers value to its clients through two primary businesses: Guggenheim Investments, a premier global asset manager and investment advisor, and Guggenheim Securities, a leading investment banking and capital markets business. Guggenheim’s professionals are based in offices around the world, and our commitment is to deliver long-term results with excellence and integrity while advancing the strategic interests of our clients. Guggenheim is an equal opportunity employer and all qualified applicants will receive consideration for employment without regard to race, color, religion, gender, sexual orientation, gender identity, national origin, disability, or status as a protected veteran. Learn more at GuggenheimPartners.com, and follow us on LinkedIn and Twitter @GuggenheimPtnrs.",https://www.indeed.com/jobs?q=Software+Engineer&l=Chicago%2C+IL&sc=0kf%3Aattr%28EXSNN%7CFCGTU%7CHFDVW%7CQJZM9%7CUTPWG%252COR%29explvl%28MID_LEVEL%29jt%28fulltime%29%3B&vjk=36d6007f6772bdeb
12,291223316213db9d,Software Engineer,"Chicago, IL",MID_LEVEL,EXSNN|FCGTU|HFDVW|QJZM9|UTPWG%2COR,fulltime,"GIS DEVELOPER (BUREAU OF TECHNOLOGY) - job post Cook County Offices Under the President 12 reviews Chicago, IL • Hybrid remote $80,708 - $96,579 a year -  Full-time Cook County Offices Under the President 12 reviews Read what people are saying about working here. You must create an Indeed account before continuing to the company website to apply Apply on company site save-icon Job details Salary $80,708 - $96,579 a year Job Type Full-time Under the direction of the Geographic Information Systems (GIS) Manager, manages and designs the GIS enterprise as related to projects and application development. Assists with the design, development and maintenance of geospatial applications through concept, design, and implementation phases. Coordinates the control and maintenance of GIS enterprise operation tasks across various agencies within Cook County to ensure compatibility and integration with the enterprise strategic plan. Maintains and updates system documentation and ensures procedures are executed properly and in a timely manner. Consults with senior level staff and departmental managers as necessary. Performs other duties as assigned. This position may be eligible for a signing bonus. Minimum Qualifications Graduation from an accredited college or university with a bachelor’s degree is required. Two (2) years of full-time work experience in Geographic Information Technology using the ESRI technology platform to conduct analysis is required. Two (2) years of full-time work experience developing GIS-related applications utilizing Python, JavaScript or R is required. Preferred Qualifications Graduation from an accredited college or university with a bachelor’s degree in Geography; Mapping; Urban Planning; Geographic Information Science; Computer Science; Geology; Environmental Science; or Civil or Environmental Engineering. Working knowledge of ArcGIS online. PURSUANT TO EXECUTIVE ORDER 2021-1 AND COOK COUNTY’S MANDATORY COVID-19 VACCINATION POLICY, THE SELECTED CANDIDATE WILL BE REQUIRED TO EITHER SUBMIT PROOF OF FULL VACCINATION OR A REQUEST FOR REASONABLE ACCOMMODATION PRIOR TO THE START OF EMPLOYMENT. PLEASE CLICK THE FOLLOWING HYPERLINKS FOR THE FULL TEXT OF EXECUTIVE ORDER 2021-1 AND THE COOK COUNTY MANDATORY COVID-19 VACCINATION POLICY. Executive Order 2021-1 Vaccination Policy Mandatory COVID-19 Vaccination Policy Candidates who are contacted will be required to produce original required documents (e.g., current driver’s license, diploma, school transcript, certifications, etc.) listed on the Notice of Job Opportunity within five (5) days of being extended an offer, in writing, by the Bureau Chief of BHR (or designee). Candidates will be notified of how to submit required documents. Degrees awarded outside of the United States with the exception of those awarded in one of the United States territories and Canada, must be credentialed by either the World Education Services (WES) or Educational Credential Evaluators (ECE). KNOWLEDGE, SKILLS, ABILITIES AND OTHER CHARACTERISTICS Knowledge of software compliance to ensure it is adhered to for all systems supported by the department. Thorough knowledge of ESRI GIS software, related geospatial technology, Microsoft Windows OS, and Microsoft Office Suite. Strong background in data management. Ability to work with ArcGIS Desktop and ArcGIS Server. Skill publishing services to ArcGIS Server and working with the ArcGIS Server REST API. Skill performing needs and workforce assessments for specific agencies to facilitate/strategize effective GIS utilization. Skill in the creation of web design/development. Skill utilizing Python. Ability to manage GIS data within at least one of the following: Oracle, SQL Server, and/or PostgreSQL database environments. Ability to coordinate with multiple agencies to develop applications for visualization, analysis and presentation of environmental data. Strong written, verbal and interpersonal skills. Ability to quickly learn new technologies, work in a team environment, and quickly turnaround maps, application prototypes or deliverables. Ability to provide senior technical leadership to the Enterprise GIS, including being conversant with the future direction of systems, how that direction will impact the enterprise, and how future and current systems can be exploited to the benefit of the County. Physical Requirements Sedentary Work Sedentary Work involves exerting up to 10 pounds of force occasionally or a negligible amount of force frequently to lift, carry, push, pull, or otherwise move objects. Sedentary work involves sitting most of the time, but may involve walking or standing for brief periods of time. The duties listed are not set forth for purposes of limiting the assignment of work. They are not to be construed as a complete list of the many duties normally to be performed under a job title or those to be performed temporarily outside an employee's normal line of work. VETERAN’S PREFERENCE When applying for employment with Cook County Government, preference is given in the application process to honorably discharged Veterans who have served in the Armed Forces of the United States for more than 180 consecutive days, or during War Time. To take advantage of this preference a Veteran must: MEET THE MINIMUM QUALIFICATIONS FOR THE POSITION. IDENTIFY THEMSELVES AS A VETERAN ON THEIR EMPLOYMENT APPLICATION BY ANSWERING YES TO THE QUESTION “Are you a military veteran?” ATTACH A COPY OF THEIR DD 214, DD 215 or NGB 22 (NOTICE OF SEPARATION) AT TIME OF APPLICATION FILING. IF YOU HAVE MULTIPLE DD 214S, 215S, OR NGB 22S, PLEASE SUBMIT THE ONE WITH THE LATEST DATE. COAST GUARD MUST SUBMIT A CERTIFIED COPY OF THE MILITARY SEPARATION FROM EITHER THE DEPARTMENT OF TRANSPORTATION (BEFORE 911) OR THE DEPARTMENT OF HOMELAND SECURITY (AFTER 911). The Cook County Department of Veterans Affairs can assist you with obtaining a certified DD214 and having it recorded for you at no charge. Please contact veterans.affairs@cookcountyil.gov VETERAN MUST PROVIDE ORIGINAL APPLICABLE DISCHARGE PAPERS AT TIME OF INTERVIEW. Benefits Package Medical, Dental, and Vision Coverage Basic Term Life Insurance Pension Plan and Deferred Compensation Program Employee Assistance Program Paid Holidays, Vacation, and Sick Time You May Qualify for the Public Service Loan Forgiveness Program (PSLF) http://www.cookcountyrisk.com/ The County has a hybrid work environment which allows employees telecommuting and flexible scheduling options. This position requires successful completion of post-offer tests, which may include a background check, drug screen and medical examination. Falsification of any information in the application process will result in disqualification, dismissal after hire, and/or placement on the County’s Ineligible for Rehire List for a period of two (2) or five (5) years. For current County employees, such falsification may result in discipline, up to and including termination, and placement on the County’s Ineligible for Rehire List for a period of two (2) or five (5) years. See Cook County Code of Ordinances, Article II, Sections 44-54 Unlawful Practices Relating to Employees and Employment - Penalty , 44-56 Political Discrimination ; Cook County Employment Plan, Section V.N. Pre-Interview License and Certification Verification ; Supplemental Policy No. 2014-2.13 Ineligible for Rehire List ; and Cook County Personnel Rules 3.3(b) (7) (d) EEO Statement Cook County Government is an Equal Employment Opportunity (“EEO”) employer. Cook County prohibits illegal discrimination and harassment and affords equal employment opportunities to employees and applicants without regard to race, color, sex, age, religion, disability, national origin, ancestry, sexual orientation, marital status, parental status, source of income, housing status, military service or discharge status, gender identity, genetic information, or any other protected category established by law, statute or ordinance as further defined in Chapter 44. Human Resources, Article II. Personnel Polices, Section 44-53 of the Cook County Code of Ordinances and Chapter 42. Human Relations, Article II. Human Rights, Section 42-35 of the Cook County Code of Ordinances. NOTE: As an internal candidate, should you be offered the position, salary allocations shall abide by the Cook County Personnel Rules. Must be legally authorized to work in the United States without sponsorship. Social Media Disclaimer The County’s hiring process is governed by the Cook County Employment Plan which prohibits employment actions from being influenced by any Political Reasons or Factors for Non-Exempt Positions. The advertisement of this position by any individual does not constitute an offer or promise of employment, promotion, or any other employment action and shall not influence the County’s hiring decision. Cook County officials and employees who become aware of or receive a complaint that involves an allegation of Political Reasons or Factors being considered in the hiring process of Non-Exempt positions are obligated to refer the complaint to the Cook County - Office of the Inspector General. If the Cook County Inspector General sustains allegations of Political Reasons or Factors being considered, Cook County will disqualify the Applicant or Candidate from consideration for employment and disciplinary action will be imposed on any involved Cook County employees, if applicable.",https://www.indeed.com/jobs?q=Software+Engineer&l=Chicago%2C+IL&sc=0kf%3Aattr%28EXSNN%7CFCGTU%7CHFDVW%7CQJZM9%7CUTPWG%252COR%29explvl%28MID_LEVEL%29jt%28fulltime%29%3B&vjk=291223316213db9d
13,fd8d453e6f68cdd7,Software Engineer,"Chicago, IL",MID_LEVEL,EXSNN|FCGTU|HFDVW|QJZM9|UTPWG%2COR,fulltime,"Lead Software Engineer (Emerging Technology) - job post Caterpillar 7,866 reviews Chicago, IL 60622 • Hybrid remote Full-time Caterpillar 7,866 reviews Read what people are saying about working here. You must create an Indeed account before continuing to the company website to apply Apply on company site save-icon Job details Job Type Full-time Career Area: Digital Job Description: This Lead Software Engineer will be part of the emerging technologies workstream to explore new technology / solution / products and influence the engineering team on alternate design options. If you have a passion to work on cutting edge and learn, explore, and validate the new features and products, this will be a perfect one! JOB DUTIES: Responsibilities of the incumbents are across functional lines with individuals assigned in new program development and/or evaluation new technology, pattern for our state-of-the-art AWS platform. This individual will also work collaboratively with other Architecture and System engineering teams to ensure cross-functional goals are met. Lead role in exploring solutions across multiple system components Works independently on complex application/technical problem identification and resolution and prototype the alternate solution Build the prototype solutions and influence the dev teams on new pattern advantages Adopt the new features in cloud / software product / Languages and share the reference pattern. Translate the new technical features into business / platform capabilities Optimize the existing solutions in terms of cost and performance Mentor and assist software engineers, providing technical assistance and direction as needed Maintains high standards of software quality by establishing good practices and habits Basic qualifications: Position requires a four-year degree from an accredited college or university. 8+ years of software development experience 5+ years of experience in designing and developing software applications in java and python including experience with microservices (spring boot and/or Flask) 5+ years of experience building production grade services in AWS Cloud 2+ years of experience in Snowflake 2 years of demonstrated experience leading software engineering projects. Top candidates will also have: AWS Certified Solution Architect – Professional Previous experience in technical innovation or emerging technologies team. Extensive experience with AWS products (ex KDA, Kinesis, OpenSearch, Dynamo, CloudWatch, Lambda, ECS, etc…) Demonstrated Technical leadership on medium to large-scale projects impacting strategic priorities. Solid understanding on data engineering pipeline designs to prepare the data the ML models and other analytics use cases. Ability to effectively prioritize, delegate responsibilities and execute tasks in a high-pressure environment. Passion for technology and an eagerness to contribute to a team-oriented environment #LI-Hybrid #BI-Remote Hybrid Work from Home Hybrid - WFH Visa sponsorship available for eligible applicants. EEO/AA Employer. All qualified individuals - Including minorities, females, veterans and individuals with disabilities - are encouraged to apply. Not ready to apply? Submit your information to our Talent Network here .",https://www.indeed.com/jobs?q=Software+Engineer&l=Chicago%2C+IL&sc=0kf%3Aattr%28EXSNN%7CFCGTU%7CHFDVW%7CQJZM9%7CUTPWG%252COR%29explvl%28MID_LEVEL%29jt%28fulltime%29%3B&vjk=fd8d453e6f68cdd7
14,8fa20dc473acb7b7,Software Engineer,"Chicago, IL",MID_LEVEL,EXSNN|FCGTU|HFDVW|QJZM9|UTPWG%2COR,fulltime,"Software Engineer - job post JPMorgan Chase Bank, N.A. (part of JPMorgan Chase & Co) 8,774 reviews Chicago, IL Full-time JPMorgan Chase Bank, N.A. 8,774 reviews Read what people are saying about working here. You must create an Indeed account before continuing to the company website to apply Apply on company site save-icon Job details Job Type Full-time Duties: Design, develop and implement software solutions. Solve business problems through innovation and engineering practices. Involved in all aspects of the Software Development Lifecycle (SDLC) including analyzing requirements, incorporating architectural standards into application design specifications, documenting application specifications, translating technical requirements into programmed application modules, and developing or enhancing software application modules. Identify or troubleshoot application code-related issues. Take active role in code reviews to ensure solutions are aligned to pre- defined architectural specifications. Assist with design reviews by recommending ways to incorporate requirements into designs and information or data flows. Participate in project planning sessions with project managers, business analysts, and team members to analyze business requirements and outline proposed solutions. QUALIFICATIONS: Minimum education and experience required: Bachelor's degree in Computer Science, Computer Engineering, Electronic Engineering, Computer Information Systems, or related field of study plus seven (7) years of experience in the job offered or as a Software Engineer, Software Developer, Technical Lead, or related occupation. The employer will alternatively accept a Master's degree in Computer Science, Computer Engineering, Electronic Engineering, Computer Information Systems, or related field of study plus five (5) years of experience in the job offered or as a Software Engineer, Software Developer, Technical Lead, or related occupation. Skills Required: Requires experience in the following: Java features such as collections, multi-threading, streams, or file io; Unit Testing tools such as Junit, EasyMock, or PowerMock; Drools; Spring Boot or Spring Core; Object-relational mapping frameworks such as Hibernate or iBatis; implementing synchronous interactions using RESTful; implementing asynchronous interactions using tools such as Kafka or Java Message Service; and Kubernetes or similar cloud, container, or orchestration platform. Job Location: 10 South Dearborn Street, Chicago, IL 60603. Telecommuting permitted up to 40% of the week. JPMorgan Chase & Co., one of the oldest financial institutions, offers innovative financial solutions to millions of consumers, small businesses and many of the world's most prominent corporate, institutional and government clients under the J.P. Morgan and Chase brands. Our history spans over 200 years and today we are a leader in investment banking, consumer and small business banking, commercial banking, financial transaction processing and asset management. We recognize that our people are our strength and the diverse talents they bring to our global workforce are directly linked to our success. We are an equal opportunity employer and place a high value on diversity and inclusion at our company. We do not discriminate on the basis of any protected attribute, including race, religion, color, national origin, gender, sexual orientation, gender identity, gender expression, age, marital or veteran status, pregnancy or disability, or any other basis protected under applicable law. In accordance with applicable law, we make reasonable accommodations for applicants' and employees' religious practices and beliefs, as well as any mental health or physical disability needs. The health and safety of our colleagues, candidates, clients and communities has been a top priority in light of the COVID-19 pandemic. JPMorgan Chase was awarded the ""WELL Health-Safety Rating"" for all of our 6,200 locations globally based on our operational policies, maintenance protocols, stakeholder engagement and emergency plans to address a post-COVID-19 environment. As a part of our commitment to health and safety, we have implemented various COVID-related health and safety requirements for our workforce. Employees are expected to follow the Firm's current COVID-19 or other infectious disease health and safety requirements, including local requirements. Requirements include sharing information including your vaccine card in the firm's vaccine record tool, and may include mask wearing. Requirements may change in the future with the evolving public health landscape. JPMorgan Chase will consider accommodation requests as required by applicable law. We offer a competitive total rewards package including base salary determined based on the role, experience, skill set, and location. For those in eligible roles, discretionary incentive compensation which may be awarded in recognition of individual achievements and contributions. We also offer a range of benefits and programs to meet employee needs, based on eligibility. These benefits include comprehensive health care coverage, on-site health and wellness centers, a retirement savings plan, backup childcare, tuition reimbursement, mental health support, financial coaching and more. Additional details about total compensation and benefits will be provided during the hiring process. Equal Opportunity Employer/Disability/Veterans",https://www.indeed.com/jobs?q=Software+Engineer&l=Chicago%2C+IL&sc=0kf%3Aattr%28EXSNN%7CFCGTU%7CHFDVW%7CQJZM9%7CUTPWG%252COR%29explvl%28MID_LEVEL%29jt%28fulltime%29%3B&vjk=8fa20dc473acb7b7
