,job_id,job_title,location,experience,education,job_type,job_description,job_link
15,8f285c88c9c7a010,Software Engineer,"Chicago, IL",MID_LEVEL,EXSNN|FCGTU|HFDVW|QJZM9|UTPWG%2COR,fulltime,"PHP Web application Developer - job post Web2Carz.com Chicago, IL $78,000 - $96,000 a year -  Full-time Apply now Apply now save-icon Job details Salary $78,000 - $96,000 a year Job Type Full-time Title: PHP Web application Developer Description: Web2Carz.com seeks an experienced PHP Web Application Developer to join their team. This developer will routinely be called upon to implement new features and functionality for its various web applications. The ideal candidate is a highly motivated self-starter with a desire to work in a fun and small internet company with a startup like culture. Exciting opportunity to be a major development stakeholder. What you'll be doing: Primary focus will be the development of PHP server-side logic. Requirements gathering, analysis & design, and code implementation. Functionality testing for a high level of compliance and quality. Other initiatives such as 3rdparty API integrations and reporting tools improvements. Contribute to central database definition & maintenance. Contribute to Production environment support including deployments, monitoring, and outage troubleshooting. Work in collaboration with additional back-end developer, front-end developer, graphic designer, and product/marketing team. Requirements: Bachelor's Degree in Computer Science, Computer Engineering, or related field. Strong PHP programming and scripting skills including multiple work experience years. Strong knowledge of object-oriented programming and common software design patterns such as MVC. Strong familiarity and experience with Lamp Stack (Linux, Apache, MySql, & PHP). Strong understanding of database best practices. Maintain cutting-edge knowledge of current and emerging technologies, trends, and standards. Comfortable working in a start-up like atmosphere on a small team with limited oversight Basic understanding and abilities in front-end technologies, such as JavaScript, HTML5, CSS3, AJAX, Jquery. About Web2Carz.com: Online automotive centric marketing company Exciting internet startup like culture. Flexible casual environment. Work from home Fridays. Located in downtown Highland Park near Metra, shops, restaurants. Job Type: Full-time Pay: $78,000.00 - $96,000.00 per year Benefits: Flexible schedule Health insurance Paid time off Compensation package: Yearly bonus Yearly pay Experience level: 3 years Schedule: Monday to Friday Ability to commute/relocate: Chicago, IL: Reliably commute or planning to relocate before starting work (Required) Experience: PHP: 3 years (Required) Linux: 1 year (Preferred) MySQL: 2 years (Preferred) Work Location: In person Health insurance If you require alternative methods of application or screening, you must approach the employer directly to request this as Indeed is not responsible for the employer's application process.",https://www.indeed.com/jobs?q=Software+Engineer&l=Chicago%2C+IL&sc=0kf%3Aattr%28EXSNN%7CFCGTU%7CHFDVW%7CQJZM9%7CUTPWG%252COR%29explvl%28MID_LEVEL%29jt%28fulltime%29%3B&start=10&pp=gQAPAAAAAAAAAAAAAAAB_hr1XQAeAQBScu0n28ME-G1zhILZT_o32R2oMMoT_C-LfO3cAAA&vjk=8f285c88c9c7a010&advn=2241391190970805
16,a26b5ab30c17218a,Software Engineer,"Chicago, IL",MID_LEVEL,EXSNN|FCGTU|HFDVW|QJZM9|UTPWG%2COR,fulltime,"Senior Developer - Node.JS Backend - job post United Airlines 4,268 reviews Chicago, IL 60606 From $121,000 a year -  Full-time United Airlines 4,268 reviews Read what people are saying about working here. Apply now Apply now save-icon Job details Salary From $121,000 a year Job Type Full-time There’s never been a more exciting time to join United Airlines. We’re on a path towards becoming the best airline in the history of aviation. Our shared purpose – Connecting People, Uniting the World – is about more than getting people from one place to another. It also means that as a global company that operates in hundreds of locations around the world with millions of customers and tens of thousands of employees, we have a unique responsibility to uplift and provide opportunities in the places where we work, live and fly, and we can only do that with a truly diverse and inclusive workforce. And we’re growing – in the years ahead, we’ll hire tens of thousands of people across every area of the airline. Our careers include a competitive benefits package aimed at keeping you happy, healthy and well-traveled. From employee-run ""Business Resource Group"" communities to world-class benefits like parental leave, 401k and privileges like space available travel, United is truly a one-of-a-kind place to work. Are you ready to travel the world? We believe that inclusion propels innovation and is the foundation of all that we do. United's Digital Technology team spans the globe and is made up of diverse individuals all working together with cutting-edge technology to build the best airline in the history of aviation. Our team designs, develops and maintains massively scaling technology solutions brought to life with innovative architectures, data analytics, and digital solutions. Key Responsibilities : The Senior Developer plays a meaningful role in crafting and maintaining the strategic partnership between business needs and technology delivery. The Senior Developer's role is to lead the efforts to plan, design, develop and launch efficient systems and solutions in support of core organizational functions. This individual will apply proven communication, analytical and problem-solving skills to help identify, communicate and resolve issues, opportunities or problems in order to enhance the benefit of IT and Business investments. The Principal Developer is highly qualified and has decision-making authority. The Principal Developer is self - sufficient, requires no direct supervision, and mentors/coaches others. The Principal Developer has extensive knowledge/experience across multiple technologies and business areas. Leads the design, development, and planning for solutions and technology standards to solve complex business problems. Hands-on development, support and fix software systems as required, optimizing performance, resolving problems, and providing follow-up on all issues and solutions Ensures that systems are properly integrated. Works with business, support, or development teams recommending system improvements Consults across multiple United Information Technology projects and technology areas to perform problem management, root-cause analysis, and solution implementation Serves as a resource for technology/project development review and technical assessments Ensures that the technical solutions meet the customers’ business goals Provide consultation and technical leadership in project life cycle planning Ensures consistency and coherence to the enterprise standards and guiding principles throughout the application lifecycle Finds opportunities to leverage/influence the direction for existing infrastructure and application components Stays ahead of industry trends through benchmarking, participation in professional associations etc. in order to advise others of strategic technology direction Provides feedback to the enterprise technology owners and Architects regarding future solution needs Understands and applies the enterprise vision and strategy to the project solution while balancing tactical needs to deliver Partner with various business and IT customers in defining domain architecture strategy Demonstrate exceptional knowledge of application architecture and architecture constructs as it connects to the enterprise architecture Demonstrate mastery of the application of development domain areas and multiple technologies and tool set Demonstrate mastery of software engineer United values diverse experiences, perspectives, and we encourage everyone who meets the minimum qualifications to apply. While having the “desired” qualifications make for a stronger candidate, we encourage applicants who may not feel they check ALL of those boxes! We are always looking for individuals who will bring something new to the table! Qualifications - External What’s needed to succeed (Minimum Qualifications): Bachelors in Computer Science/Information Technology or related field 5+ experience with Node JS developing APIs 5 years demonstrated ability implementing AWS technologies (Lambda, CloudFront, Cognito, route53, Dynamo DB, ECS, EC2, S3, RDS, API Gateway) Experience with Cloud Automation Development Tool such as Git, Python/Bash/Powershell Scripting Experience with Docker, including management and deployment using a scheduler such as the Elastic Container Service or Kubernetes Thorough knowledge of Docker, Docker Compose, Docker Swarm or similar container technologies Event Processing; Tibco & Kafka integrations Experience in RESTful APIs Experience in CI/CD, TeamCity, GitHub Experience in agile environment Understands Technology systems & applications Vendor management and negotiation Exceptional at coding and on time delivery of quality components and or applications Exceptional at component and unit testing of following standard practices and methodologies Exceptional applying the technologies and domain knowledge with the delivery of developed components or integrated components Exceptional at working problems of moderate scope where analysis of situations or data requires review of a variety of factors Exceptional at triage or analysis of situations for production support Effective participant of requirements gathering, requirements analysis *Must be legally authorized to work in the United States for any employer without sponsorship. What will help you propel from the pack (Preferred Qualifications): Knowledge of Python and/or other scripting languages (express.js, next.js) Knowledge of Java Airline Maintenance systems development United Airlines is an equal opportunity employer. United Airlines recruits, employs, trains, compensates and promotes regardless of race, religion, color, national origin, gender identity, sexual orientation, physical ability, age, veteran status and other protected status as required by applicable law. We will ensure that individuals with disabilities are provided reasonable accommodation to participate in the job application or interview process, to perform crucial job functions. Please contact JobAccommodations at united to request accommodation. Job Type: Full-time Pay: From $121,000.00 per year Benefits: 401(k) 401(k) matching Dental insurance Employee assistance program Employee discount Flexible schedule Flexible spending account Health insurance Health savings account Life insurance Paid time off Parental leave Professional development assistance Vision insurance Compensation package: Yearly bonus Yearly pay Experience level: 3 years 4 years Schedule: 8 hour shift Monday to Friday Ability to commute/relocate: Chicago, IL 60606: Reliably commute or planning to relocate before starting work (Preferred) Application Question(s): This is a hybrid role in Chicago. Are you open to a Hybrid-Remote role? Are you authorized to work in the United States with no sponsorship? Experience: AWS: 4 years (Preferred) Node.js: 4 years (Required) APIs: 4 years (Preferred) Work Location: Hybrid remote in Chicago, IL 60606 Health insurance If you require alternative methods of application or screening, you must approach the employer directly to request this as Indeed is not responsible for the employer's application process.",https://www.indeed.com/jobs?q=Software+Engineer&l=Chicago%2C+IL&sc=0kf%3Aattr%28EXSNN%7CFCGTU%7CHFDVW%7CQJZM9%7CUTPWG%252COR%29explvl%28MID_LEVEL%29jt%28fulltime%29%3B&start=10&pp=gQAPAAAAAAAAAAAAAAAB_hr1XQAeAQBScu0n28ME-G1zhILZT_o32R2oMMoT_C-LfO3cAAA&vjk=a26b5ab30c17218a
17,b5126593c7ab677d,Software Engineer,"Chicago, IL",MID_LEVEL,EXSNN|FCGTU|HFDVW|QJZM9|UTPWG%2COR,fulltime,"Software Engineer III (On-site & Fulltime) - job post Bectran 4 reviews Schaumburg, IL 60173 • Hybrid remote $120,000 a year -  Full-time Bectran 4 reviews Read what people are saying about working here. Apply now Apply now save-icon Job details Salary $120,000 a year Job Type Full-time Since its inception in 2010, Bectran has pioneered affordable credit management and accounts receivable automation solutions for all sizes of organizations. Bectran’s SaaS solutions — credit, collections and accounts receivable — provide seamless user experiences across various industries and empower users with robust credit evaluation services, providing more oversight, control and efficiency to companies of all sizes. Our dedication to improving the efficiency of the order-to-cash cycle has helped companies cut down the time to process and approve credit by over 90% while significantly lowering the risk of default. We are committed to helping businesses make the transition to powerful SaaS technology solutions that save you time and money. And we’re looking for a driven, experienced software developer passionate about hands-on work to join our on-site, Schaumburg-based software engineering team as a full time Senior Software Engineer. Our software engineering team is responsible for having a breadth of knowledge of contemporary SaaS-based architecture and practical development experience using Java/J2EE and other services languages. We are searching for a practical and results-oriented developer to join the Bectran team as Senior Software Engineer — a role dedicated to producing and implementing functional software solutions to drive application development and lead operational and technical projects. In this role, you should be able to work independently with little supervision. You should have excellent organization and problem-solving skills. Your goal will be to develop high-quality software that is aligned with our user needs and goals. Key Responsibilities: Contribute directly to full stack development efforts , UI updates and testing methodology while actively designing and creating Java-based computer systems and applications to solve complex client problems. Develops software solutions by studying information needs, conferring with users, studying systems flow, data usage and work processes; investigating problem areas; and following the software development lifecycle. Determines operational feasibility by evaluating analysis, problem definition, requirements, solution development and proposed solutions. Documents and demonstrates solutions by developing documentation , flowcharts, layouts, diagrams, charts, code comments and clear code. Prepares and installs solutions by determining and designing system specifications, standards, and programming. Improves operations by conducting systems analysis and recommending changes in policies and procedures. Updates job knowledge by studying state-of-the-art development tools, programming techniques, and computing equipment, and by participating in educational opportunities, reading professional publications, maintaining personal networks and participating in professional organizations. Protects operations by keeping information confidential. Provides information by collecting, analyzing and summarizing development and service issues. Accomplishes engineering and organization mission by completing related results as needed. Supports and develops software engineers by providing advice, mentoring and educational opportunities. Desired Qualifications/Skills: JAVA experience Communication skills Leadership Teamwork Analyzing information Software design Software documentation Software testing General programming skills Software development fundamentals Software development process Software requirements Software architecture Desired Education and Experience: B.S. in computer science, information technology, computer engineering or related discipline M.S. preferred Four years of job related experience Four years of experience as software engineer Experience with computer programming Job Type: Full-time Pay: $120,000.00 per year Benefits: Dental insurance Health insurance Paid time off Vision insurance Schedule: 8 hour shift Application Question(s): Will you now, or in the future, require sponsorship for employment visa status (e.g. H-1B visa status)? Please note: this position is not a hybrid/remote or a contract/C2C role. Are you willing to be onsite in Schaumburg, Illinois, for this full-time position? Education: Master's (Required) Work Location: One location Health insurance If you require alternative methods of application or screening, you must approach the employer directly to request this as Indeed is not responsible for the employer's application process.",https://www.indeed.com/jobs?q=Software+Engineer&l=Chicago%2C+IL&sc=0kf%3Aattr%28EXSNN%7CFCGTU%7CHFDVW%7CQJZM9%7CUTPWG%252COR%29explvl%28MID_LEVEL%29jt%28fulltime%29%3B&start=10&pp=gQAPAAAAAAAAAAAAAAAB_hr1XQAeAQBScu0n28ME-G1zhILZT_o32R2oMMoT_C-LfO3cAAA&vjk=b5126593c7ab677d
18,4c6e98fbd6009cf3,Software Engineer,"Chicago, IL",MID_LEVEL,EXSNN|FCGTU|HFDVW|QJZM9|UTPWG%2COR,fulltime,"Front-End Software Engineer - job post SimBioSys Chicago, IL Full-time Apply now Apply now save-icon Job details Job Type Full-time SimBioSys is seeking both Senior Back-End and Front-End Software Engineers to contribute to development of PhenoScope, an application to assist pharmaceutical researchers in the designing new life-saving therapies. As a Software Engineer, you will help build a web-based platform for the management, analysis, and visualization of diverse datasets across multiple biological scales. In the role you will be responsible designing and building the user interface of the web front-end of the application. You will work closely with the back-end team to use our APIs to display a multitude of data and rich visualizations. What you'll do Design, develop, and maintain customer-facing web applications using React Collaborate closely with Back-end Engineers on API development Build visualizations to effectively communicate data Interact with scientists to design intuitive interfaces for data exploration Assess human usability factors of the front-end application Lead code quality and testing initiatives Provide internal leadership and support Mentor junior developers Contribute to development of other in-house tools as assigned Qualifications Bachelor's Degree in Computer Science or a related degree Three years of experience in working with JavaScript in a production environment Proficient in designing web applications using frameworks such as React, Angular, or Vue Experience with consuming data from REST APIs Experience with TypeScript Proficient with using git for version control, as well as development management platforms such as GitLab or GitHub Experience with cloud-based application development (e.g., AWS, GCP, Azure) Ability to work independently and as part of a team to meet project goals Excellent written and verbal communication skills Preferred Qualifications Proficient in Python Experience with AWS Experience with Design-Build-Test software development processes Experience with medical imaging, biological data, and/or drug design If you require alternative methods of application or screening, you must approach the employer directly to request this as Indeed is not responsible for the employer's application process.",https://www.indeed.com/jobs?q=Software+Engineer&l=Chicago%2C+IL&sc=0kf%3Aattr%28EXSNN%7CFCGTU%7CHFDVW%7CQJZM9%7CUTPWG%252COR%29explvl%28MID_LEVEL%29jt%28fulltime%29%3B&start=10&pp=gQAPAAAAAAAAAAAAAAAB_hr1XQAeAQBScu0n28ME-G1zhILZT_o32R2oMMoT_C-LfO3cAAA&vjk=4c6e98fbd6009cf3
19,b726e1fc8ede7e32,Software Engineer,"Chicago, IL",MID_LEVEL,EXSNN|FCGTU|HFDVW|QJZM9|UTPWG%2COR,fulltime,"Software Developer II - job post BigTime Software 2 reviews Chicago, IL 60606 Full-time BigTime Software 2 reviews Read what people are saying about working here. Apply now Apply now save-icon Job details Job Type Full-time BigTime Software is seeking a Developer II to join our team in Chicago, IL or in Phoenix, AZ. What We Offer: Competitive salary and a quarterly bonus Company pays 100% of benefits, including medical, dental, vision, disability and life insurance 401k with generous company match Paid Parental Leave Generous time off and paid company holidays Weekly Lunch Credit via GrubHub and company paid GrubHub+ (free unlimited delivery) Fresh fruit, snacks, cold brew coffee/tea, soda and La Croix Great, convenient downtown / loop location - Flexible work environment with remote opportunities Parental leave support with Parently Hybrid work schedule - Most teams in office 2 times a week Company provided latest technology & software tools What You’ll Be Doing - Developer I/II BigTime Software is looking for a full-stack Software Engineer I/II to join our engineering team in building the next-generation of the BigTime product. The individual in this role will collaborate extensively to design, build, and test complex functionality in our award-winning, cloud-based system and multiple integrations with other SaaS systems. The ideal candidate will be passionate about development, comfortable or willing to get comfortable/learn both front and backend, thrives on technical challenges, takes initiative, and ready to collaborate in our fast-paced, agile environment. Who You Are Experience with full-stack .NET development. Our tech stack includes: C#, SQL, .NET MVC, JavaScript/CSS/HTML, AngularJS, RESTful API, memcached, Redis, MongoDB and hosting in AWS. You don’t need to be an expert in all of these technologies but if you are strong in a couple of these, we’d love to talk to you! Strong analytical and problem solving skills and a clear understanding of software engineering (SDLC, OOP principles, design patterns, SOLID design, agile development, testing and debugging methods, CI/CD automation experience, etc). Interest and ability to learn other coding languages and technologies as needed. We’re a hybrid environment and our engineering team is in several locations so great written and verbal communication skills! Bachelor’s degree in Computer Science or Computer Engineering, Mathematics, Physics, or its professional equivalent. 2-4+ years hands on development experience, ideally in a .NET environment Characteristics that could make you really stand out .NET Core Angular/React or other frontend development frameworks Experience with software design and architecture Container technologies like Docker Microservices Automated testing SAAS experience Developing cloud-based integrations with multiple cloud providers Experience working with designers and business stakeholders Business applications: Accounting systems, CRM systems, PSA systems Who We Are BigTime Software is the engine behind the greatest consulting firms on the planet, delivering back-office time/budgeting and invoicing to over 2,300 firms worldwide and tracking over $4 billion in billable time each year. Our flagship product is a SaaS-based system that is custom-built for the professional services industry. BigTime is a PE-backed company based in Chicago committed to helping clients run professional teams more efficiently, unlocking potential revenue and improving profitability. If you love what you do, and want to work in a team environment that will challenge you to do your best, then check us out! Applicants must be authorized to work in the U.S. BigTime Software, Inc. is proud to be an Equal Opportunity Employer All qualified applicants will receive consideration for employment without regard to race, color, religion, sex, national origin, disability, protected veteran status, or any other characteristic protected by law. Your Right to Work - In compliance with federal law, all persons hired will be required to verify identity and eligibility to work in the United States and to complete the required employment eligibility verification document form upon hire. If you require alternative methods of application or screening, you must approach the employer directly to request this as Indeed is not responsible for the employer's application process.",https://www.indeed.com/jobs?q=Software+Engineer&l=Chicago%2C+IL&sc=0kf%3Aattr%28EXSNN%7CFCGTU%7CHFDVW%7CQJZM9%7CUTPWG%252COR%29explvl%28MID_LEVEL%29jt%28fulltime%29%3B&start=10&pp=gQAPAAAAAAAAAAAAAAAB_hr1XQAeAQBScu0n28ME-G1zhILZT_o32R2oMMoT_C-LfO3cAAA&vjk=b726e1fc8ede7e32
