,job_id,job_title,location,experience,education,job_type,job_description,job_link
5,b7568dfe4928de29,Software Engineer,"San Francisco, CA",ENTRY_LEVEL,EXSNN|FCGTU|HFDVW|QJZM9|UTPWG%2COR,fulltime,"Software Engineer / Data Scientist, Planner Evaluation Driving Sets - job post Waymo 41 reviews Mountain View, CA • Hybrid remote $187,000 - $233,000 a year -  Full-time Waymo 41 reviews Read what people are saying about working here. You must create an Indeed account before continuing to the company website to apply Apply on company site save-icon Job details Salary $187,000 - $233,000 a year Job Type Full-time Waymo is an autonomous driving technology company with a mission to make it safe and easy for people and things to get where they’re going. Since our start as the Google Self-Driving Car Project in 2009, Waymo has been focused on building the Waymo Driver—The World’s Most Experienced Driver™—to improve everyone's access to mobility while saving thousands of lives now lost to traffic crashes. Our Waymo Driver powers Waymo One, our fully autonomous ride-hailing service, as well as Waymo Via, our trucking and local delivery service. To date, Waymo has driven over 20 million miles autonomously on public roads across 25 U.S. cities and conducted over 20 billion miles of simulation testing. At Waymo, we are mission-driven and believe deeply in the opportunity of autonomous driving technology to improve mobility and make people's lives better. We are united by purpose and responsibility (for our employees and riders alike). We are looking for kind, committed, employees who have integrity, dream big, work together as one team and create a sense of belonging for one another that is the foundation of our culture. We want each team member to feel welcomed and included in every step of our exciting journey. The Simulation Organization enables Waymo to simulate and analyze millions of miles of driving every day. We can recreate, modify, and amplify our real-world experience - or generate entirely new situations from scratch. We work with teams across Waymo, enabling the rapid iterations in advancing self-driving technology. Our work was recently featured in The Atlantic - ""Inside Waymo's Secret World for training Self-Driving Cars"". As powerful as this system is, however, there are still many open problems to solve and much work ahead of us. Role Description As a Software Engineer on the Driver Understanding and Evaluation team, you will work to understand and measure the performance and safety of our Waymo Driver, which is key to unlocking scale. Large scale experimentation and data driven decision making in autonomous driving has unique challenges - the long tail behavior matters more than the average case. Discovering and recreating the long tail is hard, and experimentation via real-world driving does not scale. We are building Machine Learning models that represent and understand the world we drive in, and executing experimentation via large-scale realistic simulation. If you have a background in working on complex high-quality systems, and enjoy Machine Learning, Data Mining, experimentation and metric design, we’d like to meet you! Responsibilities Seamlessly integrate logged data replay and simulated agents Quantify the performance and safety characteristics of the Waymo Driver Filter and mine large scale simulated data to detect the most interesting issues Build reliable and scalable infrastructure services that enable us to use simulation in new ways Automate with deep learning or streamline manual triage processes performed by a large team of operators Design car, cyclist or pedestrian agents that interact in realistic ways with the Waymo Driver Generate simulations that target specific challenges Accelerate onboard software development with improved tools and visualization Minimum Qualifications A BS or MS in Computer Science or a similar discipline, or equivalent industry experience Experience with C++ or Python (or a willingness to learn) A proven background navigating a large code base Passion for Self Driving Cars and the future of sustainable transportation Preferred Qualifications Interest and/or experience with data labeling or Machine Learning data Full stack web development experience (frontend and backend) Experience learning from - and optimizing for - external users Experience in Machine Learning modeling or AV simulation, especially TensorFlow The expected base salary range for this full-time position across US locations is listed below. Actual starting pay will be based on job-related factors, including exact work location, experience, relevant training and education, and skill level. Your recruiter can share more about the specific salary range for the role location or, if the role can be performed remote, the specific salary range for your preferred location, during the hiring process. Waymo employees are also eligible to participate in Waymo’s discretionary annual bonus program, equity incentive plan, and generous Company benefits program, subject to eligibility requirements. Salary Range $187,000—$233,000 USD While at Waymo, you will enjoy benefits that cover… Health and wellness: Our people are at the heart of everything we do. At Waymo, you can enjoy top-notch medical, dental and vision insurance, mental wellness support, a Flexible Spending Account (FSA), a Health Saving Account (HSA), on-site physicians and/or nurses in some locations, and special wellness programs. Financial wellness: Your financial peace of mind is important to us. At Waymo, we offer competitive compensation, bonus opportunities, equity, a generous 401(k) plan or regional retirement plans, 1-on-1 financial coaching, a 529 College Savings Plan and lots of other perks and employee discounts. Flexibility and time off: Take the time you need to relax and recharge. Enjoy the flexibility to work from another location for four weeks per year. We support an on-site, hybrid work model and offer remote working opportunities, paid time off, Waymo recharge days, bereavement, sick, and parental leave. Supporting families: When it comes to growing your family or caring for your loved ones, you have our full support. Enhanced leave options include paid parental leave (birthing parent gets 24 weeks of paid leave, and non-birthing parent gets 18 weeks of paid leave), and 20 subsidized days of backup childcare or adult/elder care. Access to fertility care or adoption support as you grow your family. Community and personal development: At Waymo, you’ll find a range of opportunities to grow, connect, and give back. We offer education tuition reimbursement, personal and professional development, mentorship, and other ways to connect through Employee Resource Groups (ERGs), other internal groups, and even time off to volunteer. Cool perks: Access to Google offices, cafes, wellness centers, personal training sessions, massages, haircuts, bike repairs, office transportation, commuter benefits and so much more. To support your wellbeing at home, you can enjoy at-home fitness and cooking classes, and more. Please note that while our benefits philosophy is the same in every place Waymonauts work, benefits may vary by office/country and are subject to eligibility requirements. Note: The following is only applicable for roles hired in the US. As we keep the safety of our employees and our communities top of mind, COVID-19 vaccinations continue to be a critical prevention measure to help end the pandemic. Because of this, Waymo requires all US-based employees who perform work onsite for Waymo to be fully vaccinated against COVID-19. If you are unable to be vaccinated, Waymo will provide a reasonable accommodation consistent with applicable law.",https://www.indeed.com/jobs?q=Software+Engineer&l=San+Francisco%2C+CA&sc=0kf%3Aattr%28EXSNN%7CFCGTU%7CHFDVW%7CQJZM9%7CUTPWG%252COR%29explvl%28ENTRY_LEVEL%29jt%28fulltime%29%3B&radius=50&start=10&pp=gQAPAAAAAAAAAAAAAAAB_iDBCAAeAQBSabTA9edema6Cf8tNOegvxrD-fypUTndlxSmeAAA&vjk=b7568dfe4928de29
6,1e618375dcf8f6a3,Software Engineer,"San Francisco, CA",ENTRY_LEVEL,EXSNN|FCGTU|HFDVW|QJZM9|UTPWG%2COR,fulltime,"Software Engineer Associate - job post Digital Foundry, Inc. Tiburon, CA 94920 Full-time Apply now Apply now save-icon Job details Job Type Full-time Digital Foundry is a leading business and software consulting firm for 30+ years. We partner with Fortune 500 companies to plan, design and build innovative digital products - think custom mobile apps, responsive websites, web 3.0 interactions and user experiences, connected hardware and IoT solutions, machine learning and AI interfaces, and comprehensive platforms that support both customer-facing products and internal operations tools. In other words, our clients come to us for help in transforming their digital products and product development practices. What do we build? We’ve built awesome products that are being actively used by all kinds of end customers, including voters, doctors, patients, auditors, veterans, students, homeowners, miners, drivers, and the list goes on. As of today, Digital Foundry has millions of people using products that we’ve helped build for our clients. Why do our clients choose DF? We believe our in-house, full-stack development capability and project based approach help set us apart. Where do you fit in? You will help Digital Foundry plan, build, and maintain highly visible custom software for start-ups and large multinational companies. What should you expect? We pride ourselves on maintaining a positive, fun environment and providing a competitive benefits package to all full-time employees. Where will you be working from? Our office is located in sunny Tiburon, California, a quick drive or ferry ride from downtown San Francisco, and we support a thriving, flexible remote work culture. We also encourage employees to make it into the office (or to our fun offsites) for special events, or simply come in whenever they’d like a productive, collaborative, relaxing work environment. DF operates in the following states: California, Oregon, Utah, Ohio, Virginia, Texas and Hawaii. Who will you be working with? We are composed of a diverse group of intelligent, fun people who will push your thinking at every turn. We seek out talented, motivated self-learners. Everyone here shares an intense passion for innovation and a propensity to thrive in a highly collaborative, inventive environment. Who are we looking for? Talented software developers to join our technology group in creating cutting-edge software solutions for our clients. You will be assigned to one of our project teams based on alignment of skills, resource demand and individual desire. The opportunity to work on different projects will give you exposure to a wide variety of technologies, tools and platforms. The software we develop is highly visible and makes a real difference for our clients’ businesses. This is a tremendous opportunity to have a direct impact and to learn from the best along the way. There is considerable growth potential in this role; we are looking for someone with leadership potential who is motivated to accelerate quickly. Ideally, you embody these traits: Problem Solver - You naturally extrapolate learnings from one solution and can apply the appropriate dev methods or build principles to a new problem, even if the tech stack is different. You have fun with a new challenge! Go Getter - You take the initiative to research a problem rather than shying away. You are curious, you ask questions, find insights, and convey your thoughts in a coherent way. Adaptable - You are comfortable with ambiguity or vague requirements. You can roll with a minor or major pivot, and handle different kinds of project needs with varying demands in terms of meetings, client personalities, or team dynamics. Professional & Empathetic - You are able to articulate your development work to your project lead as well as client stakeholders, communicating professionally and effectively. We are looking for someone who can engage with a diverse group, who is open to unique perspectives, and can add another dimension to the team. Team Player - You thrive in a collaborative, agile, team-centric environment. When applicable, you are willing to step up to mentor a teammate through a problem. You come to the table with humility and are open to learning from others. What do you need to have? BS in Computer Science or related field Proficiency in one or more of the following: C#, Java, JavaScript, Golang, Python, Swift Ability to learn and adapt to new, complex development environments Work authorization in the U.S. which does not require sponsorship by the employer for a visa. What other skills do we consider? Experience utilizing test-driven development processes and automated testing frameworks; Ability to test your code and the code of others Strong team ethic, analytical skills, and attention to detail Strong written and verbal communication skills Working knowledge of object-oriented design Aptitude to write clean, clear, commented code Strong troubleshooting and problem-solving abilities What compensation do we offer? Digital Foundry offers a comprehensive compensation and benefits package including a competitive salary and performance bonuses; medical, dental, and vision benefits; and a matching 401(k) retirement program. All employees get up to three weeks of time off in their first year! Thank you for your interest in Digital Foundry. We look forward to hearing from you Digital Foundry, Inc. is an equal opportunity employer that is dedicated to a policy of non discrimination in employment and does not discriminate in hiring or employment on the basis of race, religion, creed, color, sex, sexual orientation, age, national origin, ancestry, mental or physical handicap, disability, or veteran status. nnK2TNBH5S If you require alternative methods of application or screening, you must approach the employer directly to request this as Indeed is not responsible for the employer's application process.",https://www.indeed.com/jobs?q=Software+Engineer&l=San+Francisco%2C+CA&sc=0kf%3Aattr%28EXSNN%7CFCGTU%7CHFDVW%7CQJZM9%7CUTPWG%252COR%29explvl%28ENTRY_LEVEL%29jt%28fulltime%29%3B&radius=50&start=10&pp=gQAPAAAAAAAAAAAAAAAB_iDBCAAeAQBSabTA9edema6Cf8tNOegvxrD-fypUTndlxSmeAAA&vjk=1e618375dcf8f6a3
7,50f44e2d16db8aee,Software Engineer,"San Francisco, CA",ENTRY_LEVEL,EXSNN|FCGTU|HFDVW|QJZM9|UTPWG%2COR,fulltime,"Software Engineer, iOS, IXL Mobile - job post IXL Learning 28 reviews San Mateo, CA 94404 • Hybrid remote Full-time IXL Learning 28 reviews Read what people are saying about working here. You must create an Indeed account before continuing to the company website to apply Apply on company site save-icon Job details Job Type Full-time IXL Learning, a leading edtech company with products used by 14 million students worldwide, is seeking highly motivated iOS Engineers who will lead in the creation of a breakthrough user experience by developing the features of our iOS applications. The IXL Mobile team is small, collaborative, and passionate about researching and implementing the best in mobile engineering. As a Software Engineer on the IXL Mobile team, you will manage the full technical life-cycle of building features, fixing bugs, and improving our technology. We find it immensely satisfying to develop products that impact the lives of millions, and we are eager to have you join our team. International candidates encouraged to apply; H1B sponsorship is available. *This is a full-time position in our San Mateo, CA office with a hybrid work schedule.* WHAT YOU'LL BE DOING Research and adapt functionality to leverage existing iOS design patterns Work across disciplines with team members representing product, content, and web development Code with Swift and iOS frameworks New feature development, testing, maintenance of existing features, and bug fixes WHAT WE'RE LOOKING FOR 1+ years of software engineering Bachelor's or advanced degree in computer science or a related discipline Knowledge of iOS app development Familiarity with back-end development A good understanding of managing limited resources (memory, network, CPU) efficiently Strong analytical-reasoning and problem-solving skills Ability to collaborate in a small team Passion for improving education through technology Our salary ranges are determined by role, level, and location. The base salary range for this full-time position is $110,000 to $150,000 + equity + benefits. The range displayed on each job posting reflects the minimum and maximum target for new hire salaries for the position. Individual pay is determined by work location and additional factors, including job-related skills, experience, and relevant education or training. Your recruiter can share more about the specific salary range for your preferred location during the hiring process. #li-hybrid At IXL, we value diversity in age, race, ethnicity, gender, sexual orientation, physical and mental ability, political and religious beliefs, and life experience, and we are proud to promote a work environment where everyone, from any background, can do their best work. IXL Learning is an Equal Opportunity Employer.",https://www.indeed.com/jobs?q=Software+Engineer&l=San+Francisco%2C+CA&sc=0kf%3Aattr%28EXSNN%7CFCGTU%7CHFDVW%7CQJZM9%7CUTPWG%252COR%29explvl%28ENTRY_LEVEL%29jt%28fulltime%29%3B&radius=50&start=10&pp=gQAPAAAAAAAAAAAAAAAB_iDBCAAeAQBSabTA9edema6Cf8tNOegvxrD-fypUTndlxSmeAAA&vjk=50f44e2d16db8aee
8,7ac4b6b29f5d1649,Software Engineer,"San Francisco, CA",ENTRY_LEVEL,EXSNN|FCGTU|HFDVW|QJZM9|UTPWG%2COR,fulltime,"Software Engineering New College Graduate - job post Cohesity 12 reviews San Jose, CA 95110 • Remote $86,000 - $110,000 a year -  Full-time Cohesity 12 reviews Read what people are saying about working here. You must create an Indeed account before continuing to the company website to apply Apply on company site save-icon Job details Salary $86,000 - $110,000 a year Job Type Full-time Cohesity is on a mission to radically simplify how organizations secure and manage their data, while unlocking limitless value. As a leader in data security and management, we make it easy to secure, protect, manage and derive value from data—across the data center, edge, and cloud. At Cohesity, we're a group of builders and go-getters who are committed to doing the right thing. We encourage you to come as you are, as our differences make us stronger. We've been named a Leader by multiple analyst firms and are prominently featured in the Forbes Cloud 100 and CRN's Coolest Cloud companies. Join us and we'll lead the way together. It's time for us to reevaluate the world of data management TOGETHER! Cohesity radically simplifies data management. We make it easy to back up, manage, and derive value from data - across the data center, edge and cloud. Cohesity also helps ensure data is in compliance and protected against ransomware attacks. We offer a full suite of services for handling data, consolidated on one multi-cloud data platform, reducing complexity and eliminating mass data fragmentation. Cohesity can be delivered as a service, self-managed, or provided by a Cohesity-powered partner. We've been named a Leader by multiple analyst firms, and are prominently featured in the Forbes Cloud 100 and CRN's Coolest Cloud companies. Our growth is off the charts, and we're just getting started! As a Software Engineering graduate, you will be an integral part of our software engineering teams, contributing to the same sophisticated challenges they're passionate about. Voted Forbes top 40 hottest startups, you would be working on innovative distributed systems technology and building product features that customers will use. To ship successful products, you will learn how to develop high-quality software and understand the various software development processes. We are looking for technically strong, motivated and dedicated individuals to join our team - are you willing to tap into your expertise and creative ideas to use? How you'll spend your time here Work alongside your mentor and your team to build product features and solve real problems at substantial scale You'll be exposed to groundbreaking technologies in distributed systems and hyper-converged systems space. Participate in our values and mission in redefining data and deliver impact while deepening your technical WE'D LOVE TO TALK TO YOU IF YOU HAVE MANY OF THE FOLLOWING Strong programming skills in any: C, C++, or Go and OOP and proficient in Data Structure, Algorithms and Systems Design Working experience involving Unix/Linux environments, distributed or parallel systems, machine learning, asynchronous programming, networking, developing large software systems, and/or security software development. Love solving difficult problems and possess critical thinking abilities. Coachable, motivated, and humble Ability to demonstrate their own projects and achievements Willing to tackle difficult problems with a positive approach. BS, MS or Ph.D degree in Computer Science or related field at accredited University, and Graduation/Completion date on/after Dec 2022 Disclosure Pursuant to Applicable State Equal Pay Transparency Laws - This position has a starting pay range as listed below. Actual salary depends upon many factors, including a candidate’s skills, qualifications and experience, location, and salary expectations, and therefore a starting salary at the low end, high end, or even above the stated range may be offered. This position may also be eligible for bonus compensation, commission (if in a sales function), and/or equity grants. Additionally, full-time employees are eligible to participate in our comprehensive benefits framework , including health and wellness benefits, vacation, paid holidays and refresh days, 401(k) retirement plan, life and disability insurance coverages, and other benefits the Company may offer from time to time. US Pay Range $86,000—$110,000 USD Data Privacy Notice for Job Candidates: For information on personal data processing, please see our Privacy Policy . Equal Employment Opportunity Employer (EEOE) Cohesity is an Equal Employment Opportunity Employer. All qualified applicants will receive consideration for employment without regard to race, color, creed, religion, sex, sexual orientation, national origin or nationality, ancestry, age, disability, gender identity or expression, marital status, veteran status or any other category protected by law. If you are an individual with a disability and require a reasonable accommodation to complete any part of the application process, or are limited in the ability or unable to access or use this online application process and need an alternative method for applying, you may contact us at 1-855-9COHESITY or talent@cohesity.com for assistance. COVID-19 Cohesity may require employees who enter its offices to be fully vaccinated against the COVID-19 virus and to provide documented proof thereof. Cohesity will comply with applicable law regarding the reasonable accommodation of individuals who are not vaccinated because of a sincerely held religious belief, disability or medical condition. This vaccination requirement does not apply to employees who work remotely and do not enter Cohesity offices.",https://www.indeed.com/jobs?q=Software+Engineer&l=San+Francisco%2C+CA&sc=0kf%3Aattr%28EXSNN%7CFCGTU%7CHFDVW%7CQJZM9%7CUTPWG%252COR%29explvl%28ENTRY_LEVEL%29jt%28fulltime%29%3B&radius=50&start=10&pp=gQAPAAAAAAAAAAAAAAAB_iDBCAAeAQBSabTA9edema6Cf8tNOegvxrD-fypUTndlxSmeAAA&vjk=7ac4b6b29f5d1649
