,job_id,job_title,location,experience,education,job_type,job_description,job_link
9,a6191c240f75a634,Software Engineer,"San Francisco, CA",ENTRY_LEVEL,EXSNN|FCGTU|HFDVW|QJZM9|UTPWG%2COR,fulltime,"Machine Learning Engineer - job post DeepMotion San Francisco Bay Area, CA Full-time You must create an Indeed account before continuing to the company website to apply Apply on company site save-icon Job details Job Type Full-time DeepMotion is a leader in the thriving field of motion intelligence, with a mission to breathe life into digital characters using AI-powered motion capture and real-time 3D body tracking. It's an exciting time to join, with the rapid advancement of AI technologies, we are continuously bringing innovative new solutions to our users, whose stories you get to tell. Led by members from Blizzard, Disney, ROBLOX and Ubisoft, we're leveraging decades of experience to build a platform that creators of all levels can use for accessible 3D animation generation. Machine Learning Engineer We are building the next-generation animation creation platform that enables a new level of interactivity with cloud-based machine learning models. We are looking for a machine learning engineer who can help us create the server-side engine that powers our interactive tools for AI based motion capture and motion synthesis. We are looking for someone who is deeply interested in the intersection of machine learning and systems design, and has extensive experience building web-based content creation applications. Responsibilities: Develop and train algorithms and models to power the motion perception and generation engine Design, build and manage large scale text, video and motion datasets for the training of multi-model motion perception and generation models Develop, deploy and optimize the inference frameworks for motion perception and generation on the cloud Research, analyze, develop and test machine learning components necessary for business strategies and roadmap Requirements: A BS or MS is required in Computer Science, Engineering specializing in computer vision, machine learning, robotics, or artificial intelligence Solid knowledge of at least one machine learning research framework (e.g. PyTorch, Tensorflow) Solid knowledge of at least one high-performance inference framework (e.g. TensorRT, Apache TVM) Experience profiling and optimizing deep neural networks, including knowledge of GPU profiling tools such as NVIDIA Nsight Nice to have: Familiarity with Python-based image and video manipulation/encoding/decoding frameworks, such as OpenCV and PyAV Experience with cloud orchestration systems such as Kubernetes and cloud providers such as AWS, GCP, and Azure Knowledge of transformers, diffusion models and multimodal discrimitive and generative models Ability to write robust and maintainable client-server architectures and APIs Please send your resume and cover letter to jobs@deepmotion.com",https://www.indeed.com/jobs?q=Software+Engineer&l=San+Francisco%2C+CA&sc=0kf%3Aattr%28EXSNN%7CFCGTU%7CHFDVW%7CQJZM9%7CUTPWG%252COR%29explvl%28ENTRY_LEVEL%29jt%28fulltime%29%3B&radius=50&start=10&pp=gQAPAAAAAAAAAAAAAAAB_iDBCAAeAQBSabTA9edema6Cf8tNOegvxrD-fypUTndlxSmeAAA&vjk=a6191c240f75a634
10,0cef493ff52c90c6,Software Engineer,"San Francisco, CA",ENTRY_LEVEL,EXSNN|FCGTU|HFDVW|QJZM9|UTPWG%2COR,fulltime,"HomeKit Software Engineer - job post Apple 11,768 reviews Cupertino, CA Full-time Apple 11,768 reviews Read what people are saying about working here. You must create an Indeed account before continuing to the company website to apply Apply on company site save-icon Job details Job Type Full-time Summary Posted: Mar 21, 2023 Weekly Hours: 40 Role Number: 200470457 The HomeKit team provides the foundation that enables an entire ecosystem of secure and intelligent home connectivity. We are developing technologies and crafting experiences that revolutionize the way people interact with the accessories around them. The team is seeking a hardworking engineer to help build the Home automation platform and take it to the next level. Key Qualifications You are an accomplished coder in C and object-oriented languages, such as C++ or Objective-C You have a well-founded grasp of computer science fundamentals You demonstrate a comprehensive knowledge of wireless technologies and protocols knowledge is a plus You have experience shipping real products to customers You thrive in a collaborative environment You have excellent communication skills A real passion for product quality and attention to detail Ability to work in a rapid development cycle with tight schedules You are obsessively passionate and inquisitive, and seek to solve everyday problems in innovative ways Laser-focused on the smallest details that are meaningful to our customers Description You will develop the framework that enables accessories, iOS devices, and apps to work together to build an amazing product. You will work on different layers of the software stack, from network protocol design and implementation, to developer APIs, to defining the customer experience. You'll be responsible for maintaining and improving existing features and implementing new and innovative ideas for the future. Our goals are simple but the task is large; craft the most amazing home automation experience in the world that our customers will love. WWDC 2018: https://developer.apple.com/videos/play/wwdc2018/231/ Education & Experience Bachelor's degree in Computer Engineering, Computer Science or equivalent experience. Additional Requirements Pay & Benefits At Apple, base pay is one part of our total compensation package and is determined within a range. This provides the opportunity to progress as you grow and develop within a role. The base pay range for this role is between $50.72 and $76.44/hr, and your base pay will depend on your skills, qualifications, experience, and location. Apple employees also have the opportunity to become an Apple shareholder through participation in Apple’s discretionary employee stock programs. Apple employees are eligible for discretionary restricted stock unit awards, and can purchase Apple stock at a discount if voluntarily participating in Apple’s Employee Stock Purchase Plan. You’ll also receive benefits including: Comprehensive medical and dental coverage, retirement benefits, a range of discounted products and free services, and for formal education related to advancing your career at Apple, reimbursement for certain educational expenses — including tuition. Additionally, this role might be eligible for discretionary bonuses or commission payments as well as relocation. Learn more about Apple Benefits. Note: Apple benefit, compensation and employee stock programs are subject to eligibility requirements and other terms of the applicable plan or program.",https://www.indeed.com/jobs?q=Software+Engineer&l=San+Francisco%2C+CA&sc=0kf%3Aattr%28EXSNN%7CFCGTU%7CHFDVW%7CQJZM9%7CUTPWG%252COR%29explvl%28ENTRY_LEVEL%29jt%28fulltime%29%3B&radius=50&start=10&pp=gQAPAAAAAAAAAAAAAAAB_iDBCAAeAQBSabTA9edema6Cf8tNOegvxrD-fypUTndlxSmeAAA&vjk=0cef493ff52c90c6
11,e0de37216f74848f,Software Engineer,"San Francisco, CA",ENTRY_LEVEL,EXSNN|FCGTU|HFDVW|QJZM9|UTPWG%2COR,fulltime,"Software Engineer - job post Express Global Solutions 4 reviews Union City, CA 94587 • Remote Full-time Express Global Solutions 4 reviews Read what people are saying about working here. You must create an Indeed account before continuing to the company website to apply Apply on company site save-icon Job details Job Type Full-time Job Description Design, develop and modify software systems and implement new applications. Collaborate with technical staff, management, and business operations staff throughout all phases of the software development life cycle in order to deliver working solutions to complex business problems. Create builds, Staging and deploying Software Content across multiple environments (DEV, QA, Test, Staging, pre-prod and Production). Modify existing software to correct errors, tune the code for better performance. Analyze business user needs, functional and technical requirements to determine feasibility of design within time and cost constraints. Identify, Investigate the root cause, analyze, and document problems with software product functionality and the software program output. Working with analysts, developers and architects to design and discus the project limitations and capabilities. Managing and applying security updates on infrastructure and assisting with building out server automation across the entire infrastructure Creating the test scenarios and test process with documentation. Technical writing, testing and debugging the code, follow Quality assurance processes to adhere to company standards. Position One (1), Full Time Hours per week Forty (40) Work Schedule 9:00 A.M. to 5:00 P.M PST Rate of Pay $90k - $135k Per anum Job Location 2600 Central Ave, Suite O Union City, CA 94587 Requirements Requires Bachelor’s Degree in Computer Science, Engineering, or related technical field. Requires proficient knowledge in the following skills: SQL, JDBC, VLAN, TCP/IP, VLSM, UML, DATA MINING, JAVA, API, OBJECT ORIENTED PROGRAMMING. Proficient knowledge may be obtained through education and experience. May travel to various unanticipated worksites in the US and telecommute. (OR) Requires Bachelor’s Degree in Computer Science, Engineering, or related technical field. Requires proficient knowledge in the following skills: C, MOBILE APP DEV W/ ANDROID, SQLITE, SQL, C#, .NET, UML. Proficient knowledge may be obtained through education and experience. May travel to various unanticipated worksites in the US and telecommute. (OR) Requires Bachelor’s Degree in Computer Science, Engineering, or related technical field. Requires proficient knowledge in the following skills: JAVA, DATA BASE, MOBILE COMPUTING - IOS, C, UNIX, DEVELOPMENT OF WEB APPS AND SERV, OBJECT ORIENTED PROGRAMMING. Proficient knowledge may be obtained through education and experience. May travel to various unanticipated worksites in the US and telecommute.",https://www.indeed.com/jobs?q=Software+Engineer&l=San+Francisco%2C+CA&sc=0kf%3Aattr%28EXSNN%7CFCGTU%7CHFDVW%7CQJZM9%7CUTPWG%252COR%29explvl%28ENTRY_LEVEL%29jt%28fulltime%29%3B&radius=50&start=10&pp=gQAPAAAAAAAAAAAAAAAB_iDBCAAeAQBSabTA9edema6Cf8tNOegvxrD-fypUTndlxSmeAAA&vjk=e0de37216f74848f
12,954191f6a3dff0c2,Software Engineer,"San Francisco, CA",ENTRY_LEVEL,EXSNN|FCGTU|HFDVW|QJZM9|UTPWG%2COR,fulltime,"Software Engineer (Java Full Stack) - Enterprise Technology Services - job post Apple 11,768 reviews Cupertino, CA Full-time Apple 11,768 reviews Read what people are saying about working here. You must create an Indeed account before continuing to the company website to apply Apply on company site save-icon Job details Job Type Full-time Summary Posted: Mar 27, 2023 Weekly Hours: 40 Role Number: 200469702 Do you like to address sophisticated problems in order to delight customers? Want to work side-by-side with hard-working and versatile people who love their jobs? Do you like the excitement of a start-up, but the stability of a large company? We're looking for a developer who want to be part of a team focussed on implementing and maintaining highly scalable, low-latency, distributed enterprise platforms. You'll need to have superb communication and collaboration skills, be able to make progress despite ambiguous circumstances, be a self starter, a quick learner of new technologies and have experience shipping products. You will be a critical part of the core engineering team for a hard-working, low latency enterprise application. You will be responsible for planning and design of new functionality, supplying to architecture of core functionality and future planning for this exciting endeavor. We need someone who is something of a generalist - a specialist who can work on new features one day and optimize inner loops the next. Key Qualifications Excellent Java development experience – full stack engineer preferred. Proven track record developing Java/J2EE applications, with specific focus on reliability, scalability, and performance. Shown understanding of object-oriented techniques, algorithms, Java design patterns and reusable component design. Hands-on experience with building and maintaining distributed WebServices based upon service-oriented architecture (SOA) methodologies. Expertise with Oracle database: design database schemas, write and tune SQL queries, develop Oracle PL/SQL packages and procedures, debug performance issues and optimization. Knowledge of Oracle failover and replication strategies Experience crafting features to be bullet proof, and low maintenance Proven record of completing projects timely and to specification Strong analysis, problem solving, and troubleshooting skills Good verbal and written communications skills Passion for the customer, user experience and actioning user feedback Excellent prioritization and scheduling skills Attention to detail and the ability to master new applications and technologies quickly Ability to thrive in within your team and cross functional Strong analysis, problem solving, and troubleshooting skills Focus on delivering with high quality, complete with unit and integration tests Good grasp of relational and no-SQL database technology Familiarity with clustered server architectures Hands-on exposure to Agile methodologies Description Participate in every stage of feature development from design and brainstorming through feature implementation, including fixing that last critical bug under a tight release deadline. Work as part of a dynamic team collaborating closely with other specialists, engineering teams and product owners. Review stories and provide feedback Build technical specifications and design artifacts Implement major features from scratch Create unit tests for features Perform code reviews Work with QA to ensure the quality of the feature Give to design & overall product architecture Education & Experience BS Software Engineering or Computer science Additional Requirements Pay & Benefits At Apple, base pay is one part of our total compensation package and is determined within a range. This provides the opportunity to progress as you grow and develop within a role. The base pay range for this role is between $130,000 and $196,500, and your base pay will depend on your skills, qualifications, experience, and location. Apple employees also have the opportunity to become an Apple shareholder through participation in Apple’s discretionary employee stock programs. Apple employees are eligible for discretionary restricted stock unit awards, and can purchase Apple stock at a discount if voluntarily participating in Apple’s Employee Stock Purchase Plan. You’ll also receive benefits including: Comprehensive medical and dental coverage, retirement benefits, a range of discounted products and free services, and for formal education related to advancing your career at Apple, reimbursement for certain educational expenses — including tuition. Additionally, this role might be eligible for discretionary bonuses or commission payments as well as relocation. Learn more about Apple Benefits. Note: Apple benefit, compensation and employee stock programs are subject to eligibility requirements and other terms of the applicable plan or program.",https://www.indeed.com/jobs?q=Software+Engineer&l=San+Francisco%2C+CA&sc=0kf%3Aattr%28EXSNN%7CFCGTU%7CHFDVW%7CQJZM9%7CUTPWG%252COR%29explvl%28ENTRY_LEVEL%29jt%28fulltime%29%3B&radius=50&start=10&pp=gQAPAAAAAAAAAAAAAAAB_iDBCAAeAQBSabTA9edema6Cf8tNOegvxrD-fypUTndlxSmeAAA&vjk=954191f6a3dff0c2
13,991b7c0939d2e2d0,Software Engineer,"San Francisco, CA",ENTRY_LEVEL,EXSNN|FCGTU|HFDVW|QJZM9|UTPWG%2COR,fulltime,"Software Development Engineer - job post Fortinet 149 reviews Sunnyvale, CA 94086 Full-time Fortinet 149 reviews Read what people are saying about working here. You must create an Indeed account before continuing to the company website to apply Apply on company site save-icon Job details Job Type Full-time Job Responsibilities: Participate in the development of Microservices, API, and backend services. Take part in the design, development, and testing of various products. Solve problems during development, testing, and provide technical support for products. Study suitable algorithms and operating mechanisms. Write technical documentation for products. Job Requirements: Bachelor's Degree majored in Computer Science or Engineering who can program. Having experience in using one of these languages: C, Golang, Python. Show good habits such as documentation and proficiency in file compilation. Developing on Linux is preferable. Master the data structure and algorithm technique, be proficient in network programming and be familiar with network protocols such as TCP/IP, HTTP. Think clearly, work well in a team, take the initiative, and seek continuous improvement. The US base salary range for this full-time position is $100000-$145000. Fortinet offers employees a variety of benefits, including medical, dental, vision, life and disability insurance, 401(k), 11 paid holidays, vacation time, and sick time as well as a comprehensive leave program. Wage ranges are based on various factors including the labor market, job type, and job level. Exact salary offers will be determined by factors such as the candidate's subject knowledge, skill level, qualifications, experience, and geographic location. All roles are eligible to participate in the Fortinet equity program, Bonus eligibility is reviewed at time of hire and annually at the Company’s discretion. #LI-LO1 #GD",https://www.indeed.com/jobs?q=Software+Engineer&l=San+Francisco%2C+CA&sc=0kf%3Aattr%28EXSNN%7CFCGTU%7CHFDVW%7CQJZM9%7CUTPWG%252COR%29explvl%28ENTRY_LEVEL%29jt%28fulltime%29%3B&radius=50&start=10&pp=gQAPAAAAAAAAAAAAAAAB_iDBCAAeAQBSabTA9edema6Cf8tNOegvxrD-fypUTndlxSmeAAA&vjk=991b7c0939d2e2d0
14,ff0aa224ef8efed7,Software Engineer,"San Francisco, CA",ENTRY_LEVEL,EXSNN|FCGTU|HFDVW|QJZM9|UTPWG%2COR,fulltime,"Software / Robotics Engineer (Python, C++) - (on-site) Champaign, IL - job post Yummy Future San Jose, CA From $80,000 a year -  Full-time You must create an Indeed account before continuing to the company website to apply Apply on company site save-icon Job details Salary From $80,000 a year Job Type Full-time Overview Yummy Future is a food & beverage robotics startup(Yummy-future.com). We design, build and operate robotic coffee shops. We are looking for highly energetic and innovative engineers to build top-notch, effective robotics solutions that are going to bring a huge impact on our daily life. This is a perfect company to acquire hands-on robotics experience and be part of a fast-evolving robotics industry. Location United States – Illinois – Champaign Role Software / Robotics Engineer (Python, C++) Employment Type Full-time Responsibilities Design, develop, and maintain software and robotics systems using Python and C++ Collaborate with cross-functional teams to ensure that software and robotics systems meet requirements Troubleshoot and debug software and robotics systems to ensure their smooth operation Develop and execute software and robotics tests to ensure their functionality and reliability Optimize software and robotics systems for performance, scalability, and maintainability Stay up-to-date with emerging trends and technologies in the software and robotics fields Qualifications Bachelor's degree in Computer Science, Mechanical Engineering, Electrical Engineering, Robotics engineering, or a related field Proficiency in Python and C++ Experience in software and robotics development Experience in Linux and embedded systems like Arduino, Raspberry Pi, ESP32, STM32, etc. Familiarity with back-end technologies in robotics systems Strong analytical and problem-solving skills Excellent communication and teamwork skills Visa Sponsorship We sponsor CPT, OPT, and H1B Application Process To apply for this position, please fill out our application form Job Type: Full-time Pay: From $80,000.00 per year Schedule: Monday to Friday Work Location: In person",https://www.indeed.com/jobs?q=Software+Engineer&l=San+Francisco%2C+CA&sc=0kf%3Aattr%28EXSNN%7CFCGTU%7CHFDVW%7CQJZM9%7CUTPWG%252COR%29explvl%28ENTRY_LEVEL%29jt%28fulltime%29%3B&radius=50&start=10&pp=gQAPAAAAAAAAAAAAAAAB_iDBCAAeAQBSabTA9edema6Cf8tNOegvxrD-fypUTndlxSmeAAA&vjk=ff0aa224ef8efed7
15,567d026ba33d2ff8,Software Engineer,"San Francisco, CA",ENTRY_LEVEL,EXSNN|FCGTU|HFDVW|QJZM9|UTPWG%2COR,fulltime,"Research Software Engineer II, CRISPR - job post Genentech (part of Roche) 1,023 reviews San Francisco, CA Full-time Genentech 1,023 reviews Read what people are saying about working here. You must create an Indeed account before continuing to the company website to apply Apply on company site save-icon Job details Job Type Full-time The Position We are seeking a highly motivated software engineer with a strong background in bioinformatics to join Genentech’s Data Science and Statistical Computing group to support the software development of tools for the design, analysis, and curation of emerging functional genomics data generated across the Research organization. The successful candidate will work in a collaborative environment, partnering closely with data scientists, computational biologists, software engineers and technology development scientists to develop, deploy, and maintain scientific software solutions to address computational needs driven by emerging functional genomics approaches such as CRISPR, base editing and prime editing. In particular, the candidate will be responsible for the development of production-level interactive applications on top of extending and maintaining existing internal CRISPR databases. Communication of results to a diverse audience of quantitative and experimental scientists will be key, and external publication of both software and methodological innovations is strongly encouraged. Requirements MS or Ph.D. in bioinformatics, biostatistics, computer science, mathematics, or similar, with a strong record of software development. Qualifications Extensive experience in the use of a high-level programming language such as R (preferred) or Python for statistics and computational biology. Experience with web application development (Shiny preferred). Experience with UNIX and shared high-performance computing environments. Experience with assays and accompanying data formats used in molecular biology such as those for next-generation sequencing and various modalities of CRISPR technology. Experience with the Bioconductor ecosystem a plus. Strong knowledge of CRISPR-based technologies and experimental designs encouraged. Ability to work independently and collaboratively on multiple fast-paced projects in molecular biology and genomics. Collaborative researcher, making co-author level contributions to scientific publications. Relocation benefits are available for this job posting. #LI-GL2 #gREDinformatics #RISE The expected salary range for this position based on the primary location of California is $97,400 to $190,800. Actual pay will be determined based on experience, qualifications, geographic location, and other job-related factors permitted by law. A discretionary annual bonus may be available based on individual and Company performance. This position also qualifies for the benefits detailed at the link provided below. Benefits Genentech is an equal opportunity employer, and we embrace the increasingly diverse world around us. Genentech prohibits unlawful discrimination based on race, color, religion, gender, sexual orientation, gender identity or expression, national origin or ancestry, age, disability, marital status and veteran status. Genentech requires all new hires to be fully vaccinated against COVID-19 as of their start date. This requirement is a condition of employment at Genentech, and it applies regardless of whether the position is located at a Genentech campus or is fully remote. If you are unable to receive the vaccine due to a disability or serious medical condition, or because it is prohibited as a result of your sincerely held religious beliefs, you will have an opportunity to request a reasonable accommodation.",https://www.indeed.com/jobs?q=Software+Engineer&l=San+Francisco%2C+CA&sc=0kf%3Aattr%28EXSNN%7CFCGTU%7CHFDVW%7CQJZM9%7CUTPWG%252COR%29explvl%28ENTRY_LEVEL%29jt%28fulltime%29%3B&radius=50&start=20&pp=gQAeAAAAAAAAAAAAAAAB_iDBCAAnAQEBCAlR5A0J_Ug3OLxtckb1MJGH5gBqkFLAKtA8TJhgkS8UwBkIAAA&vjk=567d026ba33d2ff8
