,job_id,job_title,location,experience,education,job_type,job_description,job_link
44,17d2fdeeaa8ee291,Software Engineer,"Los Angeles, CA",SENIOR_LEVEL,BACHELORS_DEGREE,fulltime,"Senior Optical Engineer IV (TS/SCI) - job post JPL/NASA 191 reviews Pasadena, CA 91109 Full-time JPL/NASA 191 reviews Read what people are saying about working here. You must create an Indeed account before continuing to the company website to apply Apply on company site save-icon Job details Job Type Full-time Job Details New ideas are all around us, but only a few will change the world. That’s our focus at JPL. We ask the biggest questions, then search the universe for answers—literally. We build upon ideas that have guided generations, then share our discoveries to inspire generations to come. Your mission—your opportunity—is to seek out the answers that bring us one step closer. If you’re driven to discover, create, and inspire something that lasts a lifetime and beyond, you’re ready for JPL. Located in Pasadena, California, JPL has a campus-like environment situated on 177 acres in the foothills of the San Gabriel Mountains and offers a work environment unlike any other: we inspire passion, foster innovation, build collaboration, and reward excellence. Responsibilities: The Optics Section provides world-leading capability and expertise in a wide range of technologies that are critical to the development of optical instruments. Section leadership and expertise are specifically applied to the development of advanced ground and space-based optical systems in the following areas: research and development of optics-related technologies; system architecture and concept definition; detailed optical system design, opto-mechanical design, analysis, and implementation; and alignment, test, and calibration of optical instruments and systems. We invite you to join the Optics Section within the Wavefront Sensing and Control Group to serve as an Optical Engineer IV. You will be reporting administratively to the Group Supervisor of the Group . The Wavefront Sensing and Control Group develops active wavefront sensing and control and optical metrology architectures for large-aperture space and ground-based telescopes. In addition, the group develops wavefront control system testbeds for technology validation. Finally, they develop active optical system architectures and perform integrated modeling and systems engineering for space telescopes. We seek an engineer to support performance analysis and image processing chains for the development of various large aperture optical systems . This includes: End-to-end image chain analysis and performance modeling of complex optical systems for Visible, IR, and UV including spectroscopy Development and maintenance of performance error budgets capturing sources from fabrication, assembly, and environments Qualifications: Bachelor’s degree in Optics, Physics, or Electrical Engineering with 9 years of related experience, or Masters with 7 years of related experience, or PhD with 5 years of related experience Experience with image-based methods and deconvolution including time-series exploitation Hands-on experience and practical advanced knowledge in hardware integration and state-of-the-art measurement techniques Experience developing optical systems from a concept through delivery, commissioning, and operations Extensive understanding of fundamental principles, theories, and concepts with applications to optical systems including Fourier optics Extensive experience with Python and/or MATLAB Experience leading a multifunctional and/or multidisciplinary team for a project within scope of assigned responsibility. Preferred Skills Significant expertise working with optical instruments such as wavefront control systems, telescopes, imagers, spectrometers, and interferometers Experience with CodeV or other optical design tools Experience with software Continuous Integration including best practices using configuration management Working knowledge of analyzing optics metrics such at OTF, MTF, and image sharpness Note: Must have an active Top Secret clearance based on a Single Scope Background Investigation (SSBI) within the last five years and be approved for Sensitive Compartmented Information (SCI) access. JPL has a catalog of benefits and perks that span from the traditional to the unique. This includes a variety of health, dental, vision, wellbeing, and retirement plans, paid time off, learning, rideshare, childcare, flexible schedule, parental leave and many more. Our focus is on work-life balance, and living healthy, fulfilling lives as we Dare Mighty Things Together. For benefits eligible positions, benefits are effective the first day of the month coincident with or immediately following the employee’s start date. For further benefits information click Benefits and Perks The hiring range displayed below is specifically for those who will work in or reside in the location listed. In extending an offer, Jet Propulsion Laboratory considers factors including, but not limited to, the candidate’s job related skills, experience, knowledge, and relevant education/training. Hiring range for this job may be adjusted based on primary work location outside of Pasadena, California. This adjusted range will be provided to candidates by the Recruiter when applicable. The typical full time equivalent annual hiring range for this job in Pasadena, California. $158,496 - $198,120 JPL is an Equal Opportunity Employer. All qualified applicants will receive consideration for employment without regard to sex, race, color, religion, national origin, citizenship, ancestry, age, marital status, physical or mental disability, medical condition, genetic information, pregnancy or perceived pregnancy, gender, gender identity, gender expression, sexual orientation, protected military or veteran status or any other characteristic or condition protected by Federal, state or local law. In addition, JPL is a VEVRAA Federal Contractor. EEO is the Law. EEO is the Law Supplement Pay Transparency Nondiscrimination Provision The Jet Propulsion Laboratory is a federal facility. Due to rules imposed by NASA, JPL will not accept applications from citizens of designated countries or those born in a designated country unless they are Legal Permanent Residents of the U.S or have other protected status under 8 U.S.C. 1324b(a)(3). The Designated Countries List is available here.",https://www.indeed.com/jobs?q=Software+Engineer&l=Los+Angeles%2C+CA&sc=0kf%3Aattr%28FCGTU%7CHFDVW%7CQJZM9%7CUTPWG%252COR%29explvl%28SENIOR_LEVEL%29jt%28fulltime%29%3B&radius=50&start=70&pp=gQBpAAAAAAAAAAAAAAAB_jANOQA9AQEBDxD0kF6M8Q7elf3yDWAPju7egH_7QuPJFGAVahlGCESJujZBrs3ewXE-mOdS1AAsm7nxyuxrCU3TFwAA&vjk=17d2fdeeaa8ee291
45,c45de966a32a4897,Software Engineer,"Los Angeles, CA",SENIOR_LEVEL,BACHELORS_DEGREE,fulltime,"IoT Data Developer - job post ABBVIE 1,293 reviews Irvine, CA Full-time ABBVIE 1,293 reviews Read what people are saying about working here. You must create an Indeed account before continuing to the company website to apply Apply on company site save-icon Job details Job Type Full-time Responsible for compliance with applicable Corporate and Divisional Policies and procedures. Partner with the functional groups within the IT organization to communicate and clarify business needs, contribute to development of long-range system plans, and ensure products and services are aligned with business needs. Provides strategic consultancy support to customers in defining or designing business processes and researching and identifying enabling technologies based on customer requirements. Actively seek ways to apply technology to business processes, researching and providing information on technical trends and competitors' practices relevant to the assigned client business. Assess near-term needs utilizing structured interview processes to establish business priorities, consult with technical subject matter experts and develop alternative technical solutions; advise on options, risks, costs versus benefits, and impact on other business processes and system priorities. Ally with other IT functional areas to remain apprised of project status, and inform customer management of progress; conversely, keep the IT group's technology and service managers aware of user issues and potential potholes or resolve conflicts. Develop, motivate, and provide direction to technical team in a way that facilitates the creation of a team environment and enables team to fulfill the department's operation objectives. In specialized systems (ie. SAP) effectively set options to change the way the program works (configuration responsibilities). Bachelor's Degree with 7 years experience; Master's Degree with 6 years experience; PhD with 2 years experience. 10+ years of related work experience, or an equivalent combination of education and work experience. Previous experience working with Azure is required Applicable to California Applicants Only The below range is the range that we in good faith believe is the range of possible compensation for this role at the time of this posting. We may ultimately pay more or less than the posted range and this range is only applicable for jobs to be performed in California. This range may be modified in the future. The salary range for this role is posted below $115,000 - $161,250 This job is eligible to participate in our short-term incentive program This job is eligible to participate in our long-term incentive programs We offer a comprehensive package of benefits including paid time off (vacation, holidays, sick), medical/dental/vision insurance and 401(k) to eligible employees. Note: No amount of pay is considered to be wages or compensation until such amount is earned, vested, and determinable. The amount and availability of any bonus, commission, incentive, benefits, or any other form of compensation and benefits that are allocable to a particular employee remains in the Company's sole discretion unless and until paid and may be modified at the Company’s sole discretion, consistent with the law. AbbVie is an equal opportunity employer including disability/vets. It is AbbVie’s policy to employ qualified persons of the greatest ability without discrimination against any employee or applicant for employment because of race, color, religion, national origin, age, sex (including pregnancy), physical or mental disability, medical condition, genetic information, gender identity or expression, sexual orientation, marital status, status as a disabled veteran, recently separated veteran, Armed Forces service medal veteran or active duty wartime or campaign badge veteran or a person’s relationship or association with a protected veteran, including spouses and other family members, or any other protected group status. We will take affirmative action to employ and advance in employment qualified minorities, women, individuals with a disability, disabled veterans, recently separated veterans, Armed Forces service medal veterans or active-duty wartime or campaign badge veterans. The Affirmative Action Plan is available for viewing in the Human Resources office during regular business hours.",https://www.indeed.com/jobs?q=Software+Engineer&l=Los+Angeles%2C+CA&sc=0kf%3Aattr%28FCGTU%7CHFDVW%7CQJZM9%7CUTPWG%252COR%29explvl%28SENIOR_LEVEL%29jt%28fulltime%29%3B&radius=50&start=80&pp=gQB4AAAAAAAAAAAAAAAB_jANOQA_AQEBFAWDT9sgjU9QwMPi73v6S9qJLWytUTCX3yNwnS_GMzRPJGY9CuzOZhsaJsoGxYh1SJgXphznwuxJsBBsAAA&vjk=c45de966a32a4897
46,fa19db02abe0cb42,Software Engineer,"Los Angeles, CA",SENIOR_LEVEL,BACHELORS_DEGREE,fulltime,"Sr. Java Developer - job post Agama Solutions 4 reviews Pasadena, CA Full-time Agama Solutions 4 reviews Read what people are saying about working here. You must create an Indeed account before continuing to the company website to apply Apply on company site save-icon Job details Job Type Full-time Top Skills: Java development background. Agile process would be followed for development. JIRA is used for documentations so that would be preferred but if someone who has worked on Rally or on other systems that’s ok too. Job Description: Senior level lead type of person who has hands on experience, capabilities, and knowledge with Xstore by Oracle. Someone who has implemented large POS implementations, hands on experience, someone who has lead development and customization. At Kaiser they are implementing Xstore as a point of sales point of service system currently. Qualification: Bachelor’s degree as they would like this person to convert to a full-time employee. 10 years+ of experience. Someone who has led the development that kind of experience would help significantly.",https://www.indeed.com/jobs?q=Software+Engineer&l=Los+Angeles%2C+CA&sc=0kf%3Aattr%28FCGTU%7CHFDVW%7CQJZM9%7CUTPWG%252COR%29explvl%28SENIOR_LEVEL%29jt%28fulltime%29%3B&radius=50&start=80&pp=gQB4AAAAAAAAAAAAAAAB_jANOQA_AQEBFAWDT9sgjU9QwMPi73v6S9qJLWytUTCX3yNwnS_GMzRPJGY9CuzOZhsaJsoGxYh1SJgXphznwuxJsBBsAAA&vjk=fa19db02abe0cb42
47,839eceec7f14b3c4,Software Engineer,"Los Angeles, CA",SENIOR_LEVEL,BACHELORS_DEGREE,fulltime,"Senior Software Engineer (FT) - job post Beaker & Wrench Commerce, CA • Hybrid remote $100,000 - $140,000 a year -  Full-time Apply now Apply now save-icon Job details Salary $100,000 - $140,000 a year Job Type Full-time About the Job: Welcome to Beaker & Wrench, where we disrupted the status quo of the cannabis equipment industry with innovations on an inefficient old technology. Started from the ground up by an engineer and a chemist, Beaker & Wrench is celebrating its 6th year in business in 2022. Our engineering team consists of our CEO (a licensed professional mechanical engineer), and our Principal Mechanical Engineer. We have a team of 4 technicians who support the development, fabrication and assembly of our machines. We are headed in operations and RnD by our COO who is also an MIT graduate. A love of science and good engineering is at the heart of our company. We are looking for a driven, detail-orientated, lead software developer to join our growing organization. Projects include high-level development of novel software and applications to develop and integrate our machine control/GUI software into a cloud-based data collection and reporting service for client and internal use. We are currently building an industrial software platform for our industrial/chemical processing equipment. The ideal candidate will lead this effort to include the development and maintenance of automation code, controls hardware selection, GUI, and data logging, structure, and reporting via a Web-based interface. The position requires someone with strong communication skills that will be able to work under minimal supervision and meet all deadlines. If you're a dynamic team player who likes a challenge and wants to be on the forefront of the exploding cannabis equipment industry, Beaker & Wrench may be for you. Responsibilities: Developing control language for Industrial automation to include GUI, motion, digital and analog I/O and PIDs. Design, implement and update robust code for automated equipment with debugging and configuration parameters built-in. Create cloud environment database including design, development, maintenance and security of the system. Develop dashboards for data analysis and reporting via Web Client. Develop and implement protocols for secure wireless communications from multiple site locations. Maintain revision control and create a bug-reporting system. Requirements: Bachelor’s in Computer Science or related engineering discipline with 5+ years of post-graduate work experience. Direct previous experience with development/management of industrial automation. Work experience with database development, management and reporting. (SQL and NoSQL). Familiarity with Cloud environments (AWS). Strong skill set in the following languages: C++. C#. Python, HTML, Java, and Javascript. Experience with version control (Git/GitHub or similar). Hybrid position with the ability to work at least 60% time on site at the main facility in Commerce, California. Authorized to work in the U.S. Salary DOE experience. About Beaker & Wrench: Beaker & Wrench is the future of cannabis distillation technology and equipment. We are a small and mighty team that is in an inflection point, looking to hire more teammates and scale the company 2x in the next 12-18 months. If you like working for entrepreneurial companies with lots of autonomy and room to grow, look no further. We value respect, diversity, innovation, science, passion and humor. You can read more about each one below. Come be part of our growing team! If you require alternative methods of application or screening, you must approach the employer directly to request this as Indeed is not responsible for the employer's application process.",https://www.indeed.com/jobs?q=Software+Engineer&l=Los+Angeles%2C+CA&sc=0kf%3Aattr%28FCGTU%7CHFDVW%7CQJZM9%7CUTPWG%252COR%29explvl%28SENIOR_LEVEL%29jt%28fulltime%29%3B&radius=50&start=80&pp=gQB4AAAAAAAAAAAAAAAB_jANOQA_AQEBFAWDT9sgjU9QwMPi73v6S9qJLWytUTCX3yNwnS_GMzRPJGY9CuzOZhsaJsoGxYh1SJgXphznwuxJsBBsAAA&vjk=839eceec7f14b3c4
48,7d0ce0f6a5d58e80,Software Engineer,"Los Angeles, CA",SENIOR_LEVEL,BACHELORS_DEGREE,fulltime,"Senior Developer/Programmer - job post New Digital IT Pasadena, CA Full-time You must create an Indeed account before continuing to the company website to apply Apply on company site save-icon Job details Job Type Full-time We are looking for multiple JAVA/PaaS Senior Developer positions in Pleasanton, CA or Pasadena, CA. This is full time employment. Developer must have 5-7 years experience in Cloud migrations , Bluemix or Cloud Foundry preferred. US Citizens or Green Card holders preferred. Developer should be open to travel and relocation if needed. Minimum Bachelor’s Degree in Computer Science Expert level of core Java/J2EE modules Knowledge of JMS messaging and MQ (Message Queue) Knowledge of Apache Camel integration framework XML, Spring, web services Knowledge of IBM Bluemix PaaS or any Cloud Foundry PaaS (like Pivotal CF, HP Stackato) Nice to have microservices architecture knowledge Please send your resume to jobs@newdigitalit.com Report job",https://www.indeed.com/jobs?q=Software+Engineer&l=Los+Angeles%2C+CA&sc=0kf%3Aattr%28FCGTU%7CHFDVW%7CQJZM9%7CUTPWG%252COR%29explvl%28SENIOR_LEVEL%29jt%28fulltime%29%3B&radius=50&start=80&pp=gQB4AAAAAAAAAAAAAAAB_jANOQA_AQEBFAWDT9sgjU9QwMPi73v6S9qJLWytUTCX3yNwnS_GMzRPJGY9CuzOZhsaJsoGxYh1SJgXphznwuxJsBBsAAA&vjk=7d0ce0f6a5d58e80
49,8cb366a78c048254,Software Engineer,"Los Angeles, CA",SENIOR_LEVEL,BACHELORS_DEGREE,fulltime,"Senior Full Stack Developer - job post American Technical Services 5 reviews Norco, CA 92860 Full-time American Technical Services 5 reviews Read what people are saying about working here. You must create an Indeed account before continuing to the company website to apply Apply on company site save-icon Job details Job Type Full-time Job Location: Norco, California Job Status: Full Time Job Description: American Technical Services, Inc. (atspage.com), is a leading technology and engineering company providing government and commercial clients a wide range of metrology & calibration engineering services. We are currently seeking a senior front-end developer to assist us in the development of a web-based assets management, and metrology software. The successful candidate will be working closely with an outstanding team of engineers to develop new features and web applications for a cutting-edge asset management and metrology application used by major corporations. You will work closely with customers to conceptualize and implement new features; use the latest technologies to build new features that helps our customers run mission critical processes; test, troubleshoot, and fix front-end production issues. Position Requirements: BS/MS in Computer Science or related field 6+ years experience in frontend development Strong proficiency in: JavaScript Microsoft C# and ASP.Net jQuery Microsoft SQL Server HTML MVM and MVVM design patterns Microsoft Visual Studio REST Web API Working knowledge of the following is desirable: SAP Crystal Reports XI – 2013 js Bootstrap jQWidgets Web Control Framework Durandal SPA framework We offer a highly competitive salary and benefits package. Must be US citizen and eligible for DoD secret clearance.",https://www.indeed.com/jobs?q=Software+Engineer&l=Los+Angeles%2C+CA&sc=0kf%3Aattr%28FCGTU%7CHFDVW%7CQJZM9%7CUTPWG%252COR%29explvl%28SENIOR_LEVEL%29jt%28fulltime%29%3B&radius=50&start=80&pp=gQB4AAAAAAAAAAAAAAAB_jANOQA_AQEBFAWDT9sgjU9QwMPi73v6S9qJLWytUTCX3yNwnS_GMzRPJGY9CuzOZhsaJsoGxYh1SJgXphznwuxJsBBsAAA&vjk=8cb366a78c048254
