,job_id,job_title,location,experience,education,job_type,job_description,job_link
0,3d685479f9630bd8,Software Engineer,"Austin, TX",SENIOR_LEVEL,EXSNN|FCGTU|HFDVW|QJZM9|UTPWG%2COR,fulltime,"Senior Software Developer - job post Emerson 2,934 reviews Austin, TX • Hybrid remote Full-time Emerson 2,934 reviews Read what people are saying about working here. You must create an Indeed account before continuing to the company website to apply Apply on company site save-icon Job details Job Type Full-time If you are a Software Developer looking for an opportunity to grow, Emerson has an exciting opportunity for you! We are looking for innovative individuals who love solving problems and are committed to developing themselves and learning new skills. Based in our Austin, Texas location, you will be welcomed into a diverse community and work as a member of one of the cross-functional agile teams responsible for the development of the DeltaV Process Control System. DeltaV is the state of the art, flagship distributed process control system used by many of the top companies in chemical, life sciences and energy industries. It consists of a variety of rich desktop and web applications used for engineering and operating a process control system, plus real-time embedded firmware in controllers and field devices directly controlling the process. Successful applicants would be expected to enhance and maintain existing products as well as develop the next generation DeltaV control system. At Emerson, our passion is creating the innovation that makes the world healthier, safer, smarter, and more sustainable. Come join us! Hybrid Work Schedule – Remote Work Option This role has the flexibility of a remote work option up to three days a week. Our teams work together to ensure our chosen work schedules enable our creativity and productivity as we serve the needs of our customers. AS A SENIOR SOFTWARE DEVELOPER, YOU WILL: Collaborate – Foster a creative atmosphere, review and provide detailed feedback on peers’ design and code and participate in agile activities like sprint planning and retrospectives. Take part in Hackathons, Tech-talks, and Communities of Practice with like-minded people. Innovate – Develop technologies to maintain our market leadership using the latest tools and frameworks. Write software in accordance with requirements and specifications and use best practices to build in high-quality. Debug and validate software issues on the latest and greatest unreleased products as well as those encountered by customers. Automate – Write automated unit tests and system level tests to continue building our automation pipeline and a release-ready product. Iterate - Help the scrum team continuously improve its environment and processes. WHO YOU ARE: You anticipate the impact of emerging technologies and make necessary adjustments. You effectively communicate in various settings: one-on-one, small and large groups, or among diverse styles and position levels. You deal comfortably with the uncertainty of change. You create teamwork allowing others across the organization to achieve shared objectives. REQUIRED EDUCATION, EXPERIENCE & SKILLS: Bachelor’s degree in Computer/Electrical Engineering, Computer Science or a related engineering degree AND 3 or more years of relevant experience OR a Master’s degree in Computer/Electrical Engineering, Computer Science or related engineering degree AND 2 or more years of relevant experience Experience in the development of embedded real-time firmware/software in C/C++ Experience with commercial real-time embedded operating systems (QNX, Linux or similar) Experience using object-oriented design techniques PREFERRED EDUCATION, EXPERIENCE & SKILLS: Experience working in an Agile Scrum Team Experience architecting and designing embedded real-time applications Experience with low level microprocessor programming including PowerPC and Arm processors Experience with Visual Studio, Windows System Programming, Virtualization (Hyper-V, VMware) and GIT. Knowledge and experience working in the process control industry #LI-Hybrid WHY EMERSON Our Commitment to Our People Across the globe, we are united by a singular Purpose: We drive innovation that makes the world healthier, safer, smarter, and more sustainable. We invest in our employees to ensure they have the marketplace knowledge, skills, and competencies to bring this Purpose to life while competing and leading in a global economy. Our training programs focus on end-to-end development, from onboarding through senior leadership. Our success is measured by the positive impact we make on people, our communities, and the world through our unwavering focus on environmental, social, and regulatory progress. Learn more about us! Flexible and competitive benefits plans offer you the right options to meet your individual/family needs: medical insurance plans, dental and vision coverage, 401(k), tuition reimbursement and more. We also provide you flexible time-off plans, including paid parental leave, vacation, and holiday leave. Our Commitment to Diversity, Equity & Inclusion At Emerson, we are committed to fostering a culture where every employee is valued and respected for their experiences and perspectives – and that reflects the world around us. We believe a diverse, equitable and inclusive work environment contributes to the rich exchange of ideas that inspires innovation and brings the best solutions to our customers. This philosophy is fundamental to living our company’s values and our responsibility to leave the world in a better place. Learn more about our Culture & Values and Diversity, Equity & Inclusion at Emerson . Work Authorization Emerson will only employ those who are legally authorized to work in the United States. This is not a position for which sponsorship will be provided. Individuals with temporary visas such as E, F-1, H-1, H-2, L, B, J or TN, or who need sponsorship for work authorization now or in the future, are not eligible for hire. Equal Opportunity Employer Emerson is an Equal Opportunity/Affirmative Action employer. All qualified applicants will receive consideration for employment without regard to sex, race, color, religion, national origin, age, marital status, political affiliation, sexual orientation, gender identity, genetic information, disability or protected veteran status. We are committed to providing a workplace free of any discrimination or harassment. If you have a disability and are having difficulty accessing or using this website to apply for a position, please contact: idisability.administrator@emerson.com . ABOUT EMERSON Emerson is a leading global technology, software and engineering company providing innovative solutions for customers in industrial, commercial, and residential markets. Our Automation Solutions business helps process, hybrid and discrete manufacturers maximize production, protect personnel and the environment while optimizing their energy and operating costs. Our Commercial & Residential Solutions business helps ensure human comfort and health, protect food quality and safety, advance energy efficiency and create sustainable infrastructure. We help customers in the world’s most essential industries solve the biggest challenges of modern life. Every day, our global workforce fulfills our unified Purpose and lives out the Values we hold close as an organization: Integrity, Safety & Quality, Support Our People, Customer Focus, Continuous Improvement, Collaboration, and Innovation. Our Causes – Planet, Humanity, Champion, Inclusion and Future – shape, define and fuel Emerson’s culture while inspiring our innovative spirit and driving our focus. Whether you’re an established professional looking for a career change, an undergraduate student exploring possibilities, or recently received your master’s degree, you’ll find opportunities with us. Join our team and start your journey today! No calls or agencies please.",https://www.indeed.com/jobs?q=Software+Engineer&l=Austin%2C+TX&sc=0kf%3Aattr%28EXSNN%7CFCGTU%7CHFDVW%7CQJZM9%7CUTPWG%252COR%29explvl%28SENIOR_LEVEL%29jt%28fulltime%29%3B&radius=50&start=10&pp=gQAPAAAAAAAAAAAAAAAB_hQcvAAVAQApedO3Eo4vT2cuwBQr4yqjn0puAAA&vjk=3d685479f9630bd8
1,c6a5c014a3892080,Software Engineer,"Austin, TX",SENIOR_LEVEL,EXSNN|FCGTU|HFDVW|QJZM9|UTPWG%2COR,fulltime,"Senior Staff Software Engineer, Infrastructure, Google Cloud Global Networking - job post Google 4,519 reviews Austin, TX Full-time Google 4,519 reviews Read what people are saying about working here. You must create an Indeed account before continuing to the company website to apply Apply on company site save-icon Job details Job Type Full-time Note: By applying to this position you will have an opportunity to share your preferred working location from the following: Sunnyvale, CA, USA; Austin, TX, USA . Minimum qualifications: Bachelor's degree or equivalent practical experience. 8 years of experience in software development, and with data structures/algorithms. 7 years of experience building and developing large-scale infrastructure, distributed systems or networks, and/or experience with compute technologies, storage, and/or hardware architecture. 5 years of experience with design and architecture; and testing/launching software products. Preferred qualifications: Master’s degree or PhD in Engineering, Computer Science, or a related technical field. 5 years of experience in a technical leadership role leading project teams and setting technical direction. 3 years of experience working in a complex, matrixed organization involving cross-functional, and/or cross-business projects. About the job Google's software engineers develop the next-generation technologies that change how billions of users connect, explore, and interact with information and one another. Our products need to handle information at massive scale, and extend well beyond web search. We're looking for engineers who bring fresh ideas from all areas, including information retrieval, distributed computing, large-scale system design, networking and data storage, security, artificial intelligence, natural language processing, UI design and mobile; the list goes on and is growing every day. As a software engineer, you will work on a specific project critical to Google’s needs with opportunities to switch teams and projects as you and our fast-paced business grow and evolve. We need our engineers to be versatile, display leadership qualities and be enthusiastic to take on new problems across the full-stack as we continue to push technology forward. With your technical expertise you will manage project priorities, deadlines, and deliverables. You will design, develop, test, deploy, maintain, and enhance software solutions. Google Cloud accelerates organizations’ ability to digitally transform their business with the best infrastructure, platform, industry solutions and expertise. We deliver enterprise-grade solutions that leverage Google’s cutting-edge technology – all on the cleanest cloud in the industry. Customers in more than 200 countries and territories turn to Google Cloud as their trusted partner to enable growth and solve their most critical business problems. The US base salary range for this full-time position is $231,000-$339,000 + bonus + equity + benefits. Our salary ranges are determined by role, level, and location. The range displayed on each job posting reflects the minimum and maximum target for new hire salaries for the position across all US locations. Within the range, individual pay is determined by work location and additional factors, including job-related skills, experience, and relevant education or training. Your recruiter can share more about the specific salary range for your preferred location during the hiring process. Please note that the compensation details listed in US role postings reflect the base salary only, and do not include bonus, equity, or benefits. Learn more about benefits at Google. Responsibilities Provide technical leadership on high-impact projects. Influence and coach a distributed team of engineers. Facilitate alignment and clarity across teams on goals, outcomes, and timelines. Manage project priorities, deadlines, and deliverables. Design, develop, test, deploy, maintain, and enhance large scale software solutions. Google is proud to be an equal opportunity workplace and is an affirmative action employer. We are committed to equal employment opportunity regardless of race, color, ancestry, religion, sex, national origin, sexual orientation, age, citizenship, marital status, disability, gender identity or Veteran status. We also consider qualified applicants regardless of criminal histories, consistent with legal requirements. See also Google's EEO Policy and EEO is the Law. If you have a disability or special need that requires accommodation, please let us know by completing our Accommodations for Applicants form.",https://www.indeed.com/jobs?q=Software+Engineer&l=Austin%2C+TX&sc=0kf%3Aattr%28EXSNN%7CFCGTU%7CHFDVW%7CQJZM9%7CUTPWG%252COR%29explvl%28SENIOR_LEVEL%29jt%28fulltime%29%3B&radius=50&start=10&pp=gQAPAAAAAAAAAAAAAAAB_hQcvAAVAQApedO3Eo4vT2cuwBQr4yqjn0puAAA&vjk=c6a5c014a3892080
2,de7df8682c65d106,Software Engineer,"Austin, TX",SENIOR_LEVEL,EXSNN|FCGTU|HFDVW|QJZM9|UTPWG%2COR,fulltime,"Software Engineer, Cloud Technologies - job post Apple 11,768 reviews Austin, TX Full-time Apple 11,768 reviews Read what people are saying about working here. You must create an Indeed account before continuing to the company website to apply Apply on company site save-icon Job details Job Type Full-time Summary Posted: Mar 9, 2023 Weekly Hours: 40 Role Number: 200466303 Imagine what you could do here. At Apple, new ideas have a way of becoming extraordinary products very quickly. Bring passion and dedication to your job and there's no telling what we can accomplish together. Do you love crafting elegant solutions to highly complex challenges? Are you passionate about building distributed, scalable solutions? Apple Cloud Technologies is a centralized organization focused on enabling 3rd party cloud access and adoption. This team develops end to end software solutions with RESTful APIs and services on cloud that are used by numerous customers. The individual needs to be adept in software development, system architecture and public cloud technologies. Key Qualifications 10+ years of proven ability plus... Proficient with various programming languages such as Python/Java/Ruby/ Perl/Go with sophisticated proficiency in at least one language, preferably Go Experience with architectural and detailed design, incorporating aspects of security, high availability, and resiliency in the design Strong software engineering background, with deep experience with multiple design patterns and building RESTful APIs Experience with CI/CD tools and techniques Experience operating and developing infrastructure and services in public cloud platforms Experience with AuthN and AuthZ technologies and protocols, including IAM and SSO Experience with application and service monitoring Working knowledge of network protocols and Linux/Unix system internals and transport protocols (TCP, TLS, HTTP, UDP) Solid understanding of centralized configuration management and provisioning technologies, such as Ansible, Terraform, Cloud Formation etc. Strong leadership skills, with experience mentoring and inspiring others Experience leading and driving projects with minimal direction. Strong project management skills, including excellent presentation development Expert in writing detailed solution specifications, diagrams, standards documentation, operating procedures, test plans/test reports, etc. Excellent communications skills and ability to establish and maintain collaborations with partners, capable of working with multi-functional technical and business teams and varying levels of management, in a professional manner Description We are a team of highly skilled and hardworking engineers working on this groundbreaking and constantly evolving space. You will partner with developers, system and site reliability engineers and customers to understand their challenges, work through their issues and provide solutions that can be embraced widely. The ideal candidate is someone with a consistent track record, deep technical knowledge and skills in delivering large scale, distributed complex software solutions deployed on public cloud platforms (AWS, GCP, etc). This is a highly technical, hands-on role that requires a wide and deep experience in leading infrastructure and applications. You will design and implement complete product demonstrating expertise in entire software development lifecycle. You serve as a technical lead with strong architectural design and software engineering skills, experience with infrastructure as code technologies, operations, and security concepts. Building and maintaining relationships with diverse sets of customers using the platform will be critical to ensure the business units are successful. Education & Experience Bachelors or equivalent industry experience plus 10+ years of proven ability Additional Requirements",https://www.indeed.com/jobs?q=Software+Engineer&l=Austin%2C+TX&sc=0kf%3Aattr%28EXSNN%7CFCGTU%7CHFDVW%7CQJZM9%7CUTPWG%252COR%29explvl%28SENIOR_LEVEL%29jt%28fulltime%29%3B&radius=50&start=10&pp=gQAPAAAAAAAAAAAAAAAB_hQcvAAVAQApedO3Eo4vT2cuwBQr4yqjn0puAAA&vjk=de7df8682c65d106
3,9d170b35fb2dcd4b,Software Engineer,"Austin, TX",SENIOR_LEVEL,EXSNN|FCGTU|HFDVW|QJZM9|UTPWG%2COR,fulltime,"Developer Software Principal III - job post Everi Games Inc 82 reviews Austin, TX • Remote $97,800 - $135,600 a year -  Full-time Everi Games Inc 82 reviews Read what people are saying about working here. You must create an Indeed account before continuing to the company website to apply Apply on company site save-icon Job details Salary $97,800 - $135,600 a year Job Type Full-time Be a part of the team creating modern systems using modern technologies. The hottest, fastest-growing team at Everi is looking forDeveloper Software Principal III to join the team - see below for more details! What Will You Be Doing? Design, modify and implement Java server-side features. Build a modern microservices system that is hosted in a part cloud-native application, part on-premise virtualized network. Create the next big thing using a lot of the same technologies Netflix uses. Be a team player in this highly collaborative group, learning from senior members and mentoring junior ones all along. Recommend alterations to designs and processes to improve the quality of products and procedures. Skills, Knowledge, & Expertise Needed for the Job: 7 -10 years experience in Software Development (preferably frontend /full stack) Strong understanding of Javascript / Typescript / HTML / CSS Comfortable in Java or Python and microservice's Experience with frontend technologies such as Angular/React/Vue or Node.js Experience with NoSQl or SQL databases Experience in planning, designing, building, documenting and maintaining application Bachelor’s Degree in Computer Science, Engineering, or equivalent work experience in a related field required. requirements Why Us? Everi’s benefits package includes Medical, Dental, Vision, 401k with company match, life insurance, maternity and paternity leave, adoption assistance, pet insurance, gym reimbursement, and more! Discretionary Time Off (DTO) - No more “banking hours” to take a day off and the perfect way to prevent burnout and improve productivity. Building on a solid culture and resounding positive feedback from Everi employees in 2021, Everi continued to receive recognition as a Top Workplace in 2022. Everi was recognized nationally as a Top Workplace 2022 USA and received a second regional award for its HQ in Las Vegas as a Nevada Top Workplace 2022. This most recent award brings Everi’s total number of Top Workplaces awards in 2021 and 2022 to a whopping 10 awards!!!! ﻿ ﻿﻿ ﻿Everi is committed to expanding its innovative and creative reach, building a culture based on the tenets of respect and transparency. We are proud to be the gaming industry’s single-source provider of financial technology, loyalty solutions, games, and intelligence solutions. ﻿ Play 00:00 00:24 Mute Enter fullscreen Play ﻿The compensation for this role considers a wide range of factors, including but not limited to skill sets; experience and training; licensure and certifications; and other business and organizational needs. The disclosed range estimate has not been adjusted for the applicable geographic differential for the location at which the position may ultimately be filled. At Everi, it is not typical for all individuals to be hired at or near the end of the range; compensation decisions depend on each case’s facts and circumstances. A reasonable estimate of the current range is $97,800 - $135,600 annually. Everi is an Equal Opportunity Employer. All qualified applicants and employees will be afforded equal employment opportunities without discrimination because of race, creed, color, national origin, sex, age, disability, marital status, or any other characteristic or class protected by federal, state, or local law. ** For All External Staffing Agencies ** Everi does not accept unsolicited agency submittals. Please do not forward resumes to our Executive team, Management team, or any current Everi employee for review. Everi is not responsible for any fees related to unsolicited resumes. #LI-MW1 #LI-remote #USremote About Everi We believe in the values of Collaboration, Integrity, Inclusion, Excellence, and Fun! Apply Now Our Hiring Process Previous Stage 2: Review Stage 3: Background Check Stage 4: Hired Stage 1: Applied Stage 2: Review Stage 3: Background Check Stage 4: Hired Stage 1: Applied Stage 2: Review Stage 3: Background Check Stage 4: Hired Next 1 2",https://www.indeed.com/jobs?q=Software+Engineer&l=Austin%2C+TX&sc=0kf%3Aattr%28EXSNN%7CFCGTU%7CHFDVW%7CQJZM9%7CUTPWG%252COR%29explvl%28SENIOR_LEVEL%29jt%28fulltime%29%3B&radius=50&start=10&pp=gQAPAAAAAAAAAAAAAAAB_hQcvAAVAQApedO3Eo4vT2cuwBQr4yqjn0puAAA&vjk=9d170b35fb2dcd4b
