,job_id,job_title,location,experience,education,job_type,job_description,job_link
7,15afa7a461810e5e,Software Engineer,"Chicago, IL",MID_LEVEL,EXSNN|FCGTU|HFDVW|QJZM9|UTPWG%2COR,fulltime,"Staff Software Engineer - job post DeepSight Technology Chicago, IL 60007 $120,000 - $239,000 a year -  Full-time Apply now Apply now save-icon Job details Salary $120,000 - $239,000 a year Job Type Full-time DeepSight Technology Inc. is actively searching for a Full-time Staff Software Engineer to apply to join our amazing medical imaging team! We are an innovative medical imaging company that invests in our team and offers real opportunities for career growth. This Lead Software Engineering position works 2-3 days per week at one of our US offices in the St. Louis or San Francisco Bay areas and earns a competitive salary of $120,000-$239,000 a year, based on skills, experience, and office location. We provide top-notch benefits and perks , including health, vision, dental, stock options, and a 401(k)-retirement plan . About Deepsight Technology Inc. DeepSight Technology Inc. is a stealth-mode startup company that has developed breakthrough technology in ultrasound imaging. This new technology will extend both the range and clarity over current systems by 10x - 100x! We are setting new standards that will dramatically improve the capabilities of ultrasound for many years. In order to develop and improve this technology, we need dedicated team players on our side. Not only do we offer a great team-oriented environment, but we also offer competitive compensation and generous benefits. ARE YOU A GOOD FIT? We are looking for someone who is motivated to do quality work and excited about developing state-of-the art medical technology that will impact the future of medical care. Ask yourself: Are you analytical? Are you ready for a life-changing opportunity? Are you self-motivated and goal-oriented? If so, we want to meet you! WHAT WE NEED FROM YOU AS A LEAD SOFTWARE ENGINEER As a Staff Software Engineer, you will contribute to the technical direction of software core to our product. As one of the initial members of the software team, you will write enabling frameworks, setup the foundational system architecture and drive the technical direction of the software team. Your expertise will establish coding practices that foster high-growth teams and comply with industry standards. Being a team player, you enjoy working with our transducer, hardware, and systems teams as you work to optimize our system prototype and product designs. At the end of the day, you enjoy the variety that each day brings, and are proud of the work you do that ultimately leads to future medical imaging advancements. If you can do this and meet the following requirements, apply today! Responsibilities: Work with software and other engineers (clinical, systems, mechanical, electrical) as part of a focused cross-functional team developing software for a medical application Understand user needs, clinical needs & customer input requirements to drive software development Design and implement software for a breakthrough ultrasound system Define architectures, designs, and workflows that enable successful treatment Participate in design discussions and code reviews Author and maintain detailed design documentation Education and Experience Minimum Requirements: BS in an engineering or computer science field 5 or more years of experience in commercial software development Strong background in object-oriented programming, software architecture, and design patterns Experienced with designing and building applications using object-oriented programming languages (C++, C#, Java) Deep familiarity with common developer tool sets, including source control, continuous integration, and automated unit testing Passionate about medical devices, with excellent communication and teamwork skills Desired Skills and Experience: Knowledge in medical imaging (Ultrasound, PET, SPECT, CT, MR, etc.) and developing software in the medical industry (FDA regulated) Familiarity in ultrasound physics, signal and image processing, beamforming, transducer optimization, simulation, algorithm development, or tool development Experience with real-time software applications Knowledge of DICOM and HL7 Experience with PACS, electronic medical records (EMR) or patient management systems (PMs), as well as other clinical systems Experience modern GUI frameworks (Qt, WPF, Flutter, etc) If you require alternative methods of application or screening, you must approach the employer directly to request this as Indeed is not responsible for the employer's application process.",https://www.indeed.com/jobs?q=Software+Engineer&l=Chicago%2C+IL&sc=0kf%3Aattr%28EXSNN%7CFCGTU%7CHFDVW%7CQJZM9%7CUTPWG%252COR%29explvl%28MID_LEVEL%29jt%28fulltime%29%3B&vjk=15afa7a461810e5e
8,6e12615177bdd4cb,Software Engineer,"Chicago, IL",MID_LEVEL,EXSNN|FCGTU|HFDVW|QJZM9|UTPWG%2COR,fulltime,"Back-End Software Engineer - job post SimBioSys Chicago, IL Full-time Apply now Apply now save-icon Job details Job Type Full-time SimBioSys is seeking both Senior Back-End and Front-End Software Engineers to contribute to development of PhenoScope, an application to assist pharmaceutical researchers in the designing new life-saving therapies. As a Software Engineer, you will help build a web-based platform for the management, analysis, and visualization of diverse datasets across multiple biological scales. In this role, you will be responsible for maintaining and developing features in the back-end implemented in Python, including providing a robust REST API to serve data to the frontend, as well as for internal tooling. You will work closely with front-end developers on the public presentation of data and will work with SimBioSys scientists to develop applications and workflows to manage scientific data. What you'll do: Develop web-based REST APIs for intake, curation, analysis, and visualization of data Work closely with Front-End Engineers for UI Delivery Design database systems to efficiently store diverse and large datasets Utilize AWS to deploy the application effectively and reliably Interact with scientists on building automated analysis pipelines Assess performance, stability, and effectiveness of the application Lead code quality and testing initiatives Provide internal leadership and support Mentor junior developers Contribute to development of other in-house tools as assigned Qualifications: Bachelor's Degree in Computer Science or a related degree 3 years of experience in working with Python in a production environment Experience with databases, both relational and NoSQL Proficient with using git for version control, as well as development management platforms such as GitLab or GitHub Proficient with a Python web framework like FastAPI, Flask, Django REST Framework, etc. Proficient in cloud-based application development (e.g. AWS, GCP, Azure) Ability to work independently and as part of a team to meet project goals Excellent written and verbal communication skills Preferred Qualifications: Proficient in building and running Python applications with Docker Experience in DevOps, and Infrastructure as Code (such as Terraform) Experience in highly-available, highly-scalable cloud applications Experience with Design-Build-Test software development processes Experience with the Python package deployment process Experience with medical imaging, biological data, and/or drug design Strong Unix skills If you require alternative methods of application or screening, you must approach the employer directly to request this as Indeed is not responsible for the employer's application process.",https://www.indeed.com/jobs?q=Software+Engineer&l=Chicago%2C+IL&sc=0kf%3Aattr%28EXSNN%7CFCGTU%7CHFDVW%7CQJZM9%7CUTPWG%252COR%29explvl%28MID_LEVEL%29jt%28fulltime%29%3B&vjk=6e12615177bdd4cb
9,a0c1276e3193e8c7,Software Engineer,"Chicago, IL",MID_LEVEL,EXSNN|FCGTU|HFDVW|QJZM9|UTPWG%2COR,fulltime,"Software Engineer III - job post C.H. Robinson 1,536 reviews Chicago, IL 60614 $101,200 - $224,400 a year -  Full-time C.H. Robinson 1,536 reviews Read what people are saying about working here. You must create an Indeed account before continuing to the company website to apply Apply on company site save-icon Job details Salary $101,200 - $224,400 a year Job Type Full-time As a Software Engineer III at C.H. Robinson, you will work with the latest frameworks, languages, and tools available to build world class software that is transforming the logistics industry. You'll be challenged to build modern, responsive, and highly scalable systems that are accelerating commerce through the world's most powerful supply chain platform; Navisphere. If you are an experienced software engineer who enjoys collaborating with other talented and passionate engineers and working on the world's most complex supply chain solutions, this is the opportunity for you! In this role, you’ll work closely with the product team to create customer-facing products that solve big problems and delight customers. You’ll get to know the ""why"" behind decisions and share ownership of the entire digital value chain, from the decision-making, to shipping great code, to validating business metrics after the release. In addition, you’ll be responsible for guiding the team’s engineering process, mentoring other software engineers, and driving innovation. This role may be located in Eden Prairie, Seattle, Chicago, Kansas City Responsibilities: Analyze and translate high-level customer requirements into detailed designs to solve complex business problems Define interfaces and develop code for modules across products or services and may influence or drive architectural changes Increase code quality through code reviews and writing unit, integration, and acceptance tests Optimize, refactor, and reuse code to improve performance and maintainability while ensuring maximum efficiency, effectiveness, and return on investment Collaborate with team to define testing strategy and drive quality throughout the engineering lifecycle through unit and integration tests Proactively identify performance and availability issues, troubleshoot, provide effective options, and resolve issues in production that could span multiple product areas Write code using secure programming patterns and by finding, fixing, and enhancing security in existing applications Develop and maintain thorough technical documentation for the product or service Estimate for software projects including dependencies, work, time, resources, and skill needs Maintain knowledge of emerging technologies Adopt established best practices while contributing to the definition of the engineering lifecycle as well as the definition of best practices Participate in design and code reviews and share best practices; proactively seek mentorship from others Collaborate with leadership to unblock and direct members on the team to successfully deliver high quality software Required Qualifications: 5+years of experience developing and implementing commercial software, preferably custom-facing software solutions. Experience creating applications and features in an object-oriented environment (ex. C#, .NET Service Stack, .Net Core) Experience with database objects in relational databases (ex. MS SQL) including schema design, stored procedure development and performance and optimization techniques Experience with non-relational databases (ex. MongoDB, Elastic, Cosmos) Experience with HTTP and REST architecture Experience with unit, integration, and acceptance testing Experience with version control systems (ex. GIT, GitHub, TFS, etc.) Experience with CI/CD continuous integration / continuous deployment practices Experience with data streaming architecture and frameworks (ex. Kafka, RabbitMQ, ESB) Experience with tooling, such as Webpack, SASS, npm, etc. Proficiency with React, JavaScript, TypeScript, HTML, CSS Bachelor’s degree or equivalent work experience and high school diploma/GED Preferred Qualifications: Experience in system integration projects or global projects Experience with transportation, logistics, or business systems Experience building cloud native applications and services (ex. Azure, AWS, GCP) Proven track record of effectively delivering results in a fast-paced environment while managing multiple priorities Possess solid communication skills and strong customer focus Ability to communicate technical and business concepts across teams A learning and growth mindset that is open to giving and receiving feedback Values a diverse and inclusive work environment Compensation Range $101,200.00 - $224,400.00 Questioning if you meet the mark? Studies have shown that women and people of color may be less likely to apply unless they match the job description exactly. Here at C.H. Robinson, we’re building a diverse and inclusive workplace where all employees feel they belong. If this position excites you, we welcome you to apply whether you check all the preferred qualifications or just a few. You may just be our next great fit! Equal Opportunity and Affirmative Action Employer C.H. Robinson is proud to be an Equal Opportunity and Affirmative Action employer. We believe in equality for all and celebrate the diversity of our employees, customers and communities. We believe this increases creativity and innovation, drives business growth and enables engaged and thriving teams. We’re committed to providing an inclusive environment, free from harassment and discrimination, where all employees feel welcomed, valued and respected. Affirmative Action Employer/EOE/M/F/Disabled/Veteran Benefits Your Health, Wealth and Self Your total wellbeing is the foundation of our business, and our benefits support your financial, family and personal goals. We provide the top-tier benefits that matter to you most, including: Two medical plans (including a High Deductible Health Plan) Prescription drug coverage Enhanced Fertility benefits Flexible Spending Accounts Health Savings Account (including employer contribution) Dental and Vision Basic and Supplemental Life Insurance Short-Term and Long-Term Disability Paid and floating holidays Paid time off (PTO) Paid parental leave Paid time off to volunteer in your community Charitable Giving Match Program 401(k) with 6% company matching Employee Stock Purchase Plan Plus a broad range of career development, networking, and team-building opportunities Dig in to our full list of benefits on OUR CULTURE page. Why Do You Belong at C.H. Robinson? Standing out among the world’s largest logistics platforms, C.H. Robinson solves logistics problems for companies across the globe and across industries, from the simple to the most complex. For 100+ years, our global suite of services has innovated trade to seamlessly deliver the products and goods that drive the world’s economy. With 20 million shipments annually for 100,000 customers, and millions of dollars contributed to support causes that matter to us, our people and technology literally move the world. As a FORTUNE 200 company, FORTUNE has also named C.H. Robinson one of the World’s Most Admired Companies 2022. Headquartered in Eden Prairie, Minnesota, we are proud to be recognized as one of LinkedIn’s Top Companies in Minneapolis-St. Paul 2021. And we’re not stopping there… Join us as we collaborate, innovate, and work as one global team to make life better and more sustainable for our customers, communities, and world.",https://www.indeed.com/jobs?q=Software+Engineer&l=Chicago%2C+IL&sc=0kf%3Aattr%28EXSNN%7CFCGTU%7CHFDVW%7CQJZM9%7CUTPWG%252COR%29explvl%28MID_LEVEL%29jt%28fulltime%29%3B&vjk=a0c1276e3193e8c7
10,8c247f6566d3648f,Software Engineer,"Chicago, IL",MID_LEVEL,EXSNN|FCGTU|HFDVW|QJZM9|UTPWG%2COR,fulltime,"Senior Site Reliability Engineer (Remote-Eligible) - job post Capital One 10,039 reviews Chicago, IL 60695 • Remote Full-time, Part-time Capital One 10,039 reviews Read what people are saying about working here. You must create an Indeed account before continuing to the company website to apply Apply on company site save-icon Job details Encouraged to Apply Fair chance Job Type Full-time Part-time Center 1 (19052), United States of America, McLean, Virginia Senior Site Reliability Engineer (Remote-Eligible) Do you love building and pioneering in the technology space? Do you enjoy solving complex business problems in a fast-paced, collaborative, inclusive, and iterative delivery environment? At Capital One, you'll be part of a big group of makers, breakers, doers and disruptors, who love to solve real problems and meet real customer needs. We are seeking Site Reliability Engineers who are passionate about marrying data with emerging technologies to join our team. As a Site Reliability Engineer, you’ll have the opportunity to be on the forefront of driving a major transformation within Capital One. Team Info: The EMP (Enterprise Model Platform) SRE team is responsible for building, maintaining, and governing the model development kubernetes fleet. This includes but is not limited to the kubernetes control plane, workers, storage, addons, custom operators, and applications within each cluster as our team is the very foundation of the ML platform at Capital One. Additionally, this team owns microservices that enable self-service onboarding and interactions with the ML fleet of clusters. We work closely with various open source projects and internal teams to ensure a seamless experience for our internal customers building machine learning models. What You’ll Do: Collaborate with and across Agile teams to design, develop, test, implement, and support technical solutions in full-stack development tools and technologies Share your passion for staying on top of tech trends, experimenting with and learning new technologies, participating in internal & external technology communities, and mentoring other members of the engineering community Collaborate with digital product managers, and deliver robust cloud-based solutions that drive powerful experiences to help millions of Americans achieve financial empowerment Utilize programming languages like Java, Python, SQL, Ruby and Go, Container Orchestration services including Docker and Kubernetes, CM tools including Ansible and Terraform, and a variety of AWS tools and services Capital One is open to hiring a Remote Employee for this opportunity. Basic Qualifications: Bachelor’s degree At least 4 years of experience in DevOps Engineering (Internship experience does not apply) At least 2 years of experience with Cloud Native technologies (Amazon Web Services, Microsoft Azure, Google Cloud Platform) At least 2 years of Unix or Linux system administration experience Preferred Qualifications: 2+ years of experience with Terraform or Ansible, CI/CD, Git, and Jenkins 2+ years of experience with multi-tenant container orchestration platforms and services including Docker and Kubernetes 2+ years of experience with Kubernetes based cloud-native technologies such as argo, kubeflow, istio, linkerd, and dex. 2+ years of experience with coding and scripting (Python, Bash, SQL, and Golang or comparable languages) 2+ years of experience working with Agile Development Practices At this time, Capital One will not sponsor a new applicant for employment authorization for this position. The minimum and maximum full-time annual salaries for this role are listed below, by location. Please note that this salary information is solely for candidates hired to perform work within one of these locations, and refers to the amount Capital One is willing to pay at the time of this posting. Salaries for part-time roles will be prorated based upon the agreed upon number of hours to be regularly worked. Location is New York City: $161,900 - $184,800 for Senior Software Engineer Location is San Francisco, California: $171,500 - $195,800 for Senior Software Engineer Remote roles in other areas of New York & California, and across Colorado & Washington: $137,200 - $156,600 for Senior Software Engineer Candidates hired to work in other locations will be subject to the pay range associated with that location, and the actual annualized salary amount offered to any candidate at the time of hire will be reflected solely in the candidate’s offer letter. This role is also eligible to earn performance based incentive compensation, which may include cash bonus(es) and/or long term incentives (LTI). Incentives could be discretionary or non discretionary depending on the plan. Capital One offers a comprehensive, competitive, and inclusive set of health, financial and other benefits that support your total well-being. Learn more at the Capital One Careers website. Eligibility varies based on full or part-time status, exempt or non-exempt status, and management level. No agencies please. Capital One is an Equal Opportunity Employer committed to diversity and inclusion in the workplace. All qualified applicants will receive consideration for employment without regard to sex, race, color, age, national origin, religion, physical and mental disability, genetic information, marital status, sexual orientation, gender identity/assignment, citizenship, pregnancy or maternity, protected veteran status, or any other status prohibited by applicable national, federal, state or local law. Capital One promotes a drug-free workplace. Capital One will consider for employment qualified applicants with a criminal history in a manner consistent with the requirements of applicable laws regarding criminal background inquiries, including, to the extent applicable, Article 23-A of the New York Correction Law; San Francisco, California Police Code Article 49, Sections 4901-4920; New York City’s Fair Chance Act; Philadelphia’s Fair Criminal Records Screening Act; and other applicable federal, state, and local laws and regulations regarding criminal background inquiries. If you have visited our website in search of information on employment opportunities or to apply for a position, and you require an accommodation, please contact Capital One Recruiting at 1-800-304-9102 or via email at RecruitingAccommodation@capitalone.com. All information you provide will be kept confidential and will be used only to the extent required to provide needed reasonable accommodations. For technical support or questions about Capital One's recruiting process, please send an email to Careers@capitalone.com Capital One does not provide, endorse nor guarantee and is not liable for third-party products, services, educational tools or other information available through this site. Capital One Financial is made up of several different entities. Please note that any position posted in Canada is for Capital One Canada, any position posted in the United Kingdom is for Capital One Europe and any position posted in the Philippines is for Capital One Philippines Service Corp. (COPSSC).",https://www.indeed.com/jobs?q=Software+Engineer&l=Chicago%2C+IL&sc=0kf%3Aattr%28EXSNN%7CFCGTU%7CHFDVW%7CQJZM9%7CUTPWG%252COR%29explvl%28MID_LEVEL%29jt%28fulltime%29%3B&vjk=8c247f6566d3648f&advn=4418968771450209
