,job_id,job_title,location,experience,education,job_type,job_description,job_link
0,e9cc5d377e89dc04,Software Engineer,"Chicago, IL",SENIOR_LEVEL,EXSNN|FCGTU|HFDVW|QJZM9|UTPWG%2COR,fulltime,"Senior Automation Test Engineer - job post SandC Electric company 222 reviews Chicago, IL 60626 • Hybrid remote $122,000 - $170,000 a year -  Full-time SandC Electric company 222 reviews Read what people are saying about working here. Responded to 51-74% of applications in the past 30 days, typically within 10 days. You must create an Indeed account before continuing to the company website to apply Apply on company site save-icon Job details Salary $122,000 - $170,000 a year Job Type Full-time Job Summary The Automation Test Engineering group is responsible for working with new product development teams to specify, design, and oversee the development of all production inspection and electronic testing systems.  We are seeking a senior level electronics engineer experienced in the designing, commissioning, and maintaining final unit test systems, component test systems, and printed circuit board functional test systems for production. This position is part of the Quality Assurance group and has primary responsibility for development of automated and manually operated production test equipment used in S&C’s Production Operations and Contract Manufacturers Operations. The successful candidate will report to the Assistant Manager – Quality Engineering and be in S&C’s Chicago, IL location. Regular travel to S&C’s contract manufacturer locations, and some travel to S&C suppliers and other S&C locations will be required. The responsibilities of this position include, but are not limited to, the following: Working with new product development project teams, and developing tester specifications to either build in-house or source from an integrator. Working with suppliers to manage the development of test equipment to meet our specifications. Troubleshooting & repairing production test equipment hardware, fixtures, and software. Utilizing problem-solving skills to find and resolve root causes of production test equipment issues. Assessing existing production test systems equipment and suggesting opportunities for improvement, using tools such as PFMEA, DFMA, and performance testing. Utilizing quality feedback and metrics to collaboratively analyze and implement production testing improvements together with S&C and contract manufacturing teams. Designing, assembling, wiring, testing and troubleshooting electrical and electronic circuits, wire harnesses and connectors, test fixtures and assemblies with digital, analog and programmable components. Developing new LabView test programs meet the requirements of the product test specification. Advanced skills with programming and troubleshooting PLCs, HMIs, and computerized system design, installation, and support production operations in an industrial setting. Preparing and updating test procedures and conducting Factory Acceptance Test (FAT) plans, Commissioning Test plans, and Site Acceptance Test (SAT) plans for production test equipment. Preparing, coordinating, and conducting product firmware verification and validation testing of new and updated firmware prior to release for production. Training Product Engineering, Production and Contract Manufacturing Operations team members in standard work for operating production test equipment. Coaching, training, mentoring and reviewing work of less experienced team members. To select this job as one of interest to you, at a minimum, you must have the following: Bachelor’s degree in Electrical or Electronics Engineering is required. 11 to 15 years of experience in electronics testing, embedded controls testing, electrical system testing, troubleshooting, repair, maintenance, and improvement of production test equipment. Experience in test equipment design, assembly, wiring, hardware and software testing, and problem-solving. Experience creating, reading and interpreting electrical schematics and datasheets. Experience using and programming with National Instruments LabVIEW and Test-Stand software. Advanced skills with programming and troubleshooting PLCs, HMIs, and computerized system design, installation, and support production operations in a industrial setting. Proficiency in using lab instrumentation (scopes, DMMs, logic analyzers, network analyzers, power supplies, etc.). Prefer candidates with experience troubleshooting digital and mixed-signal electronic circuits, printed circuit board assemblies, programming, testing and debugging large-scale digital systems that include FPGAs, CPUs, DSP’s and various logic and interface circuitry. Ability to work hands-on, independently, and in cross-functional, multi-cultural project teams. Ability to interface with contract manufacturers, S&C production operations, and stake holders. Knowledge of Quality Management Systems, specifically ISO:9001. Ability to use Microsoft products, CAD, schematic and board layout tools such as Allegro, Cadence, Mentor Graphics, Zuken E3, AutoCAD, Visio. Experience using agile management and defect tracking tools (Confluence, JIRA). Enthusiasm, drive, a sense of urgency with strong interpersonal, communication, collaboration and teaming skills. Proven ability to manage working on multiple projects at a time while paying strict attention to detail. Capacity to deal with a high workload and deadline pressure including ability to work extended hours as necessary to meet deadlines. Ability to travel without restrictions. Major Physical Demands: Standing: Occasional, during test observations. Lifting: Occasional light lifting. Walking: Occasional walking of moderate distances (1 mile) within the S&C complex. Bending: Occasional bending. Reaching: Occasional reaching. Handling: Occasional handling of parts and tools. Environment: Consists of an office environment, factory floor and at times working in a test lab. Job Type: Full-time Pay: $122,000.00 - $170,000.00 per year Benefits: 401(k) 401(k) matching Dental insurance Flexible schedule Flexible spending account Health insurance Health savings account Life insurance Paid time off Professional development assistance Referral program Relocation assistance Tuition reimbursement Vision insurance Compensation package: Bonus pay Employee stock ownership plan Experience level: 7 years Schedule: 8 hour shift Day shift Monday to Friday Supplemental pay types: Bonus pay Ability to commute/relocate: Chicago, IL 60626: Reliably commute or planning to relocate before starting work (Required) Experience: SQL: 1 year (Preferred) Selenium: 1 year (Preferred) electronics, embedded controls, electrical system testing: 7 years (Required) Work Location: Hybrid remote in Chicago, IL 60626 Health insurance",https://www.indeed.com/jobs?q=Software+Engineer&l=Chicago%2C+IL&sc=0kf%3Aattr%28EXSNN%7CFCGTU%7CHFDVW%7CQJZM9%7CUTPWG%252COR%29explvl%28SENIOR_LEVEL%29jt%28fulltime%29%3B&radius=50&start=10&pp=gQAPAAAAAAAAAAAAAAAB_h8FDAAdAQAIy1KBtXU64PbNXg8KeeG1s3wY_awj0Ybhm-IAAA&vjk=e9cc5d377e89dc04&advn=1778024452021452
1,e17d48c2ad32b47a,Software Engineer,"Chicago, IL",SENIOR_LEVEL,EXSNN|FCGTU|HFDVW|QJZM9|UTPWG%2COR,fulltime,"Senior Full Stack Developer - IL Lisle - job post Ryerson 372 reviews 1050 Warrenville Rd, Lisle, IL 60532 Full-time Ryerson 372 reviews Read what people are saying about working here. You must create an Indeed account before continuing to the company website to apply Apply on company site save-icon Job details Job Type Full-time The future will be made from metal. From global infrastructure projects to smart energy initiatives, metal is essential for building a more sustainable society. Joseph T. Ryerson & Son, Inc., a leader in the global metals supply chain for 180 years, is at the center of it all, helping close the gap between metal producers’ supply and end-users' demand. We are seeking a Sr. Full Stack Developer to join our team. Responsibilities include but are not limited to developing and designing front-end web architecture, ensuring the responsiveness of applications, and working alongside graphic designers for web design features. In this role, you will be required to see out a project from conception to final product, requiring good organizational skills and attention to detail. Roles & Responsibilities: Managing the complete software development process from conception to deployment Maintaining and upgrading the software following deployment Managing the end-to-end life cycle for the production of software and applications Overseeing and guiding the analyzing, writing, building, and deployment of software Overseeing the automated testing and providing feedback to management during the development process Modifying and testing changes to previously developed programs Designing and developing APIs. Meeting both technical and consumer needs. Staying abreast of developments in web applications and programming languages. Other duties as assigned Position Requirements: • Minimum of 6 years of relevant work experience with a Bachelor’s in computer science Engineering or similar technical degree; 10 years of relevant work experience with a High School Diploma. Proficiency with the creation of Unit Tests and the use of the library JEST. Minimum of 3 years of relevant work experience with React.js and TypeScript. Knowledge of Node.js and Serverless.com. Familiarity with database technology such as MySQL and MSSQL. Basic experience in using Cloud Technologies (AWS, Azure Cloud). Strong organizational and project management skills. Excellent verbal communication skills. Good problem-solving skills. Attention to detail. Experience Required: 5 - 7 Years Education Required: Bachelors Degree Preferred",https://www.indeed.com/jobs?q=Software+Engineer&l=Chicago%2C+IL&sc=0kf%3Aattr%28EXSNN%7CFCGTU%7CHFDVW%7CQJZM9%7CUTPWG%252COR%29explvl%28SENIOR_LEVEL%29jt%28fulltime%29%3B&radius=50&start=10&pp=gQAPAAAAAAAAAAAAAAAB_h8FDAAdAQAIy1KBtXU64PbNXg8KeeG1s3wY_awj0Ybhm-IAAA&vjk=e17d48c2ad32b47a
2,6f18b0cc29018395,Software Engineer,"Chicago, IL",SENIOR_LEVEL,EXSNN|FCGTU|HFDVW|QJZM9|UTPWG%2COR,fulltime,"Senior Software Engineer - job post S & C Electric Company 222 reviews Chicago, IL • Remote Full-time S & C Electric Company 222 reviews Read what people are saying about working here. You must create an Indeed account before continuing to the company website to apply Apply on company site save-icon Job details Job Type Full-time S & C Electric Company, a global leader for power reliability products is looking for a Senior Software Engineer. Candidates must have a strong background in design and development of embedded software on custom electronics including experience in the following areas: distributed systems, communication protocols, large-scale system analysis, and automation of unit tests. This is a remote position, located in the United States. Our office locations are in Chicago, IL, Alameda, CA, Rockville, MD, and Franklin, WI. Occasional travel (10%) to one of these facilities may be required for development, system testing, and debug. This position will report to the Manager of Embedded Software. The work associated with this position includes the following: Design and code embedded application firmware using the C language, for Smart Grid controls including implementing new product features, communication protocols, and device drivers Participate in Agile Scrum meetings and peer reviews of source code Review and implement product requirements Create, execute, and automate Unit Tests Contribute to software specifications, and test plans Investigate new technologies and create design documents as necessary Provide project and task schedule estimates Develop and support PC-based engineering test tools as needed Collaborate with hardware and test engineers to support verification and validation at the integration and system levels Work with the product management and field service teams to resolve customer issues quickly To select this job as one of interest to you, at a minimum, you must have the following: Being a team player is essential. Excellent written and verbal communications skills Continuous learner and self-starter BS degree in Electrical Engineering, Computer Engineering, Computer Science, or equivalent Ten years relevant work experience in embedded real-time software development. Demonstrated working knowledge of programming principles in C Demonstrated working knowledge of build scripts, Jenkins, Python, Jython, Java, and Robot Framework or equivalents Experience with communication protocols including DNP3, and SCADA Ethernet and WiFi networking experience Familiarity with the following hardware concepts: GPIO, I2C, SPI, ADC, DAC, UART, DMA, flash memory, low power microprocessor modes is a plus Working knowledge of Agile methodology fundamentals and continuous process improvement Experience with configuration management / process tools: Jira, Confluence, and Bitbucket/Git Continuous Integration / Continuous Deploy (CI/CD) build familiarity including Jenkins is a plus Embedded Linux experience is a plus Experience with electrical power distribution (grid) principles is a plus Desktop application programming experience is a plus MAJOR PHYSICAL DEMANDS Standing: Occasional standing for work on complete control assemblies. Lifting: Occasional lifting of controls and test equipment, less than 50 pounds. Walking: Occasional walking throughout the facility. Carrying: Occasional carrying of light objects. Pushing: Infrequent pushing of objects, possibly related to rearrangement work. Pulling: Infrequent pulling of objects, possibly related to rearrangement work. Bending: Occasional bending during access to equipment. Reaching: Infrequent reaching. Handling: Frequent handling of parts or tools. Environment: Frequent handling of parts or tools. S & C - TOP WORKPLACE For 2019, S & C Electric Company was named the 10th-best place to work among large employers in the Chicagoland area by The Chicago Tribune as part of the newspaper's prestigious annual Top Workplaces list. For 2020, S & C Electric was named as the 15th-Best Workplace in Chicago Tribune’s 11th Annual Report. For 2021, S & C Electric was named Among Top 2021 Workplaces in the United States by Top Workplaces USA, the nation’s most credible employer-recognition program. #LI-KD1 #LI-Remote S&C is a global company providing equipment and services for electric power systems. Founded in 1911, the Chicago-based company designs and manufactures switching and protection products for electric power transmission and distribution. S&C’s Engineering teams design solutions for a portfolio of products for a wide range of customers including electric utilities and industrial/commercial power users. S&C offers broad opportunities for advancement, excellent education and training programs, a challenging work environment, and a strong package of pay and benefits. The Human Energy of S&C has been built on the principles of integrity, enthusiasm, and sustained energy. These are the traits that S&C has always looked for and found when seeking people to join our 100% employee-owned team. S&C would not be where it is today without the diversity of our team members and business partners. We consider our diversity to be a core strength of our company, and we aspire to align our team-member demographics with the populations in which we live and work. To realize this vision, we seek to facilitate the career development of minorities, women and all team members through events hosted by our Inclusion, Diversity, Engagement and Awareness (I.D.E.A.) Group, Women’s Empowerment Group and other S&C affinity groups. S&C has a proud and longstanding tradition of providing equal employment opportunities without regard to race, color, creed, religion, gender, age, sexual orientation, gender identity, national origin, disability, veteran status, or marital status. Further, S&C is committed to taking affirmative action to ensure that qualified females, minorities, veterans, and persons with disabilities can pursue equal employment opportunities. For information regarding equal employment opportunity, please see http://www.dol.gov/ofccp/regs/compliance/posters/pdf/eeopost.pdf. On the (Admin, HR, General Management, Strategy, IT, F&A, HSE, S&L) team, we are responsible for several core business functions and collaborate with departments across S&C to collectively achieve S&C's mission. We are key players in facilitating how S&C provides long-term value to our employee owners. Always focused on the big picture of revolutionizing the energy sector, we take pride in the impact we have on S&C by empowering our team members to succeed.",https://www.indeed.com/jobs?q=Software+Engineer&l=Chicago%2C+IL&sc=0kf%3Aattr%28EXSNN%7CFCGTU%7CHFDVW%7CQJZM9%7CUTPWG%252COR%29explvl%28SENIOR_LEVEL%29jt%28fulltime%29%3B&radius=50&start=10&pp=gQAPAAAAAAAAAAAAAAAB_h8FDAAdAQAIy1KBtXU64PbNXg8KeeG1s3wY_awj0Ybhm-IAAA&vjk=6f18b0cc29018395
3,f2e48440f93896fe,Software Engineer,"Chicago, IL",SENIOR_LEVEL,EXSNN|FCGTU|HFDVW|QJZM9|UTPWG%2COR,fulltime,"Senior Software Engineer, Online - job post Warner Bros. Discovery 882 reviews Chicago, IL Full-time Warner Bros. Discovery 882 reviews Read what people are saying about working here. You must create an Indeed account before continuing to the company website to apply Apply on company site save-icon Job details Job Type Full-time Every great story has a new beginning, and yours starts here. Welcome to Warner Bros. Discovery… the stuff dreams are made of. Who We Are… When we say, “the stuff dreams are made of,” we’re not just referring to the world of wizards, dragons and superheroes, or even to the wonders of Planet Earth. Behind WBD’s vast portfolio of iconic content and beloved brands, are the storytellers bringing our characters to life, the creators bringing them to your living rooms and the dreamers creating what’s next… From brilliant creatives, to technology trailblazers, across the globe, WBD offers career defining opportunities, thoughtfully curated benefits, and the tools to explore and grow into your best selves. Here you are supported, here you are celebrated, here you can thrive. The creative team that brought Mortal Kombat and Injustice to life is now NetherRealm Studios, part of the Warner Bros. Games family. With over 20 years of creation under our belts, NetherRealm’s mission remains the same: to create cutting edge entertainment and deliver industry leading tech, game art and overall gaming experiences. NetherRealm Studios is a collaborative and creative environment, constantly striving to up the ante on what is possible in interactive entertainment. Our team is comprised of dedicated professionals with years of experience who are at the forefront of the gaming industry. The passion and energy that made Mortal Kombat a reality is still on display every day in our offices, our hallways and most definitely the studio’s arcade room. The Job This position is for a Senior Software Engineer, Online, to help us develop and implement cutting-edge online features and capabilities. The candidate should possess a strong background in network play and will assist in improving our online infrastructure. This role works closely with other online engineers on the Koretech engine team to implement functionality ranging from optimization of the core network transport layer to owning the final implementation of brand-new features for future titles. The online engineer will deal with the full development cycle of online, and should be comfortable contributing to core system development, feature planning, and live game maintenance. The Koretech team is a fantastic group of professional software engineers. We support each other, hold ourselves to a high standard, and seek to develop a game that competes with the best franchises in gaming, not just our genre. We have many engineers that have been with the Koretech team for more than 10 years because it is a great place to learn, grow, and make your impact felt. The Daily ONLINE ENGINEERING Extend online layer support for our Unreal based engine Work with modern console APIs for invites, presence, user management, etc. Write code for consoles that communicates with our backend servers Write server-side code for user/inventory/currency management Optimize network code for size, speed, and reliability Modify and extend MMR systems Build online solutions that scale our player count Monitor and respond to issues in our live environment The Essentials Minimum 5+ years professional experience developing in C++ and at least one shipped AAA title B.S. in computer science, computer engineering, or other relevant field Excellent C/C++ programming skills Experience building network implementations for modern games Experience with online game service APIs, such as Xbox LIVE, PSN, and similar Familiarity with networking systems and their components, including DNS, NAT, firewalls, security methods, and both peer-to-peer and client-server models. Soft(er) Skills Passion for building robust solutions . Delivering an excellent online experience is paramount, and that includes fast, resilient, and reliable network systems. Strong ability to collaborate . You will work closely with other engineers to achieve common goals. You must be able to openly discuss proposals without ego so that we reach the best solutions. Strong technical abilities. We will regularly rely on your debugging and analytical skills to solve issues in the online realm. While you will be supported by your peers and your Lead engineer, independent work will be the norm. How We Get Things Done… This last bit is probably the most important! Here at WBD, our guiding principles are the core values by which we operate and are central to how we get things done. You can find them at www.wbd.com/guiding-principles/ along with some insights from the team on what they mean and how they show up in their day to day. We hope they resonate with you and look forward to discussing them during your interview. The Legal Bits… Warner Bros. Discovery embraces the opportunity to build a workforce that reflects the diversity of our society and the world around us. Being an equal opportunity employer means that we take seriously our responsibility to consider qualified candidates on the basis of merit, without regard to race, color, religion, national origin, gender, sexual orientation, gender identity or expression, age, mental or physical disability, and genetic information, marital status, citizenship status, military status, protected veteran status or any other category protected by law. If you’re a qualified candidate with a disability and you need a reasonable accommodation in order to apply for this position, please contact us at recruitadmin@warnermedia.com.",https://www.indeed.com/jobs?q=Software+Engineer&l=Chicago%2C+IL&sc=0kf%3Aattr%28EXSNN%7CFCGTU%7CHFDVW%7CQJZM9%7CUTPWG%252COR%29explvl%28SENIOR_LEVEL%29jt%28fulltime%29%3B&radius=50&start=10&pp=gQAPAAAAAAAAAAAAAAAB_h8FDAAdAQAIy1KBtXU64PbNXg8KeeG1s3wY_awj0Ybhm-IAAA&vjk=f2e48440f93896fe
