,job_id,job_title,location,experience,education,job_type,job_description,job_link
18,4655a0aa2a30cd1d,Software Engineer,"Chicago, IL",SENIOR_LEVEL,EXSNN|FCGTU|HFDVW|QJZM9|UTPWG%2COR,fulltime,"Senior Software Engineer - Java - job post Reveal-Brainspace 8 reviews Chicago, IL 60606 Full-time Reveal-Brainspace 8 reviews Read what people are saying about working here. You must create an Indeed account before continuing to the company website to apply Apply on company site save-icon Job details Job Type Full-time Job Description Position : Senior Software Engineer, Java Location : Chicago, IL Job Overview Join an innovative and fast-paced team-building software that allows litigation professionals to filter millions of documents down to those most important to their case using advanced techniques and artificial intelligence. From your seat in Downtown Chicago, you’ll be developing technology that addresses complex challenges such as data visualization, machine learning, distributed systems, large databases, and large-scale data processing. We code primarily in C#, React, and Java. If you don’t know it “all,” you won’t be alone! We are seeking full-stack generalists that can bring experience and diverse knowledge to our team, rather than hyper-focused specialists. Our hiring staff is not focused on playing “technology experience bingo” but wants to find the best software engineers. As far as the development process itself, we don’t want to just check the boxes to be able to say that we have the most (or even the snazziest) features. Rather, we are thoughtful about our design and focused on ensuring that our clients can use software that is both useful and useable. You won’t be buried in a dark corner – you’ll have the opportunity to actively shape the software, while working as an integral part of a dynamic team of developers who are focused on writing great code, learning every day, and having a lot of fun. From your seat in our beautiful new office in downtown Chicago, you will have access to many teammates to help respond to clients timely. Our office is in the heart of the loop with very convenient access to all major public transportation lines. Please note that we are onsite with a traditional five-day work week schedule. This is a fully in-person role. Responsibilities & Duties Participate in the development of new features and expand existing features. Add support for new platforms to our existing products and develop new products. Develop and review designs, code, unit tests, system tests, and documentation. Collaborate in root cause analysis; diagnose, isolate, and fix software problems. Create back-end applications using primarily Java. Demonstrate your work product to your team. Identify and correct issues that impact performance, reliability, and scalability. Investigate and develop skills in new technologies. Characteristics Extensive knowledge of Unix/Linux environments. Driven to build modern systems that emphasize user experience and aesthetics. An eagerness to learn, explore, and introduce new technologies. Excellent writing and written/verbal communication skills. Education & Experience Bachelor's degree in Computer Science, Information Systems, Engineering, a related field, or equivalent work experience. 7+ years’ work experience in back-end software engineering. Deep experience programming in Java. Experience with PostgreSQL as well as document stores such as Lucene. Experience using Agile development methodologies. Experience creating and consuming REST interfaces. Experience with Continuous Integration/Continuous Deployment preferred. Experience with containerization and container orchestration frameworks preferred. This job description reflects the present requirements of the position. As duties and responsibilities change and develop, the job description will be reviewed and subject to amendment. Hiring Policy This job description reflects the present requirements of the position. As duties and responsibilities change and develop, the job description will be reviewed and subject to amendment. Reveal is an equal opportunity employer. We celebrate diversity and are committed to creating an inclusive environment for all employees. Reveal does not discriminate in employment on the basis of race, color, religion, sex (including pregnancy and gender identity), national origin, political affiliation, sexual orientation, marital status, disability, genetic information, age, membership in an employee organization, retaliation, parental status, military service, or other non-merit factor. Reveal considers candidates with existing visas, but does not sponsor new visa applications.",https://www.indeed.com/jobs?q=Software+Engineer&l=Chicago%2C+IL&sc=0kf%3Aattr%28EXSNN%7CFCGTU%7CHFDVW%7CQJZM9%7CUTPWG%252COR%29explvl%28SENIOR_LEVEL%29jt%28fulltime%29%3B&radius=50&start=20&pp=gQAeAAAAAAAAAAAAAAAB_h8FDAAnAQEBEAkoKfKlAdONotxJ2YSLOxuKEsssal0ADntWynjsUGf2W6sEAAA&vjk=4655a0aa2a30cd1d
19,0f5a3163e1350895,Software Engineer,"Chicago, IL",SENIOR_LEVEL,EXSNN|FCGTU|HFDVW|QJZM9|UTPWG%2COR,fulltime,"Principal/Senior Principal Engineer Software--Interim Secret Clearance Required to Start - job post Northrop Grumman 6,747 reviews 600 S Hicks Rd, Rolling Meadows, IL 60008 $96,900 - $145,300 a year -  Full-time Northrop Grumman 6,747 reviews Read what people are saying about working here. You must create an Indeed account before continuing to the company website to apply Apply on company site save-icon Job details Salary $96,900 - $145,300 a year Job Type Full-time Requisition ID: R10076879 Category: Engineering Location: Baltimore, MD, USA | Rolling Meadows, IL, USA +1 more Citizenship Required: United States Citizenship Clearance Type: Secret Telecommute: Yes-May consider hybrid teleworking for this position Shift: 1st Shift (United States of America) Travel Required: No Positions Available: 1 At Northrop Grumman, our employees have incredible opportunities to work on revolutionary systems that impact people's lives around the world today, and for generations to come. Our pioneering and inventive spirit has enabled us to be at the forefront of many technological advancements in our nation's history - from the first flight across the Atlantic Ocean, to stealth bombers, to landing on the moon. We look for people who have bold new ideas, courage and a pioneering spirit to join forces to invent the future, and have fun along the way. Our culture thrives on intellectual curiosity, cognitive diversity and bringing your whole self to work — and we have an insatiable drive to do what others think is impossible. Our employees are not only part of history, they're making history. Northrop Grumman’s Enterprise Services organization is seeking a qualified Computer Systems Architect to perform key assignments for Mission Systems off-net Engineering and Manufacturing network. Primary location preference would be Linthicum, MD or Rolling Meadows, IL to support closed areas. This position does not offer the ability to telecommute full time, however when not requested to be onsite for customer support, telework will be available for supporting unclassified resources. This position can be hired as a Principal Engineer Software 3 or 4, depending on the individuals experience and education. The incumbent will support software development teams through configuration management tools onsite, primarily with ClearCase and ClearQuest support. This technical role requires an understanding of concepts including software support, system administration, cyber security, and information assurance and requires the ability to support a diverse user community in a dynamic environment. This position will report to the EMSI Infrastructure Engineering Development and Applications Support (EDAS) Manager but will be expected to work independently onsite, directly supporting programs. Primary duties will include providing onsite customer support for CM Systems (primarily ClearCase/ClearQuest but also Bitbucket, GitHub, and other Git applications), working with DevOps tools including but not limited to Atlassian tools, (Jira, Bitbucket, Confluence, Crucible / Fisheye), Jenkins, databases (SQL), and maintaining system documentation, developing infrastructure support procedures, and providing security support. The incumbent will also be expected to support programs directly upon request. Basic Qualifications: Requirements for a Principal Engineer Software (Level 3) are: At least 5 years of relevant experience with a BS Degree in Computer Science or Information Systems field; 3 Years with Masters Familiarity with Windows and Linux OS administration Familiarity with ClearCase and ClearQuest Familiarity with other Configuration Management tools/services Proven experience in a customer supporting role Demonstrated proficiency in analytical thinking, problem solving skills, and Systems Thinking mindset Willingness to learn and perform request tasks, respond quickly, work onsite when necessary, and make recommendations based on customer needs Ability and willingness to work independently with little oversight or direction in an Agile environment Must be a US Citizen and must have the ability to obtain Interim Secret clearance prior to start date. Once started, must have the ability to obtain full secret clearance Candidate will be trained on the server-side installation of ClearCase/ClearQuest in a timely fashion Requirements for a Senior Principal Engineer Software (Level 4) are At least 9 years of relevant experience with a BS Degree in Computer Science or Information Systems field; 7 Years with Masters Familiarity with Windows and Linux OS administration Experience with ClearCase/ClearQuest Experience with other Configuration Management tools/services Proven experience in a customer supporting role Willingness to learn and perform request tasks, respond quickly, work onsite when necessary, and make recommendations based on customer needs with little or no training Ability and willingness to work independently with little oversight or direction Must be a US Citizen and must have the ability to obtain Interim Secret clearance prior to start date. Once started, must have the ability to obtain full secret clearance Candidate will be expected to perform server-side installation of ClearCase/ClearQuest in a timely fashion Preferred Qualifications: Experience with Linux OS system Experience with ClearCase/ClearQuest CompTIA Security+ certification Working experience in ClearCase/ClearQuest Familiarity with database administration (MySQL) Experience using Perl, PowerShell, and Windows batch to automate manual tasks Understanding of server configuration and infrastructure Superior written and oral communication skills Ability to work flex and overtime hours if necessary Active Secret clearance or has been active within the last two years CIOSoftDev This position reports to Baltimore, MD, USA, however, this position can also be worked from Rolling Meadows, IL, IL, USA. Salary Range: $96,900 USD - $145,300 USD Employees may be eligible for a discretionary bonus in addition to base pay. Annual bonuses are designed to reward individual contributions as well as allow employees to share in company results. Employees in Vice President or Director positions may be eligible for Long Term Incentives. In addition, Northrop Grumman provides a variety of benefits including health insurance coverage, life and disability insurance, savings plan, Company paid holidays and paid time off (PTO) for vacation and/or personal business. The health and safety of our employees and their families is a top priority . The company encourages employees to remain up-to-date on their COVID-19 vaccinations. U.S. Northrop Grumman employees may be required, in the future, to be vaccinated or have an approved disability/medical or religious accommodation, pursuant to future court decisions and/or government action on the currently stayed federal contractor vaccine mandate under Executive Order 14042 https://www.saferfederalworkforce.gov/contractors/. Northrop Grumman is committed to hiring and retaining a diverse workforce. We are proud to be an Equal Opportunity/Affirmative Action Employer, making decisions without regard to race, color, religion, creed, sex, sexual orientation, gender identity, marital status, national origin, age, veteran status, disability, or any other protected class. For our complete EEO/AA and Pay Transparency statement, please visit http://www.northropgrumman.com/EEO. U.S. Citizenship is required for most positions.",https://www.indeed.com/jobs?q=Software+Engineer&l=Chicago%2C+IL&sc=0kf%3Aattr%28EXSNN%7CFCGTU%7CHFDVW%7CQJZM9%7CUTPWG%252COR%29explvl%28SENIOR_LEVEL%29jt%28fulltime%29%3B&radius=50&start=20&pp=gQAeAAAAAAAAAAAAAAAB_h8FDAAnAQEBEAkoKfKlAdONotxJ2YSLOxuKEsssal0ADntWynjsUGf2W6sEAAA&vjk=0f5a3163e1350895
20,48392741b2643ae0,Software Engineer,"Chicago, IL",SENIOR_LEVEL,EXSNN|FCGTU|HFDVW|QJZM9|UTPWG%2COR,fulltime,"Sr. Software Engineer(remote) - job post Cognizant Technology Solutions 15,425 reviews Bannockburn, IL • Remote Full-time Cognizant Technology Solutions 15,425 reviews Read what people are saying about working here. You must create an Indeed account before continuing to the company website to apply Apply on company site save-icon Job details Job Type Full-time Cognizant is looking for a “ Lead Developer - SQL Server” for developing customized product for our clients. The role is expected to drive technology discussions and analyze the current landscape for gaps in addressing business needs. Cognizant needs a motivated individual to challenge the status quo and provide thought leadership/best practices to enhance our current services and technologies. Job Title: Lead Developer - SQL Server Location: Bannockburn, IL, US Experience : > 10 Years Required Skills Technical Skills- Advanced SQL Server Domain Skills- , Healthcare (but not mandatory) Nice to have skills Technology - Java, Camel Roles & Responsibilities Good experience in TSQL programming and exception handling which includes ( Complex queries, DDL, DML, DCL, TCL, Triggers, Cursors, Functions, Indexes, Stored procedure, Views/ materialized views) Evaluating various query optimization metrics parameters like Generate and analyze Query Execution Plan along with Execution time IO Statistics etc Implement performance improvements / tuning Experience with SQL Server Service Broker Should be able to work independently Should be able to co-ordinate with client and offshore team SQL Server 2005+ experience which will include generating and analyzing query plans, identifying issues and causes of contention such as bad indexes/statistics/missing indexes, knowledge of optimization techniques, experience with SQL Server Service Broker, etc. Shift : 9AM to 6 PM CST Qualification : Holds Bachelor’s degree, Computer Science or relate course preferred Employee Status : Full Time Employee Shift : Day Job Travel : No Job Posting : Mar 30 2023 About Cognizant Cognizant (Nasdaq-100: CTSH) is one of the world's leading professional services companies, transforming clients' business, operating and technology models for the digital era. Our unique industry-based, consultative approach helps clients envision, build and run more innovative and efficient businesses. Headquartered in the U.S., Cognizant is ranked 185 on the Fortune 500 and is consistently listed among the most admired companies in the world. Learn how Cognizant helps clients lead with digital at www.cognizant.com or follow us @USJobsCognizant. Applicants may be required to attend interviews in person or by video conference. In addition, candidates may be required to present their current state or government issued ID during each interview. Cognizant is an equal opportunity employer. All qualified applicants will receive consideration for employment without regard to sex, gender identity, sexual orientation, race, color, religion, national origin, disability, protected Veteran status, age, or any other characteristic protected by law. If you have a disability that requires a reasonable accommodation to search for a job opening or submit an application, please email CareersNA2@cognizant.com with your request and contact information.",https://www.indeed.com/jobs?q=Software+Engineer&l=Chicago%2C+IL&sc=0kf%3Aattr%28EXSNN%7CFCGTU%7CHFDVW%7CQJZM9%7CUTPWG%252COR%29explvl%28SENIOR_LEVEL%29jt%28fulltime%29%3B&radius=50&start=20&pp=gQAeAAAAAAAAAAAAAAAB_h8FDAAnAQEBEAkoKfKlAdONotxJ2YSLOxuKEsssal0ADntWynjsUGf2W6sEAAA&vjk=48392741b2643ae0
21,67d9b31a74edaf8b,Software Engineer,"Chicago, IL",SENIOR_LEVEL,EXSNN|FCGTU|HFDVW|QJZM9|UTPWG%2COR,fulltime,"Senior Backend Developer - job post Drift Net Securities Drift Net Securities in Chicago, IL 60602 $90,000 - $120,000 a year -  Full-time Responded to 51-74% of applications in the past 30 days, typically within 3 days. Apply now Apply now save-icon Job details Salary $90,000 - $120,000 a year Job Type Full-time Job Overview We are seeking a back-end web developer to join our software development team. You will be responsible for building and maintaining the server-side operation and functionality of the website. Your main tasks will include developing and maintaining our database layer, APIs, and other web services. Successful candidates will be able to demonstrate knowledge and experience in modern programming languages such as Java, Ruby, and Python. Responsibilities Below are some of the responsibilities a back-end developer is expected to assume in their position: Be proficient in server-side development and optimization of data, including database creation and management and debugging Integrate data from various back-end services and databases Create and maintain software documentation Create and analyze reliable and secure back-end functionality Maintain, expand, and scale our website Remain knowledgeable of emerging technologies/industry trends and apply them into operations and activities Collaborate with front-end developers and web designers to match visual design intent AWS or GCP is a must. Job Qualifications and Skill Sets Below are the qualifications expected of a back-end developer: Minimum Bachelor of Science in computer science, software engineering, programming, or equivalent (Minimum experience 2 years.) Proficiency with languages such as Java, Ruby, PHP, MySQL, SQL, and Python Proficiency in at least one of the following: JavaScript, Ajax, jQuery, HTML, CSS, Bootstrap Understanding of object-oriented programming Experience with the design and implementation of APIs Understanding of code versioning tools such as SVN, Git, and Mercurial Understanding of code management tools such as Subversion, Git, and Helix Core Understanding of code deployment tools such as Jenkins, Capistrano, and ElectricFlow Track record of successfully managing multiple company or customer websites Cloud practitioner or equivalent certification is a plus. Job Type: Full-time Pay: $90,000.00 - $120,000.00 per year Benefits: Dental insurance Health insurance Paid time off Vision insurance Experience level: 2 years Schedule: 8 hour shift Monday to Friday Ability to commute/relocate: Chicago, IL 60602: Reliably commute or planning to relocate before starting work (Required) Experience: AWS: 1 year (Preferred) APIs: 1 year (Preferred) Work Location: One location Health insurance If you require alternative methods of application or screening, you must approach the employer directly to request this as Indeed is not responsible for the employer's application process.",https://www.indeed.com/jobs?q=Software+Engineer&l=Chicago%2C+IL&sc=0kf%3Aattr%28EXSNN%7CFCGTU%7CHFDVW%7CQJZM9%7CUTPWG%252COR%29explvl%28SENIOR_LEVEL%29jt%28fulltime%29%3B&radius=50&start=20&pp=gQAeAAAAAAAAAAAAAAAB_h8FDAAnAQEBEAkoKfKlAdONotxJ2YSLOxuKEsssal0ADntWynjsUGf2W6sEAAA&vjk=67d9b31a74edaf8b
22,7341fca3b4c1aa4e,Software Engineer,"Chicago, IL",SENIOR_LEVEL,EXSNN|FCGTU|HFDVW|QJZM9|UTPWG%2COR,fulltime,"Senior Software Engineer US Remote - job post Motorola Solutions 3,075 reviews Chicago, IL 60661 • Remote Full-time Motorola Solutions 3,075 reviews Read what people are saying about working here. You must create an Indeed account before continuing to the company website to apply Apply on company site save-icon Job details Job Type Full-time Company Overview At Motorola Solutions, we believe that everything starts with safety.Its the constant that empowers people to confidently move forward. It can fill a flight or sell out a stadium. It can care for a patient or graduate a class. As a global leader in public safety and enterprise security, we create and connect the technologies that help to keep people safe where they live, learn, work and play. Our integrated technology ecosystem unifies critical communications, video security and access control, and command center software, enabling collaboration in more powerful ways. At Motorola Solutions, were ushering in a new era in public safety and security. Bring your passion, potential and talents to a career that matters. Department Overview Come join us at Motorola Solutions, as a member of the AI, Data & Common Services Engineering Team in the city of Chicago As a software engineer, you will be a key member of our Common Services team, responsible for building the next generation cloud products for our public safety customers around the world. Our products allow customers to respond effectively in missioncritical operating environments and were looking for worldclass engineers interested in building software and systems that truly make a difference. Job Description We are looking for developers who love challenges and have experience building complex web applications at scale. Work as a contributing member of an advanced software development team using modern software development techniques to produce worldclass public safety cloudbasedsoftware solution Design, develop, and maintain software applications following established standards, procedures, and specifications. Develop code and create unit and other automated testing solutions. Able to participate in group discussions by expressing thoughts and ideas clearly. Selfdriven, high energy, highly innovative person with a positive attitude. Effectively collaborate with technical leaders in a multiteam environment. Demonstrate flexibility and resilience in the face of changing priorities and requirements. Qualifications The ideal candidate will have at least some of the following skills and experience BS degree in Computer Science, IT, Computer Engineering, Software Engineering or related field. Strong background in serverside web development, preferably in C Experience with unit test frameworks, such as xUnit and Moq Experience with software technologies such as Docker, Kubernetes, and Git Experience with GIS and Mapping, ESRI technologies is a plus. Experience with modern, single page web app development using HTML5, JavaScript AngularJS, or CSS Knowledge of client and serverside web app performance scaling techniques; Be prepared to discuss application optimization experience on previous projects Experience defining and building Web REST APIs for internal and external usage Knowledge of both SQL and NoSQL data stores, including the ability to choose the right one for the job Production application experience with public web applications; Ideally, you should have some knowledge of andor experience with public cloud technologies such as Microsoft Azure. Working knowledge of Linux and Windows Strong problemsolving and troubleshooting skills Interested in working in a continuous deployment environment This role can be remote anywhere in the US. LIMP2 LIREMOTE Basic Requirements Bachelors Degree and 743; years of software engineering experience OR Masters Degree and 543; years of software engineering experience OR 10 years of software engineering experience Vaccine Requirement Motorola Solutions has implemented a voluntary COVID19 vaccination policy. We strongly encourage all employees to be fully vaccinated. Additionally, certain local governments or Motorola Solutions39; customers may have vaccine requirements that apply to some of our employees. These employees are required to submit proof of vaccination to Motorola Solutions and maintain compliance with these requirements. Travel Requirements None Relocation Provided None Position Type Experienced Referral Payment Plan Yes Our U.S.Benefitsinclude Incentive Bonus Plans Medical, Dental, VisionbenefitseffectiveDay 1 401K with Company Match and Day 1 vesting 9 Paid Holidays GenerousPaidTime Off Packages Employee Stock Purchase Plan PaidParental & Family Leave and more EEO Statement Motorola Solutions is an Equal Opportunity Employer and all qualified applicants will receive consideration for employment without regard to race, color, religion, sex, sexual orientation, gender identity, national origin, disability, veteran39;s status, or, any other protected characteristic.",https://www.indeed.com/jobs?q=Software+Engineer&l=Chicago%2C+IL&sc=0kf%3Aattr%28EXSNN%7CFCGTU%7CHFDVW%7CQJZM9%7CUTPWG%252COR%29explvl%28SENIOR_LEVEL%29jt%28fulltime%29%3B&radius=50&start=20&pp=gQAeAAAAAAAAAAAAAAAB_h8FDAAnAQEBEAkoKfKlAdONotxJ2YSLOxuKEsssal0ADntWynjsUGf2W6sEAAA&vjk=7341fca3b4c1aa4e
